idx,title,created_utc,score,upvote_ratio
469,"If someone is 10% Polish, does that make them a tad pole?",07-10-2019 05:32:53,519,0.99
470,"I’ve been off my OCD meds for 7 months, 12 days, 3 hours and 52 minutes",05-30-2020 06:27:38,523,0.96
471,"Correct punctuation: the difference between a sentence that’s well-written and a sentence that’s, well, written.",06-03-2019 10:40:27,515,0.98
472,"The guy who invented anagrams passed away today, may he erect a penis.",04-03-2021 23:14:55,518,0.98
473,"I’ve been charged with murder for killing a man with sandpaper, but to be honest, I only intended to rough him up a bit.",04-25-2020 06:20:15,518,0.98
474,Turning on your lights and sirens after losing a drag race is just poor sportsmanship.,01-21-2020 23:37:38,516,0.98
475,Gambling addiction hotlines would do so much better if every fifth caller was a winner.,10-23-2017 21:14:40,517,0.99
476,"People tell me it’s strange to idolize the Pillsbury Doughboy, but I think he’s a great roll model.",03-13-2021 09:52:13,510,0.99
477,"Pepperonis are great, but nothing tops a plain cheese pizza.",02-08-2021 20:12:41,512,0.98
478,"I don't like making plans for the day because then the word ""premeditated"" gets thrown around the courtroom.",01-12-2021 15:14:19,521,0.99
479,Join The Flat Earth Society today and become a part of an organization that has members all around the globe!,11-26-2020 02:20:08,509,0.91
480,"When you buy condoms, you're paying protection money",03-23-2020 05:48:47,515,0.98
481,"I once had a boyfriend in kindergarten, then he got fired",12-13-2020 06:09:31,512,0.97
482,Who knew setting a mosquito free would bite me in the ass.,06-27-2020 10:46:31,511,0.99
483,Nostalgia isn’t what it used to be.,02-20-2020 15:51:01,517,0.98
484,"I was addicted to the Hokey Pokey, but I turned myself around.",04-15-2020 14:35:19,507,0.98
485,I like to play chess with old men in the park although it's hard to find 32 of them,03-15-2019 06:19:33,513,0.98
486,"My friend and I laugh about how competitive we are, but I laugh more.",01-18-2021 14:27:39,514,0.99
487,Hear about the new restaurant called Karma? There’s no menu - you get what you deserve.,10-04-2020 23:37:44,511,0.93
488,A nurse finds a rectal thermometer in her purse and thinks to herself “some asshole has my pen”,03-25-2019 10:47:31,510,0.96
489,The grenade store was so quiet you could hear a pin drop.,04-22-2021 21:43:19,509,1.0
490,"When my mom told me that I was grounded, I was shocked!",03-19-2020 02:53:52,514,0.98
491,"I don't want to sound like I'm showing off or something, but people put bricks through my windows just so they can hear me practicing my saxophone louder.",07-03-2019 06:16:28,510,0.99
492,"As a recovering vegetarian I drove past a familiar vegan restaurant and thought, ""I've been herbivore.""",04-28-2021 09:20:57,507,0.97
493,"My friend overdosed on weight loss pills. He just, vanished.",05-27-2020 16:24:47,507,0.93
494,I really bonded with the guys at the glue factory.,03-27-2021 06:54:43,505,0.99
495,"If you rearrange the letters of “postmen”, they get really pissed off.",11-10-2018 17:46:50,511,0.98
496,"I found a book about an amazing basement, it was a best cellar.",03-28-2021 17:40:03,505,1.0
497,"For the last eight years I've been voted the ""most secretive guy"" in the office by my coworkers and I can't tell you how much this award means to me.",03-19-2021 07:17:14,506,0.99
498,Moths are always looking on the bright side.,03-26-2020 08:28:10,503,0.99
499,"I don’t like cocaine, I just like the smell of it.",02-15-2020 11:44:22,505,0.96
500,"Turns out, when asked, who your favourite child is, you're supposed to pick your own.",08-01-2020 13:56:05,508,0.98
501,"The person who coined ""one hit wonder"" probably didn't come up with any other popular phrases.",12-07-2019 01:03:34,507,0.97
502,I never finish anything. It's almost like I have a black belt in partial arts.,07-09-2020 16:34:26,506,0.97
503,Lets all thank the guy who invented the number zero! - Thanks for nothing,05-03-2021 09:13:46,505,0.98
504,Most people are shocked when they find out how incompetent I am as an electrician.,10-26-2019 06:53:03,506,0.98
505,"It's entirely possible that people don't put unwanted cats in boxes on the side of the road, and instead they just put out an empty box that a bunch of stray cats in the area just came to sit in it.",05-28-2021 10:01:45,507,0.97
506,"I'm so broke, I have to fart to have a cent in my pocket!",03-30-2021 18:57:38,503,0.97
507,I never finish anythi,01-25-2021 12:56:22,507,0.98
508,Don't bother doing a criminal background check on me. I've never been caught.,09-12-2020 03:12:16,500,0.93
509,It's really a shame that Gene Hackman didn't go into DNA splicing,05-09-2020 12:03:41,504,0.99
510,I'm thankful for my fingers because I can always count on them.,02-21-2020 20:02:08,500,0.98
511,"Justice is a dish best served cold because if it were served warm, it would be justwater.",03-21-2019 01:30:03,502,0.93
512,"The only time the word ""incorrectly"" isn’t spelled incorrectly is when it’s spelled incorrectly.",10-27-2017 10:47:10,504,0.95
513,If you run in front of a car you'll get tired...But if you run behind the car you'll get exhausted,06-28-2018 03:01:24,500,0.96
514,"I told my suitcases that we will not be taking a vacation again this year, so now I'm dealing with emotional baggage.",05-08-2021 17:48:36,504,0.97
515,Who's that motherfucker who said we need a Chernobyl season 2?,03-18-2020 08:25:36,498,0.94
516,I have issues when it comes to comic book subscriptions,02-28-2020 09:56:50,496,0.98
517,I used to be in a band called The Hinges before we collaborated with The Handles to form The Doors,07-06-2020 03:08:43,501,0.97
518,Goat cheese is the greatest cheese of all time.,03-25-2020 15:11:06,499,0.95
519,"The word, “diputseromneve” may look ridiculous, but backwards, it’s even more stupid.",03-24-2018 06:14:52,500,0.96
520,Just signed my will which is a dead giveaway.,05-13-2020 17:56:24,495,0.99
521,"I was addicted to the hokey pokey, but then I turned myself around.",04-13-2021 08:59:02,491,0.97
522,"In light of collapsing economy, JPMorgan plans to lay off several members of Congress",07-27-2020 07:32:38,492,0.99
523,"I used to wonder where the sun went at night, then it dawned on me",04-24-2020 13:03:13,499,0.98
524,People who say that everything happens for a reason have obviously never got a boner on public transport.,05-19-2021 08:27:49,493,0.98
525,"If there’s a bee in my hand, there's beauty in my eye, because beauty is in the eye of the bee-holder.",05-14-2021 06:31:48,494,0.95
526,Is it crazy how saying sentences backwards creates backwards sentences saying how crazy it is?,10-05-2018 08:57:54,498,0.95
527,"I must have a nice butt, because every time I turn around, I hear people whisper ""What an ass.""",11-13-2017 12:42:56,492,0.98
528,Sometimes I really feel bad about all the shit toilets go through.,01-31-2021 12:22:55,492,0.98
529,I'd kill to get a job as a hit man,07-17-2020 00:20:28,496,0.99
530,"Without a doubt, my favorite Robin Williams movie is Mrs. Fire.",02-14-2018 04:39:15,496,0.97
531,My neighbour asked me where I was getting so many buckets of water from and I said 'you know full well'.,02-16-2021 18:53:13,491,0.99
532,Because I have so little faith left in humanity I look both ways before crossing a one way street.,04-19-2021 19:43:03,492,0.98
533,Going to start a dildo repair service after the lockdown called InspectHerGadget.,04-29-2021 16:50:52,486,0.98
534,"I wasn't sure about using ""Zoom"", until I looked at it a little closer.",05-31-2020 12:14:38,492,0.98
535,"They say a picture is worth a thousand words, but if your word ain't worth a dime, that puts an upper bound on your picture of $100.",03-07-2020 08:45:11,487,0.98
536,"Been so bored recently, decided to take up fencing, but my neighbors said they’ll call the police if I don’t put it back.",03-28-2021 00:21:05,485,0.99
537,Moses was the first ever person with a tablet connected to the cloud.,03-28-2020 20:55:24,484,0.96
538,"I despise Russian dolls, they're way too full of themselves.",02-08-2020 07:20:47,481,0.98
539,"To the guy who invented zero, thanks for nothing!",12-10-2019 12:38:07,483,0.96
540,"I was raised as an only child, which really annoyed my sister.",05-27-2018 23:23:40,484,0.98
541,"There’s a new movie about premature ejaculators, it’s coming soon",02-26-2021 10:12:15,484,0.97
542,Every time I ask my doctor to check my prostate he gives me the finger,06-13-2020 19:07:42,482,0.98
543,I make dandruff from scratch.,05-23-2020 20:00:05,486,0.99
544,"When I asked the doctor if I could administer my own anesthetic, he said, “Go ahead. Knock yourself out.”",11-26-2018 04:38:51,486,0.98
545,"Instead of ""the John,"" I call my toilet ""the Jim."" That way it sounds better when I say I go to the Jim first thing every morning.",01-13-2021 17:52:21,488,0.97
546,"Say what you like about cocktail waitresses, but they'll lift your spirits.",11-05-2020 02:42:22,483,0.98
547,The CEO of Pepsi was fired today. They found traces of Coke in his system,07-30-2020 15:59:44,488,0.96
548,"When I won the Nobel prize for inventing cloning, I was beside myself.",05-22-2020 13:08:46,485,0.99
549,"I was going to make a joke about sodium and hydrogen, but NaH..",03-09-2020 07:41:40,485,0.96
550,"For the suicidal, procrastination is a survival skill.",11-29-2018 11:07:50,484,0.98
551,Man with authority walks into a bar and orders everyone a round.,04-01-2018 20:03:16,486,0.98
552,"If one uses stimulus funds to buy baby chickens, does that mean we got money for nothing and our chicks for free?",05-03-2020 18:46:40,482,0.99
553,If humans had to build their houses like spiders I would literally shit bricks.,04-22-2019 06:09:04,484,0.98
554,"The ceiling isn’t my favorite part of the house, but it’s definitely up there.",08-28-2019 07:34:21,483,0.99
555,"Charles Dickens walks into a bar and orders a martini and the bartender asks, “Olive or twist?”",06-01-2020 06:14:23,479,0.98
556,"Remember, because of synonyms ""Forgive me Father for I have sinned,"" and ""Sorry Daddy, I've been naughty,"" are the same sentence.",08-21-2018 03:49:59,480,0.95
557,"I've just been given a Swiss flag for my collection, which is a big plus.",04-15-2021 07:38:15,476,0.97
558,I wonder if a group of deaf people can have herd mentality.,02-13-2021 04:46:04,478,0.98
559,I swear I get the weirdest responses to my adverts trying to find seamen for my tug job,02-01-2021 09:11:59,479,1.0
560,The cannibal passed his brother in the jungle.,08-21-2020 00:16:54,481,0.98
561,"If you abbreviate in sign language, is it called short hand?",06-25-2020 19:57:06,477,0.99
562,God was fired from his preaching job at our church after not showing up for thousands of years,06-21-2020 01:47:16,479,0.93
563,I wonder if the arachnophobia support group has a web site.,05-08-2020 06:21:20,481,0.99
564,I singlehandedly watched thousands of hours of porn,01-12-2020 17:58:35,479,0.98
565,"Technically, national anthems are just country music.",08-11-2019 20:42:24,479,0.99
566,I just joined a dating site for arsonists. Still waiting for a match.,05-19-2021 21:17:55,474,0.97
567,"The girl I tried to pick up at the bar last night told me to go fuck myself I laughed and said ""jokes on you I was gonna do that anyway""",09-21-2020 14:19:55,478,0.9
568,"I just spotted an albino Dalmatian, I mean, it was the least I could do.",02-09-2019 08:22:45,476,0.99
569,Sign language is the least spoken language in the world.,03-13-2018 07:14:34,477,0.98
570,I may be a gold digger but you're the only gold I'm after.,01-22-2021 06:36:57,474,0.94
571,"Some of my friends have been making very hurtful remarks about my choosing to wear mittens rather than gloves, but I don't like to point fingers.",05-03-2020 06:54:36,473,0.98
572,I started a band called Clitoris...we haven't been discovered yet.,04-30-2021 09:30:22,475,0.96
573,"I used to be a heavy drinker, but then I lost some weight",06-24-2020 22:19:48,473,0.98
574,My dad used to be really good at russian roulette.,03-05-2019 14:54:12,472,0.99
575,"A friend of mine asked me how much I spend on a bottle of wine. I said “Oh, about 15 minutes”...",09-16-2020 00:09:51,469,0.97
576,"You'd be jolly too, if you had a list of all the naughty girls and where they live.",12-26-2019 11:13:37,473,0.96
577,You've got to hand it to the blind hooker,05-02-2021 00:09:34,475,0.98
578,I heard the inventor of auto correct died and I didn't even know he was I'll.,03-20-2021 14:38:39,470,0.99
579,An erection is a dick move.,09-19-2020 20:24:02,476,0.95
580,12 out of 10 dentists agree someone is using bad math,03-14-2020 09:05:38,468,0.95
581,Janitors in skyscrapers are high maintenance,02-25-2020 11:27:21,477,0.99
582,People say it’s difficult to have sex with erectile disfunction but it’s not fucking hard.,03-04-2020 15:07:46,470,0.98
583,I was once kidnapped by mimes and they did unspeakable things to me.,12-30-2019 09:52:02,469,0.95
584,"I just heard a woodpecker call me a paranoid twat, in Morse Code.",02-15-2019 07:05:04,471,0.98
585,I was attacked by a group of mime artists. They did unspeakable things to me.,08-06-2020 14:10:29,469,0.95
586,"I find it ironic that the colors red, white, and blue stand for freedom until they are flashing behind you.",06-08-2019 09:08:05,470,0.95
587,"I had to fly across the country for my vaccine, and, wow, are my arms sore.",04-16-2021 15:48:56,469,0.95
588,Autocorrect socks!,02-03-2021 12:34:44,472,0.96
589,I only got a C++ in programing class...,08-08-2020 20:45:12,465,0.98
590,"Without nipples, boobs would be pointless.",07-05-2018 16:13:07,465,0.96
591,People with ADHD should be sent to concentration camps,11-06-2019 12:09:18,461,0.96
592,"I love how babies always look drunk, even after only one beer.",10-28-2018 02:40:25,469,0.97
593,"Face is a four letter word, but preface is a foreword letter.",05-24-2017 02:25:59,464,0.99
594,A redhead baker is a ginger bread-man.,11-21-2020 21:19:16,466,0.99
595,I put the 'sexy' in dyslexia,02-18-2019 10:28:10,464,0.98
596,I'm not an orgy guy but I have masturbated in a house of mirrors.,02-06-2021 02:13:22,460,0.98
597,I can't find the meaning of nihilism anywhere.,07-23-2020 12:58:32,466,0.99
598,When pornstars punch out for lunch are they considered off the cock?,07-22-2020 22:17:13,465,0.96
599,Jokes about menstrual cycles aren’t funny... period.,04-16-2020 09:15:50,463,0.96
600,I wish I was rich enough to eat out all the time like the homeless do,04-08-2020 09:48:29,469,0.94
601,I told my suitcases there will be no vacation this year and now I'm dealing with emotional baggage.,04-13-2021 18:42:19,462,0.99
602,Waterboarding at Guantanamo Bay sounds really fun if you don't know what either of those two things are,01-26-2019 03:00:01,458,0.88
603,"I would call you a cunt, but you have neither the warmth nor the depth.",10-31-2017 04:32:52,458,0.94
604,I think someone's been Watering down my Whiskey but I don't have the Proof.,02-24-2021 10:55:46,465,0.99
605,Successful palm readers ... got to give them a hand.,11-19-2020 03:22:18,463,0.98
606,"As I put the car in reverse, I thought ""This takes me back"".",03-01-2020 18:56:17,459,0.98
607,"I saw an ad that said, “Television for sale, $1, volume stuck on full” and I thought to myself, “I can’t turn that down!""",06-01-2018 08:21:08,458,0.91
608,Dr. Frankenstein entered a bodybuilding competition and soon discovered he seriously misunderstood the objective.,03-08-2021 17:56:32,462,0.98
609,It's impossible to surprise a snowman because it has ice in the back of its head.,06-12-2020 06:12:25,457,0.95
610,"If I had a dollar for everytime baby boomers criticised younger generations, I would have enough money to live in the economy that they destroyed.",05-08-2019 08:46:13,455,0.9
611,I knew I was going bald when it took longer and longer to wash my face.,04-24-2019 09:07:45,458,0.98
612,"When my father asked me to get an organ donor card, I realised that he was a man after my own heart.",05-16-2021 05:41:10,456,0.99
613,My gay friend is the worst liar because he can never keep a straight face.,03-02-2021 03:52:28,459,0.98
614,Would 100 rabbits lined up single file and marching backwards qualify as a receding hare line?,05-01-2020 12:43:45,453,0.95
615,My penis made it into the Guinness book of world records. But the librarian told me to take it out,03-01-2019 12:43:16,457,0.94
616,"With the rise of self-driving vehicles, it’s only a matter of time before we get a country song where a guy’s truck leaves him too.",10-18-2017 06:33:29,459,0.97
617,I draw the line at cocaine.,05-15-2021 08:39:50,453,0.97
618,I thought my mom would be excited that I’m dating a horse but apparently that’s not what she meant by stable relationship,04-09-2021 01:26:53,455,0.99
619,"He who smiles when things go bad, has found someone to blame.",10-22-2020 22:48:32,461,0.97
620,Hemorrhoids are a real pain in the ass.,06-26-2020 14:03:12,460,0.95
621,"I've just spent a £1000 on hiring a limousine,then found out it doesn't come with a driver, I can't believe I spent all that money and have nothing to chauffeur it.",12-17-2018 10:26:11,460,0.94
622,"I bought a dog off a blacksmith today and as soon as I got it home, it made a bolt for the door.",07-07-2018 08:48:44,460,0.97
623,"If you ever miss 4:20 just wait until 4:22, because 4:22 is 4:20 too.",04-17-2018 09:43:13,457,0.92
624,You'll struggle to find someone better than me at 'Hide and Seek'.,03-05-2021 07:17:15,459,0.99
625,"Kim Jong Un uses body doubles, they're named Kim Jong Deux and Kim Jong Trois.",05-07-2020 17:10:04,455,0.98
626,"I'm not saying my wife's a bad cook, but she uses a smoke alarm as a timer.",11-14-2018 04:39:13,452,0.96
627,My doctor told me to drink two glasses of red wine after a hot bath but I can't even finish drinking the hot bath.,09-03-2017 14:19:27,454,0.97
628,"I told my son to stop playing Russian roulette, but you know how it is with kids... In one ear, out the other",01-16-2021 10:17:23,453,0.98
629,My neighbors listen to Smashmouth's All-Star a lot. Whether they like it or not.,07-22-2020 10:06:28,453,0.92
630,The only way I’m getting shredded at the gym is if my shoelace gets caught in the stairmaster.,12-05-2020 23:35:27,450,0.98
631,Minecraft is a perfect game because they didn't cut any corners.,04-12-2020 19:56:36,452,0.99
632,Bullets are really weird because they only do their job after they’re fired.,06-09-2018 20:39:38,448,0.93
633,I was immediately fired at my new job as a human cannon ball,01-18-2020 21:51:00,450,0.99
634,"I used to be a member of the secret cooking society, but they kicked me out for spilling the beans.",07-07-2019 06:44:07,450,0.98
635,My extra sensitive toothpaste doesn't like it when I use other toothpastes,01-19-2020 19:42:25,452,0.99
636,"Like most people my age, I'm 45.",08-15-2019 06:18:46,453,1.0
637,"If you think people who apologize too much are annoying, I'm sorry.",03-06-2021 00:10:53,452,0.98
638,"My neighbor blamed my gravel for making him fall, but it was his own dumb asphalt.",03-29-2020 06:04:48,444,0.98
639,"i always wondered why a male sheep is called a ""ram"", then it hit me.",11-01-2018 10:42:57,443,0.97
640,I’m forever disappointed that a group of squids isn’t called a squad,11-16-2017 09:55:25,447,0.97
641,"My wife wants to leave me because I keep pretending to be a Transformer, but I've told her I can change.",04-20-2021 08:33:03,448,0.98
642,"I learned so many new phrases while attending university, like “hyperbolic functions”, “binary fission”, “failed exam”, “retaking courses”, “last chance”, “self medication”, “seething depression” and “suicide hotline”.",02-29-2020 03:37:40,448,0.95
643,Tequilla probably wont fix your problems but it's worth a shot.,01-13-2020 16:01:44,453,0.99
644,I think the Discovery Channel should be on a different channel every day.,09-04-2018 08:25:19,446,0.98
645,I know everything there is to know about the Dunning-Kruger effect,07-27-2020 20:05:32,447,1.0
646,"Australians don't have sex, Australians mate.",12-27-2019 05:03:58,448,0.95
647,Just heard an inmate with a stutter died in prison before he could finish his sentence.,07-17-2019 14:39:34,444,0.98
648,"I don't plan to put up solar panels, but if you do, more power to you.",05-29-2020 18:27:23,449,0.99
649,I tried to buy a hotdog with ketchup but the vendor would only accept cash.,01-20-2020 13:53:58,448,0.97
650,It took me a long time to figure out I'm a slow learner.,05-06-2019 09:21:07,447,0.99
651,"Despite the high cost of living, it remains popular.",12-26-2018 00:11:20,445,0.98
652,"When wearing a bikini, women reveal 90% of their body, but I'm so polite, I only look at the covered parts.",10-15-2017 09:10:38,444,0.94
653,"With great reflexes, comes great response ability.",03-09-2019 07:43:49,442,0.98
654,The job title of a firearms enthusiast and speechwriter is a glockenspiel.,12-11-2020 06:04:44,443,0.98
655,"The better dressed your snowman, the faster you kill him.",02-16-2021 08:08:38,443,0.93
656,Jokes about communism aren't funny unless everyone gets them.,04-29-2019 09:59:14,445,0.94
657,"Apparently it costs £1,500,000 to climb Mount Everest...which in my opinion, is a bit steep.",06-10-2018 13:42:56,444,0.97
658,"Nobody believed me when I told them I can chop down a tree just by looking at it, but I saw it with my own eyes.",05-18-2018 16:50:47,445,0.97
659,I just boiled the hell out of a pot of tap water - now I have holy water.,04-30-2020 14:25:46,442,0.91
660,Sorry but ever since I started a routine of jogging at midnight I have been running late.,01-06-2020 09:34:58,443,0.98
661,I’ve found an origami porn channel but it’s paper view only.,03-30-2019 09:12:29,447,0.99
662,I bought a new weed-whacker today that's cutting hedge technology.,04-05-2021 06:22:45,434,0.99
663,Do you smoke pot? Because weed look cute together,02-07-2021 09:02:07,440,0.92
664,"I'm not calling it Covid 19 anymore, it is now ""The Election Infection.""",08-01-2020 05:32:49,438,0.92
665,I for one like Roman numerals,06-19-2020 02:05:22,445,0.93
666,"Apparently, when you go to donate blood it’s supposed to be YOUR blood",06-07-2019 10:25:58,443,0.97
667,I tried to sue the airline for losing my luggage but i lost the case,02-10-2020 02:59:24,434,0.96
668,The only way to get ahead is to decapitate someone,10-08-2020 20:27:22,438,0.99
669,The only thing flat earthers have to fear is sphere itself.,05-02-2020 20:45:35,440,0.94
670,My wife felt me because I’m dyslexic.,09-06-2019 06:02:03,433,0.96
671,"I think I have AD, which is like ADHD only I’m not as sharp.",05-04-2019 10:32:56,443,0.98
672,"Yo mama’s so fat, the Hogwarts sorting hat placed her in Waffle House.",08-26-2019 12:36:22,441,0.94
673,I've started telling people about the benefits of eating dried grapes. It's all about raisin awareness.,07-12-2019 01:07:44,438,0.97
674,"My company is a non-profit, but not on purpose.",06-18-2019 11:47:20,436,0.99
675,The gender neutral term for sugar daddy is glucose guardian,11-04-2017 12:20:14,442,0.96
676,Nostalgia isn't what it used to be,05-20-2021 10:22:13,440,0.99
677,"My girlfriends dad asked me what I do, apparently your daughter wasn’t the right answer",06-19-2020 12:49:59,436,0.95
678,I can count on one hand how many hands I've lost in chainsaw accidents,03-15-2021 16:06:59,441,0.99
679,"My friend Jay recently had twin girls and wanted to name them after him, so I suggested Kaye and Elle.",10-29-2019 06:08:23,435,0.97
680,My math teacher told me I was average which is just mean.,06-16-2018 05:03:32,436,0.97
681,Abandonment issues: they've stayed with me my whole life,01-23-2021 08:59:02,432,0.98
682,"If anyone has any advice on how to deal with plastic surgery gone wrong, I'm all ears",12-31-2019 07:28:00,438,0.99
683,"The difference between ""burro"" and ""burrow?"" - if you don't know that, you can't tell your ass from a hole in the ground.",02-12-2020 09:17:34,430,0.99
684,"I wanted to marry my English teacher when she got out of jail but apparently, you can't end a sentence with a proposition.",10-10-2019 06:27:43,433,0.95
685,"Accordion to a study, 93% won't notice if a word has been replaced with an instrument.",12-15-2017 05:54:23,431,0.95
686,"It's okay password, I'm insecure too.",12-13-2017 00:18:54,425,0.97
687,"As a wheat farmer, I keep having these strange headaches, but my doctor insists it's just my grains.",04-28-2020 01:53:06,427,0.97
688,"To the people who are trying to overcome their paranoia, I'm behind you all the way.",06-12-2019 08:35:15,432,0.98
689,"I'm here to self deprecate and chew bubble gum, and I forgot to bring gum because I'm the worst.",09-05-2018 08:40:53,425,0.94
690,I googled “cigarette lighter” and got 2000 matches.,11-25-2019 01:54:07,431,0.98
691,"If your bedroom is too hot at night, have an argument with your other half - the cold shoulder you'll get will keep you cool the whole night!",01-20-2021 02:00:12,427,0.95
692,I read that by law you must turn on your headlights when it’s raining in Sweden but how the fuck am I supposed to know when it is raining in Sweden?,09-30-2018 06:21:43,422,0.97
693,I had thought that improving my personal hygiene by showering daily would be appreciated by the ladies; but apparently this sentiment only applies OUTSIDE the women's locker room at the gym.,10-30-2020 10:13:02,426,0.95
694,"My wife is really mad I have no sense of direction, so I packed my stuff and right.",04-01-2020 17:40:09,432,0.96
695,I have a pen that can write underwater as well as other words too.,06-25-2019 11:49:52,430,0.97
696,A mom that comes out as a dad is transparent,04-12-2021 14:48:34,421,0.95
697,I asked 101 people what they thought about avoiding round numbers.,03-21-2020 08:20:11,428,0.98
