idx,title,created_utc,score,upvote_ratio
224,The piano is the hardest instrument to pick up.,02-09-2021 10:10:21,678,0.99
225,Uncircumcised men are complete dicks.,04-29-2020 16:52:36,684,0.98
226,Is a snake that's exactly 3.14 metres in length considered a πthon?,05-08-2020 20:28:26,674,0.97
227,-,02-16-2020 02:08:13,683,0.95
228,Some people are like clouds. When they disappear it’s a brighter day.,01-24-2021 20:43:06,681,0.97
229,"When I told my psychiatrist I’ve been hearing voices in my head, she told me I don’t have a psychiatrist.",06-15-2020 06:46:44,672,0.99
230,80% of married men cannot fall asleep after sex because they have to drive home.,02-13-2020 09:38:03,673,0.94
231,"As a wheat farmer, I worried about having these strange headaches all the time, but my doctor said it's just my grains.",01-03-2021 06:07:58,673,0.98
232,My handicap parking permit cost me an arm and a leg.,12-22-2020 22:36:39,665,0.99
233,"I named my eraser Confidence, because it gets smaller after every mistake I make.",07-13-2019 06:52:36,665,0.99
234,"My mailman got a sex change, so now he's really a post-man; guess he had the wrong package.",02-02-2021 21:35:06,664,0.95
235,Autocorrect has become my worst enema.,01-30-2021 16:37:18,671,0.99
236,I saw a dwarf climbing down a prison wall and thought that it was a little condescending,06-14-2020 10:20:40,666,0.98
237,Did you know that Iceland is only one sea away from Ireland?,04-10-2020 05:41:58,669,0.97
238,"The butt plug is not her favourite toy, but it's up there.",12-24-2020 17:44:20,666,0.99
239,It takes a lot of balls to play golf as badly as I do.,05-21-2021 03:45:48,665,0.99
240,I was delighted when someone stole my flashlight.,04-21-2021 18:49:44,659,1.0
241,I've set myself a five year plan to become more spontaneous.,11-16-2020 08:29:38,666,1.0
242,Men and women are dying from the Coronavirus in greater numbers than all the other genders combined.,10-13-2020 10:09:34,663,0.91
243,I just saw some idiot at the gym put a water bottle in the Pringles holder on the treadmill.,08-01-2018 22:46:30,668,0.95
244,The price of balloons has gone up due to inflation.,12-09-2020 09:05:46,661,0.99
245,Maybe in 9 months we're gonna have a baby boom; but in 3 months we're gonna have a divorce boom.,03-16-2020 08:35:41,665,0.98
246,My titties be in the seatbelt like %,05-06-2021 00:39:44,660,0.96
247,Pornhub now has a category for Coronavirus videos. It's for sick fucks.,02-27-2021 13:49:50,661,0.93
248,I went to a pet shop and put a sign saying 'CHAMELEON' next to an empty cage. 🦎,07-08-2020 05:53:54,656,0.98
249,I used to think that the brain was the most fascinating organ in the body but then I realized look who’s telling me that.,02-08-2021 02:59:55,657,0.98
250,I have sex daily. I mean dsylexia,03-29-2020 19:20:01,662,0.95
251,"Yesterday I saw a book called ""How to solve 50% of your problems"" so I bought 2.",03-12-2021 10:33:56,656,0.99
252,"Wrestling is so stupid. Men with no pants, fighting for a belt.",07-19-2020 13:24:46,657,0.95
253,The amount of unqualified candidates in this election is unpresidented,10-21-2020 07:26:40,653,0.96
254,My body only fights off illness on Saturday and Sunday because I have a weekend immune system.,05-28-2020 21:11:31,654,0.99
255,"I love how babies always look drunk, even after only one beer.",04-25-2020 20:49:23,654,0.99
256,I think every quilt is better than every duvet but maybe that’s just a blanket statement.,10-16-2020 01:22:06,660,0.99
257,"People often say “icy” is the easiest word to spell and, looking at it now, I see why.",04-10-2018 01:30:01,657,0.98
258,"I was into necrophilia, bestiality, and S&M - until I realized I was just beating a dead horse.",09-04-2020 09:36:15,658,0.99
259,"Circumcisions are so painful that when I got mine right after I was born, I couldn’t walk for nearly a year.",04-03-2021 06:15:18,653,0.97
260,Millions of fans angered by Marvel decision to kill off Stan Lee,11-13-2018 06:56:58,649,0.92
261,My Saturday was going pretty well until I realized it was Sunday.,05-09-2021 14:22:16,651,0.99
262,"Your mom sucks dick for gas money, then takes the bus.",09-20-2020 20:04:38,643,0.95
263,You put the “sexy” in “dyslexic.”,04-19-2018 10:43:18,648,0.98
264,"When I saw my sister crying, I asked, ""Are you having a crisis?""",04-18-2020 07:14:43,648,0.99
265,I watched my first porno last night. I looked so much younger then.,09-06-2020 07:00:02,642,0.95
266,If you are flying a 747 in microsoft Flight Simulator and your ping reaches 999 do you begin to experience jet lag?,11-09-2020 01:12:52,645,0.98
267,"Give a man a duck, and he'll eat for a day. Teach a man to duck, and he'll never walk into a bar.",11-13-2019 12:14:12,642,0.97
268,Baby squids should be called “Inklings”,10-11-2020 21:59:04,646,0.98
269,All my passwords are protected by amnesia.,07-30-2020 05:21:32,643,0.99
270,My neighbor was absolutely delighted when he realized I’d stolen all his lightbulbs.,02-14-2020 01:29:23,642,0.99
271,COVID-19 jokes are tasteless,01-09-2021 22:51:47,648,0.96
272,"The actors performed on a stage that was covered in letters, so I guess it was a play on words.",10-14-2020 03:45:26,646,0.97
273,Communist jokes are only funny if everyone gets them.,03-04-2020 03:01:07,639,0.96
274,R Kelly - taking the art out of rap artist,02-06-2019 18:52:51,643,0.98
275,I asked the judge to shorten my sentence and he interrupted me,05-30-2020 23:01:25,641,0.99
276,"If Watson isn’t the most famous doctor in the world, then Who is.",04-22-2020 06:12:38,633,0.98
277,I ordered a chicken and an egg from Amazon. I’ll let you know,01-05-2020 05:37:17,641,0.95
278,Yesterday i spent 45 minutes trying to get into my girlfriend's panties... until she came home and made me take them off.,12-29-2020 08:25:36,636,0.97
279,Did the Backstreet Boys ever find out why ?,10-28-2020 07:21:54,636,0.97
280,-,04-21-2021 03:46:38,637,0.95
281,"If one Domino's pizza shop collapses, would the others then fall in succession?",04-01-2021 05:52:10,634,0.98
282,People are often shocked when they find out I'm not a very good electrician.,10-09-2018 11:29:46,635,0.99
283,"As a commemoration, I always stab my Caesar salad 23 times before I eat it.",06-16-2020 14:25:47,631,0.98
284,If you die and get cremated you can be put into an hour glass and still be included in family game night.,04-30-2021 22:15:13,636,0.96
285,The secret to being smart is knowing when to play dumb.,04-02-2021 10:28:42,628,0.98
286,"A dung beetle walks into a bar and asks ""Is this stool taken?""",02-16-2020 15:14:29,634,1.0
287,I've been diagnosed with a chronic fear of giants.....feefiphobia.,09-05-2020 14:06:54,634,0.99
288,"I'm a shy cute pebble, who wishes to be a little boulder.",10-31-2020 07:36:35,633,0.99
289,"When I told my wife our neighbor died she said 'Who, Ray?' and I said honey we shouldn't celebrate these things.",04-23-2021 11:56:23,632,0.97
290,"If a guy is addicted to masturbating but then gets addicted to sex, is it fair to say his addiction got out of hand?",12-29-2019 01:30:55,632,0.97
291,"If I had a Delorean, I would probably only drive it from time to time.",01-22-2019 11:07:16,625,0.98
292,A dad joke becomes apparent when it's full groan.,10-23-2020 12:14:30,626,0.98
293,If you want to setup a company and run it then that’s your business.,09-17-2020 04:28:43,623,1.0
294,"I’ve successfully grown a field of dildos, but now I have a problem with squatters.",06-05-2020 06:55:00,625,0.99
295,"My wife threatened to divorce me when I said I was going to give our daughter a silly name, so I called her Bluff.",03-25-2021 06:29:03,623,0.99
296,"My four year old grandson has been learning Spanish all year but still can’t say please, which I think is poor for four",09-17-2020 09:50:23,617,0.97
297,"I’ve been trying to find someone to drive me around for years, and I still have nothing to chauffeur it",07-25-2020 04:15:22,618,0.98
298,I made a belt out of herbs; what a waist of thyme.,01-28-2021 17:07:13,621,0.98
299,"I may ejaculate early, but my wife should love me despite my short cummings.",06-09-2020 08:10:36,620,0.97
300,"Never stick your penis into a bag of cashews, that's fucking nuts.",02-25-2021 09:16:38,614,0.96
301,"In the end, all our skeletons will have the same dick sizes.",01-18-2021 00:48:04,617,0.97
302,"If a tree falls in the forest and nobody hears, my illegal logging business is a success.",09-07-2017 15:20:27,618,0.98
303,"I try to be self-deprecating, I'm just not very good at it.",11-10-2020 20:55:29,612,0.99
304,I collect records....it's my decision and that's vinyl.,10-24-2020 05:58:11,613,0.97
305,"My friend's say I'm a pessimist, but I think it's far worse than that.",07-21-2020 18:37:25,616,1.0
306,"The Black Eyed peas can sing us a tune, but the Chick Peas can hummus one.",04-14-2021 13:34:11,615,0.99
307,Everything I cook turns to shit,04-25-2021 08:18:34,610,0.99
308,We argued all day about what to call a medieval soldier but it was getting late so we decided to call it a knight.,05-16-2020 05:57:02,614,0.99
309,I threw my iPhone into a lake the other day and it’s still syncing.,03-26-2021 06:16:28,612,0.99
310,Similies be like,11-01-2020 10:39:58,610,0.98
311,A Freudian slip is when you say one thing but mean your Mother.,09-01-2020 09:28:59,615,0.97
312,"If you are color blind, Twister is a mother fucking free for all.",01-05-2021 21:48:49,611,0.97
313,Why is it called it a paternity test and not a pop quiz?,06-12-2020 19:11:45,610,0.98
314,Bullets only do their job after they're fired,04-03-2020 23:37:02,612,0.96
315,My mum asked me if i'd seen the dog bowl; I said I didn't know he could.,02-11-2021 11:29:09,604,0.94
316,Drink wine....Its not good to keep things bottled up.,08-21-2020 18:11:14,604,0.98
317,I made a chicken salad today but the ungrateful pecker didn’t even eat it!,06-24-2020 07:07:41,601,1.0
318,"Elton John is a great pianist, but he sucks on the organ.",06-04-2020 02:31:01,601,0.95
319,"I'm the best in the world at sitting down, I sat for a month and got atrophy",11-24-2020 00:43:03,604,0.98
320,This Fibonacci joke is as bad as the last two you heard combined.,12-02-2017 09:25:08,601,0.98
321,A doctor who specializes in Adam’s apples is a guyneckologist.,03-16-2021 07:15:54,604,0.98
322,2020 was rough but a special shout out to dogs who had to experience it seven times.,12-08-2020 22:48:39,594,0.96
323,Explosive Dough? That's the last thing I knead,11-20-2020 08:26:37,596,0.96
324,I may not have the best ceiling in the world but it's definitely up there.,04-27-2021 11:09:09,598,1.0
325,whoever named them missiles wasn't very optimistic,03-04-2021 00:12:47,601,1.0
326,"If anyone has a suggestion on how to reverse the spell that turned me into corn, I’m all ears.",02-06-2021 16:49:24,595,1.0
327,Is it just me or is a good camouflage expert is really hard to find?,11-06-2020 23:44:56,597,0.98
328,"For each action, there is an equal & opposite reaction, plus a social media overreaction.",12-13-2020 18:00:11,597,0.97
329,"Everytime you light a lighter, it gets lighter.",11-27-2020 14:23:44,597,0.98
330,Ive just fallen through the roof of a French bakery. I'm in a world of pain.🥖🥐,07-20-2020 07:38:01,598,0.94
331,"Dear Autocorrect, No one uses the word 'ducking', absolutely no one.",07-09-2020 04:48:33,602,0.91
332,"My son thinks he’s so smart now that he’s learned how to recite pi, and now I’ll never hear the end of it.",01-17-2020 23:04:46,599,0.99
333,The Scottish military has eliminated the draft by issuing pants to all its officers.,03-06-2021 13:28:18,596,0.99
334,"When I'm on my death bed, I'm going to look around the room at all my friends and family and say, ""hey, you guys wanna see a dead body?""",06-19-2019 08:50:12,599,0.98
335,"I remember 2020 like it was... Ah, nevermind.",01-01-2021 06:52:10,595,0.96
336,Two of my mom's sisters moved to the Alaskan wilderness so now it's a double aunt tundra.,03-28-2020 06:05:49,598,0.99
337,I would h8-2 be a Barcelona fan right now,08-15-2020 03:04:28,592,0.96
338,The earth was flat until they buried your mom.,03-31-2021 09:47:38,599,0.98
339,"""i"" before ""e"" except after ""c"" was disproven by science",03-18-2021 21:18:34,591,0.99
340,"Yesterday, I swam with a dolphin for hours, we just clicked.",11-17-2020 04:22:21,591,0.98
341,"I was short on cash, but I needed to get some brickwork done, so I hired a Freemason.",08-11-2020 19:59:33,589,0.98
342,I went to punch the fog yesterday...mist.,07-10-2020 08:24:20,592,0.97
343,"Sperm donations are more valuable than blood donation, because they are handmade.",06-08-2020 01:11:48,588,0.98
344,"I've been wearing surgical gloves because of Covid-19, and now I don't feel very well.",04-05-2020 08:30:00,590,0.97
345,"I believe in God 12.5%,does this mean I'm an eighthiest?",12-28-2020 16:24:46,590,0.98
346,My obsession with coloured feathers is dyeing down.,12-16-2020 09:05:17,589,0.99
347,"I thought I'd been stung on the tongue by a murder hornet while eating sushi, turned out it wasabi",05-26-2020 06:53:37,588,0.96
348,"English puns make me feel numb, but math puns make me feel number.",03-14-2019 12:31:46,586,0.98
349,"I’m okay with smoking, alcohol and marijuana, but cocaine is where I draw the line.",04-27-2019 05:27:52,584,0.98
350,"I hate those people who bang on your door and tell you how you need to be ""saved"" or you'll ""burn"". Stupid firemen",03-23-2019 09:58:59,588,0.95
351,"If every letter ""t"" was silent, we'd never hear the end of it.",04-02-2018 19:18:10,585,0.98
352,Big Ben's guards look so tired because they’re always working around the clock.,05-18-2020 05:56:41,585,0.99
353,"One man's trash is another man's treasure. Wonderful saying, horrible way to find out you were adopted",05-20-2020 12:44:04,579,0.96
354,I regret rubbing ketchup in my eyes but that's Heinz sight for you.,07-01-2020 15:14:51,578,0.99
355,"My wife and I don't want kids so if anyone does, we can drop them off tomorrow.",03-03-2021 07:16:16,576,0.98
356,"I wonder if the guy who coined the term ""One Hit Wonder"" came up with any other phrases.",02-21-2018 02:23:59,579,0.95
357,"In light of plummeting oil prices, Exxon Mobil plans to lay off several members of Congress.",05-19-2020 01:24:29,583,0.99
358,My book looks so much thinner ever since it had its appendix removed.,04-12-2020 04:44:09,574,0.99
359,I'm seriously contemplating remarrying my ex wife but I'm scared she will realize that I'm just after my money,05-12-2018 04:36:27,577,0.97
360,"Someone stole my thesaurus, which is very very very bad.",05-29-2021 08:45:01,573,0.99
361,They put honest Abe on the penny because hes in a cent,11-30-2020 10:29:09,580,0.98
362,Will hourglasses filled with cremated ashes be a success? Remains to be seen.,11-21-2020 06:08:06,577,0.95
363,I've stopped greeting my neighbors: they're too 'hi!' maintenance.,10-25-2020 17:14:16,577,0.95
364,Testical torture enthusiasts after a long day : aahh time to hit the sack,03-19-2021 22:27:27,576,0.97
365,"If someone is 10% Polish, does that make them a tad pole?",05-04-2020 06:03:48,576,0.99
366,Best part of COVID-19 is my car getting 3 weeks a gallon.,04-04-2020 15:54:54,575,0.98
367,"The person who proof read Hitler's speeches, was the original grammar Nazi.",07-16-2019 10:25:09,578,0.95
368,I can't even count how many math tests I've failed.,04-26-2020 14:27:29,572,0.99
369,"I have a lot of opinions on this covid relief bill, but sending a billion dollars to Egypt just seems like a pyramid scheme.",12-23-2020 19:12:09,569,0.98
370,My therapist says I am too preoccupied by vengeance. We’ll see about that...,11-15-2020 18:59:10,573,0.95
371,People who enjoy anal sex are fucking assholes,07-18-2020 23:09:50,566,0.97
372,"Marriage is like a hand grenade, remove the ring and the house is gone.",07-17-2020 08:11:01,572,0.98
373,"Someone says ""you look familiar"" respond with ""oh yeah I do porn""",06-30-2019 08:26:37,568,0.95
374,Everything is a smoke machine if you use it wrong enough.,01-11-2020 18:25:24,565,0.98
375,"You can't spell ""wink"" without one i.",05-13-2021 07:21:31,564,0.99
376,Today I have a 45 minute presentation about the importance of short meetings.,03-30-2020 13:03:47,569,0.98
377,My wife asked me to put ketchup on the shopping list and now I can’t read anything!,04-19-2021 07:02:05,565,0.95
378,I am terrified of elevators so I am taking steps to avoid them.,06-04-2020 14:30:01,562,0.99
379,"One way or another, there are probably going to be a lot less anti-vaxxers after this Covid-19 ordeal is over.",03-20-2020 14:09:21,569,0.98
380,The guy who invented autocorrect can burn in hello.,11-12-2018 12:42:09,568,0.98
381,"I quit my job as a scuba diving instructor after giving my first lesson, because deep down, I realized it just wasn’t for me.",05-25-2021 06:14:25,568,0.98
382,Does the name Pavlov ring a bell?,05-12-2021 09:50:24,559,0.98
383,"I came into some money recently, I really must buy some more toilet paper.",09-09-2020 08:07:25,563,0.98
384,"Back when they were thinking of what to name the 24-hour unit of time, they got really tired and just decided to call it a day.",02-14-2021 19:24:09,563,0.99
385,Accidentally spilt some tomato sauce in my eye. In Heinz sight it was a mistake,11-09-2020 16:57:23,560,0.94
386,I've just heard all dentists are going on strike.....Brace yourselves.,09-18-2020 12:16:47,566,0.98
387,Words cannot express how much I hate emojis,02-28-2021 07:52:28,560,0.99
388,To and Too are two different words.,01-21-2021 08:37:37,557,0.97
389,I hate it when you sincerely compliment someone’s mustache and suddenly she’s not your friend anymore.,05-12-2019 17:31:57,562,0.99
390,I just made up a new word: plagiarism.,10-06-2017 13:36:04,559,0.99
391,"Who decided to call it ""marijuana possession"" and not ""joint custody?""",09-30-2017 23:38:49,564,0.98
392,Since I bought a solar-powered treadmill I've been walking on sunshine.,03-09-2021 12:32:50,557,0.99
393,"My body has absorbed so much hand sanitizer that now when I pee, it cleans the toilet.",04-07-2021 12:23:05,557,0.94
394,Undercooked meat is a rare treat,09-15-2020 09:37:16,555,1.0
395,I quit my job at the helium gas factory – I didn’t like being spoken to in that tone.,02-02-2021 08:13:27,559,0.98
396,"If life is pointless, how did I just get stabbed?",05-04-2021 07:42:48,554,0.97
397,"The only ""B word"" I'll ever call my bitch is beautiful",07-23-2019 11:57:27,553,0.97
398,"My girlfriend thinks that I'm a stalker... well, she's not exactly my girlfriend yet.",06-10-2020 04:48:58,552,0.98
399,I’m so scared of negative numbers and I will stop at nothing to avoid them!,06-21-2020 22:00:34,551,0.98
400,"If life gives you melons, you may be dyslexic.",05-13-2020 01:05:52,548,0.97
401,"In most cases, cell phones won't crack when you drop them",05-31-2019 11:28:14,551,0.97
402,"As I always say, ""only idiots quote themselves""",04-25-2021 19:18:18,551,0.99
403,My wife asked me if I thought our kids were spoiled and I told her I think most kids smell that way.,04-10-2021 18:54:31,550,0.98
404,Parmesan is the most grateful cheese.,11-25-2020 07:21:32,549,0.99
405,Police are working tirelessly to catch the local wheel thief.,04-23-2020 06:52:40,548,0.98
406,[NSFW] People who buy sex dolls are fucking dummies,12-02-2020 16:47:27,550,1.0
407,"If you want an unbeatable christmas present for your friend, get them a broken drum.",11-24-2020 19:40:35,548,0.99
408,"If you suck at playing the trumpet, that's probably why.",10-19-2018 12:52:12,551,0.97
409,I got a job at Comcast and completed training so I could fix my own cable because it was faster than being on hold with customer service.,10-16-2020 20:49:25,552,0.91
410,"My therapist told me my narcissism causes me to misread social situations, but I’m pretty sure she was hitting on me.",05-20-2018 20:00:07,547,0.97
411,_______________________,03-05-2020 04:53:00,550,0.92
412,Pressing F5 is so refreshing!,02-20-2021 13:22:21,549,0.99
413,"In America, police dogs are K9. In Korea, they are E10.",07-21-2020 06:00:20,549,0.85
414,A bad analogy is like a bad analogy,10-23-2018 13:33:49,548,0.98
415,"When I yelled at my girlfriend, ""If you continue stealing my cooking utensils, I'll move out!"", she just laughed and said, ""That's a whisk I'm willing to take!""",03-18-2021 06:59:01,545,0.96
416,When lockdown is over and people can’t face going back to the office will they be suffering from StuckHome Syndrome?,02-23-2021 05:50:32,538,0.99
417,"After rapper 50 Cent announced he is voting for Trump, he immediately became The 1 Percent.",10-20-2020 12:39:34,544,0.9
418,"In a grading system of A+, A, B+, B.....so on, I think for computer science student grade 'B' should be called 'C++'",09-03-2020 01:53:21,541,0.95
419,I before E except after C has been disproven by science,08-13-2018 13:08:32,541,0.98
420,"The sitcom about airplanes never took off, because the pilot was terrible.",04-22-2018 21:34:38,538,0.98
421,"Duck, duck, goose is the most fowl game ever played.",01-16-2021 00:52:20,544,0.99
422,I'm not saying it was a mistake letting my wife control the thermostat but two Hobbits just showed up and threw a ring into our bedroom.,05-27-2021 19:48:40,542,0.98
423,Scientists have discovered a cure for apathy but so far nobody cares.,03-14-2021 23:01:04,535,1.0
424,"To all the people out there suffering with paranoia just remember, you're not alone.",03-27-2019 13:05:20,535,1.0
425,"I want to know, if vegetables are so good why are vegetarians always trying to make them taste like meat.",09-12-2020 14:14:41,534,0.92
426,2020: The year health experts told you to avoid the gym,11-17-2020 17:53:06,537,0.99
427,Cremated ashes are dead weight.,08-28-2020 00:23:25,540,0.97
428,Some women have a difficult time working for the postal service because it’s so mail-dominated.,01-15-2021 06:06:06,536,0.97
429,"I’ve started carrying a gun after an attempted mugging a few years ago and since then, my mugging attempts have been a lot more successful.",09-28-2018 00:24:59,536,0.96
430,"Overweight people don't skinny dip, we chunky dunk.",07-06-2020 22:33:27,534,0.96
431,"They said a mask and gloves were enough to go to the grocery store. They lied, everyone else had clothes on.",06-16-2020 00:28:03,533,0.94
432,"I went to a wedding on the weekend, and it was so emotional that even the cake was in tiers.",03-09-2020 23:06:55,536,0.98
433,"My wife likes it when I blow air on her when she's hot, but honestly... I'm not a fan.",09-07-2019 05:54:27,534,0.99
434,"Always give 100%, unless it's blood.",05-18-2021 09:42:11,529,0.99
435,"Without nipples, boobs would be pointless",05-23-2021 07:39:14,529,0.98
436,Nostalgia ain’t what it used to be.,01-27-2021 00:16:39,527,0.98
437,Etta James' full name is 'Estimated Time to Arrival James'.,11-04-2020 08:33:45,527,0.95
438,YGOLOHCYSP....Reverse psychology.,08-25-2020 13:31:42,532,0.98
439,I'd like to give a big shout out to all the partially deaf people out there.,06-22-2020 10:38:05,533,0.99
440,I watched a documentary about how ships are held together. Riveting,06-06-2020 16:13:16,530,0.98
441,"I’m not gonna lie, I’m pretty good at telling the truth.",05-05-2020 00:11:48,532,0.97
442,People are usually shocked when they find out I am not a good electrician.,02-19-2020 20:18:26,532,0.97
443,My girlfriend said we should have makeup sex... So I fucked her lipstick.,07-12-2020 01:32:47,530,0.92
444,I was attacked by a group of mimes and they did unspeakable things to me.,11-06-2017 23:23:54,531,0.99
445,"RIP boiling water, you will be mist.",10-25-2017 06:02:23,523,0.96
446,I used to work as a programmer for auto correct... Then they fried me for no raisin.,07-15-2020 08:03:26,522,0.98
447,How I Met Your Mother was the longest Ted talk ever.,03-10-2018 11:16:27,526,0.98
448,I want to start a hide and seek club but good members are hard to find.,10-28-2020 15:39:58,525,0.99
449,Cows have hooves instead of feet because they lactose.,06-20-2018 07:38:21,523,0.96
450,I hear that it's easier to convince ladies not to eat Tide Pods but it's harder to deter gents.,01-22-2021 17:19:06,526,0.98
451,I’m done being a people pleaser if everyone’s ok with that.,08-17-2020 23:09:06,526,0.83
452,I avoid oneliners for the same reason I avoid cocaine: one line is never enough.,04-22-2020 21:33:35,520,0.98
453,"I came into some money the other day, the cash register was really sticky after.",04-09-2020 08:09:26,519,0.95
454,"I’ve made a website for depressed tennis players, but the servers are currently down.",05-30-2018 21:16:13,521,0.98
455,Maybe if we all emailed the Constitution to each other the NSA will finally read it.,05-07-2021 06:11:45,521,0.97
456,Becoming a flat-earther has really widened my horizons.,03-10-2021 09:03:07,520,0.99
457,It takes guts to be an organ donor.,07-29-2020 17:04:48,523,0.99
458,"I'm developing a new fragrance for introverts. It's called ""Leave Me The Fuh Cologne"".",02-29-2020 15:17:03,525,0.92
459,"To the guy who invented the number zero, thanks for nothing.",06-26-2019 08:11:45,525,0.97
460,"My friend hired a Butler without a left arm, which serves him right.",04-17-2021 10:42:39,519,0.99
461,I am old enough to remember when the truth wasn't a conspiracy.,11-10-2020 07:17:42,521,0.94
462,Why am I the only one naked in this gender reveal party?,02-04-2020 02:46:02,525,0.98
463,"I used to be a D.J. at Stonehenge, but I no longer mix in those circles.",10-26-2020 15:03:24,521,0.98
464,"There are three dimensions to credit cards: length, width, and debt.",01-16-2020 08:47:38,521,0.99
465,"I, for one, really like Roman Numerals",03-05-2020 20:09:41,519,0.96
466,I once lived a stone's throw away from a family who died of mysterious head injuries.,07-19-2019 04:45:26,513,0.99
467,"Whoever put the ""b"" in ""subtle"" was a clever fuck.",02-17-2018 20:23:33,517,0.94
468,A guy that's really bad at limbo walks into a bar.,08-12-2019 15:17:53,515,0.99
