idx,title,created_utc,score,upvote_ratio
698,"KNOCK KNOCK, WHO'S THERE: WHO representative regretfully informs you that you will be placed under quarantine for 14 days",03-08-2020 04:21:36,427,0.93
699,I do public relations work for a company that sells bicycle wheels. I'm also their spokes person.,01-17-2020 06:06:41,429,0.94
700,"I tried to be nice by holding the door open for a girl but apparently, chivalry doesn't apply to bathroom stalls",05-11-2019 05:21:47,423,0.98
701,Calling your mother an asshole makes you a piece of shit.,04-30-2019 13:07:24,422,0.98
702,A lighthouse is actually very heavy.,11-21-2018 18:03:43,426,0.98
703,Why is there so much month left at the end of my money?,05-25-2020 15:15:58,423,0.98
704,"Amanda thought it'd be unsafe for me to walk home in my bikini, but I made it back all in one piece.",04-03-2020 08:28:58,419,0.97
705,"If a blind prostitute tells you that you're the biggest she's ever felt, she might be pulling your leg.",11-30-2019 18:40:02,424,0.97
706,"My mailman got a sex change, so I guess you’d call him a post-man now.",10-12-2018 09:03:56,424,0.95
707,"When I was a kid, my parents used to make me walk the plank because we couldn't afford a dog.",05-23-2020 06:03:33,424,0.97
708,"Why do they call childbirth ""delivery,"" why not call it ""take-out""?",04-06-2020 17:40:55,425,0.99
709,Clones are people two.,01-15-2020 13:44:50,427,0.97
710,"Birthdays are nice and all, but too many of them can kill you.",01-24-2019 10:29:11,428,0.99
711,"Opinions are like assholes, I look at the one's of hot chicks online",05-10-2020 03:26:53,427,0.94
712,"I wanted to marry my English teacher when she got out of jail, but apparently, you can’t end a sentence with a proposition.",10-01-2018 01:46:49,421,0.96
713,"Vodka may not be the answer, but it’s worth a shot.",05-03-2018 12:47:03,426,0.98
714,Shout-out to my self-aware friends - you know who you are,12-17-2019 11:09:32,418,0.99
715,“It’s sad that a family can be torn apart by something as simple as wild dogs.”,06-13-2020 04:54:54,419,0.99
716,Life's too short to make fun of midgets.,12-28-2020 08:11:17,414,0.96
717,"All the young people today are stealing bus stop signs, where do they get off?",04-08-2021 08:17:01,413,0.98
718,I for one like Roman numerals.,12-15-2018 05:02:03,415,0.96
719,I once threw a dart at a rodeo and got a bullseye!,03-06-2020 12:50:27,414,0.97
720,A seal walks into a club.,12-07-2020 22:38:50,410,0.97
721,People are often shocked when they realize how bad of an electrician I am.,12-02-2019 16:21:47,411,0.96
722,I've been telling everyone about the benefits of eating dried grapes -- it's all about raisin awareness.,11-17-2018 18:20:06,410,0.98
723,"I wonder if the guy who coined the term ""One Hit Wonder"" every came up with any other ideas that caught on?",10-15-2018 10:33:05,415,0.98
724,I asked the judge to shorten my sentence and he interrupted me.,08-28-2017 18:17:54,415,0.98
725,"I planned an orgy for my birthday, but no one came.",05-06-2021 16:41:55,409,0.98
726,Iraqi comedy club...Badgag.,12-27-2020 16:37:18,409,0.97
727,Women only call me ugly until they find out how much money I make; then they call me ugly and poor.,11-24-2018 22:01:37,407,0.95
728,My mate David has had his ID stolen.... now he's just Dav,05-26-2021 00:06:39,406,0.98
729,"It isn't any wonder why I've got intimacy issues, considering that my mother was the first woman who ever stood me up.",07-05-2020 09:12:22,406,0.99
730,"I'd never refuse a stranger's money, even if you paid me.",02-01-2020 06:24:55,409,0.98
731,"A lot of people worry about being buried alive, but that's really a miner problem.",12-04-2018 14:17:19,414,0.98
732,"Guess what? I came up with a new word, Plagiarism.",05-21-2020 21:52:38,409,0.93
733,"If pronouncing my b's as v's makes me sound Russian, Soviet",02-05-2018 03:46:05,413,0.96
734,"One night, as I was laying in bed, I looked up at the stars and thought to myself, “what the fuck happened to my roof?”",09-10-2018 08:11:21,409,0.96
735,"My boss said he’ll fire the employee with the worst posture and I have a hunch, it might be me.",08-29-2018 23:16:36,410,0.98
736,A plague of locusts and a plague of frogs seems like a self-correcting problem,02-21-2021 04:36:43,410,0.98
737,I wonder if gun manuals have a troubleshooting section.,11-05-2018 21:08:04,408,0.97
738,"People like to say that I'm mean. The truth is, I'm just really average.",04-26-2021 19:43:43,408,0.97
739,i only use lower case letters because i hate capitalism,05-09-2019 07:11:59,407,0.96
740,"To the thief who stole all my cans of red bull, I don't know how you can sleep at night.",12-31-2018 12:24:48,405,0.99
741,"Maybe if we all emailed the Constitution to each other, the NSA will finally read it.",03-23-2018 07:17:36,408,0.95
742,"My friends and I experimented sexually in high school, I was the control group.",03-27-2017 02:04:20,403,0.99
743,Grammar. The difference between knowing your shit and knowing you're shit.,05-27-2021 06:58:08,403,0.99
744,Whenever my baker makes a joke he cracks a rye smile,02-05-2021 08:02:56,402,0.98
745,Eating two whole pizzas a day has made me a well-rounded person.,11-24-2020 11:09:15,407,0.98
746,"Well, to be frank i'd have to change my name.",02-26-2019 09:55:37,403,0.98
747,Our boss just banned overly-specific nicknames and the whole office is staring at Rat Snitch Brian The Good Time Ruiner.,08-26-2018 03:28:36,412,0.95
748,I can’t stand it when my tripod has a broken leg.,09-01-2019 09:37:07,408,0.99
749,"People who don't know the difference between ""burro"" and ""burrow"" don't know their ass from a hole in the ground.",08-07-2019 07:53:03,403,0.98
750,"I used to be into S&M, bestiality, and necrophilia - until I realized I was just beating a dead horse.",02-21-2019 08:21:38,405,0.97
751,"If smoking marijuana causes short-term memory loss, what does smoking marijuana do?",02-03-2019 02:21:58,407,0.95
752,"Would like to share my oneliner about the tropical birds who got stuck together, but it's toucan fusing.",05-07-2020 07:04:16,401,0.98
753,"I tried calling the tinnitus helpline, but it just kept ringing.",07-19-2019 19:42:29,402,1.0
754,A will is a dead giveaway!,05-30-2021 01:17:00,401,0.99
755,When do S and C sound the same? When it's necessary.,07-31-2020 18:07:43,403,0.97
756,I like to shit with the door open because it keeps people from getting into the elevator with me.,01-22-2020 15:43:28,397,0.98
757,The shovel was a truly groundbreaking invention,03-17-2019 22:53:14,404,0.98
758,"Not only am I a master of suspense, but",06-22-2018 18:47:26,405,0.96
759,Juno is the best movie about a man getting pregnant since Junior.,12-02-2020 07:21:15,397,0.89
760,"Elon Musk, the richest man on earth, sole mission in life is to leave earth.",01-08-2021 21:04:02,403,0.97
761,Saying the name Keanu backwards is unique.,11-05-2019 00:42:51,404,0.93
762,There is no “I” in denial.,09-13-2018 08:18:21,397,0.99
763,Short people can't reach an agreement,01-12-2021 04:56:37,401,0.98
764,"VIAGRA....It won't make you James Bond, but it would make you Roger Moore.",09-20-2020 09:52:11,398,0.98
765,I've been going through a lot right now and can't seem to find a parking space.,09-19-2019 10:35:16,396,0.99
766,"If you're here for the yodeling lesson, please form an orderly orderly orderly orderly queue.",10-17-2018 08:06:41,400,0.97
767,A nine year old girl has disappeared after using moisturizer that makes you look ten years younger.,04-14-2018 05:23:38,403,0.96
768,My new hobby is throwing lamps at people who need to lighten the fuck up,04-20-2021 11:15:07,397,0.97
769,Never challenge Death to a pillow fight unless you're prepared to handle the reaper cushions.,09-29-2019 23:01:23,400,0.98
770,"Most people think that t-rexes can't clap because they have short arms, but really it's because they are dead",04-21-2019 14:42:16,396,0.95
771,"When I was young, I used to think earwigs actually lived in your ears, so you can imagine how terrified I was of cockroaches.",01-15-2019 00:21:54,395,0.98
772,I asked my wife to dress up as a nurse tonight to fulfill my fantasy that we have health insurance.,11-22-2018 21:58:22,395,0.94
773,"I’m a scientist researching bestiality between humans and dogs, so if any of you have any questions for me, you'll find me in my lab.",11-04-2019 05:44:37,393,0.97
774,Five out of six scientists agree that Russian Roulette is safe.,07-16-2018 19:52:39,396,0.97
775,"My kinky GF wants to put glitter on my testicles, but I think that's pretty nuts.",12-15-2019 19:55:26,395,0.98
776,The gallows are a really popular hang out spot if you ask me.,05-22-2021 09:20:50,392,0.98
777,I have a really intense phobia of negative numbers. I'll stop at nothing to avoid them.,10-20-2019 09:05:17,395,0.96
778,We were so poor growing up that for breakfast we had Ordinary K,05-26-2021 21:23:00,395,0.99
779,Prison walls are never built to scale.,11-11-2019 09:10:43,396,0.98
780,"I was wondering if the world was ready for ejaculating clocks, then I thought, I guess we'll know when the time comes.",01-05-2019 05:46:57,393,0.96
781,My extra sensitive toothpaste doesn't like it when I use other toothpastes.,10-14-2018 08:19:56,396,0.98
782,"My girlfriend dressed up as a policewoman and told me I was under arrest on suspicion of being good in bed, but after 2 minutes, all charges were dropped due to a lack of evidence.",02-23-2018 08:41:21,391,0.92
783,"The Dalai Lama walks into a pizza shop and asks, “Can you make me one with everything?”",05-16-2021 23:39:14,390,0.95
784,Has COVID-19 forced you to wear a mask and glasses at the same time? You may be entitled to condensation.,06-17-2020 21:29:51,388,0.86
785,Getting your shit together is a direct violation of the Law of Entropy.,03-03-2020 08:21:19,393,0.98
786,"The easiest way to tell the difference between an alligator and a crocodile, is to pay attention to who who you see later, and who you see in a while.",12-01-2019 16:45:54,388,0.97
787,Is it crazy how saying sentences backwards creates backwards sentences saying how crazy it is ¿,11-18-2017 03:53:20,393,0.93
788,"My last girlfriend asked me to make her feel special, so I got her a helmet and a box of crayons.",03-22-2021 00:00:18,386,0.92
789,"Face is a four letter word, but preface is a foreword letter.",07-08-2018 18:42:14,389,0.9
790,"I like doing multiplications, sum times.",12-17-2020 04:01:04,385,0.98
791,"I used to hate pimples, but they grew on me.",02-11-2020 09:21:06,387,0.96
792,The procrastination club's meeting has been postponed.,05-03-2019 05:01:34,386,0.96
793,"To pirate any movie you like, just rate it 3.14.",05-24-2018 20:46:09,388,0.96
794,Was given a bag of peanuts blessed by the Pope but gave them away because I hate religious nuts.,03-30-2021 06:33:47,391,0.96
795,Walking into the drum shop like ‘I’d tap that’,02-19-2020 05:14:57,383,0.96
796,"There are actually 8 dwarves in Snow White, but Kinky was left out of the film because he was a bit tied up during recording",07-29-2019 13:19:48,382,0.96
797,"I didn't get a good look at the guy who stole my car, but I managed to write down the license plate number.",01-07-2019 15:44:24,385,0.97
798,Always writing my name in cursive is my signature move.,11-23-2018 14:55:46,385,0.97
799,"Just so everybody's clear, I'm going to put my glasses on.",10-08-2018 07:10:09,386,0.99
800,"If aliens are observing us, the ultimate alpha move would be to probe ourselves.",05-05-2021 07:18:03,387,0.96
801,Uncircumcised guys are comfortable in their own skin,03-11-2021 23:55:22,390,0.99
802,Pumping septic tanks is a job where you take a lot of shit from people.,01-28-2021 03:26:12,384,0.99
803,I’ve been trying to study micro-penises recently but they’re very hard to get a grasp on.,12-11-2020 20:59:05,381,0.98
804,idioms that don't take into account inflation are a dime a dozen these days,12-10-2020 15:35:37,386,0.99
805,You call the best salesman at a funeral home the Top Urner.,04-01-2020 05:17:15,385,0.98
806,If you see someone without a smile give them one of yours.,03-17-2020 01:33:07,386,0.97
807,Having erectile dysfunction can’t be that hard,07-14-2019 06:20:30,383,0.98
808,"Mike Tyson once watched Breaking Bad, he thought it was pretty methed up.",05-17-2018 12:03:40,385,0.94
809,Never trust math teachers who use graph paper. They’re always plotting something.,07-08-2019 04:49:19,379,0.95
810,"My wife said that hair grows faster during pregnancy, but I'm not convinced; it's been three months now and I'm still bald.",04-22-2021 11:05:21,380,0.97
811,"""Mars looks like the sort of place they could've faked the moon landings..."" - Milton Jones",03-04-2021 17:17:33,383,1.0
812,The top job at the Old MacDonald's farm corporation is the CIEIO.,05-02-2019 06:27:59,381,0.97
813,I've fallen in love with a pencil and we're getting married and I can't wait to introduce my parents to my bride 2B.,10-18-2018 07:10:08,386,0.94
814,I participated in an anal sex competition and came in turd.,02-26-2020 00:29:20,387,0.94
815,"It's quite ironic that, ""strap on"", backwards, spells, ""no parts.""",10-16-2018 02:39:43,383,0.94
816,I thought they did a nasal swab but the sign said 'Covid-19 tests in the rear',04-05-2021 23:11:45,379,0.99
817,Autocorrect and I have a love hat relationship,06-25-2020 10:54:26,387,0.99
818,"I don't think anyone here knew this, but I like to underestimate people's intelligence.",01-30-2020 11:15:44,383,0.97
819,I named my dog 8 miles so I can tell people that I walk 8 miles every single day.,06-30-2018 07:16:23,380,0.96
820,Money can get you ahead in life and also a head in life,01-08-2021 06:29:02,379,0.94
821,"The cops issued a warrant because I was stealing baby sheep and riding them, so now I’m on the lamb.",03-20-2020 06:41:54,380,0.99
822,I went to a family restaurant and they refused to serve me a family.,02-27-2020 14:53:56,383,0.97
823,I like self-deprecating humor but I’m not very good at it,01-09-2020 20:00:37,380,0.99
824,"My wife got angry at me for kicking ice cubes in the kitchen, but now it's all just water under the fridge.",10-01-2019 05:23:26,381,0.97
825,"I can never tell what my fish wants, why does he have to be so coy?",01-27-2021 13:44:45,379,0.99
826,I called the Urology department and the Nurse asked me if I could hold!,02-15-2021 11:26:01,379,0.99
827,They say that semen contains about 1.6 terabytes worth of information. I find that hard to swallow.,09-22-2019 12:43:34,381,0.95
828,My girlfriend hates it when I make jokes about her weight.. she needs to lighten up.,10-30-2017 06:00:07,375,0.96
829,Don't eat animal crackers if the seal is broken,02-22-2020 08:14:49,377,0.99
830,"I wanted to tell a USPS joke, but these days people might not get it anymore.",05-22-2021 22:26:08,376,0.97
831,The Lego stores have finally reopened and people are lined up for blocks.,05-29-2020 08:34:47,375,1.0
832,I'm giving up past tense for Lend.,03-07-2019 05:39:09,378,0.97
833,My wife said she wanted some peace and quiet while she made dinner so I unplugged the smoke alarm.,01-15-2019 18:21:33,372,0.98
834,"My wife asked me to get some pills to help me get an erection, so I bought her some diet pills.",03-20-2018 01:29:53,375,0.94
835,"One tectonic plate bumped into another and said, “Sorry, my fault.”",11-20-2017 07:34:09,379,0.97
836,"I met someone online who shares my fetish for urinating on dried fruit, so we’re going to go on a date next week.",11-17-2017 09:59:01,376,0.95
837,Good camo pants are hard to find.,08-19-2019 07:05:52,379,0.99
838,I just opened my electric bill and water bill at the same time and was completely shocked.,03-02-2018 06:40:24,375,0.96
839,I want to start a communist pillow company called Our Pillow.,03-22-2021 12:21:10,375,0.95
840,I have a German friend who is a sound engineer and a Czech one too,04-02-2020 15:08:20,369,0.98
841,Probably the worst thing you can hear when you’re wearing a bikini is “Good for you!”,10-03-2017 06:39:59,376,0.98
842,"I just burned 2,000 calories. That's the last time I leave brownies in the oven while I nap.",11-02-2017 20:47:40,372,0.97
843,"Whatever you think of the porn industry, you have to admit those guys are always hard at work",05-16-2021 14:49:13,375,0.98
844,"In high school, my math teacher called me average and that was mean.",06-02-2019 19:08:37,376,0.98
845,"I got my best friend a fridge for his birthday, I can’t wait to see his face light up when he opens it.",08-16-2018 17:44:50,371,0.98
846,Did you sit on the f5 key? Because your ass is refreshing,04-16-2021 03:40:02,371,0.92
847,"There's plenty of fish in the sea, but until I catch one, I'm stuck here just holding my rod.",12-25-2019 22:22:04,375,0.98
848,"People often say that my life must be tough living with erectile dysfunction but honestly, it's not so hard.",06-27-2019 06:25:14,369,0.97
849,"I thought I spotted a leopard once, but it turns out they’re born like that.",06-09-2019 20:01:18,374,0.98
850,"I had my identity stolen once, now they have no life.",05-10-2021 12:03:52,369,0.97
851,"My family couldn't agree on whether to get grandpa buried or cremated, so in the end, we just let him live.",09-02-2019 05:52:33,366,0.95
852,"The sitcom about airplanes never took off, because the pilot was terrible.",08-25-2019 08:45:47,370,0.99
853,"My parents always tell me their world doesn’t revolve around me, so I guess that means I’m not actually their sun.",08-04-2018 03:20:42,370,0.97
854,I started out with nothing ... I still have most of it.,03-17-2021 03:20:05,371,0.98
855,A new Lego store opened up in my town... People were lined up for blocks,10-11-2020 13:02:03,368,0.98
856,"A dyslexic, agnostic insomniac lays awake all night wondering if there really is a dog.",06-01-2020 21:17:28,369,0.92
857,I was told I had Type A blood but later discovered it was a typo.,12-08-2019 10:59:29,367,0.99
858,"Statistically, 6 out of 7 dwarves are not happy.",06-21-2019 17:03:54,367,0.97
859,"The pub is ten minutes from my house, however, my house is two hours from the pub.",12-07-2018 00:41:36,369,0.96
860,"I'm not paranoid, but I'm sure there are people who think I am.",01-02-2020 13:13:44,364,0.99
861,My poor knowledge of greek mythology has always been my achilles elbow,01-03-2018 17:50:16,368,0.97
862,2 in 1 people have multiple personality disorder.,10-03-2017 16:30:29,367,0.98
863,Three conspiracy theorists walk into a bar...you can't tell me that's just a coincidence.,04-15-2021 18:21:18,367,0.99
864,Masturbation is a touchy subject.,12-31-2020 00:56:23,366,0.98
865,Do NOT open any emails from Hormel Foods - It might be SPAM,05-10-2020 14:21:20,366,0.99
866,I'd give my left bladder to be better at biology.,12-20-2018 04:28:12,366,0.97
867,"I tried to explain to my 4-year-old son that it's perfectly normal to accidentally poop your pants, but he's still making fun of me.",07-02-2018 22:46:45,370,0.97
868,"We’ll We’ll We’ll, if it isn’t autocorrect.",04-25-2018 21:36:37,370,0.95
869,"Now that food has replaced sex in my life, I can't even get into my own pants.",01-16-2021 17:08:06,367,0.98
870,Pickup lines don't have the charm that you do,04-19-2020 15:02:53,365,0.98
871,A cure for premature ejaculation can't come soon enough.,02-26-2020 12:27:46,362,0.98
872,"Always use a condom when having phone sex, or you might get hearing aids.",11-10-2019 14:04:18,360,0.97
873,Condoms are for fucking pussies.,04-10-2019 06:26:14,361,0.92
874,Why is no one ever the right amount of whelmed?,11-21-2018 01:32:01,362,0.96
875,I cannot stand being fat.,02-15-2020 00:56:20,364,0.96
876,I've been caught red-handed lying about the colour of my body parts.,02-03-2020 10:10:20,359,0.99
877,"Put down the phone, close your eyes, and just concentrate on driving.",06-04-2019 08:10:36,358,0.98
878,You mention Botox these days and no even raises an eyebrow.,01-16-2019 15:52:29,362,0.97
879,"My wife is really mad at the fact that I have no sense of direction, so I packed up my stuff and right.",08-27-2018 21:55:34,360,0.95
880,"When I die, I’d like the word ""Humble"" to be written on my statue.",06-13-2018 19:04:00,357,0.96
881,"If a Norwegian robot analyzes a bird, it Scandinavian.",11-14-2017 21:36:12,363,0.96
882,When you buy a bigger bed you have more bed room but less bedroom.,07-31-2019 15:52:15,364,0.96
883,"If you're bad at haggling, you'll end up paying the price.",12-29-2018 09:53:47,355,0.97
884,"Chickens like to draw, but a cock'll doodle, too.",01-16-2018 08:47:14,367,0.97
885,"If i had the option to transform into any animal for just one day, i'd choose Thursday",11-28-2019 07:09:51,356,0.97
886,There’s a fine line between doing coke and not doing coke.,05-10-2019 09:05:25,361,0.97
887,"I was named after my father, obviously, seeing as he was born before me.",02-10-2019 23:04:56,360,0.95
888,"Honestly, my worst purchase of 2020 was a 2020 planner.",07-06-2020 10:47:36,359,0.95
889,"People have told me that I'm very doubting, but I'm not so sure.",06-17-2020 08:16:59,361,0.99
890,"My friend told me that he can sleep while standing, but I know he's been lying.",09-25-2019 08:45:53,358,0.99
891,Keeping tropical fish in your home has a calming effect on the brain because of the indoor fins.,08-10-2019 05:45:16,356,0.99
892,"I only believe in 12.5% of the bible, which makes me an eighth theist.",12-28-2017 23:20:03,361,0.97
893,I like Freudian slips as much as the next gay.,10-05-2017 19:36:01,364,0.98
894,Masturbation is like procrastination—it’s all good fun until you realize you’re just fucking yourself.,12-15-2019 07:39:15,357,0.97
895,"We choose to masturbate, not because it is easy, but because it is hard.",10-19-2019 03:03:57,354,0.97
896,"I got an e-mail saying, 'At Google Earth, we can read maps backwards!' and I thought to myself, ""That's just spam.""",11-05-2017 01:56:17,359,0.96
897,I just made some dandruff from scratch!,02-23-2021 18:08:40,359,0.99
898,3.14% of sailors are π-rates.,08-29-2019 06:25:25,359,0.95
899,"If you need to start a fire by rubbing two sticks together, make sure they’re the same because then, you’ll have a match.",07-09-2019 06:30:58,360,0.97
900,Kleptomaniac evangelicalists take the Bible literally.,05-08-2018 13:50:10,356,0.97
901,There is no level of trust equal to that of cannibals giving each other oral sex.,01-30-2020 00:41:27,354,0.96
902,Thank God I'm an atheist,11-08-2019 09:02:41,357,0.93
903,After winning the game I decided to throw the ball into the crowd like they do on TV but apparently that's unacceptable in Bowling.,04-03-2019 15:42:32,352,0.98
904,I ate four cans of alphabet soup and just had the biggest vowel movement ever.,02-19-2019 17:28:42,355,0.97
905,Every novel is a mystery novel if you never finish it,01-27-2020 23:07:02,356,0.99
906,I got mugged by six dwarves last night. Not happy.,01-28-2019 01:26:18,348,0.96
907,I couldn't pay the exorcist so he repossessed my house,11-27-2018 00:57:23,355,0.97
908,"""I before E except after C"" is unscientific.",05-10-2018 13:17:31,354,0.95
909,I cut myself on a jigsaw which really puzzled me.,01-26-2020 13:09:47,352,0.96
910,"True house cleaners aren't just born, they're maid.",07-27-2019 06:46:22,348,0.99
911,"Despite the high cost of living, it still remains popular",07-21-2018 09:46:06,350,0.95
912,My dentist girlfriend ditched me and hurt my fillings.,02-21-2020 05:37:34,352,0.96
913,Don't forget today is Alzheimer's awareness day!,11-07-2019 07:30:34,349,0.97
914,"Just to make things clear, I'm going to put my glasses on.",05-30-2019 15:38:21,348,0.98
915,The word “camouflage” is just the word “disguise” in disguise,01-18-2019 18:28:42,348,0.94
916,"The word “diputseromneve” may look ridiculous, but backwards, it’s even more stupid.",09-27-2018 02:38:38,352,0.93
917,"The sitcom about airplanes never took off, because the pilot was terrible.",08-28-2018 22:26:37,351,0.97
918,If I had a crystal ball I'd sit down very carefully.,07-03-2018 12:59:46,349,0.96
919,"I have a Polish friend who's a sound engineer, and I have a Czech one, too. A Czech one too.",06-15-2018 01:19:21,348,0.96
920,"It's pretty easy to stop ladies from eating tide pods, but it's much more difficult to deter gents.",01-20-2018 15:32:32,357,0.95
921,Some people can’t tell a penis apart from a teste even though there is a vas deferens between them.,02-11-2020 22:55:12,346,0.97
922,"Gravity is one of the most fundamental forces in the universe, but when you remove it, you get gravy.",10-08-2019 05:58:03,355,0.97
923,"If laziness was an Olympic sport, I'd probably come in fourth so I wouldn't need to walk up to the podium.",02-11-2018 17:26:20,353,0.98
924,I crack good drug puns.,02-23-2020 03:54:17,348,0.94
925,My extra sensitive toothpaste doesn't like it when I use other toothpastes.,02-03-2019 22:17:02,355,0.97
926,If 4 out of 5 people SUFFER from diarrhea… does that mean that one enjoys it?,11-28-2018 08:04:53,350,0.97
927,"If you're ever trapped under the snow, try not to panic... just sit there and chill.",12-19-2019 01:29:57,345,0.96
928,The most convenient time to add insult to injury is when you’re signing someone’s cast.,12-09-2019 05:02:06,349,0.99
929,"My boyfriend and I are made for eachother: he thinks I'm cute when I don't have my glasses on, and I think he's cute when I don't have my glasses on.",08-09-2018 04:18:45,351,0.97
930,"I googled ""how to start a wildfire"" and I got 50,000 matches.",03-26-2018 17:52:59,349,0.98
931,"I wrote a book on penguins, but in retrospect, I realize that paper would have been easier.",03-16-2018 18:54:09,347,0.97
932,"For those who have run out of toilet paper and are using the napkins stashed in the glove box, make sure they weren't used for eating hot wings.",04-14-2020 09:12:57,349,0.88
933,"When I said that I like it rough, I was talking about the sex, not the entire relationship.",09-11-2019 11:40:24,346,0.96
