idx,title,created_utc,score,upvote_ratio
0,y = mx + b,03-24-2020 09:07:16,1985,0.99
1,"The adjective for metal is metallic, but not so for iron, which is ironic.",11-18-2020 06:17:01,1875,0.99
2,Coughing has finally overtaken speaking Arabic as the most taboo thing to do in an airport.,03-21-2020 21:31:47,1715,0.99
3,"My wife asked me to put ketchup on the shopping list that I was making and now, I can’t read anything.",08-02-2020 06:48:51,1449,0.99
4,“DO NOT TOUCH” must be one of the most terrifying things to read in braille.,02-05-2020 07:55:54,1426,0.98
5,"Together, I can beat schizophrenia.",10-02-2020 20:09:39,1401,0.98
6,"Chameleons are supposed to blend well, but I think it's ruined this smoothie.",11-13-2020 05:19:18,1391,0.99
7,"I, for one, like Roman Numerals",10-18-2020 23:42:24,1366,0.98
8,Superglue can also be used for cleaning your computer keyboarddddddddddddddddddddddddddddddddddddddddddd,11-12-2020 06:14:50,1351,0.98
9,"If there's one thing that makes me throw up, it's a dart board on a ceiling.",03-13-2020 08:16:29,1348,0.99
10,"I don’t like people who take drugs, for example: airport security.",08-22-2020 13:01:13,1274,0.99
11,The thief who stole my iPhone could face time.,08-05-2020 20:24:28,1270,0.99
12,I think the Discovery Channel should be on a different channel everyday.,11-29-2020 05:49:48,1249,0.99
13,I tried to remarry my ex-wife but She figured out I was only after my money.,09-02-2020 07:18:19,1225,0.98
14,"It's quite ironic that ""strap on"", backwards, spells 'no parts'.",12-18-2020 06:07:56,1164,0.98
15,"My cocaine is so white, the police let it go with a warning.",09-26-2020 14:27:32,1158,0.98
16,I learned Morse code and then I couldn't sleep because the rain kept telling me to go fuck myself.,02-04-2021 13:13:32,1155,0.98
17,"The word ""misread"" can be misread as ""misread"".",10-06-2020 05:20:56,1138,0.98
18,Why the hell did they name them 'Soldier ants' and not 'Combatants'?,08-26-2020 10:32:13,1128,0.99
19,"Gravity is one of the most fundamental forces in the universe, but if you remove it, you get gravy.",03-12-2020 07:35:28,1114,0.99
20,“DO NOT TOUCH” must be one of the most terrifying things to read in braille.,12-06-2020 07:42:32,1114,0.97
21,"Did you know if you hold your ear up to a stranger’s leg, you can actually hear them say, “What the hell are you doing?”",04-16-2020 21:16:42,1117,0.99
22,You can't spell advertisements without semen between the tits.,07-18-2017 07:24:07,1108,0.98
23,"“There are no words in the English language that have all the vowels in alphabetical order,” he said facetiously.",07-14-2020 19:36:25,1099,0.99
24,"My wife threatened to divorce me when I said I was going to give our daughter a silly name, so I called her Bluff.",12-21-2020 05:50:28,1085,0.99
25,I was gonna tell a time travelling joke but you guys didn't like it,08-25-2017 06:32:20,1053,0.99
26,People who buy sex dolls are fucking dummies,03-14-2020 20:18:52,1039,0.99
27,"Build a man a fire and he'll be warm for the night, set a man on fire and he'll be warm for the rest of his life.",08-08-2020 04:24:52,1039,0.96
28,Selling porn is gross but selling food and small household items is grocer.,08-11-2020 01:22:17,1028,0.99
29,"My girlfriend confided in me she loves when I blow air on her when she's hot, but honestly, I’m not a fan.",08-04-2020 06:24:29,1016,0.99
30,"Justice is a dish best served cold, if it were served warm, it would be justwater.",08-23-2020 11:02:04,1014,0.98
31,With great power comes a huge electric bill.,11-03-2020 06:07:15,1010,0.99
32,Oral sex in the morning is a great way to get a head start.,09-30-2020 07:28:25,1013,0.98
33,"Like most people my age, I'm 50.",04-11-2020 05:54:38,1001,0.98
34,I put the “sexy” in “dyslexic”,03-02-2020 11:11:02,1005,0.99
35,"I identify as Michael Jackson, so my pronouns are ""he/hee"".",10-31-2020 23:47:00,995,0.97
36,I hate making spelling mistakes when I'm posting on /r/oneliners because all you have to do is mix up a few letters and your whole joke is urined.,07-31-2020 06:54:20,996,0.98
37,I named my eraser Confidence because it gets smaller after every mistake I make.,12-26-2020 06:06:50,985,0.99
38,People who can’t tell the difference between whole numbers and decimals are missing the point.,11-05-2020 15:13:43,985,0.99
39,"I've heard so much about the ""Eye Of The Tiger"", but how come no one ever talks about the other four letters?",06-28-2020 06:39:16,982,0.99
40,My three favorite things are eating my family and not using commas.,09-23-2017 14:25:51,970,1.0
41,"Every day is a D-Day, if you're a stutterer.",09-22-2020 05:34:40,965,0.98
42,"If your Tesla gets stolen, is it called an Edison now?",09-05-2020 00:52:39,965,0.96
43,man addicted to drinking brake fluid claims he can stop anytime he wants,01-04-2021 12:06:17,969,0.99
44,I put the “sexy” in “dyslexic”,12-03-2020 06:38:13,965,0.98
45,"OK, just so everybody's clear, I'm going to put my glasses on.",02-22-2021 02:19:35,970,0.99
46,Water is heavier than butane because butane is a lighter fluid.,11-22-2020 10:45:25,963,0.99
47,"Despite removing all the stains, I still lost my job as a Church window cleaner.",08-07-2020 06:29:14,967,0.99
48,Whoever called it 'Dentures' really missed an opportunity to call it ' 'Substitooths'.,09-14-2020 15:44:36,956,0.99
49,"My nerdy friend just got a PhD on the history of palindromes, so now we call him Dr Awkward.",04-28-2020 20:23:39,945,0.99
50,"Bill Gates has agreed to pay for the completion of Trumps wall, on the condition he gets to install Windows.",08-14-2020 04:39:05,940,0.97
51,Quarantine has taught me you don’t need fun to have alcohol,04-07-2020 13:42:52,939,0.99
52,"Is it o.k. for me to start drinking as soon as the kids are at school, or am I just a terrible teacher?",10-07-2020 18:10:47,937,0.98
53,"The show ""How I Met Your Mother"" was just a really long TED talk",10-08-2020 08:40:19,930,0.98
54,Socrates literally only wants one thing and it's fucking discussing,09-08-2020 03:15:11,929,0.99
55,I'm such a virgin that even flipping a coin won't give me head.,08-31-2020 02:48:21,937,0.98
56,_____________,08-24-2020 23:25:45,931,0.96
57,It's baffling why Marvel never used Hulk as an advertisement. He's literally a massive banner.,07-02-2020 21:55:46,915,0.97
58,Never take the 'P' out of a pirate..... as he becomes very angry.,09-11-2020 07:13:56,918,0.98
59,"My wife says she's going to leave me if i don't start supporting Trump.... I said ""Biden""",10-03-2020 06:51:40,916,0.93
60,"My wife said ""I'm leaving you because your always pretending to be a transformer"" I said ""no, wait! I can change""",01-06-2021 15:09:16,913,0.97
61,"To cut a long story short, I became a film editor.",08-30-2020 09:57:02,914,0.93
62,An interviewer asked me how well i can perform under pressure; I said I’m much better at Bohemian Rhapsody.,02-10-2021 08:11:45,901,0.98
63,Nothing tops a plain pizza.,11-23-2020 09:19:42,900,0.99
64,"The word “diputseromneve” may look ridiculous, but backwards, it’s even more stupid.",12-30-2020 06:09:06,894,0.96
65,Suicidal twin kills sister by mistake,11-14-2020 22:28:44,895,0.98
66,"I once had a psychic girlfriend, she left me before we met.",09-07-2020 07:04:28,895,0.98
67,I accidentally bit the inside of my cheek and now it hurts like crazy everytime I sit down.,08-10-2020 06:13:37,890,0.99
68,"Right now, both Mexico and Canada are bordering on stupidity.",06-30-2020 04:04:55,889,0.93
69,Tequila won't fix your life but it's worth a shot.,09-27-2020 12:45:33,879,0.99
70,The share button on reddit should be called spreddit,10-29-2018 11:54:29,880,0.98
71,"If my wife made a dollar for every sexist joke I make, she'd be $0.77 richer right now.",10-26-2017 04:22:40,882,0.96
72,My mom asked me to hand out invitations for my brother’s surprise birthday party and that’s when I realized he was the favorite twin.,12-17-2020 06:14:29,884,0.99
73,Do gun manuals have a trouble shooting section?,09-08-2020 18:28:26,874,1.0
74,I'm always frank with my sexual partners. I don't want them knowing my real name.,09-25-2020 22:36:10,873,0.97
75,"If I had 50¢ for every math test I've failed, I'd have $7.20",06-05-2020 23:34:24,871,0.99
76,"I can’t see an end, have no control. don’t think there’s any escape and don’t even have a home anymore, so I thought, yup, definitely time for a new keyboard.",12-20-2020 06:10:08,859,0.96
77,People who boast about how good they are at yoga can go fuck themselves.,10-04-2020 05:40:05,866,0.98
78,"If you stick your head between two breast implants, are you technically in Silicon Valley?",02-06-2020 07:40:22,859,0.96
79,I really love playing chess with elderly people in the park but it’s just really hard to find thirty two of them willing to do it.,07-28-2020 06:29:07,858,0.99
80,"When you tickle a man to death by accident, it is manslaughter.",12-07-2020 05:55:59,860,0.99
81,The man who invented autocorrect has died... May he roast in piss.,09-19-2020 03:47:20,853,0.97
82,'Seldom' is a word I rarely use.,12-01-2020 08:31:06,852,0.99
83,"I wanted to marry my English teacher when she got out of jail, but apparently, you can’t end a sentence with a proposition.",05-07-2018 06:41:42,850,0.95
84,bruh if an election lasts longer than 4 hours aren't you supposed to call your doctor??,11-06-2020 07:10:58,852,0.97
85,I love Ebay....I sold my homing pigeon 8 times last month.,09-10-2020 08:23:30,848,0.98
86,Talking to people about the benefits of dried grapes is all about raisin awareness.,11-28-2020 09:27:05,852,1.0
87,You can tell Monopoly is an old game because there’s a luxury tax and rich people can go to jail.,07-02-2020 07:06:10,847,0.97
88,"Went to the bathroom earlier and took a poo....not sure whose it was, but it's mine now.",10-01-2020 07:13:36,844,0.96
89,"I've discovered I have a logic fetish, I just can't stop coming to conclusions.",08-28-2020 18:34:12,849,0.97
90,"How are Christians against piercings, didn't Jesus have like four?",09-14-2020 03:40:57,846,0.95
91,I'm having a quarantine party this weekend and none of you are invited.,03-27-2020 05:15:50,847,0.98
92,"I've heard so much about the ""Eye Of The Tiger"" but how come no one talks about the other four letters?",01-17-2021 06:12:47,842,0.98
93,"My wife has a weird habit of starting conversations by saying ""Are you even listening to me?""",12-07-2020 23:38:44,841,0.99
94,"I saw a double-entendre contest, so I entered my friend.",09-02-2017 03:47:39,843,0.99
95,Say what you want about waitresses but they bring a lot to the table,10-10-2020 07:59:35,841,0.99
96,"Accordion to a recent survey, replacing words with the names of musical instruments in a sentence, often goes undetected.",10-02-2017 05:07:36,837,0.97
97,Most people are shocked when they find out how incompetent I am as an electrician.,04-20-2020 06:00:07,834,0.97
98,Some rude kids on the bus just texted each other “I think that old creep is looking at our phones”,03-10-2020 17:55:39,832,0.99
99,"Mike Tyson is such a religious guy, he punches people in the faith.",09-29-2020 12:22:29,828,0.99
100,"Today I went for a walk with a girl, she noticed me, so we went for a run.",10-09-2020 10:51:34,828,0.97
101,"My dad always used to say to me that the best part of fighting is the make-up sex, which probably explains his short-lived career as a boxer.",08-24-2020 06:20:49,821,0.99
102,I tried cooking with wine yesterday for the very first time...after 5 glasses I forgot why I was in the kitchen.,09-25-2020 05:02:42,820,0.96
103,"If I had a $1 for every failed maths exam, I'd have $3.45.",09-23-2020 05:50:15,823,0.97
104,I grew up just a stone's throw away from where that whole family died of mysterious head injuries.,12-31-2020 11:33:37,821,0.99
105,"I have a pet tree.....It's like a pet dog, but the bark is quieter.",09-23-2020 18:11:46,823,0.99
106,Donald Trump got the full 2020 experience ... COVID & unemployment.,11-07-2020 13:10:31,823,0.92
107,"Rats are underrated, according to the dictionary.",10-22-2020 04:16:01,822,0.99
108,"My boss hates it when I shorten his name to Dick, mostly because his name is Steve.",06-18-2020 07:07:19,817,0.99
109,"Last night my wife asked me if I wanted to dress up as a clown, hide in the drains and scare her but I didn't really feel like It.",08-05-2020 05:37:49,821,0.96
110,Considering we can't tickle ourselves I'd say we got pretty fucking lucky with masturbation,09-28-2020 21:50:30,811,0.98
111,"To be frank, I'd have to change my name.",02-02-2020 02:42:58,814,0.99
112,"One day Canada will take over the world, then you'll all be sorry.",05-02-2020 06:02:57,813,0.98
113,Mexico have now decided they will pay for the wall and Canada wants one too.,01-07-2021 14:52:36,814,0.95
114,"Mountains aren’t just funny, they’re hill areas.",03-31-2020 05:57:41,799,0.98
115,"Googled 'how to light a cigar' & got 80,000 matches.",11-14-2020 03:43:07,802,0.99
116,Nothing tops a plain pizza.,01-11-2021 10:09:41,799,0.98
117,I've asked many people what LGBTQ stands for but no one can give me a straight answer.,09-17-2020 21:41:24,799,0.98
118,"If America changed from pounds to kilograms overnight, would it create mass confusion?",10-22-2017 08:37:47,800,0.98
119,I think it’s pretty cool how the Chinese made a language entirely out of tattoos.,10-04-2017 09:15:24,796,0.99
120,"I went into a sex shop today and was shocked to find out how much all of my wife’s vibrators cost, realizing, she’s sitting on a small fortune.",12-19-2020 06:24:27,800,0.98
121,I wonder if the arachnophobia support group has a web site.,11-08-2020 05:58:30,799,0.99
122,"Good punctuation is a sentence that's well written and bad punctuation is a sentence that's, well, written.",05-24-2021 06:09:17,792,0.99
123,"I think my girlfriend's hallucinating, as she keeps insisting that she's seeing other people.",11-19-2020 16:54:37,789,0.99
124,"Statistics are like bikinis....What they reveal is suggestive, but what they conceal is vital.",10-18-2020 02:43:58,789,0.98
125,"Not gonna lie, i sleep standing up",07-25-2020 22:02:21,788,0.99
126,A 9 year old girl has vanished after using a revolutionary new cream which makes you look 10 years younger.,08-15-2020 19:04:49,780,0.96
127,"What has 4 letters, always has 6 letters and never has 5 letters.",04-09-2021 12:38:26,779,0.98
128,When my daughter asked me if trees poop I told her that's how we get number 2 pencils.,02-19-2021 17:36:03,784,0.99
129,Shouldn't tank tops offer more protection?,12-15-2020 02:14:41,782,0.99
130,"When I noticed “HI” in the alphabet, I thought someone was actually going to be my friend and then I saw the next two letters.",04-02-2020 05:11:13,784,0.98
131,Shout out to the people wondering what the opposite of in is.,10-16-2017 22:55:33,782,0.96
132,"Starbucks isnt that expensive, when you think of how much Victoria Secrets charges per cup.",07-16-2020 04:49:40,776,0.97
133,"My wife and I are both feminists. But as a man, I'm a tiny bit better at it.",01-19-2021 07:51:41,780,0.95
134,"I got my parents a new fridge for Christmas, I can't wait to see their faces light up when they open it!",12-25-2020 10:16:15,773,0.99
135,"Mountains aren’t just funny, they’re hill areas.",08-20-2020 06:24:21,767,0.96
136,"My lesbian friends got me a nice Rolex for my birthday but, I think they misunderstood me when I said ""I wanna watch"".",07-18-2020 01:30:52,769,0.9
137,I saw a Microbiologist today and he was much bigger than I expected.,04-06-2021 14:13:11,773,0.99
138,I have a chicken proof lawn...It's impeccable.,10-17-2020 12:10:35,767,0.99
139,I just entered the Town's tightest hat competition.. hope I can pull it off.,08-29-2020 14:18:56,769,0.98
140,"I got arrested at the airport because apparently security doesn't appreciate it when you call ""shotgun"" before boarding a plane.",12-22-2020 06:05:51,765,0.99
141,"Time flies like an arrow, fruit flies like a banana!",10-15-2020 04:12:41,765,0.96
142,"Everyone knows where the Big Apple is, but does anyone know where the Minneapolis?",03-01-2021 10:10:39,764,0.97
143,"Every year dozens of kids are sent off to mime school, never to be heard from again",05-16-2020 22:53:25,765,0.99
144,"Return of the Jedi, is not possible without the Receipt of the Jedi.",07-11-2020 06:32:51,765,0.97
145,I was shocked when I found out my toaster wasn’t waterproof.,01-05-2021 02:47:05,757,0.99
146,Have you ever noticed the irony behind “hyphenated” and “non-hyphenated”?,07-10-2018 00:42:41,763,0.98
147,"I'm finally going to live out my dreams, and show up naked for a test that I haven't studied for.",12-26-2020 20:02:28,761,0.99
148,"Turns out, a wooden stake to the heart, kills normal people too.",08-31-2020 14:55:56,752,0.99
149,"""How many people does it take to change a light bulb?"" is just one of the questions I should have asked before buying a lighthouse.",06-29-2020 06:00:23,754,0.99
150,My email password was hacked again and that's the third time I had to rename the dog.,05-17-2021 16:39:42,751,0.99
151,I believe a lot of conflict in the Wild West could have been avoided completely if cowboy architects had just made their towns big enough for everyone.,05-21-2020 05:17:04,743,0.99
152,"The only running I do, is out of patience, fucks and money.",09-13-2020 06:53:36,745,0.97
153,"The last thing my grandfather said before he died was “Pints, Liters, Gallons” which spoke volumes.",04-21-2020 06:39:28,745,0.99
154,"I hate it when I'm texting, I get rudely interrupted by a cyclist bouncing off my windscreen.",09-24-2020 06:21:41,744,0.97
155,"Kale is a negative calorie food, meaning the kale itself contains fewer calories than your body uses to throw it up because it's so fucking disgusting.",05-14-2018 11:57:05,748,0.95
156,"My boss hates it when I shorten his name to Dick, mostly because his name is Steve.",03-21-2021 06:22:58,740,0.98
157,The Police Officer told me he was looking for a man with one eye and I told him he should use both eyes and he'd find him a lot quicker.,04-11-2021 13:21:14,733,0.98
158,"Before was was was, was was is.",01-29-2021 10:24:20,743,0.99
159,"I've set out to lose 5 kilos this month, only 8 more to go.",08-17-2020 06:16:38,741,0.98
160,"I have kleptomania, but when it gets bad, I take something for it.",08-09-2020 10:54:52,739,0.99
161,I think someone should explain to Southerners that MILF means someone else's mom.,12-12-2020 12:04:55,733,0.96
162,"I'm such a virgin, that even flipping a coin, won't give me head.",02-12-2021 09:50:47,732,0.98
163,My wife and I split up because of psychological reasons....She was Psycho and I was Logical.,07-29-2020 05:22:42,738,0.93
164,"I don't know how to act my age, I've never been this old before.",07-04-2020 10:19:13,730,0.99
165,Old relationships are a lot like algebra...have you ever looked at your x and wondered y ?,10-05-2020 08:49:55,730,0.97
166,I'm a magician who likes to make cocaine and marijuana disappear by using a bunch of smoke and mirrors.,04-13-2020 07:31:28,728,0.98
167,What do you call a joke without a punchline?,08-12-2020 14:35:16,729,0.97
168,My Viagra addiction was the hardest time of my life,12-15-2020 19:28:07,731,0.99
169,"Childproof your house as much as you want, they still get in.",09-03-2020 14:36:49,724,0.99
170,Imagine the Titanic with a lisp.... It's unthinkable.🚢,07-13-2020 06:28:08,728,0.98
171,"While masturbation is a touchy subject, oral sex is a matter of taste.",03-29-2021 08:19:42,725,0.98
172,I dropped my phone in the bath. It's syncing now.,10-07-2020 03:19:11,728,0.95
173,"Slightly peeved the makers of the shampoo, ""Head and Shoulders"" have not followed up with a body wash called, ""Knees and Toes.""",06-23-2020 06:43:01,727,0.96
174,Apparently I snore so loudly that it scares everyone in the car I'm driving.,04-19-2017 19:44:45,722,0.99
175,"I had an appointment to see my psychic next week, but she called me up and told me I wouldn't be able to make it.",06-11-2020 00:18:35,720,1.0
176,People are making apocalypse jokes...like there's no tomorrow!!,10-02-2020 05:03:22,720,0.99
177,"If your parachute doesn't deploy, you have the rest of your life to fix it.",06-05-2017 00:54:15,718,0.99
178,Most people have 32 teeth and some have 4....It's just simple meth.,10-12-2020 15:29:57,716,0.97
179,I can’t remember the last time I smelled Chloroform.,03-17-2020 12:46:10,713,0.99
180,𝙃𝙚 𝙬𝙝𝙤 𝙨𝙢𝙞𝙡𝙚𝙨 𝙞𝙣 𝙖 𝙘𝙧𝙞𝙨𝙞𝙨 𝙝𝙖𝙨 𝙛𝙤𝙪𝙣𝙙 𝙨𝙤𝙢𝙚𝙤𝙣𝙚 𝙩𝙤 𝙗𝙡𝙖𝙢𝙚.,12-05-2020 02:25:25,714,0.96
181,I am the greatest exaggerator in the history of mankind.,12-04-2020 07:55:53,707,0.99
182,My new years resolution is to stop seeking the approval of strangers... is everyone OK with that?,01-03-2021 19:11:49,715,0.99
183,"To avoid being raped when I am in jail, I stick a tube of toothpaste up my ass for complete cavity protection.",12-24-2020 06:09:24,708,0.97
184,Not sure if the world is ready for ejaculating clocks but I guess we'll know when the time comes.,04-27-2020 06:05:36,717,0.97
185,"I just found out that my great grandfather was on the Titanic and as far as I know, he still is.",10-19-2020 18:39:04,716,0.99
186,My wife was furious with me today because I put a stick in a non-stick pan.,06-03-2020 07:00:59,710,0.99
187,"Most people hate when I stand in the corner of my psychiatrist's waiting room and blow on them when they walk by, but I'm a fan.",01-02-2021 06:14:31,706,0.98
188,"Is it true that ""an apple a day keeps the doctor away?"", or is it one of Granny's myths .",10-11-2020 02:01:34,705,0.99
189,When I won the world’s best doppelgänger competition I was beside myself,05-12-2020 07:59:35,711,0.99
190,"Everybody wearing masks at Walmart like it's no big deal, but suddenly I'm the weirdo for adding tights and a cape.",10-24-2020 19:30:41,708,0.98
191,"Some people have trouble sleeping, but I can do it with my eyes closed.",05-11-2020 06:24:39,711,0.99
192,"People who cannot distinguish between etymology and entomology, bug me in ways in which I cannot put into words.",03-15-2020 12:33:30,709,0.97
193,"My penis was in the Guinness book of world records, but then the librarian told me to take it out.",10-09-2017 18:47:18,708,0.97
194,Action movies have really exaggerated how hard it is to take over the Capitol Building.,01-10-2021 16:03:52,709,0.98
195,Don't accept shampoo...Demand real poo.,07-26-2020 14:01:16,702,0.98
196,My desire to stay well informed is at odds with my desire to stay sane.,10-27-2020 08:25:40,702,0.98
197,"When your girlfriend comes home in a white suit, smelling of honey and covered in bee stings, you know she's a keeper.",04-27-2018 07:25:41,698,0.96
198,"I once sent a message to God asking him to make me a better person, but as I pressed send I noticed that stupid fucking piece of shit autocorrect changed the word to “bitter”",02-18-2021 07:24:21,700,0.96
199,"When my wife accused me of being way too self-important, I nearly fell off my throne.",08-27-2020 06:18:43,697,0.99
200,"Never realised until today, that Karl Marx's sister Onya, invented the starting pistol....",07-24-2020 04:48:25,699,0.98
201,The local bowling alley is closed due to a strike.,06-20-2020 04:41:17,696,1.0
202,"I saw an ad saying ‘Radio for Sale, $1, Volume Stuck on Full’ and thought... I can’t turn that down.",05-05-2020 20:07:11,690,0.98
203,Piano is one of the hardest instruments to pick up.,11-11-2020 13:40:16,692,0.97
204,"I'm not sure what shocked my mailman more, the fact that I came to the door completely naked, or the fact that I knew where he lived.",02-05-2018 21:05:24,690,0.98
205,You can turn a regular sofa into a sofa bed by simply forgetting your wife’s birthday,04-24-2021 12:40:55,691,0.99
206,"Got thrown out of Mime Club yesterday, must have been something I said.",07-07-2020 14:05:14,692,0.99
207,The one thing quarantine has taught me is you don’t need fun to have alcohol,08-25-2020 17:15:33,692,0.99
208,"Justice is a dish best served cold, because, if it were served warm, it would be justwater.",07-03-2018 22:51:17,688,0.97
209,"At any given moment, the urge to sing, “The Lion Sleeps Tonight” is just a whim away, a whim away, a whim away.",06-21-2018 21:36:46,688,0.95
210,"My face lift has gone terribly wrong. If anyone knows of a good surgeon, I'm all ears.",08-13-2020 06:44:09,690,0.96
211,I tried flirting with the cute girl who works in the Internet cafe but I was unable to connect to the server,06-02-2020 08:15:52,691,0.98
212,"Someone ripped a bunch of pages out of both ends of my dictionary, so now it just goes from bad to worse.",05-24-2020 23:25:14,689,0.99
213,"The worst pub I've been to was called ""The Fiddle"".................... That was a vile inn.",08-19-2020 07:43:54,691,0.96
214,"The pub is ten minutes from my house, however, my house is two hours from the pub.",12-14-2020 05:44:37,691,0.97
215,Never trust an electrician with no eyebrows.,12-10-2020 00:11:42,691,0.98
216,"My therapist told me my narcissism causes me to misread social situations, but I’m pretty sure she was hitting on me.",05-19-2020 18:43:16,688,0.99
217,"Had a terrible start to my day, ran over 3 geese....it's given me goosebumps.",10-29-2020 10:19:52,688,0.98
218,"One thing my dad told me, ""Son never explain yourself to anyone!"" He never did tell me why!!",08-18-2020 15:57:47,688,0.96
219,"Ladies, if your man is willing to give you the Moon and the Stars, the least you could do is sacrifice Uranus.🌜🌚🌛",07-14-2020 03:15:19,690,0.94
220,I used to be a member of the secret cooking society but they kicked me out for spilling the beans.,04-19-2020 00:52:48,686,1.0
221,___________________________,03-03-2019 12:02:31,689,0.94
222,"If one more person tells me to stop using movie titles as verbs, I'm gonna Scream (1996).",03-08-2021 04:45:05,679,0.98
223,4/04 Jesus not found,04-04-2021 12:22:32,678,0.98
