idx,title,created_utc,score,upvote_ratio
0,"Annoyed by loud music, man uses drone to hit neighbors with fireworks",07-15-2019 12:17:08,117372,0.98
1,Confessed killer Stephen McDaniel keeps his body eerily still during 2 hour interrogation,10-11-2019 04:56:55,101046,0.97
2,Guy throws gator into lake,11-28-2018 16:58:07,98371,0.9400000000000001
3,I split up with my boyfriend yesterday. I fell asleep while he was packing and he stole my toilet.,08-14-2018 13:00:15,93885,0.92
4,Cougar stalks man for 6 minutes during run,10-12-2020 14:11:29,88995,0.9500000000000001
5,Best thing I found on the internet today,04-29-2019 14:23:18,88444,0.92
6,No filters. Australia is red from wildfires.,12-31-2019 03:10:59,86255,0.97
7,My buddy is a maniac... Just watch,07-29-2020 16:41:41,79477,0.93
8,"Landslide in northern Norway, 3rd of June 2020",06-03-2020 14:43:06,78435,0.98
9,Pupper has a extra mouth growing in her ear. It even salivates.,02-10-2019 18:03:57,77025,0.88
10,"Cabin in Alaska for rent, lovely view.",09-11-2020 07:14:26,74793,0.96
11,Never stop rockin',02-11-2019 14:46:29,74395,0.96
12,You call that a blunt?,03-26-2019 22:05:55,72500,0.92
13,How f******g deep is that dock.,03-11-2017 07:18:10,71798,0.9
14,Kid being brought up into sky by a kite today in Taiwan,08-30-2020 06:24:20,71545,0.97
15,Car drives over spilled liquefied petroleum gas,02-11-2018 12:32:13,71355,0.9500000000000001
16,Rabbit emerges from the ocean. The world's officially gone mad.,06-07-2020 18:49:16,69594,0.96
17,A squirrel has been hoarding acorns inside this antenna,08-03-2018 08:40:27,69051,0.92
18,"Ok here it is, breaking free the thing from the bitter orange juice bottle... And transferring it to a new BIGGER bottle!",07-15-2018 09:33:00,68708,0.92
19,You have been deodorised,01-05-2019 18:58:29,68332,0.9
20,Semi tire getting loose on the highway...,07-25-2019 14:33:00,68233,0.97
21,stadium disaster just waiting to happen,02-19-2019 19:33:06,67792,0.9400000000000001
22,"CT Scan of 1,000-year-old Buddha sculpture reveals mummified monk hidden inside",12-13-2017 13:50:55,67354,0.9
23,Just learned that standing this close to a 380 feet waterfall is a thing (Devil's pool - Victoria falls ),12-16-2020 10:10:04,66243,0.9400000000000001
24,"A ""zombie spider"" - spider covered in fungus, half-dead, half-alive which can crawl around. Found in my basement.",11-22-2018 08:47:31,66135,0.9400000000000001
25,You think you've had a crappy day at work?,05-15-2018 22:14:13,65799,0.9500000000000001
26,"New prototype ""economy"" airline seats",04-02-2019 14:13:12,65624,0.9400000000000001
27,Somewhere in Russia,02-13-2020 11:18:31,65100,0.9500000000000001
28,Russian Helicopter accidentally fires during a flight,05-01-2020 12:59:05,64664,0.96
29,"6.3 magnitude earthquake during an interview on earthquakes that struck the day before, Petrinja, Croatia",12-29-2020 16:30:45,63541,0.97
30,Fishing with the dog,11-06-2018 21:32:14,63337,0.93
31,two teenagers burned down my public library last night.,02-19-2020 11:22:21,63124,0.96
32,When the fuck did this happen?,10-06-2017 00:26:12,62705,0.88
33,"a carp fish with a ""human face""",11-08-2019 06:53:19,62572,0.9500000000000001
34,In Russia no one gives a damn if you rob them.,05-30-2017 22:58:16,62190,0.92
35,There was a friggin gecko hiding in my son's toy spider's ass!,08-26-2018 18:13:27,62064,0.92
36,A non slithering snake,05-10-2020 13:59:31,61995,0.96
37,Sunbathing mom escapes death by seconds.,07-13-2020 09:52:24,61645,0.9400000000000001
38,Inside the I-70 Avalanche,03-04-2019 12:58:08,61289,0.96
39,So I put a sticky trap down and then forgot about it for a few months. I'm terrified of my house now.,11-23-2018 10:12:15,61134,0.93
40,He was a gator boy,06-08-2020 20:27:23,60765,0.96
41,"Kids, this is why you do not climb on icebergs",09-16-2020 17:24:15,60432,0.96
42,What a great bathroom,09-16-2018 06:43:36,60312,0.9400000000000001
43,Mistakes were made,06-27-2019 11:32:15,60261,0.9500000000000001
44,Manager going for a ride,03-02-2019 13:05:11,60072,0.9500000000000001
45,Darwin would be proud,05-11-2018 15:19:23,60031,0.91
46,A new way of unloading people from the ski lift,03-16-2018 07:03:05,59987,0.9400000000000001
47,This bitch ass just flew into my eye and fell to the ground,11-06-2020 17:11:35,59982,0.92
48,Why washing your dried chilies is important,12-20-2017 08:46:19,59687,0.93
49,Logic is for losers....,09-23-2017 04:45:08,59561,0.92
50,you ever walk your birds?,01-11-2020 10:02:50,59304,0.92
51,This skin graft was taken from my groin when I was a baby. I been WTFing since puberty.,06-29-2017 22:52:36,59218,0.91
52,Discovering a rattlesnake den...in your backyard.,02-06-2020 07:13:25,59206,0.96
53,Imagine in 1862 during the civil war and in the middle of the night you hear a gun shot and your wife says what’s that and you say oh that’s the rat trap,05-03-2020 10:57:04,59046,0.96
54,Fahaka puffer feeding,08-09-2018 13:52:21,58826,0.93
55,Dude asleep at the wheel of his Tesla on the interstate,03-05-2019 15:32:55,58803,0.9
56,How is this bug even still alive?,06-16-2020 15:42:41,58781,0.9500000000000001
57,Guy is not strapped in to the hang glider,08-21-2020 12:43:10,58767,0.9400000000000001
58,Can't believe they even attempted this,04-03-2018 13:46:44,58702,0.92
59,My university is burning 20 minutes into New Year,12-31-2020 11:12:09,58690,0.9500000000000001
60,Yeet,02-08-2020 15:22:48,58366,0.9500000000000001
61,Oregon fires next to a golf course.,09-05-2017 15:59:42,58221,0.9500000000000001
62,Prisoners in Ecuador sealed up and flooded with tap water one of their prison yards so they‘d have their own swimming pool in the high temperatures.,03-04-2020 06:28:05,58166,0.9500000000000001
63,I did not have this on my apocalypse bingo card,09-11-2020 21:20:04,58041,0.96
64,Public television in Germany. Wait for it.,11-01-2019 10:16:46,58004,0.93
65,No filter. A motel in NSW Australia in middle of the day.,01-03-2020 21:57:37,57804,0.96
66,Amputee plays prank by chasing people,02-09-2019 17:13:57,57627,0.88
67,ants trying to steal my mail,07-09-2020 09:35:11,57609,0.97
68,Guy stuck under moving train escapes between its rails,11-05-2020 21:18:45,57591,0.9400000000000001
69,27 contact lenses were found by doctors in woman's eye,03-11-2019 10:19:45,57470,0.93
70,I sat on that toilet for about 10 or 15 minutes. After I flushed I noticed this.,12-14-2019 12:54:38,57418,0.9400000000000001
71,Rabid coyote showed up at this guy’s front door.,11-25-2018 18:33:48,57133,0.9400000000000001
72,Breaking into a piano shop,03-13-2019 13:39:41,57016,0.9500000000000001
73,what the fuck,01-08-2019 21:24:49,56989,0.92
74,Just a casual day out fishing for salmon.........,07-30-2020 17:33:55,56768,0.9400000000000001
75,A normal night in an english pub,02-22-2018 07:39:50,56764,0.93
76,3 kids floating down a river on ice,04-12-2020 10:08:56,56753,0.9500000000000001
77,"This lady I drove past earlier today: Cranford, New Jersey",01-03-2019 15:52:13,56688,0.93
78,"I filmed the takeoff because I wanted to see the new ""deploy cowling"" feature these new planes have",07-24-2020 16:20:20,56643,0.9500000000000001
79,When Thor Wields the Mjolnir,03-21-2020 08:11:05,56619,0.9400000000000001
80,Raising anchor of your oil tanker only to realize you've hooked an unexploded torpedo,01-31-2019 07:37:29,56573,0.9500000000000001
81,My wife and I are selling our home. This man came to our open house to put my underwear (men’s) down his pants.,11-02-2018 19:54:14,56534,0.9400000000000001
82,How to set your house on fire,03-08-2018 20:36:49,56501,0.9400000000000001
83,How to steal an ATM.,04-20-2019 08:20:37,56269,0.97
84,On the next episode of Dirty Jobs...,12-29-2019 11:13:39,55905,0.96
85,Day #2 of quarantine and someone is riding around Milwaukee in a porta potty,03-18-2020 14:03:08,55463,0.96
86,Cool,11-04-2018 21:23:54,55417,0.9400000000000001
87,Prehistoric spider-like arachnid found preserved in amber,02-07-2018 09:02:51,55308,0.92
88,Wild Hamster Knows Kung Fu,01-11-2019 13:16:57,55301,0.93
89,Remember the video of the bear encounter in Mexico? The girl actually took a selfie,07-20-2020 11:43:34,55149,0.9500000000000001
90,"This man randomly rides into the mayor, who was giving an interview",06-26-2020 08:54:30,55003,0.96
91,2020 got birds doing crack,07-31-2020 19:23:43,54870,0.92
92,Some focus group told some ad agency that this would sell jeans.,11-01-2020 19:15:21,54837,0.93
93,House across my street blew up and my house almost caved in,09-28-2020 21:15:11,54782,0.96
94,Enormous wave from iceberg!,01-10-2021 19:18:42,54752,0.9500000000000001
95,Puppy and the Technicolor Vomit,07-28-2017 18:41:29,54751,0.9
96,I’m a contractor. Bought an abandoned/foreclosed home to renovate. This was in the basement bathroom. What. The. Fuck.,06-10-2020 18:31:20,54738,0.9400000000000001
97,👁️wtf👁️,11-21-2018 08:27:22,54626,0.88
98,Missing death by inches,10-12-2019 07:59:46,54486,0.96
99,This decapitated Wasp cleaned it's wounds before flying away with it's own head,04-07-2020 14:14:46,54470,0.9400000000000001
100,So this lizard moved into my microwave clock. I guess it's his now?,09-09-2019 11:23:49,54423,0.96
101,Lightning bolt showers the street with sparks,05-13-2017 11:12:19,54263,0.93
102,This monitor lizard,04-07-2021 10:25:51,53953,0.9500000000000001
103,Fiat had a test track on their factory rooftop in 1929,12-05-2018 21:05:34,53948,0.91
104,Dressed chicken.,01-11-2018 09:50:39,53910,0.88
105,Trying to catch who’s been stealing the chickens...,06-20-2018 13:51:39,53812,0.91
106,Coconut crabs are attracted to the smell of food.,12-04-2020 14:51:33,53335,0.96
107,Seagull enjoying a light lunch,06-23-2020 22:41:49,53010,0.96
108,"It's doomsday in Rubio, Mexico",05-31-2017 11:40:52,52889,0.9
109,Potholes are dangerous,11-21-2019 08:46:00,52864,0.96
110,Pakistan is on another level,05-02-2021 07:55:49,52762,0.93
111,I’m not sure what’s going on.,07-12-2018 12:38:20,52726,0.9400000000000001
112,Got to love Japan,03-21-2018 12:05:09,52675,0.85
113,This cemetery fire from yesterday looks like a horror movie's climax,05-10-2017 14:47:46,52608,0.93
114,I have tentacles under my tongue- apparently not everyone does?,02-26-2019 10:59:45,52591,0.88
115,Waking up to a strange pain,06-13-2018 01:11:44,52495,0.9400000000000001
116,"A tornado overnight in Thomaston, Georgia, ripped a home off its foundation and put it in the road",04-13-2020 10:24:57,52485,0.96
117,So I was spraying the weeds near my mailbox and saw something move in the culvert.,02-25-2019 19:38:17,52413,0.93
118,This SUV broke the sound barrier.,08-27-2017 09:10:48,52396,0.89
119,What the actually fuck,02-24-2020 12:56:08,52293,0.9400000000000001
120,"Went in for teeth cleaning last month & mentioned a numb feeling in a tooth- I was shocked to find a tumor eating my jaw bone. This photo is my [OC] CT scan. Biopsy surgery results were non-cancerous, thankfully. It’s been a real WTF month.",04-12-2019 18:32:46,52295,0.97
121,Game of Thrones stuntmen are crazy,08-07-2017 17:47:22,52267,0.9
122,Only In Australia,03-30-2019 04:27:33,52190,0.9500000000000001
123,New York,09-11-2019 10:44:50,52109,0.9400000000000001
124,Highway robbers take shots at a moving truck - driver does well to keep it steady!,10-11-2020 15:15:41,52087,0.96
125,Hitchhiking,11-20-2017 09:04:15,52031,0.85
126,One lucky guy,06-24-2017 21:18:56,51986,0.89
127,Putting your hand in front of a loaded and pulling the trigger to see if it still fires.,07-03-2018 09:15:49,51921,0.92
128,This man saves a calf from the grasp of death,11-04-2020 15:16:43,51847,0.96
129,Someone dropped a concrete block from a high-rise building and missed their target,04-22-2017 08:15:24,51736,0.93
130,What are the odds of this happening,02-21-2019 10:52:31,51726,0.89
131,"Poor Cambodian guy was trapped like this for four days after slipping while alone in the jungle. After finding him, it took ten hours of chipping away at the rock to free him. He's alive and now recovering in hospital.",08-08-2019 03:51:45,51682,0.96
132,The hell is going on here,11-17-2020 11:42:23,51546,0.88
133,This structural pole my boss refuses to fix,01-01-2019 15:57:47,51482,0.9500000000000001
134,Elevator begins to ascend while the passenger is entering it,05-06-2020 07:41:25,51298,0.96
135,Drone captures a man sun bathing on a wind turbine with no harness on,09-09-2019 00:08:47,51168,0.93
136,Secret recording device under break room table at work.,09-03-2017 15:52:41,51074,0.91
137,Is this the bus to the morgue?,02-14-2019 19:03:41,50994,0.92
138,He got a little too close.,01-15-2018 15:22:36,50951,0.91
139,Absolute Chaos,11-11-2019 03:18:24,50922,0.9400000000000001
140,My Venus Flytrap uses all its energy to make 200 mouths instead of growing big.,10-31-2019 20:49:37,50880,0.96
141,Yank That Plank,08-03-2020 20:06:39,50790,0.93
142,Rome yesterday,02-22-2018 18:52:38,50773,0.9400000000000001
143,Well that’s one way of doing it,01-14-2019 14:43:46,50732,0.87
144,This guy has an interesting method for taming bulls,11-08-2020 06:26:15,50718,0.92
145,No time to lose,08-08-2018 07:23:44,50710,0.9500000000000001
146,Calcium buildup in this water pipe we had to replace,12-02-2018 21:12:17,50529,0.9400000000000001
147,"Took a shower before work today, looked down to grab a bottle of shampoo and see this!",08-21-2018 09:19:25,50467,0.93
148,Friendly local LION,12-15-2018 17:29:23,50465,0.9
149,I was driving through the back roads of Pennsylvania on the way to a camping spot and found a mountain of ceramic dishes and tea cups in the middle of the woods!?....,02-26-2019 23:33:55,50397,0.9400000000000001
150,Tornado decimates school gymnasium,03-09-2016 10:52:45,50282,0.92
151,Trust Issues,05-22-2018 07:08:29,50275,0.9400000000000001
152,Guy found a glass eye embedded in the rock at a beach,10-31-2019 05:08:15,50199,0.9
153,Knee pad catches small splinter,12-09-2019 18:30:55,50165,0.9500000000000001
154,$5000 Canadian after someone using the microwave to disinfect it,04-11-2020 23:10:43,50096,0.9500000000000001
155,"I'm no expert, so don't quote me on this, but I'll go ahead and say... This is NOT how an electric shaver is supposed to work:",07-27-2018 12:55:54,49995,0.92
156,This absolute unit of a croc,08-10-2020 10:14:43,49813,0.9400000000000001
157,New Dash Cam Angle Of Failed Heist Shows Prinsloo's Epic Driving Skills,05-06-2021 23:37:29,49811,0.9500000000000001
158,Russian guy finds grenade zip-tied to his wheel (close-up in comments),04-20-2017 09:00:56,49766,0.9400000000000001
159,Don't play with fireworks,01-16-2018 07:56:55,49672,0.92
160,I see movement ahead,02-18-2019 07:00:18,49656,0.93
161,So turns out humans can control gnats with sound...,06-12-2020 20:52:27,49624,0.9500000000000001
162,"Unexplained explosion currently happened in Beirut, Lebanon",08-04-2020 11:25:13,49619,0.9500000000000001
163,Maybe i should’ve closed the window.,08-02-2020 12:32:24,49586,0.96
164,....and he accomplished nothing.,01-21-2018 09:18:26,49557,0.86
165,"Sir, there's something in your lips!",10-23-2019 17:21:07,49540,0.92
166,Ceiling's water broke,09-15-2020 14:43:09,49476,0.9500000000000001
167,How the hell do you explain this?,08-09-2017 10:39:03,49424,0.87
168,Sometimes people stop in the middle of a conversation to stare at my eye. Wonder why.,11-27-2019 07:12:56,49333,0.93
169,This power line happened to be laid straight through the skull of an Anglo Saxon woman buried in a previously undiscovered 6th century graveyard.,05-17-2020 00:27:45,49328,0.96
170,"Just ""one"" beer",12-23-2018 10:55:54,49324,0.9
171,Side ways down Sesame Street,09-03-2020 17:42:53,49318,0.9400000000000001
172,Wait for it,03-11-2018 13:33:29,49308,0.81
173,A rather “rural” patient came in with new-onset seizures. CT reveals small metal pellets in head. Patient states his wife accidentally shot him several years ago while trying to get a raccoon off their property.,03-28-2019 06:02:00,49296,0.96
174,Swimming pool during an earthquake,05-26-2017 17:32:35,49232,0.92
175,Pentagon declassifies footage of UFO’s caught by US Navy pilots 2004-2015 in order to dispel any stigma around reporting sightings by pilots,04-27-2020 19:37:07,49113,0.9400000000000001
176,"Migingo Island, population of 131, only 0.0008sq mi of dirt",01-14-2018 13:03:01,49039,0.92
177,"Don't mind me, just checking some of your configurations",01-25-2019 14:48:02,49026,0.9400000000000001
178,This mf rooster,03-19-2017 06:40:18,49014,0.9400000000000001
179,I definitely said wtf out loud.,09-23-2020 15:31:37,48930,0.92
180,Cheetah chase in traffic,05-19-2020 08:40:05,48930,0.9500000000000001
181,Just found a random video of 2011...,03-05-2021 08:08:43,48860,0.9
182,Did you know snakes fart like humans,07-24-2019 11:52:37,48838,0.93
183,Something to think about the next time you eat at the salad bar.,10-26-2018 19:54:25,48807,0.9400000000000001
184,Luxembourg yesterday,08-10-2019 10:22:46,48748,0.97
185,oh shit,09-15-2018 05:10:49,48688,0.92
186,Found this clown mannequin half a mile deep into a drainage pipe tied like this to a grate.,10-26-2020 08:43:22,48686,0.91
187,Houston Man Goes Fishing In His Living Room After Hurricane Harvey,08-28-2017 14:24:03,48563,0.89
188,"My sisters train derailed, she just sent me this",02-20-2020 05:00:57,48495,0.9500000000000001
189,Saharan sand from Africa covering snow in Europe,02-06-2021 14:31:35,48471,0.96
190,My girlfriend sent me this from her doctors appointment.,02-29-2020 14:42:46,48379,0.93
191,Studio apartment... no thanks,08-31-2018 12:07:49,48327,0.93
192,People forget how to drive along I-70 today during snow storm.,02-16-2019 00:24:41,48318,0.92
193,Snake regurgitating eggs after it found it couldn't slip back into its hidey hole with them.,06-25-2018 22:00:27,48327,0.92
194,Dumb people get lucky,12-06-2018 10:04:51,48319,0.93
195,"Tonight, We Dine in Hell!",05-09-2018 08:35:52,48172,0.91
196,Massive electrical sparks fly across power lines in Louisiana as dangerous weather batters the region.,02-15-2021 14:47:38,48121,0.96
197,OSHA has left the chat,07-08-2020 18:31:28,48108,0.9400000000000001
198,"Tick season is here, make sure to check every spot!",04-08-2020 11:42:56,48060,0.96
199,The End Is Near,03-11-2020 23:16:00,47993,0.92
200,Fire funnel spotted in the bushfires currently burning in Australia,12-07-2019 05:22:58,47964,0.96
201,"Chill bro, it's just a prank",10-12-2017 10:00:12,47865,0.85
202,Butthole accidentally broadcast live on Brazil TV [NSFW],02-26-2017 11:29:01,47828,0.86
203,"Move to Hawaii, they said, it’s paradise, they said",08-01-2018 03:30:00,47775,0.92
204,A guy comes back from work to find this in his living room,04-20-2021 12:39:21,47769,0.9500000000000001
205,Some Mad Max shit right there,04-14-2019 14:21:24,47743,0.9400000000000001
206,This fish ate all the goldfish’s eyes,12-05-2018 08:49:21,47721,0.88
207,Don’t crowd surf where killer whales play...,07-19-2018 07:10:24,47721,0.91
208,"Daytime in São Paulo, Brazil. Locals are describing this as the Apocolypse as they witness the largest rainforest fire in history.",08-21-2019 20:47:10,47694,0.96
209,Just bale,07-09-2017 12:14:05,47675,0.85
210,"Stopped cause I thought my tire popped, but i'm pretty sure someone tried to murder me.",03-13-2017 10:11:59,47616,0.8200000000000001
211,Legged robbery,05-25-2020 19:25:01,47600,0.96
212,Hey Tim...can I get a hand here?,01-13-2018 17:18:18,47535,0.92
213,This will happen if you look directly at the sun through a telescope,10-06-2019 12:22:04,47513,0.9500000000000001
214,This dude did a 360 on the horse's back wtf,02-03-2020 11:27:34,47469,0.93
215,A woman does the limbo dance under a pickup truck,05-28-2020 07:41:58,47427,0.89
216,....So now you all know why we don't invite Wendy to the Christmas party anymore.,12-13-2019 15:08:25,47432,0.92
217,Tumbleweeds take over a town,11-28-2018 07:29:32,47419,0.9400000000000001
218,1952 Testing bullet proof glass,10-30-2018 07:53:50,47390,0.9400000000000001
219,Valet parking.,01-20-2018 07:57:41,47381,0.91
220,2 minutes for head chopping.,02-17-2019 17:41:22,47383,0.93
221,The end of times,03-19-2017 18:23:27,47312,0.88
222,Lightning striking a plane wing (xpost from thatsinsane),03-06-2020 07:08:01,47292,0.9500000000000001
223,Fell asleep in the bath. Finger brains.,04-14-2018 16:58:47,47210,0.87
224,"Flash flood after the Bighorn Fire in the Catalina Mountains, Tucson, AZ",07-16-2020 17:29:48,47190,0.96
225,Rattlesnakes can swim btw,08-02-2020 23:59:13,47077,0.91
226,Russian prisoner escapes cell through small food door,08-30-2019 22:43:58,47000,0.96
227,Parking tons of cars on a ship in a storm,10-16-2020 15:48:07,46983,0.92
228,I killed a cockroach and a parasite came out,02-26-2020 11:12:17,46974,0.91
229,When you don't respect the recoil of a high calibre gun,07-06-2017 10:56:04,46969,0.89
230,a strange phenomenon where the sky turns red happened in Indonesia,09-21-2019 06:48:08,46926,0.9500000000000001
231,You're not taking this grandma's purse.,03-03-2020 10:05:34,46912,0.93
232,A guy at JFK was caught trying to smuggle 70 finches inside hair rollers in a duffel bag,12-13-2018 15:42:34,46843,0.9400000000000001
233,Keep your enemies close,08-20-2020 03:07:58,46785,0.92
234,This 1950s Newsreel where Louella Gallagher Throws knives at kids. Pfff... Health and Safety...,08-18-2020 09:05:40,46756,0.96
235,Pug's skull,10-04-2019 07:55:43,46701,0.9400000000000001
236,"No clue what’s going on, but pretty sure it’s offensive to Italians",09-01-2019 14:35:44,46692,0.9
237,When it's not quite your time,03-11-2019 18:20:21,46688,0.9400000000000001
238,One of the unspoken (and worst) parts of flooding...when the coffins rise from the ground,09-09-2018 12:14:17,46669,0.93
239,The wheel on the truck goes bam bam bam,02-12-2020 11:26:29,46663,0.96
240,Training for the Darwin Awards,03-08-2018 09:59:59,46661,0.93
241,"What, exactly, was the sequence of events that led to this?",05-13-2020 10:52:32,46649,0.9400000000000001
242,"""oktoberfest""",07-06-2020 09:24:10,46660,0.9400000000000001
243,"Found in Downtown Fresno, CA. Someone covered a Geo Metro with Pennies. Possibly doubled the value of the car.",11-13-2020 11:47:58,46622,0.93
244,the white part of my eye sweled today because of my pollen allergy,05-26-2020 15:53:51,46572,0.91
245,"Oh, let me just park my FUCKING SQUID",12-14-2018 15:55:15,46570,0.88
246,A customer just gave me this cactus flower as a thank you. Then told me not to touch it because it will sting me and not to smell it because it smells like rotting flesh.,10-26-2018 09:34:55,46563,0.93
247,The head of a Wolf Eel can still bite and poison you after it’s been decapitated.,11-04-2019 15:59:42,46563,0.92
248,burning car! quick! let's call the firefighters!,09-17-2019 08:12:32,46519,0.96
249,"Can’t decide how to feel about this, but definitely WTF material.",09-22-2020 10:28:49,46504,0.88
250,"Someone made a Photorealistic Sculpture of Dickbutt, and it's horrifying.",01-09-2017 12:49:11,46491,0.8300000000000001
251,Robert Bobroczky 7' tall at 12 years of age,04-15-2018 19:15:46,46485,0.89
252,crazy pussy,12-21-2019 09:00:42,46443,0.9400000000000001
253,Using your time efficiently,02-09-2019 07:50:44,46438,0.92
254,Removing an underground wasp nest,07-27-2019 10:45:15,46389,0.9500000000000001
255,How the fuck did that happen? Hong Kong after the storm 2 days ago.,09-18-2018 10:39:02,46395,0.93
256,Pedals? Where were going we don’t need pedals!,11-14-2018 08:29:47,46359,0.8
257,"Shoplifting Ant, Steal Diamond From Jewelry Store",08-12-2018 16:56:16,46333,0.9
258,Think twice before you push someone's head into cakes,02-26-2021 20:08:29,46334,0.93
259,Never dump your pet gold fish in the wild. They are invasive species and they multiply like crazy!,09-01-2018 09:16:38,46181,0.92
260,Some guy was selling an old fridge full of Jurassic Park SNES cartridges for $1500 on eBay.,04-06-2019 16:46:02,46139,0.93
261,"My friend in Brazil had to end the call we were having because a shootout just started. I didn't believe it, so he sent me this selfie of him",05-30-2017 01:27:21,46139,0.93
262,Catching a Deer with an Eagle!,09-09-2020 17:23:01,46080,0.9400000000000001
263,"""Mom! The vultures are being creepy again!""",10-14-2020 15:16:05,46056,0.9500000000000001
264,The local ABC news network in Alabama shared this user submitted image of enormous hail from last night.,03-20-2018 07:25:49,46055,0.91
265,Hairless horse,03-03-2019 19:14:42,46030,0.9
266,Somewhere in Kenya,05-02-2020 04:24:08,46018,0.96
267,"Yes sir, it's stock",10-27-2020 07:47:17,45967,0.92
268,A bear chasing a skier,01-24-2021 17:39:18,45911,0.9400000000000001
269,I think this guy hates balloons,08-12-2019 12:34:38,45846,0.9
270,Just buying some sugar in a supermarket.,08-17-2017 07:01:24,45830,0.92
271,How much bass you want? yes,01-11-2021 07:47:14,45810,0.9400000000000001
272,Hyper Realistic Mask to be sold in Japan,01-15-2021 15:10:19,45776,0.91
273,That’s some weird looking puke,09-19-2020 01:56:06,45751,0.9400000000000001
274,This monster of a tick that was crawling across the floor (lego for scale),05-03-2021 14:36:49,45702,0.93
275,My friend works at a landfill and uses trained hawks to deter the swarms of gulls. The hawks occasionally bring back gifts..,05-12-2020 15:56:57,45664,0.9500000000000001
276,This yard was turned into a war zone due to a massive hail storm,02-17-2021 19:04:03,45660,0.9500000000000001
277,logging is dangerous work,03-31-2018 17:29:37,45656,0.93
278,Wouldn't happen again in a million years.,12-04-2019 09:22:20,45634,0.92
279,My dad cleans out hoarders homes after they pass away. He discovered this collection under all the trash.,01-17-2021 17:57:07,45620,0.93
280,Hoarding Level: Pro,07-18-2018 05:50:44,45530,0.92
281,Guy casually pets his super pissed off caracal.,02-28-2019 23:44:28,45526,0.92
282,Cobalt blue tarantula,11-14-2018 22:58:13,45369,0.86
283,Millions of fire ants floating in flooding from Harvey,08-31-2017 09:33:44,45356,0.92
