idx,title,created_utc,score,upvote_ratio
601,Unforgettable birthday,08-26-2018 09:58:14,39055,0.91
602,Just couldn't wait for the next one,07-19-2018 15:26:25,38997,0.93
603,"""Festivals are trash""",07-25-2018 12:02:03,38976,0.91
604,This Official City of Zurich (Switzerland) Tourist Information Display in (Hard Core) Action...,02-10-2021 06:11:54,38966,0.9400000000000001
605,A Cruise ship caught in huge waves and 120MPH winds. View from the third deck.,04-04-2021 11:32:49,38961,0.97
606,"""A little more to the left... Alright! Smile and say F3!""",12-18-2018 14:49:07,38949,0.91
607,How is that even possible?!,09-08-2017 08:18:17,38954,0.9
608,Life in a 60 square foot apartment flat in Hong Kong,05-06-2017 12:21:17,38933,0.85
609,"My parent’s cat Prince lost his nose a few years ago to skin cancer and I think he looks a bit like Voldemort now, and has a similar attitude...",12-23-2017 14:34:24,38922,0.84
610,this is fine,02-27-2019 19:10:08,38883,0.93
611,Surfer after riding waves in Lake Superior during polar vortex.,02-03-2019 10:14:42,38886,0.91
612,This road in Mexico,08-24-2018 17:19:25,38870,0.93
613,Man headbutts another man after touching his back.,09-23-2019 11:41:06,38868,0.9400000000000001
614,Car robbery ATTEMPT caught on camera.,07-15-2020 20:05:51,38836,0.96
615,Jumping a sand dune,02-07-2017 16:03:21,38828,0.87
616,He's just exterminating some poor ants.,10-19-2019 14:37:08,38813,0.92
617,Chicken walking like a duck.,12-29-2019 21:22:07,38812,0.93
618,Just wait.,10-30-2019 07:22:54,38802,0.91
619,Holy fuck,10-06-2018 08:14:21,38773,0.91
620,"Whatever this is, I wouldn't want to encounter it",10-17-2019 15:41:28,38755,0.93
621,Oh god it came true,10-01-2018 05:07:23,38743,0.9500000000000001
622,"You mean, this wasn't supposed to happen?",01-13-2021 02:22:51,38720,0.92
623,Lightning struck this fishing rod,07-23-2017 15:02:11,38713,0.92
624,Wait For It...,10-31-2016 13:18:39,38679,0.86
625,This girl who poured 3 jugs of rice in my driveway at 1AM,06-26-2018 16:20:07,38648,0.92
626,A perfect example of how NOT to tow a vehicle.,09-07-2019 08:02:30,38617,0.9400000000000001
627,Who needs a wrench when you have Superman shins?,09-23-2018 10:28:15,38599,0.88
628,How actually did this sneaky snake got there?,10-24-2020 09:02:09,38582,0.91
629,Wouldn't just fixing the AC be easier and cheaper?,05-31-2019 08:12:00,38582,0.93
630,Wave breaks through restaurant,04-16-2021 05:45:15,38513,0.9500000000000001
631,This tank ain't big enough for both of us,03-07-2018 08:27:48,38466,0.87
632,"""A"" rating from the health inspector.",01-04-2019 15:45:08,38383,0.93
633,He looks so relieved.,10-22-2017 08:58:56,38342,0.89
634,Tree in a graveyard hit by lightning.,09-06-2019 09:50:30,38331,0.93
635,Making out with an iguana...what can possibly go wrong,01-18-2018 23:27:43,38311,0.85
636,"Well, the well was unwell and now it’s not well. Well it didn’t end well.",08-06-2020 12:04:34,38266,0.89
637,"I thought there was a little dirt in these pipes, that clearly wasn’t the case.",04-19-2020 17:04:38,38218,0.96
638,"My town has major plumbing issues, I've seen 3 or 4 similar incidents in the past 2 years.",05-26-2019 20:48:10,38192,0.96
639,I was told this would fit here. A one-eyed donkey with two pupils in the only existing eye.,09-14-2018 13:26:09,38194,0.87
640,They look so relaxed,02-03-2020 01:37:49,38182,0.96
641,That was really close.,11-05-2019 17:32:48,38132,0.9500000000000001
642,Merica,11-27-2019 22:56:39,38119,0.85
643,This woman survived her head getting caved in by a wooden chair that fell 12 floors,09-26-2020 12:06:09,38120,0.9500000000000001
644,"Mice rain from the sky as a farmer cleans out his silo, as ""horror"" rodent plague takes hold of NSW, Australia.",05-12-2021 16:36:36,38098,0.9500000000000001
645,Tokyo drift vibe,09-19-2020 10:44:53,38089,0.97
646,My grandma had no idea she had a sewing needle in her foot. No telling how long it’s been in there. Skin was healed. It finally started rejecting yesterday and she had emergency surgery.,12-09-2018 20:47:34,38078,0.93
647,Just cleaning out the car,04-18-2018 09:11:23,38070,0.9
648,Russian missile launch,10-10-2017 08:52:15,38052,0.88
649,Hailstones causing locusts to drop dead out of the sky like rain,02-21-2020 14:29:12,38031,0.97
650,Carbonice,01-30-2017 14:45:44,37994,0.88
651,Whats the worst that could happen on a tight rope with no gear...,05-01-2019 20:47:16,37991,0.93
652,"Well, he's dead. Might as well just close this",08-03-2019 13:49:32,37936,0.91
653,Rafting,09-20-2017 07:08:25,37915,0.87
654,Guillotine on the roof of a building in NYC,10-18-2018 07:34:20,37921,0.92
655,Just about to enjoy this nice day...,03-01-2018 06:49:44,37910,0.92
656,Paint container fell off truck and completely blasted this Jeep.,10-03-2019 20:39:21,37899,0.96
657,This rabbit seems to be broken...,06-22-2017 09:25:35,37884,0.84
658,Well... the race is over...,12-26-2017 07:26:18,37870,0.9
659,Eels and duck want a snack,04-12-2018 17:50:51,37873,0.91
660,"My aunt is trapped in Merimbula, NSW. This was the sky there at 9am",01-04-2020 22:42:39,37852,0.9400000000000001
661,Woman has 4 balloons implanted so a dangerous birthmark can be removed and replaced with the expanded skin,05-24-2019 11:35:31,37854,0.93
662,Bombardier Beetles Spray Boiling Acid (212 degrees F) as a defense mechanism against predators.,08-12-2020 06:08:03,37852,0.96
663,Digging for fish - WTF,02-06-2017 15:39:08,37844,0.89
664,When you lose your thumb in an accident and replace it with your big toe.,02-18-2018 09:10:36,37839,0.88
665,Taxi driver in Beijing,01-26-2020 05:21:43,37829,0.9400000000000001
666,Driving through an airport,05-29-2017 08:48:59,37819,0.89
667,My dad backhanded a fly and it’s head fell off.,11-23-2018 16:25:05,37814,0.91
668,"WELL, WTF.",05-29-2019 11:48:18,37786,0.89
669,Who says you have to get out of bed to go fishing?,01-02-2020 02:13:15,37782,0.9500000000000001
670,I’ll save you baby,02-02-2019 08:17:26,37776,0.9
671,yes,06-11-2020 20:55:36,37778,0.9
672,"Inverness, FL is a strange place",12-29-2017 11:45:42,37763,0.93
673,A bomb fell of a landing fighter airplane and kept going,03-15-2019 04:54:10,37734,0.9500000000000001
674,Currently renovating our floors. Seems everyone has come out of hiding.,01-15-2018 05:26:01,37712,0.87
675,My Reddit secret santa gave me a dead rat,12-23-2016 12:01:31,37710,0.89
676,So there's this pigeon at my bus stop. It's been like this for 2 weeks.,07-16-2020 05:05:21,37697,0.9500000000000001
677,We’re going on a trip in my favorite rocket ship,05-22-2020 22:15:14,37674,0.9400000000000001
678,Newborn kangaroo kind of looks like a parasite,08-09-2019 15:28:46,37660,0.9500000000000001
679,Always the last place you look.,08-24-2016 12:30:30,37661,0.89
680,casual fishing day,08-11-2020 13:19:39,37650,0.96
681,The new King of Thailand,10-14-2016 06:45:08,37626,0.91
682,Indicators,08-26-2019 15:00:16,37620,0.9500000000000001
683,Kid tries to smuggle himself on a jet.,07-01-2020 07:56:13,37596,0.96
684,"reject humanity, return to monke.",01-14-2021 13:49:16,37595,0.89
685,Kids don’t play outside like they used to anymore,11-17-2019 13:33:55,37587,0.9500000000000001
686,What Could Go Wrong If We Watch The Waves?,12-02-2020 20:55:57,37581,0.9500000000000001
687,Porch pirate slips and breaks leg.,01-26-2018 23:29:50,37569,0.9
688,A plane engine went hurling into my neighbor's house after a crash,05-12-2018 12:26:46,37570,0.9400000000000001
689,Sitting next to a Panda's cage,01-25-2021 07:03:00,37551,0.9400000000000001
690,IED harvesting season,12-13-2018 07:29:22,37537,0.81
691,Bodyshops hate him for this one simple trick,01-28-2019 21:17:37,37532,0.87
692,"""That was a close one, we almost missed our exit""",04-07-2018 09:13:00,37527,0.88
693,Macaque is huge,11-30-2018 07:27:59,37470,0.91
694,This two headed dolphin,08-14-2020 18:38:11,37464,0.9400000000000001
695,People live in this house. These are their lights 24/7,12-16-2019 18:51:29,37451,0.9500000000000001
696,Hindsight is 20/20,11-09-2016 09:29:20,37450,0.81
697,I don’t like it,08-25-2019 17:27:46,37415,0.89
698,Blindfolded racing,11-03-2017 19:05:47,37403,0.92
699,Going for a windy drive,01-27-2018 09:31:11,37358,0.93
700,Will the balcony resist the weight?,06-19-2017 14:47:40,37359,0.9
701,Insurance scam gone wrong,01-06-2018 08:55:59,37354,0.91
702,"Millipede with half body missing and dried entrails dragging behind, still alive and moving ~~",10-10-2020 10:25:18,37312,0.9400000000000001
703,Just a normal storm in Canada,03-06-2021 03:43:37,37300,0.92
704,The size of this huntsman spider,12-16-2019 08:42:25,37293,0.9
705,Classic brazilian driver,10-26-2019 14:40:47,37292,0.92
706,"Earlier today a deer decided to jump into the flood waters in downtown Louisville, KY",02-26-2018 20:50:05,37265,0.91
707,Get out of traffic kit,09-30-2018 19:58:38,37246,0.84
708,store clerk using flame thrower to fight off robbers.,05-09-2016 16:18:24,37237,0.92
709,Snake inside the car,05-23-2017 15:16:51,37236,0.8
710,It's either a really fast train or completely useless barriers,10-05-2017 01:11:52,37224,0.9400000000000001
711,Sitting at a traffic light,05-06-2018 11:24:08,37200,0.9
712,The amount of McDonald’s coffee cups in this persons back seat,10-21-2018 19:53:50,37178,0.92
713,Mother of all hot boxes!,04-27-2019 04:52:04,37171,0.89
714,A Southern Cassowary claw. Just in case you didn't think that birds are dinosaurs,12-03-2019 00:47:15,37147,0.9500000000000001
715,The Goat,03-30-2020 06:41:55,37137,0.92
716,When you have fuck you money.,02-14-2018 16:03:35,37143,0.84
717,Huge bird,06-18-2019 11:01:21,37117,0.91
718,Chickens are omnivores and cannibals,10-11-2020 02:42:57,37093,0.9400000000000001
719,Driving through a road hazard,10-29-2018 10:03:18,37087,0.9400000000000001
720,The methane in my buddies well water,02-13-2019 06:27:58,37079,0.9500000000000001
721,Always check before putting on a pair of gloves,10-31-2019 12:40:35,37060,0.93
722,"42 feet up in the air with nowhere to run, I opened a light fixture and saw a wasp. I fogged the inside with wasp spray and closed it for a minute. When I opened it back up I realized I could have been killed.",03-04-2015 10:14:53,37044,0.91
723,What to do in Russia when you out of vodka and there is no bears nearby to fight,03-16-2021 14:43:22,37024,0.92
724,Riding on a TV,06-14-2018 09:42:42,37015,0.93
725,Tire fell off and bounces down an overpass.,12-07-2020 03:02:51,37009,0.9500000000000001
726,"Sinkhole opened in Cornish backyard, leading 300ft down into a medieval mineshaft",12-06-2019 13:53:18,37006,0.9500000000000001
727,"My son broke this chess piece decor I bought from Ross 5 years ago, this was inside..",07-30-2019 13:57:06,36995,0.93
728,Coronavirus victim being wheeled across the street,01-23-2020 14:37:25,37000,0.93
729,"Just another day in Houston, Texas",10-25-2018 21:59:09,36997,0.9400000000000001
730,Facial reconstruction on a child with Crouzon Syndrome,03-24-2018 14:19:11,36964,0.89
731,JESUS CHRIST!! What did I just watch?,01-31-2019 18:21:41,36911,0.85
732,No lighter no problem,11-15-2018 08:08:30,36906,0.92
733,Tornado on the road,08-09-2015 11:19:19,36899,0.9400000000000001
734,Dude are you serious ?,05-12-2019 09:15:11,36903,0.9400000000000001
735,Why monkey? Why?,10-01-2019 01:06:04,36872,0.93
736,I'll get them to their destination one way or another...,04-22-2018 05:56:37,36868,0.92
737,Fireworks factory explosion in Mexico,07-03-2017 08:52:13,36858,0.89
738,When two lightning bolts meet,02-07-2019 10:47:16,36848,0.88
739,Yeehaw Motherfucker,12-10-2016 08:52:14,36836,0.89
740,Ghost Rider,08-23-2019 12:00:47,36830,0.9400000000000001
741,Check your toilet before you poop,11-16-2018 06:32:25,36823,0.88
742,A few people have acrually said WTF when looking at my eyes,05-05-2020 20:43:35,36825,0.9
743,Deer hits cyclist in empty car park,04-23-2020 16:57:46,36820,0.97
744,OSHA want to know your location,02-24-2021 04:06:06,36779,0.96
745,Huntsman spider loses patience.,04-03-2017 17:45:38,36777,0.89
746,ET never made it home.,08-25-2018 06:15:47,36754,0.88
747,U.S.P.S Postman Delivers Mail in Santa Rosa,10-13-2017 09:13:29,36711,0.88
748,Don't change your car tire in the middle of a highway,04-27-2016 09:15:05,36706,0.93
749,The Bloodwood tree has dark red sap. It's like something from a horror film when being chainsawed.,02-12-2021 06:01:22,36657,0.9500000000000001
750,Man feeding a polar bear at his window.,01-20-2021 09:13:02,36651,0.9400000000000001
751,The Clathrus Archeri fungus resembles alien tentacles sprouting from an egg,06-12-2018 08:18:15,36635,0.93
752,This bus' creepy stick,06-23-2018 13:08:16,36628,0.91
753,Who said money doesn't grow on trees? Or rather in them,11-18-2020 11:12:25,36621,0.9500000000000001
754,Smoke From a Flare Exposes Deadly Pocket of Carbon Dioxide,01-22-2020 14:27:27,36609,0.9500000000000001
755,Parasite removed from fish,06-05-2018 15:42:32,36591,0.88
756,Friend found a bug in their Advil capsule,02-05-2020 22:26:49,36586,0.9400000000000001
757,Clearing out built up sludge in pipes,07-22-2017 15:02:19,36560,0.92
758,My great uncle lost his fingers in 1979 from a grain auger accident. He stored them in a plastic bag. We found them in a bin when we were cleaning out his house. Here they are for you all to see.,09-27-2017 16:17:35,36546,0.89
759,Not a good time for a fight.,01-25-2018 00:23:49,36534,0.88
760,The exhaust on this car.,03-24-2020 20:06:15,36522,0.9400000000000001
761,Russian truck drivers aren’t fazed at all when they crash into a river,03-12-2020 15:01:45,36520,0.9500000000000001
762,Cutting down this tree,03-18-2018 23:42:12,36516,0.89
763,Who knew raccoons hated Hannah Montana?,02-27-2021 20:34:27,36496,0.9400000000000001
764,The Giant Devil’s Flower Mantis looks like something that crawled out of hell,09-24-2020 16:59:20,36503,0.96
765,"Found this in the breakroom, so glad to see I'm not the only weirdo at work.",08-23-2017 15:34:55,36478,0.89
766,I did not expect that many cats,02-02-2020 14:26:36,36478,0.9500000000000001
767,Backing up,06-07-2015 15:29:18,36466,0.9400000000000001
768,WTF - only in Australia,09-15-2020 23:13:43,36464,0.97
769,"Safety first, Always wear a welding cap.",04-09-2018 10:37:18,36448,0.91
770,Meanwhile in Brazil...,02-10-2019 10:06:34,36422,0.91
771,Weeee,04-10-2018 06:54:41,36388,0.92
772,Meanwhile in Japan,07-08-2020 02:09:48,36386,0.9400000000000001
773,Two-Face,01-04-2018 15:36:34,36385,0.88
774,Bird strike in a single prop airplane equals a shattered windscreen,01-23-2019 04:11:03,36366,0.9400000000000001
775,Prosthetic nose.,04-10-2018 17:51:39,36367,0.87
776,"The speed and ferocity of the fires in nsw, Australia.",01-29-2020 05:09:08,36350,0.96
777,About 15 years ago I sealed a block of cheese inside this glass jar,10-16-2019 19:54:44,36351,0.91
778,Muy thai fighter suffered a skull fracture after elbow shot,12-15-2017 10:09:11,36298,0.88
779,Cave exploring is so peaceful and relaxing,04-30-2020 04:26:52,36288,0.96
780,I thought men only had this problem.,08-04-2020 22:30:54,36277,0.89
781,Thats an odd turn signal,09-25-2019 15:16:25,36269,0.9400000000000001
782,When you kick Superman,02-08-2019 18:46:47,36259,0.89
783,A new kind of baby shower,12-28-2018 06:57:07,36255,0.89
784,Spotted at the local antique store,07-13-2020 22:43:34,36249,0.92
785,B-but it works in the movies!,05-15-2018 05:57:58,36231,0.91
786,There’s no place like home,10-06-2020 21:55:31,36232,0.96
787,Alligator skin sensitivity,03-05-2019 01:57:56,36214,0.9
788,I'm here for my money!,05-09-2018 20:22:53,36203,0.92
789,When you love your shoes too much,01-23-2018 08:23:15,36199,0.9
790,Creepy clay man,06-21-2020 21:45:00,36176,0.91
791,Ghost Rider,11-08-2017 09:11:16,36172,0.88
792,Well this happened about an hour away from where I live.. wtf how,09-09-2019 21:31:59,36160,0.96
793,Seen in Sullivan County Tn,07-11-2020 21:06:35,36157,0.9400000000000001
794,Testing out how bulletproof layers of regular coats are,02-28-2019 17:24:57,36124,0.9400000000000001
795,There's always a bigger fish,06-24-2018 22:57:52,36118,0.87
796,Birds nesting in the skeleton of a dead pike,12-17-2018 07:51:36,36127,0.91
797,Weird sea bacon spitting white stuff out of the ass,05-02-2017 07:43:02,36114,0.89
798,"You wanna go high? Okay, so fasten your seatbelts",06-16-2018 09:54:37,36109,0.8300000000000001
799,Passion for taking pictures,05-24-2018 13:08:50,36100,0.8300000000000001
800,Street 'breathing' in Mexico during the earthquake,09-20-2017 22:22:29,36102,0.91
801,Sleepy turtle,04-12-2017 11:12:47,36085,0.86
802,The size of her bag!,08-18-2019 20:41:26,36049,0.91
803,In Russia no one gives a damn if you rob them.,05-14-2021 02:08:44,36043,0.9400000000000001
804,That is my worst dream,04-01-2018 09:09:30,36037,0.89
805,this was staring at me during my dentist appointment,05-17-2019 01:48:49,36034,0.93
806,This is a photo of a child’s skull shown with adult teeth waiting to protrude and replace baby teeth.,12-07-2018 14:58:38,36042,0.9
807,Summer in the South of Russia be like...,08-07-2020 11:14:47,36028,0.9500000000000001
808,The world's first double arm transplant recipient celebrates by picking his nose.,02-22-2021 09:24:09,36030,0.89
809,Rekt by the cold,01-13-2021 23:19:59,36035,0.92
810,It's not just a phase mum,03-27-2019 08:38:42,36022,0.89
811,"Giant Anaconda in the Amazon Rainforest , Brazil",08-29-2019 16:31:23,36014,0.92
812,"This was taken at 09:04 on August 17, 2018 in Prince George, BC. The smoke from the wildfires is so thick, it's blocking out the sun.",08-17-2018 12:35:27,35992,0.9400000000000001
813,Hi there,10-06-2018 17:39:35,35954,0.9
814,The boiler is running a little hot,10-30-2018 23:29:49,35935,0.9400000000000001
815,A man wrapped his truck around a light pole in downtown Tucson the other day. Dont drink and drive folks,12-27-2019 09:02:08,35889,0.96
816,I think its time to run away,05-06-2020 17:19:36,35880,0.96
817,Bear encounter in Mexico,07-18-2020 17:51:23,35855,0.96
818,Removing a Parasite from a Wasp,05-19-2020 14:48:38,35852,0.92
819,[NSFW] Meanwhile on primetime TV in Denmark,12-12-2017 09:27:54,35846,0.84
820,"Found this botfly larvae in my bed this morning. I had a wound I got from doing rodent research in Ecuador I thought was skin leismaniasis. Turns out I had a botfly, and the cold weather last night forced it out of my back.",05-31-2018 12:50:55,35855,0.89
821,9 AM at the Oregon Coast due to wildfires 100s of miles away,09-09-2020 01:16:21,35825,0.96
822,Just seems a little excessive...,09-11-2017 12:59:24,35820,0.88
823,Don't mess with Krampus,12-09-2019 08:58:01,35795,0.9500000000000001
824,Store clerk grabs baby as mother goes in to seizure,03-17-2016 23:25:56,35783,0.91
825,You know a deer is tough when it can walk around with a gunshot wound you can see through.,01-18-2019 02:18:07,35756,0.91
826,Umm wtf tho,04-20-2018 02:20:36,35751,0.91
827,Cashier fights off sword-wielding robber with BIGGER sword,03-22-2018 23:01:01,35723,0.91
828,The Golden Number,07-05-2020 09:04:48,35723,0.93
829,"On top of Corona, Egypt now has mass flooding, locusts, and hail.",03-13-2020 19:38:19,35720,0.97
830,"Due to a daytime worker with mental issues, hotel got its laundry piled up",09-30-2019 07:18:59,35710,0.93
831,A friend of mine went to an art exhibit in Germany last week.,10-04-2017 14:41:46,35700,0.86
832,In Russia accident survives you,10-22-2016 14:03:56,35700,0.91
833,Yeeh baby!,10-08-2018 05:33:26,35658,0.9
834,Every crazed gunman has a manifesto,02-17-2017 15:18:21,35656,0.9
835,Who wants to ride the town bike?,08-06-2018 07:43:57,35646,0.89
836,My partially artificial heart seen through my chest.,06-18-2020 22:05:12,35649,0.93
837,I clean out vacant houses. See sad stuff like this all the time.,07-15-2017 00:31:37,35638,0.9
838,Going up?,04-21-2019 07:20:54,35619,0.9400000000000001
839,"The right hand belongs to the Ukrainian Denis Tsiplenkov, the world champion in arm wrestling.",05-31-2020 16:42:39,35611,0.96
840,Well that's different,09-03-2017 04:50:22,35613,0.88
841,Eagle-like reflexes,03-30-2017 21:15:34,35593,0.89
842,Night shift brings skin surprise customer,03-26-2018 04:47:37,35583,0.8300000000000001
843,"Someone in Oregon caught this Ling cod, complete with a 'belly full' of octopus....",05-16-2021 06:03:46,35572,0.9400000000000001
844,Crew of Ethiopian Boeing 737 after being hit by swarm of grasshoppers opened the cockpit side window and cleaned the windscreen by hand at 8500 feet,01-17-2020 08:06:48,35561,0.9500000000000001
845,Turn on the lights......fuck,02-01-2017 12:57:58,35563,0.88
846,I guess it's a bit icy here in Minnesota,02-04-2019 18:38:59,35542,0.91
847,Special delivery!,12-17-2017 09:06:13,35543,0.9
848,U-turn on the highway from the right lane,02-10-2017 14:51:22,35537,0.91
849,When the aliens are done,11-25-2020 10:14:11,35530,0.96
850,Intentions were good. Results weren't.,06-25-2018 09:54:35,35533,0.9
851,Slolam anyone?,12-30-2017 15:07:22,35504,0.88
852,Man almost killed by giant mirror,09-20-2015 13:34:45,35500,0.9500000000000001
853,dancing with a shark?,07-04-2020 10:28:35,35476,0.9500000000000001
854,Now I'm not a vacuum expert but...,04-21-2019 15:07:12,35472,0.9500000000000001
855,Play time with a furry friend,03-20-2020 20:09:12,35425,0.89
856,"I don't need a full face helmet, Karen",06-10-2018 07:41:55,35416,0.77
857,Igniting Sewer Gas,06-13-2017 17:24:06,35391,0.91
858,"Someone in Oregon caught this Ling cod, complete with a 'belly full' of octopus....",05-30-2020 20:15:45,35398,0.9500000000000001
859,"I've been to a lot of yardsales, pretty sure this was a first.",06-19-2016 18:19:51,35543,0.91
860,A 3 eyed snake found in Australia,05-01-2019 09:25:41,35384,0.9400000000000001
861,Guy uses katana to defend his family from home invasion. The robbers escaped but crashed their car due to their injuries. [NSFW],04-11-2015 08:17:02,35365,0.92
862,Tornado debris trails near Kalamazoo last night,07-01-2017 12:18:27,35359,0.91
863,Just walked into the supply room to find this.,09-12-2018 18:22:46,35344,0.88
864,When you get possessed by Satan by you realise you are on you way to church,09-29-2018 10:13:00,35344,0.87
865,"NSFW Racoons and squirrels live in our attic, now we have shit-cicles growing from our soffit",02-12-2018 13:05:17,35329,0.9
866,No hands!,06-29-2018 19:21:56,35328,0.93
867,Maybe just wait for the green...,12-13-2017 05:17:16,35327,0.9
868,What happens when the water is not turned off in a non winterized house. 5ft frozen solid,02-26-2015 20:38:40,35315,0.9400000000000001
869,My inlaws are in a bit of a froggy situation right now,10-02-2017 11:30:01,35304,0.9
870,"Oh, he got it!",03-23-2018 09:03:30,35289,0.9
871,"My grandmother's ""critter collection"" of corpses she finds dried out near the pool.",10-02-2020 19:23:01,35283,0.9500000000000001
872,Attentive father,10-28-2019 14:02:58,35268,0.93
873,Anyone down for some ski-canoing?,03-04-2017 10:04:46,35257,0.8300000000000001
874,Escalator WTF moment!!,03-25-2018 14:01:25,35248,0.92
875,Ice Highway + Low Visibility = holy shit,10-11-2017 19:57:28,35254,0.91
876,Children's back to school stationary...,08-26-2017 11:36:04,35238,0.87
877,Leg cramp,05-27-2018 08:37:44,35221,0.91
878,Lemme just taste that,03-27-2017 07:53:05,35212,0.85
879,"This still-living bat, caught in a twisted spider web, was hanging in front of my door this morning at eye level. My girlish screams are still reverberating through the trees.",07-24-2018 10:27:38,35196,0.92
880,Close Call,10-26-2020 18:43:10,35181,0.96
881,"Well, you don't see this every day",09-14-2016 17:19:56,35180,0.91
882,A porsche went airborne and crashed into the 2nd story of a building in my town this morning. 2 confirmed dead. How does this even happen?,11-10-2019 11:40:42,35173,0.96
883,You shall not pass!,07-12-2018 22:22:42,35166,0.93
884,Never stick your dick in crazy,01-11-2016 08:52:08,35157,0.86
885,Turtle riding an Alligator.,07-07-2019 21:37:45,35152,0.92
886,What a lovely day on the rive-OH FU**,03-04-2021 15:46:40,35144,0.9500000000000001
887,Snake Head Caterpillar,04-25-2017 11:37:56,35152,0.87
888,Oops...,02-25-2019 11:22:38,35145,0.92
889,King of the Raccoons,10-08-2018 15:33:06,35137,0.91
890,Cut down coconut tree like a boss,04-28-2020 06:24:45,35138,0.9400000000000001
891,"My dad does tile for a living, this is one of the houses he was working on. Can anyone explain this?",04-27-2017 20:51:32,35123,0.89
892,My sister bought some strawberries from a very large grocery chain in BC Canada. Comes with a live prize inside!,06-06-2019 13:46:21,35127,0.9500000000000001
893,"Migingo Island, a 0.0008 sq mi dirt mound with 131 inhabitants",10-30-2016 16:24:27,35124,0.92
894,Better call the Men In Black,11-22-2020 15:34:27,35105,0.9500000000000001
895,You can see the back of an owl’s eye through its ear,10-28-2018 17:44:37,35104,0.9
896,When the City awards the Contract to the Lowest Bidder..,08-14-2020 05:57:34,35082,0.9
897,Guy in my hometown (Toronto) tried to stop a subway with his head,12-21-2017 17:00:51,35086,0.9
898,Tobacco Sniffing Championship,12-02-2017 14:10:20,35060,0.86
899,Follow the leader they said...,01-01-2018 19:58:11,35040,0.88
900,Trying to overtake with no visibility,11-04-2019 07:38:05,35035,0.96
901,Tuna swallows a seagull and spits it out,04-25-2016 13:51:43,35028,0.9
902,"A snake fighting a cat while being eaten by a frog, as a boy watches.",01-22-2020 01:55:15,35019,0.9400000000000001
903,British kids can be little cunts,01-17-2020 17:06:38,35012,0.93
904,This frankenstein fish device just seems.. I dont even know...,02-18-2019 19:51:19,35011,0.86
905,Skate park of death,02-13-2019 16:04:28,34983,0.87
906,Being chased by a tiger on a motorcycle,02-08-2020 03:05:40,34976,0.92
907,How to tease a live newscaster,08-03-2017 10:00:08,34978,0.88
908,Born without collar bones,10-30-2019 16:08:15,34949,0.9400000000000001
909,I don't know why either.,05-16-2018 19:08:17,34924,0.86
910,When paragliding gone wrong,04-28-2021 10:00:26,34887,0.9400000000000001
