idx,title,created_utc,score,upvote_ratio
911,Cow pulling off the perfect cat walk.,12-07-2020 17:17:02,34867,0.9
912,Don't touch the bear,12-26-2016 21:01:02,34853,0.91
913,A clam on the lam.,12-20-2018 08:20:57,34848,0.9
914,Man Risks His Life To Save a Dog From Certain Death.,04-18-2016 18:53:02,34842,0.86
915,This man who has a hole in his head that goes down to his mouth.,01-19-2019 18:10:36,34813,0.88
916,WTF is this driver doing!!!,10-09-2018 03:46:34,34800,0.93
917,Climbing with an excavator,12-31-2017 09:43:12,34787,0.9
918,My tooth's location...,08-30-2018 09:14:53,34750,0.9
919,Wild from start to finish,03-27-2018 03:55:49,34738,0.8
920,Safety precautions.,09-25-2020 03:50:57,34713,0.96
921,Oh how the tables have turned...,04-10-2019 04:21:28,34696,0.9400000000000001
922,"This might be a little tame for this sub, but my middle finger is kind of “loose”",07-03-2019 04:19:09,34687,0.91
923,Scarface,09-21-2019 16:56:27,34668,0.91
924,Meanwhile in Vietnam...,12-25-2019 18:42:31,34648,0.93
925,When you can’t be bothered to chew...,06-14-2020 20:04:39,34636,0.92
926,Never ride in a home-made double decker bus.,04-17-2018 09:13:19,34632,0.93
927,That's a nope from me!,05-17-2020 09:55:09,34627,0.9500000000000001
928,"Hmmmm, I wonder what this is for...",11-20-2018 02:00:46,34634,0.9400000000000001
929,Gymnasium floor after a flood.,01-23-2018 22:30:48,34616,0.86
930,My cat had a blockage in her stomach and needed surgery to remove it. It ended up being 26 hair ties.,02-05-2021 20:59:51,34608,0.93
931,A 8 feet long colon that belonged to a man who had complained of constipation most of his life. It contained 40 pounds of feces at autopsy,10-16-2018 20:29:14,34582,0.91
932,Sniper Shoots GoPro Off The Chest Of A Reporter,05-15-2017 18:10:47,34583,0.92
933,"Mmm, fish lollipop.",10-13-2018 14:50:47,34580,0.9
934,Watch out for that door,04-16-2019 20:24:14,34563,0.93
935,So cold in the northeast that the blood of a deer froze into a bloodcicle,01-02-2018 16:43:02,34564,0.9
936,My sister had an allergic reaction during a root canal,05-15-2017 10:10:14,34554,0.86
937,Holy..,08-29-2017 02:39:17,34547,0.9
938,Tourists: what just happend?,04-22-2021 01:35:09,34493,0.9400000000000001
939,J-Turn Failure,06-18-2017 12:47:54,34473,0.8200000000000001
940,"Hey, you guys got a trash can?",05-07-2019 08:10:49,34452,0.9500000000000001
941,Follow the leader,11-18-2017 09:19:25,34448,0.86
942,Me standing upright against a wall. I thought the Dr. was fucking with me at first,01-31-2020 23:14:50,34430,0.9500000000000001
943,Flash flood.,04-30-2017 08:30:18,34428,0.92
944,"Shitty thing to do, Jack.",05-08-2017 10:33:31,34408,0.8300000000000001
945,Whose fault is this?,06-04-2018 07:24:41,34360,0.91
946,Hundreds of birds dying in Rome scared by the fireworks,01-01-2021 14:02:46,34353,0.9500000000000001
947,weeeeeeeee,02-20-2019 05:44:29,34350,0.87
948,Spotted at a McDonalds drive thru in Tennessee,04-13-2017 23:47:58,34360,0.91
949,"Come on, I've got places to be.",05-19-2018 21:01:57,34320,0.92
950,"Through a ditch, airborne 140 feet and cleanly cleared 16+ cars before making landfall and crashing through our lot. Almost died today",12-03-2019 19:25:41,34311,0.96
951,That fish is/was metal AF,11-26-2017 08:51:48,34308,0.87
952,"If you don’t know how to operate a fire hydrant, you are working under Pressure",08-02-2019 13:40:56,34307,0.93
953,They sure made sure kids were safe back in the olden days,08-07-2019 09:28:56,34283,0.92
954,mmm...tastes like boat,11-13-2018 03:53:41,34276,0.91
955,Found this at my local Holiday Inn,11-22-2019 20:12:49,34266,0.9400000000000001
956,Solar-powered Robot Wolves are protecting the crops of Japanese farmers,03-29-2019 16:53:57,34220,0.9500000000000001
957,He attak. He protec.,11-12-2018 15:20:08,34198,0.89
958,Why would you do this on a kids playground?,12-15-2020 21:23:34,34153,0.93
959,When skydiving isn't exciting anymore,08-02-2019 03:41:10,34149,0.9400000000000001
960,There's a hydrant missing somewhere,03-14-2019 13:27:19,34103,0.9500000000000001
961,New parents at our local hospital just named their newborn Metallica.,08-20-2019 19:12:05,34080,0.9400000000000001
962,Killing wasps the old fashioned way,01-09-2018 20:46:51,34072,0.9
963,'Smiiiittttttthhhhhers!',08-18-2017 07:31:28,34061,0.86
964,Drive through strip clubs,05-02-2020 12:56:30,34057,0.91
965,Complete snap of the Achilles’ tendon.,08-04-2018 14:49:51,34047,0.89
966,You better be paying me extra for this,07-31-2018 08:07:02,33993,0.92
967,Haven't cleaned behind the dresser in months!!,02-26-2018 08:03:50,33989,0.73
968,My Dad hired a company to install a fence after extending the driveway. This is their handy work.,10-14-2015 12:25:14,33985,0.88
969,catching an iguana from a tree with his bare hands,06-12-2019 15:02:04,33984,0.93
970,Bus finds out if the breaks work.,01-11-2018 17:11:36,33980,0.87
971,Child Eats Bird,03-07-2019 15:45:58,33961,0.84
972,My buddy seen this deer just sleeping on the side of the road,03-10-2019 21:30:46,33955,0.86
973,"Man at a gas station refuses to give woman a cigarette, so she sets his car on fire.",04-29-2015 07:35:57,33925,0.9500000000000001
974,Dust devil forms over a grassfire and tumbleweeds,10-25-2017 02:36:02,33910,0.93
975,Man feeding a polar bear at his window.,03-13-2017 18:29:55,33899,0.89
976,I smell a lawsuit,02-26-2019 08:18:12,33882,0.93
977,"A man disappeared in Brazil and left behind 14 books full of encrypted hand-written text, a $2500 worth statue and a lot more",04-04-2017 07:46:34,33822,0.9
978,"Wall collapses, it's all downhill from there",04-28-2020 14:58:16,33812,0.9400000000000001
979,A landslide in Taiwan,08-05-2017 05:21:52,33807,0.92
980,"10 years old boy in Russia, drives a car with his 4 years old sister",10-22-2020 08:27:31,33786,0.9400000000000001
981,"Man who once weighed 540 pounds lost 303 pounds, and was left with a lot of loose skin.",11-18-2019 22:01:20,33778,0.91
982,I don’t think the mop sink is supposed to be used to thaw out chicken.,01-27-2018 18:19:52,33781,0.92
983,Just hanging out with a bear,11-16-2020 16:58:38,33768,0.96
984,Close call,12-19-2019 08:13:57,33771,0.96
985,"Flood in Minas Gerais, Brazil",01-28-2020 21:16:07,33738,0.97
986,"Hurricane's coming, better stock up on fuel!",08-30-2019 09:55:24,33730,0.96
987,This rat has lost its damn mind,10-18-2016 11:59:08,33732,0.86
