idx,title,created_utc,score,upvote_ratio
284,Want to build a house and you only have a small piece of land? No problem!,12-12-2018 08:33:58,45362,0.93
285,Well thats one way to hide drugs.,03-05-2020 13:52:20,45304,0.9400000000000001
286,a humpback whale was found dead in amazon rainforest,05-30-2020 12:07:26,45270,0.9
287,Some rough seas on the Norwegian Cruise Ship Viking Sky,03-23-2019 17:01:18,45274,0.96
288,Meanwhile in Brazil,10-07-2017 17:02:29,45244,0.92
289,"Someone managed to carry a huge wooden post, bypass all the teacher in the way to the second floor bathroom and stuck it in the toilet without anyone noticing",05-10-2019 13:13:23,45236,0.91
290,Someone LIVING in this Waffle House just fell through the ceiling!,11-05-2018 21:04:04,45212,0.9
291,Handing over a can,05-06-2019 11:43:16,45210,0.9400000000000001
292,This happened back in 2011 at a mall i used to work at.,09-05-2019 08:39:21,45202,0.9500000000000001
293,Boop,09-07-2018 16:40:55,45155,0.92
294,Secret tunnel,07-23-2020 04:35:01,45132,0.93
295,Trying to cautiously open to door,01-28-2019 00:32:33,45102,0.93
296,Justice From Above,01-09-2018 08:56:59,45092,0.91
297,A slight wait at the lift line,02-16-2020 21:04:27,45062,0.9500000000000001
298,Surprise...!,10-02-2019 17:21:54,45061,0.9
299,This road is misaligned after a California earthquake,07-12-2019 15:05:17,45038,0.92
300,Someone is getting fired 👀,03-25-2021 12:46:15,45034,0.93
301,Bad boy,08-28-2020 16:19:50,45024,0.97
302,Guy telling a bear to get off his tree stand,02-10-2020 05:20:34,45003,0.96
303,Went to my coworkers Christmas party and I think they forgot to put something away while decorating,12-19-2017 19:19:36,44991,0.86
304,Rock through the bus window,10-14-2019 10:07:52,44986,0.96
305,Some anime cartel fight happened in brazil,05-11-2019 15:08:31,44983,0.9500000000000001
306,Bad place to land,12-06-2020 11:25:46,44954,0.9500000000000001
307,Python vs King Cobra,02-01-2018 09:03:11,44959,0.92
308,My new laptop finally arrived,01-26-2019 06:47:00,44910,0.93
309,"Russian killer tries to escape from court... in a stupid, funny manner",01-06-2021 01:38:46,44886,0.96
310,Fish processing plant,07-28-2019 18:32:43,44789,0.9400000000000001
311,Just as God intended,02-11-2020 12:24:46,44763,0.91
312,Absolutely Chillin,12-20-2020 23:23:04,44752,0.9400000000000001
313,I prefer my airplanes a little further away,05-18-2020 15:37:13,44758,0.97
314,Ohhh SHIT...That is my bad Karen.,01-10-2018 18:04:10,44750,0.89
315,"1973 ""Piper"" type plane has emergency landing on autoroute 40, Quebec. No one was injured.",04-16-2020 13:50:37,44717,0.9500000000000001
316,that was quick!,09-14-2020 05:18:26,44709,0.9500000000000001
317,wtf,12-08-2020 19:18:44,44644,0.88
318,"Last week a bald eagle flew threw my bedroom window, while I was laying in bed . It was insane, to say the least.",02-05-2020 11:16:22,44637,0.9500000000000001
319,My kitchen exploded today.,08-17-2019 16:15:31,44603,0.92
320,And this is why you don’t sit naked on patio furniture,10-14-2018 08:38:43,44580,0.9
321,The river guide.,09-29-2017 13:08:51,44572,0.93
322,Clean up from a homeless camp...,10-25-2017 18:50:21,44569,0.9
323,Volcano eruption in Papaue New Guinea (wait for the shockwave),11-15-2019 14:11:25,44545,0.93
324,"Found a polaroid of some lines of coke on a photograph of myself as a child, in my dad's belongings after he died.",03-18-2019 08:59:51,44542,0.9500000000000001
325,Clean the snow off your damn car,11-17-2016 23:10:45,44540,0.92
326,Person pulls an elk antler out of a cow's shoulder,10-14-2020 02:11:47,44525,0.96
327,MadMax can carry his own choppa,09-08-2018 08:35:52,44528,0.92
328,Looks like the missing link,02-10-2020 17:43:01,44502,0.9400000000000001
329,WTF moment during race,12-08-2020 07:32:33,44480,0.9400000000000001
330,When the light turns green in the middle of an argument.,01-05-2018 13:14:50,44437,0.9400000000000001
331,"After a weekend storm in New England, a Puffer Fish was found in a tree.",03-07-2018 14:16:33,44421,0.91
332,"Before and After comparison pics of a street in Surf City, NC after Florence",09-16-2018 14:22:55,44420,0.93
333,Yo anyone got the nuclear launch codes?,03-09-2019 21:25:36,44326,0.92
334,WTF.. everyone is skidding,04-20-2020 10:11:18,44307,0.9500000000000001
335,Seal slaps a kayaker in the face with an octopus,09-26-2018 12:03:48,44259,0.9
336,Went in the attic of a house we were looking at aannd....,08-19-2018 17:00:22,44185,0.91
337,That reaction time,02-04-2019 10:06:57,44158,0.93
338,WTF,03-08-2019 14:07:27,44125,0.91
339,In Algeria we have these weird things in public parks and children’s playgrounds,10-05-2020 15:20:23,44119,0.96
340,3500 rental cars ablaze at a Florida airport,04-05-2020 22:19:41,44075,0.96
341,Driving slowly past an active crime scene - Geneva Ave SF 3:21:2018,06-18-2019 22:58:35,44067,0.88
342,Nature be doing crazy shit again,12-05-2014 11:52:28,44076,0.92
343,No power for 30 hours. Came home to busted water pipe in unit above after my 10 hour night shift. I'm done. Happened in Arlington TX.,02-16-2021 22:12:50,43995,0.9500000000000001
344,Plane crashing onto a highway near Seattle today,05-03-2017 00:59:41,43981,0.9500000000000001
345,Driving along,03-07-2019 05:55:01,43970,0.93
346,"Dude jumps on painful things, for apparently no reason. It’s like Jackass with even less of a point.",03-13-2020 16:01:24,43913,0.86
347,Let me put some on your trousers,01-22-2018 12:16:30,43874,0.86
348,Goliath grouper eats shark whole,12-30-2020 19:46:17,43864,0.9500000000000001
349,Holy Shit,10-16-2018 11:34:19,43762,0.9
350,Nice parking job.,12-16-2017 18:38:05,43750,0.92
351,Surfer taking on the biggest wave I have ever seen,01-21-2017 06:34:00,43725,0.89
352,Bridge collapse. 4/3/20,04-03-2020 08:52:17,43675,0.97
353,"Ipanema beach, Rio de Janiero. Lose a child and you're fucked.",12-11-2018 14:07:41,43666,0.88
354,I'm so glad I don't live in the same time as Quetzalcoutlus Northropi,07-19-2020 05:47:26,43655,0.9400000000000001
355,Damn Shadow,02-13-2019 22:20:51,43586,0.9400000000000001
356,This is a clown shower for children...,04-29-2020 10:54:35,43565,0.93
357,This bridge on a russian highway,11-07-2020 04:29:32,43548,0.9500000000000001
358,Washington State looking ominous,03-31-2020 23:33:56,43545,0.9400000000000001
359,Stuff of nightmares,08-23-2020 07:17:16,43552,0.97
360,Machine malfunction,08-30-2019 02:36:19,43519,0.96
361,Pure savage. The survival instinct is strong with this one.,11-16-2018 13:12:08,43516,0.86
362,Tornado,09-24-2017 08:07:59,43506,0.88
363,Who's a good boy ?,06-18-2018 07:13:47,43494,0.92
364,Holy Mother of Carp,08-10-2017 09:30:33,43468,0.9
365,Australia. Something got under the car door handle,10-08-2020 00:31:40,43460,0.96
366,I freaked out a little when I met this while cross country skiing.,01-19-2021 14:09:53,43451,0.9400000000000001
367,Old McDonald Lost His Farm,01-13-2020 11:03:27,43445,0.9400000000000001
368,Big cat running behind house cat,10-26-2020 04:30:52,43410,0.96
369,Friend of friend had a close call while mountain biking,10-17-2018 19:50:10,43407,0.9
370,How to eat a banana,11-08-2018 13:56:46,43384,0.88
371,Lightning strike survivor,02-13-2018 18:47:21,43350,0.9
372,update: the grease didn't work,01-22-2018 00:00:43,43340,0.86
373,Dudeeeeeee,05-04-2019 07:03:33,43302,0.93
374,Worst driver alive?,09-29-2019 08:22:28,43292,0.93
375,Guy's heart beating out of his chest,02-09-2018 14:59:53,43288,0.86
376,Gaslighting,09-03-2019 07:59:30,43234,0.96
377,There’s a boot in my snake!,05-28-2018 16:36:48,43183,0.93
378,The beginning of a disaster?,12-10-2020 15:07:32,43182,0.93
379,It happens fast,01-30-2020 02:51:20,43163,0.9400000000000001
380,Found out why the Roomba quit working...,08-31-2020 12:10:01,43113,0.96
381,A little windy today,06-13-2018 06:57:40,43099,0.93
382,There's literally a panther on my neighbors rooftop,09-18-2019 12:56:49,43031,0.9500000000000001
383,Safety is number one priority.,10-09-2020 15:36:57,43022,0.96
384,Gas station fire,11-19-2017 06:59:50,43020,0.93
385,All the brown you can see is spiders.,03-21-2021 20:36:44,42999,0.93
386,The front yard is lava - Hawaii,05-06-2018 01:07:03,42894,0.9400000000000001
387,Found myself a coffee table.,10-20-2018 17:14:13,42869,0.87
388,Too long to be legal,06-17-2020 11:09:40,42863,0.9500000000000001
389,"One of my grandpa’s cows (he’s a rancher) gave birth to this two-headed fella back in the 1980’s. The calf lived for less than ten minutes, but have no fear. Grandpa took it to a taxidermist.",08-14-2019 11:15:12,42825,0.9400000000000001
390,"Man with Radium Poisoning, Ukraine 1990's",02-02-2021 17:38:26,42814,0.93
391,Guys in pink suits bouncing across the street,11-07-2016 20:49:52,42811,0.86
392,This guy is going places,11-27-2020 17:57:52,42805,0.87
393,I hate people who stops when there's no red light,04-16-2017 08:27:36,42781,0.91
394,"And to your left we ha.. never mind, don't look to your left.",02-20-2019 22:44:56,42757,0.93
395,"Thought I had a broken knuckle for the last 2.5 years, last night this splinter popped out. (2 pics)",12-26-2020 10:40:39,42750,0.92
396,Massive armadillo unearthed during construction,08-24-2019 07:44:54,42747,0.93
397,This is a scene straight out of a horror movie!,07-07-2020 10:04:41,42715,0.9500000000000001
398,All it takes is one bad apple,07-01-2019 18:49:20,42686,0.96
399,Pidgin found with 200 ecstasy pills in a little backpack.,04-25-2020 13:38:15,42651,0.85
400,"After going on a walk, I was horrified to find that I was COVERED with tiny ticks. Stay safe out there.",09-08-2020 16:00:37,42641,0.9500000000000001
401,Pit Maneuver Fail,10-03-2020 09:02:21,42632,0.9500000000000001
402,"Got a complaint at work about ""very loud crickets"" in the bathroom...",08-11-2020 15:28:57,42621,0.97
403,They call it a cotton candy burrito.,07-29-2020 00:07:43,42587,0.86
404,Earthquake followed soon after by tsunami (Indonesia Sept 2018),10-24-2018 13:43:07,42582,0.9400000000000001
405,"A ship explosion in Ulsan, South Korea today.",09-28-2019 10:18:40,42574,0.96
406,"Cop car didn’t stop, look, and listen",05-21-2019 17:29:51,42582,0.9500000000000001
407,This slide seems safe,07-18-2019 15:40:40,42518,0.9500000000000001
408,WTF,09-22-2018 08:11:49,42506,0.92
409,"So kiss me, little princess",10-09-2017 16:15:25,42501,0.87
410,Cocaine wrapped in concrete to look like debris,06-30-2019 11:58:37,42498,0.96
411,"I support a woman’s right to breast feed in publi... uh, wait...",08-24-2020 17:10:58,42497,0.92
412,The “Children’s LEGO Bible” I found.,03-30-2019 19:40:51,42474,0.9400000000000001
413,Lake Baikal (Siberia) wakes up after winter,05-10-2020 06:50:41,42449,0.9500000000000001
414,Someone honked at a slow driver and the passenger wasn't having any of it.,05-04-2017 08:49:02,42437,0.92
415,I don't get it. But I kinda like it.,11-03-2018 16:47:18,42431,0.89
416,BRB just gotta grab my bat,12-06-2016 10:13:32,42417,0.9
417,Cashiers got some quick hands!,08-29-2017 21:17:35,42384,0.92
418,Seagull riding on another seagull. Wait what?,04-24-2021 08:17:58,42358,0.9500000000000001
419,He probably just wanted a goodbye kisssssss,05-29-2020 09:59:23,42344,0.9400000000000001
420,"Exsqueeze me, wtf?",01-15-2019 04:24:42,42323,0.91
421,Night turns into day in an instant in Texas,01-19-2017 06:49:24,42326,0.89
422,My mother won the KFC photoshop contest and her prize scares me.,02-13-2019 04:11:47,42323,0.92
423,Watch for rocks falling,11-27-2018 08:00:39,42304,0.9400000000000001
424,Unclogging the kitchen sink,07-30-2018 07:54:56,42254,0.9
425,Just a guy showing off his BMW,09-13-2020 18:25:21,42253,0.92
426,Auto-grabbing bed to hold patients in zero gravity,08-11-2019 22:30:45,42239,0.92
427,Frog had its eyes grow back into its skull as a result of macro mutation.,08-19-2018 08:22:07,42222,0.93
428,Testicle weightlifting,05-25-2020 07:59:15,42203,0.9
429,FedEx truck slams into 100-car pileup,02-11-2021 20:05:28,42180,0.9500000000000001
430,"My biggest fear! A freighter just appearing, inches overhead!",07-25-2020 11:24:47,42174,0.93
431,All weather tires,03-08-2020 16:05:11,42155,0.96
432,Subway Creatures,07-09-2018 09:44:19,42142,0.89
433,This massive crocodile caught in Australia,02-17-2020 09:36:33,42126,0.92
434,Guy on his phone doesn’t realize there’s an armed robbery,10-27-2018 12:35:24,42108,0.9400000000000001
435,Martin Laurello could turn his head 180° & was known as the human owl. He was a sideshow performer who lived from 1886 to 1955.,01-08-2021 06:38:09,42094,0.9500000000000001
436,This Booby Trapped Meth House,01-24-2019 10:33:59,42077,0.9500000000000001
437,Car wash house of horrors.,10-31-2018 18:54:07,42055,0.9
438,Pandemic keeping you from the salon? Problem solved!!!,01-01-2021 05:58:57,42035,0.92
439,F*cking a girl on a motorcycle,04-14-2021 18:56:41,42031,0.9400000000000001
440,Swimming pool collapsing,04-23-2021 23:49:42,42002,0.96
441,But why zebra? Why?,12-29-2017 07:41:28,41975,0.91
442,At least it's not a two way mirror,11-07-2020 12:28:02,41933,0.92
443,Deep Sea Worms viewed under Electron Microscope,11-24-2019 20:50:27,41928,0.9400000000000001
444,The craziness going on the Midwest right now,03-15-2019 11:49:19,41923,0.9500000000000001
445,"Snowpocalypse in Austin Texas. ""No water. No electricity. No snowplows. No de-icing.""",02-16-2021 00:33:36,41901,0.9400000000000001
446,Pro-wrestler's handprint left in his opponent's chest after a hard chop,01-30-2019 17:12:34,41886,0.92
447,Methane gas trapped in ice.,01-12-2021 07:06:57,41844,0.92
448,Typical rainy day in Venice,10-29-2018 16:15:14,41849,0.9400000000000001
449,"Guy Climbs Out Of A Moving Truck Onto A Slide, Slides Down, Then Climbs Back Into The Drivers Seat",04-08-2018 14:31:47,41826,0.86
450,Thanks for inviting me.,01-30-2018 11:15:48,41782,0.92
451,Time to wake up the neighbor,06-24-2019 09:18:49,41775,0.93
452,Counting down the new year... what did they think was going to happen,01-08-2019 00:14:53,41693,0.9500000000000001
453,This frequent flyer at Miami International Airport,01-15-2020 21:01:34,41684,0.9400000000000001
454,Seems legal,11-15-2018 17:04:47,41674,0.9
455,"You've heard of jorts, are you ready for jairs?",09-06-2018 18:22:37,41644,0.91
456,to be continued.....,02-08-2019 07:19:04,41639,0.93
457,Rolling spider,04-21-2017 08:26:55,41629,0.88
458,Flight delayed after woman throws coins into engine for ‘luck’,06-27-2017 09:53:45,41547,0.92
459,Overdue for an oil change,01-05-2017 15:56:06,41532,0.92
460,These people narrowly escaped death from a falling tree,11-29-2020 14:13:52,41515,0.9500000000000001
461,A snake fighting a cat while being eaten by a huge ass frog...,11-23-2016 09:01:31,41499,0.9
462,My local pizza place threw out their leftover dough in a garbage bin and it started growing,11-16-2017 05:08:39,41480,0.91
463,Child Drops Sparkler down a Manhole,05-02-2019 17:50:17,41460,0.9500000000000001
464,Big ass Komodo Dragon eats an Entire Goddamn Monkey,01-13-2019 17:00:43,41468,0.89
465,Wat?,07-08-2018 09:28:47,41443,0.87
466,"How to stop a snake from eating itself, I guess.",08-22-2020 12:34:48,41396,0.96
467,Rush hour in Tokyo,12-08-2016 22:31:05,41355,0.91
468,There is a grown man in my town with an unhealthy obsession with Carrie Underwood.,11-28-2017 13:22:18,41344,0.89
469,Shark egg case that washed ashore with a living embryo inside.,03-01-2020 06:52:39,41320,0.93
470,WTF I am supposed to write? Would not have guessed the ending.,08-05-2020 14:15:08,41327,0.93
471,Chicken what?,02-02-2019 18:24:08,41307,0.92
472,"Kid is hit by car, and then nearly run over by another car. Gets up and runs away.",12-22-2018 15:33:01,41303,0.93
473,This burn victims facial reconstruction [NSFW],06-26-2017 20:12:55,41307,0.86
474,Abandoned mask taken over by wasps as part of their nest.,07-10-2018 09:47:41,41302,0.88
475,Jesus take the wheel!,09-06-2018 08:02:20,41297,0.91
476,Lambo casually driving around stalled cars on flooded road during Tropical Storm Eta in Miami,11-09-2020 01:17:11,41241,0.96
477,Good ol' America,12-14-2020 02:42:14,41226,0.89
478,Tips allowed,10-23-2018 07:08:32,41187,0.9
479,Having zero fear of death,01-31-2021 12:45:14,41171,0.92
480,When fireworks just aren't enough to celebrate New Years.,01-01-2018 04:10:40,41164,0.89
481,This woman and her opossums,01-27-2020 19:54:17,41155,0.92
482,Hercules beetle pupa,04-24-2017 14:56:40,41132,0.87
483,Handle broke off my wife's brush.,03-24-2019 09:20:47,41124,0.9500000000000001
484,Shepherd gets ass kicked by her own sheep.,01-12-2017 17:18:12,41125,0.92
485,Look both ways before crossing a street.,11-10-2016 09:31:09,41118,0.86
486,Goliath tarantula,06-17-2017 10:35:13,41102,0.85
487,Paycheck Queue,05-08-2018 09:48:26,41061,0.9
488,A falcon sex hat allows falcon keepers to collect sperm from their birds for later artificial insemination. Essentially the bird has sex with the keepers head...,08-27-2020 13:46:01,41056,0.9500000000000001
489,Tongue game on point,10-29-2020 06:53:40,41040,0.91
490,This buttplug,01-07-2019 14:23:12,41036,0.88
491,The Camping looks pretty fun,06-25-2020 08:15:29,40964,0.9400000000000001
492,Hong Kong’s fake skyline,05-21-2018 17:12:04,40955,0.87
493,Just a little fun on the lake,11-24-2020 18:23:36,40954,0.9400000000000001
494,Wait for it,04-08-2018 23:35:04,40942,0.87
495,This Painting at the local Ice Cream Shop,11-06-2019 15:51:46,40913,0.93
496,Video shows scale of mouse plague affecting rural New South Wales Australia,03-21-2021 03:07:13,40910,0.96
497,I bet his mom would be proud of his mastery over the sandal 🤣🤣,01-22-2021 08:10:24,40866,0.9400000000000001
498,When you run into a cloud of mosquitos at 80mph 😂,06-10-2018 03:26:37,40815,0.78
499,A whip made from a spine.,05-20-2018 12:57:19,40793,0.9
500,Painful fall off Hawaiian Waterfall,07-05-2020 22:27:09,40799,0.9400000000000001
501,Fucking Bear in a Lambo,02-09-2017 10:16:57,40790,0.86
502,"My neighbor down the streets recycling pile, must be over 100 empty 1/2 gallon bottles of captain morgans rum! The recycle bin was full as well. A lot of captain in him!!",05-14-2020 21:08:14,40786,0.9500000000000001
503,Cameraman Adam Ward and Reporter Alison Parker shot and killed on-air during live report at Bridgewater Plaza in Virginia.,08-26-2015 09:03:46,40758,0.85
504,Sat down to pee. Looked up and saw this looking back...,05-25-2019 18:18:44,40748,0.9500000000000001
505,Bird hits space shuttle,07-04-2017 11:48:25,40735,0.87
506,Let s cut the tree and call a lot of people to watch it,07-29-2019 10:00:18,40736,0.92
507,Brand ironing his chest,08-13-2018 13:21:52,40681,0.88
508,"The driver was unconscious and managed to dodge cars, a building and then land a jump.",07-02-2019 07:51:50,40663,0.96
509,"This ""Fog Dome"" that formed over a town in Northern Wales",10-19-2017 20:30:15,40652,0.93
510,Damn Nature U Scary !,10-19-2018 06:22:09,40652,0.93
511,Today's special on the menu....,03-16-2020 07:54:36,40639,0.9500000000000001
512,The BALLS on this guy!,07-04-2019 09:41:38,40625,0.93
513,Awww some tadpoles!,07-13-2019 05:53:12,40601,0.92
514,A beautiful day at the beach in Australia,01-05-2020 08:58:20,40556,0.9500000000000001
515,Not giving a quack,04-28-2019 17:44:44,40558,0.9400000000000001
516,Trying to drift,09-24-2017 17:42:41,40548,0.9
517,Construction workers at the top of a skyscraper,07-03-2019 12:15:11,40548,0.9400000000000001
518,This elevator,12-28-2020 23:23:43,40540,0.9500000000000001
519,Well that was easy,06-01-2019 06:56:51,40537,0.91
520,"Well, that's one way to end an interview...",01-31-2018 09:33:15,40508,0.91
521,Insane Lava River,03-02-2020 23:41:27,40503,0.9500000000000001
522,I am not in danger. I'M THE DANGER,01-03-2021 18:45:03,40490,0.92
523,Meanwhile in Florida,08-01-2020 16:42:51,40485,0.96
524,Only in Australia...,07-25-2019 02:13:50,40467,0.92
525,Reflex test,10-15-2018 06:59:19,40470,0.9400000000000001
526,A380 nearly loses directional control while landing in a heavy crosswind,07-06-2020 19:58:07,40447,0.93
527,"""OK, I Found The Problem.. It's Th............",06-04-2019 15:07:18,40447,0.9400000000000001
528,Someone loves the holidays,12-11-2018 20:10:49,40423,0.9400000000000001
529,Had trouble breathing. 1 litter removed from around my lungs.,04-10-2020 19:58:58,40397,0.93
530,We're moving... this is how my wife packed the kids' dolls.,04-26-2019 14:49:20,40396,0.9
531,Something is growing inside a bottle of natural orange juice I abandoned inside a cabinet for over a year.,07-14-2018 10:31:05,40388,0.91
532,My firefighting truck on Thursday in New South Wales.,12-21-2019 22:50:58,40360,0.97
533,"I’m 14, and this is my hand! Open to absolutely *any* questions; seriously, couldn’t possibly get offended at sheer curiosity.",08-06-2020 02:37:48,40311,0.89
534,My friend just bought a new house and showed me where the ex owner was found.,02-02-2018 19:58:34,40314,0.91
535,"Good intentions, poor execution",10-16-2019 09:39:03,40298,0.89
536,In the subway..,09-02-2017 14:35:51,40289,0.88
537,SuiSlide,01-17-2019 12:07:16,40273,0.92
538,girl roller,11-21-2020 06:41:06,40270,0.93
539,Having a bad day?,11-26-2018 17:46:45,40211,0.9
540,Deer goes flying,08-18-2016 14:23:44,40182,0.87
541,Found this beauty today,09-20-2018 14:57:40,40188,0.93
542,The end of an elephants tail,11-08-2020 17:15:42,40179,0.91
543,Child safety thinking in the 60s,03-18-2018 10:02:39,40153,0.92
544,Woke up for some water. Thank god I turned on the light before taking a sip.,09-07-2020 00:32:37,40151,0.9400000000000001
545,WTF electrocution,11-02-2020 10:13:19,40129,0.9500000000000001
546,The skull of a person with the rare type of bone cancer Chordoma.,05-19-2018 09:08:17,40125,0.93
547,Mylar Balloons And Power Lines Don't Mix,08-04-2017 14:24:46,40101,0.92
548,I think I'll make a left turn instead...,06-30-2017 09:14:47,40097,0.92
549,I thought these were flowers,06-02-2020 12:05:10,40088,0.9
550,What is making that noise underneath the floor?,07-13-2017 14:20:18,40067,0.91
551,A disaster of idiotic proportions waiting to happen.,08-31-2017 22:08:37,40007,0.9
552,"In other Florida news, This maniac pulled a monster gator out of my sister’s pool this morning.",10-15-2019 23:09:19,40007,0.9500000000000001
553,I coughed up a staple from a lung lobectomy performed in August 2016.,03-05-2018 21:51:42,39997,0.91
554,Heroine needles pulled out of the Merrimack River in NH.,02-23-2019 12:21:08,39988,0.91
555,Someone bugged his phone,01-09-2019 07:44:53,39992,0.89
556,Refrigerator delivery in Nepal,01-08-2018 08:23:56,39990,0.91
557,wolf saying hi,05-14-2019 07:17:11,39963,0.92
558,Lunch & live music,05-22-2021 18:33:21,39943,0.89
559,What a world,11-11-2020 01:38:20,39867,0.9400000000000001
560,Hippo saves deer and then....,08-13-2020 20:49:24,39862,0.93
561,Shop owner saves his employee from getting electrocuted.,08-12-2020 19:43:57,39850,0.93
562,I'm never driving again,01-06-2021 23:02:23,39830,0.93
563,This supermarket has the freshest fish,02-05-2018 14:42:06,39825,0.91
564,This guys hair,11-27-2016 15:08:26,39755,0.88
565,Head lice infestation,07-17-2018 19:10:49,39745,0.86
566,"My friend's father crashing in like 2003 ? If you got some anxiety issues don't watch this, just saying, strong WTF material here.",03-07-2021 16:00:49,39733,0.92
567,DIY gone wrong,08-15-2018 09:20:36,39716,0.93
568,A young Saddam Hussein flirting with his future wife.,12-19-2016 10:33:12,39652,0.88
569,What the actual fuck? How many can you carry?,07-01-2018 10:59:42,39618,0.91
570,So my GF saw this at the front door at 3:00 AM after she got home from work. We don’t have a cat.,05-02-2018 23:20:19,39588,0.8200000000000001
571,Failed robbery attempt,03-06-2018 11:14:28,39581,0.91
572,"If I saw THIS in my bathroom corner, I’d burn my house down",03-20-2020 07:56:31,39573,0.87
573,It's fine it just needs to settle,09-12-2020 10:32:25,39521,0.96
574,20MM Vulcan Cannon on top of a Prius.,11-17-2018 19:05:18,39507,0.92
575,is that a russian labrador?,08-03-2020 10:01:35,39490,0.9400000000000001
576,I hate when the internet starts to leak again,07-10-2019 14:08:13,39492,0.9500000000000001
577,WTF Grandma?!?!,04-06-2019 07:41:21,39471,0.9400000000000001
578,Grandma didn't make it in time.,06-19-2017 06:20:17,39417,0.92
579,"400,000 volt short circuit arc",10-25-2020 08:02:22,39419,0.96
580,When you want to use the outside shower after a while of not using it,07-23-2020 15:26:40,39384,0.9500000000000001
581,Mt. Sinabung eruption in Indonesia,02-19-2018 22:45:04,39343,0.91
582,Truck in the wind,11-14-2017 14:57:16,39343,0.92
583,"The debris from this fire is, um, shocking",11-16-2019 11:53:15,39322,0.9400000000000001
584,A pint drinking baby from a 1997 documentary about rural Ireland,02-20-2017 13:07:07,39308,0.87
585,"Australian man caught ""sea monster"" with no eyes and a mouth full of sharp teeth",07-23-2019 13:58:03,39304,0.9400000000000001
586,I like your hair,01-05-2018 08:49:50,39306,0.84
587,Safety First,02-07-2019 03:49:22,39271,0.91
588,A ball of mud I stepped full of surprises.,12-04-2019 17:44:52,39257,0.9400000000000001
589,[NSFW] Why would you even cover cake with silly string like that? You can't even eat it.,12-14-2017 06:59:12,39227,0.89
590,Bum made a Jacuzzi at a kids park,07-09-2018 21:04:37,39198,0.89
591,wtf,12-09-2020 08:45:40,39200,0.9400000000000001
592,This watermelon I bought started foaming,11-27-2018 19:32:16,39195,0.92
593,I think I'll sit in the back of this gun safety class,11-22-2016 11:52:24,39147,0.88
594,Snake in a vehicle,03-29-2020 08:16:55,39128,0.93
595,A naked guy tried to enter my house and then proceeded to jack off while looking into my bedroom.,02-27-2018 19:10:38,39092,0.89
596,Attempt at robbery,11-29-2017 08:22:27,39099,0.89
597,Man tries to kidnap singer while she is performing,05-25-2017 07:25:02,39091,0.91
598,How to eat a donut like a real man,10-04-2019 19:43:23,39072,0.87
599,An actual WTF?,01-29-2017 19:42:07,39070,0.85
600,3 near misses in 10 seconds,09-07-2018 04:27:38,39067,0.93
