idx,title,created_utc
210,The Official Title for Star Wars: Episode VIII Revealed - The Last Jedi,01-23-2017 11:04:33
211,‘Spider-Man: Into The Spider-Verse’ Actor Jake Johnson Offers Free Peter Parker Voice Messages To Quarantined Kids,03-21-2020 16:08:03
212,Star Wars: The Force Awakens Trailer #3,10-19-2015 22:08:44
213,"Susan Sarandon has revealed that Paul Newman once gave her part of his salary. They starred together in the 1998 film Twilight, with Gene Hackman. Sarandon discovered that her male co-stars were getting paid the same as each other - and more than her. Newman said, ""Well I'll give you part of mine.""",03-08-2018 12:43:31
214,Jack Black to Play Claptrap in Star-Studded ‘Borderlands’ Movie,02-11-2021 13:08:12
215,Borat: Subsequent Moviefilm - Official Trailer | Prime Video,10-01-2020 10:00:09
216,"If Chris Pratt and Jennifer Lawrence in Passengers had switched roles with Dane DeHaan and Cara Delevingne in Valerian and the City of a Thousand Planets, both movies would've been significantly better.",12-14-2018 16:08:18
217,Stunt driver killed in accident on Deadpool 2 set in Vancouver,08-14-2017 13:13:11
218,Marvel Studios' Avengers: Infinity War Teaser Trailer,11-29-2017 08:26:37
219,John Wick solidified Keanu Reeves as one of the greatest action stars of all time,11-17-2017 07:19:54
220,Poster for “Joker” with Joaquin Phoenix,04-02-2019 11:43:27
221,Oscars Ratings Crash To All-Time Low; Viewership Falls Under 10M For First Time Ever,04-26-2021 13:38:19
222,First official image from BOND 25,06-30-2019 22:54:22
223,‘District 9’: How A Mid-Budget Sci-Fi Thriller Defied Expectations And Became A Best Picture-Nominated Success,09-24-2020 03:56:45
224,"First Poster for South Korean Zombie Movie 'Alive' - The rapid spread of an unknown infection has left an entire city in ungovernable chaos, but one survivor remains alive in isolation.",05-19-2020 08:28:33
225,After 56 years and 200 films Jackie Chan has finally been awarded his lifetime achievement Oscar.,11-13-2016 08:17:30
226,Warner Bros has confirmed that Mads Mikkelsen has replaced Johnny Depp in the role of Grindelwald in Fantastic Beasts 3,11-25-2020 16:47:07
227,First Image of James McAvoy as Bill Denbrough in 'IT: Chapter Two',04-22-2019 12:09:16
228,Chloé Zhao Becomes Only the Second Woman to Win Oscar for Best Director in 93 Years,04-25-2021 21:00:44
229,ZOMBIELAND: DOUBLE TAP - Official Trailer (HD),07-25-2019 12:00:18
230,Karen Gillan confirms she will appear in Thor 4,01-18-2021 13:30:04
231,"Ken Spears, Co-Creator of ‘Scooby-Doo,’ Dies at 82",11-09-2020 13:20:06
232,"First Image of Will Ferrell & John C. Reilly in Comedy-Mystery 'Holmes & Watson' - Also Starring Ralph Fiennes, Rebecca Hall, Noah Jupe, and Kelly Macdonald",08-10-2018 18:34:50
233,"10 Years Later, a Look Back on How Badly M. Night Shyamalan Botched ""The Last Airbender""",07-09-2020 10:10:41
234,Incredibles 2 - Olympics Sneak Peek,02-14-2018 22:35:08
235,The Lord of the Rings is a master piece that may never replicated in our life time. My fan art using miniature scale model photography.,08-29-2019 00:08:09
236,"Wonder Woman has just passed the original Spider-Man's gross at the box office, becoming the #1 Superhero origin film.",08-20-2017 11:58:05
237,Oscar-Nominated ‘Umbrella Academy’ Star Elliot Page Announces He Is Transgender,12-01-2020 12:17:31
238,Liam Neeson announces retirement from action films,09-12-2017 08:32:31
239,Ben Affleck Will Return as Batman in The Flash,08-20-2020 15:04:33
240,"From over 9,000 stores to only 1: Australian Associated Press announces that the Blockbuster in Perth will close its doors on Monday, leaving the one in Oregon as the final location in the world.",03-05-2019 19:07:44
241,POKÉMON Detective Pikachu - Official Trailer #1,11-12-2018 12:00:53
242,"James Franco [winner], Dave Franco, and Tommy Wiseau Accept the Golden Globe for Best Performance by an Actor in a Motion Picture (Musical or Comedy)",01-07-2018 21:13:21
243,New image of Joaquin Phoenix in “Joker”,03-22-2019 16:49:21
244,"Stanley Kubrick's 'Napoleon', the Greatest Movie Never Made: Kubrick gathered 15,000 location images, read hundreds of books, gathered earth samples, hired 50,000 Romanian troops, and prepared to shoot the most ambitious film of all time, only to lose funding before production officially began.",05-12-2019 12:02:57
245,"Opinion: I think it was foolish of Disney to remake so many of their popular movies within the span of a year: Dumbo, Aladdin, Lion King, Mulan. If they had spaced them out to maybe 1 or 2 a year, they might each be received better; but now people are getting weary, and Disney's greed is showing.",07-08-2019 03:09:26
246,New Look at Naomi Scott's Princess Jasmine in Disney's 'Aladdin' Remake,01-03-2019 11:14:58
247,First Image of Liu Yifei as Hua Mulan in Disney's Live-Action 'Mulan' Film - Production Began This Week After Many Delays,08-13-2018 12:09:39
248,Hollywood will stop making reboots when you stop paying for them,10-28-2019 14:40:16
249,‘Knives Out’ Exposes the Veiled Prejudice of Seemingly Nice People,11-20-2020 08:14:15
250,Danny DeVito Joins Dwayne Johnson in ‘Jumanji’ Sequel,01-04-2019 15:02:23
251,I spent all month drawing Reddit's movie title typos,11-03-2014 10:36:09
252,"Now is the time to revisit 'Wall-E', perhaps the finest environmental film of the past decade",06-03-2017 09:18:17
253,"Throughout each of Quentin Tarantino’s productions, he would have his actors turn to the camera and say “Hello, Sally!” as a nod to Sally Menke, who’d edited every one of his films until she passed away in 2010.",12-23-2017 17:43:49
254,"Jessica Walter Dead: ‘Arrested Development,’ ‘Archer’ Actress Was 80",03-25-2021 14:26:59
255,"Isao Takahata, Studio Ghibli co-founder and director of Grave of the Fireflies, Only Yesterday, Pom Poko, and The Tale of the Princess Kaguya has died. (Japanese Article)",04-05-2018 16:51:06
256,The Lion King (2019) - Official Trailer,11-22-2018 17:33:05
257,David Harbour as Hellboy (2018),09-13-2017 16:10:31
258,"""Isle of Dogs"" - Wes Anderson - Official Trailer #1",09-21-2017 10:58:55
259,"John Musker, the Co-Director of 'The Little Mermaid', 'Aladdin', and 'Moana' retires from Disney after 40 years of work.",03-19-2018 08:18:56
260,First poster for Guillermo Del Toro’s ‘Scary Stories To Tell In The Dark’,02-01-2019 20:36:54
261,"Seth Rogen’s Comedy ‘An American Pickle’ Movie Gets August 6, 2020 Release Date On HBO Max - About an immigrant worker (Seth Rogen) at a pickle factory who is accidentally preserved for 100 years and wakes up in modern day Brooklyn and meets his grandson (also played by Seth Rogen).",05-13-2020 10:10:36
262,The full set used for the movie Coraline. Was an exhibit at a tour I took.,03-08-2019 03:04:15
263,Lucasfilm confirms the Boba Fett Star Wars movie is 100% dead,10-26-2018 15:44:28
264,"‘Aqua Teen Hunger Force’, ‘Venture Bros.’ & ‘Metalocalypse’ Movies In the Works",05-12-2021 12:02:08
265,Director Jeff Fowler claims his VFX team will redesign the look of Sonic in the film Sonic the Hedgehog (2019) after major online backlash to the film's trailer,05-03-2019 14:32:43
266,Tessa Thompson Confirms Christian Bale Will Play the Villain in 'Thor: Love and Thunder',03-06-2020 15:16:19
267,TENET - Official Trailer,12-19-2019 11:59:58
268,Official Poster for 'Nobody' - Bob Odenkirk plays a bystander who intervenes to help a woman being harassed by a group of men and becomes the target of a vengeful drug lord.,12-10-2020 10:52:43
269,Carey Mulligan Suggests Oscar Voters Need to Prove They’ve Seen the Movies,01-25-2020 19:21:45
270,"New image of Keanu Reeves and Alex Winter in ""Bill & Ted Face the Music""",02-18-2020 09:37:21
271,"Irrfan Khan, actor extraordinaire and India’s face in the West, dies at 54",04-29-2020 02:33:39
272,‘Solo’ Score Disqualified From the Oscars Because Someone Forgot to Submit It,12-10-2018 19:44:09
273,Mads Mikkelsen Joins Harrison Ford in ‘Indiana Jones 5’,04-15-2021 12:31:32
274,Zack Snyder Will #ReleaseTheSnyderCut of ‘Justice League’ on HBO Max,05-20-2020 14:07:01
275,"Kristen Stewart addresses the ""slippery slope"" of only having gay actors play gay characters",11-24-2020 09:29:01
276,Rutger Hauer Dead: ‘Blade Runner’ Co-Star Was 75,07-24-2019 12:52:27
277,"I am Dwayne ""The Rock"" Johnson, here to answer all your jabroni questions about RAMPAGE and what I was cooking this whole time. AMA",04-01-2018 12:51:46
278,"Scarlett Johansson Turned Down Film Funding From Saudi Prince For Her Next Film, A Journalism Biopic Directed by Ridley Scott",10-24-2018 17:40:54
279,"RIP Syd Mead, the illustrator who was largely responsible what people in the 80's thought the future was going to look like, thanks to his work on Blade Runner, TRON and Aliens.",12-30-2019 14:49:21
280,'Guardians of the Galaxy Vol. 2' - New Poster,02-05-2017 18:32:04
281,"'Black Panther' Director Ryan Coogler Pens Emotional, Beautiful Tribute to Chadwick Boseman",08-30-2020 14:59:55
282,New poster for H. P. Lovecraft’s Color Out of Space starring Nicolas Cage,08-11-2019 14:25:05
283,Will Smith Exits ‘Suicide Squad’ Sequel,02-27-2019 21:02:30
284,Zombieland 2 official poster,07-19-2019 20:27:14
285,"Four Bong Joon-ho films were just added to Hulu: Parasite, Mother, The Host and Barking Dogs Never Bite",04-08-2020 12:57:13
286,First Image from 'Color Out of Space' - Starring Nicolas Cage & Tommy Chong - HP Lovecraft adaption about a town being struck by a meteorite and the fallout is catastrophic.,08-14-2019 09:16:40
287,"I know Robin Williams' character is meant to be the hero of Mrs Doubtfire but, on reflection, his behaviour is full level psycho creep while Piers Brosnan's potential stepdad does nothing wrong except be rather dashing",02-27-2019 11:36:20
288,"Buster Keaton filmed this shot in ‘Sherlock Jr.’ (1924) in reverse, with the train backing away from the road crossing",07-27-2019 15:10:00
289,Star Wars: The Rise of Skywalker poster,08-24-2019 13:27:29
290,New Deadpool Poster,01-11-2016 15:02:31
291,‘Star Wars’ Actor John Boyega Signs Netflix Deal To Develop Non-English Language Films Centered on West and East Africa,03-10-2020 06:20:54
292,First Poster for Netflix's Documentary 'Fyre' - A behind the scenes look at the infamous unraveling of the Fyre music festival.,01-11-2019 09:30:26
293,First Image of John Travolta as a Crazed Stalker in Thriller 'Moose' - Directed by Fred Durst of Limp Bizkit,04-24-2018 20:43:19
294,"When Alfred Hitchcock was 6, his father punished him for a minor offense by sending him to the local police station with note telling the officer on duty to put Alfred in a cell for 5 minutes without telling him for how long. False imprisonment is a main theme of his movies.",08-08-2019 07:03:05
295,"Will Ferell Was Originally Afraid 'Elf' Would Ruin His Career, Fearing It Was Too Over-The-Top & Risky",12-24-2018 22:35:50
296,Cats has ended its domestic run after 8 weeks with a total of $27.2M.,02-14-2020 19:15:16
297,Acclaimed WWI Documentary 'They Shall Not Grow Old' Returning to Theaters in December,11-24-2019 09:52:20
298,"Pixar's 'Onward' is Releasing Today on Digital, Just Two Weeks After It Hit Theaters",03-20-2020 09:12:20
299,Debbie Reynolds Dead at 84,12-28-2016 20:40:17
300,"Britain No Longer Permitting Rape Scenes, Sexual Violence in Films Rated for Under 15 Year Olds",01-16-2019 16:14:38
301,Ivan Drago and his son in ‘Creed II’,10-30-2018 13:30:55
302,Shannon Elizabeth on set of “Jay and Silent Bob: Reboot!”,03-12-2019 13:29:25
303,Obama shares his favorite movies of the year,12-28-2018 09:33:42
304,"First Image of Ryan Reynolds in Comedy 'Free Guy' - About a bank teller stuck in his routine that discovers he’s an NPC character in brutal open world game. - Also Starring Channing Tatum, Taika Waititi, Jodie Comer, and Lil Rel Howery - Directed by Shawn Levy ('Stranger Things')",10-31-2019 12:43:16
305,The Bat-Signal to Shine Over L.A. in Honor of Adam West,06-15-2017 04:32:23
306,[Official YT Channel]Star Wars: The Force Awakens Official Teaser,11-28-2014 10:23:43
307,Jim Carrey To Play ‘Sonic The Hedgehog’ Villain Robotnik,06-29-2018 18:13:37
308,"Ten years later, 'Ratatouille' remains a striking allegory of art and class",02-20-2018 09:34:52
309,Samurai Jack creator Genndy Tartakovsky is working to bring back hand-drawn cartoons to big studio animated films,07-10-2018 15:33:16
310,First poster for Pixar's Luca,02-24-2021 09:00:18
311,'Her 2013' meets 'lost in translation 2003',06-23-2018 11:23:43
312,"Major ‘Hamilton’ Change: Disney Sets July 3 Streaming Release Date For Lin-Manuel Miranda's $75 Million Musical, A Filmed Version of the World-Famous Musical",05-12-2020 08:21:31
313,How some cool silent film effects were done,01-07-2017 04:13:00
314,"Robert Pattinson set to star in French art house director Claire Denis' first English-language film 'High Life', a genre-bending sci-fi drama about a death row inmate sent on an isolated, no-return mission to explore a black hole",12-17-2017 10:58:23
315,"New image of Kristen Stewart as Diana, Princess of Wales, in Pablo Larraín’s SPENCER.",03-25-2021 10:32:38
316,"Deadpool 2, Meet Cable",02-07-2018 09:06:19
317,Albus Dumbledore and Young Newt Scamander in Fantastic Beasts: The Crimes of Grindelwald,07-12-2018 10:39:09
318,‘Bob’s Burgers’ Movie Ordered Up For 2020,10-04-2017 12:24:33
319,Denis Villeneuve’s ‘Dune’ Movie Delayed Until October 2021,10-05-2020 15:00:27
320,The Onion: Fans Excited As ‘Solo’ Trailer Sheds Light On Specifically How It Will Suck,04-09-2018 16:07:40
321,"Acclaimed Mr. Rogers Documentary 'Won't You Be My Neighbor?"" To Premiere on PBS Tonight",02-09-2019 12:36:06
322,Taron Egerton training for the upcoming Robin Hood movie,10-25-2018 09:12:34
323,Sen. Ted Cruz set to introduce a bill barring Pentagon from working with film studios that censor movies for China,04-28-2020 18:45:08
324,First image look at 'JOHN WICK: CHAPTER THREE',12-19-2018 14:05:32
325,First poster for 'Raya and the Last Dragon',10-20-2020 12:00:37
326,The Lego Movie 2 coming Feb 2019!,05-21-2018 11:08:33
327,First picture of Alphonse from the Full Metal Alchemist movie.,02-23-2017 21:43:33
328,"I'm very excited to share the official poster of my film 'Arctic', starring Mads Mikkelsen!",11-05-2018 11:33:56
329,Canada Inquiry Finds That ‘Deadpool 2′ Producers Violated Several Safety Regulations That Contributed To Death Of Stuntwoman Joi Harris,10-02-2019 17:47:09
330,"Ryan Reynolds to battle Sharks, Vikings and Nazis in Sam Raimi's Bermuda Triangle",06-09-2018 13:27:54
331,'No Time To Die' First Official Poster,10-05-2019 07:01:58
332,Court Refuses to Block Release of Netflix's Panama Papers Movie ‘The Laundromat’,10-18-2019 11:22:27
333,El Camino: A Breaking Bad Movie | Date Announcement | Netflix,08-24-2019 18:40:45
334,Dave Bautista Joins ‘Dune’ Reboot,01-07-2019 16:29:00
335,"Milla Jovovich's 'Resident Evil' Stunt Double Sues Producers Over ""Horrific"" On-Set Injury",09-12-2019 11:16:24
336,WW84 New International Poster,03-13-2020 11:27:12
337,Film Academy Expels Bill Cosby and Roman Polanski From Membership,05-03-2018 14:26:02
338,‘The Batman’ Resumes Production After Shutdown Over Positive COVID-19 Test,09-17-2020 11:10:30
339,Thor: Ragnarok Teaser Trailer #1,04-10-2017 09:00:16
340,'Gone With the Wind' star Olivia de Havilland dies at 104,07-26-2020 11:41:44
341,"New Netflix movie "" The Last Days of American Crime"" lands infamous 0% rating on Rotten Tomatoes",06-08-2020 11:31:59
342,Tenacious D announces 2nd movie!,05-07-2018 03:42:19
343,Guy writes screenplay about 2 kids finding the long-lost 1968 Mustang GT 390 from the movie Bullitt. Randomly mentions it to dude who secretly owns the actual car,03-18-2018 08:07:00
344,"'The Social Network', 'Watchmen', 'Gone Girl', 'Waves': Trent Reznor Reinvented Himself As a Score Master Without Shedding His Nine Inch Nails Roots By Crafting Some of the Decade’s Most Iconic Scores",11-22-2019 13:59:58
345,"Netflix Adapting 'Redwall' Books Into Movies, TV Series",02-10-2021 08:59:23
346,"Kendrick Lamar Producing, Curating Black Panther Soundtrack Album",01-04-2018 10:12:12
347,How to Train Your Dragon 3 - Official Poster,05-31-2018 11:02:19
348,Star Wars Episode IX – Teaser,04-12-2019 13:08:35
349,"Okay Hollywood, ""Deadpool"" and ""Kingsman: The Secret Service"" are both smash hits at the box office. ""Mad Max: Fury Road"" is even nominated for best picture. So, can we PLEASE go back to having R rated blockbusters?",02-14-2016 15:44:53
350,New Poster for 'Bill and Ted Face the Music',07-23-2020 09:04:33
351,Arnold Schwarzenegger Joins 'Kung Fury' Feature Film,02-15-2018 14:04:59
352,Mad Max: Fury Road voted greatest Australian film this century by critics,07-24-2018 07:18:19
353,‘Bright’ Sequel Announced by Netflix,01-03-2018 10:04:19
354,Us - Official Trailer [HD],12-25-2018 09:00:26
355,"Bill Cosby guilty on all three counts in indecent assault trial, jury decides",04-26-2018 14:05:41
356,"California Coronavirus Update: Governor Gavin Newsom Closes All Restaurants, Movie Theaters In State",07-13-2020 15:10:04
357,"Ridley Scott's 'Alien' has spawned an academic industry that remains unsurpassed. No other film in history, not even 'The Godfather' or 'Psycho', has generated quite the amount of academic research, talks, and papers that 'Alien' has, from biology to post-humanism.",03-24-2019 18:04:26
358,Batman Star Adam West Missing From Oscars 2018 In Memoriam Reel,03-05-2018 08:16:49
359,Official poster for “Call of the Wild”,11-20-2019 09:06:48
360,Arnold Schwarzenegger and Jackie Chan are making a movie together: Journey to China: The Mystery of Iron Mask,12-09-2016 23:56:44
361,JJ Abrams' Bad Robot Production Company & Foundation Pledges $10 Million for Anti-Racist Organizations,06-01-2020 19:37:52
362,"‘Step Brothers’ and the Peak Summer of Blockbuster Comedy: Filled with movies like ‘Tropic Thunder,’ ‘Forgetting Sarah Marshall,’ and the Will Ferrell–John C. Reilly classic, the dog days of 2008 were a great time to laugh in theaters. And also one of the last.",07-24-2020 09:27:17
363,Super Troopers 2 Has Finished Post-Production!,08-02-2017 16:32:55
364,Netflix Only Has 35 Movies from the IMDB Top 250 List in Its US Streaming Library,09-17-2018 10:29:03
365,Game of Thrones Creators David Benioff and D.B. Weiss to Write and Produce a New Series of Star Wars Films,02-06-2018 15:31:55
366,Venom poster,02-07-2018 12:17:50
367,Godzilla vs. Kong – Official Trailer,01-24-2021 12:00:59
368,Disney pricing their new releases at $30 on top of regular Disney+ subscription sets a bad precedence for future of streaming,10-03-2020 22:12:10
369,'Breaking Bad' Movie Is a Sequel Starring Aaron Paul and Will Air on AMC and Netflix,02-13-2019 12:27:52
370,"During the filming of ""Borat"", the FBI started a file on Sacha Baron Cohen after receiving numerous complaints about a strange man traveling around the country in an ice cream truck",09-03-2017 19:33:18
371,Steven Yeun to Star in Jordan Peele’s Next Movie,04-01-2021 16:23:57
372,New 'The Disaster Artist' Poster (A24),09-11-2017 10:11:03
373,"I painted Nacho Libre, oil on canvas",06-11-2019 08:13:15
374,Donald Trump Muslim ban will keep Oscar-nominated director Asghar Farhadi from 2017 ceremony,01-28-2017 08:08:57
375,"In 2008, a man altered an old story he had written to resemble Kung Fu Panda, then sued DreamWorks for $12 million. After the court found out he was lying, he was sentenced to 2 years in prison.",05-11-2017 06:08:08
376,"Kenny Baker, actor behind R2-D2, dies | Film",08-13-2016 11:55:45
377,First official look at Joaquin Phoenix in ‘Joker’,09-16-2018 15:29:15
378,"Sony didn't believe that Aaron Sorkin's 162 page script for The Social Network would come out under 2 hours, so David Fincher timed Aaron reading it aloud. The reading took 1 hour 59 minutes, which was the exact running time of the final cut",06-24-2018 15:32:13
379,"Florence Pugh, Shia LaBeouf and Chris Pine to Star in Olivia Wilde’s Film ‘Don’t Worry Darling’ - a psychological thriller set in an isolated, utopian community in the 1950s California desert.",04-24-2020 13:02:29
380,"‘John Wick 4’ Director Chad Stahelski - Sequel won't make its previously announced May 21, 2021 release date, as Keanu Reeves must finish 'The Matrix 4' first.",04-29-2020 16:35:25
381,New Poster for 'Bill and Ted Face the Music',06-09-2020 03:07:07
382,Monica Lewinsky to Produce HBO Documentary '15 Minutes of Shame' About the Culture of Public Shaming,10-21-2019 13:01:10
383,'Ant-Man And The Wasp' Teaser Poster,01-30-2018 21:23:10
384,I saw 192 movies in theaters in 2019. Here is my full ranking.,12-29-2019 10:20:40
385,"Laika, the independent animation studio behind Oscar-nominated films such as 'Coraline,' says its Portland-area studio will remain closed at least through May 1 due to the coronavirus pandemic, while ""all employees are being paid in full with all benefits in place"" during this time.",04-09-2020 17:37:33
386,Christopher Nolan opted to buy a real 747 instead of using a miniature plane or CGI in 'Tenet' because it was actually 'more efficient' after running the numbers,05-26-2020 13:56:07
387,"After 20 grueling years in the movie industry, my best friend decided to write/direct/produce his first film. It took 16 days to shoot and 4 years to finish, thanks to endless fundraising from 50 small investors. Here’s the official trailer for his movie ‘Caged,’ a Thriller starring Edi Gathegi",12-18-2020 19:27:21
388,"Filmmaker Jo Andres and wife of Steve Buscemi, has passed away at age 65",01-12-2019 01:39:55
389,Topher Grace edited all 10 Star Wars movies into one super trailer called “Star Wars: Always” when his wife was out of town for a weekend,02-26-2019 13:29:52
390,"Official: ""Lucasfilm has no plans to digitally recreate Carrie Fisher’s performance as Princess or General Leia Organa.""",01-13-2017 19:05:24
391,Nigerian kids make cheap low budget version of 'Extraction' trailer. Impress the directors so much they get invited to the sequel's Premiere.,06-25-2020 19:08:19
392,Danny Elfman confirms he's scoring Doctor Strange: Multiverse of Madness,02-18-2021 09:16:29
393,New Poster for M. Night Shyamalan's 'Glass',11-29-2018 12:29:35
394,Glass - Official Trailer,07-20-2018 19:09:53
395,"It's Official: Sony Will Campaign Leonardo DiCaprio For Best Actor, with Brad Pitt in Supporting Category for 'Once Upon A Time In Hollywood'",10-23-2019 09:42:22
396,Avengers: Infinity War officially hits $2 billion worldwide today.,06-11-2018 15:31:54
397,"DMX, New York Rapper and Actor, Dies at 50",04-09-2021 12:25:37
398,"‘David Attenborough: A Life On Our Planet’ Is The Most Important Documentary Of The Year: By framing environmental destruction through Attenborough’s eyes and unique career, it manages to humanize an issue that can often seem distant and abstract.",10-10-2020 15:47:37
399,Avengers: Infinity War release date has been moved to April 27,03-01-2018 15:39:33
400,Ryan Reynolds shares behind the scenes image of him doing motion capture for 'Detective Pìkachu',12-31-2018 05:35:31
401,[OC]A selective timeline of famous Dystopias,06-14-2019 14:33:17
402,Steve Martin's opening at Tom Hanks AFI Lifetime Achievement Award ceremony. Perfect timing and delivery. Other hosts take note,06-24-2017 08:57:37
403,"Lots Of Time To Die: The 'No Time To Die' Runtime Is Confirmed, And It's The Longest Bond Film Ever At 163 Minutes",02-26-2020 11:41:16
404,3000 upvotes turns this sub into a Daisy Ridley sub,04-01-2016 14:16:03
405,New image from James Gunn's 'The Suicide Squad',10-26-2020 08:17:48
406,"Official Poster for ""Jurassic World: Dominion""",10-06-2020 18:09:22
407,"Watch John Wick 1 & 2. Then watch Constantine. Constantine feels like a sequel in a series where our protagonist, John, develops the ability to fight Hell itself. The continuity is made possible because everyone refers to the character as “John” and treats him with a reserved respect.",10-29-2017 06:50:07
408,Toy Story 4 Official 'Bo Peep' Poster,01-28-2019 12:19:12
409,"If you begin ""Apollo 13"" at 9:17pm ET tonight, Tom Hanks will utter the infamous, ""Houston, we have a problem"" line *exactly* 50 years after Jim Lovell said it for real - 10:08pm, on April 13, 1970.",04-13-2020 11:45:46
410,VENOM - Official Trailer (HD),04-23-2018 23:45:35
411,All Oscar Categories to Air Live After Hollywood Protest,02-15-2019 18:01:14
412,A fight scene between shape-shifting beings in Lotte Reiniger’s 'The Adventures of Prince Achmed' (1926). The oldest surviving animated feature film.,05-30-2018 16:51:26
413,Disney and Pixar’s Luca | Official Poster,04-28-2021 09:11:50
414,Darren Aronofsky reveals his Batman film fell apart because he wanted Joaquin Phoenix as Bruce Wayne – and the studio wanted Freddie Prinze Jr for the role instead.,04-17-2020 10:49:31
415,"Official Poster for ""GODZILLA VS. KONG"", Coming March 26, 2021",01-21-2021 12:09:31
416,"Hugh Keays-Byrne, of Mad Max fame, dead at 73",12-02-2020 13:52:12
417,Jackie Chan to get lifetime achievement Oscar,09-01-2016 16:57:31
418,Halle Berry in John Wick: Chapter 3,06-04-2018 14:24:32
419,Marvel’s Guardians of the Galaxy Vol.2 – Official Teaser Trailer,12-03-2016 17:39:09
420,New image of Bruce Wayne (Robert Pattinson) in 'The Batman',08-22-2020 16:16:57
421,"Eliza Dushku says she was molested during the production of ""True Lies"" by the stunt coordinator, a guy who still works in Hollywood and most recently did the stunts for ""Blade Runner 2049"" and ""Furious 7""",01-13-2018 12:49:02
422,"""It"" smashes opening night records: $13.5 million, the largest gross for any horror, R-rated film, and September release ever, and the third largest of the year behind GotG 2 and Beauty & the Beast.",09-08-2017 15:44:32
