idx,title,created_utc
0,"The Senate. Upvote this so that people see it when they Google ""The Senate"".",04-01-2017 08:57:54
1,‘Black Panther’ actor Chadwick Boseman dies at 43 after 4-year fight with colon cancer,08-28-2020 22:10:04
2,Disney Reinstates Director James Gunn For ‘Guardians Of The Galaxy 3’,03-15-2019 14:03:32
3,Leo gets the Oscar!,02-28-2016 23:55:52
4,Sir Sean Connery dies aged 90,10-31-2020 08:26:20
5,"Hey everyone, Guillermo here. I wanted the Reddit community to be the first to see the official artwork for my new film, The Shape of Water. Enjoy!",10-19-2017 17:11:09
6,"When cast in ""Big Fat Liar"", John Cho was asked to do his role with an accent. He turned down the part, saying he didn't want young people thinking it was okay to laugh at someone's accent. In Cho's entire career, he has not once played a character with a fake accent",08-17-2020 14:37:22
7,"‘Matrix 4’ Officially a Go With Keanu Reeves, Carrie-Anne Moss and Lana Wachowski",08-20-2019 16:10:42
8,"Stan Lee, Marvel Comics' Real-Life Superhero, Dies at 95",11-12-2018 13:50:22
9,Terminator came out 35 years ago - here are some of my personal behind the scenes shots,10-26-2019 15:09:25
10,The World Unites on One Thing: No One Wants a Princess Bride Remake,09-22-2019 15:01:43
11,First Image of Tom Holland as Nate in Uncharted,10-22-2020 10:49:31
12,'Joker' becomes first R-rated movie to gross $1 billion worldwide,11-15-2019 14:45:19
13,Tom Hanks as Mister Rogers on the set of 'You Are My Friend',09-27-2018 14:59:13
14,"Peter Mayhew, actor of Chewbacca from 'Star Wars', has passed away",05-02-2019 18:34:45
15,Robin Williams dead at 63,08-11-2014 18:56:13
16,"Jagshemash. My name Borat. My new moviefilm is streams in Amazon. Please you will watch then spray me with questions. I strong, I have survive syphilis 17 time, I can take whatever you want pump on me! AMA!",10-27-2020 17:28:36
17,First poster for ‘Wonder Woman 1984’,06-05-2019 15:01:10
18,Verne Troyer passed away today,04-21-2018 16:05:38
19,"Comedian Jerry Stiller, Seinfield Star And Father Of Ben Stiller, Dies Aged 92",05-11-2020 04:30:38
20,Jordan Peele is the first black writer to win Oscar for best original screenplay.,03-04-2018 22:50:16
21,First Image of Josh Brolin as Cable in Deadpool 2,08-07-2017 11:26:24
22,"ASSHOLES OF R/MOVIE, GREAT SUCCESS! Join us for an AMA with famous journalist Borat this October 27th at 3:30 PT",10-23-2020 16:56:26
23,"'Zombieland' Sequel a Go With Emma Stone, Woody Harrelson, Jesse Eisenberg, Abigail Breslin",07-13-2018 15:43:58
24,Golden Globes: 'Spider-Man: Into the Spider-Verse' Wins Best Animated Feature,01-06-2019 20:31:44
25,First image of Pixar's 'Lightyear' Starring Chris Evans - the definitive story of the original Buzz Lightyear,12-10-2020 19:40:32
26,Ryan Reynolds to Produce 'Stoned Alone' - R-Rated Re-imagining of Classic 'Home Alone',07-25-2018 18:34:36
27,How the HALO jump scene from MI: Fallout was filmed. The cameraman also jumped with Tom Cruise.,04-16-2020 11:11:55
28,"Adam West, Straight-Faced Star of TV's 'Batman,' Dies at 88",06-10-2017 11:21:31
29,Pixar's Incredibles 2 Trailer,11-18-2017 10:44:04
30,'Borat 2' Has Already Been Shot and Screened by Sacha Baron Cohen,09-08-2020 18:09:05
31,Carrie Fisher dead at age 60,12-27-2016 12:52:18
32,"Why Everybody Should Be Very Afraid of the Disney Death Star: “Disney would control as much as 40 percent of the the U.S. movie business, and 40 percent of the U.S. television business”",12-15-2017 11:41:55
33,"Harvey Weinstein Guilty: Jury Convicts Him of Rape, Criminal Sexual Act",02-24-2020 13:01:44
34,James Cameron congratulates Avengers: Endgame on becoming the biggest film of all time,07-22-2019 07:05:22
35,Louisiana Police Apologize for Using ‘The Purge’ Siren to Signal Coronavirus Curfew,04-07-2020 18:12:07
36,Parasite Wins Best Picture at the 92nd Academy Awards,02-09-2020 23:28:06
37,Finally filming Kung Fury 2,09-13-2019 09:23:31
38,RIP Peter Sallis - Wallace and Gromit,06-06-2017 04:34:13
39,Ryan Reynolds starring in movie about a man who realizes he's a background character in a video game. Stranger Things' producer Shawn Levy to direct,09-28-2018 12:39:28
40,"There are less than a dozen remaining Blockbusters in the United States. One of them has a Twitter account, and it's pretty hilarious.",08-04-2017 07:43:14
41,New 'Deadpool 2' Poster,02-06-2018 08:59:20
42,"Christopher Nolan's Dunkirk is the only live-action film in the top 25 worldwide box office of 2017 to be original—not an adaptation, remake or sequel.",12-31-2017 11:59:30
43,"Ten Years Later, 'The Social Network' Has Become a Supervillain Origin Story",09-25-2020 10:05:17
44,Dune Official Trailer,09-09-2020 12:18:11
45,"First image of Adam Driver and Lady Gaga as Maurizio Gucci and Patrizia Reggiani in Ridley Scott’s ‘House of Gucci’ - The story of how Patrizia Reggiani, the ex-wife of Maurizio Gucci, plotted to kill her husband, the grandson of renown fashion designer Guccio Gucci.",03-09-2021 15:06:28
46,The Batman - DC FanDome Teaser,08-22-2020 20:57:33
47,Netflix takes over lease to iconic but failed 71-year-old movie theater in New York City to show its own original films.,11-26-2019 09:24:41
48,"Netflix got booed at Cannes, but it's not responsible for killing movies; at least it finances auteurs. A lot of blame should go to the major studios, which have become sequel and franchise-obsessed",05-21-2017 19:23:40
49,Quentin Tarantino won’t recut “Once Upon a Time in Hollywood” for China,10-19-2019 08:03:13
50,My Grandmother kept a diary of the films she'd seen and gave them ratings. This was her diary from 1942.,10-17-2020 10:55:12
51,New picture of John Wick 3,07-19-2018 09:25:50
52,Dave Prowse: Darth Vader actor dies aged 85,11-29-2020 01:10:00
53,"Sony, Marvel Make Up: Companies Will Produce Third ‘Spider-Man’ Film",09-27-2019 11:03:40
54,About 60 artists who created hero makeups and background masks in 'Bright' were left out of the credits,12-26-2017 11:08:09
55,"'Borat' Sequel Fans Raise $50,000 for Unemployed Babysitter Duped in Sacha Baron Cohen Film",10-28-2020 11:26:38
56,"Deadpool 2 | Official HD Deadpool's ""Wet on Wet"" Teaser | 2018",11-15-2017 09:00:36
57,"The movie ""The Princess Bride"" meant so much to Andre the Giant that he made his wrestling friends watch an advanced copy of the VHS with him over, and over, and over again. He'd supply dinner, drinks and sweetly asking them each time, “What did you think of the movie? Did you like my performance?”",10-04-2018 04:45:22
58,Star Wars: The Last Jedi - Official Teaser Trailer,04-14-2017 11:56:19
59,"In 1979's Alien, the alien only had 4 minutes of total screentime. Vader had 8 min 6 sec in 1977's Star Wars. Jaws only had 4 minutes screen time. Less can be more.",05-02-2020 11:43:11
60,A Texas theater shut down a few weeks ago. This week they decided to turn their outside wall & parking lot into a drive-in theater with free screenings & carry-out food for sale. Every ticket through Tuesday has been sold out and the theater is planning on adding additional showtimes to meet demand.,03-31-2020 10:02:13
61,First images from the new animated Scooby-Doo film 'SCOOB!' via Fandango,11-07-2019 15:07:21
62,The first film to be screened in Saudi Arabia after a 35-year ban on cinemas was 'The Emoji Movie',01-15-2018 08:21:28
63,How Disney changed Lilo & Stich after 9/11,10-13-2018 09:46:17
64,Sonic The Hedgehog (2020) - New Official Trailer - Paramount Pictures,11-12-2019 05:55:28
65,"First poster for the upcoming film ""Glass""",06-29-2018 09:10:18
66,‘Cats’ fans demand Universal Pictures to ‘release the butthole cut’,03-18-2020 08:55:06
67,Netflix's Upcoming 'Black Mirror' Film Will be a Choose-Your-Own-Adventure With 5+ Hours of Footage,12-24-2018 12:31:25
68,Tom Hanks to Play Mr. Rogers in ‘You Are My Friend’,01-29-2018 13:31:13
69,"First Official Image from ""Zombieland: Double Tap""",01-29-2019 15:31:53
70,James Cameron congratulates Kevin Feige and Marvel!,05-09-2019 01:35:23
71,"Movie posters for ""Toy Story 4"" and ""Child's Play""",04-30-2019 14:12:50
72,Oscar Isaac To Star As Solid Snake In Sony’s ‘Metal Gear Solid’ Movie,12-04-2020 12:07:00
73,"Joe Ruby, the co-creator of ""Scooby-Doo,"" has died at 87",08-27-2020 15:21:13
74,"I listed more than 1,800 must-see movies and arranged them by genre and themes on a giant imaginary roadmap",10-29-2017 18:53:51
75,Joaquin Phoenix Wins Best Actor for 'Joker' - SAG Awards,01-19-2020 22:29:50
76,Marvel Studios' Avengers - Official Trailer,12-07-2018 08:02:21
77,"Ryan Reynolds’ 'Free Guy' Receives July 3, 2020 Release Date - About a bank teller stuck in his routine that discovers he’s an NPC character in brutal open world game.",02-23-2019 09:22:53
78,Tarantino Made ‘Right Decision’ Refusing to Edit ‘Hollywood’ for China,01-15-2020 09:35:01
79,Gene Wilder Dead at 83,08-29-2016 15:21:47
80,The Cast of Guardians of the Galaxy release statement on James Gunn,07-30-2018 12:43:56
81,Borat sequel titled Borat: Gift of Pornographic Monkey to Vice Premiere Mikhael Pence to Make Benefit Recently Diminished Nation of Kazakhstan,09-26-2020 16:17:11
82,First image of Eddie Murphy and Arsenio Hall in Coming 2 America,12-17-2020 10:03:11
83,Hayao Miyazaki Got So Bored with Retirement He Started Directing Again ‘in Order to Live’,02-04-2021 09:03:43
84,‘Star Wars’ Setback: ‘Game Of Thrones’ Duo David Benioff & D.B. Weiss Exit Trilogy,10-28-2019 23:40:23
85,The voice cast of Jon Favereau's 'The Lion King',11-01-2017 18:36:37
86,"Actor Danny Masterson Charged With Raping 3 Women, Faces 45 Years In Prison",06-17-2020 17:30:05
87,SPIDER-MAN: FAR FROM HOME - Official Teaser Trailer,01-15-2019 08:59:48
88,"50,000 sign petition for Disney to rehire James Gunn for Guardians of the Galaxy Vol. 3",07-22-2018 12:32:42
89,‘Deadpool 3’ Confirmed for the MCU; Kevin Feige Teases R-Rating and When It’s Filming,01-11-2021 10:23:51
90,‘Avengers: Endgame’ Finally Conquers King of The World James Cameron’s ‘Avatar’ To Becoming The Highest Grossing Film Of All-Time,07-20-2019 20:37:12
91,Channing Tatum Joins the Cast of Ryan Reynolds’ Action-Comedy ‘Free Guy’ - About a bank teller stuck in his routine that discovers he’s an NPC character in brutal open world game.,06-15-2019 20:33:23
92,"First image of Kristen Stewart as Diana, Princess of Wales, in Pablo Larraín’s SPENCER.",01-27-2021 09:01:05
93,I quit my day job to make what I genuinely think is the most helpful movie suggestion website in the world: recommending highly-rated BUT little-known movies. Would love to hear what you guys think,10-03-2017 10:40:41
94,Buster Keaton gets rejected by a hatcheck girl without a word being spoken in Seven Chances (1925),02-06-2018 00:02:46
95,"Christopher Lee, veteran actor, dies at 93",06-11-2015 07:28:12
96,‘Spider-Man: Into the Spider-Verse’ Sequel Lands April 8 2022 Release Date,11-01-2019 17:01:40
97,"Peter Jackson’s LOTR Was an Improbable Miracle, and We’re Lucky to Have It",05-27-2020 10:32:38
98,Elijah Wood And Daniel Radcliffe Unite For Empire’s Harry Potter And Lord Of The Rings 20th Anniversary Issue,02-12-2021 12:19:20
99,New Image from Netflix's Post-Apocalyptic Zombie-Thriller 'Cargo' - Starring Martin Freeman & Anthony Hayes,02-17-2018 10:14:20
100,"Chadwick Boseman’s Wife, Simone Ledward Boseman, Tearfully Accepts His Posthumous Golden Globe",02-28-2021 22:48:38
101,Bring Back Hand-Drawn Disney Animation,07-23-2019 12:56:41
102,"‘Joker’ Has Become The Highest Grossing R-Rated Movie Ever Worldwide With $785.5M, Surpassing 'Deadpool 2'",10-25-2019 13:21:44
103,Ryan Reynolds Opens Streaming Service That Only Streams 2003's Foolproof - IGN,08-14-2020 11:04:50
104,"Disney bought Marvel for $4 billion in 2009, a decade later it's made more than $18 billion at the global box office",07-21-2019 16:03:46
105,Netflix now has the option to turn off autoplay previews.,02-06-2020 14:56:06
106,Disney Admits Mulan Controversy Pileup Has Created a “Lot of Issues for Us”,09-12-2020 06:22:10
107,"Adam Sandler said he would make a terrible film if he didn't win a Best Actor Academy Award for Uncut Gems. To help him out, I analyzed his films and their movie posters to come up with a perfectly bad Sandler film entitled 'Jacked Up'",06-16-2020 10:14:55
108,Marvel Studios' Avengers: Endgame - Official Trailer,03-14-2019 08:06:07
109,"Joan Lee, Wife of Marvel Comics Legend Stan Lee, Dies at 93",07-06-2017 18:40:53
110,Lucasfilm congratulates Marvel Studios for claiming the title of Biggest Opening Weekend,04-30-2018 22:21:42
111,"The year that made The Matrix, Office Space, The Iron Giant, The Sixth Sense, American Beauty, The Blair Witch Project, Fight Club, and more: Looking back at 1999, before franchises took over theaters",02-05-2018 15:43:26
112,"First Poster for 'Holmes & Watson' - Comedy-Mystery Starring Will Ferrell, John C. Reilly, Ralph Fiennes, Rebecca Hall, Noah Jupe, and Kelly Macdonald",08-23-2018 18:23:27
113,"'Knives Out', 'Uncut Gems', 'Sorry to Bother You', 'Atlanta': In a short amount of time, Lakeith Stanfield has established himself as one of the most exciting actors of his generation. Nothing he ever does is like anything he’s done before.",01-24-2020 10:29:19
114,Seth Rogen and The Lonely Island are teaming up for a movie about a music festival that goes horribly wrong.,04-29-2017 09:10:05
115,Walt Disney Company Posts First Quarterly Loss In Almost 20 Years,08-07-2020 09:56:29
116,Official Deadpool 2 Teaser - No Good Deed,03-04-2017 10:58:01
117,"George A. Romero, 'Night of the Living Dead' creator, dies at 77",07-16-2017 17:11:41
118,‘Borat’ Sequel Acquired By Amazon Studios; Sacha Baron Cohen Film Will Bow Right Before Election Day,09-29-2020 15:16:27
119,Poster for Quentin Tarantino's upcoming 'Once Upon a Time in Hollywood',03-18-2019 08:47:14
120,Joker - Final Trailer,08-28-2019 12:00:02
121,a cheer for 'Logan' and 'John Wick 2' for NOT being in 3D!,02-23-2017 10:12:56
122,Harvey Weinstein has been expelled from the Academy of Motion Picture Arts and Sciences,10-14-2017 17:40:34
123,Pro-democracy boycott of Disney's Mulan builds online via #milkteaalliance,09-04-2020 06:26:42
124,I keep all my cinema tickets to stick in this book and do a quick doodle with each one- I though reddit would enjoy the one from Wednesday’s double bill,05-17-2019 07:18:04
125,First image from The Adam Project starring Ryan Reynolds - A man travels back in time to get help from his younger self to confront their late father.,11-29-2020 13:30:50
126,"Quentin Tarantino Has Finished the Script for His Ninth Movie, About the Manson Family Murders",11-02-2017 11:45:24
127,New Star Wars The Force Awakens Trailer!,04-16-2015 14:03:51
128,[self] Dear Netflix - stop auto-playing every time I want to look at a title.,07-09-2018 03:27:58
129,Hollywood actor Jeff Bridges diagnosed with lymphoma,10-19-2020 20:33:11
130,I tried to make the mask from the mask today,01-21-2019 21:30:19
131,Monty Python star Terry Jones dies aged 77,01-22-2020 07:45:35
132,"Brendan Fraser on His Comeback, Disappearance, and the Experience that Nearly Ended His Career",02-22-2018 09:21:55
133,"Chinese poster for Spirited Away, to be screened for the first time in China",06-07-2019 13:13:25
134,"Lord of the Ring's 'Battle of Helm's Deep' battle scene took over 3 and a half months of night shoots to finish. Computer software was created specifically for the scene due to the massive crowds needed. Clocking in at 39 minutes long with a full narrative arc, it is almost a movie within a movie.",05-01-2019 16:40:40
135,Disney would control 40% of the US box office if it buys Fox,07-14-2018 10:34:52
136,New image of Rami Malek as Freddie Mercury in the upcoming Bohemian Rhapsody,04-27-2018 11:24:34
137,Saying a movie has a 'great twist' is the exact same as a spoiler,08-19-2019 07:15:31
138,"Sonic the Hedgehog Movie delayed until February 14, 2020",05-24-2019 11:09:55
139,"David Fincher should make a sequel to 2010’s The Social Network covering the trial that Mark Zuckerberg and Facebook had earlier this year. It would be a rare instance where a sequel manifests itself through real life events and, if the same cast and crew return, I can see it living up to the first.",11-15-2018 19:24:32
140,Burt Reynolds Dies at 82,09-06-2018 14:48:59
141,JOKER - Teaser Trailer - In Theaters October 4,04-03-2019 09:00:52
142,"Research Reveals That Danny Trejo Has Topped Christopher Lee as the Most Killed Actor in Hollywood, With 65 On-Screen Deaths",02-08-2020 10:40:54
143,"Jeremy Bulloch, Original Boba Fett Actor in Star Wars, Dies at 75",12-17-2020 15:38:01
144,An original storyboard from The Terminator by Jim Cameron,08-16-2019 14:02:51
145,The First-Ever Native American-Owned Film Studio is Opening in New Mexico,03-14-2020 11:34:22
146,'Spider-Man 3': Alfred Molina Returning as Doctor Octopus,12-08-2020 13:43:17
147,We’re back. Here’s your Terminator: Dark Fate trailer that doesn’t give the movie away.,05-23-2019 08:59:04
148,"""Avengers: Endgame"" becomes the fifth movie to pass $2B worldwide. Currently it stands at $2.188B making it the second highest grossing film worldwide.",05-05-2019 11:35:42
149,Netflix Has a Page Where You Can Request TV Shows and Movies To Be Added,07-07-2018 12:02:30
150,Guinness World Records Claims 'Borat Subsequent Moviefilm: Delivery of Prodigious Bribe to American Regime for Make Benefit Once Glorious Nation of Kazakhstan' Is Longest Title For An Oscar-Nominated Film,03-27-2021 13:59:42
151,Steven Yeun Snags Historic Lead Actor Nomination - Yeun becomes the first Asian-American performer to ever be recognized in the in the Lead Actor category,03-15-2021 08:44:34
152,"Kirk Douglas, ‘Spartacus’ Star and Legend of Hollywood’s Golden Age, Dies at 103",02-05-2020 18:30:55
153,"Chris Pratt has just said to the mods: ""If you get me to the top of /r/movies, I will do an AMA""! AbVotes to the left!",04-01-2015 05:18:08
154,First Image of Timothée Chalamet in Dune,04-13-2020 07:16:27
155,[Fanart] I relate to Heihei from Moana on a spiritual level so I painted him,07-23-2018 22:59:08
156,Netflix says it is finally adding offline playback,11-30-2016 09:42:15
157,First Image of Shia Labeouf as Shia Labeouf's Father in Shia Labeouf Biopic 'Honey Boy',05-31-2018 17:58:35
158,"Citizen Kane loses 100% ""Fresh"" rating after 80-year-old negative review added to Rotten Tomatoes",04-27-2021 08:05:19
159,My brother and I have been remaking Toy Story 3 in our free time as a passion project for several years now. Here’s the trailer:,09-08-2018 18:47:44
160,'A beautiful day in the neighborhood' Official New Poster.,09-20-2019 09:21:04
161,The Weinstein Company to File for Bankruptcy Tonight,03-19-2018 18:12:01
162,Rami Malek as Freddie Mercury in 'Bohemian Rhapsody',09-05-2017 16:03:35
163,Brad Pitt and Leonardo DiCaprio from ‘Once Upon a Time in Hollywood’,06-27-2018 09:08:08
164,Documentary 'Only Don't Tell Anyone' has sparked outrage against the Catholic Church in Poland after being viewed by 18 million people. Secret camera footage of victims confronting priests about their alleged abuse will now result in 30-year jail terms after confessions were caught on tape.,06-01-2019 11:10:54
165,"Daniel Radcliffe and Robert Pattinson have each starred in big budget, huge franchise movies and used that fame to make bizarre, thought provoking and wonderful films, and cinema is better for it.",09-09-2020 18:17:37
166,Avatar 2: James Cameron reveals filming is '100 per cent complete',09-27-2020 15:29:43
167,"From September onwards, Netflix will become the exclusive US pay TV home of the latest films from Disney, Marvel, Lucasfilm and Pixar",05-23-2016 13:42:51
168,The Guillermo del Toro Produced ‘Scary Stories to Tell in the Dark’ Begins Shooting This Week,08-21-2018 18:38:54
169,"I animated some classic Movie Quotes, with a twist!",11-01-2017 04:37:02
170,Margot Robbie as Sharon Tate in Once Upon a Time in Hollywood,08-06-2018 13:09:29
171,Corey Feldman fundraising $10m to make documentary to expose Hollywoods paedophile ring.,10-26-2017 14:18:08
172,"Christopher Plummer Passes Away At 91; ‘Sound Of Music,’ ‘All The Money In The World’ Star A True Hollywood Legend",02-05-2021 12:53:48
173,Netflix Near $400M+ Deal For ‘Knives Out’ 2 & 3; Daniel Craig & Director Rian Johnson Reprising,03-31-2021 17:06:44
174,"Ryan Reynolds, John Krasinski Teaming Up for Fantasy-Comedy 'Imaginary Friends' - A man who can see and talk to people’s imaginary friends, befriending those that have been forgotten or discarded. Some imaginary friends turn to the dark side and they must save the world from those that become evil.",10-15-2019 19:17:58
175,IT - Official Teaser Trailer,03-29-2017 12:00:12
176,First Official Image from Steven Spielberg's 'Ready Player One',07-14-2017 10:38:16
177,"Michael Bay producing 'Duke Nukem' movie, John Cena in negotiations to star",01-22-2018 20:56:53
178,New Hellboy poster from Entertainment Weekly,10-01-2018 14:11:34
179,"A consistently-great actor for over 30 years, Mark Strong has made a career out of playing sinister-looking spies, villains, assassins, and morally compromised doctors. Looking back at the memorable roles that defined his career.",12-27-2020 12:21:43
180,Danny DeVito to Receive Lifetime Achievement Award for Acting at Camerimage Film Festival,10-31-2019 06:44:16
181,Box Office: ‘Godzilla vs. Kong’ Sets Pandemic Record With $48.5 Million Debut,04-04-2021 10:49:33
182,"Andy Samberg and Craig Robinson team up for Super High, a comedy where smoking weed gives you superpowers",10-16-2020 07:26:54
183,First Poster for Horror-Western 'The Pale Door' - Follows a gang of cowboys who seek shelter in a ghost town after a disastrous train robbery. They soon discover that the town is home to a coven of witches and blood-thirsty wolves.,06-20-2019 12:28:16
184,"The first draft of ‘Anchorman: The Legend of Ron Burgundy’ involved a planeload of news anchors crashing into the mountains, discovering their plane carried monkeys and martial arts equipment, and resulted in a battle between cannibalistic newsmen and star-throwing monkeys.",01-14-2018 17:58:02
185,Coronavirus Hits ‘Elvis Presley’ Film; Tom Hanks & Rita Wilson Bit By The Bug,03-11-2020 21:10:09
186,Tommy Wiseau has released “The Room” in its entirety to his YouTube channel,09-21-2018 15:39:10
187,Benedict Cumberbatch Joins ‘Spider-Man 3’ as Doctor Strange,10-08-2020 13:49:37
188,Deadpool 2 | Official Trailer,03-22-2018 09:00:21
189,Universal Putting Classic Monster Movies Including ‘Dracula’ and ‘Frankenstein’ Up for Free on YouTube,01-07-2021 13:07:24
190,Sir Ian Holm: Lord of the Rings and Alien star dies aged 88,06-19-2020 08:06:37
191,"Almost three months after its premiere, Tony Hawk documentary ‘Pretending I’m a Superman’ finally lands worldwide distribution deal. - Will tell the story of how skateboarding became a part of the mainstream by focusing on the success of the ""Tony Hawk's Pro Skater"" video game franchise.",05-08-2020 13:43:15
192,Johnny Depp Exits 'Fantastic Beasts' Franchise,11-06-2020 11:27:14
193,My character poster for Terminator: Dark Fate,09-10-2019 10:13:54
194,I visited a DreamWorks animation exhibition yesterday; here's an early sketch of Shrek (concept art) from during the film's production.,08-25-2018 09:40:32
195,John Wick: Chapter 3 - Parabellum Official Trailer,01-17-2019 11:07:45
196,"First images of Seth Rogen in 'An American Pickle' - Rogen plays dual leading roles as 1920s immigrant Herschel Greenbaum, who is brined alive for 100 years after falling into a factory vat of pickles and re-emerges in 2020 to live with his Brooklynite app developer great-grandson Ben.",07-01-2020 14:32:38
197,‘Star Wars: Episode 9’ Hires ‘Blade Runner 2049’ Art Director,02-13-2018 16:18:40
198,"Bit of an unusual post, but this is what lurks behind a movie theater screen!",07-10-2017 19:08:58
199,"Dave Bautista to Star in Action-Thriller ‘Killer’s Game’ - About a veteran hitman informed that he has months to live, so he puts out an open contract on himself, only to discover that the lab made a mistake and he’s in perfect health — forcing him to battle an army of assassins out to kill him.",04-11-2019 12:22:52
200,Warner Bros Has Begun Developing Sequel to Sci-Fi Hit ‘Edge Of Tomorrow’,03-01-2019 12:40:51
201,SHAZAM! - Official Teaser Trailer [HD],07-21-2018 14:56:28
202,Leonardo DiCaprio To Star In Quentin Tarantino’s Manson Movie,01-12-2018 14:36:03
203,Ryan Reynolds to Star in Pokemon Movie 'Detective Pikachu',12-06-2017 18:38:26
204,"Black Panther has become domestically the highest grossing superhero film of all time with $630 million, beating previous record holder The Avengers",03-25-2018 12:38:43
205,'Hocus Pocus': How A Critically-Trashed Box Office Bomb Become Disney’s Most Popular Halloween Movie,10-11-2020 13:04:54
206,First image of Tom Holland as Nico Walker from the Russo Brothers’ upcoming thriller film ‘Cherry’ - An Army medic who has returned from Iraq dealing with an opioid addiction and posttraumatic stress disorder begins robbing banks.,11-01-2019 09:13:55
207,The First Purge - Official Poster,01-30-2018 13:21:24
208,"I built a site that combines Rotten Tomatoes, IMDb, Letterboxd and Metacritic ratings, with Netflix and Amazon Prime availability, and can notify you when top rated movies are released on each platform [OC]",12-17-2018 14:37:27
209,"[OPINION] Rich filmmakers who probably haven't paid money to go see a film in a regular modern cinema in years/decades need to stop running their mouths about ""the sanctity of the movie theater experience"" and admonishing home viewing, which is often a far purer film experience these days.",03-10-2019 23:59:04
