idx,title,created_utc
640,"Gal Gadot to produce film adaptation of controversial novel 'Borderlife', about a romance between a Jewish Israeli woman and a Palestinian man. The book's ban by Israel’s education ministry caused protests and was later re-instated.",12-24-2019 19:25:50
641,Every Member of Margot Robbie and Christina Hodson’s All-Women Screenwriting Lab Has Sold a Feature Film,10-15-2020 08:01:12
642,'Men In Black' 'Jump Street' crossover no longer in development,01-08-2019 10:24:29
643,Netflix lost $39 million sacking Kevin Spacey and scrapping his last movie 'Gore',10-26-2018 07:30:01
644,‘The Lord of the Rings’ and ‘The Hobbit’ trilogies coming to 4K UHD,10-11-2019 01:15:55
645,I painted Cameron from Ferris Bueller's Day Off.,04-14-2019 14:36:52
646,The legacy of Alan Rickman: One of Britain’s finest artists,01-14-2021 07:25:42
647,"This has been an unofficial policy for awhile, but effective immediately, any criticism of Disney will officially be an immediate permanent ban.",04-01-2020 14:59:29
648,Aladdin 2019 Poster,10-10-2018 15:04:01
649,"First Poster for Documentary 'Hail Satan?' - Traces the rise of The Satanic Temple, one of the most controversial religious movements in American history.",02-03-2019 11:42:52
650,"First promo picture for Deadpool 2, featuring Domino",07-31-2017 11:48:18
651,First Image of Bruce Willis in Sci-Fi Thriller 'Cosmic Sin' - Seven rogue soldiers launch a preemptive strike against a newly discovered alien civilization in the hopes of ending an interstellar war before it starts.,06-28-2020 14:43:27
652,"Guillermo Del Toro Took a Year Off From Directing to Open an Animation Studio, Establish a Scholarship Program for Young Filmmakers in Mexico, and Open a New Movie Theater in His Hometown",11-05-2018 06:45:06
653,Göteborg Film Festival in Sweden will send ONE person to an isolated island just to watch their festival line up (around 60 movies) for a whole week with no other media allowed.,01-08-2021 04:13:56
654,"The average color of every frame of a given movie, compressed into a single picture.",05-20-2017 21:39:18
655,Bong Joon-ho Confirms 'Parasite' Follow up Films Are on Track for Completion,02-15-2021 08:19:16
656,"Disney Closes $71.3 Billion Fox Deal, Creating Global Content Powerhouse",03-20-2019 00:02:55
657,New poster for ‘Pet Semetary’,02-07-2019 09:06:42
658,"In 2004, Johnny Depp was nominated for an Oscar for his role as Jack Sparrow in Pirates 1. In 2018, he was nominated for a Golden Raspberry for the same role in Pirates 5. Has this happened to any other actor?",10-06-2018 07:44:32
659,Edge of Tomorrow is the perfect blockbuster movie,06-07-2020 11:34:29
660,Rip Torn Dead at 88,07-09-2019 22:40:53
661,Bob Odenkirk Launches His Own Production Company,04-15-2020 12:46:32
662,Super Troopers 2 Movie Poster,03-02-2018 15:34:56
663,John Williams leaves all his scores to Juilliard,03-06-2018 19:07:47
664,WON'T YOU BE MY NEIGHBOR? - Official Trailer,03-20-2018 08:30:26
665,"Bob Iger to step down as Disney CEO, effective immediately",02-25-2020 16:13:08
666,"Netflix to Acquire Zac Efron Ted Bundy Movie ‘Extremely Wicked, Shockingly Evil and Vile’",02-04-2019 14:51:12
667,"Ken Watanabe’s ‘Fukushima 50’ preparing worldwide release - Film about the true story of workers at the Fukushima power plant who worked for 5 days to prevent a nuclear disaster that could've caused the evacuation of Tokyo and other country-crippling damage, following the 2011 earthquake & tsunami.",11-02-2019 09:53:25
668,Hollywood giant MGM puts itself up for sale at $5bn,12-22-2020 19:56:48
669,Carl Reiner Passes Away Aged 98,06-30-2020 09:20:51
670,Alamo Drafthose rolls out nationwide program where patrons rent out an entire theater for themselves – along with their pandemic pod family and friends – for $150 (+ minimum $150 in food/beverages) after 'massively successful' test run.,09-24-2020 11:09:09
671,"‘Bill & Ted Face The Music’ Proving To Be A Huge Success For MGM Making $32M on VOD, Leads Company Towards Profit",09-30-2020 16:07:56
672,The Screaming Bear Attack Scene from ‘Annihilation’ Was One of This Year’s Scariest Horror Moments,12-26-2018 18:06:38
673,Hong Kong Protestors Boycott 'Ip Man 4' for Donnie Yen and Producer's Pro-Beijing Stance,12-24-2019 05:55:10
674,First Poster for Sci-Fi Thriller 'Aniara' - A spaceship carrying settlers to Mars is knocked off course.,03-04-2019 19:29:18
675,"Netflix, Amazon Should Be Recognized at the Oscars",11-22-2017 19:20:54
676,"Since Will Ferrell is going to continue his sports movies, I want a movie where he plays an Olympic Diver that can't swim.",12-10-2016 11:33:39
677,Chinese poster for “1917”. It will be one of the first movies played when Chinese theatres reopen,05-14-2020 06:50:07
678,"Clearing out my parent's attic after dad died, I discovered in an old battered briefcase that from 1954 to 1957, my mum was pen pals with Peter Cushing!",06-15-2018 19:43:39
679,"""The Emoji Movie"" named worst movie of 2017 at The Razzies",03-03-2018 06:44:00
680,Brendan Fraser Says Golden Globes Organization Admits Member 'Inappropriately Touched' Him in 2003,06-06-2018 14:05:25
681,"Dear Hollywood, Please Stop Making Musicals with People Who Can’t Sing",08-18-2018 19:08:51
682,"'Jurassic Park,' 'The Shining,' 'Brokeback Mountain', and 'Rebecca' Enter the National Film Registry, Deeming them Culturally, Historically or Aesthetically Significant",12-12-2018 06:37:15
683,First official look at John C Reilly and Steve Coogan as Laurel & Hardy in Stan & Ollie,08-03-2018 04:19:25
684,Still taken of Tessa Thompson and Chris Hemsworth in Men In Black International,12-07-2018 10:18:12
685,AVENGERS: ENDGAME official poster,12-07-2018 09:00:30
686,"Pornhub to Release First Ever Non-Adult Film, About Black Lesbian Strip Club Culture Titled ‘Shakedown’",03-03-2020 13:18:13
687,Disney Plus Warns Users Older Movies Have ‘Outdated Cultural Depictions’,11-13-2019 13:32:26
688,"Singer from original ‘Lion King’ turned down $2 Million at the time & took $100,000 upfront + royalties instead",10-09-2019 04:19:22
689,"Director Neil Marshall Says His 'Hellboy' Reboot Will Be Bloody, R-Rated And Light On CGI",06-27-2017 11:46:20
690,Harrison Ford Was the Reason Mark Hamill Returned to ‘Star Wars’,10-30-2017 11:48:13
691,Pixar Reportedly Focusing Only On Original Films After 'Toy Story 4' & Other Recent Sequels,05-14-2019 12:27:01
692,Simon Pegg's Upcoming Horror-Comedy ‘Slaughterhouse Rulez’ Will Center Around A Fracking Company That Unleashes a Subterranean Monster,05-25-2018 13:35:37
693,"1983's Grizzly II, a movie about an oversized killer bear that terrorizes a young George Clooney, Laura Dern, and Charlie Sheen as they try to enjoy a music festival, is going to be released after sitting unfinished for decades.",09-01-2020 22:26:55
694,To avoid any potential issues - Should 2020 Oscars be hosted by the Muppets?,11-27-2019 01:14:02
695,AKIRA Imax Poster,03-19-2020 07:43:41
696,'The Last Sharknado: It’s About Time' - Official Poster,07-30-2018 10:44:01
697,'Deadpool' Official Red Band Trailer,08-04-2015 22:59:33
698,"Ever got movie high? Like when the world felt so unreal after watching a good movie, you’re out of the cinema but you just wanna sit and ponder and soak in your emotions.",09-15-2018 03:07:42
699,New Venom poster released,08-01-2018 00:58:31
700,Jim Jarmusch's The Dead Don't Die poster,04-01-2019 11:13:52
701,‘Ghostbusters’ remake is the most disliked trailer of all time on youtube,04-29-2016 16:11:51
702,"Cursing aside, Tom Cruise is right: Covid is a big problem for Hollywood",12-16-2020 13:58:34
703,"A number of months ago, a Reddit thread titled, ""Add ""ing"" to the end of a movie title, what is the movie about now?"" was a hit. I turned some of them into movie posters.",10-10-2016 02:22:07
704,Samuel L. Jackson has announced that he's started his recording sessions for The Incredibles II,12-15-2016 20:43:42
705,New pic of the cast of the new untitled Han Solo 'Star Wars' story,02-21-2017 12:27:44
706,"Deafening cinema sound is ruining films, claims Hugh Grant | Film",10-13-2019 06:05:32
707,"First look at Joaquin Phoenix in make-up from ""Joker""",09-21-2018 13:14:00
708,Disney’s remakes aren’t good because they don’t need to be,09-22-2020 16:34:34
709,Ghostbusters: Afterlife trailer,12-09-2019 09:12:14
710,"First Image of Willem Dafoe in Disney's 'Togo' - About a sled dog who in 1925, helped prevent an epidemic in Nome, Alaska by delivering an antitoxin serum through the punishing elements of the Alaskan Wilderness.",10-24-2019 17:14:28
711,AMC Raises $917 Million to Weather ‘Dark Coronavirus-Impacted Winter’,01-25-2021 07:49:07
712,Captain Marvel trailer,09-18-2018 08:38:40
713,Struggling AMC Chain Launches Private Theatre Rentals Program,11-10-2020 08:02:21
714,"Scorsese, Tarantino, Deakins, Other Filmmakers Call Academy's Oscar Plan ""An Insult""",02-13-2019 21:53:21
715,The Mummy (1999) - An Adventure Masterpiece,10-13-2019 19:58:25
716,The Devil All The Time starring Tom Holland & Robert Pattinson | Official Trailer | Netflix,08-13-2020 08:06:57
717,New Re-Release of Kevin Costner's 'Waterworld' Will Be 40 Minutes Longer than the Original Release,02-11-2019 13:13:50
718,First Image of Joe Pesci and Robert De Niro in 'The Irishman',07-29-2019 12:57:27
719,"Javier Bardem plays Pablo Escobar without 'glamour' in new movie, 'Loving Pablo'. Colombians asked Bardem not to play Escobar with 'glamour' or coolness. ""They don't want their kids to repeat their story,” said the acclaimed actor.",10-05-2018 08:18:27
720,I kinda want to see a Reverse Terminator movie where Skynet sends a Terminator back to protect one of it's creators while the Human Resitance sends someone back in time to kill them.,11-03-2019 00:30:54
721,I got chastised for being on my cell phone BEFORE THE PREVIEWS STARTED!,04-01-2018 18:57:16
722,"Box Office: ""Star Wars: The Last Jedi"" was #1 again this weekend with $68M. However, that marks a massive 68% drop from last weekend, the steepest drop-off ever for a Star Wars film.",12-25-2017 09:52:44
723,"After 20 years, the childlike innocence of Brad Bird's directorial debut 'The Iron Giant' still resonates. The film perfectly delivers on the notions of friendship & heroism, showing us a moving convergence between childhood and adult responsibility.",04-04-2019 06:55:47
724,Johnny Depp's Exit From Upcoming 'Pirates Of the Caribbean' Film Will Reportedly Save the Producers $90M,12-31-2018 18:15:16
725,Paramount Drops 'Transformers 6' from its Slate,02-20-2018 18:44:06
726,Alien Covenant Poster,11-23-2016 18:23:19
727,Mission Impossible Fallout was shown last night on a fjord in Norway for 1500 people.,08-02-2018 08:01:59
728,‘Spider-Man: Into the Spider-Verse’ Sweeps With Seven Wins at Annie Awards,02-03-2019 00:47:05
729,New look at Jared Leto's Joker in the Snyder Cut of Justice League from Vanity Fair,02-09-2021 11:06:12
730,"Native American Chief David Bald Eagle, who appeared in the Oscar-winning 1990 film Dances With Wolves, has died aged 97. The grandson of Chief White Bull, who fought in the Battle of the Little Bighorn in 1876, Bald Eagle appeared in more than 40 films.",07-27-2016 09:22:33
731,"""Kubo and the Two Strings"" is an absolute masterpiece.",01-27-2018 21:33:52
732,"COVID-19 Brutalizes AMC Theatres Quarterly Earnings, Losses Top $900 Million",11-02-2020 16:51:44
733,Keanu Reeves is Training to Kill Everyone Again (in 'John Wick 4' and 'The Matrix 4'),12-20-2019 17:59:18
734,Russia Censors Disney’s First Openly Gay Character From ‘Onward’,02-29-2020 12:12:56
735,"Remembering Arnold Schwarzenegger’s 'Commando,' the Most ‘80s Action Movie of the '80s",10-04-2020 10:38:05
736,"""Spider-Man: Into The Spider-Verse"" To Get National Rerelease This Weekend, Including IMAX and Dolby Shows",02-26-2019 21:39:34
737,T.J. Miller Arrested for Fake Bomb Threat,04-10-2018 12:33:42
738,"Amy Poehler to Direct, Star In and Produce Netflix Comedy 'Wine Country', co-starring Rachel Dratch, Ana Gasteyer, Tina Fey and Maya Rudolph",03-20-2018 16:11:44
739,Studio notes to Spielberg over Back to the Future,08-28-2016 09:40:23
740,No trailer watched = Better movie experience,11-30-2019 07:31:48
741,"Adam Sandler's Netflix deal was a great idea. He doesn't have to worry about box office disappointment, and his films can break all of Netflix's records. His fans will watch regardless of the bad reviews, and Netflix makes it easier to hate-watch. Either way it is more press.",06-17-2016 10:28:41
742,Hollywood is running out of hit ’80s movies to reboot,05-27-2017 11:37:11
743,Watching Madonna’s Truth or Dare is like viewing the world through the eyes of a sociopath,03-30-2021 08:02:24
744,New Poster for Peter Jackson's Critically-Acclaimed World War 1 Documentary 'They Shall not Grow Old',12-01-2018 18:33:55
745,Chinese poster for Fantastic Beasts: The Crimes of Grindelwald,10-29-2018 09:01:32
746,Colin Farrell Officially Joins Matt Reeves' 'The Batman' as The Penguin,01-06-2020 19:49:30
747,"Andy Serkis rallying for performance capture actors, calling for the greater protection of rights & pay for digital performers.",09-17-2019 06:47:49
748,'Forgetting Sarah Marshall' remains one of the better modern comedies. It all starts with the script...,04-17-2018 16:25:18
749,Dwayne Johnson Is Hollywood’s Highest-Paid Actor for Second Year in a Row,08-11-2020 21:18:06
750,"There should be a movie starring Vin Diesel and Terry Crews where they (and their group) play D&D together, but it actually acts out the campaign, switching between the table and the setting, a-la ""The Princess Bride"".",09-12-2016 15:29:04
751,Studio Ghibli’s Hayao Miyazaki Is Coming Out of Retirement,11-13-2016 15:44:31
752,"25 Years Later, Mortal Kombat Remains Cinema's Best Bizarre Video Game Adaptation",08-18-2020 15:33:07
753,Don Bluth Launches New Studio To Usher In 'Renaissance Of Hand-Drawn Animation',09-10-2020 15:55:52
754,"First Images from 'Bill & Ted Face the Music' Starring Keanu Reeves, Alex Winter, William Sadler, Brigette Lundy-Paine, Samara Weaving, Anthony Carrigan & Kid Cudi",12-17-2019 10:08:48
755,"IMO Disney messed up by putting Will Smith's face on Genie's character, not only because the role is so deeply tied to Robin Williams' performance, but also because the Genie is a non-anthropomorphic character. The Genie should've been a fully CGI designed character.",02-11-2019 22:32:37
756,‘Aquaman’s Jason Momoa Joins Killer Cast Of Denis Villenueve’s ‘Dune’,02-14-2019 18:20:17
757,"'The Big Lebowski' To Be Re-Released in Theaters Nationwide on August 5, 2018 & August 8, 2018",07-16-2018 19:07:37
758,Mr. Rogers biopic starring Tom Hanks officially titled “A Beautiful Day In The Neighborhood”,12-27-2018 13:43:24
759,"‘BlacKkKlansman’ Returning to Theaters After Six Oscar Nominations, Expanding to Over 150 Theaters This Week",01-23-2019 18:11:55
760,MoviePass Changed Some Users’ Passwords on Purpose So They Couldn’t Use the Service,08-08-2019 12:32:19
761,Bill Paxton dead at 61,02-26-2017 10:32:47
762,Netflix Will Make Sci-Fi and Fantasy Shows and Movies Its Main Focus - IGN,04-29-2018 02:11:37
763,Mark Wahlberg Originally Rejected His Oscar-Nominated 'The Departed' Role Several Times Before Martin Scorses Convinced Him To Do It,12-30-2018 16:41:39
764,"Blade Runner 2049 premiered on HBO last night, shown fully in it's widescreen format",06-03-2018 12:07:51
765,Max von Sydow dies aged 90,03-09-2020 08:05:28
766,'Ready Player One' Official Trailer,07-22-2017 14:49:06
767,'Spider-Man: Homecoming' - Official Trailer,12-08-2016 23:51:53
768,Regal Cinemas Closing All Theaters Starting Tomorrow Until Further Notice: Coronavirus,03-16-2020 16:52:24
769,Studio Ghibli releases 400 images from eight movies free to download online,09-20-2020 10:51:58
770,'Fantastic Beasts 3' Loses Its Release Date to Denis Villeneuve's 'Dune' - Delay Could Be Longer Than Anticipated,02-18-2019 20:42:15
771,First poster for ‘Doctor Sleep’,06-13-2019 10:07:50
772,"Sexless Comedy, Cool Parents, and a Hilarious Emma Stone: How 'Easy A' Redefined the 2000s Teen Film",09-21-2020 05:11:43
773,"Bryan Cranston as LBJ in HBO's adaptation of ""All the Way"".",09-02-2015 12:59:17
774,"Almost no one I know has seen ""The Nice Guys"" and its a god damn shame.",03-23-2020 23:03:06
775,"John Waters bequeaths his art collection to Baltimore Museum of Art, whose bathrooms will be named in his honor",11-11-2020 17:04:26
776,The Lawyer Dick Cheney Shot in the Face Says He’s Definitely Going to See ‘Vice’,12-21-2018 16:11:37
777,Charlize Theron Says Script For 'Mad Max' Prequel 'Furiosa' Ready To Go,07-11-2017 14:15:11
778,From 'Spectre' to 'Blade Runner 2049': Dave Bautista's Unpredictability Is His Biggest Strength,01-09-2019 22:27:05
779,Simon Pegg has lost weight for his new movie role,03-02-2019 04:25:42
780,William Sadler Will Be Reprising the Role of Death in ‘Bill & Ted 3’,03-25-2019 12:16:55
781,Exclusive new look at Dune,04-14-2020 07:02:04
782,"Andy Serkis rallying for performance capture actors, calling for the greater protection of rights & pay for digital performers.",09-16-2020 15:44:23
783,John Goodman was terrifyingly perfect in 10 Cloverfield Lane. He deserves an Oscar nomination.,12-01-2016 10:19:49
784,"John Williams, at 85, wins 5th Grammy for Star Wars: The Force Awakens",02-12-2017 18:32:33
785,Christopher Nolan's Tenet Budget Is More Than $200 Million,01-10-2020 10:06:16
786,"Poster for ""Five Came Back"", a Netflix documentary about five major American directors who went off to help the war effort in WWII and the films they made when they came home",03-24-2017 09:59:38
787,Five-time Oscar nominee John Seale will come out of retirement to serve as the cinematographer on George Miller’s upcoming 'Mad Max Fury Road' prequel centered on a young Furiosa,05-17-2020 13:07:22
788,"In Japan, the broccoli in ""Inside Out"" was replaced with green peppers, which are more universally hated by Japanese children",07-23-2015 09:50:05
789,Aquaman : First image of Black Manta,06-14-2018 12:53:14
790,"Shia LaBeouf's 'Man Down' receives a UK box-office jump of 200% - ""I think we've sold three tickets in total,"" the cinema manager has confirmed, bringing the film's final theatrical haul in the U.K. to $26.",04-05-2017 08:38:08
791,‘Deadpool 3’: Marvel And Ryan Reynolds Tap The Molyneux Sisters To Pen The Sequel,11-20-2020 14:01:52
792,First behind the scenes look at Mera in upcoming Aquaman movie.,05-18-2017 16:10:45
793,"'It' grosses $51M on Friday. That is the biggest opening day ever for an R-rated film, it has already passed the biggest September opening weekend record in just one day, and it's only $1.5M away from the biggest horror opening weekend ever (Paranormal Activity 3 - $52.5M)",09-09-2017 11:56:22
794,"The Man Behind Pixar’s Deepest Explorations - Pixar always has been known for making profound animated movies, but no one has pushed that imperative further than ‘Soul’ director Pete Docter, who also directed ‘Monsters, Inc.,’ ‘Up,’ and ‘Inside Out.’",12-29-2020 09:14:58
795,'Wonder Woman 1984' Heading to HBO Max and Theaters Dec. 25,11-18-2020 18:36:35
796,"Two Years After Fan Campaigns, John Cho Is Finally a Hollywood Leading Man",07-26-2018 11:51:00
797,'Incredibles 2' Hits $1 Billion at Box Office Faster Than Any Animated Film,07-31-2018 12:11:36
798,"Thank you, Reddit. Without your help, my movie would never have been made. Here's the trailer of ARCTIC, starring Mads Mikkelsen!",01-03-2019 16:59:24
799,We think CGI sucks because we only notice bad CGI,08-04-2015 15:14:37
800,Prop from the upcoming Ghost in the Shell.,02-27-2017 16:43:23
801,Shrek Returns to Theaters for 20th Anniversary,03-12-2021 11:52:55
802,Every suit worn by Robert De Niro in Casino,06-07-2017 15:45:43
803,"'Like mother, like daughter.' New image from action thriller Gunpowder Milkshake starring Karen Gillan, Lena Headey, Michelle Yeoh, Angela Bassett and Carla Gugino",03-16-2021 08:39:58
804,"Ken Burns says his next 6 films will be about Ernest Hemingway, Muhammad Ali, Benjamin Franklin, LBJ, the American Revolution, and buffalos",11-10-2020 23:37:22
805,First Poster for Korean Historical-Zombie Film 'Rampant',10-28-2018 18:27:47
806,"New York's Roosevelt Hotel to close after 96 years due to COVID-19: The iconic hotel was used as a filming location and setting for movies such as The Irishman, Men in Black 3, Malcolm X, Wall Street, The French Connection, 1408, and The Dictator",10-12-2020 10:03:16
807,Report: Netflix apparently shut down its user review platform because of the increasingly bad reviews its original programming received for years,09-07-2018 12:08:31
808,Deadpool 2: The Final Trailer,04-19-2018 08:54:23
809,John Wick Chapter 3 Official Trailer,03-21-2019 11:11:39
810,Hans Zimmer is set to compose the score for Denis Villeneuve’s ‘DUNE’,03-18-2019 12:12:05
811,Danny Devito voicing Detective Pikachu was considered and tested during the early stages of production.,03-18-2019 16:00:04
812,Liam Neeson Was Convinced Taken Would Be a Box Office Bomb,08-11-2020 07:09:46
813,New Zealand: 'One of the very few places you can actually shoot a film right now'.,07-12-2020 15:14:23
814,Chris Tucker Confirms 'Rush Hour 4' is happening,02-21-2018 22:24:27
815,‘Paddington 2’ is the Fourth Film to Score 100% on Rotten Tomatoes With Over 100 Reviews,01-15-2018 18:40:41
816,"David J. Peterson, who crafted the Dothraki and Valyrian languages for HBO’s 'Game of Thrones', is joining Denis Villeneuve's 'Dune' to build & develop the languages of that world.",04-09-2019 18:17:19
817,Cloverfield Paradox has been announced and is also going to be streaming after the game.,02-04-2018 19:25:20
818,Star Wars: Rogue One (Trailer 2),08-11-2016 22:38:39
819,"Harvey Weinstein, Accused of Sex Assault, Facing Arrest in New York",05-24-2018 15:40:26
820,A Klansman whose 1963 church bombing killed 4 little girls died in prison today. Here’s how a 1997 Spike Lee documentary helped bring him to justice,06-26-2020 21:12:27
821,New poster released for ‘Scary Stories To Tell In The Dark’,03-26-2019 11:03:09
822,Does anyone ever experience a “movie high”?,03-08-2019 20:26:43
823,First Image of Natalie Portman as Lucy Cola from Noah Hawley's 'Pale Blue Dot',07-25-2018 14:19:59
824,"Poster for the Restored Re-Release of 1985's 'Come And See' - Generally viewed as one of the most brutal, important anti-war movies ever made.",12-27-2019 12:15:00
825,"Screenwriter of THE INTERVIEW: ""Comedians shouldn’t be held accountable for acts of violence – and those we satirize shouldn’t be silenced.... If all countries made satirical movies about each other, and that was the only way we all fought – what a great world we’d live in""",12-18-2014 08:41:29
826,L.A. Health Department Asks Film Industry to Pause Production,12-28-2020 20:43:20
827,Robert Pattinson to Play ‘The Batman’ for Matt Reeves and Warner Bros.,05-16-2019 20:48:44
828,New poster for John Wick 2,09-21-2016 13:03:43
829,David Bowie has Passed Away at the Age of 69,01-11-2016 01:53:47
830,"In Firing James Gunn, Disney Hurts All of Hollywood",07-25-2018 09:12:40
831,'Avengers: Infinity War' Official Poster (2018),11-28-2017 13:32:16
832,Saudi Arabia Lifts 35-Year Ban On Cinemas; Movie Theaters To Open In March,12-11-2017 05:39:19
833,JUSTICE LEAGUE - Official Trailer 1,03-25-2017 11:00:10
834,"'The Blair Witch Project' changed horror forever: It created a genre and took advantage of trust in the early internet. Its ingenious premise required it to break all the rules: no script, no jump scares, no music, no professional crew, no special effects. Hysteria became its greatest weapon.",04-09-2019 06:51:35
835,Solo: A Star Wars Story Official Trailer,04-08-2018 20:46:03
836,"Keanu Reeves' 'Bill & Ted 3' Facing Production Issues (Financing, Rights, Distribution), Film No Longer Confirmed",07-15-2018 12:41:12
837,"‘Jurassic World: Dominion’ Wraps Unprecedented Shoot After 18 Months, 40,000 COVID Tests & Millions On Protocols; Colin Trevorrow & Donna Langley On The Emotional Journey",11-07-2020 10:13:02
838,"At 20, 'Rush Hour' is still an undeniably charismatic buddy comedy about American complacency",09-18-2018 14:04:00
839,Dunkirk - Official Trailer,12-14-2016 10:00:30
840,Avatar 2 Was Originally Supposed To Be Out This Weekend,12-19-2020 07:12:41
841,Toy Story 4 | Official Trailer,03-19-2019 08:46:19
842,"The Lonely Island were asked to write a song for the Oscars, but it was dropped due to being ""financially and logistically impossible"". They uploaded the demo here",03-05-2018 13:29:57
843,‘The Princess Bride’ Cast To Reunite For Virtual Script Reading,09-04-2020 17:25:36
844,"Not all Netflix movies are bad, it's just that the good ones are so small they don't get attention.",08-16-2020 11:38:56
845,Official 'Guardians of the Galaxy: Vol. 2' Teaser Poster,10-19-2016 11:00:56
846,"'Ford v Ferrari' Official Poster (Matt Damon, Christian Bale)",05-31-2019 12:02:26
847,New poster for Wonder Woman 1984,08-21-2020 11:02:21
848,The Man Who Killed Don Quixote poster,03-07-2019 17:34:08
849,"To keep faithful to the 1931 Frankenstein film, Mel Brooks tracked down the man who designed the original laboratory props and discovered that he had kept many of them. They used those props in Young Frankenstein which gave the lab a wonderfully authentic feel with moving parts, creaking and swaying",05-23-2019 20:57:32
850,Tanya Roberts Passes Away at 65 After Premature Death Announcement,01-05-2021 10:02:23
