idx,title,created_utc
423,James Gunn Boards ‘Suicide Squad 2’ To Write And Possibly Direct,10-09-2018 14:47:24
424,"When the stunt team tried to flip James Bond’s Aston Martin DBS in ‘Casino Royale,’ they found the car too stable to be overturned by an 18” ramp. In their last attempt they fitted the DBS with a gas cannon and ended up rolling the car a total of 7 times, accidentally setting a new world record.",01-10-2018 17:01:53
425,Nicolas Cage made 29 direct-to-video movies in the 2010s. I watched all of them.,03-09-2020 14:06:05
426,Disney CEO Bob Iger Reaffirms That R-Rated Properties Like ‘Alien’ and ‘Deadpool’ Will Continue After The Merger,02-05-2019 17:23:31
427,The Onion: Cool Glitch Effect On Movie Studio Logo Must Mean Shit About To Go Down,04-16-2018 14:44:56
428,"Leonardo DiCaprio's next project ""Devil In The White City"" will reunite him with Martin Scorcese and will see him play one of the most horrific serial killers of all time, the infamous H.H. Holmes, the architect of the ""Murder Castle"" in Chicago.",01-10-2016 11:19:20
429,First Image of Stealth Suit Spider-Man in ‘Spider-Man: Far From Home’,12-08-2018 14:38:12
430,Hans Zimmer Worked with a Choir over FaceTime to Craft the ‘Dune’ Trailer’s Pink Floyd Cover,09-16-2020 09:32:18
431,The oldest film listed on the IMDB is Roundhay Garden Scene (1888.) This is the only 3-seconds of film that survives today.,02-07-2018 15:18:18
432,"First Official Image from ""Bad Boys for Life""",01-30-2019 09:17:21
433,"Stephen King has updated his list of ‘dollar babies’ - stories that aren’t optioned for movies, and that film students can get the rights to for one dollar.",08-29-2019 19:52:40
434,Marvel Studios' Avengers: Infinity War - Official Trailer,03-16-2018 09:02:53
435,Taika Waititi to Direct and Co-Write new Star Wars Feature Film for Theatrical Release; Oscar Nominee Krysty Wilson-Cairns to Co-Write Screenplay with Waititi | StarWars.com,05-04-2020 12:04:45
436,I miss going to the movie theater.,01-16-2021 06:17:28
437,"Star Wars: The Last Jedi's runtime is 150 minutes (credits included), making it the longest film of the franchise",11-17-2017 11:47:30
438,Christopher Nolan’s ‘Tenet’ Delayed Indefinitely,07-20-2020 12:30:47
439,"150 movie theaters have signed up for a new streaming program, which will split the revenue between the distributor & the theater. When buying the movie online, you pick the theater you want to support, and they will get a split of the money, starting with Cannes winner 'Bacurau'.",03-29-2020 13:51:24
440,Disney Severs Ties With ‘Guardians Of The Galaxy’ Director James Gunn Over Old Offensive Tweets,07-20-2018 15:21:54
441,"Twenty years ago, an upstart animator named Mike Judge changed how we think about office culture, adulthood, and red staplers. At first a box office flop, ‘Office Space’ has took on cult classic status by holding up a mirror to the depressing, cynical, and the farcical nature of the modern office",04-05-2019 11:47:57
442,"Banning Netflix, Amazon From Festivals And Awards Is Wrong",03-27-2018 09:28:09
443,Gal Gadot to voice Wonder Woman in The LEGO Movie 2: The Second Part,01-13-2019 10:09:54
444,Star Wars: The Last Jedi Official Trailer,10-09-2017 21:59:09
445,"James Cameron attempted to buy the rights to the novel ""Jurassic Park"", but Spielberg beat him by a few hours. He described his version as ""'Aliens' with dinosaurs.""",04-03-2018 09:30:07
446,First Aquaman Poster,07-16-2018 12:01:22
447,Disney will pull its movies from Netflix and start its own streaming services,08-08-2017 16:11:06
448,POKÉMON Detective Pikachu - Official Trailer #2,02-26-2019 11:58:16
449,"First Image of Tommy Lee Jones in 'Wander' - Plays an eccentric conspiracy theorist & private detective investigating a local murder. - Also starring Aaron Eckhart, Katheryn Winnick and Heather Graham.",11-09-2019 09:35:16
450,'Logan' Official Trailer,10-20-2016 09:00:04
451,Harvey Weinstein Turns Himself in to Authorities,05-25-2018 07:29:47
452,Donald Glover will voice Simba in Jon Favreau's 'The Lion King' Remake,02-17-2017 19:25:39
453,New Poster for 'Tesla' starring Ethan Hawke.,07-21-2020 10:11:24
454,Pre-Production Has Begun on 'John Wick: Chapter 3',12-05-2017 19:50:44
455,New Poster for Jordan Peele’s ‘Us’,12-13-2018 11:14:43
456,"Dave Chappelle to Receive Mark Twain Prize for American Humor from Kennedy Center, Honoring His Career Achievements in Comedy",05-08-2019 06:58:47
457,"Talked about Walt Disney’s multiplane camera in a class about film analysis today, and I see it as my civic beauty to remind you all of its beauty",11-22-2018 13:34:32
458,New images from Space Jam: A New Legacy,03-04-2021 11:07:28
459,‘Spider-Man: Into The Spider-Verse’ Sequel Production Underway Ahead Of 2022 Release,06-09-2020 09:54:59
460,"‘Predator’, 'Alien' and ‘Hellboy’ Makeup Artist Matt Rose Has Died",01-28-2019 19:52:51
461,The Disaster Artist Teaser,07-18-2017 09:02:07
462,Kevin Smith in hospital recovering from a heart attack earlier today.,02-26-2018 03:24:29
463,"Pixar's ""Bao"" is free on YouTube for a week, to celebrate its Oscar shortlisting!",12-18-2018 00:20:04
464,Danny Trejo to voice Boots in live-action Dora the Explorer,03-21-2019 16:53:10
465,Poster for the 50th Anniversary Re-Release of Stanley Kubrick's '2001: A Space Odyssey',05-16-2018 12:41:24
466,Jake Gyllenhaal officially confirms Mysterio role in Spider-Man: Far From Home,12-05-2018 17:48:36
467,"Stephen Chow Confirms ""Kung Fu Hustle 2""",02-12-2019 13:50:39
468,"Disney Dropping ‘Fox,’ Rebranding Division as 20th Century Studios",01-17-2020 12:01:45
469,"'Tony Hawk's Pro Skater,' a video game that defined a generation, gets its own documentary",02-20-2020 16:19:08
470,Someone Put a Statue of Jason Voorhees in a Minnesota Lake For Divers to Stumble Across,02-28-2018 17:19:16
471,"Incredibles 2 becomes first animated film to pass $600M domestic. Also, it's the third Disney produced superhero film to pass $600M domestic this year.",09-02-2018 12:26:47
472,"Kazakhstan's tourism board has adopted the Borat catchphrase ""very nice"" in its new advertising campaign",10-27-2020 06:10:25
473,"M. Night Shyamalan's latest film ""Split"" has closed its box office run, earning $138M domestic and $275M worldwide on a budget of just $10M",05-07-2017 15:18:56
474,Elton John Questions Catholic Church for Investing in ‘Rocketman’ but Remaining Anti-Gay Marriage,03-15-2021 20:10:08
475,IT CHAPTER TWO - Official Teaser Trailer,05-09-2019 11:58:05
476,"Walmart announces free drive-in movie screenings of Black Panther, LEGO Batman, E.T., and more",08-05-2020 09:23:43
477,New Poster for Disney-Pixar’s ‘Soul’,10-25-2020 11:24:30
478,David Fincher Says Sacha Baron Cohen Looked ‘Spectacular’ as Freddie Mercury in Unmade Biopic,02-17-2021 09:59:26
479,New 'Ant-Man and the Wasp' image released.,01-16-2018 14:15:42
480,Amazon to buy MGM Studios for $8.45 billion,05-26-2021 08:38:59
481,"During test screenings of ""The Disaster Artist,"" the biggest comments from test audiences was that they didn't believe it was actually a true story",12-11-2017 12:49:44
482,"""The Great Gatsby"" is entering the public domain and we’re due for a Muppet adaptation",01-01-2021 11:06:58
483,"Yes, Michael Keaton Really Is Playing Batman in ‘The Flash’ - After hesitating over COVID concerns, the actor joins cast as U.K. production begins this week, confirms his agency",04-19-2021 16:19:23
484,First image of Al Pacino as Jimmy Hoffa in Martin Scorcese's 'The Irishman.',10-12-2017 15:16:30
485,Chadwick Boseman Boosted Sienna Miller’s 21 Bridges Salary From His Own Pay,09-28-2020 08:12:02
486,New Poster for Wes Anderson's 'Isle of Dogs',12-19-2017 13:47:39
487,'Star Trek' actor Anton Yelchin dies in car crash at age 27,06-19-2016 13:55:47
488,First Image from Zombie-Thriller 'Blood Quantum' - A deadly zombie plague spreads across the globe. An isolated Native American reserve becomes a front line and battle zone after it's discovered that the indigenous inhabitants are immune to the virus.,05-01-2019 12:21:00
489,"Hugh Grant Considers Paddington 2 to be “kind of a masterpiece,” and If His Children Talk Smack About It, ‘They Don’t Get Fed’",11-19-2020 16:52:41
490,"New poster for “Dolittle”, releasing January 17, 2020.",10-12-2019 18:09:41
491,Hundreds Of Children Terrified When Movie Theatre Plays La Llorona Instead Of Detective Pikachu,05-10-2019 14:23:41
492,"I zoom bombed a Kindergarten Cop reunion, and I thought you guys might enjoy it. I had a blast.",12-21-2020 10:49:17
493,My 12 year old is pissed at me because he accidentally proved that Die Hard is indeed a Christmas movie. [SPOILERS],12-04-2020 21:37:37
494,"Home Alone Is 30, Ya Filthy Animal",12-15-2020 08:59:47
495,Dunkirk - Official Poster,12-12-2016 10:43:53
496,"First Image of Adam Driver in Drama 'The Torture Report' - Explores the aftermath of the 9/11 attacks, when CIA agents begin using extreme interrogation tactics on those they think were behind it.",11-30-2018 22:10:55
497,Wizard of Oz was one of the first movies to truly capture my imagination. Here is my fan art dedicated to that timeless classic.,03-16-2019 15:55:46
498,Incredibles 2 - New Official Trailer,04-13-2018 08:02:01
499,'Avatar' Re-Release Has Grossed More in China Than 'Mulan',03-21-2021 15:00:17
500,First Image of Nicholas Hoult in Biopic 'Tolkien' - Will Explore the Life of 'Lord of the Rings' Author JRR Tolkien,01-26-2019 16:14:45
501,Disney lost the Best Animated Film for the first time since 2006,02-25-2019 08:23:51
502,Poster for Good Boy (starring Judy Greer) - An anxious woman's demonic emotional support dog kills anyone who causes her stress,06-02-2020 15:07:58
503,"No Responders Left Behind (2020) - Official Trailer - This documentary follows John Feal, and JonStewart in their battle to get healthcare and financial benefits for those affected by 9/11 related illnesses.",09-11-2020 08:05:55
504,First Poster for Spike Lee’s BLACKKKLANSMAN,05-17-2018 12:59:54
505,Amazing shot from Sergey Bondarchuk's 'War and Peace' (1966),07-15-2019 19:55:10
506,"Amid social distancing, drive-in theaters unexpectedly find their moment",03-19-2020 10:57:55
507,"First poster for ""Bohemian Rhapsody"" with Rami Malek as Freddie Mercury",05-13-2018 17:06:18
508,Jeff Goldblum Joins 'Jurassic World' Sequel,04-25-2017 21:37:03
509,"‘It’ Tops $500 million worldwide, making it the highest grossing horror film ever.",09-28-2017 17:01:17
510,"First Poster for Drama 'Three Christs' - Starring Peter Dinklage, Richard Gere, Walton Goggins and Bradley Whitford. - True story about a doctor treating three paranoid schizophrenic patients who all believe they are Jesus Christ.",12-18-2019 06:41:38
511,"I saw a Cinemax commercial over 10 years ago that blew my mind. I've been searching for it ever since with no luck. Today, I finally found it.",08-31-2018 10:17:20
512,Disney produced an unprecedented 80 percent of the top box office hits this year,12-23-2019 15:27:29
513,Bo Burnham's ‘Eighth Grade’ Is the First Movie to Nail Youth Culture in the Digital Age,08-05-2018 18:49:20
514,"New poster for Guillermo del Toro's ""The Shape of Water""",09-14-2017 09:49:31
515,'Spider-Man: Homecoming' - Official Poster,03-24-2017 14:05:52
516,"Former actor Corey Feldman has completed a documentary about abuse in Hollywood. The film, titled 'Truth: The Rape of Two Coreys', has been rejected by a number of studios and networks, including Lifetime, which aired 'Surviving R. Kelly'.",04-25-2019 17:05:40
517,New poster for Wes Anderson’s The French Dispatch,02-11-2020 09:01:45
518,'Terminator 2: Judgment Day' fan screening turned out to secretly be a screening of the upcoming 'Terminator: Dark Fate',10-20-2019 22:48:59
519,Sir Roger Moore Passes Away,05-23-2017 09:15:37
520,SPIDER-MAN: INTO THE SPIDER-VERSE - Official Trailer (HD) - YouTube,06-06-2018 09:00:31
521,FUCK YOU NETFLIX STOP CUTTING OFF THE CREDITS,09-07-2018 04:43:47
522,"First Poster for World War 2 Thriller 'Burial' - Follows a small band of Soviet soldiers who must escape from Berlin to Moscow whilst harboring one of the world’s greatest secrets, Hitler's remains. - Described as a mix between 'Green Room' & 'Don't Breathe'.",06-13-2020 14:38:57
523,Metro 2033 film has been cancelled because the scripter wanted to 'Americanize' it,12-11-2018 07:14:14
524,Box Office Week: Joker opens to #1 with a phenomenal $93.5M and $234M worldwide. That's the biggest October opening ever and the 4th biggest opening ever for an R-rated film.,10-07-2019 08:00:21
525,New Poster Of Jackie Chan’s Next Blockbuster THE FOREIGNER,06-21-2017 23:42:58
526,"'Free Guy' Official Poster (Ryan Reynolds, Taika Waititi)",10-03-2019 14:06:56
527,"Disney Pulls 'Artemis Fowl' From Theaters, Will Debut On Disney +",04-03-2020 14:34:50
528,‘Judas And The Black Messiah’ Inspires Congressman To Reintroduce Bill To Strip J. Edgar Hoover’s Name From FBI Building,03-08-2021 16:58:05
529,Christopher Nolan Says Fellow Directors Have Called to Complain About His ‘Inaudible’ Sound,11-12-2020 11:49:58
530,"New Keanu Reeves movie ""Replicas"", about a brilliant neuroscientist who brings back his wife and children after they died in a car accident, is already shooting",09-07-2016 11:13:55
531,"In 1971, actor George C. Scott was nominated and eventually won the Best Actor Oscar for his role in 'Patton'. He refused to accept the award based on his belief that each performance is unique and actors shouldn't be in competition with each other. He stayed home and slept through the awards show.",06-29-2019 23:11:41
532,Hayao Miyazaki has turned down multiple offers from Hollywood to make live-action Nausicaa movie,10-06-2019 15:06:31
533,Kelly Preston dead: John Travolta‘s wife dies aged 57,07-13-2020 01:28:46
534,Lucasfilm to start production on Obi-Wan Kenobi Star Wars spinoff in January 2019,12-09-2017 18:49:46
535,James Earl Jones Confirmed as Voice of Darth Vader in Rogue One: A Star Wars Story,06-23-2016 12:49:19
536,Super Troopers 2 - Trailer,01-18-2018 17:07:12
537,First Image from the Addams Family Animated Movie,06-05-2018 14:38:45
538,Cannes festival venue opens doors to homeless instead of cinema figures,03-26-2020 07:11:46
539,ROGUE ONE: A STAR WARS STORY Teaser Trailer,04-07-2016 07:49:36
540,Four new images of Robert de Niro in Martin Scorsese's The Irishman,09-25-2019 14:52:24
541,"Joel Schumacher, Director of Batman Films, Dies at 80",06-22-2020 13:44:05
542,Cineplex Execs Take 80 Percent Pay Cut Amid Theater Worker Layoffs,03-23-2020 11:36:25
543,Wonder Woman 1984 – Official Trailer,12-08-2019 16:02:28
544,The opening scene of 28 weeks later is the most scary and horriffic thing I wish never to experience.,06-18-2017 08:56:13
545,El Camino: A Breaking Bad Movie | Official Trailer | Netflix,09-24-2019 09:04:59
546,"'The Hitman's Bodyguard' - Official Poster (Ryan Reynolds, Samuel L. Jackson)",04-15-2017 09:03:12
547,Dear People Who Won't Shut Up In Movie Theaters: You're The Worst,03-31-2018 06:27:12
548,Guillermo del Toro Directing ‘Pinocchio’ for Netflix,10-22-2018 10:31:26
549,"Rick Moranis Closes Deal To Return To ‘Honey, I Shrunk The Kids’ Franchise With ‘Shrunk’ At Disney",02-12-2020 13:05:28
550,Once Upon a Time in Hollywood Trailer,03-20-2019 08:55:21
551,IT (2017) - Official Trailer,07-27-2017 12:00:15
552,Star Wars: The Force Awakens - Official Poster,10-18-2015 12:00:26
553,Guardians Of The Galaxy vol 3 put on hold,08-24-2018 18:26:12
554,New Poster for Jordan Peele’s ‘Us’,02-06-2019 11:10:57
555,Ready Player One- Official Trailer #1,12-10-2017 13:01:17
556,"Seth Rogen Criticizes Sony's Plan to Release ""Clean Versions"" of Films",06-06-2017 17:38:51
557,"First images of George Clooney, Kyle Chandler, Felicity Jones, David Oyelowo and Tiffany Boone in 'The Midnight Sky' - A lonely scientist in the Arctic races to stop a team of astronauts from returning to a post-apocalyptic Earth after a mysterious global catastrophe.",09-25-2020 08:12:42
558,Jerry Bruckheimer has confirmed that a third ‘NATIONAL TREASURE’ film is in active development at Disney with the screenplay currently being written.,05-07-2020 15:15:19
559,'Cats' - Review Thread,12-18-2019 19:02:46
560,First image of Dennis Quaid as Ronald Reagan in the ‘REAGAN’ biopic,01-21-2021 09:09:51
561,A24’s Highly Anticipated ‘The Green Knight’ Gets R-Rating for “Graphic Nudity”,11-05-2020 13:51:44
562,Sam Mendes' '1917' Official Poster,09-30-2019 11:13:39
563,"New image of Gary Oldman as Winston Churchill in ""Darkest Hour"".",11-03-2016 22:36:14
564,"Elijah Wood, Daniel Radcliffe and Robert Pattinson need to team up for the most bizarre indie film of all time",04-27-2020 18:35:06
565,Jason Mantzoukas in ‘John Wick: Chapter 3 - Parabellum’,03-20-2019 16:17:54
566,"Official Poster for ""Holmes and Watson """,09-28-2018 18:52:00
567,First image of Anne Hathaway and Chiwetel Ejiofor in Doug Liman's 'LOCKED DOWN' - A quarreling couple make peace in order to take advantage of the COVID-19 pandemic and pull off a jewellery heist at the department store Harrods.,01-04-2021 09:16:45
568,Louis CK's Movie Premiere Canceled in Advance of N.Y. Times Story,11-09-2017 12:49:21
569,Comic Con poster for Godzilla: King of the Monsters,07-22-2018 12:27:35
570,"Poster Revealed for Jordan Peele's New Movie, 'Us'",05-08-2018 20:06:10
571,'The Lion King' (2019) Official Poster,11-22-2018 17:48:46
572,LeBron James To Produce Documentary On 1921 Tulsa Race Massacre,10-27-2020 22:19:50
573,'Captain Underpants: The First Epic Movie' - Official Poster,02-03-2017 10:03:25
574,Bill Murray Confirmed To Return For ‘Ghostbusters 2020’,11-08-2019 19:16:54
575,"Ron Cobb, Designer of the 'Alien' Ship and the 'Back to the Future' DeLorean, Dies at 83",09-21-2020 11:45:14
576,The transformation of Rambo from broken veteran to unstoppable killing machine is a real cultural loss.,01-14-2021 13:08:30
577,John Krasinski Pushed to Cast a Deaf Actress for 'A Quiet Place',04-07-2018 09:41:35
578,New official poster for 'The Dark Tower',03-18-2017 22:06:42
579,Actor John Hurt dies from cancer aged 77,01-27-2017 20:17:13
580,Star Wars actress Carrie Fisher 'suffers heart attack' - BBC News,12-23-2016 16:57:32
581,'The Sandlot' Is One of the Best Baseball Movies Because It's Not About Winning,04-06-2018 22:23:07
582,"M. Night Shyamalan personally financed the entire $20 million budget of ""Glass"", like he had done with ""Split"" and ""The Visit""",01-15-2019 17:34:50
583,"In the alley scene in Collateral, Tom Cruise executes this firing technique so well that it's used in lessons for tactical handgun training",02-13-2017 10:51:39
584,‘Child’s Play’: Mark Hamill Will Be The Voice Of Chucky In Killer Remake,03-30-2019 21:16:50
585,Thor 4: Matt Damon Cast In Marvel Sequel,01-17-2021 18:24:46
586,First poster for ‘Shazam’,12-06-2018 12:12:08
587,The Original 'Pirates of the Caribbean' Had A Snack Budget Of $2 Million,05-28-2017 11:05:13
588,Taika Waititi to Direct 'Thor 4' for Marvel as WB's 'Akira' Is Delayed Again,07-16-2019 13:47:44
589,(X-Men) Dark Phoenix Official Poster,09-26-2018 09:23:38
590,"Official posters for 'Cherry,' starring Tom Holland and directed by Anthony and Joe Russo - An Army medic with PTSD becomes addicted to opioids and starts robbing banks to pay for the addiction.",12-31-2020 10:10:47
591,"Olivia Wilde Tapped To Direct Untitled Female-Centered Marvel Movie At Sony, Expected To Be 'Spider-Woman'",08-19-2020 18:14:22
592,Poster for Netflix's '23 Hours to Kill' - Jerry Seinfeld's First Comedy Special In 22 Years,04-23-2020 18:50:22
593,Keanu Reeves & Alex Winter Confirmed For Threequel ‘Bill & Ted Face The Music’,05-08-2018 11:32:14
594,Warner Bros Sets ‘Sherlock Holmes 3’ for Christmas 2020,05-07-2018 18:17:53
595,‘Matrix 4’ Starring Keanu Reeves Set To Begin Shooting Next Month In San Francisco,01-26-2020 12:02:19
596,Hugh Jackman doing ADR for Logan,03-07-2017 08:43:34
597,‘Alien’ Helmer Ridley Scott Gives Thumbs Up To High Schoolers Who Adapted His Sci-Fi Classic: ‘Do Gladiator Next!’,03-28-2019 12:40:12
598,"Tommy Wiseau submitted ‘The Room’ to Paramount with the hope of getting it distributed. Usually it takes a studio roughly two weeks to reply, but the film was rejected within 24 hours.",11-24-2017 16:48:29
599,"Zac Efron to star in comedy-biopic ‘King Of The Jungle’ - About the journalist who covered the wild true story of rogue tech magnate John McAfee, who cashed-in his Antivirus Software fortune, left civilization and moved to the jungle in Belize. There, he set up a compound of guns, sex and madness.",11-04-2019 17:17:01
600,Suicide Squad Official Trailer,07-13-2015 16:03:42
601,Octavia Spencer plans to buy out Mississippi screening of 'Black Panther' for underserved communities,01-31-2018 18:02:09
602,Thor: Ragnarok Comic-Con Trailer,07-22-2017 21:28:13
603,Poster for Tommy Wiseau’s upcoming film Big Shark.,02-10-2019 00:25:18
604,"Moviefone is Bankrupt, Now Being Run By Only One Employee",02-17-2020 11:08:52
605,John Krasinski Plans Sci-Fi Thriller 'Life on Mars' With 'Quiet Place' Team (Exclusive),04-11-2018 19:42:40
606,'12 Monkeys' was Brad Pitt's Career-Defining Performance: It only took one frenzied role for the world to recognize he wasn’t just a pretty face; he was a bonafide character actor.,12-28-2020 06:31:42
607,"Martin Scorsese’s mafia saga “The Irishman” was watched by 17.1 million unique viewers in the U.S. in the first five days of its streaming release, according to Nielsen estimates",12-06-2019 10:23:47
608,'Kingsman: The Golden Circle' - Official Poster,03-30-2017 09:04:25
609,"After an extremely successful limited release ($5.4M in 2 days), Peter Jackson's acclaimed World War 1 documentary 'They Shall Not Grow Old' will receive a traditional theatrical release starting January 11th, and expanding in February.",12-28-2018 09:58:19
610,Heath Ledger Had Planned to Return as the Joker,02-01-2018 17:22:58
611,First Image of Jamie Foxx in Pixar's 'Soul' - Also Starring Tina Fey & Daveed Diggs - A musician who has lost his passion for music is transported out of his body and must find his way back with the help of an infant soul learning about herself.,11-06-2019 12:10:15
612,Jude Law to Play Young Dumbledore in ‘Fantastic Beasts’ Sequel,04-12-2017 12:30:55
613,Dave Bautista Says He Turned Down Fast and Furious to Pitch a Gears of War Movie,05-13-2021 19:43:31
614,Why ‘Knives Out’ Is A Rare Box Office Triumph For Original Movies,02-04-2020 12:56:12
615,YSK: Disney doesn't play nice with small town theaters. The require theaters to run their movies for a set period of time - as long as 4 weeks straight - even if they only have one screen.,07-17-2018 15:22:02
616,​Simon Pegg Admits He’s Written A ‘Ridiculous’ Vampire-Driven ‘Shaun Of The Dead’ Sequel Treatment,10-28-2017 06:59:30
617,China’s Film Authority Orders All Cinemas to Screen Propaganda Films at Least Twice a Week,04-05-2021 07:25:30
618,Paul Mooney Dies: Writing Partner Of Richard Pryor Was 79,05-19-2021 11:04:23
619,Exclusive: China cancels release of Tarantino's 'Once Upon a Time in Hollywood',10-18-2019 06:29:00
620,U.K. Government Makes Masks In Cinemas Mandatory,07-31-2020 07:45:51
621,Disney Ends Ban on Los Angeles Times Amid Fierce Backlash,11-07-2017 14:55:02
622,"On Dunkirk, Nolan strapped an IMAX camera in a plane and launched it into the ocean to capture the crash landing. It sunk quicker than expected. 90 minutes later, divers retrieved the film from the seabottom. After development, the footage was found to be ""all there, in full color and clarity.""",08-18-2017 18:04:45
623,"Galaxy Quest is still one of a kind. It blends the line between being a parody and tribute to Star Trek, while also being a legit Science Fiction film flawlessly",11-25-2017 09:42:05
624,"First images of Star Wars: The Last Jedi, including new characters by Laura Dern and Benecio Del Toro",05-24-2017 12:57:09
625,"1917 and Parasite are the current front-runners for Best Picture. If either wins tonight, it will be the first Best Picture winner with no acting noms since Slumdog Millionaire won 11 years ago.",02-09-2020 13:45:02
626,"'Ghostbusters' Heading for $70M-Plus Loss, Sequel Unlikely",08-10-2016 08:35:50
627,Filming a car chase scene in the new Jason Bourne movie,07-20-2016 14:33:46
628,"AMC Changes Course, Will Require Moviegoers to Wear Masks In Theaters",06-19-2020 13:09:47
629,Star Wars The Last Jedi Official Poster,10-09-2017 20:13:24
630,Andy Serkis Closes Deal to Direct 'Venom 2',08-05-2019 17:15:54
631,Denis Villeneuve named filmmaker of the decade by the Hollywood Critics Association,12-12-2019 19:19:20
632,"Nic Cage crashed a Nic Cage film festival, watched 4 of his own films, did a 47-minute Q&A and read a 10-minute short story",01-30-2017 12:04:58
633,"'No Country For Old Men's Anton Chigurh is still an iconic movie villain, 10 years later",12-09-2017 11:35:17
634,"Oreo the Raccoon, Model for ‘Guardians of the Galaxy’ Character Rocket, Dies at 10",02-07-2019 19:26:44
635,"Disney Rejection Letter to a Woman, 1938",06-14-2017 13:26:48
636,"8 years ago, my brother and I decided to remake Toy Story 3 shot-for-shot. We’re getting close to finishing our passion project, and here’s the final trailer:",06-01-2019 18:28:41
637,Just found out Tarantino has been reviewing films regularly in the website for New Beverley. He published 9 reviews this month alone,03-30-2020 07:45:04
638,Nicolas Cage Can Now Be Put Into Any Movie in History Thanks to A Machine-Learning Algorithm,01-31-2018 06:28:55
639,First Images of Mortal Kombat Reboot,01-15-2021 11:58:49
