idx,title,created_utc
155,"A ‘gay conversion camp’ that markets itself as a ruthless Christian camp but is actually a retreat where they tell kids that they’re great the way they are, do fun activities, and have a place for kids to get away from awful parents.",12-24-2019 23:20:07
156,Start naming hurricanes after climate change deniers. Saying “Mitch McConnell has caused billions in damage” would have more impact than “Florence has caused billions in damage”,09-19-2018 07:41:22
157,Take political party labels off of the ballots. Make people actually research who they’re voting for,11-06-2018 23:59:05
158,"A place called The ""Coffee"" Shop that serves alcohol in coffee cups, and everyone just pretends it's a normal coffee shop even though they're totally wasted.",12-11-2015 06:24:24
159,"Announce Ryan Reynolds has dropped out of the ""Deadpool"" sequel (following the director), 3 days later announce the new actor cast in his place, Brian Ronalds (Ryan Reynolds with a cheap fake mustache). Keep up the charade for the entirety of the marketing, and have the mustache appear in the movie.",11-09-2016 23:45:01
160,Put an ant on a map and use its path to plan a crazy ass road trip,01-09-2019 11:30:31
161,"Let's start saying ""nice"" for the number 74 instead of 69, and then just never explain it.",03-12-2020 02:31:54
162,On the next season of South Park everybody should be wearing masks for covid19 . Everyone should talk like Kenny and you have to read subtitles for the whole season,07-08-2020 16:09:40
163,"Start a peanut butter company named Gif, wait for the inevitable lawsuit, let a court of law decide the pronunciation once and for all.",02-02-2016 21:13:43
164,A waterpark for adults only. More extreme slides. A wave pool that has huge waves. Alcohol everywhere. And a normal lazy river.,07-14-2017 12:53:39
165,"r/unpopularopinions should delete any posts with over 1,000 upvotes because they are too popular",11-25-2018 00:24:01
166,Google should reward you for being the first person to ever search for something,09-18-2018 15:08:47
167,A buttplug with a one way check valve so people who use them throughout the day can still fart,11-06-2017 08:23:15
168,"We should start using ""digital penetration"" as a term for hacking until it becomes so popular that Fox News and CNN are saying it on-air.",12-27-2014 09:11:59
169,"Real life ""community challenges"". Ex. Plant 500 million trees by next Sunday and everyone pays 2% less in taxes",04-21-2017 11:35:29
170,"People should be able to dial 911 from an ATM. If someone comes up to them and holds them at gunpoint, they should be able to discreetly call 911 by entering it as their PIN. This would activate a discreet security protocol where the ATM begins recording footage and local authorities are notified.",02-19-2019 23:06:08
171,"A videogame which seems like a kiddy adventure game, as long as you follow the linear path the story has set you. The more you deviate from the main storyline path, the more unsettling, creepy, and horrific the game gets.",11-01-2015 04:43:43
172,"With $1.6B, start a space program with the sole purpose of stealing Elon Musk’s Tesla Roadster.",10-23-2018 20:42:49
173,"Put bloopers at the end of every porn video to make people stay watching, instead of closing the window after finishing.",01-11-2018 12:45:56
174,Become an Uber driver and a driver instructor. Have your student drive your Uber routes. Get paid for 2 jobs while doing nothing.,07-22-2018 10:40:37
175,"Ariel shouldn’t be black or white. She should be black on her back and white on her front side, similar to a penguin or great white. This both eliminates the controversy regarding her skin color and makes evolutionary sense",07-09-2019 14:23:41
176,Snickers should do a commercial with Louis C.K. where he's optimistic and cheerful until he eats a snickers.,09-11-2014 09:10:14
177,"Give an active user a ""virus"" trophy. Whenever they respond to another users comment or a user respond to theirs, spread the ""virus"" by giving that user a trophy as well. See if ""Patient Zero"" can be identified before 99% of the active population is ""infected"".",06-19-2017 07:56:05
178,Submit the word 'fuck' to /r/interestingasfuck and see how many upvotes it gets. Delete all posts that do not get the same amount because they are not as interesting as fuck,05-24-2016 10:50:51
179,We all join ISIS so there isn't anyone left for them to attack. Then we dismantle it from the inside,05-23-2017 07:35:19
180,"Add ""parkour"" to Google maps direction options.",04-15-2018 12:35:15
181,"Pokemon Go, but for finding the Dragonballs. There's only 7, and they're all over the world. When someone finds one, they get it, and it warps away so no one else can get it at that same place. Whoever finds all 7 gets a ""wish"" granted via the money generated from ad revenue.",07-10-2016 17:44:02
182,Cast Danny Devito as the next Peter Pan. Change nothing within the story.,07-14-2016 11:44:55
183,"Legally Change your name to ""The State of California"" and commit a major felony in California. Bonus points if your lawyer changes their name to ""Objection"".",12-23-2017 20:06:33
184,"Putin should declare a slightly larger marine sanctuary than Obama, sparking a environmentalist ""arms race"" that ends with a clean, unpolluted Earth.",09-26-2014 10:58:34
185,"Start a western themed bar, where the music stops randomly when the door opens, so that everyone can turn around and look at who entered and then go back to their drinks.",04-23-2019 10:27:26
186,"A new video game where you play someone with no skills and no weapons. The object is to get killed as fast as possible while a heavily armed badass tries to protect you. Call it ""Escort Mission""",10-20-2015 13:50:37
187,"The average humans penis (5.16"") takes about two tablespoons of blood to become erect. Coincidentally, Hamsters have about two tablespoons of blood total. I would like to propose that we measure penis size not by inches, but by how many Hamsters it takes to become erect.",11-23-2019 17:37:30
188,An app where whenever you come into proximity with another user of the app it plays the Seinfeld theme and you both just pretend you're in a sitcom,04-10-2017 01:39:11
189,"Have 25 kids and name them alphabetically A thru Z, but skip M. If they ever ask about it, suspiciously avoid the question each time.",05-14-2017 12:26:34
190,Olympic Games with random people from each country so everyone has a reason to stay fit in case they get picked.,07-08-2016 15:57:27
191,"Elon musk abandons Tesla and SpaceX to start a cologne line called ""Elon's Musk""",12-29-2016 15:24:34
192,"If everyone who hates Tik Tok introduced it to their parents the app would quickly become overrun with older people and no longer be cool for young people to use, therefore quickly killing the app",03-31-2020 18:26:16
193,"If Mayweather goes 50-0 in Boxing and takes > $100M, he should fight Mcgregor full MMA style for ONE BILLION DOLLARS!",08-26-2017 16:38:44
194,"Make minimum wage tied to congresses pay so each time they raise their salary, the working class gets a raise too.",03-13-2018 06:17:58
195,[NSFW] A urinal that scans the size of your dick and shows you on a leader board against everyone who has used that urinal.,05-20-2017 11:41:40
196,Before the Superbowl game the NFL should have a game between the 2 worst teams. The winner gets the 1st pick in the Draft.,02-05-2017 08:20:13
197,"An interracial rap duo where the white guy does all the rapping except for when the lyrics have the N-word, which is interjected by the black guy",10-20-2017 11:37:55
198,"Make a new law that says if after the pizza man tells you, ""Enjoy the pizza"" you respond with ""you too"" the pizza man can grab a slice of your pizza.",12-07-2016 09:22:09
199,"Instead of cancer warnings on cigarette packages, we should just let funeral parlors advertise on them e.g. ""Your coughing is like music to our ears.""",04-11-2018 06:57:05
200,Release a conspiracy theory that the antivaxx movement is a ploy from the big pharma because vaccinating is much less profitable than treating preventable diseases like poliomyelitis.,01-03-2019 07:03:05