idx,title,created_utc
0,Upvote the Net Neutrality Megathread as much as we down voted EA.,11-21-2017 21:37:17
1,"PornHub should create a second website, TheHub, for all nonporn material and become a YouTube competitor.",03-23-2018 12:51:04
2,Shut down the /r/conspiracy sub. Give no explanation.,12-18-2017 16:28:17
3,"A porn video where a woman orders a pizza, pays with money. Then She has a plumber come, fix her faucet, get paid with money, then leaves. After many such psych-outs, she finally goes to bed and has sex with her loving husband.",09-08-2017 16:49:29
4,"Every year, the richest person in America is declared the ""Winner of Capitalism."" They get a badge. Then all of their wealth is donated to charity and they have to start over at $0.",01-10-2018 14:36:15
5,"Since Donald Trump apparently has a serious problem distinguishing ""fake"" news from real news, The Onion should write a satire piece about how great he is and see if they can get him to retweet it.",01-17-2017 14:00:03
6,"Obama should resign on the 19th, making Biden the 45th President and fucking up the Trump memorabilia",01-15-2017 05:51:46
7,"To Disney - Don’t release any trailers or details for Star Wars episode 9, just have blank posters that say Star Wars episode 9 on posters and have 30 second long silent commercials that only say Star Wars episode 9, nothing else.",12-29-2017 10:13:08
8,An app that lets you invite an anonymous person to act as a neutral third party when having an argument,04-07-2018 17:50:31
9,Make /r/Kansas the official subreddit for the state of Arkansas,06-02-2017 10:02:53
10,Siri and Alexia should only work if you say “please” and “thank you”. This could improve people’s manners to each other.,01-07-2018 11:25:21
11,"One T.V. show that is split into two shows, that air at the same-exact-time showing the perspectives of the ""Bad Guy"" and the ""Good Guy"" - but each show portrays their characters as ""The Good Guy.""",06-25-2017 14:00:21
12,"Take a gorilla, put it inside a fake-looking gorilla costume, and set it loose inside a shopping mall.",05-29-2018 14:07:58
13,Put pictures of missing people on packs of cigarettes. Smokers are the only people standing outside in all kinds of weather,12-06-2018 17:02:39
14,"Edward Snowden should dress up like a Turkey and sneak into the Turkey bin where Obama will choose to pardon he Turkey. Then Edward should kill the other Turkeys. Then Obama will have no choice put to pardon him. After he pardons him on the stage, Edward should take off his Turkey costume .",11-24-2016 23:11:10
15,Put Michael Jackson’s “lean” in Fortnite as a dance so kids try to replicate it and fall over.,01-14-2019 19:25:24
16,Adding bloopers at the end of horror movies to relax the viewer before he goes to sleep,03-09-2018 16:05:56
17,Pay prisons by the time ex-inmates stay crime-free after release,10-03-2017 13:54:05
18,"Make an R2-D2 spin-off movie, but it's the events of the series told from his point of view. His outer dialogue is beeps, but his inner voice and narration is Morgan Freeman.",04-18-2018 22:53:08
19,Vatican City should have an untrained Olympic Team that rely solely on prayers to win,02-01-2018 07:27:08
20,"We should all start using Myspace again, out of nowhere.",11-29-2017 07:58:30
21,Make another NSFW tag and separate porn from violence. I'm tired of getting my boner ruined by mass genocides.,11-17-2018 06:04:08
22,"Fill your mouth with water at home, drive to work, and somehow communicate non-verbally that you'd like to have a spitting contest where the winner is determined by the amount of spit one can produce. Do not participate - just rest easy that night, knowing you could have won if you wanted to.",12-10-2018 13:02:55
23,"Joggr. An Uber like app that allows joggers to drive you home from the bar, then jog home",07-20-2017 16:34:29
24,"Netflix should make a show called ""your life"" and when I click on it I can watch all the footage that the government has taken of me through my webcam and cellphone",09-04-2017 17:19:43
25,"It's been 10 years since ""To Catch a Predator"". Make a Hollywood celebrity special.",11-12-2017 09:33:35
26,Set your wifi password to 2444666668888888 so that when some one asks for password you can just tell them it's 12345678.,12-31-2016 00:38:38
27,Companies such as Microsoft/Google/Facebook/LinkedIn/Apple/Netflix/Wikipedia/Twitter/etc. should throttle accounts belonging to politicians opposing Net Neutrality to 0.1KB/s for a month,01-24-2017 12:01:07
28,"Posthumously change the names of mass shooters and domestic terrorists to things like the Indiana Idiot, the California Clown #4, and the Texas Twat.",05-30-2018 13:06:19
29,"Guinness World Records should create a record called ""Person Who Spent The Most Money To Buy This World Record"", and then let rich narcissists give them millions for the title.",10-10-2017 10:16:30
30,Now that our search history is for sale we should crowd fund and buy politicians web historys and post them publicly.,03-24-2017 10:43:23
31,Make Stevie Wonder a judge on 'The Voice' so every audition is a true blind audition.,07-17-2017 21:03:55
32,"Next time the United Airlines CEO has a restaurant reservation, allow him to take his seat, then shortly thereafter tell him he must give up his table for restaurant employees and take a later reservation as he has been involuntarily bumped. Film the fit he has and then call the police.",04-11-2017 09:12:32
33,"Instead of showing women ultrasounds before they get an abortion, show them video of children dying from polio, whooping cough, etc. before they decide not to vaccinate.",04-16-2017 09:13:40
34,"Dress up like Ronald McDonald, enter a McDonalds and tell random customers they win free fries for life. Also fire some employees.",11-28-2016 08:36:39
35,A house buying show where the buyers are millennials and they can't afford any of the houses,01-28-2018 12:35:15
36,Public toilets that weigh your own poop and show it on a scoreboard for competition,08-03-2018 11:35:08
37,"Have Terry Crews do a commercial for Old Spice with the spice girls introducing him as the newest member, Old Spice, for their one night return concert.",02-18-2018 14:19:49
38,"Hire a female prostitute, tell her to meet you at a fancy restaurant, and ask her to pretend to be your colleague from the bank. Hire a male prostitute, and tell him the same thing. Reserve the table next to theirs and listen to them trying to improvise sexy bank-themed dialogue at each other.",01-25-2017 06:35:40
39,"Slip a resignation letter on Donald Trump's desk with the words ""Executive Order"" at the top; see his response when he signs it.",02-06-2017 16:08:01
40,"Reverse lottery. The entry fee is $10,000. The vast majority of people get their entry fee back plus a little more. One person gets nothing.",09-17-2016 12:14:54
41,"Start referring to mass shooters as ""Shooter #1"", ""Shooter #2"", and so on. It avoids using their name and demonstrates how quickly the number rises.",05-19-2018 13:35:28
42,Make bathrooms pay to enter but you get your money back if you wash your hands.,01-25-2018 12:39:21
43,"Have Dwane ""The Rock"" Johnson prepare different meals behind a curtain then have the audience or guest stars guess what he made solely by smell. Can you smell what the rock is Cooking?",09-22-2017 12:18:03
44,"Create a black comedy that makes fun of the protagonist, after a while gradually increase the despair the protagonist suffers until at the end of the movie he brutally commits suicide. Audience begins to question at what point the movie ceased being a comedy.",01-03-2018 07:35:40
45,"They should announce a sequel to groundhog day, and then re-release the original",02-02-2019 21:53:41
46,"Make a documentary series called ""The War, on Drugs"" where college professors of 20th century history discuss WWI while smoking weed, dropping acid, and eating shrooms.",06-03-2017 12:18:42
47,A Parks and Rec style comedy from Marvel which follows urban planners in NYC constantly dealing with the aftermath of MCU battles.,06-22-2018 15:45:17
48,A form of Reddit Gold which signifies that you hate a comment/post so much that you're willing to pay money to demonstrate your extreme distaste.,07-16-2018 05:06:21
49,The price of movies should be variable based on demand (like stock). e.g.: King Arthur is flopping? Tickets are $2.99.,05-27-2017 21:16:18
50,"Have r/Eli5 moderated entirely by 5 year old children, any answers that they don't understand are deleted immediately.",07-27-2016 18:19:59
51,"Kim Jong Un should make a sequel to The Interview, where North Korean journalists interview Trump",05-31-2018 13:27:21
52,MySpace should start pushing to kill Facebook in a revenge scheme.,03-28-2018 21:56:49
53,Everyone should search on Whitehouse.gov for 'tiny hands' so that it shows up as the top rated search.,01-23-2017 09:39:53
54,"At 8 PM for the next week, google, ""How to restore Japanese Shogunate?"" Let's confuse Google together.",12-19-2018 00:20:34
55,A show similar to Big Brother where there is one contestant that is constantly fed LSD. Where the sober contestants have to vote out who is the one they think is on LSD and the high one has to act sober. Best part? They're all on LSD,06-05-2018 03:20:06
56,"A tv show where during the pilot, the characters flip a coin about something trivial. Then, the tv show splits in two timelines, one where the coin is heads and one for tails. Over the season, the two timelines get wildly different until they are different genres at the end.",10-04-2018 11:06:53
57,"If you are ever going to be drafted for a war, get “fuck you” tattooed on the outside of your right pinky. You won’t be able to salute without showing your superior your tattoo and they’ll refuse your draft.",12-30-2017 14:11:36
58,Crazy Idea: Have the current president attempt to pass the Presidential Physical Fitness Test.,12-02-2017 12:28:02
59,Have NASA release flat-earth pictures on April 1st.,03-27-2018 09:30:28
60,After a government shutdown all active members of congress should be ineligible for reelection.,01-22-2018 10:14:08
61,Barack Obama should be the comedian hired at this year's White House Correspondence Dinner,01-16-2018 18:59:33
62,"Delete any post that gets more than 2000 upvotes on /r/mildlyinteresting, since it is too interesting",05-24-2015 08:33:24
63,Everyone turns adblock on in protest of Victoria being fired.,07-02-2015 22:33:24
64,Games should have a blooper reel during the end credits to show some of the bugs the developers had to deal with,10-19-2018 07:48:29
65,Ban r/showerthoughts in California until drought ends,09-16-2015 08:31:57
66,"Do a push-up every time someone says ""Trump"". It won't solve our political differences but at least you'll have gains.",12-01-2018 16:02:30
67,Rich kids can buy their way through the admissions process if they pay for the college of the poorest 5 kids enrolled there.,03-16-2019 08:48:37
68,"Make all the Anti-Vaxxers live together in one community, make them experience first hand what happens when you lose herd immunity.",02-22-2017 14:37:25
69,Combine r/EnoughTrumpSpam and r/The_Donald and watch both sides downvote each other's posts so that they never make it to the front page but still be angry at each other.,01-10-2017 11:39:09
70,"Legalize Fist Fights between consenting adults. Compared to mass shootings and suicide bombings, good, old-fashioned brawls are harmless and could be beneficial.",12-13-2017 10:10:42
71,Presidential candidates shouldn't run with a vice president. Second place should be the vice president. They would be forced to work together and perhaps be more respectful and act more mature during the campaigns since they're going to be stuck with each other for the next four years.,10-28-2018 08:22:14
72,"If everyone went to YouTube's trending page and copyright striked every video they saw there, YouTube would probably fix their garbage copyright system.",02-15-2019 18:02:26
73,I'm starting a charity to raise awareness of pyramid schemes. Donate $100 to register as a fundraiser and you'll receive 10% of all donations you raise.,03-10-2018 12:50:27
74,"Spotify should have a ""music soulmate"" in their yearly wrap up where they match you with the person that has the most similar music taste to you based on your listening habits",01-23-2020 00:32:20
75,Start a religious movement that believes God is angry with us for polluting and will punish us with God-made climate change,05-08-2017 20:10:18
76,Private prisons should be paid by how long former inmates stay out of jail after they serve their full sentence.,10-12-2018 14:47:18
77,"Start pronouncing ""Popeyes"" as ""Pope-yes"" and see how long it takes to catch on.",06-24-2017 10:07:13
78,Streaming services like Netflix could have one channel which plays random movies or shows and you can watch that channel when you are not able to decide what to watch.,01-27-2019 13:05:31
79,"Have Tinder update their app, where if you swipe left 10 consecutive times, it automatically posts your picture to r/roastme, so Reddit can tell you why you shouldn't be such a picky douchebag.",12-08-2016 09:21:36
80,"Judges shouldn't be able to see or hear defendants directly. They should also never be told the sex or race of the defendant. This will remove a fair bit of racism and sexism from the judicial process, whether real or perceived.",10-08-2018 10:34:59
81,"After the corona virus, we should globally take a month off like this every year to let the planet recover from climate change activities, we call it planet relief month",03-25-2020 18:44:32
82,mystery plane tickets where everyone boards the plane and then theres rounds of voting as to what the destination will be,09-12-2017 14:37:20
83,"Reddit should have a Reddit Wood gilding option that is free, but requires a few cumbersome steps. Just to show that certain users liked the post so much that they were OK with going through the trouble.",02-08-2019 15:41:31
84,Everyone in the US cancels their internet plan when the FCC brings down net neutrality,11-23-2017 23:18:45
85,"After Usain Bolt retires, just pump him full of drugs and see how fast we can get a human to go",08-16-2016 20:26:49
86,An R rated animated Scooby Doo movie where people actually get brutally killed and Shaggy tells Fred to go fuck himself.,07-02-2018 08:27:16
87,"Ask a stranger to watch your bag for you but never actually leave, just sit there and watch your bag together with your new friend.",08-14-2016 07:07:45
88,"Pronounce ""Chipotle"" like ""Aristotle"" and the latter like the former. If we start now, we can probably switch the pronunciations in ten or twenty years, fifty tops.",09-06-2016 10:00:35
89,We should have a bracket style tournament where we mix men’s semen together and impregnate the women with the mix. Whoever is the biological father wins and moves on to the next round. In the end we would find who has the fastest sperm out of everybody.,03-09-2020 09:07:37
90,"For april fools, the creators of ""where's waldo"" should make book where waldo just isn't in it",05-20-2018 19:57:55
91,"Uber Fire. A much cheaper version of Uber and a fire truck picks you up. But! If there is a fire while they are taking you to your destination, you have to help put it out first.",07-28-2017 11:15:11
92,A Pornhub section dedicated entirely to genital hygiene and it’s just videos of proper ways to clean and groom your junk.,02-03-2019 23:15:19
93,During a driver's license test they should include a mock traffic stop so new drivers learn how to properly conduct themselves and communicate with an officer,05-16-2018 12:41:29
94,Have an election where all candidates are anonymous and the only information known about them is their policies.,07-05-2018 06:55:16
95,"I’m gonna work my way up the company ladder at Trader Joe’s, learn their secrets, then open a competing store called Traitor Joe’s.",08-10-2018 02:10:55
96,"If you're an organ donor, your funeral should be free.",10-13-2018 11:03:19
97,"Walk around in public wearing a ""Make America Great Again"" hat and a ""Black Lives Matter"" T-Shirt and just see what happens.",11-29-2016 12:15:57
98,A strip club where all the strippers are cosplayers,09-30-2017 17:12:55
99,"Poaching is only illegal if you use a weapon. If you think you can take a rhino or a lion with your bare hands, go ahead.",04-06-2017 09:10:58
100,"We genetically modify a large group of people and make each person allergic to a different type of seasoning, then they each have a piece of KFC. We can then figure out what 11 herbs and spices are used in the recipe.",03-20-2020 14:42:59
101,"Secret Speeders. A state funded program like Secret Shoppers, where people are paid to purposefully speed to be pulled over, so that Police can be evaluated on how professional they are.",11-25-2018 21:13:33
102,Marvel studios should forgo releasing a trailer the fourth Avengers film. Every ad should just have the title and the date. They can claim the last 11 years have been the preview. The mystery would drive intrigue and hype more than any generic superhero movie trailer ever has.,12-04-2018 08:34:29
103,"Have a spouse debate, see Bill Clinton take on Melania Trump",10-05-2016 10:13:11
104,"The US should invade the US, setup a framework for Democracy, and rebuild infrastructure.",04-17-2016 11:45:20
105,An airhorn that looks like a Febreze can do you'll always know when someone poops at your house,10-14-2017 09:56:27
106,"Erect a statue that has movable joints and actuators with a motion detector. When there's more than one person in an area it's motionless, when there's only one the statue will turn to follow them with it's gaze.",05-13-2018 21:40:29
107,Make a USB hub that doesn't include LEDs so bright it is impossible to sleep in the same room,02-12-2018 12:02:06
108,We should collect DNA and fingerprints when people die and run it agains criminal databases to solve unsolved cases,04-04-2018 20:31:48
109,Subway should create a subsidiary called Domway where they tell you what kind of sandwich you're going to eat.,08-16-2017 06:38:27
110,"Remove the drinking age, make it so that you have to graduate highschool to legally drink. Increase graduation rates all over the country.",09-20-2016 07:27:27
111,They should make a Weekend at Bernie’s 3 where Bernie Sanders dies on the campaign trail and his team still gets him elected,02-25-2019 23:24:12
112,Terry Crews should change his name to Dwayne Elizondo Mountain Dew Herbert Camacho and run for president in 2020.,08-11-2017 08:58:40
113,Drug Cartels should start producing insulin instead of cocaine. Seeing the hike in insulin prices and the demand . The market is ripe for harvest.,04-25-2019 05:57:34
114,"Remake a movie with the same actors 5 years later, but none of them get to look back at the script.",10-06-2018 20:17:12
115,"Mandatory training for police: They each visit another precinct as a prisoner, can't tell those cops the truth, they experience the other side of things. Other officers never know who's a cop or perp, and the experience will remind officers that we're all human.",11-08-2017 01:32:13
116,Olympic athletes are chosen by lottery so countries are encouraged to increase the average athleticism of their citizens and not just elite athletes,02-23-2017 15:52:24
117,Hats but for two people,12-17-2018 07:21:25
118,"Someone should make a haunted house that's not scary at all, with cheap decorations and stuff, but the exit is fake, and that's when the real horror begins",10-31-2018 13:27:59
119,"Have Japan introduce an ""abstinence only"" education plan for students to actually increase the pregnancy rate.",01-29-2019 08:48:38
120,"Create a post called ""10 reasons why BuzzFeed sucks"" Upvote it to oblivion. Watch as it ends up on buzzfeed",11-28-2015 12:01:47
121,"A Fight Club app that's like tinder, but instead of having sex you beat the shit out of one another.",04-25-2018 20:44:21
122,Hang the Mona Lisa from the right field bleachers at Yankee Stadium. The first player to put a ball through it gets to decide whether karaoke remains legal in the US.,06-04-2015 10:48:55
123,"Start a band named Torrent and name your subsequent albums Seed, Leech, Kickass, Client, etc, and watch people struggle to pirate your music.",08-24-2017 09:56:37
124,"People continue buying lottery tickets, but no one ever wins. We are never told that there will never be a lottery winner ever again, people just continue to play in hopes of winning the ultimate jackpot. Eventually, the jackpot is used to pay off national debt.",10-20-2018 08:43:40
125,Survivor: Crack Island. A normal season of Survivor but all the contestants are crack addicts and all the rewards are crack.,12-22-2016 12:36:32
126,"Everyone google ""why is my pee red"" at 6:00 PM GMT on December 01. Confuse the hell out of search algorithms",11-18-2020 00:34:00
127,"""Don't Get Polio!"" A reality show where anti-vaccine families live on an island infested with various infectious diseases. Hosted by Jenny McCarthy.",10-05-2017 21:52:20
128,An undo button on Reddit that brings you back to where you were before you accidentally hit the refresh button.,01-22-2019 22:14:00
129,"Stormy Daniels should make porn series with a Trump look-a-like, detailing their affair but protected by parody laws.",03-15-2018 16:25:25
130,16 year olds shouldn’t pay income tax since they aren’t able to vote. No taxation without representation.,04-14-2018 02:31:04
131,1.Develop power of invisibility. 2.Befriend blind person. 3.Fall silent when they try to introduce you to friends and family. 4.Witness descent into madness.,05-04-2017 09:30:38
132,"Coordinate a taping of ""Jeopardy"" where all 3 contestants never buzz in, forcing Alex Trebek to pause awkwardly and always say the answer in an increasingly frustrated tone.",08-20-2018 15:00:56
133,"Start out fat, and get two gym memberships. At one gym, workout, diet, and get absolutely riped. At the other gym:",07-13-2018 22:00:34
134,Bear Grylls show where he learns survival techniques for living on the streets from homeless people,10-16-2018 07:55:15
135,"There should be a category on Netflix for movies you searched and they didn’t have, but now they have.",03-26-2020 14:07:25
136,"Ask your friends to help you move, but hire professional movers instead. For the friends that show up, SURPRISE they get free booze and pizza for being good friends instead of having to carry your futon. Also, backup plan if no one shows up: you have booze and pizza while you cry.",05-10-2019 14:13:52
137,"‪Idea for the NBA: once a team wins the final, have the roster divide in half and play each other, and the winning team split in half again, until we have a one-on-one duel to see who the best player on the championship team is. You’re welcome, ESPN.",06-08-2018 20:52:18
138,Make r/showerthots a subreddit about girls who post slutty pictures to social media along with a philosophical caption to make it seem like it's not just a slutty picture posted to social media,11-08-2018 16:55:14
139,"Attach sensors to every car that determine the exact weight of bugs killed while driving. Add up the score at years end and announce the winner on TV. Since bats also kill an impressive amount of bugs, the winner is dubbed Batman and can legally conduct vigilante justice until the next year.",06-20-2016 07:16:20
140,"Everyone in the US should start going out topless in response to people who won't wear a mask. They'll have to try to defend the obvious hypocrisy of their mask objections, AND the double standard about male vs. female chests. Or they'll be so bothered by exposed breasts they'll finally stay home.",07-06-2020 07:33:22
141,"In divorce court, hide the genders of both parents from the jury.",12-29-2019 13:53:22
142,We should do a copyright claim challenge where we see how many corporate videos we can claim are ours before YouTube fixes the system,01-16-2019 09:54:54
143,Shoot fireworks every 10 miles at every state border at the same time and see a U.S. map from space,07-12-2018 03:57:24
144,"Make a handy guide of Democratic and Republican talking points so instead of having a big argument, you could just say, ""#4"" and the other person could say, ""#8 contradicts that"" and we'd save time because no one is going to change their fucking mind anyway.",05-11-2017 13:46:37
145,"Buy one of those drones that follows you and films you, buy a VR headset, connect the two with a live stream. Live your life in third person.",11-21-2018 11:32:40
146,"Seeing as the 1% have nearly everything, lets just give them all the money, and start a new currency and they're not allowed any.",12-17-2015 12:02:16
147,Tinder but FaceTime where you have to say yes or no to their face,09-02-2018 21:36:20
148,"Prank people who have just come out of a coma. Get the doctors to dress like confederate soldiers. Dress an old lady in American 1862 garb and have her claim to be the patients wife. Explain- ""you were hit by cannon fire in March 1861""",08-06-2017 05:12:18
149,"""Topless & Wet"", a smoothie bar where none of the blenders have lids",03-20-2017 11:25:56
150,"Upload copyrighted songs and images set to nazi speeches. When the EU fines it, they'll be making money off nazi propaganda, which violates German law.",09-17-2018 15:17:35
151,"A high school drama where the main cast is played by actors over 60, it is never referenced and all the secondary characters are just normal young actors.",12-09-2017 07:23:25
152,Have lights on either side of your car to signal which direction you are turning in to other vehicles.,03-02-2018 07:37:49
153,Have North Korea host the next Olympics,08-13-2016 09:12:56
154,Everyone PM me your credit card info.,09-26-2017 08:23:00
