idx,title,created_utc,score,upvote_ratio,humor_scores
633,"John knew his password was just one letter, but he couldn't remember which one.",10-09-2016 12:25:12,6412,0.95,0.6
634,"Phil's true passion, slapping and groping really wet things.",01-21-2017 20:58:15,6407,0.96,1.2
635,Vanessa learned that only Gina was allowed to draw dicks on pillows.,05-04-2017 21:59:52,6397,0.89,1.4
636,PSA: Every day millions of teens are in danger of taking bad selfies. Learn to recognize the signs of screen recognition disorder and do your part.,12-17-2018 22:42:53,6393,0.97,1.2
637,"When Cheryl found two more woman's shoes under her boyfriend's bed, she decided to hide there and catch him in the act.",08-24-2019 12:02:12,6384,0.99,1.2
638,Bernard finally realized that the churchgoer next to him wasn't his neighbor Peggy but a lifeless wax figure replica.,01-22-2016 10:39:26,6375,0.92,0.6
639,"Get your phone possessed by Satan, Today!",12-06-2016 19:45:25,6380,0.91,1.2
640,"Oh Pan, you're such a comedian!",10-24-2015 23:34:51,6381,0.92,1.0
641,How to train your child for a lifetime of mental institutions,01-17-2015 06:09:43,6368,0.91,0.8
642,Kyle was overjoyed when his ecstasy-filled shower head came in the mail. [Repost],01-13-2015 09:38:59,6361,0.94,1.6
643,"Susan's friend asked her to ""watch the oven,"" but it had already been several minutes and these potatoes weren't doing ANYTHING",10-31-2017 12:19:20,6359,0.96,1.0
644,"Dylan's girl friend didn't understand his desires, but Dylan didn't care, Dylan was doing his own thing. Dylan knows how to get Dylan off.",05-11-2016 10:40:59,6359,0.92,1.2
645,Last Christmas Amy broke up with Charles. There is no more Christmas.,11-24-2018 02:01:54,6351,0.96,1.2
646,Kyle COULD NOT WAIT when his wife said she wanted to try it on all fours tonight!,11-05-2014 07:34:39,6324,0.91,1.4
647,"Fookin carrots, amarite?",11-11-2017 14:21:40,6305,0.94,1.0
648,Don't be fooled by pricey diets trying to keep yourself regular and don't get trapped using risky laxatives. Just use a pencil! You can safely take a #2 with your trusty #2.,07-26-2018 09:52:01,6306,0.96,1.2
649,"Laura has been a bad, bad girl...",11-08-2015 14:30:37,6290,0.89,0.6
650,Katy was tired of using her ancestors tools for ordinary bread slicing.,05-16-2018 02:13:00,6289,0.97,0.6
651,Susan regrets not learning how to floss her teeth.,01-28-2015 10:09:09,6274,0.92,1.4
652,"Thanks to the Diet Spatula, I have managed to decrease protein and fat in meals by 50%!",05-03-2015 15:11:27,6276,0.92,1.2
653,There's no room for two dishes! ...AH FUCK IT.,10-23-2012 06:27:25,6265,0.96,1.2
654,Women worldwide were discovering the newest anti-aging miracle: Photoshop,01-27-2018 05:59:58,6259,0.97,0.8
655,Jackie paying a professional to cure her hiccups via scare tactics was costly but invaluable,04-13-2016 08:09:40,6258,0.9,1.2
656,Rare footage from spring break 2003 of the tramp stamp ghost claiming another victim,06-01-2018 19:34:08,6248,0.99,0.6
657,"Once again, Grandpa stubs his toe on the psychic energy surrounding the haunted pirate treasure chest.",07-01-2015 12:41:41,6239,0.94,0.8
658,The clock was actually quite convincing while spilling the pastors secrets to his wife.,07-24-2020 12:37:13,6231,0.97,0.8
659,Jersey Jen would only go out in public after she bought a pair of ‘Ugly People’ filters,04-03-2017 16:48:43,6242,0.9,1.4
660,"When Brenda auctioned off her family members online, 70% of the bidders said they wanted to acquire Fun Gus (in blue shirt, front left).",09-09-2019 23:21:45,6233,0.99,1.2
661,"Yeah, I'd love to help you beat cancer, but you need to stop leaving these disgusting messages for my assistant. Don't pretend it's not you.",11-05-2016 15:12:48,6228,0.92,1.0
662,William had an unorthodox method for punishing his horny and out-of-control left hand,09-08-2016 12:53:45,6225,0.92,1.2
663,Vanessa wanted to stop Jeremy's snoring... forever.,12-09-2016 07:40:19,6218,0.96,1.2
664,New 2020 diet yields S H O C K I N G results,12-31-2019 15:28:09,6198,0.97,0.8
665,"When the shareholders called for higher profit margins, Clarissa knew exactly what to do",04-07-2016 07:21:30,6194,0.97,0.6
666,"Jenna was going to try rubber tube bondage, and she wasn't going to let her tug-of-war-obsessed dog stop her.",03-01-2018 05:30:29,6173,0.97,1.0
667,On my way to fuck yo bitch!,07-21-2014 16:47:29,6166,0.83,1.2
668,Bertrand realized that showing people he was immune to pain allowed him to do whatever he wanted,09-24-2015 15:16:59,6158,0.92,0.8
669,It was time. Sarah decided to pull her classic 6-minute insurance fraud again.,09-14-2017 06:10:40,6149,0.98,0.6
670,"Karen claimed she wasn't a lesbian, but looking at pictures of beautiful women always made her very hot.",03-28-2019 23:20:18,6146,0.99,1.0
671,I lobe yiu tp bwby,03-12-2020 20:35:18,6124,0.97,0.6
672,"""This bitch...""",12-06-2012 15:43:49,6119,0.96,0.4
673,It took Bob 50 years to finally hack a U.S. government supercomputer with his old laptop,10-17-2018 02:38:15,6119,0.97,1.0
674,Little did Kari know that sexual stimulation triggered Dave's narcolepsy,04-21-2015 20:44:41,6125,0.9,1.0
675,Lisa tries to keep her dog cool during their summer walks.,06-29-2015 15:19:08,6114,0.94,1.4
676,"With her husband away on work, Wendy found someone else to motorboat those melons",05-23-2020 04:25:41,6100,0.99,1.2
677,George brought free samples to his first drug deal.,05-23-2018 04:36:38,6102,0.97,1.2
678,Oh shiit!,10-22-2012 07:33:38,6090,0.94,0.6
679,Washing cars can be difficult,01-05-2013 18:53:34,6093,0.97,0.8
680,"Little Dennis refused to pick up his action figures. And so mother had enough: ""I'll show you a real buzz lightyear, space cadet.""",01-28-2018 16:49:03,6095,0.98,1.2
681,Little Katie has a drinking problem.,12-10-2018 22:06:53,6089,0.96,1.2
682,Aerosolize your favorite narcotic with the new Stimulatron5000,12-14-2016 13:25:57,6089,0.91,1.0
683,"Since Phoebe tasted that delicious cup of coffee, her life became a everlasting tourment of spilling and spitting",10-07-2020 08:14:15,6082,0.98,1.0
684,"First the divorce and now this, even Madison's groceries were trying to leave her.",05-12-2018 23:32:44,6085,0.98,0.8
685,Why can't I open these jars?,12-16-2016 18:04:40,6085,0.89,0.6
686,"It may seem like a simple task for most, even though Frank was slow, he gave it his all day in and day out",03-27-2017 14:08:05,6087,0.93,0.6
687,Anthony's plan to get rid of the lamps had just one flaw,08-22-2016 10:20:04,6080,0.94,0.8
688,"After her divorce, Katie swore off men and started preparing phallic shaped foods rather differently",04-29-2017 21:37:15,6074,0.94,1.2
689,Always wanted to have a green lawn? Now you can!,08-23-2014 18:17:06,6059,0.93,1.2
690,"Shake the girl, then I can have the volume as loud as I want!",10-17-2019 09:20:42,6014,0.99,1.0
691,Teaching civilians how to take down enemy aircraft has never been so much fun!,06-22-2016 19:02:56,6017,0.92,0.8
692,Gloria is still learning to live with her super human strength,03-02-2016 12:36:15,6003,0.94,0.8
693,I send you a Christmas card and you sent me a cease and desist letter?,12-23-2015 23:16:35,6008,0.92,1.0
694,Eva wondered how long she could keep pretending that she appreciated her husband's art,06-29-2020 14:42:26,6000,0.98,0.8
695,"Only after nine years, Marjorie realised they had taken the wrong kid at the hospital",07-02-2017 08:57:19,5998,0.97,0.6
696,"With thanksgiving coming up, Mark had to practice for his mother in law's arrival",11-21-2020 09:00:20,5987,0.98,0.8
697,Miranda instantly grew happier once the fungus parasite that had been living in her hair started growing and taking over her mind,08-06-2016 01:32:08,5987,0.92,0.8
698,Ken didn’t need the iron to be plugged in as he was about to straighten this bitch out either way,01-29-2021 07:30:35,5974,0.98,0.6
699,"Captain Kirk may have been a legend in the fleet, but his cooking was so bad that his children would often teleport back to Mom's house.",12-31-2016 16:11:41,5956,0.89,1.2
700,"With all of her other knives broken, Sharon had no choice.",09-11-2015 14:44:26,5945,0.92,0.4
701,"While Jack and Billy struggled with the old school method of fishing, Jim's dad had taught him the 'American Way'",01-31-2017 11:33:12,5942,0.93,0.8
702,New study proves that using electronics in bed could disrupt your sleep,12-05-2015 12:35:55,5935,0.93,1.2
703,Bella was starting to freak out... she had never seen this blonde haired woman before and had no idea how she snuck into the house.,09-06-2019 16:09:26,5930,0.99,0.6
704,Now you can be prepared for those awful toilet paper emergencies!,07-15-2014 23:04:47,5929,0.92,1.2
705,Showering is so depressing,09-20-2015 17:05:45,5909,0.9,1.2
706,Uncle Phil shows us how to huff with class.,10-09-2018 22:22:43,5891,0.98,1.4
707,I always knew one day I was going to brick my phone.,12-31-2014 12:49:22,5888,0.9,1.0
708,I can't swim,05-21-2015 13:04:20,5886,0.93,0.8
709,"Suddenly, it wasn’t about where the soda went, but why the soda went. Getting his step kids sent to summer camp was a breeze.",03-29-2020 20:28:59,5855,0.98,1.0
710,"Kevin tried to tell the witch to give him his tongue back in his nightmare, but in reality he had only himself to blame",12-31-2018 13:57:18,5836,0.97,0.8
711,Ever rub sand? Ever rub sand on weed?,03-11-2021 12:15:57,5834,0.96,1.2
712,Fred didn't understand that the car was not the cart return,03-05-2016 10:22:57,5821,0.94,0.4
713,"Katie wanted to look smart for her lunch date with Brian, but Jimmy's glasses were giving her a headache.",10-03-2016 20:26:20,5818,0.9,1.0
714,"About 5 months in, Chad started to regret his decision to brew moonshine in his bathroom sink.",01-17-2016 22:07:22,5811,0.92,1.4
715,"Jane wasn't sure about the new laser fat removal system at first, but grew to enjoy the tingly feeling in her midsection.",08-11-2016 22:16:05,5796,0.9,1.2
716,Straight Up Muggery,11-03-2020 04:39:11,5800,0.98,0.8
717,"Sharon, a happily divorced mother of 2, always looks at her cooked bacon and reminisces on her ex-husband's failure in bed.",12-27-2018 22:20:12,5798,0.97,1.2
718,Samantha was thrilled to learn that her magic wand could capture souls.,12-21-2015 09:22:25,5786,0.92,0.8
719,He'd asked for Pokémon but whatever.,01-27-2017 22:31:02,5792,0.89,1.2
720,"Waking up, only to remember you'd spent all night updating reddit threads and watching your PI's video footage",01-27-2015 09:31:40,5782,0.91,1.0
721,These fresh beats are blowing my mind,11-27-2012 16:22:38,5775,0.98,0.8
722,Dad knew how to do this. Rod sucks.,12-23-2016 22:32:17,5770,0.9,0.6
723,"""Alright, Jack, I found the credit card. Let's get outta here!""",07-13-2016 12:23:52,5762,0.87,0.6
724,"‘Plates are for pussies, son.’ “Are you a pussy?”",05-06-2021 18:09:36,5758,0.97,1.0
725,"Despite a thorough examination, Brad's D&D character fell victim to the couch mimic.",10-01-2016 21:20:49,5756,0.91,1.0
726,Scooby just can't seem to escape the doggy internment camps.,03-29-2021 02:28:05,5743,0.98,1.2
727,"Thirty years later, marketing experts believe that the Music Vest™ failed to catch on because of that annoying space before the exclamation mark.",04-04-2019 21:56:51,5720,0.97,0.8
728,Granny locates hot singles in her area.,12-06-2014 14:02:39,5721,0.92,1.6
729,"With her husband gone, Beatrice's dream of a margarine-free household would finally be realized.",10-16-2016 19:14:39,5723,0.92,1.2
730,"""My anaconda don't want none, unless you've got buns, hun.""",05-27-2015 11:26:56,5724,0.9,1.2
731,Wendy uses her coffee frother in the jail ramen to add both flavor and visual appeal,08-07-2017 17:44:17,5704,0.94,1.2
732,Vicki tries to pull her best wow face after getting her makeup done at the local mall,01-09-2015 13:15:55,5706,0.91,1.4
733,Joe failed miserably in trying to hide the evidence that he has been drinking while driving.,06-12-2015 13:13:06,5694,0.92,1.2
734,Rural beauty pageant winner seals the deal with her talent display.,08-23-2019 17:49:59,5696,0.98,1.0
735,Dan was skeptical that little Jimmy could correctly guess the day his first wife left him.,08-04-2017 10:02:41,5679,0.95,0.8
736,Sharon knew what she needed to spice up her lonely baths,05-30-2017 00:25:33,5663,0.92,1.2
737,She's wanted in New Jersey for attempted glass bottle slaughter.,06-11-2019 09:36:53,5650,0.96,1.0
738,Unfortunately Gram Gram tapped R for Restart.,09-21-2019 10:06:56,5647,0.99,0.6
739,"Zero women flirting with you? Are you a sad virgin? If so, buy the brand new Arctic Hat! Putting on this COOL hat will give you a COOL blue aura that makes you 20 degrees COOLER, man!",09-15-2019 03:32:34,5645,0.99,1.2
740,"Just like a proud father, Eric could never bring himself to throw away his cat's fine work and showing them off to his friends.",04-11-2017 07:35:50,5643,0.91,1.0
741,Grandpa Marty's yayo addiction was causing him to steal from his own kids.,06-30-2018 12:13:44,5646,0.95,1.2
742,"If you don't clean up your damn room, Patty here will claw your eyes out.",03-28-2015 20:35:50,5633,0.92,1.0
743,"After John heard that the Fine Bros trademarked sprinklers, he had to resort to using the lousy hose format.",02-01-2016 00:30:18,5610,0.88,1.0
744,Where did the frying pan go?,12-27-2012 10:26:04,5606,0.96,0.6
745,Another reason why the Amazon Fire Phone wasn't as successful as expected,01-02-2015 13:55:20,5582,0.89,0.6
746,"Bob fondly reflects back to this moment as the genesis of his ""farting on sleeping women"" fetish",01-22-2015 15:56:46,5585,0.93,1.0
747,Meghan discovered a cuss switch on the side of her left hand,10-16-2018 08:44:41,5584,0.96,1.0
748,"After frequently upsetting his guests and family, Jim's chastity belt works like a charm!",03-23-2019 11:47:03,5580,0.97,1.4
749,"Once again, Dr. Soda has caught Wonder Mom and her trusty sidekick in the agonizing Fan Death trap! Will they be able to escape in time, before the oxygen is depleted in the room?",01-07-2018 12:43:43,5573,0.94,1.2
750,"After years of getting stopped by border patrol, Marie realized the best way to smuggle her ""magic powder"" out of the country was through the lining of her dress",07-05-2020 12:04:17,5569,0.98,1.0
751,"On one hand, the cat didn't chew its food enough. On the other hand, packing school lunches was a lot quicker these days",01-26-2018 12:36:44,5565,0.92,1.0
752,"Oh crap, she poisoned me.",11-29-2014 14:15:24,5567,0.92,0.4
753,"Living in a black and white world, Richard was stunned when his bathroom emitted actual light.",12-03-2016 04:36:24,5546,0.93,1.0
754,Lorena Couldn't Cut Vegetables Without Remembering Her Past Sins,08-14-2016 10:11:20,5538,0.9,1.4
755,"Sadly, Vicki never figured out how to properly lower her phone's ringer volume.",02-14-2019 21:19:53,5539,0.96,0.8
756,Investing in that home centrifuge sure saves money on haircuts.,10-23-2016 17:39:13,5531,0.92,1.6
757,Gary Busey attempts to make a career transition from acting to professional house painting,01-08-2019 09:53:19,5533,0.98,1.0
758,"Awe, somebody's sleepy!",10-27-2015 18:03:32,5524,0.9,1.0
759,Damn Hackers!,11-16-2014 01:16:12,5530,0.95,0.8
760,"They took their trip to Haiti and thought the Voodoo woman was nuts, yet now they are forever linked to one another",06-01-2016 08:47:23,5520,0.93,0.8
761,"Susan, a successful con artist and mother of 2, went for her ultimate trick by baking her famous bread with chloroform. She knew the steam could knock them out in seconds.",05-23-2019 23:34:05,5513,0.98,1.0
762,I'm over 72,03-27-2016 14:13:18,5505,0.89,0.6
763,"After unexpectedly getting her period at the pool, Mandy decided to make the most of it",12-25-2017 05:17:24,5487,0.91,1.2
764,"""Reggie…! God dammit, stop storing your farts in my jars!""",09-05-2018 11:52:33,5484,0.94,1.0
765,Betty was in a lot of pain after anal.,01-12-2016 13:18:52,5483,0.9,1.0
766,"Easy, eeeeaaasy...",09-21-2014 02:15:19,5476,0.94,0.6
767,Brian was growing desperate for excuses not to visit his in-laws.,08-12-2016 17:29:52,5473,0.93,0.8
768,Tom underestimated the weight of her situation,09-17-2016 06:48:06,5472,0.92,0.4
769,Smoking all the weed before dinner time was a terrible idea,04-25-2020 10:30:18,5462,0.97,1.2
770,"In a desperate attempt to be felt up by a man, Steve decided to target pickpockets.",02-23-2016 23:50:25,5436,0.94,1.2
771,"After dinner the family usually played a fun game, but today Father had a better idea...",04-20-2019 14:16:42,5445,0.97,1.0
772,"Don't let the fancy degrees and books fool you, scientists use magic to invent things.",12-31-2015 17:19:45,5440,0.93,0.8
773,"Mary told herself she would quit months ago, but with little Tommy, there was never a day she could go without breaking into her spice rack cocaine stash.",11-09-2017 11:17:17,5430,0.95,1.2
774,My reaction when checking the results of the last thing I posted on Reddit,03-09-2020 20:23:50,5425,0.96,0.6
775,Heather didn't mind it when her kids used her bakeware to debate isoperimetric inequality. She just wished they would wash everything afterwards.,05-07-2019 16:27:15,5417,0.97,1.0
776,"Cindy knew she couldn't re-gift the sunglasses, so she concocted the perfect disposal method.",07-31-2016 17:32:37,5424,0.9,0.8
777,"The stench of death was overwhelming and the oven was never quite the same, but it was still cheaper than a divorce.",05-15-2016 17:46:00,5411,0.91,0.6
778,47 years into their marriage and Ben still cries when Mary elbows him before bed,12-08-2016 15:53:54,5409,0.9,1.2
779,Jason's Hot-Dog Lovers Society hazing was especially traumatizing,11-18-2016 13:20:46,5409,0.91,1.0
780,"In retrospect, trying to learn Irish dancing in the shower wasn't the smartest idea",03-13-2015 19:10:17,5405,0.92,1.2
781,Doug's timing was always off when it came to seducing the ladies.,06-13-2020 03:32:24,5401,0.98,1.0
782,Robin laid an egg. It was delicious.,11-29-2020 02:35:20,5393,0.99,0.8
783,"“You’re gonna love this new dish sweetheart, the meat falls right off the bone!” .. Mom where’s Baxter?",03-25-2020 21:15:52,5385,0.96,0.8
784,I don't even own a dog,01-31-2015 12:29:16,5381,0.93,1.2
785,"Within mere seconds, the quarantine became a living nightmare.",03-23-2020 19:14:04,5369,0.97,0.4
786,Jane's stalker really went too far this time,09-06-2014 09:57:49,5373,0.93,0.6
787,Doug's Father's Day gift from his ex-wife made a lot more sense to him after he discovered he was actually trying to measure his window with a live snake.,06-28-2015 15:19:18,5363,0.93,1.0
788,"Hey kids, Aunt Fransisco is here for more art lessons!",01-12-2021 13:51:40,5365,0.96,1.2
789,There goes more money down the drain!,03-08-2015 12:58:50,5362,0.92,0.8
790,Cutting a sandwich is basically impossible.,04-13-2015 06:38:39,5362,0.95,1.2
791,"Lamp, please...",02-07-2015 03:57:21,5349,0.94,0.6
792,Susan can't stop being reminded about her hospitalized husband,05-02-2018 14:25:42,5349,0.89,0.8
793,"she was sick and tired of fucking around, that hair was getting curled today!",05-17-2016 08:43:26,5335,0.92,1.0
794,Walking was always Steve's achilles heel,04-10-2015 08:33:54,5330,0.95,1.0
795,Jeff discovered his new favorite personal lubricant,05-19-2014 07:23:17,5332,0.95,1.2
796,Jessica didn't quite understand why guys kept saying they were attracted to her bouncy body,11-30-2016 19:06:32,5310,0.89,1.2
797,The pills are kicking in.,05-14-2015 23:54:10,5314,0.93,0.6
798,"Phillip was eager to get into Revolutionary War reenactments, but he couldn't shake the feeling that something wasn't right.",10-03-2017 19:03:51,5310,0.91,0.6
799,Be amazed as Rover can pass through the magic rings without touching them!,09-30-2015 17:31:29,5310,0.89,1.0
800,You can’t really enjoy the new CARS movie without the 3D glasses,02-18-2020 19:40:59,5307,0.98,0.8
801,"""Mommy, Mommy I want brownies,"" well here they are you stupid little turds.",10-17-2020 21:09:39,5297,0.98,1.0
802,The Comfort Click Belt is so versatile it even works with ugly shorts.,07-30-2019 14:15:52,5304,0.96,1.0
803,"Checkmate, Atheists ",03-11-2013 21:44:40,5299,0.94,0.8
804,Mom? What the fuck are you doing?,05-26-2014 23:48:24,5296,0.97,0.8
805,"The kids are sad because their father, Flat Stanley, has been traveling around the world for years...",04-26-2016 02:09:09,5294,0.9,0.8
806,"Alyssa knew there was only one place she could hide the diamonds, one place Roger would never think to look.",01-09-2019 07:13:29,5288,0.97,0.4
807,Making coffee traditionally is so complex and hard.,10-27-2014 05:39:56,5289,0.93,0.8
808,How was Dave supposed to know all the kids were victims of Spoon Abuse!?!?!?,03-30-2016 22:44:59,5282,0.92,0.8
809,"""I want the best hairstyle that $3 can buy!""",03-14-2016 09:05:55,5277,0.94,1.6
810,"Brian always came prepared to urine tests, but nothing could prepare him for this.",08-02-2014 03:52:16,5272,0.91,0.8
811,When the power came back on George finally noticed how useless that lampshade is...,08-27-2019 01:45:29,5275,0.99,0.6
812,In the middle of the stakeout FBI Agent Henderson's headset suddenly started picking up strange musical interference...,09-29-2019 23:35:09,5268,0.99,0.8
813,"After spending an hour trying to empty out his pool, Tom began to wonder if the bucket was the best choice.",06-02-2015 16:37:29,5265,0.93,1.0
814,"John was running out of time, the police were on their way.",06-03-2015 12:47:45,5268,0.94,0.4
815,Sarah got upset when the 911 operator told her that being late for a pedicure did not constitute an emergency.,10-26-2019 21:07:56,5255,0.98,1.4
816,"After years of constant itching, Jane has finally found relief",09-11-2014 19:01:28,5248,0.92,1.0
817,"Woman is surprised, yet happy when family surprises her wearing creepy dead-grandma masks",04-17-2015 12:55:33,5250,0.91,1.0
818,"Despite her doctor's insistence, Carol continued to sleep on a blazing fire.",01-25-2017 02:16:26,5235,0.96,0.8
819,"Little did Daryl know, the battered rug had been plotting its revenge for years.",08-25-2019 12:11:24,5230,0.99,0.6
820,"his freestyle rap career was going no where, but he was determined to come up with the freshest lyrics the world had ever heard",05-28-2016 09:41:50,5226,0.93,1.0
821,The tattoo on Natasha's wrist reminded her of the platoon she'd lost those many years ago...,03-04-2015 07:52:06,5213,0.87,0.4
822,"Calm down dude, you're spilling shit (x-post r/gifs)",12-15-2012 07:25:21,5217,0.94,1.0
823,Anger makes Gina's clothes change color.,09-04-2016 22:42:35,5204,0.89,1.2
824,Julie asked the Lord for forgiveness before she assassinated the unsuspecting tomato.,05-08-2019 09:11:54,5198,0.98,1.0
825,Chad finally found a way to practice his putting while touring with Nickelback.,02-16-2019 19:06:20,5201,0.97,1.0
826,Dad's playing catch with himself and dreaming about wieners again. ,10-24-2012 13:08:18,5195,0.97,1.2
827,"Though she felt some guilt for lying to her children about their ""peanut allergies"", Vanessa did greatly enjoy peanuts.",08-25-2016 17:40:37,5194,0.89,1.2
828,"dawn thought a simple ""no thank you, i'm fine"" would suffice when the gym creep asked her if she knew how to use the machine.",07-28-2015 06:51:50,5188,0.95,1.0
829,"No, we don't accept bitcoin",06-18-2015 22:25:34,5170,0.9,1.0
830,"No car, don't cry. It's not your fault.",11-15-2014 08:20:07,5172,0.91,0.6
831,"What a beautiful puzzle, I'm going to show it to all my friends!",06-13-2014 08:25:08,5165,0.96,0.8
832,Susan realized having children with The Incredible Moldable Man might not be the worst thing in the world.,12-12-2017 23:33:36,5161,0.96,1.0
833,Little Jimmy's plan to bribe Santa worked flawlessly.,12-19-2015 08:53:11,5157,0.92,1.2
834,Susan just really doesn't like Phillips head screwdrivers (x-post from /r/ScrewPhillips),07-17-2020 00:14:50,5152,0.99,1.2
835,"Sleeping with the secretary was an accident? Well, you son of a bitch I'm going to have an ""accident"" too.",06-04-2015 09:50:11,5149,0.94,1.0
836,"After their successful kidnapping attempt, the boys celebrated with some football",03-18-2017 07:58:42,5144,0.92,1.0
837,"Sorry dad, nobody likes your stupid clown paintings.",10-29-2016 11:18:35,5147,0.93,1.2
838,Every night Jerry strapped on his food bag and visualized peaceful nature scenes until the Viagra kicked in.,12-01-2019 22:24:59,5143,0.98,1.0
839,"she was never fully convinced that her husband was telling her the truth, but like clockwork she would go out into the yard and collect the steamy pile of bananas for breakfast",05-25-2016 08:30:59,5144,0.92,1.0
840,The dangers of uncovered genitals.,10-05-2014 20:42:51,5141,0.86,1.0
841,This is what happens when you hire Michael Bay as your electrician.,06-16-2016 14:48:02,5130,0.93,0.8
842,At least you didn't have to scroll through a life story to get the recipe for basic bitch.,04-24-2021 16:43:47,5127,0.97,1.0
843,Harold and Nancy were scientists hoping to evade their electricity bill. They realized that their lightning-powered lightbulbs were not a viable solution.,11-07-2018 20:01:26,5121,0.97,0.8
844,Are you tired of getting a D- in shop class?,04-29-2016 13:03:57,5120,0.91,1.2
845,Reminders of Todd's woeful wet noodle haunted Debra after their last date.,02-21-2019 18:01:31,5111,0.96,1.2
846,Shit,11-10-2012 17:01:53,5108,0.95,0.4
847,Don't put the cart before the hose.,05-01-2017 08:12:41,5106,0.9,0.8
848,"As Kevin attempted to remove his wife's Chestburster, he found it way longer than he anticipated.",11-29-2018 06:17:45,5104,0.96,1.0
849,Audiences found the newest Home Alone reboot left much to be desired.,12-20-2019 17:23:47,5102,0.98,0.8
850,Josh's premature ejaculation put a damper on an otherwise fun evening out.,10-28-2019 18:09:34,5097,0.98,1.2
851,I love laxatives,11-01-2014 16:17:17,5092,0.9,1.0
852,Day 386: I still cannot figure out how to break free from this device,02-19-2017 01:51:39,5092,0.98,0.8
853,That doesn't go there,11-17-2015 10:15:36,5088,0.93,0.4
854,"After mastering her skills, Emma is ready to join the circus",08-13-2015 18:51:31,5078,0.93,1.2
855,Ted recalled his misstep when his mechanic reported Ted had a flooded engine.,02-15-2019 17:14:34,5079,0.98,0.8
