idx,title,created_utc,score,upvote_ratio,humor_scores
415,"That’s it, Brenda’s evening was ruined. Her husband didn’t put the lotion on his skin so she now had to go and find the hose again",01-03-2020 18:07:08,8698,0.97,1.0
416,The new jewelry box anti-theft system exceeded all expectations,11-07-2015 10:06:15,8687,0.94,0.6
417,"After her goldfish died, Joanne decided to repurpose the aquarium as a display case for her giant glass blueberry.",07-28-2019 20:25:42,8670,0.99,1.0
418,"It took months of testing in the lab, but Jeb finally found the most promising candidate for his new aerial cocaine distribution system",12-11-2020 23:04:11,8657,0.98,1.0
419,The day after Brad and Jeff's relationship went to the 'next stage',04-04-2015 00:23:49,8658,0.96,0.8
420,"Next time you're pushing rope, whip out your caulk and give it a caulk slab! Slab that caulk all over the place, even if your caulk is only an inch or two!",02-01-2018 12:18:19,8649,0.91,1.0
421,Gladys finally figured out how to blast the rest of that cocaine residue inside her nose directly into her brain.,02-21-2018 09:02:24,8651,0.97,1.2
422,"Richard remembered the last time he huffed gas, he destroyed the lawnmower for talking shit.",07-10-2017 11:49:28,8647,0.94,1.0
423,"Becky gets free lunch whenever she wants, thanks to the ol' ""Sticky Noodle"" technique: ""There's hair in my pasta"" - ""So disgusting""",05-01-2018 11:05:22,8649,0.93,1.4
424,Jada did everything she could to erase evidence of what she did to her ex-boyfriend.,07-15-2017 14:48:29,8618,0.91,0.6
425,"When your child gets overdosed with Flintstones™ Gummies, you have to act fast!",07-24-2019 12:17:57,8615,0.98,1.4
426,"Forbidden to meet her boyfriend, little Millie took advantage of her cruel owner's ham & olive pizza addiction",03-22-2018 05:36:26,8609,0.97,1.2
427,"Hiram started to wonder if his ""farm fresh"" goose down pillow was a wise purchase",09-14-2016 08:41:20,8604,0.93,1.2
428,"Disney World's brand new Orlando attraction, ""The Magic of School Security Guards"" may have gone too far",06-28-2018 02:56:53,8544,0.96,0.8
429,"Fifi, disgusted at the use of a catapult over a trebuchet, immediately gnaws off her hand",08-26-2018 00:13:24,8537,0.94,1.0
430,Guess Timmy's been spending too much time on the internet,08-22-2017 13:21:21,8525,0.94,1.2
431,Darryl suddenly realised he didn't like the nightclub as much as he thought he would.,01-10-2017 09:23:05,8514,0.87,0.8
432,Welcome to /r/wheredidthesodago,10-11-2015 15:48:36,8493,0.9,0.8
433,Are you thirsty?,03-01-2017 01:14:09,8489,0.93,0.8
434,This mini vacuum takes care of all your mini carpet needs!,04-26-2017 12:24:32,8488,0.94,1.2
435,"Midas had his golden touch, but not Debbie. Debbie has cardboard chomp.",08-01-2015 02:54:07,8483,0.94,1.4
436,The lack of a G-button proved frustrating for Ricky.,08-21-2017 19:16:51,8479,0.82,0.8
437,You gotta do what you gotta do!,11-15-2016 22:05:44,8449,0.9,0.8
438,After a long day of work Lisa was ready for a night of slaying,03-27-2015 14:15:18,8431,0.93,0.8
439,"How does gravity work??? Let me google it on my iPad ""How does gra..."" awwww shucks! Dagnabbit to heck!",08-10-2016 21:59:40,8390,0.9,0.8
440,Don't kink shame. You do you.,03-02-2019 19:25:32,8397,0.94,1.0
441,"Kyle's new flesh-light was self-cleaning, but it came at a cost",09-22-2018 02:07:17,8385,0.96,0.8
442,"No, Satan, No. I will NOT kill these people!",01-14-2015 22:20:45,8383,0.93,0.6
443,Jessica felt the need to psych herself up before she finally resorted to eating lawn decorations,10-28-2017 10:20:05,8372,0.94,1.2
444,Forget cow tipping. It's all about AC tipping now.,07-04-2017 04:02:03,8367,0.96,1.4
445,Anthony Sullivan beheads an infidel on live TV,01-11-2015 12:11:50,8315,0.91,0.8
446,"After a hard day's work at the alpaca farm Bryce likes to wind down with a cold Dos Equis and a couple of rounds on his favorite game, ""Metal Detector Simulator 2: Quest for the Spanish Doubloons""",03-05-2017 07:47:02,8315,0.92,1.2
447,Combine this mystical product with a hot shower and watch the years roll backwards - you too can be hot again!,03-08-2016 03:42:14,8310,0.92,1.2
448,Janet was sick of that ghost haunting her family,05-06-2018 18:54:42,8248,0.96,0.6
449,Why Can't I Kitchen?,05-12-2015 11:22:37,8237,0.92,1.4
450,we need to give our kids glasses honey,11-03-2018 15:00:42,8235,0.96,1.4
451,Grandpa was thrilled when he overheard plans of his upcoming surprise euthanasia!,07-13-2014 10:27:43,8223,0.89,1.0
452,Guess this isn't how you stream porn...,08-09-2016 00:09:01,8212,0.9,1.0
453,"the birth of ""Electric Man""",05-08-2016 10:08:56,8202,0.9,0.8
454,Carl finally found the source of the incessant honking,04-23-2017 08:43:26,8152,0.95,0.6
455,Great...another thing that won't stay up in the bedroom,04-28-2020 17:57:48,8124,0.98,1.0
456,"Kyle used his telekinetic powers for minor evils, like ruining Bill from accounting's shirt at the office party.",12-28-2018 14:51:58,8126,0.97,1.2
457,The infamous home intruder left his mark by lubricating the handles of every mop and broom.,04-22-2016 16:45:36,8124,0.92,1.2
458,"Unknown Artist. 2016. ""Beans on Counter""",08-30-2016 17:03:51,8107,0.92,1.0
459,He’d already been told it wasn't pasta night.,01-26-2017 09:26:03,8108,0.94,1.0
460,Mike was feeling kind of sexy today,08-28-2019 11:19:08,8093,0.99,1.0
461,"Ok, just one more meme before behhhh...",09-05-2020 14:17:23,8077,0.98,0.8
462,Our flight had to turn around because someone left a bomb.,04-14-2016 16:29:06,8079,0.9,0.6
463,Now you can launch troops out of planes from the comfort of your own home!,06-14-2015 09:49:19,8078,0.93,1.0
464,Always remember to leave your mouse in safe mode. Accident prevention begins with you.,01-24-2018 08:54:40,8077,0.95,0.8
465,Ron misunderstood why a crowd of pretty ladies gathered so quickly at the hairstylist’s “What NOT To Do” seminar,03-19-2017 10:57:25,8067,0.92,1.2
466,"After her family and doctor told her she shouldn’t drive anymore, Barb decided HD Vision Wraparounds were the best option to keep herself and others safe on the road.",08-12-2018 18:23:02,8062,0.95,1.0
467,"Ya stupid jackass, this one’s got that smuggled tiger cub from the Berlin Zoo!",07-13-2018 01:21:33,8054,0.93,1.2
468,"When I slipped into Gif Tournament X, I knew I was in trouble",08-04-2018 17:24:06,8043,0.93,0.8
469,Who knew water cooling my laptop could be so easy.,08-02-2016 12:54:10,8027,0.91,1.0
470,"""Clothes are hard! Why is this hook on the wall?""",01-02-2019 15:30:43,8018,0.96,0.8
471,"Due to budget cuts, the university is combining anger management courses with culinary arts.",01-18-2019 10:14:00,8012,0.97,1.0
472,"Mike never questioned that his grandma was from Argentina, but something about her sandwiches seemed a bit off",05-16-2020 07:28:52,7985,0.98,1.0
473,Billy had a clever way of telling his dad to get his own goddamn drink,04-05-2017 12:17:46,7980,0.92,1.2
474,"Despite the recent discovery of his ex wife’s love affair, Marks artistic side was really starting to shine!",06-19-2020 21:12:48,7977,0.97,0.8
475,The concept of waving at the parade eluded the Sioux Falls beauty queen,07-27-2016 15:42:42,7949,0.9,1.0
476,Somebody call a whambulance.,12-30-2014 06:26:35,7920,0.92,1.2
477,"Craig regrets using the genies final wish for ""A never ending sink-full of Campbells chunky soup.""",07-26-2015 13:38:21,7917,0.93,1.2
478,"He knew he had become a monster, murdering the innocent… and yet… the power felt so right…",07-14-2014 09:25:43,7889,0.92,0.4
479,"After failing at breakdancing, the last thing Roger expected was to be murdered by a sorcerer.",01-16-2016 12:21:40,7860,0.94,0.8
480,Barbara made it clear to Frank what she would do to him if he was ever caught cheating,06-06-2015 10:11:49,7848,0.91,1.0
481,"After the Divorce, Jen didn’t want to lose anything else to another hole.",11-08-2017 13:34:20,7836,0.94,0.6
482,"The chicken nugget machine worked well, but needed a new look.",11-02-2014 16:11:53,7804,0.89,0.8
483,"Even after all those years training as a chef, Bob still couldn't figure out how pizza toppings work",12-31-2017 03:13:22,7792,0.97,1.2
484,"Tommy couldn't find any LEGO pieces lying around to prank his Dad, so he had to improvise immediately",02-05-2018 15:50:48,7793,0.94,1.0
485,Jerry hated the crocs that his new neighbor gave him.,06-21-2016 12:22:49,7808,0.91,1.2
486,That lightbulb moment Tom was waiting for never came,01-21-2018 20:11:47,7778,0.92,0.6
487,It was love at first cavity,04-20-2020 20:37:12,7772,0.95,0.6
488,Becky's habit of watching other people drive came to an abrupt halt...,08-30-2017 09:02:28,7775,0.95,0.6
489,Amy casually made sure the murder weapon was in place.,08-17-2019 22:31:56,7741,0.99,0.4
490,Monica could finally grow enough zucchini to satisfy r/wheredidthevegetablego,03-20-2017 17:13:20,7741,0.91,1.2
491,"""Hi Ralf, you know what? Fuck You! Fuck you and your Mercedes!!!""",05-30-2016 19:43:17,7728,0.93,0.8
492,Recently-left-Amish-community world problems,11-11-2014 09:59:08,7729,0.94,0.4
493,Chloe's Attention Deficit Disorder started to annoy her friends,10-25-2018 08:05:35,7707,0.95,1.0
494,"This is Dave. Dave is attempting to take his first tequila shot at the ripe age of 38, after hearing about how the ""cool kids"" do them at the bars. Kids, don't be like Dave.",12-19-2018 13:03:50,7700,0.96,1.4
495,Sore back? Lost jewelry? All symptoms of letting toddlers ride you bareback! Pony Up Daddy!,12-17-2016 16:23:48,7685,0.93,1.4
496,It all makes sense now,12-29-2012 21:18:31,7668,0.97,0.2
497,Yup. That's definitely how it's done...,12-14-2014 11:12:47,7634,0.94,0.6
498,The new Quantum Superposition Express Train allowed Eddie to commute downtown and visit the beach at the same time.,12-21-2019 20:37:52,7626,0.98,1.0
499,"Tired of doing homework in school, Donald decides to drop out and make a lot of money instead",02-16-2017 02:31:08,7626,0.88,1.2
500,"When the earthquake struck, Diane's first response was to check on her plastic containers.",05-01-2019 18:15:43,7620,0.97,0.8
501,when that last green bean just wont fit inside the bag,09-13-2016 10:06:30,7621,0.9,1.2
502,"Ah yes, the three primary colors",03-09-2018 20:32:20,7610,0.98,0.8
503,Don't you just hate it when you're trying to lightly toast your hand and it catches on fire?,07-16-2014 22:02:38,7610,0.94,1.0
504,"All of a sudden, Dads purple pills kicked in.",04-29-2020 20:27:27,7599,0.98,0.8
505,Burnout 3: Takedown - Canadian Edition,03-07-2018 07:35:32,7603,0.94,0.6
506,"Since childhood, James had always hated being “it” for hide and seek",11-23-2016 10:05:34,7595,0.91,0.8
507,"Despite her repeated and desperate pleas to the contrary, Donna’s husband found out that yes, it would indeed kill her to grab the remote.",11-22-2019 02:19:30,7588,0.99,1.0
508,"Despite her best efforts, Lisa couldn't scrub out the memories of her cheating ex-husband, and had to take more extreme measures.",01-04-2018 15:04:52,7573,0.94,0.6
509,Tired of your defenseless car being attacked by feral shopping carts?,05-25-2015 22:00:30,7558,0.95,1.0
510,"""Ah fuck it, I tried.""",08-29-2014 09:01:40,7547,0.9,0.4
511,Gilbert loved to close deals almost as much as loved to aggressively vape at restaurants.,07-31-2019 23:43:34,7553,0.99,1.2
512,Tiffany and Chad finally had to admit they were getting too old for these low-margin high-risk daytime burglaries.,07-18-2019 02:38:35,7543,0.98,0.8
513,Buying a license off Craigslist was the worst idea ever!,05-10-2020 19:50:58,7528,0.96,0.8
514,Where did the soda go?,10-22-2012 06:52:52,7536,0.94,0.8
515,"Realizing she didn't have floss, Sally resorted to Plan B to hide the spinach stuck in her teeth.",10-14-2016 20:00:21,7523,0.91,1.0
516,Liza couldn't fathom why her sister would think bell pepper blueberry muffins taste good.,09-28-2019 16:55:11,7518,0.99,1.0
517,Holly would later try to convince her friends it was chocolate pudding.,02-13-2017 20:05:44,7507,0.91,1.0
518,"After one too many complaints about her hygiene, Sandra's boss offered her an ultimatum.",09-28-2016 16:57:46,7502,0.92,1.2
519,Deborah would later understand what her husband meant by a hot beef injection.,02-04-2017 22:13:45,7509,0.92,1.0
520,We may have solved world hunger,07-22-2014 06:15:28,7498,0.95,0.8
521,Carl instantly knew this was the moment he hit rock bottom.,08-09-2018 19:36:23,7464,0.97,0.6
522,"Janice needed a catchy title for her new ""high-fiber diet"" cookbook.",08-08-2014 17:34:42,7468,0.93,1.0
523,The iPhone consumer testing didn't work as planned.,09-26-2014 10:28:30,7451,0.94,0.6
524,"In an attempt to break the world record for hacking websites, Veronica accidentally infected her own computer",02-28-2016 23:05:14,7432,0.93,1.0
525,If only frail old Douglas had know that his fireplace was connected to the burning gates of hell itself,07-29-2014 11:06:49,7427,0.91,0.6
526,"Jenna had learned in couples therapy she often emasculated Steve, so to save their marriage, she feigned struggling to open a jar and then asked him to do it for her.",12-31-2017 20:48:13,7433,0.96,1.2
527,Every hard working man knows the pleasure of sniffing his boots after a long day,06-11-2017 09:34:20,7402,0.98,1.2
528,Michael shows his wife his latest magic trick while installing their new electrical outlet.,01-15-2020 01:42:09,7375,0.98,1.4
529,"Just as Linda suspected, Bud started drinking again. She emptied the can into the sink and knew it was time to throw his shit to the curb.",07-08-2017 22:36:56,7381,0.9,0.8
530,With the power of science Jun knew she could finally bring all the boys to the yard,03-26-2017 16:52:59,7372,0.92,1.0
531,"Killing imaginary spiders always made Bill hungry, so he dialled a random number hoping to order a pizza.",04-11-2019 11:03:39,7360,0.97,1.2
532,aggressive lactose intolerance,05-23-2015 21:46:58,7351,0.9,0.8
533,“I don’t care if the damn dog has super powers or not! Let’s see him survive his next vet visit.”,08-22-2020 07:41:54,7345,0.98,1.0
534,FUCK lettuce,03-09-2018 11:36:53,7341,0.93,1.2
535,Martha was really struggling with the idea of a light diet,03-31-2017 17:51:09,7338,0.95,1.2
536,"And just like that, Mark's special rainy day hot dogs were ruined.",10-15-2016 22:20:19,7337,0.93,1.0
537,I'm invincible.,06-18-2016 17:58:15,7328,0.89,0.4
538,Takeaways: 1) Vince is a cockroach sharpshooter. 2) Crumb removal is foreplay.,01-25-2019 09:28:26,7288,0.97,1.2
539,"""Oh mercy me, I do declare, this tractor is giving me the vapors.""",11-23-2019 13:42:33,7253,0.99,0.8
540,Sarah can't handle modern technology,04-25-2015 04:09:59,7243,0.94,1.0
541,the skunk aliens never really had a easy way with blending in with society,11-21-2018 18:19:10,7244,0.96,1.2
542,"Realizing the snipers had their sights on them, Dean, Barbara, and Philip frantically tried to cover their weak spots",05-10-2015 18:01:03,7227,0.91,0.6
543,Tonight Janice is getting ready OH CRAP! NOPE! WE'RE NOT GOING THERE! CLOSE IT DOWN! CLOSE IT DOWN!!,07-19-2019 21:44:10,7219,0.95,1.0
544,Are you tired from seeking cover from your neighbor's gunfire?,09-21-2016 16:02:00,7202,0.91,0.8
545,"To keep her from interrupting the World Series, Tammy’s husband soaked her brush in a heat-activated glue.",10-28-2018 18:27:36,7195,0.96,1.2
546,Where did the soda go?,10-12-2015 12:14:13,7183,0.89,0.8
547,Shane finds out that installing car bombs is easier to do in the movies.,05-20-2015 09:25:12,7162,0.93,1.0
548,"No one had the heart to tell Bob that he wasn't the ""grillmaster"" he thought himself to be.",11-19-2014 14:23:24,7160,0.93,0.6
549,Every day Johnny Mullet sprays his head with Rust-Oleum. It keeps the metal plate in his skull from rusting AND it attracts babes. So he says.,03-31-2019 00:30:53,7143,0.97,1.0
550,Aww :) Let’s order some DomiNO-THERE-she-GOES!!,10-09-2020 22:48:37,7146,0.98,1.4
551,The whole family goes wild when Despacito starts playing.,08-25-2017 14:25:29,7139,0.96,1.2
552,"It was then that Gary knew he needed a bullet for everyone, including the baby.",01-14-2016 14:37:04,7125,0.92,0.4
553,The burritos were Heather and Jeff's favourite part of foreplay.,12-06-2019 16:41:41,7121,0.99,1.2
554,"No matter what Nancy did, she couldn't keep the alien fetus from growing inside of her",04-15-2016 13:43:49,7083,0.92,1.0
555,"As she sank her teeth into the fetus fajitas, Sarah could literally feel herself becoming more corrupt",07-01-2019 10:28:07,7076,0.94,1.0
556,In his search for the messiah he followed the new star each day,12-24-2019 16:17:33,7064,0.98,0.6
557,"Oh no, can't see shit. Better keep driving my large vehicle.",01-07-2019 17:29:08,7055,0.96,0.6
558,Rob never figured out why his pico de gallo wasn't a bigger hit at parties.,12-29-2019 17:30:59,7045,0.98,1.0
559,Patented Candy-Corn technology infuses flesh with soy sauce instantly.,11-19-2016 22:49:30,7032,0.87,1.2
560,"""Dammit honey... I thought you said we were getting plastered tonight!""",08-23-2016 15:45:57,7032,0.89,1.0
561,"After some scientific analysis, I have located the soda.",09-23-2015 10:16:28,7019,0.89,0.8
562,When Ralph understand that he would never become a good Artist,01-11-2017 23:23:53,7002,0.91,0.8
563,The brownie gives some sassy backtalk before ultimate destruction by the asteroid.,09-11-2016 13:31:44,6994,0.9,1.0
564,Accident my ass! You did that because of my Ashley Madison account.,09-10-2015 13:57:21,6985,0.91,0.6
565,"Katie wants to get Shadow neutered, but her left hand has other ideas",11-27-2016 20:18:23,6982,0.91,1.6
566,"Order now to get your instructional video for the newest fitness dance craze that's sweeping the nation: ""Awkward Nine Year Old at a Church Dance"".",09-16-2019 20:57:49,6975,0.99,1.2
567,Once Tod accepted that Lisa needed her space their relationship greatly improved,09-08-2019 19:58:09,6957,0.99,0.8
568,"To make her troubles go away, Kaycee knew a normal sized bribe wouldn't do.",02-20-2016 09:49:47,6955,0.93,0.8
569,I can't be seen hanging around these weirdos.,08-23-2015 01:18:12,6949,0.95,0.8
570,"Although already in her second year of college, Danielle was still learning about cause and effect",07-31-2014 12:33:31,6947,0.9,0.6
571,Scientists determine whose BABY ON BOARD sign has more street cred,11-20-2018 13:06:19,6923,0.95,0.8
572,The secret ingredient is LSD.,12-08-2014 13:49:03,6926,0.9,0.8
573,Maria the goddess would disguise herself as an emotional housewife and would not reveal herself until she was offered sacrifices of food.,04-01-2018 05:10:10,6916,0.96,0.8
574,Steph thought nothing of the roach she had crushed and flushed - but the roach thought of nothing but revenge,07-26-2019 19:46:16,6906,0.99,0.8
575,8 out of 10 women agree: trying to dislocate your jaw really hurts,01-23-2015 16:23:09,6897,0.93,1.0
576,"Hi! I'm Phil Swift and if I catch YOU harassing my wife again, I'm gonna come brush your teeth!",02-08-2018 18:10:37,6909,0.98,1.6
577,It was the first thing Janet did after leaving Mormons,10-25-2018 08:09:57,6896,0.98,0.6
578,"Despite her education, Susan still couldn't understand eggs.",05-09-2018 01:28:44,6879,0.99,0.8
579,Jaclyn was disappointed when her boyfriend ruined the classic pasta kiss.,05-04-2016 21:07:52,6871,0.87,1.4
580,Janice couldn't believe the blanket didn't come with instructions,08-26-2016 13:50:51,6866,0.92,0.8
581,"George says when his family doesn't like his cooking he punches them in the gut, while Karen prefers to give them a slap across the side of the head.",04-17-2019 11:42:45,6869,0.96,1.4
582,"""Hee hee, she has no idea what I'm doing in here,"" Chet thought to himself.",12-08-2015 07:37:03,6857,0.92,0.8
583,Frank was happy to know not even a fried egg could harm his car.,03-18-2018 00:09:22,6855,0.98,1.0
584,Frank was tired of his kids coming into his room at night and interrupting his alone time. He figured instilling a healthy amount of fear would keep everyone happy and no amount of counseling could replace that feeling.,07-03-2018 10:18:23,6843,0.97,0.8
585,Karen hated having a mouse in her kitchen so she decided to get rid of it once and for all with the new RodenTNT™.,04-09-2019 19:14:17,6840,0.94,1.2
586,denise didn't realize her new cookware was going to be literally 1/2 off,07-17-2015 07:13:29,6830,0.91,1.0
587,"To save time and reduce his electric bill, Gary uses the sun to heat up his morning coffee",05-17-2018 18:09:46,6813,0.98,1.4
588,Jill's debilitating chicken grease phobia unexpectedly rears its ugly head,03-25-2016 13:10:13,6813,0.91,1.2
589,The new season of Deadly Senior Smash-Walker Battle Royal looks off the hook. My money is on Trudy and her battle tested Green CrushWalker 3000.,06-10-2018 16:01:42,6809,0.94,0.8
590,This fly terrorized millions. Time to take him out.,02-18-2017 16:27:52,6801,0.91,0.8
591,"Despite his enthusiasm, Mark’s science fair project on aquariums only left the judges scratching their heads",04-07-2017 10:47:04,6790,0.93,1.2
592,New battery drill! Recharge by simply focusing your disapproval!,08-18-2014 11:12:06,6783,0.93,1.0
593,Dear God! Give me the strength needed to toss this salad!!!!,01-13-2016 12:15:16,6779,0.93,1.0
594,"I never thought a face full of hair was possible, until now!",08-03-2014 05:54:14,6784,0.95,1.2
595,"Susan's attempts to stop snacking were all in vain. No one could keep her out of the kitchen, not even herself",11-19-2020 14:36:49,6769,0.99,0.8
596,"In order to protect his family from the outbreak, Chris decides to take drastic measures.",01-05-2018 11:22:51,6761,0.94,0.8
597,"Despite her better judgement, Jane loved Mega Man.",11-10-2015 15:25:10,6753,0.93,1.0
598,"Long ago before digital editing, goldfish pornographers had to add the black censorship eye bar manually.",06-04-2019 01:49:30,6738,0.95,0.8
599,She's having a halibut afternoon.,08-19-2015 09:43:55,6738,0.93,1.2
600,She’d come so close to abandoning her family and starting a new life.,01-27-2017 01:21:39,6734,0.97,0.4
601,"It cuts Cheese, Pigroast, Rotisserie Chicken, Cans, and even your Mom Pot Roast!",04-03-2020 13:49:36,6729,0.97,1.0
602,Whenever Danny smoked the World's Greatest Pot he got a craving for boiled eggs. Lots of boiled eggs.,05-05-2019 12:13:01,6708,0.95,1.2
603,"In 2010, scientists in Zurich admit to another disastrous Justin Bieber clone, but felt an ethical duty to keep the subject satisfied with his favorite snacks & drinks",03-07-2018 20:12:07,6709,0.97,1.4
604,"Immediately after swinging & missing, Hector realized he needs to rub one off in the bushes for good luck.",02-23-2015 05:32:00,6695,0.94,1.2
605,On the half moon Wanda only half transforms into a werewolf,08-30-2018 22:55:31,6678,0.98,1.0
606,"""I sure wish this jar would open as easily as my door apparently did.""",07-08-2016 03:41:24,6673,0.92,0.6
607,"she swore for years the house was haunted, but one ever believed her, the demon would only strike when she was alone",05-12-2016 09:51:35,6674,0.93,0.6
608,Tammy’s kids were just plain stupid,02-07-2020 20:49:03,6631,0.98,1.0
609,"When it came to interior decorating, Janet had absolutely no idea what she was doing",08-27-2015 10:39:49,6633,0.93,0.8
610,"When Mommy says you have to let Grandpa Eddie play with your toys because he was ""made special""",05-07-2016 05:38:19,6626,0.92,1.4
611,It's like watching the world cup all over again...,09-09-2014 10:18:45,6619,0.87,0.6
612,Donna shows off one of the discount prosthetic legs she makes at home and sells on Etsy.,06-08-2019 12:19:49,6622,0.97,1.2
613,This donut looks del-FUCK,10-23-2012 11:30:13,6610,0.96,1.2
614,"Janet bought the new ""Race Car Game 2000"" for the kids but didn't know how realistic it actually was until she heard a crash in the living room.",10-20-2017 09:55:17,6592,0.96,0.8
615,"Even after all those self defense classes, Jerry could not escape from the garden hose's choke hold.",01-17-2017 18:00:32,6573,0.93,1.0
616,Tom knew he wouldn't be able to finish his lunch after Janet's latest rectal cacophony.,08-18-2016 19:28:07,6563,0.91,1.0
617,Johan quickly realized that wearing the shirt while ironing it is not a good idea,09-25-2014 13:09:38,6572,0.93,1.0
618,Shoe polish just didn't give Jenny's carpet the shine she wanted.,03-11-2016 17:21:44,6561,0.91,1.0
619,Jennifer was devastated to learn the horrible truth about what happened to Mr. Snuggles.,06-10-2016 08:18:52,6543,0.89,1.0
620,"Linda realizes a little too late that school glue is not, in fact, a cheap alternative to styling gel.",01-03-2019 17:46:53,6542,0.97,1.2
621,Wow! I can’t believe it’s not ..FFuUcK!!,09-06-2020 23:52:52,6540,0.98,0.6
622,Worst ending to a scavenger hunt ever,07-14-2015 10:31:30,6523,0.93,0.8
623,"I don't know about you, but I always peel off my lips before going to bed.",03-25-2017 20:23:48,6515,0.91,1.4
624,Not the Sun!!!!,12-09-2012 12:18:34,6502,0.98,0.8
625,"Timmy wasn't going to eat that off-brand trash, but he knew he'd have to do some serious acting for the ""accident"" to be believed.",10-02-2016 10:35:11,6504,0.95,0.6
626,"Mom was great, but Dad was so much cooler..",11-12-2020 17:48:10,6497,0.97,0.8
627,"No matter how many times she tried, none of the pans were good enough to recreate Grandpa's favorite burnt scrambled eggs",03-22-2019 10:33:47,6476,0.97,1.0
628,On this laundry day Marjorie succumbed to her objectophilia.,08-28-2018 21:59:26,6444,0.96,0.6
629,"Fed up with other drivers on the road, Sharon generously replaced her side-view mirror with an HD screen so passersby could quickly and easily see a looping gif of her disapproving scowl.",06-23-2019 12:01:54,6457,0.98,0.8
630,"When confronted by a journalist with phone video evidence, Cheryl denied disposing of her ex’s body in the lake and awkwardly blamed it on her “twin sister.”",03-11-2017 16:58:37,6422,0.87,0.8
631,Chef Robert says the secret to making his make world-famous pan-fried sole is to start with a fresh shoe.,09-22-2019 12:46:15,6417,0.99,1.2
632,"After his DUI, Boomer had to take a cab to his weekly obedience class.",08-02-2019 00:27:34,6415,0.98,1.4
