idx,title,created_utc,score,upvote_ratio,humor_scores
0,Is your dumb kid sad because nobody bullies them? Fuckin' glue some paint to their head,02-22-2018 12:37:50,64773,0.95,1.2
1,Jim forgave his wife for her one-time affair but he would be damned if he had to treat that kid the same as his own.,06-29-2018 09:54:10,55031,0.94,0.8
2,Look at how distraught Megan is! This is what it will feel like if Net Neutrality dies. Don't let the FCC make you like Megan!,11-22-2017 01:20:14,51488,0.87,1.2
3,"Wait a minute, your profile said those were larger. What are those sad things? No don't try to hide them now, this date is over.",07-23-2018 13:05:38,45421,0.91,0.4
4,The worst thing about identity thieves is how stealthy they are.,04-22-2018 16:23:45,43998,0.94,0.8
5,I know my rights. You can't do anything to me. I'm an unstoppable vaping ahole.,11-01-2017 18:24:58,42496,0.92,1.2
6,Tom finally decided he was going to end his obsession with having sex with random objects filled with water,10-02-2017 16:45:24,41471,0.91,1.4
7,"Steve always knew his daughter was colorblind, but he never knew he could catch it from her.",01-23-2017 17:54:11,41224,0.94,0.8
8,"As Laura began to use her new toy, she hoped it would be big enough to finally give her the pleasure she so desperately desired.",04-07-2018 08:22:56,39616,0.94,0.8
9,"Are you fat? Bet you never tried rotating clockwise huh, dummy?",01-13-2018 19:36:56,38782,0.93,1.0
10,Frank was a career criminal looking for an easy target. It wasn't until he felt the wind on his head that he was reminded of his sudden hair loss.,07-24-2018 10:49:59,37477,0.94,1.2
11,"Suddenly without warning, the sight of smeared ink turned Kevin on",10-24-2016 13:05:08,37254,0.92,0.6
12,John still didn't understand the concept of passwords and kept trying to enter eight asterisks,12-19-2017 14:32:02,34812,0.94,0.8
13,"And now... we'll reveal the name of the murderer! *gasp* ""it's patrick!""",03-01-2018 23:41:47,33794,0.93,0.4
14,"Lord, I hate reading...",11-23-2017 10:57:37,33238,0.93,0.8
15,Stop saying the police in America are biased! Here's video proof that they go after all colors,03-20-2018 13:22:56,32518,0.89,1.0
16,"They told Terrance that you couldn't open an assisted suicide clinic, but Terrance knew that in America, you could do anything",09-17-2017 12:28:28,32497,0.93,1.0
17,"Sorry, but you can't laser butt fuck this man.",03-11-2018 08:45:55,32469,0.94,1.0
18,How to politely refuse someone offering you a diet soda,05-18-2018 16:04:53,32152,0.93,1.4
19,Nothing can prepare a parent for the horror of discovering your child has built their first meth lab,05-15-2018 15:28:37,32128,0.93,1.2
20,We can't have a drinking problem if we don't have a problem drinking right? Haha *click*,02-23-2018 13:13:26,30934,0.94,1.4
21,Jennifer's tasteful use of blackface wasn't appreciated at work but she knew no one could judge her at home,06-06-2018 09:47:16,30808,0.92,0.8
22,UGH! If only there was some way to bring your foot closer to your body!,08-19-2017 20:55:25,30731,0.94,1.0
23,"Hell yeah, that's my jam!",07-07-2018 15:16:02,30444,0.95,1.0
24,Barbara had a craving for McDonalds BBQ sauce and she knew just where to find it,01-05-2019 17:39:00,30204,0.94,1.2
25,Ryan was glad to finally put his new fursuit to use in the Garden,01-12-2018 16:35:36,30130,0.91,1.2
26,These uncut-able gloves were interfering with John and Caryns self harming tendencies,01-10-2018 18:09:24,29069,0.93,0.6
27,"I told you to stay away from my husband, bitch",03-29-2018 14:00:19,28842,0.92,0.8
28,The ultimate viewing experience,08-27-2017 12:46:28,28826,0.93,0.8
29,"Thanks to AT&T and Comcast's lobbying to destroy internet freedoms, Mary couldn't afford Netflix anymore and had to watch boring-ass local news",03-06-2018 11:15:16,28684,0.91,1.0
30,"Hey VSauce, Michael here. This guy's dick is tiny. ...or is it?",04-05-2018 14:28:56,27491,0.9,1.4
31,"After Mark's mom died from an allergic reaction to shrimp, he decided to give the shrimp a taste of their own medicine and record their tiny screams.",03-24-2019 15:36:15,27103,0.94,1.4
32,"Contrary to popular belief, the mood was quite upbeat during the Jonestown massacre.",08-09-2017 11:48:07,26694,0.91,0.6
33,"After stepping on LEGOs for years, John decided it was time to take it to the next level.",05-08-2018 10:30:13,26175,0.93,1.0
34,"When Larry told Suzy ""I'm gonna stretch out that tight little fanny,"" this was not what she had in mind",01-25-2018 12:35:18,26151,0.91,1.4
35,Susan couldn't ignore the voices any longer.,06-08-2018 10:49:42,26020,0.95,0.4
36,Geoff couldn’t believe that Mom wanted her ashes scattered where he was drunkenly conceived,10-21-2017 18:32:32,25960,0.92,1.0
37,LPT: A hose on the tailpipe can direct soothing carbon monoxide back into the car cabin to help your kids get a nice long nap!,02-20-2018 17:45:43,25827,0.88,1.2
38,He'd been dead for hours but 2 Broke Girls was having a marathon.,04-19-2017 15:06:42,25749,0.92,1.0
39,Kim’s flopping to avoid playtime with the kids was getting out of control,12-26-2017 16:52:52,25642,0.93,0.8
40,Dylan's addiction to Robitussin was affecting his state of mind but his mother was tired of mopping the floors,06-01-2018 10:52:48,25552,0.93,1.0
41,"Here's your omelette, you stupid son of a bitch.",10-22-2016 16:45:26,25122,0.93,1.0
42,An indecisive serial killer's worst nightmare,04-25-2017 13:14:35,24972,0.93,0.8
43,Susan was on her first date after the divorce. She unfortunately didn't understand her friend's advice to 'shake her goods' to impress her date.,07-25-2018 09:22:21,24567,0.94,1.2
44,Workers for the National Motion Sickness Hotline know that empathy is the key to success.,07-30-2017 19:16:01,24464,0.94,0.8
45,The best way to catch fish is the American Way.,04-20-2018 23:38:25,23674,0.94,1.0
46,Michael realised that he needs to work on his handjob skills if he wants to keep up with the increasing competition on Grindr,11-13-2017 16:14:10,23401,0.89,1.2
47,Once the rumba took care of the murder evidence. It was time to take care of the rumba.,06-04-2018 01:32:08,23195,0.93,0.8
48,New from Mark Zuckerberg: HOW TO CONSUME SPHERICAL NUTRIENT CORES LIKE THE HUMAN YOU DEFINITELY ARE,12-04-2017 13:28:48,23130,0.91,0.8
49,"Not only will Tesla’s next gen car cook your breakfast, it will also quickly & painfully teleport you to your destination.",09-12-2018 15:49:37,23044,0.94,1.2
50,Frank was fucking done with epileptics breaking into his house.,08-26-2017 04:42:52,22719,0.97,1.0
51,"If Grandma won't let us play video games, then f**k her couch.",06-26-2017 13:25:49,22698,0.96,1.4
52,"After all these years, he finally tracked down the coconut that killed his family.",12-09-2017 11:03:24,22608,0.94,0.6
53,Greg was not called back to play 'athletic businessman' ever again.,08-01-2018 09:31:31,22527,0.94,0.8
54,Fetch your own balls. I know what you did with mine.,02-02-2020 17:42:12,22483,0.96,1.2
55,"..I have to be honest, the new Disney Cinderella movie looks pretty lame",03-02-2018 16:54:57,22098,0.95,0.8
56,Scientists have identified a chemical found in popcorn that makes you remember that embarrassing thing you did that one time,04-25-2018 11:24:20,22038,0.94,1.0
57,Helen is fed up with George leaving his lit cigarettes on the bed every night,04-18-2018 14:20:23,21862,0.92,1.2
58,"Man, fuck shoes...am I right, guys?",07-09-2016 13:59:56,21850,0.92,1.0
59,"Are the kids bored? Do you want to keep them happy for hours on end? Babysitting just got a lot easier thanks to Shrooms for Kids™! Watch as the kids can now see, feel, and taste colors!",07-11-2018 10:38:43,21693,0.95,1.2
60,Brenda didn't regret choosing her career over having children one bit.,08-28-2017 18:53:07,21499,0.91,0.8
61,Rhonda was so happy she finally found a product that would assist with her voyeuristic kink of public egg insertion,01-19-2018 11:46:31,21355,0.96,1.4
62,"Nancy’s first day at Starbucks: “Grande mocha, ready at the bar!”",10-17-2017 00:55:06,21136,0.93,1.6
63,Donna was stunned when Kevin showed her how much he urinates every week.,04-24-2019 21:48:56,20999,0.96,1.4
64,I made you dinner,01-16-2017 18:05:58,20911,0.93,1.2
65,"""The cane must die and no one must ever know""",03-29-2016 19:24:28,20904,0.94,0.6
66,Janice and Bob almost forgot they promised their son his own personal rave party that night,09-24-2018 10:47:31,20847,0.95,1.4
67,Jessica's husband had a fetish for simultaneous lovemaking and home repair,06-25-2018 13:57:21,20703,0.93,1.4
68,Mom was great at making Wonderbread Sandwiches! Eat one every day and you'll wonder if God is dead or has simply abandoned this worthless world,02-15-2018 14:59:07,20656,0.91,1.2
69,Cindy's lack of sexual education became woefully apparent after receiving a gag gift from her girlfriends,12-10-2017 10:25:26,20543,0.92,1.4
70,Danielle couldn’t admit the AR-15 she ordered from China wasn’t the real deal,10-25-2017 13:44:12,20486,0.87,0.8
71,"Thanks to the night class for illiterate adult Lucy attended every weekday, she can now perfectly spell words on her first try!",11-28-2017 08:22:23,20474,0.92,1.0
72,When you suddenly realize that putting your grandchildren up for adoption is still not legal,08-17-2018 16:05:37,20233,0.95,1.0
73,"Karen always knew how to make a great first impression. As luck would have it, she got the job!",07-09-2018 10:42:29,20141,0.91,0.8
74,Not even a would-be attacker could take Monica's beloved vibrator away from her,11-18-2017 12:05:16,20120,0.92,1.0
75,Sarah was disappointed that the open can of soda she found floating in swill on the refrigerator door didn't taste quite as good as she expected.,05-02-2019 19:51:17,19979,0.96,0.8
76,I killed them all,04-22-2017 08:15:45,19835,0.91,0.4
77,"Wait a minute, where did the soda come from?",11-25-2018 22:04:46,19810,0.95,0.8
78,"KYYYYYYLE!! What the fuck man that's my fucking sandwich! I have to eat that, what's your fucking problem dude?!?",12-05-2017 12:38:38,19658,0.93,1.0
79,"Because the ‘Canine’ Flu's symptoms were identical to Swine Flu's, doctors couldn’t confirm a diagnosis until its long-term effects presented: the patient turning ""as sick as a dog.""",01-09-2018 15:25:26,19639,0.91,0.6
80,I'm not the one with the drinking problem,06-04-2017 21:22:32,19579,0.93,1.0
81,Did you know the Stay Puft Marshmallow Man had a public urination fetish?,02-28-2018 10:40:31,19453,0.92,1.6
82,You're so sexy when you don't shave.,06-23-2017 11:35:18,19392,0.92,1.2
83,"After weeks of ruthlessly hunting down her family members, T-1000 unit ANNIE had finally located Sarah Connor",06-14-2017 10:01:02,19376,0.93,0.4
84,What did happened with my life?! Now i feel nothing but the void inside...,08-14-2017 15:41:03,19375,0.93,0.6
85,"Robert could no longer resist temptation, he finally gave in to his fetish for golf clubs in the middle of a game. His attempt to hide it was not very successful",11-20-2017 19:54:35,19107,0.92,1.0
86,"Next time you need to beat your child into silent submission, use soft silicone so that you only leave emotional damage",05-22-2018 11:18:07,18879,0.93,1.2
87,Barbara was getting really tired of her neighbor after finding the fifth peephole this week,06-14-2018 08:33:29,18858,0.95,0.8
88,"In case of patriotic emergency, tear apart bear and hug the flag.",07-06-2018 09:45:27,18835,0.94,1.0
89,Candace knew exactly which side of the family she inherited her brittle molars from.,10-15-2017 19:06:49,18813,0.93,0.8
90,Life got a lot better once Barbara realized she could just live in denial,01-31-2018 11:17:05,18724,0.94,0.8
91,After starting his new gym regimen Tim was not sure how to handle his new-found strength.,04-10-2018 16:05:32,18641,0.95,0.8
92,When I need to get my next batch of cocaine ready quickly,10-08-2017 20:45:30,18559,0.92,1.2
93,"Fed up with canned air, Bob decided to try filling up his car's tires with Silly String",07-05-2017 21:13:57,18494,0.93,1.2
94,"Jessica had two choices: donate $1,000,000 to a charity for washing windows, or wash them herself. Since the former was impossible, she chose the ladder.",04-24-2018 16:15:16,18475,0.89,1.2
95,"Karl accidentally triggered Ana's Ice Cream Fetish. She said: ""Fuck my diet, scoop dat shit yo""",08-03-2017 14:35:46,18370,0.89,1.2
96,"Before the Wright Brothers, Ben and Jill experimented with their own methods of flight.",12-04-2016 21:59:07,18284,0.91,0.8
97,"America wasn't ready for Chef Chaser and his famous catchphrase, ""Fat bitchesssss, what is up??""",12-08-2017 14:23:05,18225,0.95,1.0
98,"When Anna accidentally opened trailer for Emoji Movie, mother was there to protect her",09-13-2017 15:34:58,18192,0.93,0.8
99,Are you tired of Meth ruining your teeth? We here at Nabisco have heard your concerns. Introducing ...OREO toothpaste!,08-02-2018 11:53:33,18184,0.92,1.2
100,Kristen's date had been perfect until Jeff realized that deep down he was actually gay.,06-21-2018 10:55:13,18147,0.93,1.2
101,"Studies show that imagining furniture during sex can lead to increased male performance, even when their partner is using toys and other stimulants",05-24-2018 13:04:14,18096,0.92,1.2
102,"""Goodnight honey."" ""Goodnight reality-based human. Do not move my hands.""",01-18-2018 09:38:01,17965,0.94,0.8
103,Wendell always dreamed of being an MMA champion,09-22-2017 17:43:10,17865,0.9,1.0
104,"Sally always over heard her father complimenting her mother's blowing, but she was no longer a believer after today",03-21-2017 20:48:42,17727,0.91,0.6
105,Wear two glasses to appreciate that your daughter has now become a focused young man,10-14-2014 08:43:50,17647,0.93,1.0
106,Michael shows the hallucinogenic effects created by compressing his patented HighAFPillow,11-29-2017 21:37:33,17634,0.92,0.8
107,This movie sucks you in,03-01-2016 09:36:25,17455,0.94,1.0
108,"When Jennifer's boyfriend found out she was cheating on him, he barges in when she was showering and comments about her whore ass",11-08-2016 00:59:42,17453,0.88,1.4
109,Fernando's short term memory issues made every slice of fruit his first.,11-07-2017 20:01:25,17442,0.91,1.0
110,Greg's acting career never took off despite his groundbreaking performance as 'Large Fat Man'.,07-02-2018 11:02:47,17324,0.95,0.8
111,"Today on ""How It's Made,"" we'll find out where parmesan cheese comes from",03-08-2018 11:08:40,17260,0.92,1.2
112,Never eat taco bell past 1am or you'll have JibJab nightmares,04-30-2018 11:08:06,17231,0.91,1.4
113,Billy wanted to draw a football. Mikey wanted his tiddies tickled. WIN-WIN!,03-05-2018 10:54:07,17209,0.93,1.4
114,I'm trying to get over my fear of pooping in public,07-01-2017 20:20:51,17009,0.93,1.2
115,"Combining her passion for hearty hand jobs and the Cleveland Steamer, Lisa had created her own new toilet-based fetish: the Cleveland Cumshot.",11-10-2017 11:51:47,16877,0.89,1.4
116,He could summon buses with his mind but never at the right time.,05-02-2017 21:41:59,16863,0.91,0.8
117,"Patient Jacob Dolan, with his bubbly laughter, tiny fingers & heartwarming smile, was deemed a danger to himself and society, and sentenced to solitary confinement until Puberty",05-31-2018 09:00:29,16783,0.93,1.0
118,"Tired of the bourgeois culture of the Olympics, Vince takes the shot put back to it's DIY roots",01-06-2018 10:54:12,16642,0.93,1.0
119,Billy's fetish for self-harm was always the prime reason of his parents putting him up for adoption.,11-24-2017 13:46:40,16593,0.93,1.0
120,"Sorry Allen, even in a car ""no"" still means ""no.""",08-15-2017 18:58:22,16541,0.92,0.6
121,If only they made pants that allowed you to somehow store commonly used items.,11-13-2016 11:57:11,16256,0.91,1.2
122,You gamble on a fart - You're cleaning that tard!,06-12-2018 14:37:22,16171,0.9,1.2
123,The spirits in Greg's house were angered by his horrific dancing.,05-27-2017 17:06:54,16143,0.93,1.2
124,Big Aunt Patti pathetically mocked her nephew’s braces as she inhaled the pie in front of her disgusted in-laws,10-09-2017 20:47:30,16108,0.91,1.2
125,"Desperate to save his marriage, Arthur had one last idea to spice things up in the bedroom so that he and Martha could have ""fun"" like she was always talking about.",12-02-2017 22:36:19,15994,0.9,1.2
126,"Too lazy to learn sign language, Josiah overacted his concerns about his deaf father’s drinking addiction",01-04-2017 14:49:59,15990,0.9,1.2
127,Recent toilet paper shortages has really taken its toll,03-19-2020 18:45:37,15980,0.95,1.0
128,It's always best to scare your picnic into submission.,08-08-2018 17:36:18,15940,0.94,1.2
129,"Always a hit with sightseers, the friendly North American Gary is known for its superior sight and hearing.",12-02-2018 00:46:51,15895,0.96,0.8
130,"To make her troubles go away, Kelly knew a normal sized bribe wouldn't do.",03-09-2017 20:08:13,15882,0.92,0.8
131,"Tragically, he forgot the floor was lava.",03-18-2015 13:35:00,15865,0.93,0.6
132,Joanna’s addiction to violent video games helped her IRL melee skills,08-21-2018 21:20:45,15862,0.92,1.0
133,Dorothy's family never appreciated just how much money they saved by reusing toilet paper,11-15-2017 22:42:49,15843,0.95,1.2
134,That feeling when you sniff glue for the first time,01-08-2018 12:57:06,15834,0.93,0.6
135,"Knock, knock! We heard you was cooking with oil",03-26-2018 12:35:18,15732,0.9,1.2
136,Let there be no doubt: the punishment for using a wrench on an Allen bolt is excruciating and immediate.,09-15-2017 10:24:43,15617,0.93,0.6
137,"A huge Bear Grylls fan, Shannon decided to make a surprise dinner for her family",12-16-2017 08:55:25,15586,0.95,1.2
138,"She has a warrant in Chicago for ""illegal use of a spatula.""",12-21-2018 15:15:57,15494,0.95,1.4
139,Carrie felt betrayed after realising the screwdriver was actually a hammer all along.,05-21-2018 03:35:23,15342,0.93,0.6
140,Sarah soon regretted giving herself a quick finger-banging before getting ready for a night on the town,03-26-2016 20:48:51,15324,0.9,1.0
141,Barry experienced first-hand the tricks whites used to introduce cocaine into black communities.,08-06-2017 18:03:10,15216,0.9,0.8
142,"The US Department of Defense unveils their new ""Nuclear Button"" measurer at the POTUS's request",01-03-2018 13:14:33,15161,0.87,0.8
143,"Actress Carla Gugino was fed up balancing a thriving movie career and feeding her worthless, ungrateful hanger-on of a family",02-12-2018 19:43:59,15153,0.91,0.8
144,Jimmy's newly founded Mafia family was tight on funds so they had to settle on knock-off weapons which didn't quite pack the same punch.,07-05-2018 09:43:15,15073,0.95,0.8
145,John just couldn't figure out who kept honking at him. He checked his mirror and there's NO ONE IN SIGHT!,06-26-2018 10:33:59,15004,0.94,0.8
146,Sharon regretted not shaving for such a long time,12-24-2017 08:20:13,14967,0.91,1.4
147,"With gender equality achieved in the science and technology sectors, feminist educators set their sights on the lawnmower gap.",09-10-2016 14:16:28,14901,0.87,0.8
148,You hid the body. Now comes the hard part.,09-02-2018 17:40:37,14881,0.94,0.4
149,"Sick of Mary breaking his stuff, Phil used his psychic powers to set her on fire",02-09-2017 08:44:04,14845,0.96,1.0
150,"Using only boiled water, hotdogs, and a $0.25 box of macaroni, Tony recreates the sound of walking in on your parents having sex",12-13-2017 11:37:18,14815,0.94,1.4
151,"Are you tired of trying to keep it together? Well now you can have that ""I'm one bad day away from losing it"" look in just minutes!",07-27-2018 13:31:49,14771,0.94,1.0
152,Turns out Edna Mode was full of shit.,11-26-2017 10:37:05,14763,0.88,0.8
153,"Karen's husband noticed her showers were taking longer and longer. He didn't mind because for some reason it seemed to make her really, really happy.",06-27-2018 11:02:03,14736,0.95,1.2
154,Jeff's high five after his wife announces she slipped him some acid,12-18-2016 16:12:47,14716,0.92,1.4
155,"After getting fired from work, Amy found solace in knowing her prized egg was still safe in her car.",11-08-2018 23:40:51,14665,0.95,1.2
156,Barry felt ecstatic when he finally found an easy way to hide where he buried his wife,01-22-2018 20:26:44,14660,0.94,0.6
157,"If we complained when Dad farted, he’s beat us. I hated my family and those fucking protein shakes.",03-16-2018 12:09:36,14536,0.9,1.2
158,"But I can't unplug Mr. Coffee Pot or Mr. Toaster, NO NO NO NO NO!",03-03-2018 18:20:02,14522,0.94,1.2
159,"After taking out all of the noisy bitches on the plane, Candice tried a little too hard to look innocent.",02-17-2017 16:56:40,14467,0.92,1.0
160,Jim realizes that he walked into the wrong house,03-29-2017 19:15:14,14375,0.92,0.8
161,"Susie's babysitter could only watch in horror as she heard little Susie let out an unforgettable, ""Ah Fuck!""",06-07-2018 10:20:33,14367,0.93,0.8
162,"Yeah, I did that real good!",10-31-2014 10:26:17,14304,0.95,0.8
163,"Despite their best efforts, the Donnie Darko sequel was starting to look rather disappointing",10-18-2017 11:43:25,14247,0.93,0.4
164,"Now with our new patented technology, you'll never have to worry about parking ever again! Just make your own space!",06-22-2018 10:55:32,14227,0.96,1.0
165,Janet was looking at her son's internet history again.,05-10-2017 09:38:37,14198,0.92,0.4
166,World's worst old school Wonder Woman Cosplay.,11-30-2017 19:49:48,14178,0.9,1.0
167,"If that was her idea of foreplay, Todd was out.",02-14-2017 12:04:30,14183,0.92,0.8
168,"Linda was fed up with the guys she met on Tinder, so she found herself a sexy alternative!",11-12-2017 12:43:03,13943,0.93,1.2
169,Living the dream in Soda Reality,03-10-2018 16:33:39,13916,0.94,1.0
170,"Angela wanted to watch a movie and David wanted to look at a mountain, so they compromised.",11-19-2019 21:30:24,13918,0.99,1.0
171,"Maybe we can pray these bills away, Mary!",03-27-2018 14:32:03,13890,0.93,0.8
172,Karen was ready to star in the world's first humiliation porn for managers,12-27-2018 00:12:49,13880,0.94,1.2
173,Everyone laughed when Cheryl said she was going to invent the Ass Poacher. No one at the psychiatric facility is laughing now.,07-04-2018 09:19:14,13853,0.94,1.0
174,Kelly figured out that it's not cheating on your diet if you just taste the bacon.,07-16-2017 23:15:59,13835,0.84,1.4
175,"Kevin's amazing technology, which would deep-suction your down doots and magically heat forge them into up doots, was unfortunately banned by the admins for being a karma farming no-no.",12-22-2018 21:47:03,13823,0.94,1.0
176,Bob loves to unwittingly slap himself with these greasy dirty tongs,02-24-2018 12:45:36,13826,0.95,1.4
177,"After her father had died in a tragic maki accident, Julia swore to disassemble all the sushi in the world, one at a time",08-19-2018 15:25:05,13770,0.94,1.4
178,Robert put his glasses on and could finally see the diarrhea monster in all its glory,05-05-2017 19:57:02,13670,0.92,1.0
179,MADE IN U.S.A.,05-07-2017 15:48:53,13667,0.95,0.8
180,Linette accidentally leaked the location of the damned soda.,02-08-2017 19:41:52,13654,0.9,1.0
181,David's failure to grasp the concept of bucket ruined his gardener career,07-10-2018 09:35:28,13630,0.95,1.0
182,How many blondes does it take to fix a pair of cheap plastic frames with a welding torch?,07-01-2018 15:38:59,13599,0.92,1.2
183,"Sick and tired of Gerald's gambling addiction, Sheryl knew she needed to make her threats clear.",03-24-2017 16:38:46,13593,0.93,0.6
184,"Martha's ghost, although less intimidating due to her appearance at death, sought revenge against any who dared enter her home",06-13-2018 10:19:43,13567,0.95,0.6
185,Oh no! Now we have paint on the wall that we were going to paint!,09-08-2018 15:52:35,13505,0.95,1.0
186,"Trapped in a looping gif, Anna had no choice but to eat plate after plate of spaghetti.",07-06-2019 18:53:33,13444,0.96,1.0
187,"Jim, ya done goofed! Bob (from HR) only enjoys two things: fresh morning coffee and a firm handshake",03-13-2018 12:23:31,13448,0.95,1.4
188,Linda was tired of Tyler's murderous sprees,06-18-2017 22:35:31,13415,0.93,0.8
189,Zack couldn't fucking believe that bartender didn't even look at him. Time to relax and watch some table tennis.,09-06-2017 21:08:12,13412,0.86,1.0
190,Ugh! I can taste all of the girls Katy Perry kissed on this cherry chapstick!,03-12-2018 14:30:53,13376,0.91,1.2
191,Frank had disabled the safety and his final prank was set. Susan never walked the same after that fateful day.,08-03-2018 09:56:40,13343,0.94,0.6
192,"Hey, loser kids! Give your boring factory ride a shitty car mod & start giving zero fucks now!",03-23-2018 10:25:53,13302,0.94,1.0
193,mod abuse,04-27-2016 18:31:09,13292,0.88,0.8
194,"Minutes before her guests arrived for the dinner party Karen discovered she forgot to buy parmesan cheese, so she improvised...",05-09-2019 10:23:29,13288,0.94,1.2
195,"Disappointed by the lack of snacks in coach, Richard decided to serve his own cheese.",01-23-2019 19:12:19,13275,0.94,1.2
196,Kathy knew that the best part about day drinking was that nobody had to know.,02-11-2017 20:35:27,13239,0.92,1.0
197,"In her desperation Jennifer tried everything, including the rituals described in that old book about the occult, but nothing could bring her husband’s hearing back",11-17-2017 04:59:30,13217,0.92,0.6
198,Doris regretted starting her budget bomb disposal business.,09-06-2016 11:06:00,13196,0.93,1.0
199,The biggest weenie at the barbecue,06-03-2017 21:36:40,13173,0.93,1.2
200,Al started to panic when his water was suddenly shut off due to non-payment while live streaming his DIY gardening show,06-22-2017 13:16:03,13155,0.91,1.2
201,"Timmy's mom gave him two choices: either he could eat, or he could prove he was ready to go to the museum",12-15-2017 12:11:22,13070,0.91,1.4
202,"Happy with her new makeup remover pads, Karen was excited to quit being called ""Pizza Face"" once and for all",06-03-2018 00:05:29,13053,0.94,1.2
203,Jim's quirky interest in stomach growling eventually morphed into a full-blown fetish,08-05-2017 11:02:23,13031,0.93,1.4
