idx,title,created_utc,score,upvote_ratio,humor_scores
204,"Debbie knew making Yahoo her company's default home page would cause turmoil, but she couldn't imagine how quickly things unraveled",06-09-2017 10:58:18,13013,0.94,0.6
205,"Sugar Pie, you best shut that sassy mouth before I beat your bitch ass to death in front of your brainless friends",04-19-2018 13:26:51,12996,0.93,1.2
206,"After so many rejections, Ed and Mabel would finally have their threesome.",09-18-2016 20:01:21,12975,0.94,1.4
207,"After his cat died, Frank decided no more animals and adopted a pet tornado.",03-27-2019 22:27:59,12906,0.96,1.2
208,"Shortly after arriving home, Steve realised that listening to his wife was a mistake. They should've adopted two dogs",12-28-2017 16:01:13,12907,0.92,1.2
209,"""This bag isn't full of ice, it's full of sadness!""",10-26-2017 11:44:12,12886,0.94,0.6
210,George was determined to make his own toupee,05-25-2018 16:12:36,12888,0.94,1.6
211,Julie practices her iPad worship from the security of her refinished basement.,09-02-2017 14:27:32,12803,0.93,1.2
212,"Once Andy was good and dismembered, Monique had to permanently dispose of the murder weapons",10-01-2017 11:03:53,12694,0.93,0.6
213,Laura doesn’t quite know how to put an end to all the pain.,12-22-2017 15:53:54,12663,0.93,0.4
214,On their first date they decided to eat mushrooms together. There was not a second date...,05-24-2016 08:47:39,12655,0.9,1.2
215,"When you can't afford a Dishwasher, but can afford a Dishwasher....",05-07-2017 02:13:49,12643,0.95,0.8
216,"Introducing the world's shittiest shredder, The Donco Hardly Shreds 3000.",11-02-2017 19:10:08,12616,0.93,1.0
217,Dr. Johnson's medical license was revoked shortly after presenting his cost-saving circumcision machine to the medical board.,11-12-2018 01:30:20,12584,0.95,0.8
218,"Mom, are you drinking again?",05-27-2016 07:46:17,12588,0.93,1.2
219,"Susan decided to make a risotto, salmon and plate sandwich",05-11-2018 10:39:23,12570,0.95,1.0
220,I upvoted a shitpost and now I can't get my karma back :(,05-21-2018 14:41:01,12508,0.95,1.0
221,There is no computer that can hide from Fuck-it-up Marsha,06-17-2018 19:31:31,12485,0.94,0.8
222,Living in Soda Reality is a never-ending torment,03-04-2018 13:19:04,12379,0.94,0.8
223,"Tired of running in the dark? Well now you don't have to thanks to Patellites™, the world's first surgically implanted illuminated kneecaps.",07-15-2019 17:34:13,12356,0.97,1.0
224,Tony realized the spark was gone when Gina started looking at the razor the way she used to look at him,07-18-2016 11:10:11,12325,0.9,0.6
225,Nate was furious and started driving recklessly when his phone transformed into a brick.,04-05-2016 12:50:18,12295,0.89,0.6
226,Ted's family grew concerned after his fishing license was suspended.,10-08-2016 20:27:06,12201,0.92,1.0
227,"Lady, don’t even START yappin bout your “bad day”. Gimmie a dollar and step the fuck BACK!",03-18-2018 23:55:37,12164,0.91,1.2
228,"After finding out there's a hidden bomb inside the car, Toby cannot find the right wire to cut for deactivation",04-13-2017 15:16:28,12122,0.9,0.8
229,"Jim remembered a little too late that one should eat pasta, not spicy chalupas, before the bike race.",01-28-2018 02:30:05,12129,0.93,1.2
230,"""We've all gambled on a fart and lost.""",08-15-2016 16:32:32,12097,0.88,0.8
231,"In retrospect, maybe Batman was too good to invite to the water balloon fight.",06-30-2017 20:39:27,12066,0.92,1.2
232,Someone's not going to be well rested when he demands a Book of Spells refund in the morning.,08-01-2017 20:46:52,12056,0.93,1.2
233,To the fap cave!,06-11-2018 18:04:34,12049,0.98,0.8
234,Hey kids! Wanna practice playing with your weiner when you get older? Now you can!,04-29-2017 03:32:49,12036,0.92,1.2
235,"As Phil watched the first atomic bombs detonate, signaling the start of the war that would end the world, he could laugh at the irony of being stuck in traffic.",07-05-2014 21:54:09,12017,0.93,0.8
236,Bob's barber scam was his most ingenious one yet.,11-04-2015 21:17:04,12010,0.93,0.8
237,"Like his alcoholic father, impressionable Brandon chose an “ugly, money-hungry pig” to be his closest companion",10-03-2018 11:29:35,11986,0.95,1.0
238,Markus has a plan to erase his debt.,08-31-2017 18:43:22,11914,0.89,0.8
239,At first teacher did not believe when Hannah said school restroom was haunted.,02-17-2019 18:01:41,11891,0.96,0.6
240,Wetwork Mafioso Billy Mays Demonstrates the Art of Body Disposal,06-29-2017 17:27:56,11888,0.93,1.0
241,"Determined to be more active, Janet decided to eat some pizza.",02-20-2017 21:18:26,11857,0.92,0.8
242,"After a day of scrubbing the house down, it was time for momma to bust out the Mega Hitachi and do some scrubbing of her own",01-29-2018 12:17:20,11763,0.94,1.2
243,"Killer fireflies have been seen popping up all over America, and their only weakness is karate",05-23-2018 14:22:30,11759,0.95,1.0
244,I'm more of a social drinker.,06-20-2017 21:06:27,11736,0.9,1.0
245,Richard and his crew attempted to invent the Ex-Wife Sandwich™ because Nicole neglected to make one for each of them,07-13-2017 20:50:46,11725,0.93,1.4
246,Who gave the vegan grill duty?,07-19-2018 21:10:46,11701,0.89,1.0
247,The Vegan Steak was a Big Mistake,01-17-2018 10:33:52,11689,0.88,1.0
248,Michael's drinking problem hindered his love life until he discovered some women like grown men in bibs.,06-12-2019 10:29:49,11680,0.98,1.4
249,"With an impending foreclosure on the house, Mom started training the kids to be homeless",04-03-2018 12:44:58,11655,0.96,1.0
250,Jim suddenly felt very inspired after watching the first episode of ‘Black Mirror’,03-15-2018 13:13:09,11626,0.96,0.8
251,"Fine, I guess I'll just have to fight off the zombies with this iron.",04-28-2018 21:49:02,11618,0.9,0.8
252,The Stevie Wonder School of Culinary Arts Presents:,03-18-2019 11:57:44,11621,0.95,1.2
253,"Here’s the bill, ma’am... fer pleasin' yo big mama",07-17-2018 09:50:28,11609,0.92,1.0
254,"After seeing Tom’s search history, Kim knew it was time to spice things up in the bedroom.",07-22-2018 12:45:05,11601,0.89,1.0
255,When Dad's new girlfriend asks you to walk her dog.,12-10-2016 17:09:12,11582,0.92,1.6
256,"Finally, Abigail had a fast and easy way to hide all evidence of her cocaine addiction before her husband got home",06-03-2020 17:50:27,11572,0.97,1.4
257,"Awww sweetie, that's so colourful and creative... Now watch me obliterate your hard work! >:D",04-19-2015 21:43:57,11562,0.94,0.8
258,"After watching Shrek, Eleanor couldn't help but think she was committing an atrocity. Maybe going vegan wasn't enough.",12-06-2017 22:09:48,11562,0.9,1.2
259,People can't smell in their sleep right?,11-04-2017 22:27:22,11548,0.94,1.0
260,Those pills worked really good LOL,03-04-2020 19:51:26,11525,0.97,0.8
261,*snap* Yep! This one is going into my cringe compilation!,05-26-2019 22:38:15,11516,0.96,1.0
262,Ten days into No Nut November and Dave still couldn't resist his strong cravings.,11-10-2018 19:43:24,11489,0.93,1.0
263,"Linda was convinced: if the fork can't do any damage, nothing can.",06-25-2017 23:37:18,11477,0.93,0.8
264,Anna and Jerry were having loads of fun with their dad's new toys,10-27-2016 07:39:46,11471,0.93,1.0
265,"""Attention to detail is one of the most important skills for our curator position""",04-20-2017 14:51:38,11427,0.94,0.8
266,"""Alright kids, tell me more about your dad's good friend Vicki and it's all yours.""",10-12-2016 20:00:31,11428,0.9,0.6
267,*sneaks into Westboro Baptist Church while everyone's sleeping*,03-30-2015 10:56:45,11408,0.88,1.0
268,It was at that moment that Jennifer realized it was a horrible idea to build their house on top of the railroad tracks.,12-28-2016 15:54:32,11399,0.92,0.6
269,When I can't decide a random name to use in title for a /r/wheredidthesodago post,07-18-2017 19:55:22,11368,0.89,0.6
270,Laura couldn't stop herself from enjoying that last drop of Invisible Liquid™ from underneath her seat,09-03-2016 01:41:03,11363,0.93,1.0
271,Gertrude could no longer stomach the horrors of everyday life.,02-25-2017 23:31:58,11360,0.93,0.6
272,/r/wheredidthesodago is celebrating its 3rd anniversary. Happy birthday !,10-22-2015 07:28:15,11341,0.94,0.8
273,Rickey gets pissed off when his booty call is no longer interested.,04-17-2016 14:00:48,11301,0.89,1.2
274,"""I mean really - how hard is it to get five stars in GTA V, Tyler?""",08-17-2016 20:25:37,11293,0.91,1.0
275,"Aware of his addiction to excessive pillow fondling, Vanessa still promised to love David for better or worse.",07-29-2018 00:50:39,11256,0.97,1.2
276,"It wasn't until she got home, that Karen realized a sneaky prankster had stuck chewing gum to her face",04-13-2018 01:44:08,11256,0.94,1.2
277,"With just a little more practice, Miranda would finally be ready to sign that restraining order",01-23-2018 14:02:25,11238,0.95,0.8
278,"After finally making her laugh with a Bernie Mac joke, Fred memorized more stand up comedy clips for their next date.",02-10-2017 11:21:36,11226,0.92,1.2
279,She'd been thirsting all day for a good flaggin'.,05-16-2017 13:04:03,11141,0.84,0.8
280,"♫♫ I'm the king of the world, on a boat like Leo If you're on the shore, then you're sho' not me-oh ♫♫",09-19-2018 08:52:50,11148,0.96,0.8
281,"Just going to take a bite of this burger and-- Dammit, I got shot AGAIN!",04-17-2017 20:49:28,11122,0.94,0.8
282,Molly recoiled as she watched the Anti-Christ possess her once sweet baby,10-22-2017 16:29:03,11102,0.92,0.6
283,We promised grandma we'd get her skydiving lessons on her last birthday,09-04-2017 18:42:02,11079,0.92,1.2
284,Calvin was now fairly certain those weren't daddy's Flintstones vitamins.,09-01-2017 17:33:23,11070,0.88,0.8
285,There's never enough lotion after a good circlejerk.,04-27-2017 14:31:28,11066,0.92,1.0
286,Joanne the former astronaut often dreamt about the time she was barbecuing outside the Space Shuttle Endeavour and accidentally dropped her cutting board.,05-06-2019 14:46:48,11042,0.97,1.4
287,Um dad..? I thought you said grandma died..,08-05-2020 11:11:04,11047,0.98,0.6
288,Knife just kind of stumbled into fetish porn. The money was too good.,01-29-2017 20:11:11,11017,0.88,1.0
289,Watch kids get overly excited over heated ice cream scoop,02-17-2018 10:38:50,11011,0.94,1.4
290,"Leopold didn't quite agree with his wife's insistence to bring her vibrator into Church, but this is 2017. Who is he to judge?",09-11-2017 05:29:30,10961,0.96,1.4
291,"With no budget, Samuel, the local university's new bowel professor, had the worst visual aids",09-29-2018 14:23:24,10949,0.95,1.0
292,This Gallstone is gone. Our Nightmare is Finally Over.,08-20-2018 13:34:28,10904,0.95,0.6
293,"Barbara took being called a ""frigid bitch"" a little too seriously",11-03-2017 14:15:47,10892,0.95,0.8
294,"Without a proper punching bag at home, Debra had to improvise to get her boxing practice in.",12-26-2016 14:48:49,10839,0.92,1.2
295,Hutch will tell anybody the details about the fat hooker he brought home last year.,03-06-2017 12:35:07,10835,0.91,1.2
296,"No matter how many times her neighbors confront her about it, Laura does not stop throwing her stale pancakes over the fence",12-30-2018 13:48:28,10798,0.96,1.2
297,Poor Susan was the first victim of a sentient bucket that rose up to overthrow humanity,08-10-2018 13:28:11,10784,0.96,0.8
298,I was saving that for later...,03-11-2015 19:54:51,10733,0.94,0.4
299,"Ever since her husband left, Laura had to use unorthodox methods to fulfill her foot fetish.",01-02-2018 18:28:31,10703,0.93,1.4
300,Max chose to drown out his children's argument on whether they should alert him to the kitchen fire or go play outside.,07-19-2017 23:39:30,10676,0.93,1.0
301,"""Alice, I command you to let me shit in Sheila's baking pan...good girl. Very good.""",05-22-2017 22:26:05,10678,0.92,1.0
302,"Jessica didn't know what she was more pissed off at: these B.S. ""magic seeds,"" her dumbass husband who couldn't separate reality from fantasy, or herself for reading 'Jack and the Beanstalk' to him yesterday",01-30-2018 12:23:39,10671,0.94,0.8
303,Apparently now gravity is sexist too.,09-23-2016 14:33:29,10660,0.8,1.0
304,"After ""Butterfingers"" Cory's accident, it took months of psyche rehab and gallons of glue to get him back on his Harley",02-19-2018 01:08:45,10664,0.93,1.0
305,"When Timmy came home from the playground and asked what “flaccid” meant, Brenda and Will struggled to come up with SFW visual aids",04-24-2017 10:32:41,10549,0.91,0.8
306,Off to start my day as that eccentric a-hole you have to deal with,10-19-2017 17:13:08,10519,0.91,1.0
307,McDonald's New Light Fries Have a Metallic Taste,07-04-2016 17:36:16,10488,0.88,1.0
308,"For selling fake male enlargement products his whole adult life, Rick was given a special task in hell",12-10-2019 21:14:40,10471,0.97,1.4
309,Xbox 360's original designer Terry Nee was never seen nor heard from again after his first pitch meeting,10-15-2018 06:28:04,10462,0.95,0.6
310,Only when I'm drunk,03-15-2016 19:30:40,10454,0.93,1.0
311,"After a long night at the Renaissance Fair, Jeremy couldn't figure out why everything he tried to do today was so difficult.",06-18-2018 09:40:01,10445,0.97,0.8
312,"Locked outside of his house, Billy tried his best to escape the rabid dog attack by clawing at his door",04-02-2018 20:03:30,10423,0.92,0.8
313,"When Laura's evil phantom twin appeared in the mirror, they had an intense psychic duel until their heads exploded.",08-11-2019 19:19:23,10426,0.99,1.0
314,"Unfortunately the Shih Tzu was significantly larger than the goldfish, but by golly they would be together forever in pet heaven.",07-03-2020 12:15:28,10397,0.97,1.0
315,Gary's newly implemented dress code for low-cut jeans was short lived after the sexual harassment claims jumped up 500% in the first week.,06-19-2018 10:52:32,10337,0.94,1.2
316,"Unfortunately for Hugo, the concept of moving furniture had yet to be invented.",01-30-2017 16:33:17,10340,0.93,0.8
317,Stanley still had to protect his family even after his guns were seized from the government (Strobe Light Warning),06-28-2016 13:59:07,10292,0.9,0.6
318,His friends agree: Bob is a hottie when he lets his hair down.,05-12-2019 20:23:44,10263,0.95,1.8
319,"Unfortunately, Lucy forgot how to get back to Narnia later in life.",10-11-2016 19:28:04,10258,0.91,0.6
320,"For no real reason, Teddy set up his ladder at a stupid angle and proceeded to start some stupid shit.",06-07-2019 11:15:58,10251,0.97,0.8
321,So sick of feeding these goddamn birds.,08-25-2020 02:22:26,10242,0.98,0.8
322,Trying something new in the bedroom,09-28-2014 18:05:40,10228,0.89,1.2
323,Martha didn't know who to blame; herself for buying the TV or her husband for his obsession with watching recordings of his high school games.,02-06-2018 21:00:35,10219,0.93,0.8
324,Cathy hated driving the sex party van.,12-24-2015 18:54:39,10220,0.93,1.0
325,"Milo realized he couldn't stand living with Margaret any longer, so he secretly ordered a pizza and made a break for it when the delivery man arrived.",05-03-2019 20:11:24,10195,0.97,1.0
326,/r/BigDickProblems,10-06-2015 19:35:38,10154,0.9,0.4
327,When you're trying to work but can't stop thinking about the club,01-05-2016 21:54:30,10145,0.93,1.0
328,"Moron Jones isn’t sure it’s the right chair, but he also can’t sleep with the lights on.",04-16-2018 01:10:32,10139,0.95,1.2
329,Not what I expected when she said she had a drinking problem.,12-01-2017 17:54:33,10107,0.94,1.0
330,Courtney suddenly realized she was too white to Macarena,08-29-2017 14:10:20,10103,0.91,0.8
331,Life is like a box of wires: .... sometimes you just don't know what the fuck is wrong with Susan,06-05-2018 11:32:47,10067,0.94,0.6
332,Tammy and Ray’s clock knew just the right bible verse to make them horny.,02-27-2017 16:21:38,10057,0.9,1.0
333,Jerry's mother had come home unexpectedly and he only had time to pull up his pants,05-29-2018 10:06:56,10056,0.92,1.2
334,The off-screen prompts to “dance like you aren't a hostage” didn't seem to work.,03-15-2017 06:03:15,10047,0.91,1.0
335,"Not only did the bully trash can force her to give him lunch, he also coerced her to give up her pocket money.",09-20-2018 17:04:12,10018,0.95,1.2
336,Darlene was starting to have serious doubts about her interpretive-dance burlesque routine.,10-23-2017 19:38:57,10012,0.92,1.0
337,Susan thought she could talk to fish,08-10-2014 23:13:50,10003,0.88,1.2
338,The aliens have successfully infiltrated humanity's households. Phase 4 is about to begin.,08-29-2016 01:48:11,9992,0.9,0.8
339,Sharon was so focussed on finishing her taxes that she totally forgot about the Uber driver waiting for her in the driveway.,09-13-2019 17:28:41,9973,0.99,0.8
340,Grandma takes being a furry very seriously,03-28-2018 11:27:34,9963,0.91,1.4
341,"If you've ever been mugged by a toddler, just know that you are not alone.",07-06-2016 05:36:03,9928,0.91,1.0
342,Jenny the compulsive gambler bet $50 she could shave her legs without cutting herself...,04-19-2019 14:17:06,9879,0.97,1.6
343,"You've heard of ApplePay. Now, here comes TomatoPay!",07-28-2018 05:05:03,9877,0.97,1.2
344,Napkins often take a bit extra to cook. Make sure to add a few more minutes until well done.,05-08-2017 22:10:48,9870,0.93,1.0
345,"That ONE time you tried to poison your dad, and he never trusts you again.",05-28-2015 12:59:13,9825,0.94,0.8
346,Angela knew what german dish she would prepare for Donald's next visit,05-17-2018 17:17:59,9824,0.82,1.0
347,Gloria couldn't stop crying at the breaking news tragedy. She was convinced that she had sent more than enough thoughts and prayers.,02-27-2019 22:14:33,9820,0.96,0.4
348,"At that moment, George realized that exploring his sexuality is not as fun as it seems.",08-10-2017 12:57:47,9772,0.93,1.0
349,aw dang it! Money Cat got stuck in the air conditioner!,02-27-2018 12:17:10,9745,0.92,0.8
350,Another case solved by Guido and The Beef.,03-30-2017 20:07:55,9734,0.92,0.8
351,"The content warning said the TV show contained full frontal nudity, so Jim made the family watch it from the side.",09-19-2019 19:48:34,9733,0.99,1.4
352,"Please Melanie, I don't want to see another Rare Pepe...",01-25-2016 19:01:24,9697,0.92,1.2
353,Improvised is about the only part Stanley got right in his first attempt at a homemade IED.,08-27-2018 21:47:57,9700,0.94,1.0
354,Amanda's sex therapist recommended that she pick up a hobby to help her cope with her orgy obsession.,10-30-2017 20:06:50,9685,0.93,1.4
355,Helen forgot to glue the phone to her face while ironing her spray-painted shirts,02-19-2018 16:19:39,9657,0.96,1.2
356,Grandpa's wish to have his ashes scattered around the house did have some unforeseen consequences,04-08-2019 08:06:26,9641,0.97,0.8
357,Exasperated Annie thought to herself that dinner would be a whole lot easier if my asshole family did the dishes like I asked.,11-19-2017 18:37:38,9586,0.93,1.0
358,What started as difficulty putting the blocks through the correct holes as a baby turned into a lifelong disability for Karen.,10-03-2015 09:07:33,9561,0.94,0.8
359,Unknown artist. Green landscape. Latex paint on natural fiber canvas. 2016,06-14-2016 16:29:31,9563,0.9,0.6
360,"Mom wasn't a fan of the arts, but she loved sports and heartwarming smiles",02-16-2018 11:59:00,9533,0.95,1.0
361,"Despite being out of prison for months, Faith's husband still loved to make toilet wine.",09-09-2016 11:51:07,9510,0.92,1.2
362,Susan knew this sock-based exercise routine was too good to be true,06-11-2018 09:26:40,9509,0.96,1.0
363,And that's when Jimmy knew he would never become a real artist...,08-03-2016 14:12:56,9498,0.9,0.8
364,Where did the Soda go?!?!,07-18-2018 08:35:37,9462,0.95,1.0
365,"When Stephen discovered another man's wallet in his pants pocket, he called his wife looking for an explanation.",05-11-2019 15:37:19,9446,0.97,0.8
366,"Wait, this isn't a Kool Aid. And Why i do blow instead of suck, like a human person?",09-08-2017 14:57:16,9446,0.82,1.2
367,Anne was pleased to learn that swallowing wouldn't make her mouth pregnant.,12-16-2018 18:49:26,9429,0.94,1.0
368,"Steve's wife had really gotten into BDSM, and he was usually game, but this was where he would draw the line",08-31-2015 20:15:31,9413,0.92,1.4
369,Hogan could only find release when flat-assed men lost their mind at the car wash.. it was an auto neurotic ass fixation,05-16-2018 13:14:26,9391,0.94,1.0
370,Jennifer keeled over in pain after tapping her sensitive arm too hard.,06-27-2017 14:10:49,9380,0.93,0.6
371,"Klara’s husband thinks it’s funny to hide mouse turds in the rice, but the joke’s on him because vacuuming is HIS goddamn job",04-15-2017 19:53:33,9372,0.9,1.4
372,"Robin took her therapist's advice, but maybe she should have waited to break up AFTER the hike in the secluded Murder Mountains!!",03-21-2018 13:45:23,9358,0.95,1.0
373,Cosmetics Sales Drop as Doctors Warn to Not Touch Your Face during Corona Outbreak,03-15-2020 10:49:40,9331,0.98,1.2
374,"One day my dear, all of these medical conditions shall be ours",08-07-2015 10:54:29,9323,0.95,0.6
375,there is nothing better in life than jumping into the car and having breakfast ready,05-26-2016 09:11:04,9292,0.93,1.2
376,And Jerry lost to the measuring tape yet again,02-21-2016 17:11:36,9289,0.93,0.8
377,"Nick firmly believed that stupid concepts like ""Dimensions"" or ""Geometry"" are fake news",05-21-2019 06:14:30,9268,0.97,0.8
378,It only took four minutes before Jeff concluded this 'Miyagi' guy was just a con artist,03-14-2017 02:36:10,9257,0.93,0.8
379,Felix never could figure out his selfie-stick,01-03-2017 08:33:58,9211,0.94,1.2
380,Betty is outraged when Frank pisses in the sink,11-24-2016 15:28:33,9193,0.91,1.4
381,Cathy wasn't about to let a little thing like rehab keep her from vodka.,08-10-2019 14:44:27,9169,0.99,0.8
382,"It took a second before Trisha realized David was attempting a selfie with their phone from 2001. They laughed, humiliated, because a phone like that would never have a camera.",08-11-2018 10:10:38,9139,0.96,1.0
383,Frank was excited to get some screwing action,06-10-2017 22:12:34,9140,0.9,1.2
384,Kathy and Steve had enough. It was time to sell their children.,07-23-2019 13:14:30,9124,0.98,0.6
385,Carla now having seen 50 Shades Darker decided to spice it up with some tupperware,12-08-2017 01:35:24,9105,0.94,1.0
386,"Harvey Weinstein was fast, but Sharon was faster. Carol was already prepared before Louie could even ask. Now there's even an option for friends of Kevin Spacey! Whip it on before they whip it out!",11-14-2017 13:30:07,9079,0.89,1.2
387,Science,10-22-2012 09:06:56,9048,0.95,0.6
388,"After playing a tough round of quidditch, Sarah discovered that her broom had a mind of its own and wanted to be free.",02-11-2018 11:08:54,9056,0.95,1.0
389,MFW I'm cleaning but ghost pirates keep trying to raise their jolly roger in my kitchen,12-11-2015 04:20:42,9042,0.92,1.2
390,The older generation quickly discovers that ranked competitive multiplayer isn't for everyone,07-16-2020 01:20:51,8996,0.97,0.8
391,Greg didn’t regret modifying his jacuzzi with a fast-acting “Shut the Fuck Up” emitter,08-25-2017 00:57:06,8987,0.87,1.0
392,[No context] It's a trap!,12-01-2015 00:58:24,8978,0.91,0.6
393,"""I'm stumped. What do you think, Obama?""",01-11-2016 16:21:07,8966,0.92,0.8
394,Are your children naughty? Teach them a lesson by hurting their toys.,03-03-2017 10:02:33,8951,0.93,1.2
395,Vroom Vroom *tires screeching* Vroom,02-08-2019 15:42:47,8950,0.97,0.6
396,"She had always referred to what she did in the bathroom as her makeup ritual, but he finally learned it wasn't just a phrase.",01-08-2017 22:32:33,8942,0.91,1.0
397,David Carradine's last invention liberated so many septuagenarians from a life of boredom and dementia.,07-03-2017 09:28:00,8937,0.93,1.2
398,"Though her phone interview was going well, Emily's drained phone battery and electrophobia prevented her from ultimately landing the job.",03-07-2017 17:00:49,8924,0.93,0.8
399,"Having never worked in plumbing before, Debra attempted to fix her first leak",07-27-2017 16:08:11,8917,0.94,1.0
400,Brenda decided to make pasta while her parents were away,07-28-2017 11:43:20,8898,0.95,1.2
401,"If you're not going to do your homework, I'm not going to make you a quality lunch.",09-12-2017 19:45:09,8869,0.96,1.2
402,Dandy the Cat was startled when he heard his owner calling out his name wrong,04-18-2017 12:27:06,8853,0.95,0.8
403,The threat was clear. Timmy knew what the consequences would be if he snitched on his mom.,07-26-2014 05:20:50,8845,0.93,0.6
404,The day your kid figures out in-app purchases are a thing.,09-30-2016 12:39:23,8824,0.93,1.0
405,I think the sex robot is broken.,08-14-2018 22:25:00,8806,0.93,1.2
406,/r/childfree,07-09-2015 13:59:52,8800,0.9,0.8
407,"It wasn't until after she entered the wrong password for the third time that Nancy remembered she had set her computer's security level at ""Self-Destruct"".",05-10-2019 15:14:18,8759,0.98,0.6
408,"What the fuck happened to my life? I went to college, played by their rules and here I am eating another goddamn bowl of Ramen because its $.10 a package. FUCK. I'm 35! This shit isn't funny anymore.",02-01-2015 14:22:11,8753,0.91,1.0
409,"Layla and Jean, insanely late for their Broadway debuts, finally realized ultrasonic suicide was the only option left",01-01-2018 18:21:18,8738,0.92,1.0
410,The photosensitive effects of self-loathing and tourettes.,07-30-2018 07:41:28,8724,0.95,0.8
411,When bitches try slicing watermelon like a common wench,09-06-2015 09:44:29,8726,0.92,1.4
412,Carl's attempts to hide the spot where he buried Becky was clearly not working,02-07-2017 06:16:54,8719,0.94,0.4
413,LOL your moms toys are so fun !,11-15-2020 16:59:07,8721,0.98,1.2
414,"I'm NOT sorry at all, jon.",06-22-2019 18:36:52,8705,0.94,0.6
