,idx,title,created_utc,score,upvote_ratio,humor_scores,normalized_scores
812,812,How did Metallica get people to stop pirating their music?,09-20-2017 12:25:26,33258,0.83,1.2,0.48449908368967626
813,813,"Today, I shocked the hell out of the postman by opening the door completely naked.",04-29-2018 03:41:47,33237,0.88,1.2,0.47968845448992065
814,814,"It is really unfortunate that Islam, Christianity, and Judaism have been fighting each other for centuries.",01-23-2021 11:14:03,33237,0.93,0.6,0.47968845448992065
815,815,"I'm a 5G installation engineer and people are constantly accusing me with bizarre conspiracy theories, such as how 5G is giving them headaches, or killing their sperm. I think they are completely crazy.",04-20-2020 14:28:39,33233,0.93,1.0,0.47877214416615765
816,816,What's the difference between a rimshot and a rimjob?,05-16-2020 20:21:10,33224,0.87,1.0,0.4767104459376909
817,817,We were having sex the other night and to my surprise my wife started punching me in the face.,01-23-2019 13:53:21,33204,0.88,1.0,0.472128894318876
818,818,"My friend Ty came first in the Beijing marathon 5 years ago, but still has not been awarded a gold medal.",05-24-2020 16:11:38,33205,0.88,1.0,0.47235797189981676
819,819,"The kids asked what was for dinner and I told them ""Scraps"". They started crying. Spoiled brats, it's really hard to get food at the moment thanks to the panic buying.",03-21-2020 04:23:32,33198,0.92,1.0,0.47075442883323154
820,820,"I think, I'm going to lose my drivers license...",08-02-2020 21:31:41,33196,0.85,1.0,0.4702962736713501
821,821,"A priest has a heart attack, and is rushed to the hospital.",09-30-2019 05:40:33,33191,0.87,0.6,0.4691508857666463
822,822,"A Hindu, a Rabbi, and a Jehovah's Witness are lost..",10-25-2018 13:41:06,33177,0.9,0.2,0.46594379963347593
823,823,A sixth grade teacher asks her class how many were Trump fans.,11-19-2020 05:34:55,33156,0.67,1.0,0.46113317043372026
824,824,A man goes into a brothel,10-27-2017 03:52:47,33138,0.9,1.2,0.4570097739767868
825,825,A couple want to have children but the wife can't get pregnant,08-16-2018 10:15:31,33147,0.9,1.2,0.4590714722052535
826,826,What's the difference between Jesus and a picture of Jesus?,03-05-2017 11:37:56,33137,0.77,0.6,0.45678069639584606
827,827,Bill Gates woke up in the morning and found that his Mexican housekeepers were gone.,09-20-2020 19:34:13,33133,0.88,1.0,0.4558643860720831
828,828,My wife told me to take the spider out instead of killing him.,11-14-2020 08:21:12,33125,0.8,1.0,0.45403176542455714
829,829,I call my wife Bambi. She thinks it's because she's cute with big brown eyes...,11-20-2018 01:08:38,33119,0.88,1.2,0.4526572999389127
830,830,"""Forget everything you learned in college...",06-02-2017 15:14:56,33088,0.81,0.6,0.44555589492974956
831,831,"Boy aged 4: Dad, I’ve decided to get married.",12-20-2019 16:38:01,33056,0.85,1.2,0.43822541233964574
832,832,Superman is out flying and sees wonder woman naked on a rooftop with her legs wide open and moaning in delight,02-05-2021 10:32:45,33051,0.71,1.2,0.437080024434942
833,833,What's the most sensitive part of a man's body during masturbation?,02-09-2019 20:25:37,33054,0.87,1.2,0.4377672571777642
834,834,A school bus full of Catholic girls drives off a cliff and they all die.,07-26-2020 19:43:34,33046,0.82,0.6,0.4359346365302383
835,835,"A Russian, an American, and a British admiral were having a drink on an American aircraft carrier. They were talking about the bravery of their sailors",05-17-2020 04:49:49,33039,0.95,0.8,0.43433109346365306
836,836,The oldest computer can be traced back to Adam and Eve.,05-16-2019 14:21:25,33040,0.83,0.6,0.4345601710445938
837,837,"A nihilist, a socialist, and a neo-marxist walk into a bar and order drinks.",02-27-2019 19:48:36,33034,0.71,1.2,0.4331857055589493
838,838,A Nazi walks into a bar,02-02-2021 19:03:58,33021,0.91,1.0,0.4302076970067196
839,839,An Australian goes to new Zealand,08-30-2018 05:14:54,33023,0.92,0.8,0.43066585216860115
840,840,Why did Elon Musk choose SpaceX to land on mars?,11-02-2017 05:41:24,33003,0.82,1.0,0.42608430054978624
841,841,"My first time buying condoms, at age 16, I went to the pharmacy. The hot cashier at the counter could see that I was new at it and gave me the pack asking if I knew how to use one. I said, ""No, it's my first time.""",04-04-2018 05:49:30,33002,0.77,1.2,0.4258552229688455
842,842,My wife stormed into the pub last night as me and the boys were downing shots of Tequila.,10-20-2019 09:47:46,33001,0.92,1.2,0.4256261453879047
843,843,How many Republicans does it take to change a lightbulb?,01-17-2019 19:46:18,32998,0.69,1.2,0.4249389126450825
844,844,"I hate those people who knock on your door and tell you that you need to be ""saved"" or else you'll ""burn""",05-25-2019 17:46:00,32992,0.9,0.8,0.42356444715943803
845,845,My friend gets really upset when I call him a flat-Earther,09-04-2019 00:21:24,32988,0.96,1.0,0.42264813683567504
846,846,"Guy : Doctor, my Girlfriend is pregnant but we always use protection and the rubber never broke. How is it possible?",04-12-2018 06:22:54,32973,0.79,1.0,0.4192119731215639
847,847,"If your phone auto corrects ""fuck"" to ""duck,"" it's okay to keep it",09-16-2018 07:36:50,32967,0.83,1.0,0.41783750763591937
848,848,What's a pirate's least favorite letter?,08-02-2016 18:39:48,32968,0.77,0.6,0.41806658521686013
849,849,My (blonde) sister hates blonde jokes. I (redhead) told her I have a redhead joke for her. She was eager to hear it!,04-23-2018 14:38:17,32970,0.9,1.4,0.41852474037874166
850,850,If i had $1 for every girl that didn't find me attractive..,03-08-2017 15:46:14,32966,0.77,1.2,0.41760843005497866
851,851,"“Father, do you have anything to declare?”",08-30-2018 18:24:39,32952,0.9,0.6,0.4144013439218082
852,852,It's a shame nothing is built in the USA anymore....,10-10-2020 17:54:47,32944,0.92,0.6,0.41256872327428223
853,853,What did the Reddit user say after setting off a bomb in a bank?,05-13-2021 09:21:32,32922,0.82,0.8,0.40752901649358586
854,854,"I was passing by my son's bedroom and was astonished to see the bed was nicely made and everything was picked up. Then, I saw an envelope, propped up prominently on the pillow, addressed to, 'Dad'. With the worst premonition, I opened the envelope and read the letter, with trembling hands...",12-07-2018 05:03:13,32930,0.78,0.6,0.40936163714111184
855,855,Ever wonder how a Jehovah’s Witness spreads their word during Covid?,07-03-2020 10:13:23,32922,0.93,0.6,0.40752901649358586
856,856,Apparently my family is racist,10-28-2020 13:46:45,32909,0.89,0.8,0.4045510079413562
857,857,Statistics show that the average person has sex 89 times a year,12-31-2017 08:18:52,32909,0.79,1.4,0.4045510079413562
858,858,My wife asked me how she compared to past girlfriends...,02-14-2018 12:22:12,32900,0.81,1.0,0.4024893097128895
859,859,I like my women like I like my coffee,07-24-2017 18:12:04,32889,0.88,1.2,0.3999694563225413
860,860,The show COPS has been dropped from broadcast,06-11-2020 06:24:21,32870,0.89,0.6,0.39561698228466713
861,861,"This morning, my wife was in the kitchen preparing to boil eggs for breakfast. As I walked in, she turned to me and said, ""You've got to make love to me this very moment!"" My eyes lit up and I thought, ""This is my lucky day!""",01-09-2019 05:02:38,32872,0.91,1.2,0.3960751374465486
862,862,"Two young boys walked into a pharmacy, picked out a box of tampons, and proceeded to the checkout counter",03-15-2020 06:11:54,32855,0.93,1.2,0.3921808185705559
863,863,My wife just completed a 40 week body building program this morning,06-19-2020 08:13:00,32846,0.93,1.2,0.39011912034208923
864,864,I trapped a couple of vegans in my basement.,09-04-2018 18:45:14,32844,0.84,1.4,0.3896609651802077
865,865,9 months later!!!,03-10-2020 13:29:06,32836,0.92,0.6,0.3878283445326818
866,866,A plane is spotted trying to land at Area 51,11-12-2017 07:51:23,32820,0.88,0.4,0.3841631032376298
867,867,The swordfish has no natural predators to fear from...,11-22-2020 12:08:44,32798,0.9,0.8,0.37912339645693344
868,868,"I’m okay with smoking, alcohol, and marijuana.",09-27-2018 05:46:51,32791,0.87,1.4,0.3775198533903482
869,869,So Barack Obama and Donald Trump somehow ended up at the same barber shop...,06-20-2017 22:29:57,32753,0.68,1.4,0.36881490531459993
870,870,Yo mama so ugly...,11-01-2017 07:18:32,32750,0.86,0.8,0.36812767257177764
871,871,"Two foreign immigrants have just arrived in the United States by boat and one says to the other, ""I hear that the people of this country actually eat dogs.""",05-09-2018 08:40:53,32737,0.87,1.2,0.36514966401954796
872,872,Did you hear about the drummer who gave all his daughters the same name?,01-16-2018 07:10:03,32735,0.86,1.0,0.3646915088576665
873,873,"In 50 years: ""You know, kids, back in my day, we had to wear masks everywhere we went at one point.""",12-21-2020 18:30:33,32733,0.92,1.0,0.364233353695785
874,874,My 8 year old son's joke: What do you call an ox with big butt?,11-05-2020 12:35:20,32709,0.91,1.4,0.3587354917532071
875,875,My wife said she wanted just one child of each gender,04-19-2018 19:14:33,32706,0.72,1.0,0.3580482590103849
876,876,My last relationship ended because I didn’t open the car door for her.,01-26-2019 09:05:01,32688,0.88,0.8,0.35392486255345146
877,877,"It must be hard for people learning to spell in English. For example, there is one silent K in ""knight"", four silent K's in ""knickknack""",04-07-2021 08:53:05,32671,0.7,0.6,0.3500305436774588
878,878,Maybe if we all emailed the Constitution to each other…,03-28-2017 05:24:52,32671,0.89,0.8,0.3500305436774588
879,879,Tom's scrotum,11-25-2018 21:18:33,32671,0.88,1.2,0.3500305436774588
880,880,I threw my girlfriend a surprise bukakke party.,06-08-2018 08:02:52,32666,0.88,1.2,0.3488851557727551
881,881,4 types of orgasm...,11-27-2020 10:36:05,32631,0.89,0.8,0.340867440439829
882,882,My husband and son getting competitive while playing games.,08-18-2020 02:16:37,32634,0.8,1.2,0.3415546731826512
883,883,"Every morning at breakfast for the past 6 months, I announce loudly to my family that I’m going for a jog, and then I don’t.",12-12-2018 08:13:36,32626,0.93,1.2,0.3397220525351253
884,884,"In Jamaica, a slice of pie costs $3.50. In the Bahamas, a slice of pie costs $5.50.",10-11-2019 15:31:18,32621,0.83,1.0,0.3385766646304215
885,885,A night out with 1$ [NSFW ?],12-02-2019 04:48:56,32622,0.88,1.4,0.3388057422113623
886,886,"In a crowded city at a bus stop, a beautiful young woman was waiting for the bus. She was decked out in a tight leather mini skirt, with matching tight leather boots and jacket...",04-06-2018 06:53:26,32594,0.87,0.8,0.3323915699450214
887,887,A policeman was interrogating 3 guys who were training to become detectives.,01-05-2019 02:05:52,32592,0.91,0.6,0.3319334147831399
888,888,The UK Prime Minister just announced her resignation.,05-24-2019 05:28:38,32591,0.89,0.6,0.33170433720219916
889,889,"My ex just sneezed and I accidentally said ""bless you""",03-24-2020 16:38:02,32585,0.9,0.8,0.3303298717165547
890,890,"I thought my son was spending too much time playing computer games, so I stopped him and said, ""Son, when Abe Lincoln was your age, he was studying books by the light of the fireplace.""",06-12-2018 07:03:05,32571,0.88,0.8,0.32712278558338426
891,891,What do you call a flower getting a sex change?,05-04-2020 01:33:57,32574,0.89,1.4,0.3278100183262065
892,892,A young man named Joe bought a horse from a farmer for £250.,02-10-2019 09:15:55,32571,0.92,0.8,0.32712278558338426
893,893,"A guy goes to Las Vegas to gamble and he loses all his money. He doesn't even have enough for a cab, but he flagged one down anyway. He explained to the driver that he would pay him back next time and gave him his phone number, but the driver told him, ""Get the fuck out of my cab.""",06-08-2019 03:59:25,32562,0.87,1.2,0.32506108735491757
894,894,"An engineer was crossing a road one day, when a frog called out to him and said, ""If you kiss me, I'll turn into a beautiful princess"".",06-02-2019 08:16:24,32548,0.93,1.0,0.3218540012217471
895,895,"‌‌I wa‌‌s crossin‌‌g th‌‌e stree‌‌t whe‌‌n ‌‌I suddenl‌‌y notice‌‌d m‌‌y e‌‌x gettin‌‌g ru‌‌n ove‌‌r b‌‌y ‌‌a bus‌‌. ‌‌I though‌‌t t‌‌o myself‌‌, ""Wow‌‌! Tha‌‌t coul‌‌d hav‌‌e bee‌‌n me!""",05-28-2020 05:59:51,32526,0.91,0.6,0.31681429444105075
896,896,"2 tampons are walking past each other, which one says ""hi"", first.",12-04-2018 06:11:43,32509,0.82,1.2,0.3129199755650581
897,897,My girlfriend kept telling me to treat her like a princess.,01-26-2017 20:46:40,32500,0.8,1.0,0.3108582773365913
898,898,I used to shave my testicles with a razor blade.,12-07-2019 10:37:56,32489,0.92,1.2,0.30833842394624317
899,899,"A distinguished young woman on a flight from Ireland asked the Priest beside her, 'Father, may I ask a favour?'",02-25-2019 17:07:36,32473,0.88,0.8,0.3046731826511912
900,900,"Twelve priests were about to be ordained. The final test was for them to line up in a straight row, totally nude in a garden, while a sexy and beautiful big breasted nude model danced before them.",10-11-2019 04:40:58,32470,0.89,1.2,0.30398594990836897
901,901,Why did Karen press Ctrl+Alt+Delete?,12-25-2019 07:45:10,32468,0.9,0.8,0.3035277947464875
902,902,I got my covid test results and I'm so confused.. it was just the number 83...,12-22-2020 15:32:50,32454,0.94,0.6,0.30032070861331706
903,903,I got thrown out of math class today.,02-16-2018 07:31:24,32457,0.82,0.8,0.3010079413561393
904,904,Kung Fu student asks his teacher,04-21-2019 07:18:38,32425,0.91,1.2,0.29367745876603546
905,905,"Man: Doctor, all five of my boys want to be valets when they grow up!",06-06-2018 12:58:19,32364,0.86,1.4,0.27970372632865
906,906,My German girlfriend likes to rate our sex between 1-10.,06-10-2018 16:52:57,32331,0.71,1.2,0.2721441661576054
907,907,My girlfriend invited me to her house to watch Netflix.,05-01-2020 09:28:35,32321,0.7,1.2,0.26985339034819794
908,908,"My Crush just sneezed and I accidentally said ""bless you""",03-25-2021 09:45:58,32316,0.89,1.0,0.26870800244349424
909,909,Nobody ever asks how Coca-Cola is doing...,05-22-2018 09:24:21,32311,0.89,1.0,0.2675626145387905
910,910,"Teacher: Johnny, give me a sentence with an ""i"" in it.",12-02-2017 11:26:36,32312,0.82,0.8,0.26779169211973125
911,911,"No one is allowed to congregate for funerals; instead, people drive by the cemetery and honk their horns in respect. One man drives by blasting “Another One Bites The Dust”",04-04-2020 07:28:26,32311,0.88,1.0,0.2675626145387905
912,912,There was a woman who had 100 kids..,06-10-2020 13:05:05,32314,0.76,0.8,0.2682498472816127
913,913,"George Clooney, Leonardo Dicaprio and Matthew Mcconaughey got together to make a movie...",01-28-2018 21:07:20,32304,0.87,0.8,0.26595907147220527
914,914,"My friend keeps saying ""cheer up man it could be worse, you could be stuck underground in a hole full of water.""",12-02-2019 18:12:40,32306,0.9,0.8,0.2664172266340868
915,915,Sometimes I wonder how vegans survive off of what little they eat,09-24-2017 21:21:30,32306,0.75,1.2,0.2664172266340868
916,916,"I walked down a street where the houses were numbered 64K, 128K, 256K, 512K and 1MB",07-19-2017 09:11:37,32291,0.84,0.6,0.2629810629199756
917,917,"Three men, aged 40, 60 and 80, discuss their sex lives",08-04-2020 05:38:10,32267,0.89,1.2,0.2574832009773977
918,918,"Several centuries ago, the Pope decreed that all the Jews had to convert to Catholicism or leave Italy. There was a huge outcry from the Jewish community, so the Pope offered a deal. He'd have a religious debate with the leader of the Jewish community...",07-31-2019 05:57:37,32256,0.79,0.6,0.25496334758704947
919,919,I proposed my russian girlfriend and she said yes,01-19-2020 07:42:21,32240,0.85,1.0,0.25129810629199756
920,920,Smoking will kill you. Bacon will kill you.,08-26-2020 19:05:08,32235,0.92,1.4,0.25015271838729386
921,921,"Two bored casino dealers are waiting at the craps table. A very attractive blonde woman from South Alabama arrives and bets $20,000 on a single roll of dice. She says, ""I hope you don’t mind, but I feel much luckier when I play topless.""",11-15-2020 05:05:28,32222,0.93,1.4,0.24717470983506415
922,922,If having sex for money makes you a whore,09-05-2020 20:36:48,32205,0.73,1.2,0.2432803909590715
923,923,"A fellow stuck in a coronavirus outbreak, prayed to God for help.",06-29-2020 01:17:35,32167,0.83,0.8,0.23457544288332316
924,924,"Daughter: ""Hey dad, how do you feel about abortion?""",05-08-2018 19:08:15,32148,0.83,1.0,0.23022296884544902
925,925,"What has 27 actors, three settings, two writers, and one plot?",12-16-2020 08:10:54,32144,0.95,0.6,0.22930665852168602
926,926,"A man’s wife asks him to go to the store to buy some cigarettes, so he walks down to the store only to find it closed.",03-04-2020 08:10:13,32109,0.91,1.2,0.22128894318875994
927,927,A wife got so mad at her husband she packed his bags and told him to get out.,12-24-2018 09:22:15,32101,0.9,1.0,0.21945632254123398
928,928,Why was Yoda afraid of 7?,10-20-2018 14:44:04,32105,0.81,0.8,0.22037263286499695
929,929,My wife’s sister visited us yesterday in her brand new Porsche.,11-06-2019 04:26:03,32077,0.92,0.8,0.2139584605986561
930,930,"A doctor goes out and buys the best car on the market, a brand new Ferrari GTO. It is also the most expensive car in the world, and it costs him $500,000. He takes it out for a spin and stops at a red light.",04-30-2019 22:56:41,32043,0.9,1.0,0.20616982284667076
931,931,How did Kim Kardashian tell her kid about her upcoming divorce with Kanye?,01-12-2021 09:35:40,32032,0.89,1.2,0.20364996945632255
932,932,A Jewish man sends his son to Israel to live there for a while . . .,06-24-2016 11:02:12,32020,0.87,0.6,0.2009010384850336
933,933,"A girl asks her boyfriend to come over Friday night and have dinner with her parents. Since this is such a big event, the girl announces to her boyfriend that after dinner, she would like to go out and make love for the first time.",02-13-2019 09:02:51,32015,0.77,1.4,0.19975565058032987
934,934,My girlfriend tried to make me have sex on the hood of her Honda Civic…,11-24-2019 22:13:57,32008,0.85,1.4,0.19815210751374468
935,935,A math teacher welcomed a new French exchange student into her class and then started teaching a lesson on fractions.,01-19-2021 19:38:39,31991,0.94,1.0,0.194257788637752
936,936,No Nut November was pretty tough,12-01-2018 06:28:38,31981,0.81,0.6,0.19196701282834455
937,937,A guy walks into the bar of a restaurant,08-15-2020 07:03:05,31988,0.93,0.8,0.19357055589492977
938,938,I tried to translate joke from Arabic,06-28-2020 08:20:53,31983,0.94,0.8,0.19242516799022605
939,939,The largest condom factory in the States burned down.,09-16-2020 14:02:15,31949,0.8,0.8,0.1846365302382407
940,940,"Today I saw an ad that said ""radio for sale, $1, volume stuck on full.""",12-16-2018 15:35:26,31947,0.8,0.8,0.1841783750763592
941,941,my wife asked me if I wish she had been born with big tits.,04-11-2019 10:08:57,31943,0.87,1.4,0.18326206475259624
942,942,Two men are drinking in a bar,02-25-2018 06:19:55,31921,0.89,1.0,0.17822235797189984
943,943,"I've often heard that ""icy"" is the easiest word to spell",11-04-2018 19:42:16,31922,0.86,0.6,0.17845143555284057
944,944,Scarlett Johansson and some guy were the only survivors of a shipwreck.,06-16-2017 07:36:27,31916,0.82,0.6,0.1770769700671961
945,945,Fire is destroying a world famous landmark in Paris right now.,04-15-2019 14:55:16,31915,0.84,0.4,0.17684789248625535
946,946,I've never understood how the Nazis couldn't find where Anne Frank was hiding,02-20-2018 08:20:03,31911,0.79,0.6,0.17593158216249238
947,947,"After 3 years, the wife starts to think...",07-10-2018 06:58:56,31904,0.86,0.8,0.17432803909590716
948,948,Harry Potter has way too many characters...,03-25-2019 23:17:34,31888,0.91,0.8,0.17066279780085525
949,949,Little johnny wakes up one night hearing noises from his parents bedroom...,07-14-2017 04:35:42,31876,0.72,1.2,0.1679138668295663
950,950,"‌‌TIL i‌‌n 1‌‌974 R‌‌ussians a‌‌ccidentally b‌‌lew u‌‌p t‌‌heir o‌‌wn s‌‌ubmarine, t‌‌hinking i‌‌t w‌‌as a‌‌n e‌‌nemy",06-30-2020 14:56:05,31873,0.87,0.6,0.16722663408674407
951,951,I have two conditions in my will...,06-02-2018 10:22:25,31857,0.86,0.4,0.16356139279169213
952,952,My son came home as I was taking his door off it’s hinges and asked “Dad what are you doing?”,05-25-2018 14:34:33,31824,0.88,0.8,0.15600183262064754
953,953,6:30 is the best time on a clock,11-06-2018 10:25:46,31825,0.87,0.6,0.15623091020158827
954,954,"An English couple decided to adopt a little German boy. After two years, the child doesn’t speak and his parents start to worry about him. After three years, he still has not spoken and after four years, he has yet to utter a word.",01-13-2020 04:31:41,31822,0.9,0.8,0.15554367745876604
955,955,Slutty girls are like Wal-Marts,12-28-2017 20:36:51,31815,0.75,1.2,0.15394013439218082
956,956,"In an African tribe village, the chieftain's wife gave birth to a white skinned child.",09-20-2019 05:19:45,31807,0.87,0.8,0.15210751374465487
957,957,Dads of Reddit: Happy Father's Day...,06-17-2018 09:24:29,31805,0.84,0.8,0.15164935858277337
958,958,Two nuns are walking down the street when they notice that a man is following them.,06-04-2020 05:58:11,31798,0.95,0.8,0.15004581551618815
959,959,After my wife died I couldn’t look at women for 20 years,03-02-2018 14:45:18,31781,0.87,1.0,0.1461514966401955
960,960,"A man and woman, both married separately, had to share a room one night on a business trip.",12-26-2020 06:29:40,31761,0.94,1.0,0.1415699450213806
961,961,Call a girl beautiful 1000 times and she wont think twice..,01-29-2019 16:56:14,31755,0.72,1.2,0.1401954795357361
962,962,The last thing my grandfather said before he died was “It’s worth it to spend money on good speakers.”,01-24-2020 10:10:33,31741,0.9,1.0,0.1369883934025657
963,963,"""I love you lots snuggles"" said my girlfriend",10-15-2017 04:51:34,31743,0.8,1.4,0.13744654856444716
964,964,"My wife handed me two kayak paddles and asked, ""Which one do you want?""",07-23-2018 04:14:45,31715,0.89,0.8,0.1310323762981063
965,965,"My wife got stung by a bee on the forehead. She's at the ER now, her face all swollen and bruised, she almost died.",03-04-2018 11:13:38,31707,0.87,0.6,0.12919975565058034
966,966,An 18 year old girl tells her mom that she has missed her last 2 periods,09-24-2020 14:56:45,31706,0.87,1.0,0.1289706780696396
967,967,"A man goes into a local bookstore and asks the young lady assistant,",10-15-2020 07:31:11,31696,0.91,0.8,0.12667990226023215
968,968,Ben Shapiro dies in a plane crash. Wanna know why it crashes?,10-16-2019 18:54:23,31674,0.85,0.6,0.12164019547953575
969,969,Larry the Fighter Pilot,04-25-2017 06:54:55,31668,0.85,0.8,0.12026572999389128
970,970,A 90 year old Holocaust survivor told me this joke.,11-17-2017 21:21:09,31638,0.85,0.6,0.11339340256566892
971,971,A young guy met a sixty years old woman at a bar and she looked pretty good for her age.,05-29-2020 10:17:31,31628,0.93,0.6,0.11110262675626147
972,972,I was sitting at a bar and asked the bartender where I could find a piece of ass.,01-10-2018 20:28:21,31620,0.89,1.2,0.1092700061087355
973,973,I live in Pripyat and I just finished watching Chernobyl,06-20-2019 20:43:19,31605,0.92,0.8,0.10583384239462432
974,974,A colon in a sentence can make a huge difference,06-14-2018 02:59:54,31571,0.86,0.8,0.09804520464263898
975,975,"When you say ""poop"" your mouth moves in the same way your anus does.",04-26-2020 11:19:17,31526,0.87,1.0,0.08773671350030544
976,976,What did the Catholic priest say to the other Catholic priest as they entered the orphanage?,08-31-2018 07:51:17,31524,0.82,0.6,0.08727855833842395
977,977,Why are murders so difficult to solve in Alabama?,12-29-2020 17:21:37,31507,0.9,0.6,0.08338423946243129
978,978,"My wife says if this post gets over 1000 upvotes, I can get anal.",10-01-2019 23:44:37,31506,0.73,1.6,0.08315516188149054
979,979,I dont believe in hitting my children as punishment,10-30-2018 14:17:19,31503,0.87,1.2,0.08246792913866831
980,980,Give a man a fish and you will feed him for a day.,08-23-2018 11:33:04,31491,0.92,1.2,0.07971899816737936
981,981,"My wife told me, “If anything happens to me, I want you to meet someone new.”",09-01-2018 14:08:36,31458,0.91,0.8,0.07215943799633476
982,982,What do you call it when two transgender midgets have sex?,02-15-2018 18:54:46,31462,0.76,1.6,0.07307574832009775
983,983,"One day in the future, Donald Trump has a heart-attack and dies. He immediately goes to Hell, where the devil is waiting for him.",02-01-2019 06:19:26,31438,0.68,1.0,0.06757788637751985
984,984,A couple wants to have sex but their 8 year old son named Timmy is in the house..,06-28-2019 08:28:19,31429,0.86,1.2,0.06551618814905315
985,985,A man in a bar starts talking to a prostitute.,08-01-2020 17:49:59,31420,0.87,1.0,0.06345448992058644
986,986,My roommate says our house is haunted,12-26-2019 07:02:45,31420,0.89,0.8,0.06345448992058644
987,987,A 7-year-old is sitting on a park bench eating a chocolate bar.,06-27-2019 17:56:50,31405,0.88,1.0,0.060018326206475264
988,988,[NSFW] My girlfriends name is Wendy and I had it tattooed on my penis.,04-14-2021 04:37:46,31408,0.83,1.4,0.0607055589492975
989,989,"Man says to his boss, ""Can we talk? I have a problem.""",03-08-2020 07:49:26,31405,0.94,1.0,0.060018326206475264
990,990,A Roman soldier is bragging to his friend: 'You'll never guess with how many women I've slept!',03-04-2019 07:29:55,31394,0.87,1.4,0.057498472816127064
