,idx,title,created_utc,score,upvote_ratio,humor_scores,normalized_scores
250,250,My grandad always used to say “as one door closes another one opens”,08-22-2020 18:27:53,44239,0.95,0.6,3.0
251,251,My dad said people shouldn't get ribbons just for participating because it rewards them for losing.,03-29-2018 12:17:26,44233,0.83,1.0,2.9986255345143555
252,252,Thanos' finger snap would have a greater impact if they found a way to make it seem like half the audience disappeared.,11-14-2018 11:51:00,44220,0.86,0.8,2.9956475259621262
253,253,"I called my wife at work and asked, ""Do you ever get a shooting pain across your body, like someone's got a voodoo doll of you and they're stabbing it?"" Sounding concerned, she said, ""No.""",03-12-2019 00:46:01,44223,0.87,0.8,2.9963347587049483
254,254,"Two engineers were standing at the base of a flagpole, looking at its top. A blonde walked by and asked what they were doing.",04-02-2020 11:15:42,44182,0.91,0.6,2.986942577886378
255,255,America seems to have successfully prevented a second wave of corona,06-02-2020 09:18:07,44160,0.91,1.0,2.981902871105681
256,256,3 guys bet on who can make their wife scream more from sex,07-31-2020 15:26:57,44147,0.93,1.6,2.9789248625534515
257,257,There was this tramp.,11-19-2017 00:20:57,44118,0.74,0.6,2.97228161270617
258,258,"Chinese takeout $15.00, gas to get there $1.50",01-29-2019 08:18:41,44113,0.78,1.0,2.9711362248014663
259,259,Handjobs [nsfw],03-10-2019 21:53:49,44107,0.82,0.8,2.969761759315822
260,260,If you only sucked average sized penises...,06-11-2020 08:54:08,44070,0.93,1.4,2.9612858888210143
261,261,If you rearrange the letters of MAILMEN,10-10-2019 16:01:34,44047,0.89,0.6,2.9560171044593773
262,262,A gorilla walks into a bar,12-19-2016 20:22:31,44046,0.89,1.2,2.9557880268784364
263,263,Haven't you ever seen a naked woman before?,10-03-2020 10:16:50,44023,0.92,1.0,2.9505192425167994
264,264,Today i asked the hot girl at my gym what her New Year's resolution was.,12-12-2016 12:18:31,44010,0.88,1.0,2.9475412339645697
265,265,Why is Peter Pan always flying?,12-17-2016 09:16:32,44006,0.84,1.2,2.9466249236408064
266,266,PETA is like a box of chocolates,05-05-2019 17:36:14,44006,0.91,1.0,2.9466249236408064
267,267,Did you hear Mary Poppins stopped wearing lipstick whilst giving head?,09-03-2019 15:15:08,43970,0.83,1.4,2.9383781307269397
268,268,Joke from my 12 year old “why do you never see elephants hiding in trees?”,12-01-2020 19:31:55,43912,0.84,1.2,2.9250916310323767
269,269,Why are there two “d”s in “Reddit”?,11-01-2018 18:29:38,43878,0.8,0.8,2.917302993280391
270,270,What’s the difference between a politician and a flying pig?,06-04-2017 03:59:55,43845,0.88,1.0,2.9097434331093464
271,271,Told my wife I was so stressed that only a blowjob would help.,07-14-2020 16:52:11,43843,0.91,1.6,2.909285277947465
272,272,They told me i wouldn’t be good at poetry because i’m dyslexic,04-05-2020 18:34:17,43812,0.92,1.2,2.902183872938302
273,273,"You meet a man on the Oregon Trail. He tells you his name is Terry. “Terry?!” you say laughing, “Terry’s a girls name!” Without any hesitation, Terry pulls out a gun and shoots you dead.",12-23-2020 20:51:56,43739,0.78,0.8,2.8854612095296277
274,274,Two cowboys are lost in the desert. One cowboy sees a tree that’s draped in bacon. “A bacon tree ! We’re saved!” He says. He runs to the tree and is shot up with bullets.,08-11-2020 07:08:17,43735,0.9,1.0,2.8845448992058644
275,275,"An Englishman, a Frenchman, a ravishing blonde and an old lady are sharing a compartment on a train as it winds its way through the Alps.",06-03-2018 18:08:37,43718,0.85,0.8,2.880650580329872
276,276,If you aren't impressed with the picture of the first Black Hole,04-10-2019 12:42:02,43677,0.84,0.6,2.8712583995113015
277,277,Trump might finally get what he wants the most,10-02-2020 20:46:15,43679,0.79,1.4,2.8717165546731827
278,278,"If any one on this sub is thinking of getting married soon, please consider this carefully",04-07-2020 10:54:19,43597,0.92,1.2,2.852932193036042
279,279,6 was afraid of 7 because 789. But why did 7 eat 9?,04-23-2020 09:16:47,43549,0.85,0.8,2.841936469150886
280,280,My girlfriend dressed up as a policewoman and told me I was under arrest on suspicion of being good in bed.,11-08-2018 06:56:36,43509,0.76,1.4,2.832773365913256
281,281,We should've known communism would fail.,03-26-2018 11:14:08,43505,0.88,0.6,2.8318570555894933
282,282,"I used to sell security alarms door to door, and I was really good at it.",11-13-2017 07:44:04,43501,0.91,0.6,2.83094074526573
283,283,I proposed my Russian girlfriend and she said Yes!,01-11-2019 04:35:45,43493,0.82,1.0,2.8291081246182044
284,284,"One day in the future, Donald Trump has a heart-attack and dies.",06-20-2018 16:05:56,43466,0.76,1.0,2.822923029932804
285,285,A joke my 8-year old made up: What do you call a chicken that's afraid of the dark?,02-18-2018 21:51:27,43268,0.85,1.2,2.7775656689065364
286,286,My wife left me because I’m insecure and paranoid.,05-12-2018 19:11:33,43216,0.84,1.0,2.765653634697618
287,287,6 yr old son made this up. What do exploding pandas eat?,11-28-2020 07:31:14,43189,0.88,1.2,2.7594685400122176
288,288,"The son went to his dad and asked him, ""Dad, what's an alcoholic?""",03-21-2017 08:38:56,43198,0.86,0.8,2.7615302382406846
289,289,A man's fence is broken and he neess to hire someone to fix it,11-03-2018 13:34:16,43184,0.88,0.8,2.758323152107514
290,290,"The protests in Hong Kong have been continuous for 160 days, proving the country does not belong to China.",11-16-2019 07:40:34,43164,0.88,0.4,2.753741600488699
291,291,"A policeman was interrogating 3 guys who were training to become detectives. To test their skills in recognizing a suspect, he shows the first guys a picture for 5 seconds and then hides it. ""This is your suspect, how would you recognize him?""",01-02-2021 06:06:42,43124,0.92,0.6,2.7445784972510694
292,292,Gay Couple on a Plane,04-15-2018 22:46:21,43120,0.81,1.4,2.743662186927306
293,293,"Why are people complaining,what EA did was great!",11-16-2017 11:25:20,43098,0.82,0.6,2.73862248014661
294,294,"As I slipped my finger slowly inside her hole, I could immediately feel it getting wetter and wetter…",12-23-2018 10:13:13,42964,0.83,0.6,2.70792608430055
295,295,Hello everyone! I'm a scientist and I am researching bestiality between humans and dogs.,02-11-2020 03:42:26,42875,0.87,1.2,2.6875381795968236
296,296,Without the Arabs we wouldn’t have 9/11.,08-19-2018 18:09:53,42873,0.83,0.6,2.687080024434942
297,297,Jehovah's Witnesses don't celebrate Halloween,10-08-2017 16:23:26,42831,0.82,1.0,2.6774587660354308
298,298,"When a girl changes her clothes in front of you, she's either really interested or you're level 99 friend-zoned",02-14-2019 20:06:36,42797,0.83,1.2,2.6696701282834456
299,299,"A woman joins a country club and when she hears the guys talking about their golf round, she says, ""I played on my college's golf team. I was pretty good. Mind if I join you next week?"" No one wants to say 'yes', but they're on the spot…",03-28-2020 06:14:15,42783,0.88,1.0,2.666463042150275
300,300,Why won't the Republicans impeach Trump?,07-19-2019 21:55:10,42775,0.78,1.0,2.664630421502749
301,301,Steve jobs would have been a better president than Donald Trump.,02-05-2017 15:02:49,42743,0.77,1.0,2.6572999389126455
302,302,A woman was in bed with her lover when she heard her husband opening the front door,08-31-2017 04:42:16,42746,0.87,1.0,2.6579871716554675
303,303,Wife: “I’m pregnant.”,02-24-2019 19:48:36,42698,0.8,1.2,2.646991447770312
304,304,Girl: “Forgive me father for I have sinned.”,03-03-2020 08:35:03,42702,0.83,0.8,2.6479077580940746
305,305,Girls who talks about girls' problems are great.,09-27-2019 02:29:13,42663,0.82,1.0,2.638973732437386
306,306,My six year old nephew just told me this joke... Why does a a duck have feathers?,10-14-2018 15:43:10,42654,0.86,1.2,2.636912034208919
307,307,"Call me a racist if you want, but south of the border is a sea of violence, corruption and stupidity I wouldn't touch with a ten foot pole.",09-19-2020 16:05:07,42626,0.72,0.6,2.6304978619425783
308,308,Marijuana is legal and haircuts are against the law.,05-18-2020 15:52:32,42561,0.77,1.6,2.6156078191814296
309,309,Steve Jobs would have made a better president than Donald Trump...,04-16-2020 08:12:24,42528,0.81,1.0,2.608048259010385
310,310,I guess China finally got what they want,03-11-2020 00:36:19,42498,0.82,0.8,2.6011759315821625
311,311,The clitoris has nearly 8000 nerve endings.,08-29-2020 15:56:34,42444,0.84,0.8,2.5888057422113624
312,312,"I hate that SEPTember, OCTober, NOVember, and DECember aren't the 7th, 8th, 9th, and 10th months......",03-17-2020 23:01:57,42389,0.87,0.6,2.5762064752596214
313,313,A girl once asked me if I was a breast or legs guy...,08-26-2020 09:21:05,42379,0.86,1.2,2.573915699450214
314,314,"A vegan said to me, ""people who sell meat are gross!""",12-20-2017 12:38:12,42244,0.79,1.2,2.5429902260232136
315,315,Steve Jobs would have made a better president than Donald Trump...,10-13-2019 14:53:48,42212,0.82,1.0,2.5356597434331096
316,316,"When I was a teen, my dad showed me a 30 minute PowerPoint presentation on why one should always wear a condom during sex.",10-16-2018 12:40:54,42145,0.91,1.4,2.5203115455100797
317,317,I was telling a girl I met in a bar last night about my uncanny ability to guess the day a woman was born on just by feeling her tits.,06-26-2018 15:01:07,42136,0.78,1.2,2.518249847281613
318,318,"4 years ago today, I shared the worst joke I ever created. Here it is again for those that missed it.",10-09-2018 13:56:56,42053,0.85,0.8,2.499236408063531
319,319,"Yesterday, I changed a light bulb, crossed the street, and walked into a bar.",02-16-2020 08:17:59,42016,0.91,1.0,2.4907605375687236
320,320,Everyone knows Alan Turing who cracked Enigma codes.,07-25-2020 08:28:17,42017,0.86,0.8,2.490989615149664
321,321,"If any of you here are thinking of getting married, consider the following before you do.",04-09-2019 06:25:52,41955,0.91,1.0,2.476786805131338
322,322,I never understood school shooting jokes,05-02-2019 12:45:07,41932,0.85,0.8,2.4715180207697007
323,323,The 72 virgins were not what I expected,09-25-2020 03:30:33,41903,0.91,1.0,2.4648747709224192
324,324,"Give a man a shirt, and he'll wear it once",10-12-2020 17:31:13,41776,0.91,1.2,2.4357819181429448
325,325,"A priest, an imam and a rabbit walk into a blood bank",04-06-2020 06:18:18,41760,0.93,1.0,2.4321166768478926
326,326,"An Irish dad calls his son in London the day before Christmas Eve and says, “I hate to ruin your day but I have to tell you that your mother and I are divorcing.”",10-30-2020 15:36:34,41750,0.94,1.2,2.4298259010384853
327,327,My BDSM community took me to court for not being hardcore enough. I got off with just a slap on the wrist.,09-11-2020 00:35:59,41718,0.93,1.2,2.4224954184483813
328,328,"Can we ban ""Yo Momma"" jokes from this sub? They're old, stupid, and have been done by literally everyone hundreds of times",02-10-2019 16:01:32,41717,0.81,1.0,2.4222663408674405
329,329,"To teach kids about democracy, I let them vote on dinner.",06-23-2020 16:28:16,41687,0.92,1.2,2.4153940134392182
330,330,Once upon a time there lived a beautiful Queen with large breasts,05-02-2018 04:38:23,41694,0.87,1.0,2.4169975565058035
331,331,My girlfriend always takes long baths after we finish watching a Ryan gosling movie,07-20-2017 00:07:22,41670,0.85,1.4,2.4114996945632257
332,332,"A horny gorilla sees a lion bent over a small stream, taking a drink.",12-07-2020 21:56:13,41643,0.83,1.0,2.4053145998778254
333,333,"A man in a hot air balloon realized he was lost. He reduced altitude and spotted a woman below. He descended a bit more and shouted, ""Excuse me, can you help me?",05-29-2020 02:31:10,41642,0.9,0.4,2.4050855222968845
334,334,If you say AT&T backwards,11-20-2020 19:13:25,41551,0.9,0.6,2.384239462431277
335,335,I called two girls hipsters and got slapped.,03-03-2019 10:49:34,41481,0.89,1.2,2.368204031765425
336,336,"So I took off her shirt. Then she said, ""Take off my skirt."" I took off her skirt. ""Take off my shoes."" I took off her shoes. ""Now take off my bra and panties."" and so I took them off.",06-20-2020 05:33:38,41479,0.78,1.0,2.3677458766035433
337,337,"I asked my mum ""How much is a couple?""",05-30-2018 18:45:18,41461,0.9,1.0,2.36362248014661
338,338,Donald is walking out of the White House and headed towards his limo...,02-04-2018 01:28:00,41351,0.81,1.2,2.338423946243128
339,339,"People always ask where I got my incredibly detailed tattoo done, but they never believe me when I tell them Spain.",03-02-2019 05:54:33,41350,0.78,0.8,2.338194868662187
340,340,I wasn’t allowed in a fraternity in college because I was circumcised.,04-06-2019 07:08:58,41318,0.9,1.0,2.3308643860720832
341,341,"A Group of guys, all turning 40, discussed where they should meet for lunch. Finally it was agreed that they would meet at Wetherspoons in Uxbridge because the waitresses had big breasts and wore mini-skirts.",01-21-2020 14:36:11,41296,0.87,1.2,2.325824679291387
342,342,I told my boyfriend we could watch a porn for his birthday and do everything that we saw in the video...,03-21-2020 15:12:58,41255,0.89,1.2,2.316432498472816
343,343,A good (and very old) joke to explain why people are stocking up on necessities,03-14-2020 09:05:28,41220,0.95,1.2,2.3084147831398902
344,344,I just saw my Chinese waiter give my order to someone who looks nothing like me. I get it now.,12-19-2018 10:34:37,41176,0.87,0.8,2.2983353695784974
345,345,"A man walks out to the street and catches a taxi just going by. He gets into the taxi, and the cabbie says, ""Perfect timing. You're just like Frank.""",03-16-2017 06:49:14,41168,0.89,1.0,2.2965027489309713
346,346,My housemates are convinced our house is haunted,06-01-2019 14:15:37,41108,0.93,1.0,2.2827580940745267
347,347,"I was going to donate blood today, but they always ask waaaay too many personal questions",02-07-2018 13:18:30,41085,0.91,1.0,2.2774893097128897
348,348,Damn girl are you a piñata?,09-28-2020 10:36:14,41000,0.91,1.2,2.2580177153329264
349,349,"A big city doctor visits an Native American tribe full of men and he asks ""How do you guys relieve your sexual tension?""",04-19-2019 05:44:49,40992,0.9,1.4,2.2561850946854003
350,350,"Me: “Squirting isn’t real, right? It’s just urine, right?”",01-12-2020 05:46:41,40934,0.9,1.2,2.242898594990837
351,351,"A man is dining in a fancy restaurant and there is a gorgeous redhead sitting at the next table. He has been checking her out since he sat down, but lacks the nerve to talk with her.",10-05-2020 15:48:16,40935,0.89,1.2,2.2431276725717777
352,352,I am getting so sick of millennials and their attitude.,12-21-2018 07:06:23,40894,0.86,0.8,2.2337354917532073
353,353,"A little girl asks her mother, “Mommy, how was I born?”",07-24-2019 15:41:45,40843,0.85,0.8,2.222052535125229
354,354,I take Viagra for my sun burn...,03-11-2020 12:46:07,40790,0.9,1.2,2.20991142333537
355,355,The Only Thing Flat-Earthers Fear.....,10-07-2017 01:36:38,40782,0.91,0.8,2.2080788026878437
356,356,Your Girlfriend Is Pregnant !,06-16-2020 01:47:26,40780,0.82,1.4,2.207620647525962
357,357,The nurse at the sperm bank asked me if I'd like to masturbate in the cup...,01-28-2018 08:44:38,40774,0.86,1.6,2.2062461820403176
358,358,"I've decided that from January 1st, I'm only going to watch things that are 1080p and above.",11-21-2018 15:28:14,40717,0.82,0.8,2.1931887599266955
359,359,What do you call a stolen Tesla?,06-18-2017 15:27:02,40710,0.8,1.0,2.19158521686011
360,360,The Pope and Donald Trump are standing in front of a large crowd.,04-07-2020 01:51:20,40703,0.86,1.0,2.189981673793525
361,361,What do you call a drunk guy trying to start his car?,08-31-2019 21:58:17,40696,0.79,1.0,2.1883781307269397
362,362,A young Arab boy asks his father “What is that strange hat you are wearing?”,07-31-2018 07:08:54,40687,0.78,0.8,2.186316432498473
363,363,Isn't it annoying when engineering students call themselves engineers?,11-30-2017 19:43:38,40688,0.81,1.0,2.1865455100794136
364,364,What’s the difference between North Korea and the US?,04-27-2020 15:03:54,40650,0.86,0.6,2.1778405620036656
365,365,"A man went to the hospital to visit his mother-in-law, who was in serious condition. On the way back the wife, very worried, asks: ""So, honey? How's my mom doing?""",08-12-2020 12:00:59,40625,0.93,0.8,2.172113622480147
366,366,"When Jane first met Tarzan in the jungle, she was instantly attracted to him and during her questions about his life, she asked him if he had ever had sex. ""Tarzan not know sex."" he replied.",02-18-2018 05:53:19,40611,0.81,1.2,2.1689065363469764
367,367,"The Bible says being gay is fine, as long as you're high.",03-15-2018 05:50:09,40611,0.77,1.4,2.1689065363469764
368,368,"The year is 2020 and the United States has just elected the first woman, from Alabama , as president.",10-31-2020 11:51:48,40592,0.88,0.8,2.164554062309102
369,369,I finally realized my parents favored my twin brother.,01-11-2018 21:15:34,40581,0.87,0.8,2.162034208918754
370,370,I had sex with my kid's teacher. I have to tell my wife...,10-26-2020 10:45:41,40549,0.81,1.2,2.15470372632865
371,371,"When Batman is investigating a crime, the most likely explanation is that the Joker did it.",08-18-2018 13:57:51,40539,0.85,1.0,2.152412950519243
372,372,"A robber pulled a gun on the bank clerk and manager saying, “Give me all the money! I need it to set myself up in a trade or profession. You know, initial investment is needed to cover the overheads until my cash flow is established.”",10-25-2019 07:00:13,40519,0.91,0.6,2.147831398900428
373,373,Do you know how to avoid clickbait?,05-19-2017 19:37:25,40524,0.77,1.4,2.1489767868051315
374,374,"‌‌I j‌‌ust d‌‌iscovered t‌‌hat t‌‌he w‌‌ord ""‌‌nothing"" i‌‌s a‌‌ p‌‌alindrome...",05-08-2020 05:59:29,40470,0.91,0.6,2.1366065974343313
375,375,Dude explaining how he made his first $10 million:,03-23-2021 07:11:49,40447,0.88,1.2,2.1313378130726943
376,376,My Chinese waiter thinks all white people look alike and gave my food to the wrong customer,10-31-2020 19:32:16,40436,0.9,1.2,2.1288179596823458
377,377,Do all black people have a problem with slavery ?,12-25-2017 08:45:17,40415,0.72,0.6,2.1240073304825904
378,378,I applied to be a sperm donor and the nurse asked if I could masturbate in the cup...,09-07-2019 19:24:30,40390,0.89,1.4,2.1182803909590717
379,379,"The maid asked her boss, the wife for a raise, and the wife was upset.",04-23-2018 08:25:51,40367,0.88,0.8,2.1130116065974347
380,380,A guy sits down in a diner and asks for a bowl of hot chili...,11-21-2016 20:45:32,40346,0.88,1.4,2.108200977397679
381,381,Your mom is so fat,01-02-2019 08:26:51,40331,0.84,1.0,2.1047648136835675
382,382,My wife said if this post gets 1000 upvotes she'll give up her anal virginity tonight!,04-18-2018 18:52:18,40323,0.76,1.6,2.102932193036042
383,383,"A little girl says to her mother: ""Mummy, when you were away at the weekend a strange lady came around""",02-12-2019 15:38:20,40309,0.88,0.8,2.0997251069028713
384,384,"As a child, I always thought of my dad as a superhero",12-07-2017 02:37:12,40288,0.89,1.0,2.0949144777031155
385,385,"Today I was invited by a female janitor to smoke some weed at her apartment, but i politley declined.",03-19-2020 10:37:14,40256,0.89,1.4,2.087583995113012
386,386,Why didn't 4 ask out 5,11-05-2019 13:39:54,40252,0.88,0.6,2.0866676847892487
387,387,"A suspected Covid-19 male patient is lying in bed in the hospital, wearing an oxygen mask over his mouth and nose. A young student female nurse appears and gives him a partial sponge bath.",12-06-2020 07:33:41,40220,0.82,0.8,2.0793372021991448
388,388,I went to the pet shop and the owner said he had a talking centipede for sale.,09-23-2019 02:52:26,40134,0.94,1.0,2.0596365302382407
389,389,I'm assuming that none of the Jenners ask Kylie to make breakfast.,01-14-2019 22:37:23,40089,0.85,1.4,2.0493280390959074
390,390,North Koreans believe they live in the best country in the world because they’re brainwashed by the government and the media,08-04-2019 18:13:07,40058,0.83,1.2,2.0422266340867443
391,391,Children who are unvaccinated are less likely to have autism. You know why?,02-05-2018 10:21:19,39986,0.77,0.8,2.0257330482590103
392,392,"I swiped right on a girl without a picture, and we matched.",07-11-2019 17:28:44,39982,0.86,0.6,2.0248167379352475
393,393,Genie: I will grant you two wishes.,08-10-2020 07:50:35,39978,0.89,1.0,2.0239004276114847
394,394,Masturbation is perfectly normal and healthy. It releases dopamine and reduces stress. Improves prostate gland and cardiovascular health.,05-17-2020 16:10:03,39977,0.88,1.0,2.023671350030544
395,395,Why is Spider-Man so good at comebacks?,09-05-2019 17:30:01,39935,0.89,1.2,2.0140500916310327
396,396,"A husband leans over and asks his wife, ""Do you remember the first time we had sex together over fifty years ago?""",08-31-2020 11:02:03,39907,0.9,1.4,2.0076359193646915
397,397,A woman brought a very limp duck into a veterinary surgeon....,09-14-2017 12:51:38,39868,0.86,1.2,1.9987018937080026
398,398,TIL that you can get dishonorably discharged from the Navy for boarding the wrong vessel just once.,06-15-2017 22:54:59,39861,0.7,1.0,1.9970983506414173
399,399,If you masturbate after smoking marijuana....,08-23-2017 11:35:40,39822,0.79,1.4,1.9881643249847283
400,400,I finally got someone to be my valentine!,02-13-2018 14:13:30,39751,0.87,1.2,1.9718998167379354
401,401,Two rednecks flew to Canada on a hunting trip.,02-07-2019 14:10:43,39693,0.9,1.0,1.9586133170433722
402,402,"Son: ""Daddy, I fell in love and want to date this awesome girl.""",08-18-2017 22:45:14,39615,0.81,1.4,1.940745265729994
403,403,"One Christmas morning, a cop on horseback is sitting at a traffic light and next to him is a little girl on her brand-new bike.",12-24-2020 20:38:19,39610,0.89,1.0,1.9395998778252903
404,404,Why was my post removed,06-12-2020 04:16:33,39606,0.88,0.4,1.9386835675015273
405,405,The first female president,08-20-2020 08:03:58,39549,0.92,1.0,1.9256261453879049
406,406,A husband notices his wife’s hearing is deteriorating and decides to visit her doctor for advice.,04-16-2019 13:24:55,39534,0.94,1.0,1.9221899816737937
407,407,‌‌A m‌‌a‌‌n i‌‌‌‌s b‌‌ein‌‌g r‌‌elease‌‌d f‌‌ro‌‌m a‌‌‌‌ U‌‌‌‌S h‌‌ospital.,07-17-2020 09:28:43,39526,0.93,0.6,1.9203573610262676
408,408,A guy walks into a bar owned by Eminem,10-22-2017 07:10:13,39513,0.78,1.2,1.917379352474038
409,409,I asked my wife to dress up as my favourite Star Wars character for some sexy birthday fun.,06-29-2018 15:38:12,39506,0.81,1.4,1.9157758094074528
410,410,My wife left me because I am insecure,03-23-2020 06:12:30,39493,0.85,1.2,1.912797800855223
411,411,What did Master Yoda say when he first saw himself in 4k?,12-01-2019 02:23:46,39453,0.77,1.0,1.9036346976175933
412,412,"""Hey dad why is my sister called Teresa ?""",04-13-2017 13:39:09,39404,0.81,0.6,1.8924098961514968
413,413,I got fired from my job because I kept asking my customers whether they would prefer “Smoking” or “Non-smoking”.,03-27-2019 13:00:21,39398,0.93,1.2,1.8910354306658523
414,414,Give a Man a Fish and You Will Feed Him for a Day.,12-13-2020 04:31:22,39381,0.94,1.2,1.8871411117898595
415,415,If a tree falls in the forest and no one is around to hear it...,08-14-2017 09:48:08,39367,0.88,0.8,1.8839340256566892
416,416,If a girl says she will be ready in 5 minutes she will.,02-27-2018 15:55:58,39347,0.85,1.2,1.8793524740378742
417,417,"A professor, a CEO, and a janitor are in a forest when they discover a magic fairy.",08-30-2019 05:45:04,39340,0.89,0.8,1.8777489309712891
418,418,"A man goes to the doctor for a physical. He tells the doctor not to be alarmed, but he has 5 penises.",01-22-2019 16:26:11,39329,0.9,1.4,1.8752290775809408
419,419,A homeless guy asked me for money today,07-28-2020 16:24:34,39339,0.94,1.0,1.8775198533903483
420,420,"A pirate goes to the doctor and say, ""I have moles on me back aaarrrghh.""",06-11-2019 14:35:31,39306,0.93,1.2,1.8699602932193038
421,421,A young couple get married and have their first night together in their new home.,07-20-2020 19:59:44,39296,0.89,1.0,1.8676695174098963
422,422,If Trump really wanted Hillary to be locked up...,11-15-2019 17:56:33,39275,0.81,1.2,1.8628588882101407
423,423,My girlfriend broke up with me so I took her wheelchair,09-15-2018 17:04:07,39264,0.88,1.2,1.8603390348197923
424,424,My girlfriend dressed up as a policewoman and told me I was under arrest on suspicion of being too good in bed...,10-22-2017 18:20:00,39249,0.79,1.4,1.8569028711056812
425,425,My wife asked me which of her friends I would like to have a threesome with.,11-14-2020 13:27:59,39195,0.93,1.6,1.844532681734881
426,426,"A French, a German and an Italian spy are captured one day.",09-27-2020 13:16:30,39195,0.93,0.6,1.844532681734881
427,427,I’m pleased to announce reddit has achieved its goal in becoming one of the top 10 green companies in the world.,01-31-2019 18:51:17,39188,0.89,0.6,1.8429291386682958
428,428,"My sister came up with this. What begins with a P, ends with an E and has a million letters in it",01-08-2021 15:22:51,39182,0.89,0.6,1.8415546731826513
429,429,How do you break up two blind guys fighting?,09-15-2017 13:00:27,39176,0.85,1.2,1.8401802076970069
430,430,Why did the Star Wars movies come out in the order 4 5 6 1 2 3?,10-15-2019 01:53:06,39135,0.85,0.6,1.8307880268784362
431,431,"One day, Albert Einstein was on his way to a science convention for a speech.",01-09-2020 07:22:22,39133,0.89,0.8,1.8303298717165548
