,idx,title,created_utc,score,upvote_ratio,humor_scores,normalized_scores
619,619,A guy walks into a bar and asks for a beer,09-19-2018 14:33:26,35861,0.89,1.2,1.0807880268784362
620,620,My wife is pregnant and my doctor asked me if I had ever been present at a childbirth before.,12-19-2018 03:05:58,35849,0.83,1.0,1.0780390959071473
621,621,A guy walks into a restaurant with a full-grown ostrich behind him.,10-28-2017 17:53:59,35808,0.88,1.2,1.0686469150885767
622,622,Student: Can I borrow a pencil?,05-19-2020 14:21:11,35788,0.89,1.2,1.0640653634697619
623,623,What's the difference between EA and North Korea?,08-18-2017 07:18:45,35779,0.9,0.6,1.0620036652412952
624,624,"For every upvote this gets, my girlfriend and I will try one thrust of anal sex.",06-23-2016 17:14:41,35770,0.68,1.6,1.0599419670128285
625,625,A lumberjack went in to a magic forest to cut a tree,06-14-2018 15:39:06,35767,0.82,1.0,1.0592547342700063
626,626,A father and son are hanging out in their living room watching TV,08-11-2020 23:30:46,35763,0.87,1.2,1.0583384239462432
627,627,How many cops does it take to push a black man down the stairs?,01-04-2021 04:39:33,35751,0.8,1.0,1.0555894929749543
628,628,My mother used to tuck me in every night,01-10-2018 06:43:54,35732,0.86,1.0,1.05123701893708
629,629,two hardcore trump supporters die and ascend to heaven.,11-17-2020 15:29:21,35736,0.83,1.0,1.0521533292608432
630,630,"An Afghan, an Albanian, an Algerian, an American, an Andorran, an Angolan, an Antiguans, an Argentine, an Armenian, an Australian.....",06-08-2020 06:00:11,35694,0.87,0.4,1.0425320708613317
631,631,An atheist dies and goes to hell.,03-18-2018 16:48:20,35693,0.8,0.6,1.042302993280391
632,632,"Today my son asked, ""Can you lend me a book mark?""",05-22-2020 11:02:18,35686,0.87,0.8,1.0406994502138058
633,633,A guy takes up a new job.,01-28-2020 20:33:57,35684,0.89,0.8,1.0402412950519244
634,634,"I'm divorcing my wife. First it was the poolboy, then the mailman, her ex-boyfriend, and my best friend. It's pretty clear...",12-21-2017 12:37:40,35686,0.82,0.8,1.0406994502138058
635,635,Why can't you hear a pterodactyl pee?,05-05-2019 01:48:34,35649,0.83,1.0,1.0322235797189983
636,636,A m‌‌an a‌‌ccidentally e‌‌lbows a‌‌ w‌‌oman's b‌‌oob a‌‌s s‌‌he i‌‌s s‌‌tanding b‌‌ehind h‌‌im i‌‌n a‌‌ h‌‌otel l‌‌obby.,07-19-2020 09:12:56,35548,0.86,1.4,1.009086744043983
637,637,How many Alzheimer’s patients does it take in to screw in a lightbulb?,02-13-2019 20:11:54,35489,0.84,1.4,0.995571166768479
638,638,How do you get Donald Trump to change a lightbulb?,07-20-2019 09:20:32,35497,0.8,1.4,0.997403787416005
639,639,What did Kim Jong-Un say yesterday before he died?,04-21-2020 21:37:56,35484,0.88,0.6,0.9944257788637753
640,640,I accidently sprayed deodorant in my mouth today,02-28-2020 15:28:38,35473,0.93,1.4,0.991905925473427
641,641,What's the Presidential ventilator called?,10-03-2020 21:05:08,35449,0.89,0.8,0.9864080635308492
642,642,Success is like pregnancy.,03-07-2020 16:16:25,35415,0.91,0.8,0.9786194257788638
643,643,Does anyone know if its possible to take a skin graft from your buttocks and put it on somebody who isn't family?,12-06-2018 06:58:18,35400,0.88,1.2,0.9751832620647527
644,644,My mate broke his leg so I went to see him at home.,02-15-2019 04:36:02,35398,0.82,1.0,0.9747251069028712
645,645,Why does Batman only wear dark colors? Easy. Batman doesn't want to get shot. Why does Robin only wear bright colors?,06-30-2019 09:55:03,35369,0.93,1.2,0.9680818570555896
646,646,Three porn stars were getting drunk,03-09-2018 23:07:03,35361,0.73,1.2,0.9662492364080636
647,647,Courtesy of my youngest child - why didn't Elsa see a doctor for her sore throat and cough?,07-06-2019 08:56:29,35355,0.91,1.0,0.9648747709224191
648,648,The best years of my life were spent in the arms of another man's wife...,05-13-2018 04:24:56,35329,0.91,0.8,0.9589187538179598
649,649,(My first dad joke) Wife was breastfeeding,04-14-2017 20:04:27,35321,0.83,1.2,0.9570861331704338
650,650,"An Englishman is hiking in Scotland and he pauses to drink from a stream. A passing shepherd calls out ""Dinnae drink frae that, it's all fulla coo piss an shite!""",09-05-2020 07:12:39,35296,0.93,1.2,0.9513591936469151
651,651,"Given that a radiator is essentially a vital organ to a car, it's strange that the town in the movie Cars is called ""Radiator Springs.""",03-05-2019 16:55:09,35257,0.89,0.6,0.9424251679902261
652,652,Doctor: (handing me my new born baby) I'm sorry but your wife didn't make it,12-18-2018 09:08:29,35237,0.87,1.0,0.9378436163714112
653,653,The problem with Trump jokes:,04-29-2017 21:34:51,35232,0.83,1.4,0.9366982284667075
654,654,My life completely changed after I learned Morse Code,05-17-2018 14:35:16,35226,0.85,0.8,0.935323762981063
655,655,imagine if Americans switched from pounds to kilograms overnight.,04-03-2020 06:17:29,35211,0.89,0.8,0.9318875992669519
656,656,What borders on stupidity?,08-17-2020 05:03:25,35208,0.75,0.6,0.9312003665241295
657,657,My wife walked out on me after I blew our life savings on a penis extension.,08-13-2019 07:05:37,35200,0.87,1.6,0.9293677458766036
658,658,Why is the white guy the scariest guy in prison?,09-23-2019 14:32:07,35202,0.83,0.6,0.9298259010384851
659,659,‌‌My L‌‌esbian n‌‌eighbours E‌‌va a‌‌nd J‌‌ulia a‌‌sked m‌‌e t‌‌o h‌‌elp t‌‌hem c‌‌onceive a‌‌ c‌‌hild r‌‌ecently,05-06-2020 16:11:02,35190,0.8,1.4,0.9270769700671961
660,660,I was in Venice Beach in January and there was a homeless man with a sign that said “1 dollar for dirty joke.”,08-29-2019 06:43:23,35160,0.9,1.0,0.9202046426389738
661,661,Her: What do you do?,11-11-2019 05:30:27,35148,0.94,1.0,0.9174557116676848
662,662,"Remember, If your apartment is hit by a dolphin, DO NOT GO OUT TO SEE IF THE DOLPHIN IS OKAY",09-08-2017 14:50:26,35151,0.75,1.2,0.918142944410507
663,663,English to become the official European language,02-07-2021 11:44:51,35148,0.89,0.6,0.9174557116676848
664,664,Girl: Come over,08-29-2020 05:57:46,35152,0.92,1.2,0.9183720219914479
665,665,I took my daughter out for her first drink...,11-03-2017 20:56:54,35131,0.81,1.2,0.9135613927916921
666,666,"Son: ""Daddy, I fell in love and want to date this awesome girl!""",04-15-2020 14:13:56,35137,0.86,1.4,0.9149358582773367
667,667,My dad died last year when my family couldn't remember his blood type in time for paramedics to save him,07-02-2017 09:07:38,35129,0.91,0.8,0.9131032376298107
668,668,"After my accident, I woke up in hospital with a sexy nurse standing over me.",09-15-2019 05:18:53,35074,0.9,1.0,0.9005039706780698
669,669,A good percentage of my friends are Nazis...,12-14-2018 21:14:33,35057,0.77,0.8,0.8966096518020771
670,670,"A cowboy rode into town and stopped at a saloon for a drink. Unfortunately, the locals always had a habit of picking on strangers, which he was.",04-06-2019 18:18:40,35052,0.93,1.0,0.8954642638973733
671,671,"When I was young, my father emphasized every day how important it was to wear a condom if I ever had sex.",02-25-2019 07:00:07,35045,0.93,1.2,0.893860720830788
672,672,A Feminist Talked to me About the Dwayne Johnson Rule,10-02-2020 10:56:41,35032,0.86,1.0,0.8908827122785584
673,673,A 55 year old lady suddenly started learning to swim instead of her usual routine of going to a temple !!!!,11-18-2020 11:08:19,35020,0.9,1.0,0.8881337813072695
674,674,See? To prove I'm not some boring house dad I went and got a tattoo!,01-13-2020 17:37:46,35015,0.92,1.2,0.8869883934025657
675,675,I was having a conversation with a scammer the other day.,07-01-2019 13:45:18,34986,0.91,0.8,0.8803451435552841
676,676,Trump is visiting a class in an elementary school where they are talking about words and meanings,10-14-2019 06:53:28,34982,0.76,1.0,0.8794288332315211
677,677,[NSFW] Had sex with my girlfriend a couple days ago..,04-23-2017 19:27:45,34979,0.8,1.4,0.8787416004886989
678,678,"Damn girl, are you a piñata?",03-05-2020 12:36:38,34969,0.94,1.2,0.8764508246792915
679,679,What's it called when a King and Queen have no children?,01-18-2018 05:22:50,34980,0.88,1.0,0.8789706780696397
680,680,"A man walks into a bar and orders a drink. The bartender gives the man his drink and the man asks ""If I show you something crazy, would let me have free drinks for the rest of the night?""",09-04-2020 02:42:13,34942,0.92,1.4,0.8702657299938913
681,681,What's the difference between humans and a bullet?,05-06-2017 11:36:52,34935,0.81,0.6,0.8686621869273061
682,682,What's it called when a chameleon can't change its colors anymore?,08-16-2017 20:30:44,34934,0.88,0.8,0.8684331093463654
683,683,I walked in on my girlfriend having sex with her fitness trainer.,11-16-2020 07:45:25,34929,0.92,1.4,0.8672877214416617
684,684,What do Apple and Donald Trump have in common?,03-30-2018 21:58:15,34926,0.75,1.2,0.8666004886988394
685,685,"Three things Christ promises he will never do: Won't leave you broken-hearted (Psalm 147:3), won't reject you (John 6:37), and won't leave you nor forsake you (Hebrews 13:5).",10-24-2020 07:59:13,34892,0.86,0.8,0.8588118509468541
686,686,"The larger the feet, the larger the penis. The larger the vehicle, the smaller the penis.",10-19-2018 14:58:54,34889,0.82,1.0,0.8581246182040319
687,687,The three unwritten rules of life,03-06-2020 09:06:07,34851,0.9,0.8,0.8494196701282835
688,688,My neighbour just got arrested for growing weed,08-13-2020 19:26:21,34835,0.91,1.2,0.8457544288332316
689,689,"A guy asked a girl in a university library: ""Do you mind if I sit beside you?"" The girl replied with a loud voice: ""NO! I DON'T WANT TO SPEND THE NIGHT WITH YOU!"" All the students in the library started looking at the guy; he was pretty embarrassed. After a while the girl walked quietly over to the",08-27-2020 14:18:19,34833,0.81,0.8,0.8452962736713501
690,690,Why do North Koreans draw lines so well?,08-12-2018 16:43:24,34828,0.89,0.8,0.8441508857666463
691,691,"For an experiment, my son as been wearing a different Manchester United top for two weeks. So far he's been spat at, verbally abused, and punched...",05-30-2020 06:48:17,34816,0.91,1.0,0.8414019547953574
692,692,What is a pirate's least favorite letter?,04-16-2018 19:37:34,34810,0.79,0.6,0.8400274893097129
693,693,I broke up with my girlfriend because she screamed too much during sex,02-19-2020 08:40:15,34778,0.91,1.2,0.8326970067196091
694,694,"Jack, a renown atheist, dies...",08-26-2018 18:06:06,34762,0.79,0.6,0.8290317654245571
695,695,We cannot allow this year to end,06-09-2020 00:40:04,34738,0.93,0.6,0.8235339034819793
696,696,Why is every American receiving a $1200 check?,06-30-2020 23:07:23,34733,0.77,0.8,0.8223885155772755
697,697,Did you know that Stephen King has a son named Joe?,12-17-2020 06:53:20,34739,0.89,1.0,0.82376298106292
698,698,Damn girl are you a newspaper?,12-16-2017 21:04:11,34720,0.9,0.6,0.8194105070250459
699,699,I’m planning a charity event for people who struggle to achieve an orgasm,12-17-2018 03:39:49,34702,0.89,1.4,0.8152871105681124
700,700,"On his death bed, an old jew says to his wife:",09-14-2018 14:07:15,34688,0.9,0.6,0.812080024434942
701,701,What did our parents do to kill boredom before the internet?,07-05-2019 05:38:56,34686,0.91,1.2,0.8116218692730606
702,702,I wanna tell you a joke about a girl who only eats plants.,09-15-2020 09:35:06,34657,0.92,1.4,0.804978619425779
703,703,"While walking down the street one day, a senator is tragically hit by a truck and killed.",05-06-2021 08:48:39,34649,0.91,0.6,0.803145998778253
704,704,"Billie Eilish is officially 18 now, do you know what that means?",12-21-2019 12:05:16,34643,0.82,1.0,0.8017715332926085
705,705,3 guys are on a boat and they have 4 cigarettes but nothing to light them with. What do they do?,04-13-2018 07:25:06,34637,0.78,1.0,0.8003970678069641
706,706,Three nuns die and go to Heaven...,07-29-2020 21:55:40,34632,0.92,0.6,0.7992516799022603
707,707,“I love my job!” exclaimed the farmer. “All you do is boss me around all day!” complained one of his sheep. “What did you say?” challenged the farmer. The sheep glared back and growled...,03-31-2020 22:30:25,34607,0.92,0.8,0.7935247403787417
708,708,A guy gets home early from work and hears strange noises coming from the bedroom.,03-09-2019 09:09:04,34611,0.86,0.8,0.7944410507025046
709,709,Genders are like the Twin Towers,12-24-2016 02:49:52,34587,0.81,0.8,0.7889431887599268
710,710,"I loaned my girlfriend $100 sometime soon after we met. After 3 years, when I broke up with her, she returned exactly $100.",11-19-2019 14:02:13,34587,0.9,1.0,0.7889431887599268
711,711,My wife is turning 32 soon...,04-17-2017 08:35:35,34566,0.84,0.8,0.7841325595601711
712,712,A soldier approaches a nun.,08-09-2020 07:35:35,34553,0.8,0.8,0.7811545510079414
713,713,A storm blew away 25% of my roof last night.,08-18-2020 09:18:29,34543,0.89,0.8,0.778863775198534
714,714,My dick is bigger in Texas too,08-19-2020 15:59:22,34539,0.89,1.2,0.777947464874771
715,715,How many BuzzFeed workers does it take to turn on an electric chair?,03-07-2019 02:59:31,34510,0.91,1.2,0.7713042150274894
716,716,Jack & Jill,10-11-2020 08:10:43,34486,0.91,1.2,0.7658063530849115
717,717,A man was arrested and taken to an interrogation room,07-29-2018 16:49:06,34437,0.86,0.4,0.7545815516188149
718,718,I got arrested for illegally downloading Wikipedia in its entirety,02-26-2020 05:11:42,34398,0.86,1.0,0.7456475259621259
719,719,What does gay mean?,04-05-2017 04:23:12,34396,0.82,1.2,0.7451893708002444
720,720,A man notices his wife’s butt is getting big...,01-23-2018 18:08:27,34388,0.8,1.6,0.7433567501527184
721,721,"A priest and a Rabbi are very good friends, so they decide to go to a remote lake for a swim.",05-11-2017 00:16:42,34367,0.91,1.0,0.7385461209529628
722,722,A man wakes up after a heavy night of drinking to his wife happily cooking breakfast.,02-06-2018 15:36:46,34367,0.86,1.2,0.7385461209529628
723,723,What do you get if you eat 3.14 cakes?,10-06-2020 05:09:25,34365,0.82,1.0,0.7380879657910813
724,724,Soooo my 4 year old nephew just told me this. He's a little nerd but it made me chuckle. Knock knock...,12-24-2019 21:02:46,34363,0.87,1.0,0.7376298106291999
725,725,Hitler commits suicide and appears in front of god,09-08-2019 06:03:01,34358,0.86,1.0,0.7364844227244961
726,726,It’s very rare that a defibrillator fails.,10-10-2018 12:11:37,34356,0.9,0.8,0.7360262675626146
727,727,Why was the anti-vaxxer’s 3 year old crying?,08-13-2018 13:15:34,34348,0.79,0.6,0.7341936469150886
728,728,"Man, on a first date: How do you feel about sex? Woman: I like it infrequently.",09-22-2018 06:59:06,34348,0.88,1.4,0.7341936469150886
729,729,Last night my girlfriend dressed up as a policewoman and told me I was under arrest on suspicion of being good in bed…,05-03-2020 06:26:47,34332,0.83,1.6,0.7305284056200367
730,730,What is a pirate's LEAST favorite letter?,09-19-2019 16:59:57,34330,0.89,0.6,0.7300702504581552
731,731,An Englishman and an Irishman go to a bakery. The Englishman steals three buns and puts them into his pockets and leaves. He says to the Irishman: “That took great skill and guile to steal those buns. The owner didn’t even see me.”,02-26-2020 13:52:06,34333,0.94,1.2,0.7307574832009774
732,732,I was blessed with a 9 inch penis.,06-20-2018 05:55:39,34296,0.83,1.4,0.7222816127061699
733,733,What do you call children born in whorehouses?,04-24-2017 07:31:30,34274,0.87,1.0,0.7172419059254734
734,734,A husband and wife are waiting at the bus stop with their 9 children.,06-04-2018 08:22:30,34234,0.86,0.8,0.7080788026878436
735,735,Trump said...,07-12-2017 12:21:59,34230,0.67,0.8,0.7071624923640807
736,736,Student: Are “well” and “actually” both single-syllable words?,05-09-2020 14:54:53,34225,0.87,0.8,0.7060171044593769
737,737,I like my women like I like my whiskey.,02-24-2017 17:36:55,34205,0.81,1.0,0.701435552840562
738,738,Told my wife I was so stressed that only a blowjob would help.,01-23-2017 19:33:33,34202,0.82,1.6,0.7007483200977398
739,739,I was complaining to my wife about our nonexistent sex life.,09-03-2020 16:10:19,34183,0.92,1.2,0.6963958460598657
740,740,"In breaking news, Trump’s personal library has burned down.",08-02-2020 11:47:50,34177,0.81,1.0,0.6950213805742211
741,741,A mom visits her son for dinner who lives with a girl as a roommate.,10-19-2020 12:45:48,34156,0.89,1.2,0.6902107513744655
742,742,"A‌‌n America‌‌n soldier‌‌, servin‌‌g i‌‌n Worl‌‌d Wa‌‌r I‌‌I ha‌‌d jus‌‌t returne‌‌d fro‌‌m severa‌‌l week‌‌s o‌‌f battl‌‌e o‌‌n th‌‌e Germa‌‌n fron‌‌t lines.",05-31-2020 10:04:00,34150,0.9,0.4,0.6888362858888211
743,743,"A man who just died is delivered to the mortuary wearing an expensive, expertly tailored black suit...",09-06-2018 05:40:27,34143,0.92,0.8,0.6872327428222359
744,744,"A man is walking through a graveyard when he sees another man squatting next to a grave. ""Morning!"" he calls out.",01-27-2018 06:36:56,34118,0.85,0.8,0.6815058032987172
745,745,The only thing Flat-Earthers fear,07-24-2018 21:55:50,34092,0.84,0.8,0.6755497861942579
746,746,How many introverts does it take to change a lightbulb?,04-02-2018 21:29:43,34068,0.88,1.2,0.6700519242516799
747,747,An engineer dies and goes to hell.,05-25-2020 03:42:25,34054,0.87,0.6,0.6668448381185095
748,748,A guy sat next to me on the train pulled out a photo of his girlfriend from his wallet and said 'she's beautiful isn't she',12-08-2020 06:08:17,34032,0.95,0.8,0.6618051313378132
749,749,My girlfriend is mad because I could only last 2 minutes in bed,08-27-2020 23:01:13,34024,0.91,1.4,0.6599725106902872
750,750,Weinstein didn’t kill himself,02-24-2020 18:33:49,34019,0.9,0.8,0.6588271227855834
751,751,"Got home to find my wife had left a note on the fridge that said ""This isn't working I'm going to my mum's""",07-11-2019 04:28:38,34006,0.89,1.0,0.6558491142333538
752,752,Jared from Subway ended his career the same way he began it,08-22-2018 08:29:21,33992,0.81,1.2,0.6526420281001833
753,753,"A teacher goes for a long walk on the beach. She finds a shiny magic lamb, picks it up, and rubs it.",07-04-2019 15:05:51,33990,0.87,1.2,0.6521838729383018
754,754,My therapist told me that a great way to let go of your anger is to write letters to people you hate and then burn them...,12-12-2017 06:14:38,33988,0.88,0.8,0.6517257177764203
755,755,eBay is so useless,09-28-2017 16:42:40,33967,0.83,0.6,0.6469150885766647
756,756,Man wakes up in a slum with no memory of how he got there.,03-06-2018 17:08:10,33961,0.81,0.8,0.6455406230910202
757,757,"If someone calls you Fat, just ignore them.",11-16-2020 16:56:01,33938,0.93,1.0,0.6402718387293831
758,758,Why haven't Aliens visited our Solar System yet? ...,10-18-2018 14:22:10,33910,0.85,1.2,0.6338576664630422
759,759,Why are circumsized penises so popular among Jewish girls?,04-14-2020 17:09:15,33894,0.77,1.6,0.6301924251679902
760,760,"When I was 5 years old, I got a coal from Santa...",12-05-2018 10:14:32,33886,0.93,0.8,0.6283598045204644
761,761,If I had a dollar for everytime someone over 40 told me my generation sucks....,04-28-2019 02:21:48,33876,0.77,0.8,0.6260690287110569
762,762,"A girl tells her mother after school ‘Mum, I got a gold star today for reciting the whole alphabet! The rest of my class only knows 3 or 4 letters!",03-26-2021 03:06:24,33844,0.9,0.8,0.618738546120953
763,763,Did you know if you hold your ear up too a strangers leg,03-31-2018 09:10:03,33820,0.82,1.0,0.6132406841783751
764,764,Wife: Does this dress make me look fat? Me: You promise not to get mad no matter what i say? Wife: Yes,10-22-2018 13:24:00,33824,0.74,1.4,0.6141569945021381
765,765,"A Jewish man decides his son isn't religious enough, so pays for him to go visit Israel.",11-20-2019 12:05:17,33802,0.92,1.0,0.6091172877214417
766,766,Did you know that a piranha can devour a human child to the bone in 30 seconds?,12-07-2018 14:18:31,33791,0.85,1.4,0.6065974343310935
767,767,Smartest president,10-08-2020 07:17:24,33793,0.77,1.2,0.607055589492975
768,768,What do you get if you cross a pirate and a paedophile?,01-24-2019 04:56:22,33785,0.92,1.0,0.605222968845449
769,769,I asked my masseuse if it was normal to get an erection during my massage,12-03-2020 14:45:02,33782,0.9,1.4,0.6045357361026268
770,770,"Jesu‌‌s onc‌‌e sai‌‌d ""H‌‌e wh‌‌o live‌‌s b‌‌y th‌‌e sword‌‌, wil‌‌l di‌‌e b‌‌y th‌‌e sword""",06-25-2020 12:01:19,33757,0.9,0.6,0.5988087965791081
771,771,"A college professor started to notice that one of his students, Dave, started gaining lots of female attention.",08-26-2018 12:20:18,33763,0.9,1.2,0.6001832620647526
772,772,"Give a man a gun and he'll rob a bank,",03-16-2018 11:28:13,33755,0.78,0.8,0.5983506414172267
773,773,A man sunbathes in the nude and ends up burning his penis,09-11-2017 15:35:47,33701,0.74,1.6,0.5859804520464265
774,774,I can count on one hand how many times I have been to Chernobyl.,10-06-2017 11:35:05,33694,0.87,0.6,0.5843769089798412
775,775,Forget everything you learned in college...,08-27-2016 09:34:59,33690,0.88,0.6,0.5834605986560782
776,776,11 Minutes,05-18-2017 20:57:32,33662,0.88,0.6,0.5770464263897374
777,777,A Nazi walks into a bar...,12-28-2018 04:37:22,33652,0.84,1.0,0.57475565058033
778,778,A drunk guy is showing friends his new apartment...,12-20-2018 16:23:27,33613,0.89,1.2,0.5658216249236409
779,779,"While in China, an American man is sexually promiscuous and does not use a condom the entire time he is there.",02-09-2021 12:59:16,33601,0.83,1.4,0.5630726939523519
780,780,"My wife screamed in pain during labor so I asked, “What’s wrong?”. She screamed. “These contractions are going to kill me!”",06-21-2020 08:47:57,33603,0.93,0.8,0.5635308491142333
781,781,"I hate that SEPTember, OCTober, NOVember, and DECember aren't the 7th, 8th, 9th, and 10th months......",07-08-2020 02:45:12,33590,0.87,0.6,0.5605528405620037
782,782,A KGB agent goes to a library and sees an old Jewish man reading a book.,08-08-2020 14:52:38,33589,0.92,0.8,0.560323762981063
783,783,I just read a list of “100 Things To Do Before You Die”...,11-02-2020 06:49:16,33576,0.95,1.0,0.5573457544288333
784,784,"If I'm ever on life support, unplug me...",05-15-2018 14:13:11,33562,0.86,0.8,0.5541386682956628
785,785,The new sex position is called Brexit:,12-08-2019 13:44:10,33564,0.9,0.8,0.5545968234575444
786,786,"I can’t believe that you’ve been visiting prostitutes for sex,” my wife screamed at me.",06-30-2017 07:26:02,33557,0.85,1.2,0.5529932803909591
787,787,What I if told you,09-28-2019 00:14:51,33559,0.81,0.4,0.5534514355528406
788,788,We are 11 days into self-isolation ands it is really upsetting me to witness my wife standing at the living room window gazing aimlessly into space with tears running down her cheeks.,03-27-2020 00:18:47,33550,0.94,0.6,0.5513897373243739
789,789,I didn’t know what to wear to my premature ejaculation support group,05-01-2020 00:12:57,33519,0.91,1.4,0.5442883323152108
790,790,Once upon a time there lived a ravishing Queen with huge tits..,11-26-2018 08:06:24,33502,0.86,1.4,0.5403940134392181
791,791,"Three contractors are bidding to fix a broken fence at the White House. One is from Chicago , another is from Tennessee , and the third is from Minnesota .",05-27-2020 08:24:14,33499,0.91,0.8,0.5397067806963959
792,792,I got so fed up with the trick-or-treaters last Halloween that I turned off the lights and pretended I wasn't home.,10-16-2017 18:07:26,33494,0.81,0.8,0.5385613927916921
793,793,What do you do with a drunken sailor? What do you do with a drunken sailor? What do you do with a drunken sailor early in the morning?,03-28-2021 10:45:17,33474,0.88,1.0,0.5339798411728772
794,794,If you find gold in Australia where should you look for silver?,01-03-2019 06:46:04,33476,0.8,0.6,0.5344379963347587
795,795,"In Britain, when you turn 100, you get a letter from the Queen.",08-03-2020 07:17:34,33473,0.88,0.8,0.5337507635919365
796,796,"A teacher asks the kids in her 3rd grade class: ""What do you want to be when you grow up?""",11-30-2020 08:37:35,33455,0.91,1.0,0.5296273671350031
797,797,I scared the postman today by going to the door completely naked…,04-29-2017 08:46:26,33465,0.88,1.4,0.5319181429444105
798,798,Why was 6 afraid of 7?,06-04-2019 19:56:11,33448,0.87,0.6,0.5280238240684179
799,799,What did Raichu say when it saw Pikachu,09-17-2019 10:47:11,33433,0.9,1.0,0.5245876603543067
800,800,r/Jokes Has 19 Million subscribers!,08-21-2020 04:22:46,33409,0.92,0.8,0.5190897984117288
801,801,A wife is tired of all the problems that need fixing in her house,10-01-2020 16:38:19,33400,0.91,1.0,0.5170281001832621
802,802,This joke got me fired when I worked as a cook. Credit goes to Jackie “The Joke Man” Martling,06-21-2020 02:28:23,33390,0.82,1.0,0.5147373243738547
803,803,What's the difference between me and Jimmy Fallon?,07-18-2017 23:26:02,33380,0.86,0.8,0.5124465485644472
804,804,Best knock knock joke ever..,03-23-2019 10:39:12,33376,0.9,1.2,0.5115302382406842
805,805,[Nsfw] My wife FINALLY agreed to a Star Wars role play in the bedroom...,11-17-2020 04:22:14,33360,0.86,1.2,0.5078649969456323
806,806,A reporter walks into a bar,06-24-2020 14:45:50,33363,0.94,1.0,0.5085522296884545
807,807,"Got my girlfriend a ""get better soon"" card",05-28-2018 19:49:57,33299,0.88,1.2,0.49389126450824683
808,808,A woman takes a lover home during the day while her husband is at work...,04-16-2018 09:08:33,33285,0.79,1.2,0.4906841783750764
809,809,A girl asks her boyfriend to come over for dinner,09-07-2020 12:22:03,33276,0.82,1.4,0.4886224801466097
810,810,How does a Flat Earther travel the world?,11-30-2017 08:09:34,33270,0.91,0.8,0.48724801466096523
811,811,A perfectly triangular lake has 3 kingdoms on its 3 sides,03-21-2019 17:06:21,33263,0.86,0.6,0.48564447159438
