,idx,title,created_utc,score,upvote_ratio,humor_scores,normalized_scores
432,432,"As we landed in Saudi Arabia the pilot announced ""Ladies and Gentlemen don't forget to adjust your watches to local time""",12-30-2018 04:17:14,39127,0.77,0.8,1.8289554062309104
433,433,My girlfriend always takes long showers after watching movies starring Chris Pratt,11-20-2017 02:10:43,39109,0.76,1.4,1.824832009773977
434,434,I was banging this hot chick on her kitchen table when we heard the front door open,02-16-2019 02:08:21,39063,0.83,0.8,1.8142944410507027
435,435,My wife left me because I am insecure,09-02-2019 10:17:37,39058,0.87,1.2,1.8131490531459988
436,436,Pot head gets really high on some good shit and goes home,08-25-2020 13:00:37,39036,0.92,1.2,1.8081093463653024
437,437,I wish I could be ugly for one day.,08-21-2017 09:27:01,39005,0.88,0.8,1.8010079413561395
438,438,My girlfriend just emailed me,03-15-2018 15:59:07,38994,0.74,1.0,1.7984880879657912
439,439,"One day, a wife came home early and found her husband in their bedroom making love to a very attractive young woman. Naturally, she was very upset.",11-23-2019 07:30:40,38987,0.79,1.0,1.796884544899206
440,440,TIL that a school of piranhas can strip all the flesh off of a child's body in less than a minute...,02-09-2018 05:57:06,38952,0.83,1.2,1.78886682956628
441,441,I haven't had sex since 1956,11-08-2020 16:39:44,38879,0.89,1.4,1.7721441661576054
442,442,My girlfriend tried to make me have sex on the hood of her Honda Civic,01-29-2018 21:39:13,38863,0.81,1.6,1.7684789248625536
443,443,"Jeff Bezos: ""Alexa, send nudes to my secret admirer.""",02-07-2019 20:34:43,38853,0.92,1.4,1.7661881490531461
444,444,A guy sits down on a bench next to a Thai kid wearing soccer cleats.,07-13-2018 00:32:03,38835,0.79,1.0,1.7620647525962128
445,445,Husband: I have cheated once,04-01-2018 07:10:08,38840,0.8,1.2,1.7632101405009164
446,446,"I’m American, and I’m sick of people saying America is “the stupidest country in the world.”",09-23-2020 07:40:25,38844,0.83,1.0,1.7641264508246794
447,447,What do you call an emo a capella group?,01-24-2017 10:48:15,38840,0.87,1.2,1.7632101405009164
448,448,Only anti-vaxxers will get this,07-13-2018 17:24:45,38833,0.82,0.6,1.7616065974343311
449,449,Yesterday I spotted an albino dalmatian.,01-09-2020 20:55:26,38744,0.91,0.8,1.7412186927306048
450,450,"Dude 1: Hey, bro?",09-06-2019 18:13:25,38739,0.82,1.2,1.7400733048259012
451,451,What did Charizard say when he saw Pikachu,09-11-2020 17:24:22,38709,0.89,1.2,1.7332009773976789
452,452,I told my gf that i had a crush on beyonce!,10-23-2020 09:10:52,38692,0.86,1.2,1.729306658521686
453,453,"A professor, a CEO, and a janitor are in a forest when they discover a magic fairy.",02-16-2019 12:00:05,38697,0.86,0.8,1.73045204642639
454,454,I met a Jewish girl and she asked for my number.,09-26-2019 03:43:08,38690,0.74,0.8,1.7288485033598047
455,455,"As a responsible employer, All my staff are in a 2 week quarantine.",03-13-2020 05:14:00,38674,0.94,0.6,1.7251832620647527
456,456,A woman is at home when she hears someone knock at the door. She goes to the door and opens the door to see a man standing there.,01-08-2020 04:54:13,38669,0.86,0.6,1.724037874160049
457,457,A woman is walking through the park when she sees a very attractive man sitting on a park bench. He's reading a book and eating some fruit out of a Tupperware container. Slowly the woman gathers the courage to go ask the man out.,06-04-2020 20:32:14,38650,0.92,1.2,1.7196854001221749
458,458,A father buys a lie detector that slaps people when they lie. He decided to test it out at dinner one night.,09-15-2018 07:43:56,38641,0.79,1.2,1.7176237018937082
459,459,Afternoon Sex,02-12-2018 00:04:36,38629,0.86,1.4,1.7148747709224192
460,460,A man heard that masturbating before sex...,01-01-2018 16:37:16,38601,0.81,1.2,1.7084605986560784
461,461,What sort of grades did Tommy Wiseau receive in school?,09-21-2018 18:59:13,38586,0.88,0.8,1.7050244349419672
462,462,My roommate is 2 days younger than me,05-19-2020 03:13:21,38584,0.86,0.8,1.7045662797800856
463,463,"At birth, success is being alive. At age 3, success is not pooping your pants. At age 10, success is having friends. At age 16, success is having a driver's license. At age 20, success is having sex. At age 30, success is having money...",08-04-2020 14:09:21,38557,0.88,1.0,1.6983811850946855
464,464,"A guy goes to Las Vegas to gamble And he loses all his money. He doesn't even have enough for a cab, but he flagged one down anyway. He explained to the driver that he would pay him back next time and gave him his phone number, but the driver told him, ""Get the fuck out of my cab.""",01-27-2019 08:09:28,38524,0.91,1.0,1.690821624923641
465,465,What’s the difference between a computer and an American?,10-19-2019 06:18:49,38509,0.86,0.6,1.6873854612095298
466,466,"I was applying for Australian citizenship and the interviewer asked, “Do you have a criminal record?”",08-08-2018 14:07:36,38495,0.86,0.6,1.6841783750763593
467,467,"When Jane first met Tarzan in the jungle, she was instantly attracted to him and during her questions about his life, she asked him if he had ever had sex. ""Tarzan not know sex."" he replied.",09-21-2020 07:01:53,38488,0.86,1.2,1.6825748320097742
468,468,"“Doc, I think my son has gonorrhea,” a patient told his urologist on the phone. “The only woman he’s screwed is our maid.”",11-06-2020 00:45:06,38488,0.9,1.2,1.6825748320097742
469,469,"Funny that when a guy sleeps with tons of girls, he's a stud..",01-04-2017 20:08:07,38466,0.81,1.4,1.6775351252290778
470,470,How do you grab the attention of a pervert?,03-31-2020 03:07:31,38405,0.89,1.2,1.6635613927916921
471,471,An old man is selling watermelons...,06-16-2020 19:26:47,38393,0.94,0.8,1.6608124618204032
472,472,Do you know how to avoid clickbait?,04-21-2018 01:42:53,38395,0.76,1.4,1.6612706169822848
473,473,How many police officers does it take to change a light bulb?,06-05-2020 07:35:54,38335,0.78,1.0,1.64752596212584
474,474,"Q : With Britain leaving EU soon, how much space will be freed up?",01-12-2019 03:09:40,38315,0.91,0.8,1.6429444105070252
475,475,A white scientist is studying a tribe in Africa,12-10-2020 12:04:03,38187,0.87,0.6,1.6136224801466097
476,476,Why do the election results take so long?,11-04-2020 07:37:12,38190,0.91,0.8,1.614309712889432
477,477,"If this year has taught us anything, it’s that Donald Trump is a regular American citizen",11-06-2020 22:44:31,38185,0.85,1.0,1.6131643249847283
478,478,"Girl: ""Come over""",12-27-2016 19:26:04,38171,0.84,1.2,1.609957238851558
479,479,Top Reddit posters should use their karma to help the environment.,10-17-2018 02:14:44,38127,0.92,1.0,1.599877825290165
480,480,What do you call a waffle on a California beach?,06-22-2017 19:36:20,38120,0.83,1.2,1.5982742822235798
481,481,A woman asked a General in the army the last time he made love to a woman...,04-15-2017 07:30:13,38111,0.87,1.2,1.5962125839951131
482,482,I like my reddit posts the same way I like my boyfriend's pants,04-03-2020 13:11:20,38106,0.93,1.4,1.5950671960904095
483,483,"An Amish woman and her daughter were riding in an old buggy one cold blustery day, when the daughter said, ""My hands are freezing cold!"" The mother replied, ""Put them between your legs. Your body heat will warm them up.""",04-19-2020 07:19:31,38081,0.9,0.8,1.5893402565668908
484,484,Two Thai girls asked me if I wanted to sleep with them.,01-17-2019 06:24:03,38060,0.8,1.4,1.5845296273671352
485,485,Where do little jokes come from?,04-18-2018 01:00:58,38040,0.83,1.0,1.5799480757483202
486,486,"As an Aussie, Americans are always asking me where in Australia there ""isn't"" something trying to kill you....",05-09-2019 01:53:43,38014,0.8,0.6,1.573992058643861
487,487,My penis is like Joe Biden.,12-21-2020 07:54:38,37991,0.85,1.6,1.5687232742822237
488,488,"Which one doesn't belong: eggs, your wife, or a blow job?",07-06-2017 21:18:27,37936,0.7,1.2,1.5561240073304827
489,489,If I got $1 every time a woman said I was't her type,04-12-2020 12:02:14,37927,0.86,1.2,1.554062309102016
490,490,People say smoking will give you diseases.,04-15-2018 09:32:10,37905,0.88,1.4,1.5490226023213196
491,491,‌‌The b‌‌oss o‌‌f a‌‌ m‌‌ining c‌‌ompany i‌‌s t‌‌rying t‌‌o d‌‌ecide w‌‌hich o‌‌f h‌‌is 3‌‌ s‌‌ons t‌‌o p‌‌romote s‌‌o h‌‌e g‌‌ives t‌‌hem a‌‌ t‌‌est.,06-14-2020 11:53:43,37869,0.89,0.8,1.5407758094074528
492,492,"As I was driving past a prison yesterday, I saw a dwarf scaling down the wall. Confused , I stared up at him and he sneered back.",07-17-2020 22:15:47,37865,0.92,0.6,1.5398594990836898
493,493,My late Grandfathers favorite joke,07-06-2020 07:40:44,37849,0.95,1.0,1.5361942577886378
494,494,A naked man arrives at a costume party with a girl on his back.,05-11-2020 07:06:50,37833,0.91,1.2,1.5325290164935859
495,495,"Whenever the cashier at the grocery store asks my dad if he would like the milk in a bag he replies,",05-29-2019 21:14:00,37802,0.83,1.0,1.5254276114844227
496,496,If I had a nickel for every time I didn’t know what was going on...,02-21-2019 15:41:41,37798,0.89,0.6,1.52451130116066
497,497,"My girlfriend borrowed $100 from me. After 3years, when we separated, she returned exactly $100.",09-26-2020 03:29:03,37788,0.92,1.0,1.5222205253512524
498,498,"If I had a dollar for every downvote EA""s comment gets....",11-13-2017 18:41:24,37785,0.86,0.6,1.5215332926084302
499,499,"At the parole hearing, the officer asked, ""Tell me, why should you be released early?"" The inmate responded, ""It’s bec...""",07-24-2020 05:57:06,37741,0.92,0.6,1.5114538790470373
500,500,"Astronaut 1: ""I can't find any milk for my coffee""",08-19-2018 09:56:10,37752,0.78,1.4,1.5139737324373856
501,501,New Teslas don't come with a new car smell,03-17-2019 21:03:42,37729,0.88,1.0,1.5087049480757484
502,502,"A man walks into a library and says to the librarian, ""Do you have that book for men with small penises?""",06-26-2020 19:45:21,37723,0.92,1.6,1.507330482590104
503,503,"To the hacker who hacked into my reddit account, I will find you.",06-07-2020 19:05:35,37711,0.85,0.8,1.504581551618815
504,504,"Donald Trump met with the Queen of England, and politely asked her, ""Your Majesty, how do you run such an efficient government? Are there any tips you can give me?""",03-28-2020 08:56:33,37691,0.85,1.0,1.5
505,505,I like my coffee how I like my slaves...,12-20-2019 02:30:34,37616,0.86,1.2,1.4828191814294442
506,506,The best years of my life were spent in the arms of another man's wife...,05-14-2017 13:38:30,37598,0.88,0.8,1.4786957849725109
507,507,"“I can’t believe that you’ve been visiting prostitutes for sex,” my wife screamed at me. “I’m really disappointed.”",02-04-2019 08:09:20,37592,0.88,1.2,1.4773213194868664
508,508,"A child asks his father what ""gay"" means",04-24-2020 06:33:21,37555,0.84,1.2,1.4688454489920588
509,509,Communism jokes are not funny,01-07-2017 18:06:53,37564,0.87,0.8,1.4709071472205255
510,510,Cheating Wives,03-12-2019 11:41:09,37545,0.87,1.2,1.4665546731826513
511,511,White people don't shoot each other in the streets like black people do.,01-13-2017 15:51:37,37504,0.8,0.8,1.4571624923640807
512,512,A teenage boy was delivering papers to an apartment house.,11-06-2017 05:36:11,37465,0.87,0.6,1.4482284667073917
513,513,A guy walks into a bar and sees a jar of $100 bills on the counter,02-01-2018 02:35:27,37466,0.82,1.0,1.4484575442883325
514,514,My attractive female neighbor is completely paranoid.,01-17-2018 09:56:53,37465,0.77,0.8,1.4482284667073917
515,515,"(NSFW) A priest has a heart attack, and is rushed to the hospital. He wakes up as he's being rushed through the hospital on a gurney by two nurses. ""Am I in heaven?"" asks the disoriented priest.",07-27-2017 21:25:24,37443,0.83,0.8,1.4431887599266953
516,516,Someone broke into my house and stole 20% of my couch,12-16-2019 04:58:48,37420,0.87,1.2,1.4379199755650582
517,517,There's a little-known legend about Attila the Hun...,07-21-2017 20:35:02,37414,0.8,0.6,1.4365455100794136
518,518,"My friend just told me, 'I hope you die in a deep hole filled with water'.",07-27-2020 07:00:31,37345,0.88,0.6,1.4207391569945023
519,519,My friends laughed at me when I told them I had a hot date and they said she was imaginary...,07-11-2018 06:31:02,37315,0.89,1.2,1.41386682956628
520,520,What do you call it when two transgender midgets have sex?,11-15-2017 01:38:49,37308,0.86,1.6,1.4122632864996947
521,521,Why do police get to protests early?,05-31-2020 16:39:13,37314,0.89,1.0,1.4136377519853391
522,522,Not for the easily offended - my favourite politically incorrect joke...,06-21-2017 11:16:13,37311,0.75,0.8,1.412950519242517
523,523,I'm giving up masturbating for an entire month.,04-06-2020 12:03:19,37300,0.9,1.4,1.4104306658521688
524,524,A woman is having an affair during the day while her husband is at work,10-23-2017 06:37:18,37308,0.83,1.2,1.4122632864996947
525,525,"If A is for Apple and B is for Banana, what is C for?",08-05-2020 19:49:30,37297,0.86,1.0,1.4097434331093464
526,526,"Remember, as a child, when air for your bike was free? Now it's $1.50! I asked the gas station attendant why.",05-11-2018 05:53:10,37275,0.86,0.8,1.4047037263286501
527,527,My local drug dealer started dressing up as a Jehovah's Witness so he wouldn't arouse suspicion.,08-11-2017 16:30:33,37277,0.9,1.0,1.4051618814905316
528,528,"A teacher told her young class to ask their parents for a family story with a moral at the end of it, and to return the next day to tell their stories.",06-06-2020 15:10:01,37262,0.92,0.6,1.4017257177764204
529,529,"My girlfriend yelled at me today saying, ""You weren't even listening just now, were you?!""",11-01-2016 01:39:47,37242,0.91,1.0,1.3971441661576054
530,530,"A little girl asks her father: ""Daddy, what is corruption?""",07-13-2020 04:38:56,37231,0.96,0.6,1.3946243127672573
531,531,A Marine returns from duty in Iraq and is immediately reassigned to a remote location in Afghanistan.,11-09-2019 07:51:42,37233,0.84,0.8,1.3950824679291387
532,532,"When you say ""poop"" your mouth moves the same way your anus does when you poop.",09-26-2017 17:21:14,37224,0.8,1.0,1.393020769700672
533,533,Just been in to Starbucks and the barista was wearing a face mask,03-05-2020 06:34:36,37210,0.93,0.8,1.3898136835675017
534,534,An infinite number of mathematicians walk into a bar,11-11-2018 17:41:28,37180,0.76,1.2,1.3829413561392792
535,535,I dont own this joke. But i havent forgotten about it for five years.,04-17-2019 01:49:59,37168,0.85,1.0,1.3801924251679902
536,536,I told my wife that the milkman said he had shagged every woman in our road except one!!,01-18-2019 18:42:25,37155,0.88,1.4,1.3772144166157607
537,537,"The guy sat next to me on the train pulled out a photo of his wife and said, “She’s beautiful, isn’t she?” I said, “If you think she’s beautiful, you should see my girlfriend mate.”",11-03-2018 04:01:46,37158,0.91,0.8,1.377901649358583
538,538,"A guy walks into a bar and orders a rum and coke, but the bartender hands him an apple.",11-19-2020 21:14:45,37150,0.86,1.2,1.3760690287110569
539,539,"Just after my wife had given birth, I asked the doctor, ""How soon do you think we'll be able to have sex?""",02-02-2017 07:35:31,37137,0.89,1.2,1.3730910201588271
540,540,A charity worker stopped me in the street and asked if I fancied taking part in a marathon.,12-15-2018 07:40:09,37123,0.93,1.2,1.3698839340256568
541,541,"A man knocks on the door and asks the woman "" Do you have a vagina? """,04-10-2018 15:36:47,37112,0.82,1.4,1.3673640806353087
542,542,I got fired from the sperm bank yesterday,03-27-2018 10:31:31,37094,0.89,1.2,1.363240684178375
543,543,"My wife beamed at me with pride and said, “Wow! I never thought our son would go that far!“",08-22-2020 08:51:56,37048,0.91,0.8,1.3527031154551008
544,544,What do you call a priest that becomes a lawyer?,09-24-2018 10:05:30,37039,0.9,0.8,1.3506414172266341
545,545,Sex with the priest's wife,11-22-2017 06:29:12,37034,0.85,1.4,1.3494960293219305
546,546,How do you get Trump to change a lightbulb?,11-01-2018 08:55:59,37021,0.76,1.4,1.3465180207697007
547,547,"A driver was stuck in a traffic jam on the highway outside Washington, DC Nothing was moving.",11-19-2019 05:29:34,37020,0.91,0.4,1.34628894318876
548,548,Ellen Pao's career,07-03-2015 11:41:05,36916,0.81,0.6,1.3224648747709224
549,549,A man filed a report to the police that his bag was stolen.,06-09-2018 07:50:32,36890,0.92,0.4,1.3165088576664632
550,550,I angered two people by calling them hipsters...,07-12-2020 13:11:57,36881,0.93,1.4,1.3144471594379965
551,551,A guy goes into the US Postal Services to apply for a job.,10-29-2020 13:55:40,36869,0.88,1.0,1.3116982284667076
552,552,Chinese doctor opens his new clinic.,05-18-2017 07:30:14,36857,0.84,1.0,1.3089492974954184
553,553,"A weasel walks into a bar. The Bartender says, ""Wow, I've never served a weasel before. What can I get you?""",10-17-2018 10:14:41,36846,0.9,1.2,1.3064294441050703
554,554,"Three brothers age 92, 94 and 96 live in a house together.",07-30-2018 11:50:16,36821,0.89,0.6,1.3007025045815517
555,555,"Four Catholic ladies are having coffee together, discussing how important their children are.",01-07-2019 06:46:13,36809,0.9,1.2,1.2979535736102628
556,556,"Today I donated my watch, phone, and $500 to a poor guy.",04-06-2018 18:27:42,36790,0.81,0.6,1.2936010995723886
557,557,Today I thought of a color that doesn't exist...,10-08-2020 19:12:40,36700,0.92,0.8,1.2729841172877214
558,558,A prostitute standing outside a motel in a small town saw a 70+ year old man walking past.,07-19-2020 16:39:11,36698,0.86,0.6,1.27252596212584
559,559,Why do reddit users hate facebook?,11-09-2018 01:44:06,36675,0.82,0.8,1.267257177764203
560,560,Only anti-vaxxers will get this...,05-12-2017 16:55:20,36676,0.8,0.6,1.2674862553451436
561,561,"My wife said to me ""If I ever get Alzheimers I would commit suicide rather than burdening you with me""",01-17-2021 10:45:14,36659,0.93,0.8,1.263591936469151
562,562,My girlfriend broke up with me for being too “un-American”,02-27-2021 04:20:09,36660,0.92,1.2,1.2638210140500916
563,563,A lady who is cheating on her husband,03-05-2020 21:07:43,36631,0.88,1.0,1.2571777642028101
564,564,What did Sparticus do to the cannibal who ate his nagging wife?,12-22-2017 18:55:54,36624,0.87,1.0,1.2555742211362249
565,565,The Pope and Trump are on stage in front of a huge crowd.,08-19-2017 08:34:31,36622,0.77,1.2,1.2551160659743434
566,566,Genie: You have 3 wishes.,04-26-2018 02:08:56,36598,0.89,1.0,1.2496182040317656
567,567,"A man drives a train in Bulgaria. One day, he falls asleep driving and runs over someone walking on the tracks. Well, his case goes to court, and he gets the death sentence for murder",09-30-2020 06:27:10,36562,0.92,0.6,1.2413714111178986
568,568,Don't know why this got removed the first time. I'll try again. When is it OK to have sex with your cousin?,11-17-2018 08:08:56,36550,0.9,1.4,1.2386224801466097
569,569,"A boob, a vagina and an asshole are debating as to who is the greatest of them all. Boob: I give milk to new born babies and I’m attractive to the opposite sex, that’s why I’m the greatest. Vagina: I give birth to babies and I accommodate the opposite sex, that’s why I’m the greatest.",07-25-2019 11:27:41,36539,0.87,1.2,1.2361026267562616
570,570,It's a 5 minute walk from my house to the pub. It's a 30 minute walk from the pub to my house.,11-13-2020 19:13:56,36511,0.9,0.8,1.2296884544899207
571,571,My Wife was dying,10-25-2020 22:15:15,36503,0.84,0.4,1.2278558338423946
572,572,Panda and a Prostitute,06-19-2017 07:05:07,36476,0.81,1.4,1.2216707391569945
573,573,"As I get older and remember all the people I've lost along the way, I think to myself...",04-02-2018 02:55:49,36464,0.9,0.4,1.2189218081857056
574,574,Gay people have no excuse to have a bad fashion sense,03-01-2020 17:08:10,36456,0.87,1.4,1.2170891875381797
575,575,"I stabbed a vampire, beat zombies to death and killed devil itself...",11-01-2020 08:15:40,36445,0.88,1.0,1.2145693341478314
576,576,"Two Texas farmers, Jim and Bob are sitting in a bar, enjoying beers.",07-02-2018 22:20:19,36444,0.86,1.0,1.2143402565668908
577,577,"Wearing crocs is like getting a blowjob from a guy,",04-28-2017 21:26:12,36436,0.72,1.4,1.2125076359193647
578,578,A lion would never drive while drunk.,05-29-2017 16:19:41,36431,0.84,1.2,1.211362248014661
579,579,My girlfriend told me to take the spider out instead of killing it.,08-06-2016 11:26:03,36426,0.8,1.0,1.2102168601099572
580,580,I’m done being a people pleaser,08-17-2020 14:04:23,36412,0.94,0.8,1.2070097739767869
581,581,I was pretty excited when I heard Logan Paul went into a suicide forest,01-07-2018 21:45:28,36407,0.75,0.8,1.2058643860720832
582,582,I lent my umbrella to a hot girl yesterday.,05-12-2018 07:55:34,36407,0.88,1.0,1.2058643860720832
583,583,‌‌I w‌‌as f‌‌ucking m‌‌y s‌‌ecretary u‌‌p t‌‌he a‌‌rse w‌‌hen m‌‌y w‌‌ife w‌‌alked i‌‌n,05-12-2020 06:19:57,36384,0.81,1.2,1.200595601710446
584,584,"Your mom is so fat she starts the alphabet with the letter ""O""...",04-14-2019 10:21:06,36365,0.89,1.0,1.1962431276725718
585,585,The word asparagus is funny.,06-07-2018 05:04:13,36355,0.86,1.0,1.1939523518631645
586,586,What happens when you do nothing about a respiratory pandemic?,11-06-2020 09:09:09,36335,0.84,1.0,1.1893708002443495
587,587,How many Democrats does it take to change a lightbulb?,01-18-2019 07:06:05,36331,0.63,1.0,1.1884544899205864
588,588,I scared the postman today by going to the door completely naked.,01-01-2019 10:15:00,36316,0.88,1.4,1.1850183262064753
589,589,"A guy named Bart walks into a bar, he immediately gets shot and dies. Who killed him?",03-19-2020 00:25:29,36295,0.85,0.6,1.1802076970067197
590,590,I arrived early to the restaurant. The manager said do you mind waiting a bit? I said no.,01-07-2021 07:18:38,36291,0.95,0.8,1.1792913866829566
591,591,Depressing pickup lines.,05-30-2020 19:08:17,36275,0.9,1.0,1.1756261453879049
592,592,What has 6 balls and fucks all the poor people?,01-14-2021 22:38:12,36256,0.9,0.8,1.1712736713500307
593,593,Judge: How could you kill 24 people? What the hell was wrong with you?,12-05-2020 17:24:55,36226,0.9,0.8,1.1644013439218082
594,594,"While driving to work, robbers jumped into my car and stole everything.",01-14-2019 11:21:36,36191,0.83,0.8,1.1563836285888822
595,595,"NSFW.. Girl: ""Forgive me father for I have sinned."" Priest: ""What have you done my child?""",01-27-2019 03:02:35,36170,0.78,0.6,1.1515729993891266
596,596,How do you get 100 drunk and rowdy Canadians out of a pool?,07-03-2017 10:03:18,36161,0.81,1.4,1.14951130116066
597,597,I am able to suck my period blood back into my vagina...,04-04-2020 19:24:07,36159,0.88,1.2,1.1490531459987783
598,598,If Trump were captain of the RMs Titanic,04-09-2020 23:44:44,36123,0.79,0.8,1.1408063530849115
599,599,"If the Klu Klux Klan leaders are wizards, why don't they cast a spell to kill all those that oppose them?",03-20-2019 06:47:20,36113,0.91,0.8,1.138515577275504
600,600,I went to the most popular NSFW subreddit and was shocked when I sorted by Best.,12-16-2019 17:21:10,36099,0.86,0.6,1.1353084911423337
601,601,"When Trump borrows $1,000,000 from his dad it's a small loan",09-01-2017 10:12:09,36091,0.72,1.0,1.1334758704948076
602,602,If a tree falls in the forest and no one is around to hear it…,10-12-2020 05:54:37,36075,0.93,0.8,1.1298106291997558
603,603,What's the difference between a politician and a flying pig.,06-04-2019 08:22:56,36077,0.9,1.0,1.1302687843616372
604,604,"Two married buddies are out drinking one night, when one turns to the other and says...",01-24-2018 06:00:43,36073,0.88,1.2,1.1293524740378742
605,605,"When she was growing up, everybody laughed when Amy Schumer said she wanted to be a comedian...",03-18-2017 03:36:27,36066,0.77,1.2,1.127748930971289
606,606,Today a girl kissed me,02-11-2020 16:40:29,36037,0.88,1.0,1.1211056811240074
607,607,"On a plane is full of Redditors, a man starts having a heart attack.",02-18-2020 06:32:41,36008,0.91,0.8,1.1144624312767257
608,608,Cashier: Scans Condoms,12-16-2018 07:04:13,35997,0.81,1.0,1.1119425778863776
609,609,An Irishman and an Englishman walk into a bakery,07-01-2020 11:57:56,35994,0.93,1.0,1.1112553451435554
610,610,"When I was a kid, my parents would always say ""Excuse my french"" after a swear word...",01-28-2019 08:23:32,35972,0.91,1.0,1.106215638362859
611,611,My boyfriend keeps talking about overthrowing capitalism in a violent revolution,01-16-2019 05:04:37,35952,0.91,1.0,1.101634086744044
612,612,"A father in Iraq gifted his daughter a new bag. The girl replied,",05-02-2017 06:14:51,35939,0.79,0.8,1.0986560781918144
613,613,A cowboy walks into a bar and takes a seat next to a very attractive woman…,06-13-2017 07:28:10,35933,0.8,1.0,1.09728161270617
614,614,"A woman has to go to Italy for a conference, so her husband drives her to the airport.",08-16-2020 01:08:01,35930,0.94,1.2,1.0965943799633477
615,615,I saw 2 men in matching outfits I asked them if they were gay,04-21-2020 09:30:55,35926,0.89,1.4,1.0956780696395847
616,616,"Scotsman, Englishman, and an Irishman walk into a bar",12-26-2016 09:18:23,35929,0.89,1.0,1.096365302382407
617,617,"I was passing by my son's bedroom and was astonished to see the bed was nicely made and everything was picked up. Then, I saw an envelope, propped up prominently on the pillow. It was addressed, 'Dad'. With the worst premonition, I opened the envelope and read the letter, with trembling hands...",05-24-2018 07:04:11,35910,0.81,0.6,1.0920128283445327
618,618,I told my teenage niece to go get me a phone book...,06-05-2018 15:02:17,35884,0.86,1.0,1.0860568112400735
