,idx,title,created_utc,score,upvote_ratio,humor_scores,normalized_scores
444,444,My friend was bragging that his new 3D printer can print a gun.,04-23-2021 11:15:47,12550,0.97,0.8,1.7567258156840297
445,445,My math teacher called me average...,10-04-2020 11:08:48,12540,0.96,0.8,1.7510017172295365
446,446,Why is the letter B so cool?,06-19-2019 22:26:38,12545,0.95,0.6,1.753863766456783
447,447,My wife accused me of hating her family and relatives,02-13-2021 02:19:47,12533,0.97,0.6,1.7469948483113908
448,448,What do you call a depressed man with a robotic arm?,11-09-2020 19:17:13,12532,0.98,1.0,1.7464224384659417
449,449,"I have to tell someone about this because I'm at home alone with my 2 year old and 11 month old, and they're to young to understand my best dad joke ever.",05-18-2020 09:18:42,12514,0.98,1.0,1.7361190612478534
450,450,"In an alternate universe, Hercules was a girl.",10-31-2020 09:37:21,12507,0.97,0.6,1.732112192329708
451,451,"While at a restaurant, the waitress was totally flirting with me with my wife present. After she walked away, my wife said “She obviously has COVID!” “Why would you think that?” I asked.",01-13-2021 06:49:56,12506,0.94,1.0,1.7315397824842587
452,452,SCUBA is an acronym for Self Contained Underwater Breathing Apparatus. What you may not know is that Tuba is also an acronym...,04-11-2020 19:39:50,12499,0.96,0.8,1.7275329135661133
453,453,I’ve been saying “mucho” to my Spanish friend a lot more often lately,05-26-2020 07:43:23,12498,0.97,1.0,1.726960503720664
454,454,What did the pirate say on his 80th birthday?,06-26-2018 05:36:06,12461,0.92,0.8,1.7057813394390384
455,455,"If you commit 90 sins, you will get caught about half the time.",02-25-2020 06:21:53,12455,0.92,1.0,1.7023468803663424
456,456,"I hear it's easy to get ladies not to eat Tide pods. It's more difficult to deter gents, though.",01-21-2018 13:13:25,12426,0.89,1.2,1.6857469948483115
457,457,"My wife said that this subreddit was full of stupid, unfunny puns...",02-18-2019 20:09:11,12427,0.85,0.8,1.6863194046937606
458,458,"Jeff, a semi colon, and an Oxford comma walk into a bar.",12-09-2020 07:37:13,12412,0.96,1.2,1.6777332570120207
459,459,What's a thousand times better than Instagram?,01-10-2020 12:36:23,12402,0.95,0.8,1.6720091585575272
460,460,"A man in an interrogation room says, “I’m not saying a word without my lawyer present!"" The cop growls, ""You ARE the lawyer!""",06-09-2019 06:56:01,12356,0.94,0.8,1.6456783056668576
461,461,When people think of calculators they think the buttons are the most important thing,04-23-2020 05:58:03,12359,0.97,0.8,1.6473955352032055
462,462,"I hate those people who knock on your door and tell you you need to get ""saved"" or you'll ""burn""..",05-18-2018 06:10:23,12351,0.93,0.8,1.6428162564396107
463,463,"Justice is a dish best served cold, if it were served warm jt would be justwater.",06-26-2019 07:17:32,12332,0.93,0.8,1.6319404693760733
464,464,I've got this awful disease where I can't stop telling airport jokes.,08-21-2019 11:48:27,12318,0.96,1.0,1.6239267315397825
465,465,I just read that someone in London gets stabbed every 52 seconds.,12-18-2020 10:05:16,12311,0.97,0.8,1.6199198626216371
466,466,"I gave my daughter a watch for her birthday. She thought it was so cool and when she showed it to the next door neighbor, he asked, ""That's a pretty watch you've got there! Does it tell you the time?""",08-22-2019 05:30:26,12305,0.96,0.8,1.616485403548941
467,467,What do you call a fear of giants?,10-06-2020 04:09:52,12301,0.97,1.0,1.6141957641671436
468,468,Why Is Dark Spelled With A K and Not A C,07-26-2019 16:13:35,12294,0.89,0.8,1.6101888952489982
469,469,The first computer dates back to Adam and Eve.,12-16-2018 12:28:55,12284,0.92,0.6,1.604464796794505
470,470,Seems a little inappropriate having a strip club across the road from Mini golf in town. I’m a pretty liberal guy but if I’m having a day out with my family the last thing I want to look across the road and see is a bunch of losers playing mini golf.,05-07-2019 15:48:52,12289,0.91,1.2,1.6073268460217516
471,471,"Ever since the pandemic started, every morning I proudly announce to my family that I’m going for a jog and then I don’t...",05-27-2020 06:23:06,12289,0.98,1.2,1.6073268460217516
472,472,My wife told me to stop acting like a flamingo.,08-25-2020 10:58:33,12275,0.97,1.2,1.5993131081854608
473,473,"If pronouncing all my ""V""s like ""B""s, makes me sound Russian...",09-13-2020 19:41:49,12267,0.91,0.8,1.594733829421866
474,474,What do you call the thing which ruins the ending of a movie?,01-13-2019 09:42:44,12253,0.94,0.6,1.5867200915855753
475,475,"My dad banned me from saying ""Hell"", so I asked: ""Have you thought of any alternative names for hell?""",09-18-2018 10:52:17,12232,0.88,1.0,1.574699484831139
476,476,"Three boys go into a haunted house. One brought a knife, one brought a gun and one brought some cough drops",08-04-2020 22:37:45,12238,0.95,1.2,1.578133943903835
477,477,What did the pirate say when he turned 80?,10-21-2020 21:15:07,12237,0.95,0.8,1.5775615340583857
478,478,What do you call an instagram celeb who got Corona?,03-02-2020 05:57:52,12234,0.94,1.2,1.5758443045220378
479,479,"My wife tells me I have 2 major faults,",11-28-2020 01:03:26,12217,0.97,0.8,1.566113337149399
480,480,Chris: Hey can I borrow a ten?,06-15-2019 15:38:35,12213,0.96,1.2,1.5638236977676017
481,481,My son asked if I could tell him what a solar eclipse is,05-03-2020 03:46:06,12202,0.95,0.8,1.5575271894676588
482,482,"Mahatma Ghandi, as you know, walked barefoot most of the time, which produced an incredible set of callouses on his feet. He also ate very little, which made him rather frail. Plus, with his odd diet, he suffered from bad breath.",07-08-2019 10:24:06,12192,0.88,1.0,1.5518030910131655
483,483,Why couldn't the green pepper practice archery?,08-31-2020 12:36:49,12186,0.94,1.0,1.5483686319404695
484,484,I have a friend with no social skills and a Ph.D in the history of palindromes.,11-20-2020 02:46:38,12191,0.97,0.8,1.5512306811677161
485,485,If I had a nickel every time I was confused,03-26-2020 23:35:21,12190,0.95,0.8,1.5506582713222667
486,486,"When I was younger, I felt like a man trapped in a woman's body ...",05-21-2019 17:59:40,12181,0.93,0.8,1.5455065827132226
487,487,"A Kung Fu student asks his teacher, ""Master, why does my ability not improve? I'm always defeated."" And the master, pensive and forever patient, answers, ""My dear pupil, have you seen the gulls flying by the setting sun and their wings seeming like flames?""",01-10-2021 06:39:36,12176,0.94,1.0,1.542644533485976
488,488,What do you get when you eat 3.14 cakes?,06-18-2020 11:17:23,12179,0.92,1.0,1.544361763022324
489,489,We have a strict hierarchy policy for PPE usage at my office...,07-13-2020 09:02:22,12176,0.97,1.0,1.542644533485976
490,490,"My deaf girlfriend just told me, “We need to talk.”",03-10-2021 06:50:45,12171,0.97,1.0,1.5397824842587293
491,491,What is the least spoken language in the world?,09-20-2017 11:16:56,12165,0.96,0.6,1.5363480251860333
492,492,Today I learnt that humans eat more bananas than monkeys,04-13-2020 09:49:20,12165,0.97,1.2,1.5363480251860333
493,493,"My son asks me, ""What does gay mean?""",04-25-2019 18:49:14,12168,0.91,1.2,1.5380652547223812
494,494,Doctor: Your brain seems to have deleted all information about 80s music!,06-19-2018 08:51:40,12163,0.94,1.2,1.5352032054951346
495,495,I told my parents I was bisexual,04-11-2021 16:27:10,12160,0.83,1.4,1.5334859759587864
496,496,What is Yoda’s last name?,06-28-2019 18:08:06,12158,0.93,0.6,1.532341156267888
497,497,Why is Pavlov's hair so soft?,07-18-2020 21:35:22,12137,0.97,1.4,1.5203205495134515
498,498,"My wife to our son, ""Go brush your teeth with your sister""",10-20-2019 10:45:32,12122,0.96,1.4,1.5117344018317116
499,499,Dad jokes are the best and here's why,07-27-2019 07:43:36,12111,0.95,1.0,1.5054378935317687
500,500,"What starts with T, ends with T, and is full of T?",09-27-2020 09:45:50,12102,0.89,0.8,1.5002862049227246
501,501,"My missus asked Siri. ""Surely it's not going to rain today?""",10-03-2019 19:34:14,12101,0.93,0.6,1.4997137950772754
502,502,My wife told me I was terrible with directions,03-08-2019 09:33:43,12083,0.96,0.8,1.4894104178591872
503,503,"My daughter, 8, asked me what happens to frogs who illegally park their cars.",10-23-2018 18:11:29,12083,0.94,1.2,1.4894104178591872
504,504,Why do some people post long jokes here?,01-24-2019 13:53:01,12067,0.96,1.0,1.4802518603319976
505,505,Shout out to the people asking what the opposite of in is.,11-06-2019 17:39:29,12047,0.92,0.8,1.4688036634230108
506,506,"When you're in California, make sure your mechanic uses a state flag to check your oil.",08-26-2019 09:09:33,12040,0.91,1.0,1.4647967945048654
507,507,"So proud of my 6 year old. While teaching her to hit a softball, I told her to “square up on the ball”",06-23-2020 08:01:38,12038,0.97,1.0,1.4636519748139667
508,508,"(Warning: Morbid dad joke) True Story -- My family were planning my mum's funeral. We always try to keep things light and try to stay positive, just as Mum would have it...",05-12-2021 02:36:40,12037,0.96,0.6,1.4630795649685175
509,509,English puns make me feel numb,03-14-2020 08:05:36,12028,0.96,0.8,1.4579278763594734
510,510,Did you know there’s no official training for a garbage collector?,08-06-2019 08:12:38,12019,0.97,1.0,1.4527761877504293
511,511,What is the least spoken language in the world?,09-26-2018 06:51:43,12014,0.94,0.6,1.4499141385231826
512,512,"My wife asked me, “Why don’t you treat me like you did when we were first dating!?”",07-02-2020 07:01:12,12000,0.97,1.0,1.4419004006868918
513,513,"A lumberjack went in to a magic forest to cut a tree. Upon arrival, he started to swing at the tree, when it shouted, “Wait! I’m a talking tree!""",06-09-2018 06:28:27,11997,0.94,1.0,1.4401831711505437
514,514,I angered two people today by calling them hipsters...,01-19-2019 04:14:29,11997,0.95,1.4,1.4401831711505437
515,515,[NSFW] What do you get if you mix human dna and whale dna?,02-04-2021 00:51:29,11987,0.95,1.2,1.4344590726960504
516,516,"If you become seriously depressed, try drinking a gallon of water just before you go to bed.",01-28-2021 13:48:08,11978,0.97,1.2,1.4293073840870063
517,517,The first photograph of a black hole was released,04-10-2019 13:02:43,11964,0.95,0.6,1.4212936462507155
518,518,Why did The Joker have to sleep with his lights on?,07-28-2020 18:50:43,11969,0.94,1.4,1.4241556954779622
519,519,I hate telling people I'm a taxidermist.,03-10-2020 09:31:52,11965,0.97,1.0,1.421866056096165
520,520,I think my wife is secretly putting glue on my antique weapon collection.,03-09-2019 01:22:40,11949,0.96,0.8,1.4127074985689754
521,521,"As we were driving down the road, ""Sweet Caroline"" came on the radio. I said to my son, ""Little known fact, Neil Diamond used to be called Neil Coal.""",02-28-2019 05:23:44,11933,0.94,0.6,1.4035489410417858
522,522,A teenage boy is getting ready to take his girlfriend to the prom...,04-25-2018 09:26:12,11942,0.89,1.2,1.40870062965083
523,523,My father’s name is Lee. My name is Riley.,02-07-2019 19:36:40,11914,0.92,0.6,1.3926731539782484
524,524,"""Dad, how do you cast spells?""",02-09-2020 05:36:50,11904,0.97,0.8,1.386949055523755
525,525,"My friend said, “You have a BA, Masters and a Ph.D., but you still act like an idiot.”",04-22-2018 07:52:14,11893,0.92,0.8,1.3806525472238123
526,526,I used to get heartburn whenever I ate birthday cake...,05-24-2020 06:43:07,11890,0.93,1.2,1.3789353176874641
527,527,How come no one at the kings table laughed when he farted?,01-09-2020 22:05:07,11879,0.96,1.2,1.3726388093875215
528,528,What do we want? Low flying airplane noises,11-21-2018 13:51:48,11871,0.91,0.8,1.3680595306239267
529,529,"Last Thursday my son was moping around and I told him, if you think Thursdays are sad, just wait two more days. He asked why?",07-28-2020 06:03:57,11856,0.97,0.8,1.3594733829421866
530,530,The person who invented autocorrect should burn in hello.,09-30-2019 16:37:05,11864,0.93,1.0,1.3640526617057813
531,531,My wife left me because I'm insecure.,01-09-2021 19:02:45,11854,0.94,1.0,1.3583285632512878
532,532,I have been reading some history on the French revolution and found out what happened to Louis XVI's head,07-27-2020 16:42:13,11862,0.96,0.6,1.3629078420148826
533,533,"My boss said, “I find it highly suspicious that you are only sick on weekdays.”",09-28-2020 11:54:27,11863,0.98,1.2,1.363480251860332
534,534,I met some chess players in the hotel lobby. They were bragging about how good they are.,03-29-2018 06:51:17,11843,0.92,0.8,1.3520320549513452
535,535,My wife said to me: ''Why don't you treat me like you did when we were first dating?'',03-04-2020 16:22:51,11823,0.93,1.0,1.3405838580423584
536,536,How does a train eat?,10-28-2020 05:37:59,11823,0.95,1.0,1.3405838580423584
537,537,What do you call a line of men waiting to get haircuts?,11-24-2020 07:36:32,11823,0.98,1.6,1.3405838580423584
538,538,what do you call a communist sniper,07-24-2020 15:56:21,11817,0.97,0.6,1.3371493989696623
539,539,[NSFW] How do you find a blind man at a nude beach?,01-16-2020 07:38:49,11797,0.93,1.4,1.3257012020606755
540,540,Looks like October is...,11-01-2017 06:42:43,11790,0.89,0.6,1.3216943331425302
541,541,My 11yo daughter just made up a joke. What do politicians thing of themselves?,03-04-2020 04:57:03,11777,0.89,0.8,1.3142530051516885
542,542,"4 men were sitting in a boat about to smoke a cigarette, when they realized they didn't have a cigarette lighter.",09-26-2020 06:43:25,11774,0.95,0.8,1.3125357756153406
543,543,How much does Santa pay to park his sleigh?,12-22-2020 22:04:58,11772,0.97,1.4,1.3113909559244419
544,544,I bought a new pair of gloves today...,06-06-2020 01:36:07,11770,0.95,1.0,1.3102461362335431
545,545,My girlfriend is turning 32 soon...,01-05-2019 18:23:37,11762,0.78,1.0,1.3056668574699486
546,546,"""Hey dad, what does gay mean?"" The boy asked his dad",12-01-2018 09:41:43,11754,0.91,1.0,1.3010875787063538
547,547,Where do mansplainers get their water?,10-11-2020 05:21:42,11747,0.93,1.0,1.2970807097882084
548,548,From my 7yr old daughter: Why was the pig covered in ink?,02-06-2021 09:25:49,11744,0.97,1.0,1.2953634802518603
549,549,My girlfriend got mad at me for being lazy,07-21-2020 10:04:26,11737,0.94,1.2,1.291356611333715
550,550,I don’t usually tell dad jokes.,07-23-2020 17:02:24,11731,0.92,1.0,1.287922152261019
551,551,"In a recent poll, 80% of people in America said they would not open their homes to a sentient water basin that walked up to their door and asked for shelter.",11-06-2018 08:39:28,11713,0.92,1.0,1.2776187750429306
552,552,Bill and Melinda Gates got divorced. Melinda got the house...,05-05-2021 08:29:17,11696,0.93,0.8,1.267887807670292
553,553,Why can pirates never finish the alphabet?,10-12-2020 11:54:08,11685,0.97,1.0,1.261591299370349
554,554,I told my wife I'll never vaccinate our kids,03-20-2019 13:28:19,11678,0.86,1.4,1.2575844304522037
555,555,My wife: You need to do more chores around the house.,12-01-2020 07:59:59,11683,0.98,1.2,1.2604464796794506
556,556,"My wife asked me ""what starts with f and ends with k""",04-27-2019 19:11:12,11674,0.95,0.8,1.2552947910704064
557,557,There's a fine line between a numerator and a denominator,04-01-2020 07:51:06,11654,0.96,0.6,1.2438465941614196
558,558,What kind of a prize do you give someone who hasn't moved a muscle in a year?,06-04-2020 22:03:16,11655,0.97,1.0,1.244419004006869
559,559,The deaf girl didn’t show up to her court case yesterday,07-18-2020 07:30:32,11646,0.97,1.0,1.2392673153978249
560,560,"A rope walks into a bar. The bartender looks up and says says, “Get out. We don’t serve rope in here.” So the rope goes out, cuts itself in two before tying the two sections together. It then pulls out a comb and combs its ends. The rope then walks back into the bar.",05-26-2020 21:34:15,11628,0.92,1.0,1.2289639381797366
561,561,"A wife asks her husband, ""Could you please go shopping for me and buy one carton of milk and if they have avocados, get 6.",08-01-2019 20:04:45,11603,0.86,1.4,1.2146536920435032
562,562,What’s the 9 letters of the pirate alphabet? (CORNY ALERT),05-03-2019 20:52:44,11597,0.9,0.8,1.2112192329708071
563,563,Got my first tattoo today,02-13-2019 21:11:34,11596,0.94,1.2,1.2106468231253578
564,564,How much do dumplings weigh?,05-29-2020 21:48:24,11594,0.97,1.2,1.209502003434459
565,565,My girlfriend started lying to me because of all my bad jokes.,10-28-2018 09:45:57,11588,0.91,1.0,1.206067544361763
566,566,I accidentally sprayed deodorant in my mouth,01-01-2021 11:59:01,11584,0.97,1.2,1.2037779049799657
567,567,"My husband: ""Look at this mind-blowing machine I found in the bathroom!""",07-05-2019 17:50:27,11584,0.97,1.2,1.2037779049799657
568,568,How do you get a farm girl to like you?,02-26-2021 14:10:10,11573,0.98,1.0,1.1974813966800228
569,569,"Went to GameStop to use the bathroom, but it was out of order...",01-29-2021 20:53:25,11578,0.96,1.2,1.2003434459072697
570,570,"If you have ever get locked out of your house, talk to your lock calmly",01-12-2021 03:02:47,11572,0.96,0.8,1.1969089868345735
571,571,How do you get a Redditor to open a post?,06-01-2019 17:32:23,11568,0.9,1.0,1.1946193474527762
572,572,Is this sub still active?,12-31-2018 06:00:00,11544,0.93,0.6,1.180881511161992
573,573,Semi NSFW! I was sitting on the toilet while my wife was in the bathtub next to me...,01-04-2021 01:16:05,11526,0.95,1.0,1.1705781339439039
574,574,"If Dwayne Johnson had downstairs neighbors, they would be clueless about just about everything.",10-31-2020 00:23:18,11521,0.98,1.0,1.1677160847166572
575,575,I hear coronavirus porn is trending.,03-09-2020 20:20:25,11527,0.86,1.0,1.1711505437893532
576,576,I think it’s weird that we call childbirth delivery.,09-15-2019 08:09:20,11519,0.97,1.0,1.1665712650257585
577,577,I was wondering why Music was coming from my printer..,04-02-2020 07:31:36,11513,0.98,0.8,1.1631368059530625
578,578,"We were eating dinner tonight, when my daughter said to me, “I see your glass is empty. Would you like another one?”",10-16-2017 06:41:32,11511,0.93,1.0,1.1619919862621637
579,579,"My son asked: “Dad, have you seen my sunglasses?”",08-17-2020 04:04:55,11517,0.97,1.2,1.1654264453348597
580,580,Is my wife dissatisfied with my body?,09-29-2020 13:58:29,11516,0.98,1.2,1.1648540354894104
581,581,"Right after being born, my newborn daughter wouldn't ""latch"" for her first feeding. So after 27-plus hours of labor and four hours of pushing, I looked at my poor, exhausted wife and said, ""Looks like she's... resisting abreast.""",01-09-2019 13:51:13,11507,0.95,1.0,1.1597023468803664
582,582,The wedding was so touching that,11-01-2020 08:49:55,11504,0.96,0.6,1.1579851173440183
583,583,I get depressed if I don’t play video games.,05-13-2020 07:05:18,11504,0.96,1.0,1.1579851173440183
584,584,"My wife said ""nothing rhymes with orange""",08-16-2018 19:49:50,11495,0.9,1.0,1.1528334287349742
585,585,John Travolta tested negative for coronavirus last night,03-15-2020 09:48:00,11497,0.92,1.2,1.153978248425873
586,586,"A horse walks into a bar. The bartender says ""You are in here a lot, do you think you have a drinking problem?""",09-04-2020 23:25:09,11493,0.92,1.2,1.1516886090440757
587,587,No more Suez Canal jokes!,03-29-2021 13:36:43,11482,0.94,1.2,1.1453921007441328
588,588,What’s the difference between Dubai and Abu Dhabi,12-19-2019 07:59:41,11478,0.94,0.6,1.1431024613623355
589,589,Who led the Jewish people across a semi permeable membrane?,11-02-2019 08:23:54,11471,0.96,0.8,1.1390955924441901
590,590,r/coronavirus is officially the fastest-growing community on Reddit,03-19-2020 18:11:33,11455,0.91,0.8,1.1299370349170006
591,591,The first computer dates back to Adam and Eve.,12-17-2020 21:36:14,11456,0.94,0.6,1.13050944476245
592,592,My son asked me what an updog was.,03-19-2019 22:15:31,11449,0.96,1.2,1.1265025758443046
593,593,I don’t get any of these dad jokes in this community!!!!,04-26-2020 09:20:05,11445,0.94,1.2,1.124212936462507
594,594,"To all the members of this subreddit, an open letter:",01-14-2021 08:11:23,11432,0.96,0.6,1.1167716084716657
595,595,"My buddy went bald years ago, but still carries around an old comb with him.",01-07-2019 09:14:54,11422,0.95,1.0,1.1110475100171724
596,596,To the person who stole my spectacles. I will find you.,09-17-2020 04:59:27,11407,0.98,0.8,1.1024613623354322
597,597,I once debated a flat earther. He got so mad he stormed off saying he would walk to the edge of the earth to prove me wrong.,02-11-2021 17:20:51,11394,0.95,0.8,1.0950200343445908
598,598,Who was the Greek god of cleavage?,08-14-2020 21:24:01,11394,0.95,1.2,1.0950200343445908
599,599,"If number 666 is evil,then 25.8069758011 is the root of all evil.",04-03-2018 13:50:23,11393,0.9,0.4,1.0944476244991415
600,600,Cop: I’m arresting you for illegally downloading the entire Wikipedia!,04-26-2019 06:30:21,11384,0.97,1.2,1.0892959358900973
601,601,"Seven has ""even"" in it.",02-14-2020 12:45:27,11366,0.95,0.8,1.078992558672009
602,602,How does two German car enthusiast cowboys greet each other?,07-12-2020 07:48:58,11361,0.94,1.2,1.0761305094447624
603,603,Bill Gates meets Arnold Schwarzenneger at a party and asks him if he's upgraded to Windows 10 yet? Big Arnie replies.......,03-22-2021 06:32:13,11355,0.96,0.8,1.0726960503720664
604,604,"As a new language, Braille is not that difficult to learn.",04-23-2020 22:55:35,11352,0.96,0.6,1.0709788208357183
605,605,My drunk friend was kicked out of Karaoke for singing “Danger Zone” 7 times in a row.,05-27-2018 13:52:11,11357,0.92,1.2,1.0738408700629651
606,606,My wife and I just found out she's pregnant with our first child.,02-29-2020 22:51:01,11323,0.93,1.2,1.0543789353176876
607,607,"I became a father today, but no dad jokes are coming to me. I’m pretty bummed.",06-24-2020 17:19:13,11320,0.93,1.2,1.0526617057813394
608,608,It FINALLY happened.,04-20-2021 02:02:15,11308,0.98,0.4,1.0457927876359474
609,609,I used to be the triangle player in a Jamaican band but I had to quit....,11-12-2020 14:34:42,11307,0.97,0.8,1.045220377790498
610,610,David Hasselhoff walked into a bar and ordered a drink.,08-01-2020 10:03:50,11297,0.98,1.2,1.0394962793360045
611,611,I went to the shooting range for the first time and couldn’t get my gun to fire.,04-28-2019 08:44:24,11290,0.96,0.4,1.0354894104178591
612,612,Today I learned that if you're in a canoe and it flips over in water...,02-23-2021 05:59:56,11287,0.95,0.8,1.0337721808815112
613,613,You ever heard the Stormtrooper band?,12-06-2020 22:28:43,11287,0.96,0.8,1.0337721808815112
614,614,"My wife said, “Why don’t you write a book instead of your stupid word play jokes?”",07-26-2020 06:57:56,11286,0.98,1.0,1.0331997710360619
615,615,A platypus walks into a bar owned by a duck.,11-06-2020 19:07:17,11286,0.95,1.2,1.0331997710360619
616,616,A woman goes to her boyfriend's parents' house for dinner. This is her first time meeting the family and she is very nervous. *long* (NSFW),05-11-2021 00:55:38,11270,0.93,0.8,1.0240412135088723
617,617,Broke ny finger today,12-06-2020 05:57:46,11272,0.94,1.2,1.025186033199771
618,618,The urge to sing “The Lion Sleeps Tonight” is always just a whim away...,04-15-2021 19:30:02,11269,0.9,1.0,1.023468803663423
619,619,What happens if the average number of bullies at a school goes up?,09-07-2018 14:54:01,11267,0.95,0.8,1.0223239839725242
620,620,My brother and I laugh at how competitive we were as kids.,05-12-2020 15:52:02,11264,0.97,0.8,1.0206067544361763
621,621,"I don’t want to sound racist, but...",12-22-2018 10:57:14,11263,0.94,0.6,1.020034344590727
622,622,"One night, a Viking called Rudolph the red was looking out of his window when he suddenly said ""It's going to rain"". His wife asked ""how do you know?""",12-08-2018 09:40:31,11257,0.89,1.0,1.016599885518031
623,623,My friend is obsessed with taking blurry pictures of himself while taking a shower.,02-07-2019 07:04:08,11252,0.94,1.4,1.0137378362907843
624,624,My mailman got a sex change.,09-19-2018 07:38:03,11242,0.91,1.6,1.0080137378362908
625,625,"The school phoned me today and said, ""Your son's has been telling lies. """,02-01-2021 12:26:00,11246,0.97,0.6,1.010303377218088
626,626,Apparently nobody knows why Notre Dame caught fire....,04-15-2019 19:22:32,11233,0.92,0.6,1.0028620492272466
627,627,What do you call a paper airplane that can't fly?,12-28-2020 18:58:37,11225,0.98,0.8,0.998282770463652
628,628,"Got my sisters whole family with my dumb owl joke, with a bonus follow up groaner",01-04-2021 22:58:13,11211,0.98,1.2,0.9902690326273612
629,629,My 3 year old's first joke,06-02-2020 02:53:15,11210,0.97,1.2,0.9896966227819118
630,630,"I gave my daughter a watch for her birthday. She thought it was so cool and when she showed it to the next door neighbor, he asked, ""That's a pretty watch you've got there! Does it tell you the time?""",03-19-2021 07:18:10,11198,0.97,0.8,0.9828277046365197
631,631,"If you’ve heard of Murphy’s law, which is that anything that can go wrong will go wrong, then have you heard of Cole’s law?",06-27-2019 00:53:43,11194,0.92,0.6,0.9805380652547224
632,632,I've decided to marry a pencil.,06-28-2020 08:56:08,11186,0.96,1.2,0.9759587864911277
633,633,Where do crayons go for vacation?,02-10-2019 09:56:25,11183,0.94,1.2,0.9742415569547797
634,634,My wife is threatening to leave me because I’m addicted to wearing a new T-shirt every half an hour.,04-24-2019 06:27:43,11172,0.94,1.4,0.9679450486548369
635,635,If a plant is sad.Do other plants photosympathise with it?,11-07-2019 08:10:10,11171,0.96,0.8,0.9673726388093875
636,636,"A friend of mine went bald years ago, but still carries around an old comb.",11-18-2020 21:10:46,11159,0.98,0.8,0.9605037206639955
