,idx,title,created_utc,score,upvote_ratio,humor_scores,normalized_scores
637,637,What does a clock do when it’s hungry?,06-28-2020 22:15:19,11163,0.96,0.8,0.9627933600457927
638,638,"When I caught my neighbor attaching a rocket engine to a deer, I immediately reported him to the authorities.",03-29-2020 08:56:25,11158,0.97,1.0,0.9599313108185461
639,639,I’m reading a horror book in Braille.,05-31-2020 10:18:21,11149,0.97,0.6,0.954779622209502
640,640,Many French guillotine victims had their heads,12-11-2019 08:29:11,11139,0.94,0.8,0.9490555237550086
641,641,"My son asked, ""Dad, every time I talk to girls, I get butterflies in my stomach! What should I do?!"" I gently put my arm around him and replied, ""That's easy son...""",08-03-2020 06:09:09,11132,0.94,1.0,0.9450486548368632
642,642,My daughter really changed a lot after becoming a vegan.,05-18-2020 02:21:35,11131,0.96,1.0,0.9444762449914138
643,643,"As I put my car in reverse, I thought to myself...",01-03-2021 06:28:41,11114,0.96,0.4,0.934745277618775
644,644,I'm so proud. My 12-year old told this joke during dinner: What degree does Dr. Pepper have?,04-30-2021 10:21:18,11106,0.97,1.2,0.9301659988551803
645,645,What do you call something that explodes at -273.15 degrees Celsius?,11-27-2019 18:19:53,11114,0.9,0.6,0.934745277618775
646,646,The Fast and The Furious 10 title should be dedicated to Paul Walker,03-18-2019 10:09:58,11102,0.91,0.6,0.927876359473383
647,647,My deaf girlfriend was talking in her sleep last night.,09-17-2019 12:23:24,11104,0.98,1.0,0.9290211791642816
648,648,"People always ask where I got my incredibly detailed tattoo done, but they never believe me when I tell them Spain.",05-15-2019 06:29:06,11091,0.9,0.8,0.9215798511734402
649,649,Why should you be worried if you see cows smoking marijuana?,05-07-2020 20:07:42,11082,0.96,1.6,0.9164281625643961
650,650,"I just had an half hour argument with my 5 year old about the importance of wearing pants in public, and she won.",12-21-2018 06:54:10,11074,0.95,1.6,0.9118488838008014
651,651,What is blue and doesn't weigh much?,12-20-2019 09:09:10,11071,0.95,0.8,0.9101316542644533
652,652,I often worry about German sausages,08-23-2020 06:12:16,11071,0.97,1.2,0.9101316542644533
653,653,"I won the ""Most Secretive Guy"" award in our office today.",07-25-2020 17:27:58,11065,0.97,1.2,0.9066971951917573
654,654,My wife gave me an ultimatum. It was either her or my addiction to sweets.,01-31-2021 09:51:25,11054,0.97,1.0,0.9004006868918145
655,655,Some woman came up to me today and said she knew me from a vegan group,07-11-2020 02:31:18,11050,0.97,1.2,0.8981110475100171
656,656,Some people aren't shaking hands because of the Coronavirus.,03-09-2020 05:38:22,11040,0.96,1.2,0.8923869490555237
657,657,Went to the store to get eight cans of sprite...,02-19-2020 09:19:57,11037,0.97,1.2,0.8906697195191757
658,658,My stoner friend used my daily agenda notebook to roll up a joint.,03-30-2018 06:57:41,11038,0.94,1.2,0.8912421293646251
659,659,"A sheep, a drum, and a snake fall off a cliff...",05-08-2020 10:24:03,11031,0.94,0.8,0.8872352604464797
660,660,"What starts with an E and ends with an E, but often only has one letter?",12-31-2017 07:27:13,11026,0.93,0.4,0.884373211219233
661,661,"Do you remember when you were a kid and whenever you cried, your parents would say, “I’ll give you a reason to cry!?""",02-18-2018 06:33:09,11013,0.73,0.8,0.8769318832283916
662,662,My wife just accused me of having zero empathy.,10-12-2019 22:21:42,11014,0.97,1.0,0.8775042930738409
663,663,My dad literally just said this to me.,05-27-2021 13:33:55,11005,0.96,0.6,0.8723526044647968
664,664,I was addicted to soap once.,05-06-2020 23:54:47,11001,0.97,1.0,0.8700629650829994
665,665,nothing tops a plain pizza,05-02-2019 09:01:14,10993,0.96,1.0,0.8654836863194046
666,666,"Boss: ""How good are you at PowerPoint?"" - Me: ""I Excel at it."" - Boss: ""Was that a Microsoft Office pun?""",11-12-2019 11:27:22,10990,0.87,0.8,0.8637664567830566
667,667,Instead of a swear jar I have a negativity jar. Everytime I have a pessimistic thought I put a dollar in it.,03-03-2021 07:50:50,10966,0.99,0.8,0.8500286204922725
668,668,My sister bet me $15 that i couldn't build a car out of spaghetti.,05-09-2019 12:32:51,10959,0.92,1.6,0.8460217515741271
669,669,"My wife said, ""You act like a detective too much, I want to split up.""",05-30-2020 21:24:47,10937,0.96,1.0,0.8334287349742415
670,670,What do you call a magician who loses his magic?,03-11-2021 19:43:11,10931,0.97,0.8,0.8299942759015455
671,671,I’m trying to convince my wife that I want a Segway for my birthday.,07-31-2019 09:46:31,10932,0.96,1.4,0.8305666857469949
672,672,I gave up my seat to a blind person on the bus.,04-05-2021 05:52:15,10925,0.97,0.6,0.8265598168288495
673,673,Doctor to patient do you smoke?,12-04-2020 00:14:40,10936,0.88,1.0,0.8328563251287923
674,674,Atheism is a non-prophet organization.,11-12-2018 15:09:26,10931,0.93,0.6,0.8299942759015455
675,675,"After being holed up in the house due to Covid, my wife has started having this weird nightmare that our house is made of celery.",10-03-2020 22:11:14,10915,0.96,1.2,0.8208357183743561
676,676,This year's Fibonacci Convention was a great success.,12-12-2020 16:49:21,10922,0.97,0.6,0.8248425872925015
677,677,I saw a pack of gummy worms that said “No artificial flavor.”,04-29-2021 09:23:09,10909,0.96,1.0,0.81740125930166
678,678,[NSFW] I once had sex with a blind girl and she said I have the biggest penis she has ever layed her hands on,09-03-2019 20:46:33,10906,0.94,1.4,0.815684029765312
679,679,Harry Potter can't tell the difference between his cooking pot and his best mate.,11-16-2018 03:46:05,10907,0.94,1.2,0.8162564396107613
680,680,My Himalayan friend has a cow that refuses to stand up.,06-07-2020 08:36:01,10900,0.96,1.4,0.8122495706926159
681,681,It's my 1-year Reddit anniversary,06-27-2020 22:06:47,10900,0.84,0.8,0.8122495706926159
682,682,"My friend worked at the zoo to circumcise elephants, the pay was bad but...",09-05-2020 23:31:25,10889,0.96,1.0,0.8059530623926732
683,683,My doctor friend is addicted to hitting his patients on their knees to check their reflexes.,06-07-2020 22:13:19,10883,0.97,1.2,0.8025186033199772
684,684,"Barack Obama went to a costume party giving his wife a piggyback. Someone asks what he is and says ""I'm a snail!""",01-25-2021 08:10:53,10886,0.95,1.2,0.8042358328563252
685,685,"Genie: ""What’s your first wish?""",02-09-2020 20:08:16,10879,0.96,1.2,0.8002289639381798
686,686,A man walks into a bakery with a salmon under his arm,09-24-2020 21:04:11,10874,0.92,1.2,0.797366914710933
687,687,I taught my four year old son how to use the word abundance in a sentence.,09-16-2018 09:15:54,10874,0.94,0.8,0.797366914710933
688,688,Believing only 12.5% of the Bible,12-10-2019 05:42:25,10867,0.97,0.6,0.7933600457927876
689,689,What do you call a dinosaur that explodes?,03-18-2020 09:32:56,10869,0.97,1.0,0.7945048654836864
690,690,I was kidnapped by mimes once,10-20-2020 07:36:54,10850,0.98,1.0,0.7836290784201488
691,691,My vaccine dad joke failed,01-02-2021 15:13:54,10849,0.96,0.8,0.7830566685746995
692,692,My son asked me for something hard to write on,07-06-2020 22:23:33,10845,0.98,0.8,0.7807670291929021
693,693,What did 50Cent do when he got hungry?,05-17-2020 00:15:10,10839,0.97,1.0,0.7773325701202061
694,694,Why shouldn't you put more than 239 beans in a soup?,04-13-2021 19:15:06,10841,0.96,1.0,0.7784773898111047
695,695,"A priest, an imam and a rabbit walk into a bloodbank.",08-07-2020 17:43:03,10835,0.95,1.0,0.7750429307384087
696,696,"My boss said to me, “You are the worst train operator ever. How many trains have you derailed in the past year?”",01-05-2020 01:42:32,10831,0.97,0.8,0.7727532913566113
697,697,My three favorite things are eating my family and not using commas,03-26-2019 21:49:51,10822,0.92,1.2,0.7676016027475673
698,698,Robin: “The Batmobil isn’t starting!” Batman: “Did you charge the battery?”,10-07-2019 20:30:02,10820,0.92,1.2,0.7664567830566685
699,699,"My wife asked me, “Are you sometimes surprised as to how little people change?”",07-13-2020 22:21:45,10791,0.97,0.8,0.7498568975386377
700,700,My wife just threw away my favourite herb.,06-03-2020 08:06:42,10793,0.94,1.2,0.7510017172295363
701,701,My therapist says that I second guess every decision that I ever make.,03-24-2021 08:02:11,10792,0.97,0.8,0.750429307384087
702,702,What did 2 tell 3 when he saw 6 acting like an idiot?,07-19-2019 21:50:55,10795,0.96,0.8,0.752146536920435
703,703,"When I turned 16, my dad told me it was time to get a job. “When I was your age, my very first job I had I worked with over 500 people under me.”...",07-28-2019 11:33:23,10792,0.97,0.6,0.750429307384087
704,704,A blind person was eating seafood,09-21-2019 11:43:24,10789,0.96,1.0,0.748712077847739
705,705,"A man went to the doctor’s and told him, “I feel like such a failure. All five of my boys want to be valets when they grow up.”",09-17-2020 14:14:21,10786,0.97,1.0,0.746994848311391
706,706,What is the difference between an old bus station and a crab with a boob job?,07-09-2020 07:34:47,10784,0.93,1.0,0.7458500286204923
707,707,Thanks for explaining the word “many” to me.,04-09-2018 17:34:09,10773,0.94,0.6,0.7395535203205496
708,708,I asked my German friend if he knew the square root of 81.,05-24-2021 20:14:13,10779,0.96,0.6,0.7429879793932456
709,709,"Today I insisted that my son had a hole in his shoe. He didn't believe me and kept looking and looking, took it off and inspect it. He yelled ""There is no hole in there at all!""",06-24-2018 18:30:02,10770,0.94,0.8,0.7378362907842015
710,710,"Every day at breakfast, I announce that I’m going for a jog, and then I don’t.",12-31-2019 22:21:28,10763,0.97,1.2,0.733829421866056
711,711,How much does Santa pay to park his sleigh?,12-19-2019 20:56:30,10767,0.98,1.4,0.7361190612478534
712,712,"There’s big penises and there’s small penises, but the best penis of all...",07-01-2019 17:24:57,10769,0.95,1.4,0.7372638809387522
713,713,I know a lot of you are sad because it’s a Monday.,10-22-2018 11:11:05,10769,0.96,0.6,0.7372638809387522
714,714,"""Why didn't Elsa see a doctor for her sore throat and cough? Because a cold never bothered her anyway!"" My youngest son thought of that all by himself!",04-27-2020 05:58:35,10762,0.95,0.8,0.7332570120206068
715,715,I always thought it would be difficult to have erectile dysfunction.,06-12-2020 11:22:08,10750,0.95,1.0,0.7263880938752146
716,716,I finally realized why trees don’t have teeth.,09-26-2020 21:00:03,10745,0.97,0.8,0.723526044647968
717,717,"My wife said, ""Nothing rhymes with orange""",03-31-2019 11:40:02,10739,0.9,1.0,0.7200915855752719
718,718,Never do Meth without tea,04-26-2021 20:57:55,10746,0.94,1.4,0.7240984544934173
719,719,What do you say to a woman who has given birth to members of the military?,07-23-2020 03:17:15,10731,0.95,1.2,0.7155123068116772
720,720,"Been a dad 5 mo, so I’m a little new to this... Hit my wife with this one tonight at dinner.",07-08-2019 21:29:14,10721,0.97,1.2,0.7097882083571837
721,721,A small meteorite is reportedly headed for Legoland,05-05-2020 09:17:33,10712,0.95,0.6,0.7046365197481397
722,722,"A weasel walks into a bar. The bartender says, ""Wow, I've never served a weasel before. What can i get you?""",02-06-2019 10:51:01,10709,0.96,1.2,0.7029192902117917
723,723,"[Driving] My wife: Hey, you missed a right.",09-26-2019 12:17:14,10713,0.96,0.8,0.705208929593589
724,724,How much sex does a person who likes both men and women have?,02-11-2020 23:00:48,10709,0.94,1.2,0.7029192902117917
725,725,"True story: I was a kid, watching TV in our living room. My dad was outside using the grill. All of a sudden he bursts in the door hopping on one foot yelling “I stepped on a Bee!”",03-07-2021 13:10:32,10713,0.97,1.2,0.705208929593589
726,726,"I finally bought the limited edition Thesaurus from Amazon that I've always wanted. When I opened it, all the pages were blank.",12-11-2016 05:26:35,10710,0.92,0.6,0.7034917000572409
727,727,Why can't your nose be 12 inches long?,11-04-2019 14:58:24,10696,0.93,1.2,0.6954779622209502
728,728,"[META] Dad jokes should be clean, not just groan-inducing. That's what makes it a Dad joke, we can tell it to the kids in front of Mom and not get in trouble (other than maybe for the punchline).",10-29-2019 09:16:46,10701,0.95,1.2,0.6983400114481969
729,729,I bet a butcher $20 that he couldn't reach the meat on the top shelf...,12-13-2019 03:50:44,10693,0.96,1.2,0.6937607326846021
730,730,Initially I didn’t believe that my chiropractor was any good.,04-28-2021 06:50:38,10683,0.97,0.8,0.6880366342301087
731,731,What do you get when you combine a porcupine and a turtle?,10-10-2020 19:22:15,10683,0.97,1.2,0.6880366342301087
732,732,"I wrote down the names of everyone I hate on a piece of paper, and my roommate used that to roll his joint.",06-04-2019 06:24:59,10682,0.96,1.0,0.6874642243846594
733,733,My friend is making a lot of easy money by taking pictures of salmon dressed in human clothes.,06-20-2020 23:36:36,10679,0.98,1.2,0.6857469948483114
734,734,"My wife caught me standing on the bathroom scale, sucking in my stomach...",12-03-2016 07:39:08,10675,0.91,1.2,0.683457355466514
735,735,"My dad died on 02/19/18, this joke came to me while signing paperwork at the funeral home...",03-01-2018 11:31:02,10670,0.95,0.8,0.6805953062392673
736,736,It used to be free to fill your car tire up with air. Now it coasts 1.50. You know why?,01-08-2019 11:12:44,10671,0.95,0.8,0.6811677160847167
737,737,I'll tell you what I know about dwarfs,05-27-2020 20:09:50,10663,0.96,1.0,0.676588437321122
738,738,I wasn't expecting to be diagnosed as colour blind.,02-02-2021 07:22:51,10665,0.94,0.8,0.6777332570120206
739,739,"The mountains aren't just funny, they're",07-14-2020 07:49:10,10639,0.97,0.8,0.6628506010303378
740,740,"I saw an ad that read: “TV for sale, $1, volume stuck on full.”",05-26-2021 12:17:58,10623,0.95,0.6,0.6536920435031482
741,741,"My friend keeps saying ""cheer up man it could be worse, you could be stuck underground in a hole full of water."" I know he means well.",10-05-2019 01:36:44,10592,0.97,0.8,0.6359473382942187
742,742,The CEO of IKEA has been elected Prime Minister of Sweden.,05-02-2021 12:45:58,10596,0.96,0.8,0.6382369776760161
743,743,Sir Lance Sir Lance Sir Lance Sir Lance Sir Lance Sir Lance Sir Lance Sir Lance Sir Lance Sir Lance Sir Lance Sir Lance Sir Lance Sir Lance Sir Lance Sir Lance Sir Lance Sir Lance,05-21-2021 17:18:47,10566,0.92,0.6,0.6210646823125358
744,744,I've run out of toilet paper and started using old newspapers instead,04-19-2020 19:15:00,10550,0.97,1.0,0.6119061247853463
745,745,You do realise that Vampires aren't real...,12-02-2020 07:16:21,10551,0.98,0.8,0.6124785346307956
746,746,My wife and I share the same sense of humour.,11-22-2020 15:43:08,10548,0.96,0.8,0.6107613050944476
747,747,"A century ago, two brothers insisted that it was possible to fly ...",01-18-2021 10:00:20,10545,0.97,1.0,0.6090440755580996
748,748,What did Delaware?,02-10-2020 11:28:20,10539,0.94,0.6,0.6056096164854036
749,749,"Two deer walk out of a gay bar. One looks at the other and says ""wow! I can't believe I blew thirty bucks in there""",08-13-2019 09:57:23,10549,0.93,1.4,0.611333714939897
750,750,My wife tripped and dropped the basket of clothes she had just ironed.,01-02-2019 04:45:57,10542,0.96,0.6,0.6073268460217516
751,751,If Mary is the mother of Jesus and Jesus is the lamb of God,02-14-2021 10:39:57,10521,0.95,0.6,0.5953062392673154
752,752,What do you call a chicken looking at a bowl of lettuce,07-11-2020 15:26:33,10517,0.96,1.2,0.593016599885518
753,753,"Regardless of price, Velcro is always a rip off",03-25-2019 11:08:28,10512,0.96,1.2,0.5901545506582713
754,754,"I told my boss, “Sorry I’m late. I was having computer issues.”",11-25-2020 07:06:40,10514,0.98,1.0,0.59129937034917
755,755,"I proudly showed my son, ""Check this out! Bought a new shrub trimmer today!"" He shrugged and replied, ""That's great, dad."" I continued...",08-10-2020 19:28:53,10496,0.98,1.0,0.5809959931310819
756,756,My son asked me what our IP address was.,08-10-2019 14:36:16,10500,0.94,0.6,0.5832856325128792
757,757,The ultimate Dad Joke - Bulgarian Train Man,12-06-2018 12:18:23,10502,0.96,0.8,0.5844304522037779
758,758,TIL: Humans are born with four kidneys.,06-15-2019 07:26:30,10494,0.96,1.0,0.5798511734401832
759,759,What does a presidential candidate who cant get his votes up suffer from?,11-03-2020 23:24:55,10488,0.93,1.0,0.5764167143674871
760,760,"FINALY, my clock-fetish sex tape arrived in the mail...",05-25-2020 21:40:15,10490,0.86,1.2,0.5775615340583858
761,761,"""Have you ever done anything good?"" St. Peter asked a guy when he showed up at the Pearly Gates. ""To protect a young girl I punched the leader of a motorcycle gang, kicked his bike over, and told them all to back off!"" said the man. St. Peter was impressed, ""When did you do this?""",09-22-2019 06:29:38,10479,0.94,0.8,0.5712650257584431
762,762,Having gay parents must be horrible,12-28-2019 00:20:17,10473,0.82,1.4,0.5678305666857469
763,763,"My calculus professor was 16 minutes late to his first class, 8 minutes late to his second, and 4 minutes late to the third.",12-13-2018 09:09:08,10479,0.96,0.8,0.5712650257584431
764,764,What is blue and not heavy?,09-03-2020 20:14:59,10477,0.92,0.6,0.5701202060675443
765,765,How much space will Brexit free up in the European Union?,01-30-2020 03:57:24,10468,0.97,0.8,0.5649685174585003
766,766,"At the parole hearing, the officer asked, ""Tell me, why should you be released early?""",04-28-2019 21:29:50,10465,0.97,0.6,0.5632512879221523
767,767,I adopted a dog from a Blacksmith...,09-16-2019 08:47:48,10460,0.97,1.2,0.5603892386949055
768,768,"I went to a deli and said, I'd like to buy a bagel with cream cheese",03-11-2021 00:13:48,10460,0.97,1.2,0.5603892386949055
769,769,My Wife is freaking out about this coronavirus. She made me promise I'd put the mask on before I left for work this morning......,03-20-2020 18:04:08,10459,0.97,1.0,0.5598168288494562
770,770,It's inappropriate to make a 'dad joke' if you're not a dad.,11-05-2019 15:23:32,10458,0.96,1.0,0.5592444190040069
771,771,My neighbor blamed my gravel for making him fall...,07-24-2020 05:45:10,10438,0.97,0.8,0.54779622209502
772,772,(Monday: Greg) (Tuesday: Ian) (Wednesday: Greg) (Thursday: Ian) (Friday: Greg) (Saturday: Ian) (Sunday: Greg),04-04-2019 01:12:19,10436,0.93,1.0,0.5466514024041214
773,773,Just watched all the Harry Potter movies back to back with a friend,07-29-2020 07:21:39,10431,0.96,1.0,0.5437893531768746
774,774,A guy knocked on my door asking for a donation to build a community swimming pool.,06-19-2020 05:16:07,10433,0.96,1.0,0.5449341728677733
775,775,I can always tell when someone is lying just by looking at them.,09-05-2019 07:53:51,10426,0.98,0.4,0.540927303949628
776,776,If pronouncing my B’s as V’s makes me sound russian...Then soviet.,08-25-2019 03:38:30,10409,0.93,1.0,0.5311963365769892
777,777,If you give an eevee money what does it evolve into?,11-28-2018 16:44:10,10406,0.95,0.6,0.529479107040641
778,778,I just found out that the guy who stole my diary died yesterday.,03-24-2021 21:53:09,10408,0.97,0.4,0.5306239267315398
779,779,Which animal has the biggest breasts,09-28-2020 07:34:57,10387,0.96,1.2,0.5186033199771036
780,780,How Long is a Chinese name.,06-06-2019 08:53:22,10392,0.96,0.6,0.5214653692043503
781,781,What's the difference between Mordor and the Capital?,01-09-2021 08:21:03,10383,0.87,0.6,0.5163136805953062
782,782,My wife says she's divorcing me because of my obsession with television dramas.,01-15-2021 11:07:38,10377,0.96,1.0,0.5128792215226102
783,783,I was on a diabetes awareness website and it asked me if I accept cookies...,01-16-2021 16:03:10,10373,0.97,1.2,0.5105895821408128
784,784,What Sith Lord immobilizes his victims instead of killing them?,09-05-2020 11:02:14,10370,0.97,1.0,0.5088723526044648
785,785,My wife asked me if she's the only one I've been with.,06-30-2020 01:31:24,10349,0.93,1.2,0.4968517458500286
786,786,What does a robot do after sex?,01-16-2021 02:53:14,10349,0.96,1.4,0.4968517458500286
787,787,"A pirate walks into a bar with a paper towel on his head. The bartender says, ""What's with the paper towel?""",11-25-2018 10:48:18,10339,0.94,1.2,0.4911276473955352
788,788,"As a lumberjack, I know that I’ve cut exactly 2,417 trees. I know because every time I cut one, I keep a log.",10-07-2019 07:02:58,10336,0.98,0.8,0.48941041785918715
789,789,"They say one in four people are homosexual, which is weird because I have three best friends, all guys. Makes me wonder which one of us would be gay.",12-24-2018 13:04:30,10337,0.88,1.2,0.4899828277046365
790,790,My wife asked me if I thought our kids were spoiled,04-12-2019 08:15:12,10336,0.98,1.2,0.48941041785918715
791,791,Why do police get to riots early?,09-07-2020 15:52:33,10323,0.92,0.8,0.48196908986834575
792,792,Why do 9 ants get to live in an apartment for free?,07-03-2019 13:49:13,10320,0.96,1.2,0.48025186033199774
793,793,I'm starting a tattoo business. Women who show their breasts get tattooed for free.,07-01-2019 04:00:42,10325,0.9,1.4,0.48311390955924444
794,794,Why do astronauts use linux?,01-27-2021 07:02:29,10311,0.97,1.4,0.47510017172295366
795,795,What do you call a deer with no eyes?,05-02-2021 07:42:51,10312,0.94,1.0,0.475672581568403
796,796,"A police officer says to a couple: ""I'm sorry to tell you this, but your son set the school on fire"".",02-01-2019 21:49:43,10310,0.94,0.6,0.4745277618775043
797,797,"If a group of dolphins is called a pod and a group of crows is called a murder, what is a group of small children called?",03-25-2020 20:41:59,10306,0.94,0.8,0.4722381224957069
798,798,"I watched Bohemian Rhapsody three times in a row, and now I feel a little sick.",03-01-2020 12:54:24,10309,0.94,0.8,0.47395535203205497
799,799,Finally my winter fat has gone...,01-24-2021 08:40:45,10294,0.98,1.0,0.4653692043503148
800,800,"“Doc, I think I might have ADHD, because I can’t remember where I parked my Ford!”",09-19-2019 07:03:32,10290,0.96,0.8,0.46307956496851743
801,801,What I if told you,09-13-2018 11:13:30,10274,0.91,0.4,0.453921007441328
802,802,I am reading a horror story in braille.,11-07-2018 16:27:08,10280,0.95,0.6,0.45735546651402403
803,803,What's the difference between a poorly dressed monkey on a tricycle and a well-dressed monkey on a bicycle?,12-02-2019 04:00:19,10281,0.97,1.2,0.4579278763594734
804,804,You know what they say about cliffhangers..,01-05-2019 04:39:21,10272,0.94,0.6,0.4527761877504293
805,805,I once walked in on my teachers having sex,02-20-2019 07:32:57,10263,0.95,1.4,0.44762449914138525
806,806,If you slap Dwayne Johnsons butt,05-14-2021 07:47:02,10261,0.94,1.6,0.44647967945048656
807,807,"Due to the Covid crisis, the Indian bakery in my neighborhood is going through some tough times.",04-03-2020 07:23:48,10249,0.97,0.8,0.43961076130509447
808,808,Why was E the only letter in the alphabet to get a Christmas present?,12-24-2019 08:43:28,10244,0.97,1.0,0.4367487120778477
809,809,"If Americans switched from pounds to kilograms overnight, there would be mass confusion",05-08-2018 07:38:12,10238,0.94,0.8,0.4333142530051517
810,810,My grandad was responsible for 28 downed german planes in WW2.,09-06-2019 15:05:50,10234,0.94,0.6,0.4310246136233543
811,811,"I can tolerate algebra, maybe even a little calculus",04-17-2021 08:09:59,10224,0.98,1.0,0.4253005151688609
812,812,How do you measure a red hot chili pepper?,03-08-2020 13:55:50,10217,0.97,1.2,0.4212936462507155
813,813,NASCAR bans the confederate flag?,06-11-2020 10:11:04,10221,0.95,0.8,0.42358328563251285
814,814,Just read an interesting fact - Bruce Lee had a vegan brother;,06-26-2020 22:47:26,10204,0.94,1.4,0.41385231825987406
815,815,Did you hear about the mathematician that was afraid of negative numbers?,05-30-2020 10:24:02,10203,0.97,0.8,0.41327990841442475
816,816,Easter and April Fools’ are on the same day this year.,03-31-2018 07:01:37,10206,0.95,0.8,0.41499713795077275
817,817,I used to hate facial hair,03-04-2019 08:24:56,10196,0.94,1.4,0.40927303949627936
818,818,My friend in the country couldn’t afford his water bill...,07-07-2020 12:28:59,10192,0.98,1.0,0.406983400114482
819,819,Why do women have a difficult time working for the postal service?,01-06-2021 07:26:57,10186,0.97,0.8,0.4035489410417859
820,820,Did you know you cannot breath through the nose while you're smiling?,01-08-2020 04:56:42,10174,0.89,1.2,0.3966800228963938
821,821,"People say circumcision doesn’t hurt, but i have to disagree.",05-08-2019 09:42:53,10180,0.94,1.0,0.4001144819690899
822,822,My wife just accused me of having zero empathy.,04-25-2019 07:09:09,10174,0.96,1.0,0.3966800228963938
823,823,"I'm looking to sell my Delorean. It’s in Great condition, low mileage..",09-27-2019 06:05:06,10178,0.94,1.0,0.3989696622781912
824,824,My boss hates when I shorten his name to Dick.,01-02-2019 20:49:21,10171,0.92,1.0,0.3949627933600458
825,825,I was researching about Atheism,02-16-2021 18:14:49,10177,0.96,0.6,0.3983972524327418
826,826,What do you call karate for amputees?,04-29-2020 07:03:40,10166,0.96,1.0,0.3921007441327991
827,827,Why is six afraid of seven?,02-11-2021 04:34:50,10163,0.9,0.6,0.39038351459645104
828,828,"To the person who stole my copy of Microsoft Office, I will find you.",09-23-2017 09:13:54,10163,0.86,0.8,0.39038351459645104
829,829,What's the longest word in the dictionary?,01-24-2020 07:15:25,10155,0.94,0.8,0.38580423583285633
830,830,My 6 year old told me this one today. Why do dogs carry bones in their mouths?,03-13-2021 22:42:05,10160,0.96,1.0,0.38866628506010303
831,831,"A priest, a minister, and a rabbit walk into a blood bank...",02-22-2020 08:28:22,10152,0.93,1.0,0.3840870062965083
