,idx,title,created_utc,score,upvote_ratio,humor_scores,normalized_scores
832,832,Santa's sack is so large because he only comes once a year,10-25-2019 06:41:38,10130,0.87,1.2,0.3714939896966228
833,833,"After watching me read “War and Peace”, my son asked me, “Dad, why is the book so thick?”",05-20-2020 08:22:04,10131,0.94,0.6,0.3720663995420721
834,834,"My daughter wanted a bouncy castle for her birthday. The guy said the rental was $50, and the set-up fee was $1000 dollars.",10-03-2018 21:09:20,10126,0.95,1.0,0.3692043503148254
835,835,The world tongue-twister champion just got arrested.,04-26-2021 05:20:41,10122,0.98,1.0,0.366914710933028
836,836,How do you feed 1000 people with one loaf of bread?,07-14-2019 19:49:11,10124,0.97,1.2,0.3680595306239267
837,837,My 7 year old came up with a dad joke: What do Zombie Cows say?,09-27-2019 22:40:01,10101,0.95,1.2,0.35489410417859185
838,838,I can cut a piece of wood in half just by looking at it.,03-29-2020 21:40:08,10104,0.97,0.6,0.3566113337149399
839,839,Guess who I bumped into on my way to get my glasses fixed?,04-16-2020 17:20:50,10095,0.97,0.8,0.35145964510589583
840,840,"Before my surgery today, the anesthesiologist asked if I'd like to be knocked out with gas or he could just hit me over the head with a canoe paddle. So I guess it was...",12-28-2020 06:03:15,10090,0.98,1.0,0.34859759587864914
841,841,The oldest computer can be traced back to Adam and Eve.,04-24-2020 21:11:37,10084,0.94,0.6,0.34516313680595306
842,842,People keep saying today is pi day,03-14-2020 19:30:27,10089,0.92,0.6,0.34802518603319976
843,843,"My friend keeps saying, “Cheer up, it could be worse, you could get stuck underground in a hole full of water.”",02-04-2019 15:37:52,10081,0.95,0.8,0.34344590726960506
844,844,My wife asked me if I'd seen the dog bowl,12-17-2020 06:18:55,10077,0.97,1.0,0.3411562678878077
845,845,My Grandfather has the heart of a lion,04-12-2020 11:22:54,10074,0.94,1.2,0.33943903835145967
846,846,A girl came up to me and said she recognised me from her vegetarian resturaunt.,09-06-2018 05:02:26,10082,0.92,1.0,0.3440183171150544
847,847,"A man walked into a hardware store, picked up a can of fly spray and asked the assistant, ""Is this good for wasps?""",10-16-2019 06:03:49,10075,0.97,1.0,0.340011448196909
848,848,"Yoda and Luke are walking through the swamp. Part of their usual training course involves shimmying along a cliff ledge, but today, there’s a long break in the ledge they can’t cross. “Something for this I have.” Yoda says.",05-04-2020 05:55:25,10063,0.94,0.8,0.3331425300515169
849,849,"It's pretty obvious, that if you run in front of a moving car, you will get tired. But if you run behind it..",03-02-2021 08:33:41,10065,0.96,0.8,0.3342873497424156
850,850,I was wondering why music was coming from my printer...,05-20-2021 09:14:48,10058,0.98,0.8,0.3302804808242702
851,851,Just started my new job as a security guard. The supervisor told me my job would be to watch the office at night.,04-11-2021 02:13:36,10047,0.98,0.8,0.3239839725243274
852,852,"Guys, today was my first day in the navy and I felt so lost!",05-04-2021 21:00:47,10046,0.95,0.6,0.32341156267887805
853,853,"My daughter was having a pretend dinner party with her teddy bear, when she asked, “Do you want anything to eat, Mr. Bear?” In my best bear voice, I replied...",04-20-2020 05:56:42,10042,0.98,1.2,0.3211219232970807
854,854,"Mum, dad, I'm gay",05-27-2019 19:04:47,10046,0.8,1.2,0.32341156267887805
855,855,Why did Hitler wear eye glasses?,01-19-2021 10:45:49,10045,0.92,1.2,0.32283915283342873
856,856,"My friend claims that he “accidentally” glued himself to his autobiography, but I don’t believe him.",05-06-2019 10:13:38,10044,0.96,0.8,0.3222667429879794
857,857,What has two butts and kills people?,02-21-2021 07:38:58,10030,0.96,1.2,0.31425300515168864
858,858,"After all these years, my wife still thinks I’m sexy.",10-09-2019 20:35:36,10023,0.97,1.2,0.3102461362335432
859,859,My dad didn't laugh so hopefully you'll enjoy.,02-14-2019 17:16:10,10027,0.96,1.2,0.31253577561534057
860,860,I took a job as the head of Old McDonald’s farm,05-29-2021 07:14:23,10013,0.98,0.8,0.3045220377790498
861,861,"My wife was a little puzzled when I suddenly bought some new beads for her abacus. Smiling, I said to her...",08-09-2020 20:33:38,10002,0.97,0.8,0.298225529479107
862,862,"I started pulling the ""Hi hungry, I'm dad"" routine with my two-year-old. A couple days in, I asked her if she was hungry.",08-17-2019 18:58:30,10003,0.98,1.0,0.2987979393245564
863,863,6:30 is my favorite time. Hands down.,12-31-2018 20:00:14,10009,0.94,0.8,0.3022323983972524
864,864,What’s a more concrete term for butt crack?,11-02-2020 20:58:15,10001,0.97,1.2,0.2976531196336577
865,865,I found the first four Harry Potter books to be quite light hearted.,11-08-2019 12:05:04,10005,0.96,0.6,0.2999427590154551
866,866,"After attempting for five hours to get this fence post to stand upright, I've finally realized",01-17-2019 16:19:46,9990,0.93,0.6,0.29135661133371493
867,867,I had to break up with this girl who just would not stop counting.,04-04-2021 13:35:34,9991,0.97,0.8,0.2919290211791643
868,868,I really want to buy one of the grocery checkout dividers but the lady behind the counter keeps putting it back,09-09-2019 15:24:32,9976,0.95,0.8,0.28334287349742415
869,869,"I took my new gun to the range to try it out, but somehow it won’t work.",07-04-2019 06:34:13,9977,0.96,0.6,0.28391528334287347
870,870,What does Pac-Man eat with his chips?,03-21-2019 20:21:32,9959,0.94,1.4,0.27361190612478536
871,871,Never date a tennis player,02-04-2021 16:16:08,9947,0.97,1.2,0.2667429879793932
872,872,My wife asked me today if I had seen the dog bowl.,02-09-2021 07:36:03,9939,0.98,1.0,0.2621637092157985
873,873,Dad: Hey son did you know that there was a kidnapping at a school today?,06-12-2018 05:17:09,9947,0.92,0.8,0.2667429879793932
874,874,A chemist froze himself at -273.15°C. Everyone said he was crazy,03-09-2021 15:33:37,9941,0.93,0.6,0.2633085289066972
875,875,"Think of a number between 5 and 15. Multiply by 2, add 3, and subtract 7 from the answer. Now close your eyes.",02-24-2019 20:38:40,9934,0.93,0.8,0.2593016599885518
876,876,"I can never remember the Roman Numerals for 1, 1000, 51, 6 and 500...",02-18-2020 03:54:14,9933,0.93,0.4,0.25872925014310244
877,877,A police officer just knocked on my door and told me my dogs are chasing people on bikes.,06-18-2019 14:31:40,9918,0.96,1.4,0.25014310246136234
878,878,What does a house wear?,07-24-2019 05:08:26,9913,0.96,1.0,0.24728105323411562
879,879,I've been accused of being a plagiarist.,10-14-2019 03:26:58,9914,0.98,0.6,0.24785346307956496
880,880,Is this sub still active?,12-31-2015 19:17:18,9912,0.91,0.6,0.2467086433886663
881,881,"My wife tried to unlatch our daughter's car seat with one hand and said, ""How do one armed mothers do it?"" Without missing a beat I replied, ""Single handedly.""",10-15-2019 02:05:54,9900,0.93,0.8,0.23983972524327418
882,882,What's the highest rank in the popcorn army?,03-16-2021 21:41:53,9900,0.95,1.0,0.23983972524327418
883,883,Mitochondria would be a great prison nickname.,07-22-2018 04:12:15,9895,0.92,0.8,0.23697767601602748
884,884,What do you call a person who eats other people slowly?,07-30-2020 07:32:29,9894,0.98,1.0,0.23640526617057814
885,885,What do Mexicans eat when it's cold out?,11-07-2020 18:41:51,9886,0.96,1.2,0.2318259874069834
886,886,What makes cars look faster?,03-02-2019 13:59:07,9888,0.96,0.6,0.2329708070978821
887,887,I’m pretty sure that the hotel receptionist was checking me out.,01-01-2019 10:34:52,9881,0.96,0.8,0.2289639381797367
888,888,"I gave my daughter a watch for her birthday. She thought it was so cool and when she showed it to the next door neighbor, he asked, ""That's a pretty watch you've got there! Does it tell you the time?""",06-24-2020 07:05:19,9876,0.98,0.8,0.22610188895248998
889,889,My colleagues at work have given me the nickname “Mr. Compromise.”,07-10-2019 05:26:43,9862,0.97,1.0,0.2180881511161992
890,890,Did you know the first French fry wasn’t cooked in France?,02-04-2019 01:39:04,9858,0.95,1.2,0.21579851173440184
891,891,"A English man, a Spaniard, a French man, and a German. Go to a club. The guy on stage asks if they can see him. They said",04-11-2020 09:07:29,9854,0.94,1.0,0.21350887235260446
892,892,"A german tourist jumped in the freezing water to save my dog. After he climbed out, he said, “here is ze dog, dry him off and keep him warm, he vill be fine. I asked him, “are you a vet?”",01-07-2020 01:22:19,9850,0.96,1.0,0.2112192329708071
893,893,What do you call a wolf that has things figured out,10-03-2019 04:17:12,9853,0.95,1.0,0.21293646250715512
894,894,Never challenge Death to a pillow fight.,07-07-2019 17:40:20,9843,0.98,1.6,0.20721236405266172
895,895,Did you know the first French Fries weren’t cooked in France?,04-19-2019 11:56:02,9844,0.94,1.2,0.20778477389811104
896,896,Bilbo Baggins wakes up suddenly to “Don’t Stop Believing”.,03-13-2021 07:09:43,9849,0.95,0.8,0.21064682312535776
897,897,I was gonna give archery a shot,04-11-2019 19:47:47,9848,0.94,1.0,0.21007441327990842
898,898,"I remember a time when plastic surgery was a taboo subject, but nowadays when you mention botox..",03-01-2021 08:28:44,9838,0.98,1.0,0.204350314825415
899,899,What is gray and not very heavy?,07-22-2019 21:57:30,9830,0.96,0.4,0.19977103606182026
900,900,Are people born with a photographic memory?,06-08-2020 22:06:52,9836,0.98,0.8,0.2032054951345163
901,901,Dad : “I need to call the doctor today.” Mom : “Which doctor?”,06-10-2019 07:14:41,9834,0.97,1.0,0.20206067544361764
902,902,"If I was an injured cat,",06-28-2019 05:09:40,9830,0.95,0.6,0.19977103606182026
903,903,I've often heard icy is the easiest word to spell.,03-16-2020 09:03:17,9825,0.97,0.6,0.19690898683457356
904,904,Edgar Allan Poe is about to run into a tree. What do you yell at him?,06-22-2018 10:33:12,9824,0.95,1.0,0.1963365769891242
905,905,I just started a business where we specialize in weighing tiny objects.,02-16-2020 21:20:39,9818,0.96,1.0,0.19290211791642817
906,906,Somebody threw a bottle of omega 3 pills at my head.,02-19-2021 11:30:18,9819,0.97,0.8,0.1934745277618775
907,907,What's blue and doesn't weigh much?,12-14-2020 16:38:53,9811,0.97,0.8,0.18889524899828278
908,908,Why do dads tell dad jokes?,08-12-2019 05:57:33,9811,0.97,1.4,0.18889524899828278
909,909,I’m friends with 25 letters of the alphabet,04-09-2019 20:34:19,9813,0.94,0.8,0.19004006868918144
910,910,How do you find Will Smith in a snow storm?,01-25-2021 21:07:41,9810,0.94,0.8,0.18832283915283343
911,911,"Waiter: “How do you like your steak, sir”?",03-06-2021 11:25:30,9806,0.93,1.0,0.18603319977103605
912,912,"True story: Driving back home, my 5 year old son says ""How do you spell 'penis'?"". My wife looks at me curiously and then asks ""Why?""",12-17-2019 09:43:40,9803,0.97,1.2,0.18431597023468804
913,913,My therapist just told me I have extreme difficulty in picking up social cues.,03-05-2021 08:01:46,9797,0.97,1.0,0.180881511161992
914,914,All dad jokes are really bad and here’s why:,01-13-2020 09:34:18,9797,0.96,1.2,0.180881511161992
915,915,What do you call a magician who has lost their magic?,04-04-2020 19:02:05,9789,0.98,0.8,0.17630223239839726
916,916,Is infinity odd or even?,01-06-2019 09:16:36,9785,0.9,0.6,0.17401259301659988
917,917,My wife got really mad when I told her she had no sense of direction,02-20-2021 03:30:03,9785,0.95,0.6,0.17401259301659988
918,918,We should have known communism wouldn't work,04-06-2019 10:56:58,9783,0.94,0.6,0.1728677733257012
919,919,"I hate the word ""xenophobia"", it sounds so...",04-21-2021 03:42:12,9772,0.97,0.6,0.16657126502575845
920,920,Hay bales under a buck,12-04-2019 17:22:17,9779,0.97,0.8,0.17057813394390384
921,921,What’s a song that costs 45¢?,08-20-2019 07:51:51,9772,0.84,1.0,0.16657126502575845
922,922,"When 2 people have sex, its a twosome. When 3 people have sex, its a threesome",05-19-2019 11:03:46,9772,0.82,1.4,0.16657126502575845
923,923,I got arrested because I left my car at the bar and took the bus home.,11-30-2019 08:05:21,9765,0.97,0.8,0.16256439610761306
924,924,What do you call a belt made of $100 bills?,06-23-2020 12:10:59,9767,0.98,0.8,0.16370921579851175
925,925,"A, B, D, E, F, G, H, I, J, K, L, M, N, O, P, Q, R, S, T, U, V, W, X, Y, & Z are all racists.. How do I know?",12-10-2019 19:08:00,9759,0.87,0.6,0.159129937034917
926,926,I was Diagnosed with chronic fear of Giants,03-09-2019 18:35:01,9768,0.95,1.0,0.16428162564396107
927,927,The last 4 letters of “queue” aren’t silent,02-16-2019 03:04:45,9754,0.95,0.6,0.15626788780767029
928,928,Changed all my passwords to Kenny.,09-10-2020 21:53:13,9753,0.97,1.0,0.15569547796222094
929,929,My wife: You need to do more chores around the house.,05-06-2021 00:13:36,9758,0.97,1.2,0.15855752718946767
930,930,If you really think about it condoms are just sonblock.,10-21-2019 02:05:27,9749,0.94,1.2,0.1534058385804236
931,931,Where did the hacker go?,03-28-2020 04:55:34,9747,0.98,0.6,0.1522610188895249
932,932,My wife asked me to stop singing Wonder wall to her,09-26-2017 06:12:40,9743,0.89,1.2,0.14997137950772754
933,933,"Kid: Dad, I want to be in politics when I grow up.",10-14-2018 07:21:48,9748,0.95,1.0,0.15283342873497424
934,934,"As I expected, my therapist told me that I have a problem verbalizing my emotions.",04-28-2020 06:06:03,9736,0.97,0.8,0.14596451058958215
935,935,*while my dad and I drive past a cemetery*,12-18-2020 21:17:37,9741,0.98,0.8,0.14882655981682885
936,936,I saw a woman at the gas station pumping gas and trying to light a cigarette,02-27-2020 21:35:32,9739,0.96,0.8,0.14768174012593016
937,937,"I've decided to become a math teacher, but I'm only going to teach subtraction.",09-01-2019 10:13:18,9737,0.98,1.0,0.14653692043503147
938,938,I made a graph for my past relationships.,01-04-2020 09:59:01,9729,0.97,0.8,0.14195764167143674
939,939,My massage therapist got fired...,06-25-2020 19:53:57,9727,0.97,1.2,0.14081282198053807
940,940,"I'm a member of the American Medical Association, AMA.",09-06-2017 08:06:03,9724,0.93,0.6,0.13909559244419004
941,941,Did you know that 10+10 and 11+11 are the same thing?,05-18-2021 08:05:25,9724,0.95,0.4,0.13909559244419004
942,942,Women are like grenades...,04-02-2019 11:02:08,9724,0.94,1.0,0.13909559244419004
943,943,"My wife saw an ant picking up a leaf 5 times its body weight, and told me, “Can you imagine being that strong?”",12-02-2018 18:20:34,9716,0.96,0.8,0.1345163136805953
944,944,Who ever invented Knock-Knock jokes should get a Nobel Prize,06-25-2019 03:28:48,9713,0.94,1.2,0.1327990841442473
945,945,"Mahatma Gandhi, as you know, walked barefoot most of the time, which produced an impressive set of calluses on his feet. He also ate very little, which made him rather frail and with his odd diet, he suffered from bad breath.",02-05-2019 20:44:40,9717,0.92,1.0,0.13508872352604465
946,946,Interviewer: How do you explain this 4 year gap on your resume? Me: That’s when I went to Yale... Interviewer: That’s impressive. You are hired.,11-06-2019 05:56:21,9703,0.88,0.6,0.12707498568975387
947,947,What do you call a native Alaskan eye doctor??,11-30-2020 23:47:53,9704,0.97,0.8,0.1276473955352032
948,948,I saw a sign today that made me piss myself,09-17-2019 03:09:23,9701,0.95,0.8,0.12593016599885518
949,949,What do you call someone who can't stop watching films with strong female leads?,03-04-2021 15:07:02,9697,0.97,1.2,0.12364052661705781
950,950,"In order to dad joke you all, a couple of days ago I posted this",02-04-2016 08:34:55,9699,0.92,0.8,0.1247853463079565
951,951,I’m still single on Star Wars Day...,05-04-2019 11:52:55,9692,0.92,1.2,0.12077847738981111
952,952,GF- “Why do we need walkie-talkies? Our relationship is over.”,08-12-2020 16:26:58,9691,0.95,1.0,0.12020606754436176
953,953,Do you know what Bruce Lee's vegetarian brother is called?,12-27-2019 09:54:29,9683,0.95,1.2,0.11562678878076703
954,954,Scientists record the sound of two helium atoms laughing.,10-30-2019 08:20:35,9674,0.97,1.0,0.11047510017172295
955,955,"A farmer takes a rest on a bale of hay. “I love my job” he says aloud. A sheep replies “All you do is boss me around all day!” The farmer, clearly upset by this statement, responds “What did you just say??” The sheep replies:",04-20-2020 14:44:07,9678,0.97,1.0,0.11276473955352032
956,956,"My son wanted some girl advice, so I told him, “If you are intimidated by a date, remember one thing.”",12-12-2018 06:04:46,9676,0.96,1.2,0.11161991986262164
957,957,"When I was a kid, my parents would always say, “Excuse my French” after a swear word...",07-13-2019 23:15:33,9663,0.96,1.2,0.10417859187178019
958,958,My son is now at that age where he's curious about the human body.,05-05-2019 05:23:10,9658,0.98,0.8,0.10131654264453349
959,959,"The recipe said, “Set the oven to 180 degrees.”",04-30-2020 06:53:01,9648,0.95,0.8,0.09559244419004007
960,960,"It used to be free to fill up your car tires with air, now it costs $1.25 You know why?",02-17-2021 08:30:04,9644,0.96,1.0,0.0933028048082427
961,961,"As I suspected, someone’s been adding soil to my garden",02-28-2019 19:26:59,9639,0.97,1.0,0.090440755580996
962,962,Is Google Assistant a dad?,10-20-2016 14:59:19,9637,0.93,1.0,0.08929593589009731
963,963,What do you call a hen who counts her eggs?,07-12-2020 20:01:08,9633,0.97,1.2,0.08700629650829994
964,964,My wife asked me if I could clear the kitchen table.,11-01-2020 18:37:28,9628,0.98,1.2,0.08414424728105323
965,965,To the person who stole my glasses,07-18-2019 01:00:18,9608,0.97,0.8,0.0726960503720664
966,966,I can't find my 'Gone in 60 Seconds' DVD.,01-29-2020 13:19:29,9600,0.96,0.8,0.06811677160847167
967,967,"Every morning I announce loudly to my family that I’m going jogging, but then don’t go.",10-06-2019 09:03:54,9600,0.98,1.2,0.06811677160847167
968,968,Post Malone has canceled his tour.,03-26-2020 09:11:02,9609,0.95,1.0,0.07326846021751574
969,969,My wife is mad at the fact that I have no sense of direction.,07-14-2020 17:43:54,9599,0.92,0.8,0.06754436176302232
970,970,My grandfather died because the report said he had Type A blood.,02-11-2018 04:37:11,9601,0.94,0.8,0.06868918145392101
971,971,My first homegrown dad joke. What do you call a low energy laser?,02-13-2019 07:09:47,9596,0.91,1.0,0.0658271322266743
972,972,So my dad had a tumour removed from his eyelid,11-13-2017 17:56:12,9600,0.93,0.8,0.06811677160847167
973,973,I refused to believe my son got fired as a road worker for theft.,02-03-2020 05:33:33,9587,0.97,0.6,0.06067544361763022
974,974,"I'm an atheist 11 months out of the year, but in December...",12-20-2020 22:25:08,9587,0.96,0.8,0.06067544361763022
975,975,I had to fire the guy I hired to mow my lawn.,01-21-2021 03:18:55,9587,0.98,0.8,0.06067544361763022
976,976,"My statistics professor told us that the larger the sample size, the more reliable are your averages.",09-30-2018 08:04:33,9572,0.96,0.4,0.052089295935890095
977,977,There was once a king who was only 12 inches tall!,03-21-2021 05:22:50,9549,0.98,0.8,0.038923869490555235
978,978,A sheep dog tells her owner she found all fifty sheep. Her owner says that there should only be 46,03-25-2020 07:25:06,9549,0.96,0.8,0.038923869490555235
979,979,"Is ""buttcheeks"" one word?",10-18-2019 18:26:18,9546,0.96,1.0,0.03720663995420721
980,980,"My dad was bragging about his new hearing aid. “State of the Art,” he said, “It cost me a fortune.”",10-12-2018 07:23:27,9547,0.92,0.8,0.03777904979965655
981,981,I found out my girlfriend is really a ghost.,09-18-2020 23:56:13,9532,0.98,0.8,0.02919290211791643
982,982,"I can’t believe that even after 15 years of the show ending, people are still making “Friends” references.",10-09-2019 06:00:27,9535,0.93,0.8,0.030910131654264452
983,983,My girlfriend is a square root of -100,03-27-2021 09:41:55,9532,0.91,1.0,0.02919290211791643
984,984,Boss told me as a security guard it's my job to watch the office,02-26-2020 18:27:50,9527,0.96,0.8,0.02633085289066972
985,985,"Sponge bob | (•)(•) | , Patrick / (•)(•) \ , Squidward ( (•)(•) ) , Plankton | (•) | , Mr. Krabs |•| |•|",05-01-2021 04:01:02,9522,0.8,0.8,0.02346880366342301
986,986,My wife left me because of my obsession with horoscopes,02-05-2021 07:55:28,9513,0.96,1.0,0.018317115054378934
987,987,"I showed my damaged luggage to a lawyer, and said, “I want to sue the airline!”",05-17-2019 05:58:44,9506,0.96,0.6,0.014310246136233544
988,988,"“Dad, is the Fibonacci sequence hard to understand?”",11-11-2018 07:20:30,9502,0.93,0.6,0.012020606754436176
989,989,"My wife: Honey, do you think our kids are spoiled?",03-03-2019 06:18:43,9498,0.96,1.4,0.009730967372638809
990,990,What do you call karate for amputees?,07-17-2019 09:30:50,9497,0.97,1.0,0.009158557527189467
991,991,"The guy at the tuxedo store keeps hovering around me, so I asked him to leave me alone.",03-17-2019 20:17:15,9498,0.97,1.0,0.009730967372638809
992,992,Jail is more than just a word...,01-15-2019 23:58:05,9494,0.97,0.6,0.007441327990841442
993,993,I go to Popeye's to get the kids something to eat.,08-16-2019 21:54:36,9495,0.95,1.0,0.008013737836290785
994,994,"""I have a split personality,"" said Tom, being frank.",11-02-2019 22:13:50,9494,0.98,0.6,0.007441327990841442
995,995,What is a highlighter's favorite Twister position?,07-06-2020 11:31:23,9486,0.97,0.8,0.0028620492272467086
996,996,"My grandfather keeps telling us that when he dies, we should try to convert his ashes into a diamond.",04-29-2019 13:46:41,9484,0.96,0.8,0.0017172295363480253
997,997,Why did the can crusher quit his job?,07-25-2020 06:35:42,9476,0.93,1.0,-0.0028620492272467086
998,998,"A priest, a minister, and a rabbit walk into a bar...",02-21-2020 17:36:56,9481,0.96,1.2,0.0
