,idx,title,created_utc,score,upvote_ratio,humor_scores,normalized_scores
250,250,My 9 year old wanted me to post her joke here!,07-27-2020 04:52:21,14722,0.95,1.0,3.0
251,251,"Dad died 17 years ago, but mom takes on the responsibility",11-10-2016 12:27:10,14689,0.91,0.6,2.981110475100172
252,252,"I told my 3yr old daughter ""I'm tired.""",07-12-2019 08:22:35,14683,0.93,0.6,2.9776760160274756
253,253,"As I put my car in reverse, I thought to myself...",11-08-2020 09:15:13,14684,0.97,0.4,2.978248425872925
254,254,Straw. Straw. Straw. Straw. Straw. Straw. Straw. Straw. Straw. Straw. Straw. Straw. Straw. Straw. Straw. Straw. Straw. Straw. Straw. Straw. Straw. Straw. Straw. Straw. Straw. Straw. Straw. Straw. Straw. Straw. Straw. Straw. Straw. Straw. Straw. Straw. Straw. Straw. Straw. Straw. Straw. That's it.,02-25-2021 23:52:29,14667,0.88,0.6,2.968517458500286
255,255,My friend couldn't afford to pay his water bill,09-07-2020 07:02:54,14672,0.98,1.0,2.971379507727533
256,256,People are usually shocked when they find out I'm not a very good electrician.,05-28-2019 09:13:04,14636,0.97,0.8,2.9507727532913566
257,257,"What do you call a person missing 75%, of their spine?",08-27-2020 00:28:48,14617,0.97,0.8,2.939896966227819
258,258,I just saw a cashier scan the eyes of a rude customer with her barcode reader.,09-10-2019 07:02:46,14618,0.97,0.8,2.9404693760732683
259,259,"On his deathbed, my grandfather said, “Remember these two words. It’ll open a lot of doors for you in life.”",03-23-2019 07:11:34,14569,0.95,0.6,2.9124212936462506
260,260,What is an Air Fryer's favorite food? (Courtesy of my 6 year old),12-26-2020 13:02:43,14540,0.95,1.0,2.89582140812822
261,261,"My birthday is on July 24th, shame I was born in america. If I was born anywhere else....",10-18-2020 04:27:42,14496,0.97,0.6,2.870635374928449
262,262,Picture this: A pandemic is unleashed by ticks that live on and around the mouths of alpacas.,05-01-2020 11:44:34,14482,0.95,1.0,2.862621637092158
263,263,My sewing instructor just told me that I’m the worst student she has ever seen.,01-02-2020 10:23:48,14473,0.93,0.8,2.857469948483114
264,264,"I got an email from Google saying ""At Google Earth, we are able to read maps backwards!"" and I thought;",02-24-2020 13:04:21,14474,0.93,0.6,2.8580423583285635
265,265,"When my wife caught me standing on the bathroom scales, sucking in my stomach, she laughed, “Ha! That’s not going to help!”",04-05-2020 22:36:25,14453,0.96,1.0,2.8460217515741273
266,266,What's made of leather and sounds like a sneeze?,10-29-2020 07:28:17,14457,0.97,0.6,2.8483113909559243
267,267,"I told my daughter, “Go to bed, the cows are sleeping in the field.” Puzzled, she asked, “What’s that got to do with anything?” I chuckled, ""Well, that means...""",03-26-2021 06:09:08,14434,0.97,0.8,2.8351459645105894
268,268,We all know that Albert Einstein was a genius...,11-28-2020 17:27:29,14386,0.95,0.8,2.8076702919290213
269,269,"After I was arrested, my ex-wife decided to hang a picture of my mugshot on the wall in her living room.",08-02-2020 01:26:20,14357,0.97,0.8,2.79107040641099
270,270,If you rearrange the letters of MAILMEN,10-22-2020 20:56:41,14363,0.96,0.6,2.7945048654836864
271,271,"For me, the urge to sing “The Lion Sleeps Tonight” is always just a whim away...",09-20-2019 00:31:19,14342,0.91,1.0,2.78248425872925
272,272,"If a father in Iraq gifts his daughter a new bag, what will she say?",09-23-2020 14:16:55,14309,0.9,1.0,2.763594733829422
273,273,"A vegan said to me, “People who sell meat are disgusting!”",11-04-2018 00:13:32,14315,0.92,1.2,2.767029192902118
274,274,Lance is an uncommon name nowdays,01-05-2021 12:29:47,14311,0.97,0.6,2.7647395535203207
275,275,eBay is so useless,09-30-2020 05:51:14,14297,0.96,0.6,2.75672581568403
276,276,So the doctor sat me down and gently revealed to me me that my child is a boy trapped in a girls body...,07-22-2020 11:08:38,14246,0.93,0.6,2.7275329135661135
277,277,I’m so bored that I just memorized six pages of the dictionary.,08-26-2020 00:09:08,14216,0.97,0.8,2.710360618202633
278,278,I finally got my dream job at the guillotine factory,06-16-2020 11:11:26,14219,0.97,0.8,2.712077847738981
279,279,My son Luke loves that we named him after a Star Wars character.,08-01-2020 00:12:47,14214,0.95,0.8,2.7092157985117344
280,280,Stopped by a roadside stand that said lobster tails $2. I paid my $2 and he said...,04-22-2019 10:41:34,14203,0.94,1.2,2.7029192902117916
281,281,"I was watching Star Wars with my daughter. She asked why Luke was climbing inside a Tauntaun, I said to keep warm.",12-12-2019 08:32:49,14209,0.94,1.0,2.706353749284488
282,282,"For the 10th year in a row, my coworkers voted me ""the most secretive guy"" in the office.",03-06-2020 07:11:32,14200,0.97,1.2,2.7012020606754437
283,283,I ordered a chicken and an egg from Amazon. I’ll let you know,08-14-2018 06:19:38,14179,0.92,1.2,2.6891814539210075
284,284,"I said to my wife, ""I need to call the doctor today.""",02-03-2019 06:48:16,14171,0.96,0.6,2.6846021751574125
285,285,"The genie asked, ""What’s your first wish?"" Steve replied, ""I wish I was rich!"" The genie nodded and said, ""What’s your second wish?""",10-01-2018 06:06:13,14170,0.94,0.8,2.6840297653119634
286,286,"My daughter came into my ""home office"" (closet) and said, ""You wanna hear a joke?"" I told her that I did",08-08-2020 06:28:26,14179,0.97,1.2,2.6891814539210075
287,287,How much did it cost HYDRA to kill Tony Stark’s parents?,07-03-2020 08:15:36,14174,0.95,0.8,2.686319404693761
288,288,Iamonthemoonandthereisnoplacetogetabeer.,11-03-2020 11:14:09,14158,0.8,0.6,2.6771608471665713
289,289,Why did the wizard’s wife have hickeys on her neck?,10-28-2020 15:26:56,14146,0.97,1.4,2.6702919290211793
290,290,Justice is a dish best served cold,07-08-2020 00:25:01,14131,0.97,1.0,2.661705781339439
291,291,Why shouldn't you kiss anyone on January 1st?,09-30-2020 21:02:42,14099,0.96,1.4,2.6433886662850603
292,292,"The owner of the tuxedo store kept hovering over me when I was browsing, so I asked him to leave me alone.",08-13-2020 21:50:17,14023,0.98,1.0,2.59988551803091
293,293,Customer: Do you have any copies of that book for men with small penises?,07-29-2020 19:08:58,13978,0.92,1.4,2.57412707498569
294,294,British people be like: I'm bri ish,04-17-2020 08:07:03,13964,0.87,1.0,2.566113337149399
295,295,My 8 year old pulled this on me,03-27-2019 12:53:09,13958,0.92,0.8,2.562678878076703
296,296,A man is staying in a hotel.,03-24-2020 18:22:57,13941,0.97,0.6,2.5529479107040642
297,297,Chinese take out: 8 dollars. Tip: 2 dollars. Getting home to find out they forgot part of your order...,12-15-2020 18:08:50,13922,0.94,1.0,2.542072123640527
298,298,This sub is disappointing me lately.,06-19-2016 08:27:59,13948,0.85,1.0,2.5569547796222096
299,299,"My teacher likes to start every day by reading a joke from Reddit. She was sick the other day, so",03-12-2021 10:33:37,13921,0.96,1.0,2.541499713795077
300,300,Cop: I’m arresting you for illegally downloading the entire Wikipedia.,11-20-2019 06:24:39,13894,0.95,1.2,2.5260446479679453
301,301,My wife left me cause Im too insecure,06-01-2020 01:15:56,13879,0.92,1.2,2.517458500286205
302,302,"The internet connection in my farm is really sketchy, so I moved the modem to the barn.",08-09-2020 06:37:02,13876,0.97,0.6,2.515741270749857
303,303,"The secret service isn't allowed to yell ""Get down!"" anymore when the president is about to be attacked.",12-07-2019 18:54:58,13872,0.9,1.0,2.5134516313680595
304,304,To call the whole Elon Musk controversy “Elon-Gate” seems like a bit of a stretch,09-09-2018 06:01:08,13870,0.96,0.6,2.5123068116771607
305,305,Today I launched a book aimed at 9-12 year olds.,06-02-2020 16:40:38,13851,0.95,0.6,2.5014310246136233
306,306,I told my son I was named after Thomas Jefferson…,04-29-2017 08:44:33,13848,0.92,0.6,2.4997137950772754
307,307,"My wife asked me whether I experimented with sex and drugs when I was in high school, and I said Yes.",01-17-2020 00:16:19,13842,0.96,1.2,2.496279336004579
308,308,"Without a doubt, my favourite Robin Williams movie is Mrs Fire.",04-18-2019 21:21:41,13821,0.95,0.6,2.484258729250143
309,309,"As a lumberjack, I know that I’ve cut exactly 2,417 trees.",08-25-2018 10:34:45,13815,0.94,0.8,2.480824270177447
310,310,What noise does a 747 make when it bounces?,01-15-2018 10:23:04,13807,0.9,0.8,2.4762449914138522
311,311,My wife accused me of hating her family and relatives...,06-15-2018 06:52:21,13799,0.92,0.6,2.4716657126502577
312,312,"My 8yr old daughter got me with ""I can breathe under water""",05-13-2020 19:09:46,13797,0.94,1.0,2.470520892959359
313,313,"A drunk wakes up in jail, ""Why am I here officer?""",12-08-2020 17:17:25,13776,0.98,0.8,2.458500286204923
314,314,What do you say to your sister when she's crying?,12-30-2018 10:04:55,13781,0.92,0.6,2.4613623354321694
315,315,Breaking a leg during an audition ensures that you end up in the cast.,11-10-2018 09:11:27,13770,0.96,1.2,2.4550658271322265
316,316,It's easy to convince ladies not to eat Tide Pods,02-11-2020 07:40:18,13751,0.91,1.4,2.444190040068689
317,317,"My wife asked me ""Is having a penis fun?""",08-29-2020 20:00:48,13747,0.93,1.6,2.4419004006868916
318,318,"Every time I go to the liquor store, a dude comes out of nowhere to give me advice on what to buy.",10-03-2020 07:42:41,13749,0.97,1.4,2.4430452203777904
319,319,I married my wife for her looks,11-04-2020 09:25:37,13741,0.96,1.0,2.438465941614196
320,320,"One impeachment is bad, but two impeachments",01-13-2021 17:15:43,13730,0.94,0.6,2.432169433314253
321,321,"Someone: ""If you need 144 rolls of toilet paper for a 14 day quarantine you probably should've been seeing a doctor long before COVID-19""",03-15-2020 20:17:41,13717,0.94,1.0,2.4247281053234118
322,322,My friend in Germany says that there has been panic buying of sausages and cheese . . .,03-17-2020 20:02:41,13712,0.95,1.2,2.4218660560961647
323,323,"A man came up to me and said ""Man, your clothes look gay"".",03-10-2019 09:32:01,13709,0.94,1.2,2.420148826559817
324,324,I was drinking my milkshake on a cliff and thought,01-30-2019 12:47:06,13705,0.92,0.8,2.4178591871780193
325,325,I just had a near sex experience.,08-29-2018 07:04:56,13702,0.92,0.8,2.4161419576416714
326,326,"I just saw my wife trip and fall, while carrying a laundry basket full of ironed clothes.",07-02-2019 19:16:54,13676,0.96,0.8,2.4012593016599886
327,327,My son told me he didn't understand cloning.,05-18-2019 06:24:28,13665,0.96,1.0,2.3949627933600457
328,328,What did Master Yoda say when he first saw himself in 4k resolution?,11-29-2019 04:53:24,13642,0.98,0.6,2.381797366914711
329,329,What did 2n+1 say to 2n?,09-09-2020 18:40:38,13635,0.96,0.6,2.3777904979965654
330,330,"What word starts with ""e"", ends with ""e"", and only has one letter in it?",12-02-2018 03:01:39,13639,0.92,0.4,2.380080137378363
331,331,Why don't the Jedi take off their shirts to greet each other?,12-16-2020 13:58:54,13606,0.95,1.2,2.3611906124785347
332,332,"Waiter: I see you glass is empty, would you like another one?",09-08-2020 21:29:55,13582,0.96,1.2,2.3474527761877506
333,333,"My wife rang me at the pub and said, “If you’re not home in 10 minutes, I’m giving the dinner I cooked you to the dog.” I was home in 5 minutes.",09-06-2020 07:27:37,13571,0.96,1.0,2.3411562678878077
334,334,"If A is for Apple and B is for Banana, then what is C for?",02-03-2020 19:57:47,13567,0.95,1.0,2.3388666285060102
335,335,"I made a playlist for hiking. It has music from Peanuts, The Cranberries, and Eminem.",07-29-2019 18:01:11,13543,0.94,1.0,2.325128792215226
336,336,The mayor in my city just passed law that male best friends have to have lunch together at least once a week,11-20-2020 14:41:30,13527,0.98,1.6,2.3159702346880366
337,337,Sex in an elevator is wrong.,01-07-2021 11:51:28,13529,0.88,1.2,2.3171150543789354
338,338,How come the Hulk doesn’t lose his pants when he transforms?,05-22-2020 19:53:26,13499,0.97,1.6,2.299942759015455
339,339,"Imagine being held at gunpoint by (bear with me) a literate animal, and the only hope of rescue is (BEAR WITH ME) posting a coded message on social media.",04-25-2020 09:05:26,13484,0.84,1.0,2.291356611333715
340,340,"If Snoop Dogg dies before pot becomes legal in the US, he will be rolling in his grave.",09-13-2019 11:22:49,13472,0.94,1.4,2.2844876931883227
341,341,My 77 year old dad said this last night,12-10-2018 10:53:41,13470,0.94,0.4,2.2833428734974244
342,342,A slice of apple pie is $2.50 in Jamaica and $3.00 in the Bahamas.,02-01-2018 12:09:39,13464,0.94,1.0,2.279908414424728
343,343,If I had 50 cents for every maths Exam I failed,11-29-2020 07:51:08,13456,0.95,1.0,2.275329135661133
344,344,"I hate it when my wife says ""Are you listening to me?!""",06-14-2020 17:49:03,13450,0.96,1.0,2.2718946765884374
345,345,Burnt my hawaiian pizza today...,10-06-2020 15:55:21,13445,0.96,1.2,2.2690326273611907
346,346,I told my wife we could still have a threesome during this Coronavirus pandemic.,03-31-2020 15:51:11,13439,0.93,1.6,2.2655981682884945
347,347,Grandpa died because we couldn’t figure out his blood type.,04-17-2020 23:42:25,13435,0.92,0.8,2.263308528906697
348,348,How do you make a water bed more bouncy?,06-22-2020 20:35:18,13415,0.98,1.0,2.2518603319977104
349,349,Why won't swords go obsolete?,11-18-2020 09:00:32,13415,0.96,0.8,2.2518603319977104
350,350,"The internet connection at my farm is really sketchy, so I moved the modem to the barn.",02-05-2019 07:17:33,13417,0.96,0.6,2.253005151688609
351,351,A new strain of head lice is going around which is resistant to conventional treatments.,08-30-2020 22:07:56,13391,0.98,0.8,2.2381224957069263
352,352,"My 10 year old came in with a piece of paper and said “Dad, I’ve got a joke for you.”",02-11-2019 19:48:50,13372,0.96,1.0,2.2272467086433885
353,353,"A blonde goes into a church and asks the minister, ""How much does it cost to rent a church singing group?""He said,""Do you mean a choir?""",12-04-2020 21:03:32,13372,0.96,1.2,2.2272467086433885
354,354,"Theresa May is stepping down on June 7th. As a result, the last week of May is the first week of June.",05-24-2019 15:19:14,13360,0.94,0.8,2.2203777904979964
355,355,"Justice is a dish best served cold, if it were served warm it would be justwater",06-18-2018 13:55:04,13352,0.95,1.0,2.215798511734402
356,356,What’s the difference between Taxes and Texas?,03-02-2021 20:03:04,13349,0.92,0.6,2.214081282198054
357,357,Two women were sharing the same ID card,09-12-2020 17:33:50,13325,0.95,0.6,2.2003434459072695
358,358,"When I reach home, my 1.5 y.o. son rushes out to the gate to sit in my lap while I park the car. Then he just grabs the steering and starts shaking it with brrrmmm brrrmmm sound. His cute antics always make me forget that he's suffering from a rare disease.",03-12-2018 10:56:16,13310,0.9,1.0,2.1917572982255296
359,359,What did the green grape say to the purple grape?,10-07-2020 08:35:12,13293,0.96,0.8,2.182026330852891
360,360,"Two drunk guys were about to get into a brawl. One of the guys grabs a stick and draws a line in the dirt and says ""If you cross this line, I'll hit you in the face"".",09-22-2020 03:20:12,13293,0.97,1.0,2.182026330852891
361,361,What did the ghost say to the beehive?,10-26-2020 04:28:17,13272,0.95,0.6,2.1700057240984547
362,362,What did the sushi say to the bee?,08-27-2020 12:55:52,13260,0.97,1.2,2.1631368059530622
363,363,What do you call a hen who counts her eggs?,07-11-2019 13:45:37,13258,0.94,1.2,2.1619919862621635
364,364,I was gonna tell a time traveling joke.,08-05-2020 11:48:36,13251,0.96,0.8,2.157985117344018
365,365,I dated a communist once. I had no idea. She seemed sweet. But it did NOT end well,10-24-2019 05:07:36,13243,0.94,0.8,2.1534058385804236
366,366,"Which is faster, hot or cold?",12-10-2020 20:11:17,13235,0.97,0.6,2.148826559816829
367,367,Why are locksmiths allowed to remain open during lockdown?,10-19-2020 06:53:00,13223,0.97,0.8,2.1419576416714365
368,368,"From my 5-year-old son: ""Hey""",05-10-2021 07:58:31,13217,0.97,1.0,2.1385231825987407
369,369,A ham sandwich walks into a bar and orders a beer,10-08-2020 13:49:10,13219,0.96,1.4,2.1396680022896395
370,370,Having sex on a regular basis helps keep memory alive!,12-31-2020 22:27:36,13206,0.93,1.4,2.132226674298798
371,371,"A woman suddenly in labor shouts, shouldn’t! wouldn’t! couldn’t! didn’t! can’t! The doctor says ""don't worry.""",09-16-2020 03:39:39,13206,0.95,0.8,2.132226674298798
372,372,No one in Antarctica has COVID-19,03-24-2020 02:25:40,13209,0.95,0.6,2.1339439038351458
373,373,An actual conversation between my wife and my son yesterday.,03-28-2021 11:12:26,13202,0.93,0.8,2.1299370349170004
374,374,"My wife tried to unlatch our daughter's car seat with one hand and said, ""How do one armed mothers do it?""",08-16-2018 00:21:34,13200,0.94,0.8,2.128792215226102
375,375,I've been torturing my daughter with jokes for weeks now,10-14-2016 12:47:00,13189,0.94,1.2,2.122495706926159
376,376,Jack: How’s it going? Beans: Pretty good,09-10-2020 09:18:20,13183,0.97,1.2,2.119061247853463
377,377,"My daughter screeched, ""Daaaaaad, you haven't listened to one word I've said, have you!?""",08-17-2019 09:09:18,13166,0.91,0.6,2.1093302804808243
378,378,"my friend just told me, 'I hope you die in a deep hole filled with water'.",07-26-2020 17:10:49,13123,0.95,0.6,2.084716657126503
379,379,"“Officer, are you crying while you are writing me a ticket?”",11-03-2019 10:32:47,13117,0.97,0.8,2.0812821980538065
380,380,My friend just got a PhD on the history of palindromes. Now we call him Dr Awkward.,10-18-2019 04:05:32,13125,0.89,0.8,2.085861476817401
381,381,What’s the Fastest Growing City on Earth?,09-03-2019 07:47:41,13110,0.96,0.8,2.077275329135661
382,382,Why did the Mexican take a Xanax?,04-17-2019 17:10:23,13103,0.93,0.8,2.0732684602175158
383,383,Got my girlfriend with this earlier,01-26-2018 19:26:28,13077,0.92,0.8,2.058385804235833
384,384,"I’d tell you a Fibonacci joke, but’s it’s probably as bad as the last two you’ve heard combined",11-23-2018 11:42:12,13065,0.93,0.8,2.051516886090441
385,385,Where did Noah put all the bee’s in his Ark?,09-09-2020 08:20:19,13067,0.98,1.0,2.052661705781339
386,386,"My 10 year old daughter just told me this one. ""What did the green grape say to the purple grape?""",05-15-2019 23:07:45,13060,0.96,0.8,2.048654836863194
387,387,Why was 69 afraid of 70?,06-05-2020 10:22:40,13050,0.95,0.8,2.0429307384087005
388,388,Justice is a dish best served cold,09-20-2020 22:16:09,13050,0.96,1.0,2.0429307384087005
389,389,I had a vasectomy because I didn't want any kids.,02-27-2021 08:26:57,13042,0.96,1.2,2.038351459645106
390,390,"A bear goes to the bar and says ""can I get one whiskey..................and one coke""",05-03-2020 13:48:11,13048,0.94,1.2,2.041785918717802
391,391,I can always tell when someone is lying just by looking at them.,10-14-2020 11:20:21,13035,0.98,0.4,2.0343445907269606
392,392,I'm pretty bad at building fences..,04-08-2020 09:10:03,13020,0.96,0.8,2.0257584430452202
393,393,"I told my son people keep accidentally pleading for me to purchase meat for them. He asked, “By mistake?”",02-26-2019 05:33:59,13024,0.92,1.0,2.0280480824270177
394,394,"My friend Ty came first in the Beijing marathon, but wasn’t awarded a gold medal.",05-19-2020 17:56:15,13012,0.95,1.0,2.0211791642816257
395,395,Stepdaughter pun that I never thought I'd hear.,10-04-2017 09:35:46,13016,0.89,0.8,2.023468803663423
396,396,A weird German kid just gave me a gold coin,12-24-2020 19:43:02,13003,0.95,0.8,2.0160274756725816
397,397,What did the Reddit user say after detonating a bomb in a bank?,01-12-2020 21:49:46,12989,0.89,0.8,2.008013737836291
398,398,"So I was out at the museum with my daughter today and got the ultimate dad joke in. Employee asks kids ""Does anyone know the difference between a Crocodile and an Alligator?""",02-11-2019 10:28:14,12988,0.95,1.2,2.0074413279908416
399,399,"If you spell the words “Absolutely Nothing” backwards, you get “Gnihton Yletulosba,” which ironically means...",02-15-2021 00:36:56,12954,0.94,0.6,1.9879793932455638
400,400,"My wife is fed up of my constant Dad jokes, so I asked her, ""How can I stop my addiction?""",03-30-2020 02:58:36,12952,0.99,1.2,1.986834573554665
401,401,"When my wife found me playing with my son’s train set, I was so embarrassed that I threw a bedsheet over it.",01-17-2021 07:23:57,12937,0.97,1.0,1.978248425872925
402,402,My left knee has never committed a crime.,08-16-2020 13:55:24,12927,0.97,1.0,1.9725243274184316
403,403,I love telling dad jokes.,04-13-2019 03:25:11,12929,0.93,1.2,1.9736691471093304
404,404,"My friend claims the he accidentally glued himself to his autobiography, but I don’t believe him.",01-11-2021 10:37:29,12912,0.96,0.6,1.9639381797366915
405,405,Why can’t two elephants swim at the same time?,12-20-2020 10:01:47,12906,0.98,1.4,1.9605037206639955
406,406,I bought my friend an Elephant for her room...,06-08-2020 13:12:10,12891,0.96,1.4,1.9519175729822553
407,407,My boss just told me that I’m the worst mailman he has ever seen.,12-14-2020 08:19:49,12863,0.96,0.8,1.9358900973096738
408,408,"I was in bed with a blind girl last night and she whispered in my ear ""You have the biggest penis I've ever laid my hands on"".",03-20-2021 11:35:33,12864,0.88,1.4,1.9364625071551231
409,409,"Remember when air was free at the gas station, now it’s $1.50. You know why?",07-21-2020 20:33:30,12855,0.97,0.8,1.931310818546079
410,410,My son asked me what I'm posting on Reddit.,09-04-2016 09:28:48,12846,0.89,0.8,1.9261591299370349
411,411,Why is Dark spelled with a ‘K’ and not a ‘C’?,04-21-2021 20:11:56,12841,0.92,0.8,1.9232970807097882
412,412,"In Ancient Rome, there were 4 types of poison.",10-14-2020 01:06:54,12833,0.96,0.8,1.9187178019461935
413,413,"I just saw my wife walk by with her sexiest underwear on, which can only mean one thing.",05-20-2019 04:16:03,12804,0.95,1.4,1.9021179164281625
414,414,"So my daughter is clearing the table and holds her cup above her head and says ""Dad look...""",04-03-2020 19:32:51,12806,0.98,0.8,1.9032627361190613
415,415,My 6 year old just told me this joke... What's stronger than a fortune cookie?,12-21-2020 12:20:26,12803,0.93,1.0,1.9015455065827132
416,416,"When my wife told me to stop impersonating a flamingo,",09-29-2020 03:57:06,12802,0.95,1.4,1.9009730967372638
417,417,I decided to quit my job as a personal trainer because I’m not big enough or strong enough,06-13-2020 05:53:18,12789,0.98,0.8,1.8935317687464224
418,418,Why do the Hong Kong police wake up early?,10-23-2019 11:09:48,12787,0.93,1.0,1.8923869490555238
419,419,They said gloves and a mask would be enough to go to the supermarket..,03-23-2020 06:11:40,12776,0.94,1.0,1.886090440755581
420,420,I'm worried that the supreme court will lack empathy now that Ginsburg is gone.,10-29-2020 20:46:26,12770,0.94,0.8,1.882655981682885
421,421,Why is “beefstew” an unsafe password to use?,11-07-2020 05:26:51,12763,0.96,1.0,1.8786491127647396
422,422,Her: I’m leaving. I am sick of you wearing a different t shirt every half an hour.,01-23-2021 07:08:14,12763,0.97,1.6,1.8786491127647396
423,423,"My wife emailed me our wedding photos, but I couldn’t open any of the files.",08-16-2020 03:13:43,12767,0.97,0.8,1.8809387521465368
424,424,My brother had to quit his job as a weightlifter because he wasn't strong enough.,11-13-2020 02:30:38,12754,0.97,1.0,1.8734974241556954
425,425,Does anyone know if doctors could take some of my butt flesh and graft it onto someone who isn't a relative?,07-15-2020 19:59:14,12756,0.97,1.2,1.8746422438465942
426,426,What do you call an orphan taking a selfie?,10-25-2020 01:11:00,12733,0.95,1.2,1.8614768174012593
427,427,A cheese factory exploded in France.,10-24-2020 08:53:42,12706,0.96,1.0,1.846021751574127
428,428,My wife told me to take a spider out instead of killing it.,09-24-2019 12:50:10,12703,0.87,1.2,1.844304522037779
429,429,"Which weighs more, a gallon of water, or a gallon of butane?",03-20-2020 03:58:49,12697,0.97,0.6,1.840870062965083
430,430,I couldn't believe I got to use this,10-04-2018 12:40:14,12662,0.94,0.4,1.820835718374356
431,431,"A man walks into a bar with a slab of asphalt under his arm and says, “A beer please, ...""",09-15-2020 11:41:19,12654,0.97,1.2,1.8162564396107612
432,432,How do you make a water bed more bouncy?,04-08-2019 08:43:46,12647,0.96,1.0,1.8122495706926158
433,433,Bilbo Baggins suddenly wakes up and hears someone singing “Don’t stop Believing”.,10-18-2020 17:07:40,12643,0.96,1.0,1.8099599313108186
434,434,I've been torturing my daughter with jokes for years now,07-30-2018 08:48:13,12629,0.97,1.2,1.8019461934745278
435,435,What do you call a calculator that works instantly?,10-31-2020 21:28:29,12613,0.96,0.8,1.7927876359473383
436,436,I have a pencil that used to belong to William Shakespeare. He chewed it a lot.,12-10-2020 03:57:53,12618,0.95,1.0,1.795649685174585
437,437,My girlfriend asked if we could have an old movie night and watch “Gaslight”,09-14-2020 07:47:43,12604,0.96,1.2,1.7876359473382941
438,438,We need to uninstall 2020 and then try reinstalling it,03-23-2020 14:47:50,12601,0.96,0.6,1.7859187178019462
439,439,I HATE HOW FUNERALS ARE ALWAYS AT 9AM,02-10-2021 09:53:06,12585,0.97,0.8,1.7767601602747567
440,440,"6 was scared of 7 because 7,8,9 but why did 7 eat 9?",02-13-2020 09:23:14,12590,0.91,0.8,1.7796222095020033
441,441,What’s the difference between bird flu and swine flu?,10-25-2020 15:13:05,12555,0.96,0.8,1.7595878649112764
442,442,This girl on Tinder asked me why I have an unlit cigarette in my picture... I told her I’m just looking for matches.,07-13-2019 08:35:32,12551,0.97,1.0,1.7572982255294791
443,443,I’ve asked so many people what LGBTQ stands for,05-10-2020 03:16:25,12544,0.91,0.8,1.7532913566113337
