idx,title,created_utc,humor_scores
601,Biden slams Trump over Covid at final debate: 'Anyone who’s responsible for that many deaths should not remain president',10-22-2020 21:17:59,0.8
602,Elizabeth Warren proposes a lifetime lobbying ban for major government officials,09-16-2019 13:30:50,1.0
603,Wisconsin recount adds 87 votes to Biden’s victory over Trump,11-29-2020 12:06:12,0.6
604,"Americans are the dangerous, disease-carrying foreigners now",07-08-2020 14:11:25,0.6
605,Joe Biden says he will rejoin the Paris climate agreement on the first day of his presidency if he wins the election,11-05-2020 09:36:37,1.0
606,Sen. Kelly Loeffler Dumped Millions in Stock After Coronavirus Briefing,03-19-2020 20:51:57,1.0
607,House member says she’s drawing up Articles of Impeachment against President Trump,01-06-2021 17:01:50,0.8
608,GOP Senators Couldn’t Even Convict The Man Who Sent a Mob After Them. Why Let Them Filibuster?,02-14-2021 18:21:00,1.0
609,"Bernie Sanders says the Chauvin verdict is 'accountability' but not justice, calling for the US to 'root out the cancer of systemic racism'",04-20-2021 18:29:25,0.4
610,"""Where the f***ing stimulus at?"": TikTok video rant at Mitch McConnell watched Over 2 million times",11-26-2020 12:19:17,1.0
611,Russiagate Was Not a Hoax | The Senate Select Committee on Intelligence confirmed what the Mueller report could not.,08-19-2020 09:49:59,0.6
612,Mike Pence ‘has told Trump he cannot overturn election result’,01-05-2021 20:09:10,0.8
613,"Louis Gohmert, who refused to wear a mask, tests positive for coronavirus",07-29-2020 10:11:59,1.0
614,"Sanders: 'Obviously I am not a communist,' but maybe Trump 'doesn't know the difference'",02-09-2020 10:15:55,0.8
615,Trump refuses to denounce white supremacism and instead tells Proud Boys to ‘stand back and stand by',09-29-2020 22:51:10,1.0
616,Trump’s Mar-a-Lago neighbours initiate legal action to stop him moving there when he leaves White House. Trump signed a deal in 1993 that bars him from using the private club as a permanent residence,12-16-2020 11:13:55,1.4
617,Bernie Sanders Says U.S. Can Cancel All Student Debt if It Can Give the Top 1% $1 Trillion in Tax Breaks,11-26-2020 09:51:22,0.8
618,Supreme Court rejects final Trump bid to nullify 2020 election results,03-08-2021 10:06:28,0.8
619,The worst president. Ever.,04-05-2020 09:35:04,0.8
620,"House Democrats draw the line: No bipartisan cooperation with Republicans who questioned the election — After the Jan. 6 riot, some Democrats say they simply can't work with anyone who voted against certifying the election.",03-14-2021 10:10:19,0.6
621,Joe Biden halts drilling in Arctic refuge,01-23-2021 14:49:24,0.8
622,"Barack Obama calls Trump a ""two-bit dictator"" after report Trump will declare premature victory",11-02-2020 19:49:16,1.0
623,"Trump’s medical bill would cost an average American citizen at least $100k, report says",10-07-2020 15:22:20,1.2
624,"Obama Slams Dropping Of Michael Flynn Case, Calls White House COVID-19 Response 'Absolute Chaotic Disaster'",05-09-2020 07:06:20,0.6
625,"More than 800K physicians beg Trump to let experts, not holidays, determine when public gatherings are safe again",03-28-2020 05:35:04,1.0
626,"Ruth Bader Ginsburg says she is starting 2020 ""cancer free""",01-08-2020 15:36:35,0.8
627,"Donald Trump Is Now ‘America’s Number One Traitor,’ Says Veterans Group | “Benedict Arnold can step aside,” VoteVets says in its latest anti-Trump attack ad",07-04-2020 06:44:29,0.8
628,AOC defeats primary challenger Michelle Caruso-Cabrera,06-23-2020 23:04:51,0.6
629,Trump promoted N.M. official’s comment that ‘the only good Democrat is a dead Democrat.’ Now the man is arrested in the Capitol riot.,01-18-2021 18:35:14,0.6
630,"Dem introduces bills to eliminate electoral college, stop presidents from pardoning themselves",01-03-2019 21:31:02,1.0
631,Pelosi wants ‘unhinged’ Trump to be stripped of nuclear codes,01-08-2021 11:57:20,0.8
632,"On a call with Trump officials, police chief pleads: 'Stop testing NBA players, start testing first responders'",03-23-2020 05:59:57,0.8
633,Megathread: President Donald Trump Removes Watchdog Overseeing Rollout of $2 Trillion Coronavirus Bill,04-07-2020 13:53:54,0.8
634,The Video of Donald Trump Telling Associates to “Get Rid of” Ambassador Marie Yovanovitch Has Been Released,01-25-2020 16:15:09,0.8
635,Mike Pence’s narrow escape thanks to Capitol officer Eugene Goodman revealed in new video,02-10-2021 17:09:50,0.6
636,"Pence, Not Trump, Gave Order to Activate National Guard: Report",01-06-2021 20:26:33,0.6
637,"Right on schedule, Republicans pretend to care about deficits again",01-21-2021 18:30:21,0.8
638,Biden plans to limit private prisons and transfer of military equipment to police,01-26-2021 06:13:21,0.8
639,Don't Be Shocked Trump Lied About COVID On Tape. Be Horrified That It Won't Matter,09-10-2020 06:07:15,1.0
640,Calls for Trump ally Lindsey Graham to resign over Georgia phone call,11-18-2020 16:00:37,0.6
641,"Sanders: ""Richest 1 Percent Is Responsible for 70 Percent of All Unpaid Taxes""",07-09-2020 11:17:42,0.6
642,#ILikeBernie Trends After Hillary Clinton Says 'Nobody Likes' Bernie Sanders,01-21-2020 12:27:48,0.8
643,The Coronavirus Is the Worst Intelligence Failure in U.S. History | It’s more glaring than Pearl Harbor and 9/11—and it’s all the fault of Donald Trump’s leadership.,03-25-2020 16:18:36,0.8
644,Sacha Baron Cohen calls Facebook Trump’s ‘willing accomplice’ in spreading conspiracy theories,10-08-2020 21:23:14,1.0
645,Comey Memo Says Trump Asked Him to End Flynn Investigation,05-16-2017 17:23:49,0.8
646,Sarah Sanders says Trump told her to go to North Korea and take 'one for the team' after Kim Jong Un winked at her,09-02-2020 07:47:45,1.2
647,"Ocasio-Cortez Says Putting Pence in Charge of Coronavirus Effort Is 'Irresponsible' Because He 'Literally Does Not Believe in Science' — ""This decision could cost people their lives. Pence's past decisions already have.""",02-27-2020 06:49:55,0.8
648,'He gets his photo op and gets out': Biden hits out at Trump for 'reckless' Omaha rally that left supporters hospitalised,10-28-2020 13:45:48,0.6
649,Major Producer of Hydroxychloroquine Once Paid Michael Cohen Hefty Sum for Access to Trump,04-06-2020 12:00:26,1.0
650,The GOP is holding up relief for millions of Americans because they want to make sure corporations have blanket protection from workers who get COVID on the job,12-13-2020 08:43:57,0.8
651,"‘The Heat Is On’: Legal Experts Say Postmaster General Committed ‘Stunning’ Array of Crimes, Including ‘Wire Fraud’",09-07-2020 10:49:38,0.4
652,U.S. House to vote on ending federal ban on marijuana,11-28-2020 16:09:05,1.2
653,Breonna Taylor grand jurors file petition to impeach Attorney General Daniel Cameron,01-22-2021 12:45:35,0.6
654,"Stop romanticizing divided government. If McConnell is majority leader, there will be no progress.",11-09-2020 20:57:58,1.0
655,"Video of ‘ballot stuffing’ is not from a Flint, Mich., polling place. It’s from Russia",11-05-2020 16:08:19,0.4
656,Megathread: Justice Department Investigating Potential Presidential Pardon Bribery Scheme,12-01-2020 20:24:58,0.8
657,First charges filed in Mueller investigation,10-27-2017 20:31:55,0.4
658,"Sanders condemns his supporters' 'ugly, personal attacks' against Warren",03-04-2020 22:23:23,0.6
659,Trump complains Biden and Obama stopped coronavirus testing even though it didn't exist during their administration,07-13-2020 17:04:26,1.0
660,Trump press secretary Kayleigh McEnany has voted by mail 11 times in 10 years,05-27-2020 12:04:57,0.8
661,Warren offers bill to create wealth tax on net worth above $50 million,03-01-2021 09:11:39,0.8
662,Trump says Abraham Lincoln 'did good' for the Black community but that 'the end result' is 'questionable',06-12-2020 15:36:49,0.4
663,Oregon Sues Federal Government for Grabbing Protesters in Unmarked Vehicles,07-19-2020 19:10:34,0.8
664,Schumer declares Democratic majority in the Senate,01-06-2021 09:12:39,0.8
665,Trump’s ‘Liberate Michigan!’ tweets incite insurrection. That’s illegal. | Federal law bans advocating the overthrow of government.,04-17-2020 21:13:26,0.6
666,Alexandria Ocasio-Cortez is heavily favored to win her reelection race. Her challenger has still raised $10 million because Republicans are desperate to beat her.,10-25-2020 12:27:06,1.0
667,"No charges for Capitol Police officer who shot Jan. 6 rioter, Justice Department says",04-14-2021 13:58:30,0.4
668,Dan Rather asks Trump what’s more ‘marginal’: ‘Believing in Santa at age 7 or not believing in climate change at age 72?,12-26-2018 08:42:06,1.0
669,Arizona Certifies Biden’s Election Victory Over Trump,11-30-2020 13:27:11,0.6
670,Bernie Sanders says the 'GOP has ceased to be a political party' and 'is now a cult' for staying silent on Trump's election attacks,11-20-2020 16:09:46,0.6
671,Taylor Swift: Trump's 'calculated dismantling' of USPS proves he's trying to 'blatantly cheat' election,08-15-2020 14:29:56,0.6
672,"H.Res.757 - Calling for the resignation and disbarment of United States Attorney General William P. Barr, and for other purposes.",12-11-2019 21:50:42,0.6
673,MSNBC airs 80-second supercut of Trump’s racist remarks over the past 30 years,10-29-2020 13:23:46,0.8
674,US spies say Trump's G7 performance suggests he's either a 'Russian asset' or a 'useful idiot' for Putin,08-29-2019 16:32:31,1.0
675,Trump ‘wants to set up ‘MAGA party’ to challenge Republicans who voted to impeach him’. Fight likely to consume GOP’s energies for months – if not years,01-24-2021 17:05:57,0.8
676,Schiff: 'No reason' Trump should get intel briefings ever again,01-17-2021 11:25:52,1.0
677,"Man really did hack Trump’s Twitter account by guessing password, ‘maga2020!,’ Dutch prosecutors confirm",12-17-2020 10:49:52,1.0
678,"Government study shows taxpayers are subsidizing “starvation wages” at McDonald's, Walmart. Sen. Bernie Sanders called the findings ""morally obscene""",12-12-2020 11:29:03,0.6
679,Senate strips provision from intelligence bill requiring campaigns to report foreign election help,06-30-2020 13:40:21,0.6
680,Biden: 'It's time corporate America paid their fair share of taxes',07-09-2020 16:16:56,0.8
681,Navy Captain Removed From Carrier Tests Positive for Covid-19,04-05-2020 12:08:51,0.6
682,Republicans Are Afraid to Attend Their Convention But Want Your Kids in School,07-14-2020 13:32:13,1.4
683,Schumer: Senate will act on marijuana legalization with or without Biden,04-03-2021 09:03:19,1.2
684,"Trump Could Be Investigated for Tax Fraud, D.A. Says for First Time",09-21-2020 16:28:29,0.8
685,White House goes quiet on coronavirus as outbreak spikes again across the U.S.,06-10-2020 06:37:04,1.0
686,Trump is reportedly 'very aware' he lost the election but is putting up a fight as 'theater',11-12-2020 10:07:31,1.2
687,Kamala Harris will be escorted at the inauguration by heroic Capitol Police officer Eugene Goodman,01-20-2021 10:46:57,0.8
688,"‘Trickle-down’ tax cuts make the rich richer but are of no value to overall economy, study finds",12-26-2020 21:41:58,0.6
689,New York State Bar moves to revoke Rudy Giuliani's membership - report,01-11-2021 09:55:22,0.6
690,Kanye West Gets Thrown Off The Ballot In Wisconsin,08-20-2020 18:55:41,1.0
691,White House considers revoking Trump's access to intelligence briefings,02-01-2021 16:33:55,1.0
692,Megathread: AP Calls Alabama Senate Special Election for Democrat Doug Jones,12-12-2017 22:27:29,0.6
693,"Bernie Sanders Is Right, and Joe Biden Is Wrong. We Still Need Medicare for All.",01-22-2021 12:23:16,0.8
694,Rudy Giuliani realized he can't actually be Trump's impeachment lawyer because he's a witness in the case,01-18-2021 05:59:49,1.0
695,Florida Republican Wants to Exclude Felons From Minimum Wage Increase Because Florida Republicans Are Terrible People,01-29-2021 09:27:38,1.2
696,Trump Supporter Arrested For Requesting Absentee Ballot For Dead Mother,10-22-2020 16:56:30,1.2
697,"Trump only agreed to condemn the Capitol rioters after realizing he could face legal trouble for inciting them, report says",01-08-2021 06:58:27,0.8
698,Trump has concealed details of his face-to-face encounters with Putin from senior officials in administration,01-12-2019 18:17:30,1.2
699,Obama films 18 separate state-specific 'How To Vote' videos,10-13-2020 17:16:25,0.8
700,"Poll: Most Americans support raising taxes on those making at least $400,000",12-02-2020 16:08:29,1.0
701,Wisconsin election results: Biden overtakes Trump with 4% of votes left to count,11-04-2020 06:29:36,1.0
702,"Republican Senator Who Voted for Trump's $1.5 Trillion Tax Cut for the Rich Blocks $1,200 Stimulus Checks",12-18-2020 14:46:30,0.6
703,Trump mocked for signing blank paper in ‘staged’ photos at Walter Reed,10-04-2020 09:03:45,1.0
704,"Dear Wisconsin: If Trump wants a recount, make him pay up front",11-07-2020 07:54:56,1.0
705,Michael Cohen says the associates Trump pardoned may now be forced to testify against him because they can no longer invoke the Fifth Amendment,12-29-2020 06:26:24,0.6
706,#ArrestRandPaul trends on Twitter after he walks out over impeachment question,01-30-2020 20:28:09,1.0
707,AOC: There are ‘legitimate white supremacist sympathizers’ at core of House GOP,01-27-2021 22:07:32,0.6
708,Megathread: Michael Cohen pleads guilty to lying to Congress about Trump real estate project in Russia,11-29-2018 09:34:14,0.6
709,America doesn’t want another Tea Party - Don’t let Fox News fool you. 81% of Americans do not share the views of anti-quarantine protesters.,04-20-2020 13:20:56,0.8
710,It Sure Looks Like Trump Will Face Criminal Charges for Election Fraud,02-10-2021 14:36:33,0.8
711,Teachers union president dares Trump to sit in classroom amid coronavirus 'and breathe that air',07-08-2020 10:37:38,1.2
712,"AOC calls Amazon jobs a 'scam' because more than 4,000 of its employees are on food stamps",12-19-2020 05:21:01,0.6
713,ACLU calls for dissolving of Department of Homeland Security,08-10-2020 12:57:21,0.6
714,Rep. Cori Bush calls for expulsion of House Republicans who sought to overturn election,01-06-2021 17:10:24,0.8
715,Kamala Harris Challenges Bill Barr to Say–Under Oath–that Clearing of Lafayette Square Was Unrelated to Bible Photo Op,06-04-2020 17:25:02,0.8
716,A New Congressional Budget Office Study Shows That Medicare for All Would Save Hundreds of Billions of Dollars Annually,12-28-2020 09:12:10,0.6
717,"Sanders on McConnell: ‘When children are going hungry in America, suddenly we don't have enough money’",12-09-2020 12:31:52,0.8
718,North Carolina Court Wipes Out Voting Restrictions Designed to “Secure White Supremacy” | Tens of thousands of people are suddenly eligible to vote in November.,09-08-2020 18:59:49,0.8
719,NY Times estimates wealthy Americans are refusing to pay $1.4 trillion in uncollected taxes,03-22-2021 20:06:23,0.8
720,Ocasio-Cortez: 'Members of Congress should not be allowed to own individual stock',03-20-2020 12:23:19,0.6
721,Biden Clinches Electoral College Win as California Certifies,12-04-2020 19:16:54,0.8
722,Giuliani associate willing to tell Congress Nunes met with ex-Ukrainian official to get dirt on Biden,11-22-2019 21:02:37,0.8
723,42% of Voters Say Trump Will Be Known as 'One of Worst' Presidents in History: Fox News Poll,12-11-2020 22:12:16,1.0
724,"'Literally What Jesus Told People to Do': In Arizona, Possible Prison Time for Leaving Food and Water for Migrants — ""If giving water to someone dying of thirst is illegal, what humanity is left in the law of this country?""",01-21-2019 11:51:23,0.6
725,Fauci warns of 'anti-science bias' being a problem in US,06-18-2020 18:06:44,0.6
726,"Trust me, I leaked the Pentagon Papers. Trump is an enemy of the Constitution and must be defeated.",10-13-2020 10:02:24,0.8
727,Bill Gates says we can’t restart the economy soon and simply “ignore that pile of bodies over in the corner”,03-24-2020 13:48:45,1.0
728,Trump claims the media misrepresented his coronavirus cure comments. Video proves otherwise. The president is now routinely lying about things we saw with our own eyes and that are on tape.,04-26-2020 13:43:03,1.0
729,Trump Just Exposed Secret Service to COVID-19 to Do a Drive-By For MAGA Supporters,10-04-2020 18:43:17,1.0
730,"Texas governor to close mail-in ballot drop-off boxes, limiting one per county",10-01-2020 14:15:02,0.8
731,Trump vows 'no more' federal aid to California as devastating wildfires continue to burn,11-03-2019 09:21:37,0.6
732,The Trump Organization Planned To Give Vladimir Putin The $50 Million Penthouse In Trump Tower Moscow,11-29-2018 17:56:12,1.2
733,Report: Georgia Secretary Of State Says Graham Pressed Him To Toss Legal Ballots,11-16-2020 18:38:20,1.2
734,Megathread: Bernie Sanders announces 2020 presidential run,02-19-2019 08:21:00,1.0
735,Panic in the White House as Staffers Discover There Is Some Sort of Pandemic Happening,07-30-2020 15:31:37,1.0
736,Alexandria Ocasio-Cortez's 'Corruption Game' Speech Is Now the Most Viewed Twitter Video of Any Politician,02-12-2019 10:31:37,0.6
737,House passes bill to require presidents to disclose their tax returns,03-08-2019 12:23:57,1.0
738,"Senate Democrats file ethics complaint against Hawley, Cruz over election challenge",01-21-2021 16:28:17,0.8
739,Biden netted 132 extra votes after Milwaukee County recount,11-27-2020 19:44:45,0.8
740,"In 2019, Marjorie Taylor Greene told protesters to ""flood the Capitol,"" feel free to use violence",02-02-2021 06:47:34,0.8
741,"Senator Warren urges Biden: Raise minimum wage, cancel student debt, invest in child care.",11-18-2020 06:31:41,1.0
742,Trump now claims he spoke 'sarcastically' when repeatedly suggesting people inject disinfectant to cure coronavirus,04-24-2020 13:01:33,1.4
743,Texas Mayor who told residents he owed them 'nothing' after storm power outage has resigned,02-17-2021 09:26:11,0.6
744,Trump promises Michigan that he will 'never come back' if he loses the state to Biden,11-03-2020 07:25:57,0.8
745,"Conservative Icon George Will Urges Nov. Sweep: Vote Out Trump, All GOP Enablers",06-02-2020 07:18:58,0.8
746,Trump Wants Covid-19 Media Coverage To Be Illegal: ‘Should Be An Election Law Violation’,10-26-2020 09:23:29,0.8
747,USPS Special Agents Raided Home of QAnon-aligned Mail Carrier Who Allegedly Hoarded and Threw Out Several Bags of Undelivered Mail,10-14-2020 10:51:47,0.6
748,Survivors demand Marjorie Taylor Green resign over more school shooting conspiracy comments,01-21-2021 20:35:58,0.6
749,"With $100B internet plan, Biden commits to bring down ‘overpriced’ broadband bills",04-13-2021 18:04:49,0.8
750,Trump impeachment hearing opened by Congress for first time,09-17-2019 13:34:48,0.8
751,GOP Congresswoman Blamed Wildfires on Secret Jewish Space Laser,01-28-2021 17:55:08,0.8
752,"After suing Fox News for $1.6 billion, Dominion says it could file lawsuits against other media outlets and even Trump",03-30-2021 07:30:13,0.6
753,2 DOJ whistleblowers testify that AG William Barr interfered in investigations to help Trump,06-24-2020 12:43:29,0.6
754,"After Life of Incalculable Harm, Billionaire Climate Denialist and Right-Wing Villain David Koch Dead at 79",08-23-2019 13:09:45,0.6
755,Analysis: Trump finishes with worst first term approval rating ever,01-16-2021 09:21:31,1.0
756,"Georgia prosecutor seriously considering a criminal investigation into Trump's election interference, report says",01-16-2021 06:31:59,0.6
757,Trump White House edits Putin support for Trump out of transcript and video,07-24-2018 23:21:56,0.8
758,‘Stop it’: Biden tells states to drop ‘new Jim Crow’ laws and praises companies ‘speaking up’ over Georgia voting restrictions,04-06-2021 16:46:06,0.6
759,Melania Trump reportedly taped making 'disparaging' remarks about president and his children,08-24-2020 10:51:19,1.0
760,99.7 Percent of Unique FCC Comments Favored Net Neutrality,10-15-2018 15:59:44,0.6
761,AOC Says U.S. 'Must Atone' for Rights Violations After Whistleblower's ICE Hysterectomy Claims,09-15-2020 08:55:31,0.8
762,"'Maybe We Ought to Go to $20 an Hour. Why Stop at $15?' Scoffs House Republican Arguing Against Wage Hike | The Republican lawmaker didn't acknowledge that had the federal minimum wage kept pace with productivity, it would be around $24 an hour today.",02-10-2021 06:25:33,0.6
763,Nancy Pelosi refuses to rule out second impeachment of Trump to delay Supreme Court battle,09-20-2020 10:40:59,0.6
764,"Trump Apparently Called Everybody in Georgia Except Boss Hogg, and They All Recorded It",03-11-2021 15:17:58,1.0
765,'Matt Gaetz wants to date your child' billboard appears in Florida,04-08-2021 16:27:53,1.2
766,30% of 18- to 29-year-olds say history will judge Trump as 'the worst president ever',04-23-2021 18:57:03,1.0
767,"Most Americans would rather spend the $5 billion Trump is demanding for the border wall on infrastructure, education, or healthcare",12-27-2018 14:27:43,0.6
768,Megathread: U.S. Supreme Court Rejects Republican Challenge to Biden's Pennsylvania Win,12-08-2020 17:26:45,0.6
769,Ex-Trump aide Scaramucci says president’s ‘well wishes’ to Ghislaine Maxwell are coded message: ‘Please don’t talk’,07-22-2020 12:37:16,0.8
770,"Opinion: With Justice Ginsburg’s death, Mitch McConnell’s nauseating hypocrisy comes into full focus",09-19-2020 07:51:10,0.8
771,"Biden: ""I trust vaccines, I trust scientists, but I don’t trust Donald Trump""",09-16-2020 16:28:43,1.0
772,Ninth Circuit Hands Trump Admin a Big Loss: the Transfer of Military Funds to Build the Wall Was ‘Unlawful’,06-26-2020 13:27:46,0.8
773,"Donald Trump should concede and ‘put country above his ego’, says Barack Obama",11-15-2020 19:56:51,1.0
774,Cory Booker Wants To End Qualified Immunity For Police Officers,06-07-2020 20:49:30,1.0
775,Ajit Pai admits Russia interfered in net neutrality process amidst lawsuit,12-05-2018 09:50:49,0.6
776,"Goodbye, Rudy Giuliani",11-07-2020 14:06:11,1.0
777,"""Is that too socialist too?"": AOC pleads for second stimulus checks and rent forgiveness as pandemic rages",11-13-2020 22:45:57,0.6
778,"New documents show Trump kept 2 sets of books for his biggest property in Manhattan, pointing to potential financial fraud",11-27-2019 10:38:44,0.8
779,Obama accuses Trump White House of suppressing black voters in rare direct attack,09-29-2020 15:02:07,0.6
780,Adam Schiff Erupts: Closing Statement On Contentious Impeachment Hearing,11-21-2019 16:39:44,0.6
781,Jaime Harrison shatters Senate fundraising record for South Carolina race,10-11-2020 07:23:18,0.8
782,America Didn’t Give Up on Covid-19. Republicans Did.,06-25-2020 18:40:27,0.6
783,Donald Trump Appears to Have Committed Felony Voter Fraud,06-03-2020 17:34:11,0.8
784,It’s impeachable. It’s likely illegal. It’s a coup.,01-03-2021 17:16:14,0.6
785,MyPillow Ceo Mike Lindell brings notes to White House that suggest calling for ‘martial law if necessary’,01-15-2021 17:29:55,0.8
786,The doctor behind a cognitive test Trump took says ‘it’s supposed to be easy’ for people with no cognitive impairment,07-20-2020 14:04:33,1.0
787,Letter from 68 Colorado elected officials requests investigation into Boebert's actions,01-14-2021 15:11:33,0.6
788,Stacey Abrams says 750K Georgians have requested ballots for runoff,11-24-2020 07:39:04,0.6
789,QAnon Supporters Vow to Leave GOP After Mitch McConnell Accepts Election Result,12-16-2020 06:40:46,0.6
790,"Bernie Sanders Warns Total Economic Collapse Will Be More Expensive Than Paying Workers, Reducing Health Care Costs Amid Coronavirus",04-04-2020 10:51:04,1.0
791,"Here Are the 8 Democrats Who Just Joined GOP to Vote Down Sanders' $15 Minimum Wage Amendment | ""Every single Dem who voted against a $15 minimum wage should be primaried.""",03-05-2021 12:16:11,0.6
792,The world is realizing the U.S. is no longer committed to basic standards of decency,07-27-2020 21:11:54,1.6
793,FBI: No evidence antifa involved in Capitol riot,01-08-2021 17:47:12,0.6
794,The Senate just dropped a massive Russia bombshell (and most people missed it),08-19-2020 15:27:11,1.0
795,"Bernie Sanders: We need scientists, not politicians, in charge of the coronavirus response | Let scientists and health professionals take charge. Stop spreading lies and focus on minimizing the risk and addressing health care needs.",03-05-2020 13:47:38,0.8
796,Megathread: U.S. House Speaker Pelosi Calling Back Chamber to Work on Postal Service Legislation,08-16-2020 20:30:44,0.8
797,Mitt Romney sides with Democrats calling for $12 hourly raises for essential workers,05-02-2020 12:37:36,0.6
798,"Mitch McConnell just adjourned the Senate until November 9, ending the prospect of additional coronavirus relief until after the election",10-27-2020 00:50:12,1.0
799,Trump Suddenly Loses Interest In Briefings After Disastrous Disinfectant Comments,04-26-2020 08:35:57,1.2
800,"GOP Senator Kept Coronavirus Info Secret for Weeks, But Shared It With Wealthy Donors",03-19-2020 11:59:49,1.0
801,"Ted Cruz, who obsessed over Clinton emails, wants to “move on” from insurrection.",01-27-2021 11:10:35,0.8
802,Source: Leaked Documents Show the U.S. Government Tracking Journalists and Immigration Advocates Through a Secret Database,03-06-2019 19:06:00,0.6
803,Megathread: President Trump Suggests Delaying 2020 Presidential Election,07-30-2020 09:29:28,0.8
804,'Trump kept saying it was basically pretty much a cure': Woman whose husband died after ingesting chloroquine warns the public not to 'believe anything that the president says',03-23-2020 21:43:30,1.2
805,Bernie Sanders Is the Only Leading Presidential Candidate Pledging to Vote Against the Patriot Act,02-24-2020 14:27:20,1.0
806,Megathread: Ex-Trump adviser Roger Stone arrested in Mueller probe,01-25-2019 06:33:39,0.8
