idx,title,created_utc,humor_scores
0,Megathread: Joe Biden Projected to Defeat President Donald Trump and Win the 2020 US Presidential Election,11-07-2020 11:28:04,1.0
1,Mitch McConnell Will Lose Control Of The Senate As Democrats Have Swept The Georgia Runoffs,01-06-2021 08:25:44,0.8
2,"AOC challenges Trump to release his college transcript after he called her a 'poor student' on Fox News | 'You release your college transcript, I’ll release mine, and we’ll see who was the better student. Loser has to fund the Post Office,' New York congresswoman tweets",08-13-2020 10:45:08,0.8
3,Megathread: House Votes to Impeach President Donald J. Trump,12-18-2019 20:36:13,1.0
4,"Biden signs federal mask mandate, repeals Muslim Ban, and rejoins Paris Climate Agreement",01-20-2021 17:28:55,1.0
5,Trump Threatens to ‘Leave the Country’ if He Loses to Biden,10-16-2020 21:08:58,1.2
6,"Demands for Kushner to Resign Over 'Staggering' Level of 'Depravity' That Put Politics Before Public Health. ""Holy hell. Jared Kushner reportedly abandoned a national testing plan because it was *politically advantageous* to sit back and let blue states be eviscerated by the virus.""",07-31-2020 11:46:57,0.6
7,Over A million people sign petition calling for KKK to be declared a terrorist group,06-12-2020 06:36:46,0.6
8,White House Website Recognizes Climate Change Is Real Again,01-20-2021 14:43:55,0.8
9,Report: Biden Admin Discovers Trump Had Zero Plans For COVID Vaccine Distribution,01-21-2021 08:41:47,1.2
10,Biden's Pennsylvania lead is now big enough to avoid an automatic recount,11-11-2020 17:32:41,0.6
11,"Donald Trump Has Just Left the White House—This Time, for Good",01-20-2021 08:18:37,1.4
12,Virginia governor makes Election Day a holiday and expands early voting,04-12-2020 16:13:46,1.0
13,"'Cry Me a River': Sanders Hits Back as Billionaire Investor Whines About Potential Tax Hikes Amid GameStop Fiasco | ""Oh look, another billionaire is mad that he might have to pay more taxes while children in America go hungry and veterans sleep on the street.""",01-29-2021 05:57:17,0.8
14,"House charges Donald Trump with impeachment for ""inciting an insurrection""",01-11-2021 09:49:20,0.8
15,Giuliani sued for $1.3 billion by Dominion Voting systems over false election fraud claims,01-25-2021 07:36:49,0.6
16,Pentagon cancels all contracts to build Trump’s border wall,04-30-2021 17:12:33,0.8
17,"FBI Asks for Evidence of Individuals Inciting Violence During Protests, People Respond With Videos of Police Violence",06-02-2020 13:53:52,0.6
18,Joe Biden Has Taken The Lead In The Historically Red State Of Georgia,11-06-2020 04:26:02,0.6
19,Sen. Elizabeth Warren wants to bar members of Congress from ever trading individual stocks again,05-24-2021 14:48:42,0.8
20,"Video emerges showing Trump talking about cutting pandemic team in 2018, despite saying last week 'I didn't know about it'",03-16-2020 19:55:39,0.8
21,Fox News sued for $1.6bn over false election claims,03-26-2021 07:11:21,0.6
22,Megathread: House Votes to Impeach President Donald J. Trump for Incitement of Insurrection,01-13-2021 16:28:05,1.0
23,Covid stimulus package worth $1.9trillion clears Senate after Kamala Harris gives tie breaking vote,02-05-2021 06:39:46,0.8
24,"Texas Supreme Court rejects Republican-led effort to throw out nearly 127,000 Harris County votes",11-01-2020 13:49:12,0.6
25,Biden says he'd like live onscreen fact checks to combat Trump 'lies' during debates,09-02-2020 14:06:31,1.2
26,Trump Thought He Could Convince Pence to Overthrow the Election by Calling Him a Pussy,01-13-2021 15:33:26,1.6
27,Video of Lindsey Graham insisting Supreme Court vacancies should never be filled in election years goes viral,09-19-2020 11:13:17,0.6
28,"Trump must turn over financial documents to New York attorney general, judge rules",12-15-2020 17:17:20,0.8
29,Biden to direct Justice Department to not renew contracts with private prisons,01-26-2021 13:51:59,0.8
30,Concerned father arrested while peacefully testifying against Arkansas trans health care ban | He was arrested for going 30 seconds over his allotted two minutes to speak. The anti-LGBTQ hate group representative who spoke before him talked for 40 minutes.,04-28-2021 12:53:05,0.6
31,Democratic nominee Joe Biden tests negative for coronavirus after potential exposure,10-02-2020 12:16:41,1.2
32,Megathread: Joseph R. Biden Sworn in as the 46th President of the United States,01-20-2021 12:14:52,0.8
33,Megathread: President Trump Pressures Georgia Secretary of State to Recalculate the Vote in His Favor in Leaked Phone Call,01-03-2021 14:42:46,1.0
34,"Jon Ossoff beats Sen. David Perdue, handing Democrats control of the Senate",01-06-2021 02:28:26,1.0
35,"Goodbye, Betsy DeVos",11-07-2020 13:19:30,0.8
36,Bernie Sanders Warns Democrats They'll Get Decimated in Midterms Unless They Deliver Big.,01-23-2021 22:26:22,1.0
37,"Democrat Raphael Warnock Defeated Republican Kelly Loeffler In Georgia's Runoff Race, Making Him The State's First Black Senator",01-05-2021 23:18:41,0.6
38,AOC demands probe after Robinhood app banned GameStop purchases triggering 90-minute sell-off frenzy,01-28-2021 12:02:27,0.8
39,Japan is 'shocked' and furious at the US after a major coronavirus outbreak at 2 Marine bases in Okinawa — and says the US is not taking the virus seriously,07-12-2020 10:23:07,1.0
40,"Bloomberg pays fines for 32,000 felons in Florida so they can vote",09-22-2020 09:47:33,1.0
41,"The Trump administration paid a bankrupt company with zero employees $55 million for N95 masks, which it's never manufactured",04-16-2020 13:08:13,0.8
42,NFL commissioner offers Joe Biden all football stadiums as Covid vaccination sites,02-05-2021 15:16:50,0.8
43,Ted Cruz accused of flying to Cancun amid Texas power outages as photo goes viral,02-18-2021 06:37:55,0.8
44,Andrew Yang moving to Atlanta to help Democrats win Senate runoffs,11-08-2020 12:10:34,1.0
45,Georgia Judge Throws Out Trump Campaign Lawsuit That Produced Exactly Zero Evidence of Fraud,11-05-2020 11:40:20,0.6
46,Joe Biden wins Wisconsin,11-04-2020 14:20:41,1.0
47,Removed US coronavirus vaccine director files stunning whistleblower complaint claiming warnings were ignored,05-05-2020 15:29:40,0.6
48,Donald Trump Should Be Impeached and Removed from Office Tomorrow,01-06-2021 15:53:25,1.2
49,"Why Impeach Trump at This Late Date? One Word, Says Bernie Sanders: 'Precedent' - ""It must be made clear that no president, now or in the future, can lead an insurrection against the U.S. government.""",01-08-2021 20:18:56,0.6
50,Flight attendant union says Capitol rioters should be banned from flights home,01-06-2021 22:08:11,0.8
51,Megathread: President Donald Trump announces he has tested positive for Coronavirus,10-02-2020 01:15:48,1.2
52,"James Mattis Denounces President Trump, Describes Him as a Threat to the Constitution",06-03-2020 18:02:45,0.6
53,Biden has now received more votes for president than any other candidate in U.S. history,11-04-2020 09:56:42,1.0
54,"Kim Davis, clerk who refused to sign marriage licenses for gay couples, loses to Democrat",11-06-2018 20:02:55,1.0
55,"Chuck Schumer made sure businesses controlled by Trump, his family, and top US officials couldn't get money from the government's $2 trillion coronavirus bailout fund",03-25-2020 08:19:59,1.0
56,President Trump has committed treason,01-06-2021 20:29:01,0.8
57,Warren reintroduces bill to bar lawmakers from trading stocks,12-19-2020 09:24:51,1.0
58,"‘I can no longer call myself a ... Republican,’ Colin Powell says after Capitol riot",01-10-2021 16:44:24,0.8
59,Twitter bans posts wishing for Trump death. The Squad wonders where that policy was for them,10-03-2020 16:34:33,0.8
60,"Sanders Bill Would Hike Taxes on Big Corporations That Pay CEOs Over 50 Times More Than Median Worker | ""Walmart, which pays its CEO nearly 1,000 times more than its average worker, would pay up to $855 million more in taxes.""",03-17-2021 08:39:38,0.8
61,Pelosi announces lawmakers will be fined $5K if they bypass metal detectors to House floor,01-13-2021 20:24:32,1.2
62,Megathread: Long-Concealed Records Show President Trump’s Losses and Years of Tax Avoidance,09-27-2020 17:55:12,0.6
63,"Proud Boys intended to kill Mike Pence and Nancy Pelosi, FBI witness says",01-15-2021 21:46:47,0.8
64,"Bernie Sanders Becomes First Candidate, Democrat or Republican, to Win Popular Vote in All 3 Three Early Voting States",02-23-2020 11:29:38,1.0
65,Mississippi hoists new state flag without Confederate emblem for first time,01-12-2021 10:32:40,0.6
66,Biden says drug users should not be jailed as he admits crime bill was a mistake at town hall,10-15-2020 21:07:34,1.0
67,Pence breaks silence to take credit for Pfizer vaccine - and drugs company immediately denies Trump involved,11-09-2020 09:31:36,0.6
68,Stacey Abrams Says 'My Heart is Full' As Georgia Poised to Turn Blue For First Time in 28 Years,11-06-2020 09:36:24,1.0
69,'You almost had me murdered 3 weeks ago': AOC rejects Ted Cruz's support for her criticism of Robinhood,01-28-2021 13:39:50,0.6
70,"Shark Tank's Kevin O'Leary on COVID-19 stimulus: Give American people checks, 'stop funding companies'",12-05-2020 11:40:10,0.4
71,72 Democrats sign motion to expel Marjorie Taylor Greene from Congress,03-18-2021 14:53:52,0.8
72,Trump threatens shut down social media platforms after Twitter put a disinformation warning on his false tweets,05-27-2020 07:46:01,1.2
73,Trump revealed highly classified information to Russian foreign minister and ambassador.,05-15-2017 17:03:22,0.8
74,"They. Sold. Their. Stock. They could have made a difference, but they made a profit.",03-20-2020 09:06:39,0.6
75,Trump claims in debate ‘Portland Sheriff’ gave him endorsement; Reese quickly responds: I ‘will never support him’,09-29-2020 22:44:26,1.0
76,Pentagon to ban all Confederate flags on military bases despite Trump's objections,07-17-2020 11:30:21,0.6
77,The FBI Just Put White Nationalists and Neo-Nazis on the Same Threat Level as ISIS,02-06-2020 14:20:27,0.6
78,"Surprise, Surprise: Off-Duty Cops From All Over the Country Were in D.C. During Capitol Coup Attempt",01-10-2021 19:16:39,0.8
79,Biden Has Already Fired Three of Trump’s Worst Appointees,01-20-2021 20:00:32,1.2
80,AOC Condemns 'Misogynistic' Republicans for Not Criticizing Trump's $70K Hairstyling Write-Off While Attacking Her $250 Haircut,09-28-2020 09:57:51,1.8
81,"Opinion: If you’re ‘essential’ enough to work through a pandemic, you’re essential enough to be paid a living wage",03-30-2020 15:20:29,0.6
82,Ocasio-Cortez raises $1 million for Texas relief in 4 hours,02-18-2021 22:53:06,0.6
83,"Jared Kushner helped create a Trump campaign shell company that secretly paid the president's family members and spent $617 million in reelection cash, a source tells Insider",12-18-2020 12:21:05,0.8
84,Georgia Judge Throws Out Trump Campaign Lawsuit That Produced Exactly Zero Evidence of Fraud,11-08-2020 16:47:18,0.6
85,Megathread: Twitter Permanently Suspends @realDonaldTrump,01-08-2021 18:43:38,0.8
86,"Panic buttons were inexplicably torn out ahead of Capitol riots, says Alyssa Pressley chief of staff",01-13-2021 10:01:21,0.8
87,Donald Trump Labelled 'Loser of the Year' by Europe's Biggest News Magazine,12-10-2020 11:17:04,1.2
88,Biden vows to rejoin Paris climate accord on ‘day one’ if he wins,11-04-2020 23:30:41,0.8
89,"Georgia election official says hand tally of presidential race is complete, the results affirm Biden’s lead over Trump",11-19-2020 19:15:57,0.6
90,Mitt Romney joins Black Lives Matter march in D.C.,06-07-2020 18:00:33,0.8
91,"Trump not allowed into Scotland to escape Biden inauguration, Sturgeon warns",01-05-2021 10:08:16,1.0
92,Trump suggests injecting disinfectant to treat coronavirus and touts power of sunlight to beat disease,04-23-2020 18:48:31,1.0
93,"U.S. representative's bill would ban QAnon supporters, Capitol rioters from getting security clearances",01-26-2021 10:40:55,0.6
94,We need an investigation into Lindsey Graham’s intervention in Georgia,11-17-2020 08:44:52,0.6
95,Trump and GOP sued for breaching KKK act with ‘coordinated conspiracy to disenfranchise Black voters’,12-22-2020 12:11:34,0.6
96,Pressure on Ted Cruz Grows as Third Texas Newspaper Calls for Him to Resign,01-18-2021 15:51:20,0.8
97,"'A Conspiracy to Steal the Election, Folks': Alarms Sound After Postal Worker Reports Removal of Sorting Machines. The removal of key equipment from Post Offices should be viewed as nothing less than ""sabotage,"" said one observer.",08-12-2020 11:42:16,0.6
98,US military ‘issues rare statement denouncing Capitol riot and confirming Biden as next commander-in-chief’,01-12-2021 16:32:41,0.6
99,Six Republican lawmakers among rioters as police release photos of wanted,01-07-2021 18:02:12,0.6
100,"Sen. John Thune, opposing $15 min wage, says he earned $6 as a kid—that's $24 with inflation",02-25-2021 05:38:50,0.8
101,"Mitch McConnell Made $3,300 This Week While Blocking One-Time $2,000 Stimulus Check",12-31-2020 11:22:46,1.0
102,US election: Biden event in Texas cancelled as 'armed' Trump supporters threaten campaign bus,10-31-2020 10:17:26,0.8
103,"Tulsa fire department says just under 6,200 people attended Trump rally",06-21-2020 09:14:46,0.8
104,"Trump Ordered Mueller Fired, but Backed Off When White House Counsel Threatened to Quit",01-25-2018 20:16:11,1.2
105,Demands for Trump Removal Grow as 'Fascist' Speech Condemned as Declaration of War Against US Public,06-02-2020 09:21:24,0.4
106,"'Yes, Exactly,' Say Progressives After Pence Warns Democrats Will 'Make Rich Poorer and Poor More Comfortable'. ""You have to be all sorts of twisted to think 'making poor people more comfortable' is a bad thing.""",12-23-2020 12:09:13,0.6
107,Twitter now alerts Trump that Biden is president every time he lies about election fraud,12-20-2020 07:53:35,1.0
108,Republicans Can’t Believe Democrats Don’t Want to Work With Them Just Because of the Guns and the Death Threats and the Congresswoman Who Thinks Jews Started the California Wildfires With Space Lasers,01-29-2021 17:34:11,1.0
109,Virginia will eliminate a state holiday honoring Robert E. Lee and Stonewall Jackson. It'll make Election Day a day off instead,02-07-2020 09:33:35,1.0
110,Trump aides reportedly had to explain to the president that his demand to 'Stop The Count' would actually guarantee his loss,11-06-2020 06:09:14,1.0
111,Remove Trump Tonight,01-06-2021 18:15:37,1.0
112,Trump: Americans Who Died in War Are ‘Losers’ and ‘Suckers’,09-03-2020 17:38:26,1.2
113,"She Noticed $200 Million Missing, Then She Was Fired | Alice Stebbins was hired to fix the finances of California’s powerful utility regulator. She was fired after finding $200 million for the state’s deaf, blind and poor residents was missing.",12-26-2020 16:42:48,0.6
114,"George W. Bush won't support Donald Trump’s reelection, report says",06-06-2020 22:42:45,0.8
115,"Trump set to be first president since 1932 to lose reelection, the House and the Senate",01-06-2021 12:15:25,1.0
116,"Donald Trump's so-called 'miracle' coronavirus treatment was tested on cells derived from an abortion – The Trump administration has notably opposed medical research that uses fetal tissue from abortions, while knocking back numerous requests from scientists to work with it.",10-08-2020 07:37:01,0.8
117,Donald Trump Called To Resign After Sleeping During Coronavirus Meeting: COVID19 Response A Failure,03-21-2020 16:30:24,1.2
118,Biden Bars Trump From Intelligence Briefings,02-05-2021 20:34:19,0.8
119,Jon Stewart Goes Off On Congress During 9/11 Hearing,06-11-2019 12:30:15,0.8
120,FBI Finds ‘No Intel Indicating Antifa Involvement’ in Sunday’s Violence,06-02-2020 19:47:11,0.6
121,"Half of all Americans want Trump criminally investigated after presidency, Independent poll finds",10-22-2020 15:06:03,1.0
122,Trump Explodes After Nevada Approves Automatically Sending All Voters Mail-In Ballots,08-03-2020 08:51:54,1.0
123,Eric Trump Busted For Fake Video Of Someone 'Burning 80 Trump Ballots',11-05-2020 06:03:27,1.2
124,Trump Just Admitted on Live Television He Will 'Terminate' Social Security and Medicare If Reelected in November,08-08-2020 18:58:00,0.8
125,Trump and Giuliani sued for conspiracy to incite deadly Capitol riot,02-16-2021 10:18:26,0.8
126,Clinton: 'Please do not take medical advice from a man who looked directly at a solar eclipse',03-24-2020 12:48:10,1.0
127,California police officers would have to be 25 or get bachelor’s degree under new proposal,12-07-2020 20:43:42,0.8
128,Kamala Harris breaks 50-50 tie to begin Senate debate on $1.9T stimulus,03-04-2021 16:32:49,0.6
129,"Romney on Trump impeachment: 'If we're going to have unity,' there must be 'accountability'",01-24-2021 10:12:38,0.6
130,Warnings of Possible Cover-Up in Progress as Trump Orders Hospitals to Stop Sending Covid-19 Data to CDC,07-15-2020 06:09:48,0.6
131,California bans private prisons – including Ice detention centers,09-12-2019 14:12:21,0.8
132,Beto O'Rourke is organizing wellness checks for seniors during Texas' blackouts. Ted Cruz is in Cancun.,02-18-2021 10:38:00,0.8
133,Wendy Davis says Trump supporters harassing a Biden bus in Texas should have served as a warning before U.S. Capitol riot,01-11-2021 17:33:30,0.8
134,Robert E. Lee high school in Virginia gets a name change: It's now John R. Lewis,07-23-2020 19:58:57,0.6
135,"People who follow Trump's advice and hang around watching polling places will be prosecuted, Nevada's attorney general says",09-30-2020 09:29:23,0.8
136,US election: Biden becomes first-ever presidential candidate to receive 80 million votes,11-24-2020 11:01:42,1.2
137,Ted Cruz mocked Alexandria Ocasio-Cortez at CPAC after the congresswoman raised millions for his Texan constituents,02-28-2021 07:08:10,0.8
138,Washington state radio station won't air Trump briefings because of 'false or misleading information',03-25-2020 12:20:27,0.8
139,"Postal workers union endorses Biden, warns 'survival' of USPS at stake",08-14-2020 13:13:26,0.4
140,"Trump leaving office with 3M less jobs than when he entered, worst record since Depression",01-19-2021 16:48:07,0.8
141,Joe Biden's Gettysburg speech was 25 minutes long and didn't mention Trump once,10-07-2020 07:59:56,0.8
142,Pence Should Invoke 25th Amendment to Remove Trump From Office Immediately,01-06-2021 15:43:27,1.2
143,Biden terminates national emergency declaration on the US-Mexico border which Trump used to pay for his wall,02-11-2021 10:37:43,1.2
144,Anthony Fauci calls out “extraordinary stigma” gays face while standing right in front of Mike Pence,04-08-2020 18:53:53,1.4
145,McConnell calls Marjorie Taylor Greene a ‘cancer’ to GOP in stunning attack on pro-Trump outsider,02-01-2021 20:38:05,0.6
146,Misinformation dropped dramatically the week after Twitter banned Trump,01-16-2021 13:16:05,1.0
147,"Fauci says he accepted Biden's offer to be chief medical adviser ""on the spot""",12-04-2020 07:41:40,0.8
148,House Schedules Historic Vote on Decriminalizing Marijuana at the Federal Level,08-28-2020 17:20:43,1.4
149,Trump's 'Don't be afraid of COVID' tweet may be the most irresponsible one in history,10-05-2020 18:01:32,0.8
150,Republicans Are Tough on Terrorism Until the Terrorists Are Republicans,01-13-2021 17:27:55,0.8
151,Sanders: 'I never expected in my life as an American to see a swastika at a major political rally',03-08-2020 10:00:57,0.8
152,Ivanka Trump used a personal email account to send hundreds of emails about government business last year,11-19-2018 18:35:44,0.8
153,Minnesota Officials Link Arrested Looters to White Supremacist Groups,05-30-2020 15:30:43,0.6
154,"Democrats want to fine colleagues $1,000 a day if they refuse to wear a mask on Capitol grounds",01-12-2021 14:06:49,1.4
155,Warren reintroduces bill to bar lawmakers from trading stocks,12-27-2020 13:07:28,1.0
156,"Donald Trump and Jared Kushner receive $3.65m in PPP loan money intended for small businesses, report says",12-02-2020 15:26:27,0.8
157,Democrats prepare bill limiting U.S. Supreme Court justice terms to 18 years,09-24-2020 18:13:04,0.8
158,"Fed should pay every American more, let hedge funds and billionaires ‘get wiped out,’ says Social Capital CEO | ‘What we’ve done is disproportionately prop up poor-performing CEOs and boards,’ Chamath Palihapitiya tells CNBC",04-10-2020 07:32:43,0.4
159,GOP Lawmaker Who Voted Against Paid Sick Leave in Florida Takes Paid Leave From Congress,03-12-2020 18:48:46,1.0
160,Don't trust presidential polls that show huge leads for Joe Biden. The race isn't over.,10-10-2020 09:05:41,0.8
161,Alexandria Ocasio-Cortez To Co-Sponsor House Bill Banning Members Of Congress From Trading Stocks,03-23-2020 19:09:29,0.8
162,President Trump’s Twitter accessed by security expert who guessed password “maga2020!”,10-22-2020 11:46:25,0.8
163,"Trump refuses to denounce white supremacy, says 'stand back and stand by' on Proud Boys movement",09-29-2020 22:43:33,0.6
164,Anonymous security forcing citizens into cars is mark of dictatorship,07-18-2020 11:22:15,0.8
165,Congressman Cohen Will Introduce Resolution to Abolish the Electoral College,01-09-2021 16:15:34,1.0
166,"Joe Biden crosses 79 million votes, 10 million more than any other president in history",11-18-2020 12:58:08,1.2
167,Democrat senators vow to legalise cannabis this year,02-02-2021 11:12:09,1.4
168,Anonymous Source Tells Times Reporter Don Jr. Is Worried His Father Will Lose And Whole Family Will Be Prosecuted,08-24-2020 16:32:16,0.8
169,"Bar association urged to disqualify Giuliani over ""trial by combat"" speech before D.C. riot",01-09-2021 18:29:29,0.6
170,A petition calling for FCC Chairman Ajit Pai to resign is racking up huge numbers,11-26-2017 15:59:58,0.6
171,Megathread: Trump says he deliberately played down the threat of Coronavirus in recorded interview with Bob Woodward,09-09-2020 13:06:58,1.0
172,Trump claims coronavirus is ‘going to just disappear’ as US sees record number of new cases,07-01-2020 15:32:54,1.0
173,"Donald Trump Has At Least $1 Billion In Debt, More Than Twice The Amount He Suggested",10-16-2020 11:37:39,1.0
174,F.B.I. Opened Inquiry Into Whether Trump Was Secretly Working on Behalf of Russia,01-11-2019 20:21:08,0.8
175,"Alexandria Ocasio-Cortez Raises $280,000 Overnight for Georgia Senate Runoffs Grassroots Organizing",11-12-2020 16:26:23,0.8
176,The FCC’s craven net neutrality vote announcement makes no mention of the 22 million comments filed,11-21-2017 14:45:36,0.6
177,Forbes editor issues warning to companies intending to hire Trump officials: 'We'll assume everything you talk about is a lie',01-10-2021 13:04:39,1.0
178,Trump Promised a Vaccine by Election Day—None Have Even Applied for Approval,11-03-2020 11:36:49,1.6
179,Texas Democrats Call For Sen. Ted Cruz's resignation for 'Acting In Bad Faith',01-07-2021 12:00:28,0.8
180,Poll: 57% of voters say US political system works only for insiders with money & power,03-31-2020 17:04:48,0.8
181,McConnell slams Bernie Sanders defence bill delay as an attempt to ‘defund the Pentagon’. Progressive senator likely is forcing Senate to remain in session through 2 January,12-30-2020 17:09:35,0.6
182,'He Is Lying. People Are Dying': Calls for Texas Governor to Resign as He Blames Power Outages on Wind and Solar,02-17-2021 06:20:22,0.8
183,'I don't kid': Trump contradicts aides and insists he meant it when he asked for coronavirus testing to be slowed down,06-23-2020 10:04:10,1.0
184,"Megathread: US Capitol Locked Down as Trump Supporters Clash with Police, Pence Evacuated",01-06-2021 14:41:11,1.2
185,"Protester in Viking headdress ID’d as Trump supporter, not Antifa",01-07-2021 16:33:16,0.8
186,Trump says he wishes accused sex trafficker Ghislaine Maxwell well and has 'met her numerous times',07-21-2020 17:43:59,1.2
187,The biggest question Twitter users have from the debate: Can we mute the mics next time? The president interrupted both the moderator and Biden at least 128 times.,09-30-2020 11:56:24,1.2
188,"Trump is refusing to unveil Obama's portrait at the White House, breaking a 40-year tradition",05-19-2020 10:39:14,1.0
189,"Congressman calls for service members, veterans who stormed the Capitol to be stripped of benefits",03-19-2021 14:16:44,0.6
190,"Trump said the 1918 Spanish Flu 'probably ended' WWII, which did not begin until 21 years after the pandemic",08-10-2020 20:00:00,0.6
191,Trump hasn't attended a coronavirus task force meeting in five months and is taking no role in combatting the surge in the disease,11-15-2020 06:55:37,1.2
192,Trump administration hands emergency loans to Kanye West and Church of Scientology as small businesses go bust,07-07-2020 07:45:15,0.8
193,"The Trump campaign's non-disclosure agreements have been voided by a court, opening the door for whistleblowers",03-31-2021 08:16:16,0.6
194,Fact check: Congress expelled 14 members in 1861 for supporting the Confederacy,01-03-2021 07:51:10,0.6
195,"Biden Has Finally Won Arizona, Turning It Democratic For The First Time In Decades",11-11-2020 22:32:32,1.0
196,"White House ordered NIH to cancel coronavirus research funding, Fauci says",06-24-2020 19:38:41,0.8
197,Auschwitz Memorial calls Greene Holocaust comments a 'sad symptom of moral and intellectual decline',05-25-2021 16:38:01,0.2
198,“It’s no longer a political party. It’s a cult.” Former Oklahoma GOP Congressman leaves Republican Party,01-15-2021 07:47:09,0.8
199,It's time to start handing out fines to people who refuse to wear masks,08-02-2020 10:41:26,1.2
200,Debates commission plans to cut off mics if Trump or Biden break rules,10-01-2020 08:08:24,1.6
201,Biden not getting intelligence reports because Trump officials won't recognize him as president-elect,11-10-2020 15:14:36,1.0
202,Biden To Have Entire WH East And West Wings Showered With Disinfectant Right After Trump Leaves,12-10-2020 08:06:47,1.2
