idx,title,created_utc,humor_scores
203,Feds say plot was bigger than kidnapping Gov. Whitmer. It was civil war attempt.,10-08-2020 18:45:34,0.6
204,AOC says coronavirus bailout should ban stock buybacks — especially for airlines,03-17-2020 18:09:35,0.8
205,America's top military officer says 'we do not take an oath to a king',11-12-2020 21:21:58,0.8
206,McConnell blocks House bill to reopen government for second time,01-15-2019 11:34:05,1.0
207,Marjorie Taylor Greene locked out of Twitter as Democrats move to expel her from Congress,03-19-2021 10:25:31,0.8
208,Trump falsely claims he has won election and demands Supreme Court stops more ballots being counted,11-04-2020 02:40:04,1.0
209,Joe Biden Makes Shocking Announcement: None of His Children or Grandchildren Will Be Named Senior Advisers to the President,02-04-2021 15:27:48,1.2
210,"Trump’s attacks on the Postal Service deserve sustained, red-alert coverage from the media",08-15-2020 07:19:19,0.8
211,Man with foot up on desk in Pelosi's office at Capitol arrested,01-08-2021 13:38:25,1.2
212,"Biden: Trickle-down economics ""has never worked""",04-28-2021 22:54:00,0.6
213,"Donald Trump Jr. under investigation in DC, Rep. Hakeem Jeffries says",01-12-2021 19:16:44,0.6
214,"Twitter CEO Jack Dorsey Responds to Trump: ""We’ll Continue to Point Out Incorrect or Disputed Information About Elections""",05-27-2020 23:06:02,0.8
215,Swalwell calls for creation of presidential crimes commission to investigate Trump when he leaves office,08-14-2020 20:40:54,0.8
216,"We Calculated How Much We Pay Trump to Play Golf. It Turns Out, He's America's 10th Highest Paid Athlete",02-19-2020 19:04:47,1.2
217,The Trump Campaign Accepted Russian Help to Win in 2016. Case Closed.,08-19-2020 21:44:04,0.8
218,Megathread: President Trump Directed His Attorney To Lie To Congress About The Moscow Tower Project,01-17-2019 22:56:54,0.8
219,"Ohio city to stop observing Columbus Day, make Election Day holiday instead",02-06-2019 16:00:32,0.8
220,Biden plans immediate flurry of executive orders to reverse Trump policies,11-07-2020 19:46:27,1.0
221,Trump administration accused of siphoning money away from 9/11 fund,09-11-2020 09:46:04,0.6
222,U.S. Intelligence Says Republicans Are Working With Russia to Reelect Trump,08-07-2020 17:16:20,1.0
223,Elizabeth Warren says the stock market has become a 'playground for the billionaires'. She's calling for a wealth tax to fix it.,01-29-2021 13:01:14,0.8
224,Colorado governor stands by saying 'you're a selfish bastard' if you refuse to wear a mask,07-14-2020 20:47:31,1.4
225,An old Ted Cruz tweet mocking California's 'failed energy policies' resurfaces as storm leaves millions of Texans without power,02-16-2021 12:32:37,0.4
226,Trump press secretary Kayleigh McEnany tests positive for coronavirus,10-05-2020 11:29:08,1.2
227,Biden vows to move ‘heaven and earth’ to get 100 million vaccinated in 100 days as he calls Trump effort a ‘dismal failure’,01-21-2021 15:05:50,1.2
228,Maryland governor said he was repeatedly denied authorization to send National Guard to D.C.,01-08-2021 06:21:47,0.6
229,Megathread: Bernie Sanders ends 2020 Democratic presidential bid,04-08-2020 11:29:33,0.8
230,Lawyers Litigating for Trump Suddenly Remember Their Licenses Are on the Line If They Lie to a Judge,11-11-2020 10:57:30,1.0
231,Al Gore says every American should be automatically registered to vote amid growing alarm over GOP voter suppression measures,03-16-2021 10:48:24,0.8
232,The Republicans who were once so pro-life they fought over one woman on life support now want to sacrifice grandma for the economy,04-25-2020 09:27:04,1.2
233,All 50 states and DC have now certified their presidential election results,12-09-2020 16:51:27,0.6
234,Ted Cruz's Approval Rating Among Republicans Drops More Than 20 Percent After Cancun Fiasco,02-24-2021 14:19:39,0.8
235,"Covid: Seven year old dies of coronavirus in Georgia, a day after Trump said children are ‘almost immune’",08-07-2020 11:09:37,1.0
236,"In secretly recorded audio, President Trump’s sister says he has ‘no principles’ and ‘you can’t trust him’",08-22-2020 20:10:23,1.0
237,Trickle-down economics is dead. It’s time to tax the rich harder,01-01-2021 09:13:03,0.8
238,Federal judges are retiring now that Joe Biden will pick their replacements.,01-27-2021 16:08:47,0.8
239,"Amy McGrath Takes Narrow Lead Over Mitch McConnell in Kentucky Senate Race, Poll Shows",06-09-2020 11:30:04,0.8
240,Alexandria Ocasio-Cortez Says Lawmakers Should Lose Their Salaries Too When They Shut Down the Government,12-22-2018 14:26:41,1.0
241,Trump Spreads Baseless Conspiracy Theory That Video of Buffalo Cops Pushing Elderly Man Was Antifa ‘Set Up’,06-09-2020 08:53:59,0.6
242,Alexandria Ocasio-Cortez called for Sen. Richard Burr's resignation after he reportedly sold off $1.7 million in stocks after reassuring the public of US preparedness during the coronavirus outbreak,03-19-2020 22:56:22,0.8
243,"Trump and his company being investigated for bank fraud, Manhattan prosecutors suggest",08-03-2020 13:12:05,0.8
244,US passes ‘historic’ anti-corruption law that effectively bans anonymous shell companies,01-01-2021 18:42:43,0.8
245,McConnell's Wife's Family Business Appears on Trump Admin's List of Companies That Received Most PPP Money,07-06-2020 18:27:51,0.8
246,Trump's GOP Worked Harder to Stop People From Voting Than They Did to Stop Covid-19 From Spreading,11-03-2020 09:06:08,0.8
247,Sanders Joins Calls for Resignation or Removal of Postmaster General Over Efforts to 'Suppress the Vote and Undermine Democracy',08-11-2020 06:04:16,0.8
248,"As Trump Says 'Voting Is An Honor' in Rant Against Mail-In Ballots, Progressives Respond: 'Voting Is a Right' - ""Voting isn't a gift given by leaders. Citizens have the right to vote.""",05-21-2020 07:08:37,0.6
249,"Scarborough calls for arrest of Trump, Giuliani and Trump Jr. for insurrection against US",01-07-2021 08:27:23,0.6
250,"Bernie Sanders dubbed ""national treasure"" after $2,000 stimulus appeal",12-31-2020 06:31:18,0.8
251,'A Red Line Crossed': Nationwide Protests Declared for Thursday at 5PM After Jeff Sessions Fired,11-07-2018 19:39:22,0.8
252,House Democrat Introduces Resolution Calling for Impeachment of Attorney General William Barr,06-30-2020 18:07:51,0.6
253,Tucker Carlson Says There's Not Enough Fraud to Change Election Results: 'We Should Be Honest',11-10-2020 11:03:29,0.8
254,"Bernie Sanders: “President Trump is a socialist, too, but here’s the difference: The difference between my socialism and Trump’s socialism is I believe the government should help working families, not billionaires.”",02-09-2020 15:41:19,0.6
255,"Poll: USPS should be run like a public service, not a business, Americans say 2-to-1",09-28-2020 17:59:35,0.6
256,"Rudy Giuliani Is My Father. Please, Everyone, Vote for Joe Biden and Kamala Harris.",10-15-2020 13:56:54,1.0
257,U.S. Postal Service officials ordered to appear in court after failing to comply with federal judge’s ballot-sweep order,11-04-2020 12:28:43,0.8
258,Louisville police chief fired after no body camera footage of shooting,06-01-2020 16:22:13,0.2
259,"Donald Trump tells supporters he has 'never lost an election', in his first rally since losing the US election",12-05-2020 19:59:03,0.8
260,"Trump flew into a rage every time US intelligence warned him about Russia, so officials gave up briefing him on it, report says",07-02-2020 07:16:18,0.8
261,"Alexandria Ocasio-Cortez Condemns NYPD Test Deployment of K-9 Robot in Bronx Home | ""Please ask yourself: when was the last time you saw next-generation, world class technology for education, healthcare, housing, etc. consistently prioritized for underserved communities like this?""",02-26-2021 14:25:20,0.6
262,"Biden says Trump was ‘paralysed with fear’ by protests and hid ‘in his bunker’ in new campaign ad | ‘Too scared to face the people. Too small to meet the moment. Too weak to lead,’ narrator says",06-12-2020 11:57:10,0.6
263,The FCC has unveiled its plan to repeal its net neutrality rules,11-21-2017 11:21:19,0.6
264,Arresting reporters at a protest is an affront to the First Amendment,05-29-2020 07:51:48,0.6
265,Obama says Trump has caused ‘damage’ by refusing to concede defeat and warns: ‘This is not normal’,11-15-2020 10:57:32,0.8
266,Lindsey Graham’s Alleged Attempt to Toss Georgia Ballots Is Felony Election Fraud,11-19-2020 17:00:54,0.8
267,Tucker Carlson Reports He Lost Only Copy of Documents That Nail Biden,10-28-2020 21:59:52,0.6
268,AOC says Donald Trump should be impeached for Georgia votes phone call,01-04-2021 09:59:08,0.6
269,Vice President Mike Pence and Wife Voted by Mail in April Using Old Indiana Address,06-22-2020 14:40:47,0.6
270,A huge study of 50 years of tax cuts for the wealthy suggests 'trickle down' economics makes inequality worse,12-16-2020 07:41:15,0.4
271,"Trump asked China’s Xi to help him win reelection, according to Bolton book",06-17-2020 14:50:56,0.8
272,"McDonald's, other CEOs have confided to Investors that a $15 minimum wage won't hurt business",04-05-2021 06:21:04,0.6
273,Derrick Evans resigns W.Va. House after entering U.S. Capitol with mob,01-09-2021 13:59:19,1.2
274,"Billionaire Kanye West’s Company Gets Multimillion-Dollar PPP Loan From Trump Admin | The loan poses questions of conflict of interest, given West’s outspoken support for President Donald Trump and the outrageously lavish lifestyle he leads.",07-06-2020 14:54:58,1.0
275,Snoop Dogg Plans to Vote for First Time Ever: 'I Can't Stand to See This Punk in Office',06-06-2020 18:34:29,1.4
276,Lawmakers Demand Removal of Postmaster General DeJoy Over 'Nefarious' Efforts to Destroy the Postal Service and 'Aid Trump Reelection',08-10-2020 05:56:08,0.6
277,"Sorry to Interrupt Your Friday, but Homeland Security is Disappearing American Citizens Off the Street | Law and Order, but Minus the Law.",07-17-2020 15:36:14,1.0
278,Pelosi orders flags at half-staff for Capitol officer that died,01-08-2021 10:01:07,0.6
279,"Pay a Living Wage or 'Flip Your Own Damn Burgers': Progressives Blast Right-Wing Narrative on Jobs | ""If one in four recipients are making more off unemployment than they did working, that's not an indictment of $300 a week in UI benefits. It's an indictment of corporations paying starvation wages.""",05-08-2021 11:32:21,0.4
280,Biden campaign launches ‘TrumpCovidPlan.com’ — a site that reads ‘Not Found’,10-24-2020 11:19:46,0.8
281,"Stacey Abrams on long lines to vote: ""It’s a Poll Tax when someone has to risk an entire day’s wage""",07-03-2020 07:32:57,0.8
282,Colorado passes resolution to award electoral votes to whoever wins the popular vote,11-04-2020 21:50:13,1.0
283,"Over 860,000 Americans Have Already Voted, Compared to Fewer Than 10,000 by This Point in 2016",09-26-2020 13:35:06,0.8
284,Ivanka Trump and Jared Kushner spent $100K of taxpayer money renting a bathroom so Secret Service agents didn't have to use theirs,01-14-2021 13:15:31,1.8
285,"GOP Covid deniers who refused to wear a mask jump the vaccine line, adding insult to injury",12-25-2020 21:40:35,1.0
286,Resurfaced Video Shows Bernie Sanders Criticizing Media for Not Covering Climate Change in 1989,03-09-2019 19:57:23,0.8
287,"H.Res.755 - Impeaching Donald John Trump, President of the United States, for high crimes and misdemeanors",12-11-2019 20:17:58,0.8
288,"Joe Biden Tests Negative Again for COVID-19, Days After Trump Is Diagnosed",10-04-2020 19:31:36,1.0
289,Ted Cruz is asked why national debt is paramount to Republicans only when a Democrat is in the White House,10-27-2020 20:55:43,0.6
290,Unqualified Impunity: Amy Coney Barrett Once Ruled That a Cop Wasn't Responsible for a Black Teenager's Death Because Breathing Isn't a Constitutional Right,10-22-2020 08:32:27,0.8
291,Joe Biden's Popular Vote Lead Over Donald Trump Passes 5 Million,11-11-2020 05:44:29,0.8
292,'I Don't Care': Trump Responds To Intel That Russia Is Working To Get Him Elected Again,08-08-2020 08:55:41,0.8
293,Lawyers: Watergate Reporter Got Trump on Tape Admitting ‘Clearly Impeachable Offense’,09-09-2020 16:23:59,1.0
294,Education Secretary Betsy DeVos Resigns,01-07-2021 21:06:40,0.8
295,Twitter confirms Trump can be banned from inauguration day onwards,12-15-2020 05:54:11,1.2
296,"House Speaker Nancy Pelosi says the country must move toward vote by mail, setting up a fight with Trump",03-31-2020 11:23:07,1.0
297,Ruth Bader Ginsburg discharged from the hospital and doing well,07-15-2020 16:25:19,0.6
298,Megathread: CEO Jack Dorsey says Twitter has decided to ban all political ads by candidates and outside groups,10-30-2019 16:45:41,1.0
299,"'He Must Resign': Attorney General Barr Personally Ordered Police Assault on Peaceful DC Protesters, Report Says",06-02-2020 16:27:44,0.6
300,Biden: Military will escort Trump out of White House if he loses election and refuses to leave,06-11-2020 08:01:44,1.2
301,Jeff Bezos would pay more than $5bn a year under Warren’s ‘Ultra-Millionaire’ tax plan,03-03-2021 11:15:56,0.8
302,[Megathread] NY Attorney General Moves to Dissolve the NRA After Fraud Investigation,08-06-2020 12:10:28,0.6
303,Bernie Sanders Says It Is 'Nauseating' to See Corporations Praise Frontline Workers as 'Heroes' While Refusing to Pay Them More,05-22-2020 05:40:40,0.6
304,Sanders raises over $2 million for coronavirus relief effort,03-21-2020 09:03:23,1.0
305,Rudy Giuliani admits Biden is president hours after being sued for $1.3 billion by voting machine company,01-25-2021 17:40:36,0.8
306,Twitter says it will give @POTUS account to Biden on Inauguration Day,11-20-2020 19:58:02,0.8
307,The Pentagon Could Use a Course in Basic Citizenship. 20% of the Arrested Capitol Insurrectionists Have Military Backgrounds; Top Brass Need to Teach Enlistees What They Are Defending,01-23-2021 11:24:45,0.8
308,Trump says he hopes George Floyd 'looking down' and seeing today’s jobs numbers as 'a great day for him',06-05-2020 11:16:50,0.6
309,FBI investigating ‘Trump Train’ swarming of Biden bus on Texas interstate: report,11-01-2020 05:30:42,0.6
310,Biden working towards putting Harriet Tubman on $20 notes after Trump delayed move,01-25-2021 13:52:31,0.8
311,The House Just Voted to Decriminalize Weed,12-04-2020 13:07:04,1.4
312,Amnesty International: U.S. police must end militarized response to protests,05-31-2020 08:33:17,0.6
313,Democratic presidents keep having to save the US economy after Republican presidents run it into the ground,01-31-2021 09:35:26,0.8
314,Ocasio-Cortez to introduce bill requiring federal officers to identify themselves,07-21-2020 09:29:24,0.8
315,Sen. Mitt Romney Calls Trump's Decision to Commute Roger Stone's Sentence 'Historic Corruption',07-11-2020 21:26:53,0.6
316,"White House prepares massive infrastructure bill with universal pre-k, free community college, climate measures",03-22-2021 14:10:57,0.8
317,"White supremacists on par with ISIS as ‘top threat,’ FBI director tells Senate",03-02-2021 10:57:30,0.8
318,Bill Belichick declines to accept Presidential Medal of Freedom,01-11-2021 19:46:07,0.8
319,White House endorses Washington DC statehood bill,04-20-2021 11:01:34,0.6
320,"Manhattan to stop prosecuting prostitution, dismissing cases dating back decades",04-21-2021 11:35:26,1.0
321,Trump Tweets Video Declaring That ‘The Only Good Democrat Is A Dead Democrat’,05-28-2020 10:21:53,0.8
322,Leaked audio: Trump adviser says Republicans 'traditionally' rely on voter suppression,12-20-2019 16:45:26,0.8
323,"Police found a pickup truck full of bombs and guns near Capitol, feds say",01-08-2021 23:10:51,0.6
324,Trump is officially the most unpopular president since modern polling began in the 1930s. It will forever be his legacy,01-19-2021 19:20:45,1.0
325,One million Americans have already cast 2020 vote in ‘historic’ early voting surge,09-28-2020 14:24:25,0.6
326,Senate Passes Bill to Save Net Neutrality,05-16-2018 15:51:45,1.2
327,"Michigan elections board certifies results from presidential election, sealing Biden’s win in state",11-23-2020 16:37:18,0.6
328,"Growing Calls to 'Audit the Ultra-Rich' as Yellen Says Tax Dodging Could Cost US $7 Trillion Over 10 Years | ""Imagine what we could do for people with $7 trillion. That's infrastructure, child care, paid leave, free college, climate action, and other investments in our communities.""",05-05-2021 06:13:49,0.6
329,"'Trump warns presidential election result may not be known for 'years,' as allegations grow he's undermining the USPS to rig the election",08-16-2020 07:33:32,0.8
330,Remember: There Was An Attempted Coup Against the United States Less Than a Month Ago,02-01-2021 14:00:29,0.4
331,A Colorado Republican tweeted about Pelosi’s location during the Capitol siege. She’s now facing calls to resign,01-13-2021 10:49:40,0.6
332,Trump walks out of press conference after altercation with female reporters,05-11-2020 17:36:18,1.6
333,Confederate Statues and Other Symbols of Racism All Over the Country Were Destroyed by Protesters This Weekend,06-01-2020 10:26:58,0.6
334,The Anarchist Daughter of the GOP's Gerrymandering Mastermind Just Dumped All His Maps and Files on Google Drive,01-06-2020 12:39:20,0.8
335,"Trump’s campaign is trying to remove a video of him appearing to call the coronavirus a ‘hoax,’ saying it’s misleading",03-26-2020 09:08:07,1.0
336,Sen. Kelly Loeffler sold at least $18 million more in stocks before the coronavirus crash than previously reported,04-01-2020 15:27:30,0.8
337,CNN and other news organizations were blocked Friday from a White House press briefing.,02-24-2017 14:12:09,0.8
338,Dolly Parton statue may replace KKK leader monument at the Tennessee capitol,06-14-2020 21:29:44,0.6
339,"Biden says the White House is cooperating fully with his transition, but that Trump still won't speak to him",11-25-2020 06:31:26,1.2
340,The President Just Admitted in Court He Ran a Crooked Charity and We're All Just Gonna Shrug It Off?,12-12-2019 12:53:04,1.2
341,Fox anchor who dismissed coronavirus fears as plot to impeach Trump is removed from her prime-time slot,03-15-2020 10:08:17,0.8
342,"'This Is Tax Evasion': Richest 1% of US Households Don't Report 21% of Their Income, Analysis Finds",03-22-2021 07:10:48,0.4
343,McConnell Threatens To Grind Senate To Halt If Dems Don’t Let Him Keep Power To Grind Senate To Halt,03-16-2021 14:59:18,1.0
344,Democratic politician says she has Covid after sheltering during riot with maskless GOP members,01-11-2021 13:19:50,0.8
345,Protestors gather outside USPS Postmaster General's home amid voter suppression allegations,08-15-2020 09:00:03,0.6
346,"Trump Supporters That Harassed Biden Bus Were Armed, Operation Organized in Private Facebook Group Linked to QAnon",11-02-2020 22:54:22,0.8
347,"Sanders Says If Israel Wants to Ban Members of Congress, It Should Not Receive Billions in US Military Aid",08-16-2019 06:06:44,0.8
348,Poll: 82 percent of voters support a national face mask mandate,08-03-2020 16:41:38,1.4
349,Impeach Donald Trump Again,01-03-2021 21:23:18,0.8
350,New York Times: Tax records show Trump maintains Chinese bank account,10-20-2020 21:03:30,0.8
351,"Everyone’s hitting up Mitch McConnell with $2,000 Venmo requests — The Senate majority leader, seen as a key obstacle to COVID stimulus checks, is getting flooded with requests online.",12-31-2020 16:28:25,1.0
352,"Postal worker admits fabricating allegations of ballot tampering, officials say",11-10-2020 18:07:43,0.6
353,Biden approves $230m for Covid home test kits that take 15 minutes and are 95% accurate,02-01-2021 11:47:54,0.8
354,Fox News Anchor: ‘Conservatives’ Heads Would've Exploded’ if Obama Claimed ‘Total’ Authority,04-14-2020 15:10:12,0.8
355,Trump’s Effort To Overturn The Election Should Be Investigated Like 9/11,01-10-2021 23:06:48,0.6
356,"Biden would not raise taxes on anyone making less than $400,000: White House",03-15-2021 13:45:35,1.0
357,Andrew Yang overtakes Pete Buttigieg to become fourth most favored primary candidate: Poll,12-24-2019 07:31:38,0.8
358,Rep. Watson Coleman: I’m 75. I had cancer. I got covid-19 because my GOP colleagues dismiss facts.,01-12-2021 20:29:54,0.8
359,"McConnell blocks Schumer’s bid to unanimously pass $2,000 stimulus checks",12-29-2020 12:25:10,0.8
360,Christie Called a Hypocrite For Seeking COVID Treatment After Saying People Were 'Gonna Have To' Accept Deaths,10-04-2020 09:55:12,1.0
361,"Petition Urging Proud Boys Be Listed as Terrorist Organization Hits 400,000",01-11-2021 20:29:00,0.8
362,Jewish leaders tell Trump he's not welcome in Pittsburgh until he denounces white nationalism,10-28-2018 19:11:45,0.6
363,"Leaked Draft of Trump Executive Order to 'Censor the Internet' Denounced as Dangerous, Unconstitutional Edict",08-11-2019 10:57:46,0.8
364,Matt Gaetz mocked for calling himself a ‘canceled man’ who’s ‘wanted by the Deep State’ — 'Dude thinks he’s some kind of a martyr for paying for sex.',04-11-2021 13:31:49,1.4
365,"Joe Exotic reportedly spent $10,000 in Trump hotel hoping for presidential pardon",11-28-2020 10:50:55,0.8
366,Texas newspaper calls for resignation of state’s senator Ted Cruz after Capitol riots,01-09-2021 11:22:56,0.6
367,All References to Climate Change Have Been Deleted From the White House Website,01-20-2017 12:43:37,0.6
368,"'The President Just Committed a Felony': Trump Tells NC Residents to Vote Twice, Openly Encouraging Voter Fraud",09-03-2020 05:25:15,0.8
369,Megathread: Representative Marjorie Taylor Greene (GA-14) Stripped of House Committee Assignments,02-04-2021 19:17:52,1.2
370,"‘What We in the Legal World Call a Felony’: Lawyers Condemn Lindsey Graham, Call for DOJ and Senate Investigations",11-17-2020 14:03:02,0.6
371,Kellyanne Conway Tests Positive for COVID-19,10-02-2020 22:21:26,0.6
372,More GOP Senators Have COVID Than Have Acknowledged That Joe Biden Won,11-20-2020 13:58:41,1.0
373,"‘In the middle of a pandemic, they’re selling beans’: Chris Cuomo blasts Trump for hawking Goya",07-16-2020 07:27:50,1.4
374,Trump impeachment trial opens with video of him telling supporters to march on Capitol and mob turning violent,02-09-2021 13:33:53,0.8
375,Pelosi says she'd be comfortable with Sanders at top of ticket,02-26-2020 10:58:55,1.2
376,‘Zero respect’: Ted Cruz pictured scrolling through phone during harrowing opening testimony into Capitol riot,02-23-2021 11:52:55,0.8
377,"To End 'Unconstitutional Nightmare,' ACLU Sues Trump Administration Over Use of Secret Police in Portland",07-18-2020 06:49:42,0.8
378,Tearful Pelosi says Congress members may be prosecuted as she announces Capitol security review,01-15-2021 12:56:34,0.8
379,Bernie Sanders details Trump's efforts to steal election in urgent call to action,09-24-2020 13:46:28,0.8
380,Nearly 60% of Americans want Donald Trump barred from holding public office again: Poll,01-25-2021 19:50:48,1.2
381,MAGA Protesters Chant 'Destroy the GOP' at Pro-Trump Rally,12-12-2020 17:21:17,0.8
382,"Ted Cruz and Josh Hawley could be put on no-fly list, House homeland security chair says",01-12-2021 09:04:15,0.8
383,Democratic presidential nominee Biden tests negative for COVID-19,10-10-2020 15:24:03,1.0
384,"Stephen Miller rejects claim grandmother died of COVID — Stephen Miller, a top adviser to President Donald Trump, is insisting his grandmother did not die of the coronavirus, despite a death certificate that states otherwise.",07-24-2020 08:22:46,0.8
385,Mitch McConnell says he would vote for Trump again days after saying he was 'practically and morally responsible' for the deadly insurrection,02-25-2021 18:53:55,0.8
386,"Trump could be banned from Twitter after he leaves office, company's rules indicate",11-05-2020 13:14:53,1.4
387,"Fox News reported Trump 'never said' that dead US troops were 'losers,' but the network's national security correspondent confirmed he did",09-04-2020 18:22:21,0.6
388,House votes 420-0 to make Mueller's report public,03-14-2019 11:09:52,0.6
389,Pro-Trump rioters could face up to 20 years in prison,01-07-2021 23:05:12,0.8
390,McConnell: Trump 'provoked' crowd that stormed Capitol,01-19-2021 12:29:30,0.8
391,'What we saw was terrifying': Former senior Trump official Miles Taylor endorses Joe Biden in damning video,08-17-2020 15:45:57,0.6
392,Nashville Mayor says he has not heard from President Trump after Christmas Day bombing,12-28-2020 12:14:40,0.8
393,"Lauren Boebert faces $5,000 fine after setting off Capitol metal detector: report",01-22-2021 08:01:54,0.8
394,"Taylor Swift Blasts Trump for ""Shooting"" Tweet: ""We Will Vote You Out in November. After stoking the fires of white supremacy and racism your entire presidency, you have the nerve to feign moral superiority before threatening violence?"" the singer wrote.",05-29-2020 11:51:48,0.6
395,"Hackers steal $2.3m from Trump reelection fund, says GOP",10-29-2020 09:56:43,1.0
396,Biden releases 2019 tax returns hours before first presidential debate,09-29-2020 13:14:04,0.8
397,"Sanders Applauds New Medicare for All Study: Will Save Americans $450 Billion and Prevent 68,000 Unnecessary Deaths Every Year",02-15-2020 19:47:04,1.0
398,Fox news cuts away from McEnany press conference: ‘I can’t in good countenance continuing showing this’,11-09-2020 17:01:31,0.6
399,'Stop the count': Crowd tries to storm Detroit convention centre,11-04-2020 16:24:38,0.8
400,"AOC says people who think raising minimum wage is a ‘crazy, socialist agenda' are living in a 'dystopian capitalist nightmare'",03-01-2021 12:35:43,0.4
401,"Kushner's axed coronavirus team shied away from a national strategy, believing the virus was hitting Democratic states hardest and they could blame the governors, report says",07-31-2020 07:33:02,0.8
402,Biden signs order to ‘undo moral and national shame’ of family separations as Homeland Security chief sworn in,02-02-2021 18:37:34,0.8
