idx,title,created_utc,humor_scores
403,"Goodbye, Ivanka",11-07-2020 14:16:21,0.8
404,Megathread: FBI Announces They’ve Foiled a Plot to Kidnap Michigan Governor Whitmer,10-08-2020 12:53:19,1.0
405,Nancy Pelosi won’t send the articles of impeachment to the Senate until she feels they’ll get a fair hearing.,12-18-2019 22:05:18,0.8
406,"Iraqi Parliament Votes to Expel All American Troops and Submit UN Complaint Against US for Violation of Sovereignty. ""What happened was a political assassination. Iraq cannot accept this.""",01-05-2020 09:57:39,0.4
407,Michigan Supreme Court flips from GOP to Dems after Tuesday vote,11-11-2020 19:53:12,0.6
408,‘QAnon Congresswoman’ Lauren Boebert faces calls to resign after tweeting information about Nancy Pelosi during Capitol riot,01-11-2021 14:16:48,0.6
409,Democrats Introduce Resolution to Permanently Ban Trump from Stepping Foot on U.S. Capitol Grounds,01-14-2021 20:04:30,1.4
410,The White House Knew Trump Had Likely Been Exposed to the Virus. He Traveled and Held Events Anyway.,10-02-2020 06:12:09,1.0
411,Mattis tears into Trump: 'We are witnessing the consequences of three years without mature leadership',06-03-2020 18:35:09,0.8
412,Legal Expert: QAnon Republican Rep. Boebert Should Not Be Allowed Into the U.S. Capitol With a Gun,01-14-2021 18:53:30,0.8
413,#FireTrumpNotFauci Trends After President Goes After Trusted Infectious Disease Official,04-13-2020 08:57:00,0.8
414,Facebook and Instagram ban Trump 'indefinitely',01-07-2021 11:03:18,1.2
415,Video of Mike Pence Saying ‘Foreign Governments Cannot Participate in the American Political Process’ Goes Viral After Trump-Ukraine Scandal,10-05-2019 11:16:01,0.6
416,"USPS Board Chairman Revealed as Director of Mitch McConnell, Trump-Linked Super PACs",08-31-2020 18:17:00,0.8
417,Biden names fired surgeon general as a head of his COVID-19 taskforce,11-08-2020 15:53:38,0.8
418,'Just Comes Right Out and Says It': Trump Declares Postal Service Can't Handle Mail-In Voting Because He's Blocking Funding,08-13-2020 06:23:27,0.8
419,The Trump campaign is reportedly 'discussing contingency plans to bypass election results',09-23-2020 12:09:47,1.0
420,Fact check: McConnell claims Obama didn't leave Trump a pandemic 'game plan.' Obama left a 69-page playbook,05-12-2020 15:26:12,1.0
421,Did you know? You can still register to vote in Georgia’s U.S. Senate runoffs,11-09-2020 19:35:17,0.8
422,"Reporter to Trump: ""Do you regret all of the lying you have done to the American people?""",08-13-2020 18:25:47,0.8
423,"Federal Judge, After Reading the Unredacted Mueller Report, Orders DOJ to Explain Itself at Hearing",06-08-2020 20:12:13,0.6
424,Democrats now have the votes to impeach Trump — again,01-11-2021 10:54:39,0.8
425,Pelosi calls for 9/11-style commission on Capitol insurrection,02-15-2021 15:31:44,0.6
426,Pompeo says there will be a ‘smooth transition to second Trump administration’,11-10-2020 13:42:08,1.0
427,"Biden's lead in Georgia grows to over 14,000 votes",11-11-2020 09:21:21,0.6
428,Democrat announces resolution to expel Marjorie Taylor Greene from Congress,01-27-2021 20:01:09,1.0
429,"Donald Trump has real estate debts of $1.1B with $900m owed in next four years, report says",10-27-2020 15:38:40,0.8
430,"Trump's surprise demand for $2,000 stimulus checks blew up Mitch McConnell's master plan and leaves him in a no-win situation",12-23-2020 06:57:17,1.0
431,Tyler Perry flies to Georgia to vote in person after absentee ballot fails to arrive,01-05-2021 13:56:27,1.0
432,"Trump Supporters in Georgia Threaten to Destroy GOP, Boycott Runoff Elections",11-21-2020 12:39:52,0.6
433,H.R.305 - 117th Congress (2021-2022): To award a Congressional Gold Medal to Officer Eugene Goodman.,01-14-2021 10:23:06,0.8
434,Megathread: Supreme Court Justice Ruth Bader Ginsburg Dies at 87,09-18-2020 19:40:19,0.6
435,White House claims Trump hasn't seen video of supporters firing paintballs at protesters despite retweeting it,08-31-2020 14:16:42,1.2
436,"Joe Biden asks Anthony Fauci, the federal coronavirus expert, to become his chief medical adviser",12-03-2020 18:19:35,1.2
437,‘Abandoning our people’: AOC attacks Mitch McConnell for granting Senate recess without passing coronavirus relief bill,11-22-2020 08:11:09,0.8
438,Trump moved cyber security budget to pay for his wall before major hacking assault,12-18-2020 07:36:11,1.0
439,"'Deeply Disturbing': New York Supreme Court Judge Rules Protesters Can Be Detained Indefinitely. ""This is suspension of habeas corpus, it is unconstitutional,"" said Rep. Alexandria Ocasio-Cortez",06-05-2020 11:55:59,0.4
440,"Family of Tom Petty issues Cease and Desist to Trump's campaign after Tulsa rally. They said the president cannot use the song ""I Won't Back Down"" to further a campaign that leaves Americans and common sense behind.",06-20-2020 23:46:39,0.8
441,It Should Terrify You That Senators Are Dumb Enough To Think No One Would Notice Them Dumping Their Stocks,03-29-2020 17:47:45,1.4
442,"Sen. Ted Cruz illegally promoted his book with campaign funds, watchdog alleges in ethics complaints",04-07-2021 11:49:31,0.8
443,Joe Biden’s Done More Good in a Week Than Donald Trump Did in Four Years,01-28-2021 07:40:53,1.2
444,Rudy Giuliani faces questions after compromising scene in new Borat film,10-21-2020 12:10:22,0.8
445,Ocasio-Cortez calls for 'answers' after Epstein found dead in jail cell,08-10-2019 10:41:21,0.8
446,"Barack Obama says Congress' lack of action after Sandy Hook was ""angriest"" day of his presidency",11-13-2020 13:19:55,0.6
447,The White House is reportedly hoping Americans 'will grow numb' to the COVID-19 death toll,07-06-2020 11:15:51,0.2
448,"Bernie Sanders says he's staying in race, looks forward to debating Joe Biden",03-11-2020 13:12:40,1.2
449,Trump ‘didn’t know people died from the flu.’ It killed his grandfather.,03-07-2020 14:19:01,0.8
450,"Majority says Election Day should be a federal holiday, poll finds",11-06-2018 12:16:08,0.8
451,Obama: If Republicans really cared about Clinton's emails they would be 'up in arms' over Trump's iPhone,10-26-2018 17:55:53,1.0
452,"'A Really Chilling Moment': Trump Refuses to Allow Dr. Fauci to Answer Question on Dangers of Hydroxychloroquine— ""This is unacceptable. Dr. Fauci, one of the world's top infectious disease scientists, was just censored live at a White House press conference.""",04-06-2020 05:52:09,0.8
453,"Trump had a meltdown and yelled at aides backstage when he realised how empty his rally in Tulsa was, reports say",06-22-2020 06:36:42,1.0
454,"Mitch McConnell's Louisville home vandalized following his blockage of $2,000 checks",01-02-2021 11:02:26,0.8
455,Legislation that would make Washington DC 51st state introduced to Senate,01-27-2021 10:58:45,0.6
456,"Biden: QAnon is ‘bizarre’ and ‘embarrassing,’ supporters should seek mental health treatment",09-04-2020 14:19:00,0.6
457,Fauci says outbreak exploding because US didn’t shut down,07-13-2020 14:27:17,0.6
458,"Andrew Yang: What good are record-high profits if we have record-high stress, anxiety, student loan debt",12-20-2019 12:57:43,0.6
459,"In a loss for Trump, judge says woman who accused him of rape can proceed with defamation suit",08-06-2020 22:02:12,1.0
460,"Trump to face ‘subpoenas and seizures’ following presidency, ex-Manhattan prosecutor says",11-13-2020 17:40:24,0.8
461,"Brawl Nearly Erupts on House Floor After Pa. Democrat Accuses GOP of Lying | Rep. Conor Lamb, D-Pa., said a breach of the Capitol by an angry mob earlier in the day was inspired by ""the same lies you are hearing in this room tonight”",01-07-2021 08:47:56,0.8
462,Sanders overtakes Biden in New Hampshire poll,08-13-2019 11:52:09,0.8
463,"Say It Under Oath, Asshole",06-17-2020 21:07:20,1.0
464,100 Republican national security experts demand GOP admit Trump loss,11-23-2020 10:42:19,0.4
465,"Maloney Introduces Legislation to Save the Open Internet, Block FCC Rollback of Net Neutrality",12-09-2017 11:55:33,0.8
466,Rep. Steve Cohen Says He Saw Lauren Boebert Giving Tour Before Capitol Riot Day,01-18-2021 12:27:43,0.8
467,"Trump was ‘muttering, I won, I won, like ‘Mad King George’ after election defeat, report says",11-29-2020 10:04:09,0.8
468,Megathread: The GSA Has Informed President-Elect Joe Biden that the Administration is Ready to Begin the Formal Transition Process,11-23-2020 19:05:24,0.6
469,The pandemic has made this much clear: those running the US have no idea what it costs to live here,04-29-2020 09:34:32,0.6
470,"Goodbye, Bill Barr",11-07-2020 14:01:22,0.8
471,Trump loses 2 pivotal allies in his anti-kneeling crusade: NASCAR and the NFL,06-14-2020 07:28:32,1.0
472,Satanic Temple challenges 18 states' abortion laws with religious exemption claim,01-01-2021 15:36:52,0.8
473,Trump: 'Nobody likes me',07-28-2020 19:56:35,1.4
474,Trump threatens White House protesters with 'vicious dogs and most ominous weapons',05-30-2020 09:02:37,1.2
475,Cards Against Humanity buys plot of land on U.S./Mexico border to block border wall,11-14-2017 17:53:11,0.6
476,McConnell Admits He's Been Working to Sabotage Covid Relief Talks Behind the Scenes to Prioritize Rushing Barrett Confirmation,10-21-2020 06:09:36,0.6
477,Megathread: Federal Judge Rules President Trump Must Turn Over Eight Years Of Personal And Corporate Tax Returns,10-07-2019 09:27:52,0.8
478,"Putting Trump's name on stimulus checks is ""abuse of government resources,"" says president of IRS managers association",04-15-2020 06:46:49,0.6
479,Worse Than Treason | No amount of rationalizing can change the fact that the majority of the Republican Party is advocating for the overthrow of an American election.,01-04-2021 06:44:07,0.6
480,A new Trump campaign ad depicting a police officer being attacked by protesters is actually a 2014 photo of pro-democracy protests in Ukraine,07-22-2020 08:46:09,0.6
481,"Insurance Industry Corrects Trump: Actually, We're Only Waiving Copays for Coronavirus Testing, Not Treatment; ""Heaven forbid they miss a chance to bankrupt sick people.""",03-12-2020 06:27:57,0.8
482,"Rep. Joaquin Castro wants to prevent Federal government from ever naming buildings, property after Trump",01-07-2021 22:40:18,0.8
483,"AOC Wants to Know Why the Hell a Predator Drone Was Spying on Protesters | The military-grade ""Predator B"" drone was far outside the 100-mile inland operational zone of Customs and Border Protection.",06-08-2020 14:30:10,0.8
484,AOC Says She Woke Up to Stacks of Photos From FBI Showing 'People Who Want to Kill' Her,10-28-2020 10:39:16,0.8
485,"Progressive Leader to Biden: Don't 'Water Down Bill for a Party Not Actually Interested in Bipartisanship' | The country can't afford to ""wait for Republicans to have some awakening on climate change,"" said Rep. Pramila Jayapal.",04-02-2021 07:52:32,0.6
486,Do not be fooled by the polling. Donald Trump could very well win a second term,08-26-2020 08:12:16,1.2
487,"""F-35s Don't Help Families Pay Their Bills"": GOP Under Fire for Slipping $30 Billion Pentagon Gift Into Coronavirus Bill",07-28-2020 12:02:32,0.8
488,"Lauren Boebert stated there hadn't been a single COVID-19 death in Texas since mask restrictions ended in March. Data shows thousands had, in fact, died.",05-23-2021 11:48:43,0.4
489,New York lawmaker announces bill to prevent fired police officers from being rehired in other jurisdictions,04-25-2021 09:34:35,0.8
490,Elijah Cummings 'signed subpoenas from his hospital bed' for Trump impeachment before his death,10-17-2019 14:32:53,0.6
491,Senator McConnell Must Recuse - The Senator Has Already Violated His Oath as a Juror,12-13-2019 13:21:15,1.0
492,"Bernie Sanders Says Trump 'Directly Responsible' for Insurrection Effort - ""Trump will go down in history as the worst and most dangerous president in history.""",01-06-2021 18:57:31,1.0
493,Gigantic Asshole Ajit Pai Is Officially Gone. Good Riddance (Time of Your Life),01-20-2021 11:02:49,1.0
494,Trump phone call: Democrats ask FBI for ‘immediate criminal investigation’ in new letter,01-04-2021 11:30:48,0.8
495,US spies say the Hunter Biden email controversy shows how 'exploitable' and 'grotesquely vulnerable' Trump and Giuliani are to Russian intelligence,10-17-2020 16:13:49,0.6
496,"Biden to Trump: 'Release your tax returns, or stop talking about corruption'",10-22-2020 22:29:25,1.0
497,Biden on Trump sharing video of protester shouting 'white power': He 'has picked a side',06-28-2020 14:36:32,0.6
498,Biden wants a 28% corporate tax rate because he's 'sick and tired of ordinary people being fleeced',04-07-2021 15:59:17,1.2
499,A Message to PBS: Televise the Trump Impeachment Hearings for All to See,11-08-2019 08:14:26,0.8
500,20 leading economists just signed a letter arguing Medicare for All would generate massive savings for American families,03-10-2020 15:54:37,0.6
501,White House Officials Who Completely Mismanaged The Pandemic Will Be Among The First To Get Vaccinated,12-13-2020 19:44:37,1.2
502,"Trump Campaign Secretly Paying $180,000 A Year To His Sons’ Significant Others | Lara Trump and Kimberly Guilfoyle are each receiving $15,000 per month through the campaign manager’s private company, GOP sources said, to dodge FEC rules.",04-17-2020 18:42:15,0.8
503,"Trump, who told Obama to resign after one Ebola death, calls 160,000 COVID-19 deaths ""fantastic job""",08-11-2020 17:23:54,0.4
504,"In First Speech as Budget Chair, Sanders Rebuffs 'Partisanship' Complaints From GOP That Unilaterally Passed $1.9T Gift for Rich | ""Eighty-three percent of the benefits of the Trump tax plan went to the 1% and large corporations... There was not one Democrat that voted for that bill.""",02-04-2021 05:27:41,0.8
505,Andrew Cuomo after Trump debate attack: 'New York has a lower infection rate than the White House',10-24-2020 08:15:16,1.0
506,The US stock market has now wiped out the entire $11.5 trillion of value it gained since Trump's 2016 election victory,03-12-2020 19:41:56,0.4
507,Joe Biden's Major to Be First Rescue Dog in White House,11-07-2020 17:09:06,1.2
508,"Mitt Romney unveils plan to provide $3,000 per child, giving bipartisan support to President Biden’s effort",02-04-2021 10:10:24,0.8
509,Reports: Gaetz Caught On Surveillance Vid With Alleged Sex Trafficker Sifting Through IDs,04-02-2021 12:16:51,1.2
510,Defiant Cheney says voters were ‘lied to’ by Trump as she insists GOP should not be ‘party of QAnon’,02-07-2021 09:53:30,0.6
511,"Goodbye, Melania",11-07-2020 15:13:32,0.8
512,Letterman Says A Trump Loss Would Be 'A Relief To Every Living Being In This Country',11-02-2020 17:20:49,0.6
513,Trump Livid After California Allows Statewide Mail-In Voting: ‘These Votes Must Not Count’,05-09-2020 14:00:13,0.8
514,Joe Biden is the first president-elect in US history to include transgender people in his victory speech,11-08-2020 07:28:30,1.0
515,Dave Bautista backs Biden over Trump in new campaign ad: 'It’s easy to bully people. That does not make you a tough guy',10-25-2020 18:50:29,1.0
516,Cuomo Reminds McConnell That KY Takes More Money Than NY: ‘Who’s Getting Bailed Out Here?’,04-23-2020 13:57:16,1.2
517,"Trump's inner circle is telling him that Giuliani and the rest of his legal team are making him look like an idiot, report says",11-26-2020 06:29:59,1.2
518,"Trump Blames Biden, Who Isn't President, For Not Instituting Mask Mandate | “To be clear: I am not currently president,” Biden wrote moments later. “But if you chip in now, we can change that.”",09-16-2020 00:14:52,1.4
519,Bernie Sanders Wins the Nevada Caucuses,02-22-2020 19:33:27,1.0
520,"Trump Just Removed the IG Investigating Elaine Chao. Chao’s Husband, Mitch McConnell, Already Vetted the Replacement.",05-19-2020 18:36:05,1.0
521,A Republican congressman who denied there was an insurrection and likened Capitol rioters to 'tourists' was photographed barricading the chamber doors against them,05-17-2021 07:07:02,0.4
522,"Megathread: Trump adviser Roger Stone guilty on all seven counts of lying to congress, obstruction and witness tampering in relation to the Russia probe",11-15-2019 11:55:07,0.6
523,Trump calls mail-in ballots 'dishonest' but says absentee ballots are 'fine.' They're the same thing.,07-10-2020 09:52:58,0.6
524,'The Public Deserves to Know': Lone Watchdog Demands Federal Reserve Release Names of Corporations Receiving Taxpayer Bailouts,04-16-2020 08:20:21,0.6
525,Most Americans Say This Is Lowest Point in U.S. History in Living Memory,06-19-2020 07:41:00,0.4
526,"Susan Collins has failed the people of Maine and this country. She has voted to confirm Trump’s judicial nominees, approve tax cuts for the rich, and has repeatedly chosen to put party before people. I am running to send her packing. I’m Betsy Sweet, and I am running for U.S. Senate in Maine. AMA.",01-02-2020 10:41:23,1.0
527,Photo emerges of Republican barricading chamber doors during US Capitol attack after he compared rioters to ‘tourists’,05-16-2021 14:26:43,0.6
528,"Dwayne Johnson Endorses Presidential Candidate for First Time, Supports Joe Biden and Kamala Harris",09-27-2020 08:33:48,1.0
529,Biden says he won't return Trump's attacks on his children because 'it's crass' to target a political opponent's family,10-24-2020 19:45:26,0.8
530,Federal Prosecutors ‘Concluded that President of the United States Committed a Felony’,12-07-2018 17:46:58,1.2
531,"Joe Biden says $2,000 stimulus checks ""will never get there"" if Loeffler and Perdue elected",01-04-2021 17:51:31,0.8
532,"Rebekah Jones says Florida Gov. DeSantis trying to ""intimidate scientists"" by raiding her home",12-08-2020 08:00:28,0.8
533,"'My God,' Says US Senator After William Barr Deploys 'History Is Written by the Winners' Trope | ""The head of the American justice system now saying publicly that there is no good or bad except what the strongest want. The definition of autocracy.""",05-08-2020 08:54:32,0.6
534,"Anderson Cooper: Trump is an 'obese turtle on his back, flailing in the hot sun'",11-05-2020 20:00:30,1.4
535,Trump ad asks people to support the troops. But it uses a picture of Russian jets,09-14-2020 20:22:16,0.8
536,Donald Trump Jr tests positive for coronavirus,11-20-2020 19:06:44,1.2
537,Sanders says he'll enact national drinking water standards,12-31-2019 12:30:38,1.0
538,"Medical Journal Urges American Voters to Not Re-Elect Trump, Slams Him for Coronavirus Response",05-17-2020 19:08:45,1.2
539,"Mueller Subpoenas Trump Organization, Demanding Documents About Russia",03-15-2018 13:47:03,0.8
540,"Romney, once party standard-bearer, is now the lone GOP voice willing to stand up to Trump",06-09-2020 20:58:27,1.0
541,"""Disturbing"" memo reveals Trump's USPS chief has slowed delivery amid calls to expand voting by mail",07-15-2020 19:44:36,0.8
542,"Watch: In Fiery Floor Speech, Sanders Rips GOP for Relentless Efforts to 'Punish' Poor People — ""Meanwhile, these very same folks had no problem a couple years ago voting for a trillion dollars in tax breaks for billionaires and large profitable corporations. Not a problem.""",03-26-2020 07:30:18,0.6
543,Trump reportedly invited a waiter into a top secret intelligence briefing room to order a milkshake,10-19-2020 11:21:02,1.8
544,Texas Republicans call on county GOP chair to resign for saying Floyd's death was staged,06-04-2020 15:25:18,0.6
545,"Trump Supporter Admits Voter Fraud, Says She Voted Twice For President in Viral Video",11-12-2020 09:20:27,1.0
546,"Oregon law to decriminalize all drugs goes into effect, offering addicts rehab instead of prison",02-01-2021 10:30:14,1.2
547,"Goodbye, Donald Trump Jr.",11-07-2020 14:18:32,1.0
548,"Trump falsely claims 'thousands' of forgeries on mail-in ballots, despite his own commission not finding a single case of fraud",05-24-2020 13:18:41,0.6
549,"Alexandria Ocasio-Cortez said she feared losing her life during Capitol siege, calls for Trump's removal",01-09-2021 17:23:58,0.6
550,Stacey Abrams Says Reason Republicans Are 'So Mad' About Election Is That Their Voter Suppression Efforts Were Blocked,11-19-2020 13:48:46,0.8
551,Romney blames Trump for Georgia defeat: ‘He has disgraced the office of presidency’,01-06-2021 11:18:23,0.4
552,"Biden didn’t ‘take the lead’ in Pennsylvania. If he wins, he always had it.",11-06-2020 10:27:16,1.0
553,"Megathread: Trump, Biden to have microphones muted for part of final U.S. presidential debate",10-19-2020 20:51:28,1.2
554,CNN Poll: Most Americans embarrassed by US response to coronavirus,08-19-2020 06:06:48,1.0
555,Jon Stewart says police are basically a 'border patrol' between 'two Americas' who exist to perpetuate segregation,06-15-2020 15:11:16,0.6
556,Cheney refuses to apologize for voting to impeach Trump during closed-door GOP meeting,02-03-2021 19:31:54,1.0
557,"Bombshell Letter: Gaetz Paid for Sex With Minor, Wingman Says",04-29-2021 20:31:31,1.6
558,Remove Trump From Office,01-06-2021 16:09:41,1.2
559,"Senate bill to reverse net neutrality repeal gains 30th co-sponsor, ensuring floor vote",01-08-2018 13:19:40,0.8
560,Colorado’s Progressive Governor and Legislature Just Ended Qualified Immunity for Police Officers,06-19-2020 15:32:36,0.8
561,Police arrest Proud Boy member on assault and gun charges hours after Trump refuses to denounce white supremacy,09-30-2020 17:36:00,0.8
562,Bernie Sanders rips into Jeff Bezos: 'You are worth $182 billion ... why are you doing everything in your power to stop your workers' unionizing?,03-17-2021 17:00:51,0.6
563,Megathread: GOP Rep. Matt Gaetz Under Investigation for Alleged Sexual Relationship with 17-Year-Old Girl,03-30-2021 19:23:01,1.0
564,GOP pushing bill to ban teaching history of slavery,05-22-2021 09:33:52,0.6
565,Jonathan Swan reveals the simple secret to exposing Trump's lies: basic follow-up questions,08-04-2020 14:59:57,0.8
566,Eric Trump cancels event at Michigan gun shop after former employee is linked to domestic terror plot against governor,10-12-2020 15:58:15,0.8
567,Ted Cruz accused of abetting sedition and inspiring pro-Trump riot by resisting Biden’s victory,01-06-2021 20:48:48,0.8
568,"Black Californians accuse ""Trump Train"" of being like ""Taliban had come to town""",11-02-2020 07:06:53,0.6
569,Mensa offers to host IQ test for Trump and Tillerson,10-10-2017 12:27:38,1.4
570,Trump pardon of Blackwater Iraq contractors violates international law - UN,12-30-2020 06:34:28,0.4
571,Law Firm Stops Representing Trump Campaign in Pennsylvania Suit,11-13-2020 08:20:29,0.6
572,Biden won the Electoral College. Now he should call for it to be abolished.,11-08-2020 09:24:09,1.0
573,The sheriff fired her because she’s a lesbian so she ran for his office. She demolished him.,04-30-2020 13:41:45,1.2
574,Susan Collins helped cripple the USPS: Now Maine farmers are getting dead baby chicks in the mail,08-21-2020 07:12:15,1.2
575,Sanders: 'Your $8.99 Netflix subscription is more than the company paid in federal income taxes',11-19-2019 17:58:24,0.6
576,Sen. Duckworth: Republicans Are Trusting ‘Reddit Conspiracy Theories' Over Constitution,01-07-2021 12:25:19,0.6
577,Kamala Harris Said Biden Administration Would Decriminalize Marijuana,09-15-2020 16:56:54,1.8
578,Dr Anthony Fauci is the only figure to find his approval rating rise after being associated with Donald Trump,11-01-2020 10:36:06,0.8
579,Biden notes 'the violence we're witnessing is happening under Donald Trump. Not me.',08-27-2020 23:52:11,0.6
580,Romney: Founders didn't intend pardons to be used for 'cronies',01-20-2021 18:46:11,0.6
581,"Trump was more upset that Capitol mob looked ‘low class’ than about violent attacks, reports say Advisers say the president was ‘turned off’ by the look of his supporters as they attacked the US Capitol",01-10-2021 11:26:52,0.8
582,"Schumer: Pelosi will transmit Trump impeachment article Monday, triggering trial of former president",01-22-2021 10:18:17,0.8
583,Investigation launched into Trump’s 'political interference' in CDC and FDA's coronavirus work,10-19-2020 14:34:50,0.8
584,Bernie Sanders says he would legalize marijuana on his first day as president,02-03-2020 14:54:35,1.6
585,Donald Trump Refused to Denounce White Supremacists. That's It.,09-30-2020 07:03:54,0.8
586,"Man who spent weekend in a bunker demands ""weak"" governors ""dominate"" protesters",06-01-2020 14:57:06,0.8
587,President Trump lost. Too many Republicans keep pretending he didn’t.,11-10-2020 06:33:17,1.0
588,"Trump is furiously watching Fauci give interviews about how relieved he is to be working for Biden, report says",01-25-2021 11:44:07,1.0
589,Trump shares video of 'great people' shouting 'white power' at protesters,06-28-2020 09:08:32,0.8
590,Keep Audiences Out of Debates—Forever,03-16-2020 15:00:16,1.0
591,Trump Has ‘Financial Interest’ in Hydroxychloroquine Manufacturer: NYT,04-07-2020 07:30:05,0.6
592,"Lawyers, Law Students Officially File Grievances Seeking To Disbar Senator Ted Cruz",01-30-2021 09:25:44,0.8
593,Lindsey Graham's Challenger Jaime Harrison Takes Narrow Lead in New Poll,10-15-2020 07:09:46,0.6
594,Democrat calls for delaying Barrett hearing after CNN uncovers 7 undisclosed talks she gave,10-15-2020 10:25:02,0.8
595,"Now Ted Cruz may be buying his own books through a mystery company. If Cancún Ted is paying royalties to himself through a shadow entity, that could stir the FEC into action",02-22-2021 20:14:29,0.8
596,Calls intensify for resignation of Michigan sheriff who shared stage with militia.,10-11-2020 17:55:05,0.6
597,House Democrats Demand Increase in IRS Funding to Go After 'Wealthy Tax Cheats'—Like Donald Trump,12-01-2020 07:05:41,0.8
598,Biden administration weighs turning over Trump tax returns to House Democrats,01-22-2021 18:28:15,0.8
599,TikTok users are trying to troll Trump's campaign by reserving tickets for Tulsa rally they'll never use,06-16-2020 13:13:46,0.6
600,Poll: 60 percent support Biden canceling up to $50K of student loan debt per person,11-24-2020 19:16:27,0.8
