,title,created_utc
183,"People who are motivated to do things, how the fuck do you do that?",06-20-2020 15:00:28
184,"If Covid never happened, what all would've you done in on past 4 months?",07-31-2020 12:13:46
185,20 years from now what will be the “ you are not going to always have a calculator in your pocket?”,09-06-2020 02:29:59
186,"Adults of Reddit, what is something every Teenager needs to know?",09-27-2020 07:34:33
187,"People who pile on generic YouTube comments like “Who’s watching in 2019”, why do you do this?",12-13-2019 01:02:45
188,What’s the cringiest thing you’ve seen a bride and groom do for their wedding?,06-22-2020 09:23:53
189,"How do you think the world would react if a major political leader, (like Trump, the Queen, or Kim Jong-un,) died of Covid-19?",03-12-2020 17:29:02
190,[SERIOUS] What is the Creepiest or most Unexplained thing that’s happened to you that you still think about to this day?,02-07-2021 14:08:04
191,It's 69 days until 4/20/20. How do you feel?,02-11-2020 17:33:11
192,What are some tricks in bed that everyone should know?,09-01-2020 21:34:27
193,"To those that live in Italy, how is the situation right now with coronavirus and lockdown?",03-10-2020 03:58:16
194,What's a relatively unknown technological invention that will have a huge impact on the future?,09-03-2020 08:46:31
195,"What is the pettiest, silliest, most meaningless hill you are willing to die on?",05-13-2020 09:31:55
196,What are some hidden gem subreddits with plenty of stuff to binge read?,01-30-2021 18:07:20
197,"For people who like to listen to full albums, what are your favorite albums to binge?",07-26-2019 10:37:18
198,"Owners of Volkswagen Beetles, how do you feel knowing that when you drive your car, countless people punch each other for being the first to see it?",11-17-2020 18:02:40
199,"What is the greatest ""fuck it, I'll do it myself"" in history?",05-09-2020 20:09:25
200,People who lost their job due to this crisis what is your story?,03-19-2020 15:41:18
201,What is a good weakness to mention on a job interview?,12-28-2018 11:44:10
202,What the f**k are you supposed to do when having happy birthday sung to you?,01-09-2020 21:42:24
203,Postal Workers of Reddit: What do you need right now? How can we brighten your day when we see you on our routes?,08-17-2020 18:18:30
204,What has simultaneously gotten worse and more expensive?,07-20-2020 13:41:59
205,"Doctors of Reddit, what's the biggest case of ""faking it"" you've ever seen?",02-16-2020 15:35:59
206,What golden nugget of information do you have to share?,05-23-2020 11:38:37
207,"Women who “dated” older men as teenagers that now realize they were predators, what’s your story?",06-03-2020 16:39:09
208,You are teleported back to 2001 terminator-style (butt ass naked) and end up in the middle of Times Square. What do you do or say to convince people you’re not a stoned homeless person?,03-25-2021 10:42:34
209,"If when you die, someone takes the VR headset off of your head and asks how the virtual life was, what's the first thing you say?",12-02-2020 08:19:17
210,What's an 'oh shit' moment where you realised you've been doing something the wrong way for years?,03-12-2019 18:38:52
211,what invention is so good that it actually can’t be improved upon?,08-20-2020 17:42:48
212,What are some lesser-known secondary uses for an everyday product?,12-21-2019 17:23:03
213,"Coders of Reddit, how do you politely refuse your friend's 'million dollars app idea'?",03-18-2020 06:59:44
214,"Overthinkers of Reddit, what unlikely scenario actually came true that you were completely prepared for because you are an overthinker?",05-07-2021 17:35:12
215,What’s a quote that permanently changed the way you look at things?,05-01-2021 11:52:02
216,"What was supposed to be ""The Next Big Thing"", but totally flopped?",04-20-2021 10:04:17
217,What's older than we think ?,10-15-2020 08:16:24
218,"What is that one fact you know that always makes people respond ""And why the fuck do YOU know that""?",06-01-2019 19:29:46
219,We are now less than 45 days from April Fool's Day. What 'long con' pranks should be started around now?,02-19-2019 14:30:35
220,"Do bosses like Michael Scott actually exist? And if you work/ed for one, what's your craziest story?",07-30-2020 18:17:36
221,"Rather than eating a family size bag of Doritos in 20 minutes, what are some healthy snack alternatives that can be consumed in large amounts?",03-17-2019 22:00:53
222,"you are teleported into a game of your choice for a month, if you die in the game you die in real life BUT Whatever you collect in the game you can keep in real life. (skils, magic, items, pets, clothes) what game do you pick?",04-21-2020 06:35:03
223,What is something about yourself that sounds totally made up but is 100% real?,03-30-2020 12:45:40
224,What are some VERY creepy facts?,06-29-2020 18:09:03
225,Would you rather be the best at speaking every language or be the best at playing every instrument? Why?,01-10-2021 08:25:51
226,"If you could singlehandedly choose ANYONE (alive, dead, or fictional character) to be the next President of the United States, who would you choose and why?",08-10-2020 20:19:08
227,"How do you feel about a friend with benefits, but instead of sexual benefits it's medical, dental and pension?",09-06-2020 17:04:46
228,"A British charity that helps victims of forced marriage recommends hiding a spoon in your underwear if your family is forcing you fly back to your old country, so that you get a chance to talk to authorities after metal detector goes off - have you or anyone else you know done this & how did it go?",02-19-2018 07:15:24
229,What are you STILL salty about?,08-17-2020 07:51:16
230,What's the best joke you know?,11-25-2020 10:25:30
231,"Were you ever that 1 in 1,000,000? If so, what's your story?",02-20-2019 23:37:46
232,"If guys started hiding their nips the way girls did, do you think eventually girls would get conditioned to be sexually aroused by male breasts? Why and why not?",12-17-2020 12:35:03
233,"Confucius once said “We all have two lives, the second one starts when you realise you only have one”. When and why did your second life begin?",10-07-2019 05:21:19
234,What has your pet accidentally conditioned you to do?,08-10-2020 10:00:56
235,Moratorium on questions related to US Politics,10-02-2020 18:48:21
236,What did a fictional character say that stuck with you?,07-14-2019 16:26:01
237,What should teenagers these days really start paying attention to as they’re about to turn 18?,02-29-2020 09:44:36
238,"What could the U.S.A. have spent $1,000,000,000,000 on instead of a 17 year-long war in Afghanistan?",09-28-2018 06:17:41
239,Doctors of Reddit: What happened when you diagnosed a Covid-19 denier with Covid-19?,04-21-2021 11:38:33
240,"At this point in 2020, if you looked in the sky tomorrow and saw a big ass death star looking mother, what do you think your first thought would be?",06-04-2020 02:11:07
241,"What is a lifehack that seems fake, but is a true lifesaver?",04-07-2021 16:12:29
242,What conspiracy theories do you think are too logical to ignore?,02-29-2020 15:11:39
243,You are given immortality with the side effect of being sent back in time 2000 years. Would you accept this offer and if so what would you do?,12-14-2020 15:15:50
244,What are some free/low-cost resources college students should know about?,08-23-2020 10:49:41
245,"Trevor Noah once said ""America is 50 countries masquerading as one"" do you think this is true or false if so why?",06-08-2020 07:30:55
246,What healthy food tastes just as good as unhealthy food?,02-09-2020 13:14:49
247,What do people learn too late?,06-30-2020 23:45:16
248,"What screams ""I'm very insecure""?",10-20-2019 09:20:05
249,Lawyers of reddit what was your “HOLD IT!” moment where you knew you would win?,11-13-2020 17:39:57
250,"Elevator-maintenance folks, what is the weirdest thing you have found at the bottom of the elevator chamber?",09-29-2020 06:37:42
251,"Men who have sold/donated sperm and gave permission for the child to contact you at 18, what is your story?",04-13-2021 08:47:58
252,You’ve been kidnapped. 30 mins later your kidnapper dumps you on the street because you won’t stop talking about what?,04-28-2021 13:22:24
253,"Fast food workers, what is your ""Sir, this is a Wendy's"" moment?",09-04-2020 19:58:04
254,“A child who is not embraced by the village will burn it down to feel its warmth.” What is an example of this that you’ve seen or experienced firsthand?,07-12-2020 15:51:47
255,"You have died and find that instead of going to heaven, you've only leveled up to Earth 2.0. What are some things that make Earth 2.0 better but not quite heaven?",03-11-2020 22:12:08
256,What's a good website to waste a whole night on?,04-09-2020 18:53:08
257,What food do you swear people only pretend to like?,11-01-2020 13:27:42
258,"""Once you were old enough, what were the dark family secrets you were finally let in on?""",03-08-2021 03:28:53
259,"Which album do you think has no bad songs on it, and can be listened all the way through?",09-14-2020 21:12:22
260,Has someone ever challenged you to something that they didn't know who are an expert at? If so how did it turn out for you/them?,04-13-2020 09:03:19
261,What do you do when you start to miss somebody who is dead?,05-22-2020 09:10:41
262,What is your opinion on Aimee Challenor?,03-24-2021 11:36:50
263,Whats an NSFW fact about history that we don't get to hear too often?,10-28-2020 06:04:46
264,What is the best video game for couples to play?,08-27-2019 10:09:40
265,"In Avengers: Age of Ultron, Ultron goes into the internet for 5 seconds before realizing humanity can't be saved. What do you think he saw?",01-18-2020 01:49:56
266,"Lawyers, What's a law that isn't real that normal people insist exists?",05-21-2020 09:29:01
267,What foods can a teenager cook for his parents to help their depression?,03-24-2019 19:57:18
268,"You get teleported to the day you were born with all the memories from your past life, but you’re now an infant. What do you do?",11-05-2020 05:48:11
269,"Suddenly on Christmas you get a PC made of pulsating flesh, blood and bone with all the normal pc ports. It Has 1000 times mire computing power than your current PC but you have to feed it with a rat once a month. How would you react to that?",12-04-2020 02:31:54
270,Which one of histories ‘good guys’ was actually a horrible person?,09-21-2020 09:06:25
271,“There is a new restaurant called Karma. It doesn’t have a menu. You just get what you deserve.” - so what are you getting?,04-22-2020 13:34:58
272,What video games show that graphics truly aren't everything?,09-07-2020 15:24:55
273,What’s the most overpriced thing you’ve seen?,08-14-2020 09:41:46
274,What can those who don’t live in Hong Kong do to support the protesters fighting for freedom?,08-14-2019 23:44:34
275,What is a good starter video game for a middle aged man who has never really played before?,03-24-2020 15:48:25
276,"Teachers of Reddit, what was the best excuse for being late that turned out to be true?",03-05-2020 15:03:39
277,What are some of the most toxic or potentially dangerous ideas/beliefs that have been perpetuated by Redditors?,11-29-2019 07:38:34
278,"What’s a small act of kindness you were once shown, that you’ll never forget?",06-24-2020 15:09:53
279,What’s something that’s “not a cult” but feels like a cult?,12-20-2020 08:32:02
280,"Donald Trump hasn’t tweeted in 19 hours, what are your theories on what’s happening in the White House right now?",03-23-2019 12:15:16
281,What’s the most fucked up thing the US government has done?,03-22-2020 11:59:22
282,If sexual experiences were like trading cards what would be your rarest card?,12-12-2019 13:13:01
283,What's the dumbest rule your school ever enforced?,05-17-2021 10:28:43
284,[Serious] Should elderly people be forced to take tests regarding their motor vehicle operating abilities and mental fitness and get their motor vehicle license(s) revoked if they fail the test(s)? Why/why not?,04-15-2018 17:17:02
285,"Zookeepers of Reddit, how are the animals acting differently now that there are no visitors to the zoo?",04-07-2020 12:37:28
286,"You've found a suitecase full of $750k in cash in $100 dollar bills, in the brush next to a highway. You can tell that it's been there for at least a year. How would you integrate this money into your life without raising red flags?",08-14-2018 11:22:31
287,"On April 1st everyone gets a text on their phone saying “April Fools! Sorry about the beginning of the year, let’s retry that” and we get sent back to January 1st 2020, what’s the first thing humanity should do?",03-21-2020 08:53:40
288,Right from *now* your need for sleep is gone. You can now stay awake till your eventual death without any consequences. How would the extra time (that you get from not sleeping) affect your life?,09-20-2019 05:21:08
289,In 40 years what will people be nostalgic for?,08-22-2020 14:23:03
290,Why do you like to be alone?,02-23-2020 12:43:39
291,"Adults of reddit, what is something that sucks about being an adult that most teenagers don’t realize?",10-01-2020 08:00:35
292,Parents of reddit: How do you feel when your kid brings back a girlfriend/boyfriend? How do you decide whether you like them or not?,10-22-2019 11:52:38
293,"People who wear hoodies when it is 100 degrees out, why?",06-21-2020 23:33:12
294,What movie could have been over in 10 minutes if the main character wasn't such a fool?,08-27-2020 09:40:03
295,What will never be the same again once the pandemic is over?,11-03-2020 17:05:40
296,what scientific experiment would you run if money and ethics weren't an issue?,11-28-2019 13:17:56
297,What's the fastest you've seen a crowd go from excited to horrified?,06-11-2020 09:00:05
298,"You get $1,000,000 however, it's because $100 is taken from 10,000 random people. If nobody knows that you got the money, would you do it, why/why not?",11-17-2018 08:23:06
299,What are some ridiculous history facts?,02-25-2020 11:31:13
300,"What’s cool now, but probably won’t be in 5 years?",03-21-2021 10:19:22
301,What fan theory do you 100% accept as true?,02-11-2021 08:00:31
302,You are given 300 million to make a movie but it HAS to bomb at the box office or else you die. What do you make?,01-31-2019 09:06:22
303,[Serious] What are some seemingly normal images with disturbing backstories?,04-26-2020 07:58:44
304,Bank tellers of reddit: What is your plan if someone sends bees through the tube?,02-17-2020 02:07:18
305,What is your favourite “dead” video game franchise?,11-13-2020 07:40:26
306,"Douglas Adams once wrote, “I may not have gone where I intended to go, but I think I have ended up where I needed to be,” how might this quote describe an experience in your life?",12-24-2020 21:32:05
307,What’s the most badass thing you’ve accidentally said in the heat of the moment?,06-18-2020 05:25:34
308,"What movie is so good you'd recommend it to all your friends, but so emotionally traumatic that you'll never watch it again?",05-21-2021 10:15:26
309,"High School teachers of Reddit, what is the one thing that you want your students to know that you’d never tell them in person?",01-11-2019 10:07:24
310,"You accidentally put in an hour more community service than needed, now you have to do 1 hour of community disservice. What do you do?",10-22-2020 18:49:01
311,what’s the most uncomfortable question you can ask someone?,07-11-2020 09:26:07
312,What are red flags in a friendship most people brush away?,02-22-2020 09:49:17
313,What was the highest waste of money that you don't regret?,01-11-2021 07:34:24
314,"Would you take a 50/50 chance at $5,000,000 or death? Why or why not?",02-20-2020 09:37:32
315,"You die and the first thing you see in the afterlife are three buttons: ""Next level"", ""Spectate"" and ""Restart"". Which one do you press and why?",01-20-2021 16:52:06
316,What was a huge trend that everyone forgot about?,09-14-2019 10:41:20
317,"What do you think is scarier, the idea that we are alone in the universe or the idea that we aren’t? Why?",04-24-2020 10:29:31
318,What are some psychology experiments with interesting results?,12-27-2018 04:56:07
319,What was normal to have in 2010 but not 2020?,03-11-2020 14:34:45
320,What’s an unfun fact?,05-26-2020 21:09:38
321,"Girls with super long acrylic nails, how do you wipe your butt without hurting yourself?",12-06-2020 20:20:33
322,What is the strangest mystery that is still unsolved?,07-07-2020 18:13:52
323,What's the dumbest way you've gotten a scar?,09-28-2020 06:34:32
324,"Non-Americans, does your culture have ""old-fashioned"" dog names like we do in America, such as Fido, Rex, Spot, Rover, etc, and what are some?",08-14-2019 14:15:16
325,You're being interrogated and so far you've held strong. What song do they play on repeat that breaks you?,12-28-2019 10:02:12
326,"What is most ""why the f*** do you know that"" fact?",08-26-2020 15:52:52
327,What YouTube channels are genuinely worth watching?,12-28-2018 01:59:15
328,[Serious] How would you react if the US government decided that The American Imperial units will be replaced by the metric system?,08-02-2020 00:06:34
329,What was the best moment you've seen where the real world hit a spoiled rich kid?,11-18-2019 11:29:25
330,"If a genie grants you the opportunity to ejaculate $50 in cash instead of sperm every time you cum for the rest of your life meaning you can't have any more children, would you accept? Why, why not?",09-12-2018 16:47:22
331,What are some good internet Rabbit Holes to fall into during this time of quarantine?,03-23-2020 04:36:07
332,"[NSFW] Guys who actually bought the “you won’t last 5 minutes playing this game” game from the ads from porn, what was it? What happened? Was it a scam?",04-21-2020 15:24:42
333,"0.1% doesn't seem much, however, What would horribly, catastrophically, go wrong if it was off by 0.1%?",08-20-2019 10:10:14
334,"If Trump was running against Trump, what would he tweet about his opponent?",11-07-2019 21:27:16
335,"Fathers of reddit. In honor of Father’s Day, what was your “don’t tell your mother about this” moment?",06-21-2020 14:44:51
336,"Reddit, what is a wholesome, solitary activity that a person can do to help forget how awful and poor their current life is?",11-15-2019 20:46:03
337,Reddittors who were born deaf; do subtitles like “dogs barking” and “tense music” help even if you’ve never heard them? What do you imagine them to be like?,08-31-2020 15:35:16
338,"[SERIOUS] Men of reddit, who are unable to share their emotions with anyone, what would you like to share?",11-18-2020 05:03:31
339,"All of the cereal box characters (Tucan Sam, Tony the Tiger, Lucky, etc.) enter a colosseum. Only one exits alive. Reddit, who is the ultimate cereal killer?",10-20-2020 16:52:13
340,"Autopsy doctors of Reddit, what was the biggest revelation you had to a person's death after you carried out the procedure?",06-01-2020 15:41:59
341,Which type of tattoo makes you cringe the most?,08-19-2020 07:52:57
342,Do you think a baby centaur would suck on the horse nipples or the human nipples? Why?,04-18-2019 13:39:47
343,What small thing brightens your day?,08-15-2020 00:48:48
344,"Men and women of reddit who caught their significant others cheating, how did you do that? And what was your reaction?",08-08-2020 09:54:11
345,What are some GREEN flags early on in dating that the relationship should become serious?,03-16-2021 12:51:55
346,"Doctors of Reddit, what are the dead giveaway signs that someone is faking?",10-04-2020 23:23:38
347,What did a crush do that made you instantly lose interest in him/her?,08-22-2020 07:08:40
348,What Movie Will You Always Recommend To People?,08-29-2020 17:21:48
349,"Redditors who were born at a very young age, what is your story?",07-23-2020 09:29:18
350,What free software is so good you can't believe it's free?,02-23-2019 11:51:17
351,Ladies: What is a dead give away that a guy watches too much porn when you sleep with him?,07-18-2020 12:47:17
352,"What subreddits do you feel were great in concept but never got the attention they deserved, and why?",10-08-2019 13:01:11
353,What industry is a lot shadier than it seems?,05-06-2020 10:15:54
354,What book would you recommend to people who haven't finished a book since high-school?,10-03-2020 17:15:57
355,What hobby does NOT get more expensive the more you dive into it?,07-04-2020 09:05:56
356,"If authors 'covered' novels, the way musicians cover songs, which covered novel would you be most excited to read?",04-30-2017 20:41:34
357,What's a thing you strongly dislike about Reddit?,03-31-2020 07:41:00
358,"Teachers of reddit, what are some signs that a student is being abused or lives in a toxic environment ?",10-27-2020 05:00:45
359,What was the biggest bullet you dodged?,12-04-2020 10:05:46
360,What's the craziest butterfly effect that happened to you because of a small decision you made?,11-23-2020 05:41:09
361,"Parents of Reddit, what is the best ""weird flex but ok"" moment you've seen from your child?",08-09-2019 19:45:35
362,"Police officers of Reddit, who’s the smartest criminal you’ve ever encountered?",03-08-2019 05:51:51
363,"Couples therapists, without breaking confidentiality, what are some relationships that instantly set off red flags, and do you try and get them to work out?",01-06-2021 17:16:27
364,Time freezes for 48 hours and you’re the only thing not affected. What do you choose to do?,11-05-2020 11:06:18
365,How do you tell if someone is attracted to you or just being very friendly?,12-16-2019 05:30:06
366,Have you ever not slept for so long that you started hallucinating? What was your experience?,12-10-2020 18:06:32
367,What is the most toxic thing a parent can say to a child?,04-24-2021 03:38:07
368,"If you were offered immortality, but everytime moonlight shined on you, you'd be a walking skeleton, would you accept it? if so, why?",12-11-2018 18:45:07
369,"Besides eating cereal with water what is the most outrageous ""eating sin"" you have ever witnessed?",04-08-2019 19:32:37
370,If cats had pockets what would you find in your cats pockets?,01-04-2020 22:49:29
371,What's a joke that's so stupid it's funny?,12-01-2018 16:20:12
372,Whats the craziest crime you or somebody in your family has commited?,12-22-2020 10:51:35
373,What's a really awkward situation that everyone can relate with?,04-02-2020 06:27:40
374,"You are offered $10,000,000 if you can name a food that nobody in human history has ever used in a sexual way. What is your answer?",11-12-2020 04:54:44
375,What food does your mom make better than anybody who has ever existed in the history of the universe?,01-26-2021 09:02:35
376,"Multilinguals, what's your ""they didn't realise I could understand their language"" story?",02-18-2019 09:56:50
377,"Vets of Reddit, What was the worst pet name you have ever encountered in your job?",01-18-2021 09:47:11
378,"“Free Candy” is often joked about being written on the side of sketchy white vans to lure children in. As an adult, what phrase would have to be written on there for you to hop on in?",09-17-2019 06:35:30
379,What do most people not realize is newer than they actually think?,10-29-2020 18:49:59
380,What is something most people need to hear but no one has the guts to tell people?,10-16-2019 17:52:27
381,"If you had enough money to build your dream house, what's a strange room/feature you'd include?",12-23-2020 08:37:39
382,"What's your, ""Tis but a scratch!"" moment?",11-26-2020 10:00:54
383,"What did ""the weird kid"" in your school do that you'll never forget?",10-09-2020 02:01:44
384,"Dog owners of Reddit: Would you cut of 5 years of your own life and give these to your dog? If so, why?",03-01-2020 04:18:14
385,"Formerly suicidal redditors, what's something that kept you alive a little while longer and helped you to get through the dark times in your lives ?",09-27-2020 17:20:59
386,"What's your creepiest ""glitch in the matrix"" or unexplainable thing that's ever happened to you?",01-18-2020 11:25:56
387,"Gym goers of Reddit, what is something (protocol, etiquette, tips, etc.) that new year resolution-ers should know about the gym?",12-27-2019 06:49:22
388,What's the best way to ruin a perfectly good bout of depression?,01-26-2019 19:42:21
389,What is the worst thing that is legal?,12-29-2020 09:06:45
390,"You just got an offer for $600K...but to collect it, you gotta have sex with the main character of the last tv show you watched. Who will it be?",11-02-2020 06:24:07
391,The year is 2030 and President Dwayne Johnson is impeached. What led to these events?,10-28-2019 07:23:48
392,What is something super important that is on the verge of happening?,02-26-2019 22:06:58
393,"If marriages were 5 to 10 year contracts with options to renew if both parties accept, how would the world be different?",03-04-2020 20:41:55
394,"Your dog has heard all of your conversations, arguments and deepest secrets. It suddenly learns to talk. What would you do?",01-22-2021 19:01:35
395,Winston Churchill famously said “You can always count on Americans to do the right thing - after they’ve tried everything else.” What are some good examples that prove OR disprove this quote’s accuracy?,11-23-2019 21:15:04
396,"Extroverts who ask others “why are you so quiet”, what kind of response are you looking for?",12-31-2020 12:28:17
397,What family secret was finally spilled in your family?,05-05-2021 14:11:58
398,"Those who have been to a ruined wedding, what happened?",05-13-2021 02:39:37
399,What free software is so good you can't believe it's free?,06-11-2018 07:20:39
400,Who are some women that often get overlooked in history but had major contributions to society?,11-09-2020 19:18:23
401,What is something that your parents did that you swore never to repeat to your own kids?,05-04-2020 20:04:58
