,title,created_utc
614,"Married couples who sleep in separate rooms, why do you do this?",10-26-2019 08:05:55
615,"What is one of the dumbest things you've done when your brain was on ""auto-pilot""?",09-27-2019 10:06:02
616,How would you feel about a button that filters out all political sub reddits on the popular or /r/all page?,08-27-2020 21:19:43
617,What are some good first date questions to get to know someone?,07-24-2019 12:28:50
618,What’s an invention that’s still around today but has lost sight of its original purpose?,01-11-2020 08:23:00
619,What are dark secrets about the Porn Industry that people should know?,08-07-2020 04:01:57
620,"If you got to pick one video game that you would live in for the rest of your life, what game would you pick and why?",03-16-2020 08:57:28
621,What film role was 100% perfectly cast?,04-01-2020 04:19:08
622,What is the most terrifying thing you’ve ever experienced while home alone?,07-15-2020 15:29:45
623,"People who had ""Abstinence Only"" sex education, what was the most outrageous or untrue thing you were told?",03-15-2021 12:14:59
624,How does someone politely end a conversation with a person who won't stop talking?,09-04-2019 10:14:17
625,People who hoarded gas two weeks ago: how are things going for you now?,05-24-2021 23:11:30
626,"People who have came close to dying, what were your “last” thoughts?",09-26-2020 21:00:11
627,What’s a suitable punishment for people who litter in national parks?,12-06-2019 18:20:19
628,"[Serious] People from Reddit who survived Corona, how has your daily life changed? What are the side effects after?",09-30-2020 12:22:20
629,"What is the HARDEST to answer ""Would You Rather"" that you have heard?",04-18-2019 18:25:51
630,"What movie did you start watching then said ""Fuck this, I'm not finishing this""?",04-11-2020 02:55:53
631,What's something your employer did that instantly killed employee morale?,07-25-2018 15:31:17
632,"Those who have been in a coma, what was it like?",06-23-2020 08:45:01
633,What myth is still widely circulated as truth?,11-16-2020 20:10:47
634,"If you could pick between $100,000 tomorrow or $1,000,000 in ten years, what would you pick and why?",02-26-2020 15:51:16
635,[Serious] What can the international community do to help the teens in Bangladesh against the ongoing government killings and oppression?,08-05-2018 07:21:05
636,"Girls, what was the most obvious hint you dropped, and the guy just didn't get it?",11-02-2019 13:14:46
637,"Cosplayers, what’s one cosplay you will never do again and why?",11-17-2019 13:56:25
638,When did the popular kid’s life fall apart in a few seconds?,03-08-2020 09:08:01
639,Teachers of reddit what is the most depressing thing a student has told you about their home life?,10-31-2020 01:12:46
640,"Redditors that worked with a dating company (Tinder, Bumble, Hinge, etc.), what’s the most insane user stat or behind-the-scenes fact you found out about?",12-23-2020 23:54:31
641,"There's a quote of Philip K. Dick that says: “There exists, for everyone, a sentence - a series of words - that has the power to destroy you"". Which sentence is it for you?",08-31-2019 00:02:46
642,What something that you’ve done while horny and you regret it?,12-19-2020 08:21:11
643,"Redditors who have been clinically dead, what did you experience in death, if anything?",08-23-2018 15:11:55
644,What do you regret finding out?,12-07-2019 05:55:35
645,It’s the year 2050 and the term “ok millennial” is trending. What are the reasons the young generation is using it?,11-10-2019 13:06:50
646,What are some REALLY REALLY weird subreddits?,10-04-2019 03:53:28
647,"What's your worst story from the ""throw him in the pool, he'll learn how to swim"" parenting style?",04-09-2021 07:55:52
648,What only exists because of people’s stupidity?,03-09-2020 13:19:45
649,"Your parents and the media were right. Video games do cause violence. Based on the last game you played, what are you getting arrested for?",03-27-2021 19:32:56
650,"Teachers of reddit, what is the smartest/most creative way of cheating that you've seen?",01-12-2019 10:19:52
651,"Aliens come to earth, one of them asks you ""hey you, do the thing. Ya know the thing you humans do"" what is the thing?",10-24-2020 12:14:00
652,How did your high school crush turn out as an adult?,02-10-2021 09:31:47
653,What is the single biggest dick move in all of history?,10-18-2020 05:31:36
654,"Storm Area 51 is just one week away. What's a harmless way they could ""stop us all""?",09-12-2019 09:50:47
655,[serious] What was your biggest ‘we need to leave... Now!’ moment?,02-24-2020 06:12:11
656,"You just got an offer for $600K...but to collect it, you gotta have sex with the main character of the last tv show you watched. Who will it be?",01-06-2020 18:24:25
657,"Only if COVID-19 was a pandemic causing Erectile Disorder instead of Respiratory disorder, do you think people would have more eagerly worn masks? Why or why not?",10-02-2020 04:44:36
658,What’s something $100 or less but is a total game changer? [serious],12-22-2019 22:31:20
659,"Teachers, what’s the darkest thing you’ve seen from a student?",04-08-2020 22:03:02
660,How do you get over someone?,08-18-2020 03:04:01
661,You've been granted one wish by the Douchebag Genie. He takes advantage of people's poor wording when making wishes to screw them over. What do you wish for?,10-01-2018 07:50:28
662,"Messy people of Reddit, where do you draw the line between ""these are acceptable living conditions"" and ""I should probably tidy up now""?",03-31-2021 07:16:22
663,Which fictional character would still be alive if other characters had used a bit of common sense?,09-19-2020 09:42:25
664,People who are stopped at a red light for 1 minute but creep forward a few feet every 10 seconds... Why?,02-15-2021 09:53:35
665,"[Serious] If you could learn the honest truth behind any rumor or mystery from the course of human history, what secret would you like to unravel?",07-06-2020 16:21:55
666,What is an important piece of advice you can give for those moving into the “real world”?,01-12-2020 09:03:24
667,"You are given a button that will make you very attractive ,but every Friday you turn into the opposite gender for a whole day. Would you press it and why?",06-03-2019 01:11:01
668,Hospital workers [SERIOUS] what regrets do you hear from dying patients?,10-09-2020 21:20:55
669,"Without saying the title, what’s your favorite video game?",10-24-2019 06:35:35
670,"People who were born deaf but gained hearing later in life, what objects did you expect to make noise?",09-24-2019 07:59:27
671,"People who grew up in third-world countries, what was the biggest shock for you when moving into a developed country?",02-11-2020 03:48:27
672,"What ""you know what, just to be safe..."" thing you did ended up saving your ass later?",12-12-2018 07:42:12
673,What is the strangest thing that happened to you that you can’t logically explain?,01-17-2021 22:37:56
674,What would 12 year-old you never believe about adult you?,03-08-2021 22:23:46
675,How much time needs to pass before grave robbing turns into archaeology?,01-02-2021 05:54:36
676,"People who have stories they want to share, but have not found a question relevant to them, what are your stories?",03-17-2021 06:53:59
677,What are some horrifying things to consider when thinking about aliens?,05-03-2020 17:43:40
678,What are some of the most interesting 24/7 live-streaming webcams to watch from around the world?,08-07-2018 18:41:09
679,"[Serious] Sailors, seamen and overall people who spend a vast amount of time in the ocean. Have you ever witnessed something you would catalog as supernatural or unusual? What was it like?",04-26-2021 03:34:09
680,"To all of those actually named Chad, Stacy, or Karen, how does it make you feel knowing that your names are used as insults?",08-07-2019 16:34:10
681,What is the greatest design fuck up of the human body?,09-29-2019 07:28:05
682,What's the best euphemism for telling people that they're stupid?,04-15-2021 05:17:47
683,What is the worst thing you've overheard while pretending to be asleep?,06-13-2020 17:23:59
684,Let's pretend violent video games teach you to use a gun to kill people. What other skills have you inconspicuously picked up playing video games?,03-11-2018 17:19:38
685,What’s a little thing you do to make the world a better place?,05-25-2020 18:29:26
686,"Photographers of Reddit: What is the most outrageous photo shoot request you have received from an Instagram ""influencer""?",02-06-2020 09:17:52
687,what are good reasons to live?,07-22-2019 01:32:01
688,What is a lesson you learned too late in life?,09-10-2020 13:52:47
689,Driver's License testers- what's the worst thing a kid has done without batting an eye while taking the driving test?,08-11-2019 19:18:37
690,What is a totally wrong thing that has become so widespread it's not considered wrong anymore?,04-30-2021 22:57:14
691,"What is the single worst movie you sat through hoping it would get better, but didn’t?",07-23-2020 12:43:08
692,What is the WORST advice you can give a virgin for their first time?,08-28-2020 09:56:01
693,What was your best purchase this year?,12-09-2020 08:54:48
694,"Redditors who lived in countries that no longer exist (Like Yugoslavia, Czechoslovakia...etc) What was it like to see your country breakup?",05-07-2020 03:34:55
695,"What are the best, most useful, must-have Google Chrome extensions?",08-12-2018 09:09:13
696,What did you think you were really good at until you saw someone who was *actually* really good at it?,08-21-2019 13:53:46
697,What only exists because humans are dumb?,05-12-2020 08:02:51
698,"You are offered 10 million dollars but you have to participate in a porn movie that your family and friends are going to be aware of, do you take this offer or not? Why?",12-27-2018 12:47:06
699,What fictional character do you feel bad for the most?,05-28-2020 18:35:07
700,"You own a cabbage cart, but your produce is destroyed periodically by a group of famous 12 year olds. What do you do?",01-09-2021 12:07:16
701,Fuck 2020 [Megathread],12-31-2020 22:50:47
702,"You just got an offer for $600K...but to collect it, you gotta have sex with the main character of the last tv show you watched. Who will it be?",05-12-2020 13:53:39
703,What are the spookiest audio or video clips on the internet?,03-25-2020 01:07:07
704,What is something in YOUR life that is SUPER FUCKING AWESOME?,09-15-2018 05:53:35
705,"Doctors and nurses of reddit what have been your ""WHY DIDN'T YOU COME IN SOONER!?"" Moments?",10-25-2020 16:34:37
706,"Philadelphia is considering opening a site where drug users can go to legally use drugs. They would be monitored by medical professionals who would administer anti-overdose medication as needed. Medical professionals, how would you feel about having this job?",09-05-2019 08:37:46
707,What’s the worst birthday gift you ever got?,09-13-2020 22:52:49
708,"Someone once said ""Everyone sees the world in a different way; so when someone dies, it is - in a way - the death of an entire world."" So, Reddit. . . what unique world will die with you?",11-09-2020 02:08:13
709,"[Serious]Have you ever known someone who wholeheartedly believed that they were wolfkin/a vampire/an elf/had special powers, and couldn't handle the reality that they weren't when confronted? What happened to them?",09-11-2019 10:16:08
710,Disney theme park characters - have there been situations where you had to break character? What was the reason? Consequences?,09-20-2019 16:11:40
711,"For those who grew up poor, what did you consider a luxury?",11-21-2020 00:06:20
712,What is a movie you find terrible but critics seem to love?,04-29-2020 10:45:15
713,"What was your 'F*** it, done helping others' moment?",11-18-2020 09:22:10
714,Would you continue to be vegan if you had to grow every single vegetable you wanted to eat? Why or why not?,04-01-2018 15:45:46
715,"Divorce Lawyers of Reddit, what's the most outrageous reason someone filed for divorce?",07-17-2019 06:46:26
716,You are now naked. How much trouble are you in?,01-13-2020 07:53:16
717,Stephen Covey said “Most people do not listen with the intent to understand; they listen with the intent to reply.” What are your thoughts on this?,01-17-2021 03:38:48
718,What’s something you’d love to see but won’t be alive for?,03-22-2021 16:00:10
719,What bot accounts on reddit should people know about?,04-29-2015 01:42:46
720,What fetish will you keep a secret from the people you know IRL?,02-27-2020 20:35:24
721,What seems harmless but is incredibly dangerous?,04-27-2021 15:23:51
722,"What's the most high risk, low reward thing you've ever done?",05-23-2020 00:51:28
723,Chocolate is now illegal. What’s its street name?,10-13-2019 17:31:05
724,"People who are / have been homeless, what was the first night without a home like, and how did you adapt to your new situation?",10-14-2019 04:54:05
725,"Would you live in a van for 6 months for $100,000 and why?",02-19-2021 07:23:59
726,"Men of Reddit, what’s the hardest thing to explain to women?",02-27-2020 11:24:23
727,"You have to fight an exact copy of yourself to the death, how do you outsmart yourself?",03-15-2019 12:27:35
728,What’s your childhood mystery that you finally solved years later?,12-18-2020 22:44:14
729,"A magical pet store is open, but the good pets are too expensive, what magical pets you find in the discount section?",08-12-2019 19:38:01
730,How long do you think it will be until a reddit post hits 1 million upvotes for the first time? And what will the post be?,10-12-2019 00:17:38
731,"What are we all missing right now, because it gets overshadowed by Corona Virus news?",03-12-2020 13:48:49
732,What is something you spend a ton of money on that the vast majority of people never would?,11-27-2019 20:11:50
733,"What's the most embarrassing/cringy thing you've accidentally shown someone, or something they accidentally saw while using your phone or computer?",04-06-2020 10:31:01
734,"Hey Reddit, what's the strangest coincidence you've ever personally experienced?",02-09-2019 07:14:23
735,What is the most hurtful thing a medical professional has ever said to you?,02-05-2019 07:11:57
736,What is the most useless fact you know?,08-24-2019 08:21:46
737,"God is retiring, and asks you to permanently replace him. What is the first thing you do as the new God?",01-24-2020 21:22:52
738,"How does the compliment ""you're smart"" make you feel?",08-05-2020 07:55:06
739,What is dangerous to forget?,05-31-2020 10:14:03
740,"If immortality was granted to 1 million individuals worldwide, what would be a fair selection process?",03-23-2020 12:31:06
741,What’s the scariest true story you’ve heard or told ?,11-22-2020 07:33:49
742,What do you own a ridiculous amount of?,01-05-2021 09:52:24
743,What is a common myth about your country that is 100% false but many people still believe in it?,04-19-2021 01:10:19
744,Who is the biggest troll in history?,11-12-2020 09:42:12
745,What's the harsh reality no one accepts?,05-01-2020 00:31:53
746,What’s it like having loving parents?,06-21-2020 09:52:31
747,"If you had a chance to broadcast one song to all the 7.8 billion people on this planet, which song would you choose?",10-31-2020 10:04:33
748,What felt like a useless piece of advice until you actually tried it?,04-29-2019 18:14:04
749,What part of your Personality do you Fake?,08-07-2019 02:16:41
750,"Parents of reddit, what is most fucked up secret you are hiding from your children?",04-19-2019 07:56:11
751,"If your username is the answer, what is the question?",12-27-2019 17:41:52
752,What did you see that you definitely weren’t supposed to see?,04-14-2021 17:43:36
753,[SERIOUS] What is the harshest truth you’ve ever learned?,11-08-2020 20:26:34
754,What's the most fucked up shit you've walked into?,01-08-2019 10:39:30
755,"You wake up, it’s 2050, what do you google first?",04-05-2020 08:24:46
756,"Women of Reddit, what things that men find unattractive about themselves do you find very attractive, and why?",08-15-2020 20:22:07
757,What is the scariest thing you’ve ever seen while driving at night?,07-27-2019 10:02:41
758,What's the dumbest thing you actually believed?,09-30-2020 08:19:23
759,What will the first reddit post that reaches 1 million upvotes be about?,07-07-2018 09:17:01
760,"For five minutes you get transported 30 years into the future, you sit in front of a computer, what information to you look up?",03-01-2021 10:23:06
761,"People who had considered themselves ""incels"" (involuntary celibates) but have since had sex, how do you feel looking back at your previous self?",05-03-2020 04:41:23
762,"Will you continue to wear a mask when the pandemic is over? If so, why?",03-20-2021 00:22:12
763,What is the best animated movie and why?,10-18-2019 21:31:47
764,"Gamers of Reddit, what are some underrated games do you think more people should play?",01-16-2020 08:01:33
765,What's the best Wi-Fi name you've seen?,04-28-2020 08:50:32
766,What popular saying is actually bullshit?,12-02-2020 03:02:48
767,"If people came with a warning tag, what would yours be?",02-14-2021 08:26:13
768,"Redditors with thin walls, what have you heard in your apartment?",08-18-2019 17:11:10
769,"Republicans who will not be voting for Trump this time around, what was the breaking point for you?",06-14-2020 19:52:01
770,Who is the most overrated person in history?,06-19-2019 10:01:41
771,"AskReddit has hit 25,000,000 subscribers! (insert party parrots here)",10-31-2019 22:15:59
772,What totally obvious scam do people still fall for?,04-25-2020 12:48:20
773,"You have to cook one dish for Gordon Ramsey. If he doesn't like it, you will die. What dish do you cook for him?",07-07-2019 19:33:20
774,What’s the adult version of “there is no Santa Claus”?,12-26-2018 08:57:24
775,"Redditors with good eyesight, what is it like to be able to watch your haircuts in progress?",09-28-2018 09:18:30
776,What is an odd behaviour of yours you think only you do?,10-03-2019 03:52:37
777,What happened at your work which caused multiple people to all quit at once?,06-24-2019 10:51:19
778,"Redditors with less than a year left to live, what is on your bucket list and how can we help you?",06-06-2017 08:37:32
779,What non-sexual fantasies do you have?,08-23-2020 19:27:14
780,What is cheaply made but sold at a ridiculous price?,01-16-2021 14:11:41
781,"If covid 19 became a pandemic in 1990 rather than 2020, how would events have played out differently?",12-30-2020 21:33:28
782,What is one thing that instantly makes you think “this person has no manners”?,07-26-2020 18:23:57
783,"Teachers of Reddit, whats the weirdest thing a student answered to ""tell me a fun fact avout yourself""?",07-12-2020 09:43:36
784,What was the weirdest thing the weird kid did at school?,04-08-2021 04:23:21
785,What's a genuine question you have that Google can't seem to answer but maybe somebody on Reddit can?,11-21-2018 04:17:12
786,"Sex workers of reddit, have any of you ever have a close friend or anyone you normally interact with daily be a surprise customer? What was the experience like, and how did it affect your interactions with them?",06-17-2020 07:11:46
787,What’s something that gets an unnecessary amount of hate?,02-26-2020 10:15:58
788,"You’re choosing a band name, the name must include a type of pasta, what are you going to call your band?",11-08-2020 06:12:45
789,"Are you afraid of dying? If so, why?",07-27-2020 06:19:41
790,What can you not believe we still have to deal with in 2019?,02-02-2019 12:20:31
791,"People who own multiple pets, what is some drama going on between them right now?",03-11-2021 10:01:08
792,"Bartenders of Reddit, what’s an underrated drink more people should try?",07-31-2018 10:44:21
793,"Parents of identical twins/triplets, how sure are you that you never accidentally switched them around and raised them under the wrong names?",10-07-2020 03:32:43
794,"What made you straight up ""nope"" out of a relationship?",05-24-2021 03:06:04
795,"Adults of reddit, what is something every teenager needs to know?",11-03-2020 08:17:01
796,"People who work in Human Resources, what is the weirdest shit you have seen?",05-05-2020 08:35:22
797,What used to be a normal behavior but is considered extremely sexual now?,11-21-2020 23:04:23
798,"If there was one movie you could completely delete from reality, what would it be?",08-18-2020 11:52:10
799,What's something you should ALWAYS keep in your car?,03-07-2021 08:55:26
800,"People who work at a ball pen factory, what does it feel like to immerse your hand into a bucket of ball pen balls?",04-01-2020 17:12:27
801,What awesome holiday gift did you get someone that you can’t tell them about yet but want to brag about?,12-14-2019 11:11:43
802,What’s the dumbest thing your significant other has said or done?,02-16-2019 09:01:28
803,Users who upvote questions but don’t answer them: Why?,10-06-2019 20:11:39
804,Identical twins of reddit who own a pet after living seperately; what was your pet's reaction when it saw two owners?,04-13-2020 21:43:01
805,What happens in movies or tv that seems to be normal and you think to yourself “that is not what people in real life do”?,04-27-2021 08:09:19
806,"You are physically incapable of ever lying again, but you get $10,000,000. Do you take it, and why or why not?",12-15-2018 14:45:34
807,"People who had no sex education at all and had never ever seen the opposite sex's special parts, how'd you know how sex worked (if you did at all) and which parts were supposed to go where? How did your first time go?",03-13-2020 08:52:48
808,What’s going on on the non-English parts of the internet that we’re all missing out on?,07-28-2018 08:18:58
809,"Of all movie opening scenes, which one sold the entire film?",10-09-2019 13:09:49
810,"Surgeons of reddit, what’s the weirdest object you’ve had to remove from someone’s butt?",12-24-2019 16:27:21
811,What is a phrase you HATE hearing from people?,04-18-2021 02:33:14
812,"Redditors with toddlers, what’s the most recent illogical breakdown they’ve had?",02-02-2019 22:04:43
813,Sometimes cheap and expensive items are the same thing with the only difference being the brand name. What are some examples of this?,04-27-2020 06:45:53
814,"Doctors, what was the best excuse you’ve heard for someone having something stuck in their ass?",06-19-2020 15:49:29
815,"What does your crazy neighbour do to be labelled ""the crazy neighbour""?",05-19-2021 07:21:31
816,What movie death scene is seared into your memory?,05-29-2020 09:32:11
817,Every character played by the same actor is now a part of one continuous story. Which actor has the best story arc?,12-07-2019 21:48:19
818,You're Satan and your goal is to torment Gordon Ramsay. What food would you serve him?,05-12-2020 21:36:34
819,"People who knew Murderers, when did you know something was off?",11-15-2020 03:13:08
820,What movie is the best anti-depressant?,11-23-2020 13:38:18
821,Hey shy people what is your worst experience?,12-06-2020 11:39:16
822,"People who don't click the tongs before using them, how?",12-23-2020 03:32:52
823,"You get to have sex with the Woman/Man of your dreams. However, there is press conference after discussing your performance. Do you do it, why or why not?",10-02-2019 15:02:10
824,"Straight males of reddit, what’s the gayest thing you’ve ever done?",01-01-2021 10:08:07
825,What’s the worst LEGAL thing you can do?,10-06-2019 10:36:15
826,Parents who have disowned or genuinely stopped loving your child - what happened?,10-14-2019 15:08:31
827,"What's a place easy to enter, but hard to exit?",01-21-2020 14:27:53
828,"Non-Americans of reddit, what is your genuine reaction to what’s going on in America right now?",08-31-2020 01:41:29
829,What sounds like fiction but is actually a real historical event?,04-05-2019 07:33:16
830,"Your best friend is faking being asleep and you need them up. What do you say out loud to trick them into ""waking up""?",03-14-2020 02:31:45
831,"After you die, you have to choose a single spot on Earth where your spirit will be locked in place and forced to observe for the next one million years. Whats the most interesting location you’d choose?",01-17-2021 06:42:48
832,What innocent item gets suspicious if you own too much of it?,03-13-2020 14:26:16
833,"You can fill a pool with anything you want (money, gold, coins, anything valuable really), but you must jump into it from 10 meters (~33 feet) and survive in order to keep what you filled it in with. What would you fill the pool up with?",06-13-2019 01:29:28
834,Non-Americans who have been to the US: What is the weirdest thing about America that Americans don't realise is weird?,12-24-2019 23:27:56
835,What song has an upbeat tune but dark lyrics?,09-17-2020 15:32:23
836,"Men of reddit, what do women do that they think is okay but is actually creepy?",10-02-2019 08:22:48
837,What life-altering things should every human ideally get to experience at least once in their lives?,02-11-2019 07:27:06
838,What's something that you've never learned to do?,02-19-2020 14:07:13
839,What the weirdest thing you did while you were high?,09-27-2019 16:10:24
840,What's the worst coworker you've ever worked with?,05-19-2020 15:33:09
841,"Doctors of Reddit, what is something that you wish everyone knew about their body?",07-07-2019 01:39:47
842,What non-sexual thing feels very sexual?,07-29-2020 08:35:44
843,"What is one thing you will never, ever do?",03-28-2020 23:16:22
844,"What’s a ""Let that sink in"" fun fact?",12-18-2017 06:36:41
845,"What's that ""can't stop laughing"" moment where you're in a situation you shouldn't be laughing?",12-14-2020 08:22:18
846,What is something that everyone should experience at least once in their lifetime?,06-17-2019 05:58:34
