,title,created_utc
402,What conspiracy theory do you completely believe is true?,09-12-2020 18:04:23
403,The Average human brain is comparable to about 2.5 million gigabites. Your brain has reached near capacity. What do you delete to free up space?,11-03-2020 02:09:25
404,What 2000s song will always be a banger?,08-03-2019 21:28:21
405,"Those of you Redditor’s in happy, healthy, and fulfilling relationships, what were the “green flags” you noticed about your partner early on in your relationship with them?",11-19-2020 02:16:31
406,"People of Reddit, are you aware of the YouTube channels who take screenshots of popular Reddit posts, put a text to speech voice over on them and get millions of views? If so, what are your opinions on them?",10-05-2019 17:44:46
407,"If ""Bullshit"" means fake and ""Batshit"" means crazy what do the other ""shits"" of the animal kingdom mean?",12-08-2019 20:18:02
408,What’s the worst scandal to happen at your school?,12-15-2020 10:30:47
409,What things did you do as a kid that you now realize is extremely weird?,07-05-2020 03:17:34
410,"As of right now, what will it take to make you 100% happy?",01-17-2020 10:36:41
411,What did your crush do that absolutely killed your interest?,06-20-2020 07:16:12
412,"On the birth of your child, a demon appears and says, ""Your child will be extraordinarily attractive, you shall receive $1 billion if they are a virgin at age 25, otherwise your soul and theirs will be mine"". You cannot inform your child of any aspect of the deal. What is your plan?",09-19-2019 04:26:04
413,What simple “life hack” should everyone know?,08-20-2020 01:08:43
414,What’s a NSFW detail about a historical figure that’s normally left out of the history books?,07-03-2020 19:33:10
415,"You’ve died and arrived at a train station to your afterlife. The trains are “animals”, “traditional Heaven”, “rebirth”, and “eternal nothingness”...Which train do you take and why?",12-27-2020 09:10:56
416,"If an alien offered you a one week trip across the galaxy and back with the catch being 15 years passes on Earth, would you accept or reject the offer and why?",03-18-2021 13:43:59
417,"Doctors of Reddit, what was the worse thing you've seen for a patient that another Doctor overlooked?",03-02-2021 08:54:14
418,What do you do confidently now that made you feel weird in the past?,09-11-2020 06:23:31
419,In what movie did you like the bad guy more than the good guy?,07-13-2020 09:03:53
420,What is the single most “you’ll understand it when you’re older” thing?,12-12-2020 12:51:13
421,What is socially acceptable in the U.S. That would be horrifying in the U.K.?,04-17-2021 12:39:55
422,What is an adult problem you were not prepared for?,06-09-2020 19:17:03
423,"[Serious] Dark Web users of Reddit, was there ever a point in your use that you felt you were genuinely in danger? What happened?",07-17-2020 22:29:53
424,"What are some common ""facts"" that people believe to be true even if the existing evidence states the contrary?",05-30-2020 17:24:21
425,"Its international mens day. Men of reddit, how are you today?",11-19-2019 06:41:24
426,"If 9/11 happened two months earlier, what do you think the store 7/11 would have done afterwards?",06-01-2019 00:07:20
427,"What's the ""went through med school just to realize you couldn't stand the sight of blood"" of your job field?",03-18-2019 09:48:43
428,"You can go back 100,000 years to a cave that will be discovered by archeologists, what do you write on the wall to mess with them?",05-09-2021 20:10:04
429,People who read the terms and conditions of any website or game. What's something you think other people should know about them?,02-28-2019 06:46:29
430,"Now that the 2010s decade is ending, which trends are the most regrettable?",11-21-2019 07:16:46
431,"What was your ""This person is on another level of stupid"" moment?",07-05-2020 18:31:17
432,"You have been appointed Gosh, God's assistant for smaller, less serious everyday business. What are some of your policies and if neccessary, how do you explain them to/conceal them from your boss?",03-27-2020 15:13:48
433,"Parents who knock on their kids' doors and then immediately open it anyway, what's your thought process?",12-23-2018 04:54:49
434,What's the most kind/beautiful thing you've overheard about yourself by accident?,12-25-2018 04:30:06
435,What's the scariest space fact/mystery in your opinion?,06-10-2020 15:46:46
436,"Partners of sleep-talkers or sleepwalkers, what gems have you to share?",09-05-2020 15:40:33
437,"How would you feel if underwear had butt cheek sizes A,B,C,DD etc just like bra cup sizes but for your butt?",12-11-2020 01:08:12
438,"You will get $10 million cash but Samuel L Jackson will be there to shout ""motherfucker"" for every dollar you spend, will you be happy? And Why?",04-28-2018 09:21:52
439,What are some VERY comforting facts?,06-30-2020 00:24:42
440,What's the weirdest compliment you've ever been given?,11-16-2020 07:38:35
441,"If life was someday proven to be a simulation, what glitch or anomaly could you point to as a major clue we'd missed?",11-04-2020 10:33:58
442,What’s something that people think makes them look cool but actually has the opposite effect?,09-09-2019 05:49:17
443,Mod statement on the Aimee Challenor controversy,03-24-2021 16:16:43
444,"Students/Teachers of Reddit, what’s the best ‘forgot to turn off the mic’ story during virtual learning?",08-30-2020 09:23:52
445,"If Cinderella’s shoe fit perfectly, then why did it fall off when she ran?",10-09-2020 09:01:17
446,"Virgins of Reddit, how bored are you of all the questions about sex on this sub?",09-22-2020 06:59:06
447,"You get $5,000,000 USD, but for every two weeks you are alive for, a tastebud grows in your butthole. Would you take it? Why or why not?",08-24-2020 21:36:10
448,"Casting staff or directors in general, how awkward is it to hire people for unattractive characters as in their whole role is being fat or ugly?",12-05-2020 04:43:15
449,"[NSFW] If you suddenly discovered that people you had fantasized about, while masturbating, were always fully aware of this, what would your first thoughts be?",03-29-2021 08:34:15
450,What innocent search turned out to be porn ?,01-26-2020 08:11:24
451,What is a seemingly mundane question you can ask somebody that will tell you a lot about their personality?,02-03-2021 18:48:10
452,What are some tips for someone with no fighting experience to win in a fight?,02-05-2020 10:06:29
453,"What drug did you take once and thought “nope, never again”?",03-14-2020 11:59:23
454,"If written like a news report, what stories from the bible were done by Florida man?",08-12-2019 04:14:01
455,What's way more dangerous than most people think?,05-31-2020 21:14:58
456,"What is your ""I don't get paid enough for this shit"" moment?",11-24-2020 10:04:21
457,"You are sent back to the day the titanic set sail with nothing but a 3rd class ticket (and food water ect) your task is to stop the titanic from sinking, how do you do this?",02-05-2020 05:24:16
458,"Guys, what made you realize, “this girl is definitely not into me”?",08-12-2020 03:51:09
459,[SERIOUS] Would you reduce your meat consumption if lab-grown meat or meat alternatives were cheaper and tasted good? Why or why not?,04-10-2019 11:35:34
460,"Americans of reddit, what is your opinion on switching to the metric system?",09-25-2019 17:07:01
461,What is the craziest encounter of 'rich kid syndrome' that you have experienced?,02-26-2019 07:06:47
462,"What is a movie that after you finished watching it, you went ""Oh shit"" then went back and watched it again to pick up on everything you missed?",01-11-2020 00:56:04
463,"Have you ever woke up in the middle of a dream and the dream was so interesting that you wanted to go back to sleep to see the end of it? If so, what was the dream?",01-13-2021 12:55:23
464,What is the most obvious lie you have ever been told?,01-13-2021 08:19:39
465,What was a house rule you had as a kid that you thought was completely normal until you grew up and realized not all households followed?,01-08-2020 21:05:00
466,"Lawyers of Reddit, what’s the worst way you’ve seen a person screw over someone else in court whether it be criminal, civil, or divorce proceedings?",09-09-2019 13:55:52
467,What is your Favorite Quote from Spongebob?,04-12-2021 10:39:58
468,"People who have ordered a bars ""safeword"" drink to get out of a bad situation, what was your date like and how did the staff help?",10-27-2018 18:25:02
469,People who separated/divorced within one year of getting married: When did you know it was a mistake?,10-10-2019 21:10:22
470,What fact is ignored generously?,04-16-2020 06:55:58
471,People who take out their phones to record strangers who are having bad days: Why?,05-14-2021 09:19:19
472,Whats the best dialogue you have ever heard in porn?,12-10-2020 09:21:40
473,"Daughters of reddit, what is something you wish your father knew about girls when you were growing up?",03-14-2018 10:59:16
474,"Couples of Reddit, what's the most unromantic thing that's happened between the two of you that actually is a stronger indication of love than others might think?",01-05-2019 19:28:12
475,What is the scariest/creepiest theory you know about?,11-27-2020 18:35:05
476,It's 50 days to a new decade! What were your best moments of this decade?,11-12-2019 08:42:43
477,"To the people who have keyboard clicking sounds on their phone, what’s your reasoning for not turning it off?",11-24-2019 07:31:56
478,"If someone borrowed your body for a week, what quirks would you tell them about so they are prepared?",01-01-2019 06:13:42
479,"[Serious] Fans who have been engrossed in a fictional universe so much you could probably earn a degree about it, what plot holes, logical inconsistencies, and the like cannot be reconciled and bother you to no end?",06-07-2020 21:02:15
480,[SERIOUS] What is a seemingly harmless parenting mistake that will majorly fuck up a child later in life?,11-11-2019 18:08:38
481,What is most useless item you carry with you all the time?,10-17-2019 09:08:15
482,What are some cheat codes you've found in the game of life?,11-15-2018 08:47:27
483,"Historians of reddit, what is the biggest 'fuck you' moment in history?",08-04-2019 10:05:19
484,What's classy if you're rich but trashy if you're poor?,05-31-2019 17:41:03
485,What happened today that made you happy?,06-02-2020 13:06:25
486,What is something that has aged well?,03-18-2020 19:10:45
487,"What is your ""I was into X before it was cool"" thing?",08-18-2020 20:25:52
488,"When you sneeze and someone says ""bless you"", you gain the ""blessed"" status buff for the next 20 minutes. What does it do?",12-09-2019 11:27:41
489,What is one fact you know that will make other people respond with “and why the f**k do you know that?”,10-27-2019 10:24:26
490,What very realistic event could happen to make 2020 even worse?,03-19-2020 23:22:52
491,What dire warning from your parents turned out to be bullshit?,02-01-2019 09:05:46
492,What do you genuinely not understand?,04-22-2021 07:04:14
493,Which scene in a film disturbed you the most?,09-15-2020 08:26:39
494,What kind of teenage bullshit probably happened at Hogwarts that wasn’t mentioned in the Harry Potter books?,01-30-2019 10:07:31
495,"Lawyers of Reddit, what was your “oh shit” moment in court?",11-26-2018 09:16:30
496,What is something that you just cannot understand the popularity of?,11-09-2020 08:11:06
497,"How would you feel about a ‘None of the above’ option in elections. If that option wins, the election will be held again with new candidates?",12-21-2019 02:58:40
498,What loophole did you exploit for years before someone found out?,12-05-2020 11:47:29
499,What weird thing would you make socially acceptable if you could?,12-28-2020 15:49:56
500,"Garbage men/woman of the world. What's the best/worst thing you have found ""thrown away"" ??",02-20-2021 09:34:27
501,What is something you did that increased your quality of life so much that you wished you would have done it much sooner because it changed your life forever?,03-20-2019 09:09:53
502,What small thing makes you automatically distrust someone?,01-02-2019 08:08:16
503,"What was your biggest/most regrettable ""It's not a phase, mom. It's my life."" that, in fact, turned out to be just a phase and not your life?",05-04-2021 15:10:36
504,"You're tired from the human race, so you decide to help an advanced alien civilization destroy the Earth, what tips would you give them?",04-19-2020 08:03:50
505,"If you could get $100 per jerk-off for life, or get $1 mil for 1 time, which would you choose and why?",03-10-2020 11:06:56
506,"The first picture of a Black Hole will be revealed next week, what do you think it will look like?",04-03-2019 15:06:29
507,"People who take an hour showering, what do you do?",05-24-2021 12:38:21
508,We create a sentient artificial intelligence and the first thing it does is switch itself off. How does the world react?,03-29-2020 07:50:56
509,What video game caused you the most amount of rage?,10-26-2020 09:43:51
510,"What is an adult life equivalent of calling your teacher ""mom""?",03-10-2019 09:07:34
511,"Rule 34 artists of reddit, what was it like on the first time you started drawing porn?",07-19-2020 09:20:58
512,Females of Reddit - What is the sexiest thing a plus size gamer gentleman has told you that has made you want to immediately have sex with him and be his girlfriend?,04-12-2021 17:25:35
513,What is the dumbest idea you have ever had that actually worked?,11-08-2019 06:49:42
514,"If someone says “I love you” but you’re not ready to say it back, how do you respond?",03-08-2020 14:06:04
515,"People who don't get stressed during a presentation, school or work, what's your secret?",03-23-2021 10:40:29
516,"Blind gay people of Reddit, how did you know you were gay?",05-18-2017 16:54:53
517,What fucked up thing did you do as a kid?,12-23-2019 19:40:40
518,"Deaf people of Reddit, what is the equivalent of having a song stuck in your head?",11-10-2020 22:02:25
519,"How do you feel about a law stating that tickets (speeding, driving under influence etc.) should be a percentage of the perpetrators annual wage, instead of fixed rates?",12-05-2019 17:02:57
520,"Divorce lawyers of Reddit, what is the most insane (evil, funny, dumb) way a spouse has tried to screw the other?",05-01-2020 10:34:38
521,Does life actually get better? How do you come back/get better from being lonely and extremely depressed? How do you create meaningful relationships when you are so screwed up?,11-20-2019 05:13:16
522,What is the most effective psychological “trick” you use?,01-22-2019 22:06:38
523,"How would you feel about a high school class called ""Therapy"" where kids are taught how to set boundaries and deal with their emotions in a healthy manner?",09-10-2019 16:39:46
524,"Medical professionals of Reddit, when did you have to tell a patient ""I've seen it all before"" to comfort them, but really you had never seen something so bad, or of that nature?",01-29-2019 13:29:19
525,What’s the most “I’m turning into my parents” moment for you?,01-13-2019 12:34:01
526,"People of Reddit who knew celebrities before they were famous, how different do they act now?",06-25-2020 01:58:39
527,"What is a movie ending that makes you cry, no matter how many times you've watched it before?",11-07-2020 14:34:54
528,what are the downsides of weed that people don't talk about ?,12-29-2019 12:16:46
529,What item under $50 drastically improved your life?,01-17-2021 12:31:26
530,"Rich people of reddit who married someone significantly poorer, what surprised you about their (previous) way of life?",06-06-2019 09:14:41
531,Ladies of Reddit - what is the most sexiest thing an overweight gamer has done that made you immediately want to have sex with him/be his girlfriend?,01-22-2020 18:37:18
532,What are some stupid mentalities and mindsets that need to end?,01-29-2020 10:01:23
533,What’s a sign that somebody wasn’t raised right?,05-21-2020 19:15:07
534,"People with the last name Pepper who have doctorate degrees, what is your experience introducing yourself to people and do you wish you could change your name?",12-07-2020 22:07:08
535,"What celebrity did bad things but everyone ""forgot"" what they did because they're famous?",10-08-2019 05:46:22
536,"What’s something that is totally normal in movies, but never happens in real life?",07-06-2020 09:36:54
537,What's a really cheap item you can buy that can make you look incredibly rich?,12-14-2018 09:04:47
538,What modern social trend pisses you off the most?,05-06-2021 10:19:46
539,What is the strangest thing you've seen that you cannot explain?,12-13-2020 01:48:38
540,How do you control yourself when you are full of rage and want to keep calm?,02-15-2020 04:56:50
541,"Ladies, just like leggings can very easily attract a guys attention, what is something guys wear that will attract your attention?",02-05-2019 13:29:41
542,What is normal in your country but seems weird to the rest of the world?,10-16-2019 05:28:34
543,"Jesus said “he who lives by the sword dies by the sword” and he was a carpenter who died nailed to a piece of wood. By this logic, how would you die?",04-21-2019 15:34:23
544,What is just a placebo effect but most people don't realize?,08-01-2020 14:03:30
545,"If you were given the chance to start your life over at age 10 right now, but still retain all of your current knowledge and memories, would you? Why or why not?",12-05-2018 00:10:06
546,What movie fucked you straight in your feelings?,10-01-2020 19:14:12
547,What’s a very common thing that you just can't relate to?,12-30-2020 06:54:26
548,The 16 year old version of you just moved in and is now your new roommate. What's the first thing you two would fight about?,06-18-2019 07:19:19
549,"What food can you bring to an office holiday part that says, ""I brought food because the office party is mandatory""?",12-19-2018 11:25:01
550,The internet is scheduled to go down forever. You have a week to prepare and download anything from the web you think is necessary to have for the rest of your life. What do you download and why?,10-23-2020 16:33:08
551,"[Serious] People that do autopsies, whats the weirdest thing that you have found that didn't have anything to do with the person's death?",08-07-2020 00:40:45
552,"If giving guaranteed healthcare to all us citizens required banning certain activities (smoking, super size sodas etc), would you still be in favor? What would you be willing to make illegal?",01-24-2021 23:36:19
553,Mike Bloomberg supporters: why?,02-18-2020 09:23:55
554,"Garbagemen if reddit, what are your pet peeves about all of us? What can we do to make your job better?",08-31-2020 22:59:47
555,"Which dead celebrities are treated like saints, but were truly awful people when they were alive ?",05-23-2021 07:45:45
556,What is an adult problem that nobody prepared you for?,04-11-2021 14:55:21
557,Would you support a remake of snakes on a plane where a bunch of innocent snakes are flying to their holiday destination when they realise a samuel l jackson has snuck aboard and plans to kill them all one by one? Why/why not?,09-15-2019 13:04:26
558,"What famous person has done something incredibly heinous, but has often been overlooked?",10-12-2020 06:43:39
559,"Men of Reddit, How Do You Stop Excess Dripping After Peeing?",09-22-2020 11:13:25
560,What's one of the dumbest things you've ever spent money on?,05-21-2020 21:36:18
561,"[Serious] Parents who have adopted a older child (5 and up), how has it gone for you? Do you regret it or would you recommend other parents considering adoption look into a older child?",04-15-2020 02:42:51
562,"Ex-homeless redditors, what was the scariest thing that you ever saw on the streets? [NSFW]",04-03-2020 05:27:25
563,What is the most inoffensive thing you've seen someone get offended by?,09-11-2020 12:14:42
564,"Redditors who cook, whats the biggest 'no no' thing in cooking?",10-29-2019 07:32:07
565,What did your friend do that accidentally turned you on?,10-19-2020 03:51:35
566,What's the single most important item in your home that has a value of $1 or less?,12-01-2020 08:08:56
567,"Porn photographers, what is the most awkward moment you had? what do you feel when you film? how is your job generally?",10-22-2020 05:59:36
568,What’s your “fake scenario that will never happen but I like to imagine it anyway so that I can fall asleep”?,01-18-2021 17:03:52
569,What's a good movie to watch if you're in the mood to laugh your ass off after a rough work week?,11-14-2020 19:42:54
570,"What is the creepiest thing you’ve seen in the woods, or in the mountains, or in deserts, or caves, or in small towns, or in remote or rural areas or while on large bodies of water, or while on a aircraft or a nautical vessel?",06-16-2019 12:02:44
571,What is an underrated website everyone should know about?,11-04-2018 18:15:37
572,What have you accidentally conditioned your pet to do?,08-09-2020 21:55:15
573,"What is a true fact so baffling, it should be false?",08-05-2019 13:27:06
574,What’s more impressive when it’s done naked?,11-20-2020 12:25:55
575,"Which character death hit you differently, and why?",09-09-2020 14:22:41
576,"Women of Reddit, what do you think would be the worst thing about being a man?",06-13-2019 11:26:01
577,How would you feel if there was a reality show where flat-earthers have to find the edge of the world?,02-19-2021 19:23:06
578,People who can express themselves clearly and make themselves understood whenever you open your mouth: How the hell do you do that?,06-02-2020 02:48:08
579,"What movie is simply magical to you, no matter how popular or unpopular it may be?",04-23-2021 13:39:53
580,"If ""retirement"" in the future means you donate your body and organs at age 40 but will be kept alive artificially in a perfectly simulated environment where you live worry-free, would you do it? Why or why not?",11-27-2019 13:46:31
581,"What song did you fall in love with not because of the original, but because of a cover?",06-12-2020 20:09:50
582,You wake up 2 hours late for work. Would you still go? Why/why not?,01-06-2020 06:53:44
583,Which celebrity got cancelled and you genuinely felt bad for them?,02-13-2021 08:15:46
584,"Depressed people of Reddit, what's your go-to ""I want to wallow in my melancholy"" song?",01-15-2020 15:23:38
585,"Woman of reddit, what is your, ""I am the client not my husband stop ignoring me."" Story?",12-18-2020 11:52:09
586,What sounds like fiction but is actually a real historical event?,06-27-2020 08:15:57
587,What’s an insult that sounds like a compliment?,05-05-2020 16:28:09
588,What's the weirdest sex act you've ever done alone?,12-03-2020 10:00:33
589,"Hey Reddit, When did your “Somethings not right here” gut Feeling ever save you?",12-29-2019 22:07:00
590,You’ve been granted immortality. You’re a minimum wage worker with a useless degree and crippling student debt. What’s your immortal life plan?,10-25-2019 08:14:40
591,Which fictional character's death have you not gotten over?,07-17-2020 05:24:57
592,There's a minimum age for certain political jobs. How would you feel if there was a maximum age limit?,02-18-2021 06:37:52
593,"What are the things every man should at least try even though they are stigmatized as ""gay"" or ""unmanly"" ?",06-19-2020 06:36:41
594,"What is something that makes you say ""Man, I f***ing hate people""?",08-28-2019 06:47:14
595,What evil prank have you pulled off?,02-02-2020 16:41:45
596,"[Serious] Redditors who gave up pursuing their 'dream' to settle for a more secure or comfortable life, how did it turn out and do you regret your decision?",01-03-2021 02:53:54
597,What would happen if Facebook shut down and all its 1.2 billion users moved to Reddit?,10-14-2019 10:53:34
598,"People who honk in traffic jams, what are you trying to achieve?",01-07-2019 06:36:06
599,What brings the worst out in people?,01-22-2021 07:43:22
600,"Kids born to teen mom's, how different is your life compared to other kids?",08-28-2020 16:33:13
601,"What’s something that people who don’t wake up early, miss?",07-08-2020 06:34:32
602,"Someone offers you $100/hr to watch any movie on repeat, which movie do you choose?",11-30-2020 08:49:54
603,"People who work at a subway/sandwich place, what is the strangest order you've ever had from a customer?",09-23-2020 16:12:02
604,"You are transported to year 0, with any object from the present with you. Which item do you choose to make people lose their minds the most?",06-15-2020 22:35:33
605,"Escape Room workers of Reddit, whats the most absurd thing players have done?",06-13-2020 06:59:51
606,What is a question you posted on AskReddit you really wanted to know but wasn't upvoted enough to be answered?,09-10-2019 04:49:41
607,What is the thing that surprised you the most when you traveled to a country you had never been to before?,05-14-2021 01:13:41
608,"Aliens have arrived and set up medical facilities around the world that can cure any disease. However, for each visit you will be anal probed for a day as the cost. How would this impact the medical and Healthcare industry now that doctors and medicine are optional?",07-07-2020 03:50:30
609,"Those who’ve never had to dig through the trash to read cooking instructions on a package before, how’s life going for you?",05-23-2021 17:10:25
610,What conspiracy theory do you believe to be true? What evidence led you to this conclusion?,04-22-2019 19:25:17
611,"Where can you find fair, honest and reasonably unbiased opinions on world news and politics?",08-26-2020 01:31:16
612,"Men of reddit who proposed and she said no, what happened afterwards with your life?",06-07-2020 13:41:21
613,"We are nearly 1/3rd of the way into 2020, how is your New Year’s resolution holding up?",04-17-2020 08:25:41
