,title,created_utc,score,upvote_ratio
552,Saw this woman getting a better view of the eclipse,08-21-2017 14:42:55,105568,0.89
553,100% attendance,05-05-2021 09:49:22,105332,0.89
554,Money shot right there!,09-11-2018 21:10:01,105329,0.86
555,Woke up and discovered my wife moved our coat stand yesterday.,01-16-2021 12:29:30,105312,0.93
556,When Countries Share Their Grandparents’ War Stories,04-04-2021 08:50:13,105307,0.79
557,How long did this interview last?,02-25-2017 08:32:48,105289,0.87
558,Did you want a fight?,04-09-2020 06:48:22,105259,0.92
559,In Venice the pollution has reduced so much that even Louis Vuitton bags are starting to swim again,04-27-2020 14:53:46,105130,0.9
560,Some friends are just assholes.,05-04-2018 10:01:50,105120,0.92
561,Explain this to a kid,09-21-2019 12:33:15,105090,0.92
562,This sign on a vending machine at my work,07-08-2018 10:35:28,105075,0.92
563,[OC] Smart Delivery..,03-03-2021 14:00:20,105079,0.89
564,"And now, a look at the machine that powers Reddit's search function.",04-16-2017 18:54:20,105029,0.9
565,It's this time of year,09-10-2020 17:11:43,105023,0.93
566,Flight attendant joins my family in stacking random stuff on my sleeping brother,05-28-2020 21:30:31,104980,0.9500000000000001
567,Batman and Catwoman model swap,06-24-2019 14:20:59,104935,0.93
568,"Omg, this card!",09-08-2020 07:48:21,104773,0.86
569,I’ve waited my whole life to record a moment like this,09-28-2018 16:17:03,104758,0.9
570,Much better...,10-04-2019 14:55:04,104718,0.93
571,Happy Canada Day!,07-01-2020 02:49:30,104682,0.9
572,"Oh, how the tides have turned...",02-07-2018 04:41:59,104661,0.88
573,"I work at a call center. Sometimes I like to draw what my rude callers might look like. Today I thought I’d show you all a kind caller. Here’s Ruth from today, when told how long she would have to wait for our services:",04-23-2020 17:17:10,104614,0.93
574,Looks at my server room and nods,04-26-2021 20:35:41,104605,0.93
575,Asked wife how the visit to the vet was going....,08-17-2018 16:14:50,104578,0.93
576,Something about pumped up kicks?,08-09-2017 11:54:22,104564,0.87
577,Just a weird fish,08-23-2020 16:47:16,104509,0.96
578,Mistakes Were Made,08-15-2020 15:14:30,104496,0.92
579,Mr. Grumpy,03-20-2020 16:47:10,104476,0.9500000000000001
580,Gus doesn’t deserve this 😔,10-11-2018 11:17:10,104449,0.92
581,Stupid covid,06-20-2020 20:21:46,104443,0.92
582,What?,08-12-2020 09:15:51,104418,0.9400000000000001
583,But i like what i have okay?,05-04-2021 09:33:39,104390,0.85
584,My dog realized she can stand in the pool,08-13-2017 10:42:01,104354,0.88
585,I AM GROOT,10-30-2020 09:48:30,104289,0.9
586,"Lol, kids.",06-30-2018 20:44:33,104272,0.85
587,MOVIE VILLAINS,08-07-2019 12:27:08,104168,0.91
588,Passed by a math book example today.,08-24-2020 18:29:02,104126,0.9400000000000001
589,The Getty is challenging quarantined people to recreate their favorite paintings with household items.,04-01-2020 21:35:54,104042,0.93
590,"My friends do a Tencious D cover band, look who crashed their show.",10-20-2019 21:02:02,103978,0.9400000000000001
591,You sick people asked me to turn Chop Suey into a bluegrass song.,03-16-2021 10:01:09,103898,0.86
592,"Flew in a helicopter for the first time at work, the pilot’s helmet wasn’t calming",07-20-2020 14:13:22,103816,0.96
593,"""Shirtception"" - my favorite gift every year from my brother. We're now at level 4.",12-26-2017 16:27:07,103775,0.86
594,We don't have the budget,03-09-2021 12:49:43,103738,0.89
595,Fan wears a Ryan Reynolds shirt to meet Hugh Jackman.,08-21-2019 18:30:51,103741,0.91
596,Fist time ever posting but I felt I finally had something worthwhile. At my friend's birthday party last night,07-12-2020 04:48:38,103702,0.89
597,real monsters,12-24-2019 17:26:49,103638,0.93
598,"Oh darn, just missed it",07-29-2019 18:56:31,103564,0.92
599,"Tried to take a panorama from our hike today, it really did my boyfriend dirty...",06-24-2020 18:54:43,103564,0.93
600,Marilyn Manson looks like Nicholas Cage dressed up as Marilyn Manson.,10-19-2018 14:11:15,103500,0.89
601,best student sign i've ever seen,03-11-2017 17:00:59,103470,0.92
602,the smell of a grill,06-21-2017 11:05:01,103464,0.88
603,My college doesn't want us to make popcorn in their shitty microwaves,02-19-2018 18:55:35,103303,0.86
604,The truth about dad jokes,12-07-2018 07:25:45,103264,0.86
605,return,09-12-2018 17:37:49,103201,0.93
606,I saw the Google Earth cursor moving over Sweden yesterday.,12-11-2019 10:06:44,103176,0.93
607,I felt like maybe my cartoon could use a little something extra this year. Happy Halloween!,10-12-2020 07:28:29,103150,0.87
608,Who needs a fishing pole anyway.,07-17-2018 13:27:03,103141,0.92
609,"As a mailman, I usually don’t know what’s in the package. But I’m pretty sure this is a tennis racket.",08-14-2020 20:29:47,103113,0.85
610,"I get a Snapchat from my brother and then a text from my dad saying, “post that to the Internet”.",06-14-2018 21:01:17,103064,0.8300000000000001
611,"It happened. I'm a fucking Disney Princess, Reddit.",05-23-2017 16:02:15,102891,0.85
612,when it rains.,09-30-2018 13:19:29,102878,0.91
613,The claw!!!,05-02-2017 21:27:14,102854,0.89
614,Offering pizza to London marathon runners,04-24-2017 08:49:22,102766,0.87
615,Guys will understand,08-06-2017 12:17:24,102721,0.8
616,Sunday night,06-11-2017 19:58:39,102719,0.87
617,"I said, ""How tall are you?"" He handed me this:",02-20-2017 23:19:09,102539,0.84
618,I drew the ONLY joke my Mom knew,04-24-2019 12:07:57,102476,0.9
619,My kitten Charlie loves the laundry hamper. He’ll meow and whine until you put upside down so he can become a kitty roomba.,11-24-2020 19:20:35,102437,0.9400000000000001
620,"In Minnesota, we like to play a game called ""am I on the road?""",01-18-2020 21:09:02,102431,0.9400000000000001
621,Clouds have feelings too,06-11-2018 06:40:40,102427,0.91
622,the endless cycle,11-30-2020 13:37:45,102390,0.93
623,i can do this,03-24-2020 09:44:59,102357,0.92
624,Seemed like a 5 star man,03-23-2019 13:44:36,102167,0.91
625,Reminder to always let Aubrey Plaza accept an award for you,10-12-2018 19:45:14,102135,0.89
626,"After years of this guy using my email as a spam account, I got my revenge. He signed my email. Up for SiriusXM which also gives me the ability to beep his horn.",08-28-2018 23:18:28,102063,0.92
627,"""Don't get too comfy!""",02-18-2021 14:10:23,102023,0.92
628,My boss knows what's up,12-23-2018 12:27:16,102032,0.93
629,Throne room.,02-27-2021 20:43:08,101990,0.9
630,"Listen here, you big monsta",01-18-2021 11:14:41,101997,0.9
631,Proof that Disney is running out of ideas,01-03-2019 14:22:43,101997,0.86
632,Relief [OC],05-13-2021 11:18:02,101971,0.93
633,My cousin is a driver for UPS and posted this today,12-22-2017 19:28:08,101942,0.91
634,Must be Canadian.,06-04-2019 15:52:37,101902,0.92
635,Posted on Fresno buy/trade on FB. Guy knows how to market,09-02-2020 00:48:37,101903,0.9500000000000001
636,Couldn’t do this again if I tried,02-25-2021 13:17:50,101876,0.86
637,My sister accidentally caught this Pikes Peak proposal on camera,08-03-2019 08:34:21,101870,0.9500000000000001
638,All terrain vehicle,10-11-2017 08:17:57,101809,0.9
639,My daughter has been picking her own clothes and watching her big brother get on the bus.,08-25-2017 21:08:51,101788,0.86
640,How to win a prank war. My friend snuck a heinous portrait of me into a charity auction that I was attending. Sold for $200.,02-25-2018 21:17:20,101777,0.91
641,A dad having fun cutting and eating a snowcake,10-05-2019 07:31:47,101764,0.9
642,exercising,09-06-2020 22:29:40,101763,0.92
643,I design unnecessary products so today I built a ceiling fan for my car.,07-28-2020 15:10:18,101692,0.86
644,V12 lambo sound vs electric i8 sound.,06-02-2020 14:01:43,101669,0.93
645,Little girl has her Christmas priorities straight,12-02-2017 16:29:29,101667,0.91
646,"I design ridiculous product ideas for fun, so I designed a pair of jeans with one giant pocket across the butt for all your essentials.",01-19-2020 19:49:11,101666,0.91
647,Cultural appreciation in Pixar films,02-27-2021 16:42:07,101611,0.73
648,OkCupid putting it's foot down.,06-08-2017 14:35:34,101593,0.81
649,he saw the opportunity and he took it.,02-28-2018 16:12:19,101553,0.84
650,"Meanwhile,back in 1999",10-22-2020 11:02:40,101519,0.91
651,"Up, up and a-way out there",07-22-2020 08:00:35,101492,0.88
652,Let Me Out!!! It’s only Drizzling!!!,05-29-2020 21:02:55,101415,0.9400000000000001
653,The Avengers 1978 has aged really well,09-24-2019 17:10:17,101399,0.9500000000000001
654,Mermaid Bra [OC],05-08-2021 14:21:44,101355,0.86
655,World Cup,06-27-2018 15:34:38,101353,0.84
656,True story,11-14-2018 09:57:20,101329,0.92
657,The code works,03-27-2018 18:38:15,101313,0.89
658,Our niece wasn't thrilled about the first kiss.,05-16-2021 21:09:03,101133,0.89
659,"NO such thing as bad publicity. Wally’s Pub here on the NH seacoast, brilliantly seeing to it.",11-27-2020 08:57:16,101070,0.87
660,My girlfriend was true to her word!,11-21-2017 13:50:37,101060,0.8200000000000001
661,My 39-week pregnant wife went to the store to “get stuff for dinner”. This is what she came home with,06-26-2020 16:03:55,101048,0.84
662,Easy Solution,11-02-2020 15:28:52,101023,0.9
663,My 11yo and I play games in the front yard nowadays. Every day he does something different to spice it up. This was today's choice.,04-10-2020 01:02:54,100974,0.91
664,German Finding Out About “Sales Tax”,04-30-2021 15:47:30,100916,0.81
665,My sisters boyfriend accidentally let the cat out briefly. Cue scooby doo hallway chase.,12-15-2020 00:25:54,100880,0.93
666,Chores are hard!,11-10-2016 14:39:12,100864,0.9400000000000001
667,The Price of Lumber is Too Darn High,03-19-2021 19:38:35,100857,0.89
668,His spidey sense was tingling,10-29-2019 03:47:50,100848,0.86
669,every single time,10-28-2019 07:34:02,100838,0.9
670,"so after I bought this house I was informed my neighbors do it big for Christmas. I spent alot of money already buying a new tree and all the decorations for the inside, so I talked to my neighbor and we came up with the perfect solution. I promise I'm not really a grinch!!",12-01-2020 16:23:23,100811,0.93
671,Old dog: YEET!,08-27-2019 22:16:39,100705,0.91
672,Doggy day at work after the floors were waxed,07-23-2017 15:21:14,100693,0.92
673,Days worth of dirty diapers for whoever keeps stealing packages off our porch,04-16-2020 11:02:01,100664,0.93
674,"No, wait, watch how awesome I am too.",02-20-2018 00:03:06,100661,0.91
675,I just can't with Noodle's face,09-06-2020 16:56:42,100632,0.9
676,Overspending...,01-12-2017 15:26:20,100623,0.93
677,I took a picture of the moment my two kids realised all the donuts at the party had been eaten while they were off playing on the swings,08-04-2019 23:28:30,100613,0.9400000000000001
678,This man is way ahead of our time,04-22-2019 13:16:28,100584,0.9500000000000001
679,This place charged me $2.25 just out of spite.,04-07-2020 11:33:51,100571,0.89
680,Water style,08-20-2019 03:33:12,100565,0.89
681,Please stop flipping me off...,11-04-2018 11:05:38,100515,0.91
682,Too soon?,10-15-2017 08:28:46,100482,0.86
683,IKEA is now selling Christmas trees. Gonna be a looooooong night,12-04-2020 17:00:47,100426,0.85
684,I made myself a sticker,04-16-2020 15:18:59,100421,0.92
685,dog on the house camera being a total drama queen,07-18-2019 13:59:08,100420,0.9500000000000001
686,"Someone installed these plaques on a bunch of benches, they got taken down by the city today but I think they're priceless.",10-08-2020 17:08:41,100408,0.9400000000000001
687,This amazing cosplay.,11-24-2019 08:54:50,100375,0.9400000000000001
688,he’s trying to convince him to play,04-03-2020 10:39:20,100360,0.9400000000000001
689,This gag is now a century old,03-18-2018 01:14:33,100357,0.9
690,"Work smarter, not harder",06-04-2019 09:06:46,100291,0.9500000000000001
691,My cat has killed all my fantasies of having a cat,08-31-2019 10:28:23,100275,0.9400000000000001
692,"You ""Car needs a service"" Mechanic ""Sure, leave it with us""",06-06-2020 10:00:49,100213,0.93
693,"""Here’s a video of my cat trying to get my dog’s tail through a glass door. it will brighten your day""",08-14-2018 12:22:01,100199,0.91
694,Your App is Amazing!,08-05-2019 14:03:57,100184,0.9400000000000001
695,My wife took the toddler and left me with the baby yesterday morning. She’s a worrywart and I love photoshop. Lesson learned; don’t reply with just a photoshopped picture when she asks how things are going with the baby,08-05-2018 19:33:22,100153,0.9
696,Morale is high this week..,10-18-2017 19:00:45,100142,0.89
697,"I asked my girlfriend, who lives in Europe, to fill in a map of the USA. These are the results",11-05-2020 10:12:02,100061,0.72
698,My brother gave me a framed photo of my most upvoted comment of all time for Secret Santa this year.,12-25-2017 14:13:54,100016,0.87
699,Probably the best skateboard trick I've ever seen,05-18-2017 12:59:22,100012,0.85
700,Me flying my quadline kite and getting blown away while my friends are no help..,05-26-2018 21:05:21,100001,0.9
701,Mom trying to convince daughter that Raptor is not scary,11-26-2018 13:30:40,99995,0.89
702,There goes my night,06-09-2020 14:42:01,99919,0.9
703,"364 days a year, I am an amputee. But today, I am Groot.",10-31-2020 09:25:51,99857,0.87
704,Maybe 2020 will be my year?,09-15-2019 12:17:05,99862,0.89
705,Remodeling my Grandfather's basement and found this... he's still yelling at us from the grave.,02-24-2018 16:54:54,99835,0.92
706,Debt cycle,03-18-2019 13:01:09,99823,0.93
707,Store App,04-09-2021 12:22:41,99792,0.8300000000000001
708,These employees at NASA totally look like they're about to drop the most fire mixtape in the galaxy,07-02-2018 14:16:44,99790,0.89
709,Why I use chopsticks,07-09-2019 14:16:16,99716,0.89
710,welcome to hell,07-02-2019 12:34:34,99685,0.91
711,The Flag of France according to the French Air Force,04-06-2021 07:55:34,99675,0.9
712,✨wish✨,06-12-2017 11:39:53,99671,0.87
713,My son picked out his own back to school shirt.,07-28-2017 16:01:33,99658,0.84
714,Incredible Black Friday madness,11-24-2017 07:01:52,99609,0.9
715,300 kmph in a small german town (with sound),01-22-2018 16:40:09,99548,0.84
716,At least they're honest,09-24-2020 10:32:24,99512,0.9
717,Google Earth is Amazing,02-09-2020 00:00:39,99472,0.85
718,7 billion people in this world and I’m so glad he was chosen as the face of our company!,07-17-2020 10:00:16,99410,0.9400000000000001
719,Nick Offerman on being manly,09-09-2018 09:08:17,99402,0.88
720,The Dad Tax,02-18-2018 22:51:36,99359,0.85
721,Hits too close to home,01-22-2019 17:55:23,99313,0.86
722,Dad... is that you??,11-18-2017 15:36:07,99284,0.87
723,Whelp.,01-23-2019 12:43:08,99280,0.87
724,"Years ago, my uncle was a wedding videographer. He got 2nd place on an episode of AFV with this video.",03-26-2017 13:17:12,99281,0.91
725,How much for a rose?,02-14-2021 05:01:32,99254,0.9
726,"Happy New Year, children!",12-31-2017 21:13:54,99246,0.87
727,I told my sister if she graduated with honors I would wear a matching dress to her graduation. She said the thought of seeing me in a dress was her motivation when she wanted to quit. Worth it to me.,05-13-2021 21:54:51,99221,0.8300000000000001
728,pain,03-11-2019 09:54:10,99211,0.87
729,Utah ski resort gets a 1 Star review from a guy in Los Angeles because the mountain was too difficult. They used the one star review to advertise what the mountain is best known for.,09-19-2017 22:40:00,99176,0.93
730,Hmmmmmmm,02-02-2019 16:17:25,99135,0.88
731,Co-worker sent me this... We work at NASA.,03-01-2020 20:25:35,99137,0.87
732,They kinda have a point.,08-25-2020 22:12:37,99097,0.96
733,"For Christmas, my dad received the exact outfit that he was wearing",12-25-2020 17:16:28,99032,0.92
734,Birth of a Veterinarian,12-12-2016 11:30:15,99015,0.91
735,There’s a gap in the cabinets because of an angled sink. Countertops get installed on Monday,03-06-2021 11:05:02,98998,0.9
736,"A customer called asking if we were practicing social distancing with her sandwiches. I told her we are, but tbh guys I'm running out of space.",05-12-2020 10:04:20,98975,0.89
737,This real Ron Swanson,09-16-2017 09:23:25,98946,0.91
738,"In 1984 a German correspondent in Paris explains how to cross Place de la Concorde. ""Walk in a steady pace and never look at the drivers, then they'll think you need to stop for them.""",06-29-2020 05:31:26,98937,0.9500000000000001
739,You can tell the age of a tree from its rings,11-16-2020 19:24:17,98940,0.91
740,Hands-free telephone set ad in 1993,10-21-2018 14:19:05,98919,0.93
741,I commemorated my trip to a ranch in Canada with a dancing montage instead of a photo album,08-02-2019 10:05:09,98914,0.84
742,photos I take of my boyfriend vs photos he takes of me,07-11-2019 21:51:06,98863,0.91
743,What I see on the news while boarding my flight today...,02-21-2021 12:08:48,98852,0.9
744,"We went to the beach to find shark teeth, so when my daughter yelled ""I found teeth!"" this was the last thing I was expecting",09-06-2019 12:56:24,98835,0.92
745,Kids getting beaten at their own game.,04-16-2020 16:48:24,98819,0.9500000000000001
746,Friend found this in her neighborhood,10-25-2018 18:07:09,98790,0.87
747,Dad bought mom a new mask,06-15-2020 22:22:20,98779,0.92
748,Customer Communication,01-28-2021 10:19:43,98696,0.81
749,[OC] Coming out,07-06-2020 15:26:20,98698,0.84
750,These sale prices. Wait till the end.,05-06-2018 12:19:39,98668,0.89
751,"Paul Rudd, Certified Young Person tells you to wear a mask",09-14-2020 17:37:32,98648,0.89
752,Someone needs to find a new pooping spot.,07-22-2018 21:20:54,98624,0.91
753,A house in my hometown is making good use of their quarantine time,03-30-2020 14:39:39,98611,0.9
754,Always give 100%,09-19-2020 06:45:00,98534,0.9
755,Imagine losing because of your penis,12-11-2017 14:23:39,98522,0.9
756,Fuck it,12-04-2017 15:28:12,98492,0.91
757,"""You seeing this shit?""",11-07-2017 14:58:19,98434,0.9
758,"I’ve never been in snow because I live in Texas, I’ve waited 15 years to do this",01-10-2021 15:51:56,98432,0.74
759,Guy at coffee shop shows off his solution to the $999 Apple stand.,06-11-2019 20:04:29,98372,0.93
760,The Kraken,08-18-2020 10:12:52,98371,0.93
761,Bet you never thought those 2 peg battleships were real huh?,07-11-2019 11:44:31,98362,0.93
762,Pinky and the Brain,12-20-2019 12:36:33,98337,0.92
763,The 5 stages of software development.,10-02-2019 14:38:46,98284,0.92
764,An employee of mine said I needed to check the security footage for a guy humping our coolers. This is the video that keeps on giving.,10-03-2018 15:48:32,98261,0.92
765,strange planet,02-17-2019 03:49:20,98226,0.92
766,"For fun I build out fake product idea, so I built the Pandemic Prevention Utility Belt based on the CDC guidelines.",03-12-2020 14:03:01,98170,0.89
767,Welcome to Calculus 101,01-28-2020 12:25:33,98139,0.89
768,Underappreciated art,06-27-2019 16:47:57,98124,0.89
769,Advanced slav squat,12-06-2019 05:03:31,98121,0.93
770,Literally being held by a thread.,09-06-2020 07:05:43,98123,0.9400000000000001
771,My wife really likes it when I do house work so I sent her these pictures while she was at work hoping it would turn her on.,01-27-2018 13:31:00,98076,0.78
772,Damn Wish!,06-13-2017 08:07:41,97979,0.92
773,Poor pup is in over his head at his new job,06-27-2017 15:39:35,97953,0.91
774,This pigeon jamming along to blurred lines,01-17-2019 06:56:22,97923,0.92
775,"Attaboy, Larry",04-19-2017 15:20:55,97905,0.86
776,"“Child"" was all over the news after being spotted smoking at a football match......he's actually a 36yr old Turkish man.",09-11-2019 21:23:37,97887,0.9400000000000001
777,Jumping people dressed as Scooby doo characters,05-20-2020 11:47:59,97833,0.88
778,Spotted in the wild at University of Utah,10-31-2019 13:30:42,97824,0.93
779,Glass bottle recycling truck in my home town,01-11-2021 07:18:40,97812,0.9400000000000001
780,This hurts on a personal level,07-04-2020 01:03:54,97792,0.91
781,Would buy. 10/10,05-09-2018 22:46:40,97775,0.78
782,Using the dinosaur filter while celebrating birthday didn't go well,05-31-2018 01:46:07,97760,0.89
783,Best cops ever,08-08-2019 18:36:02,97741,0.86
784,Flight of the penguin.,06-27-2019 10:14:29,97741,0.93
785,The Power of Friendship,03-04-2021 05:11:36,97668,0.93
786,Can't argue with that..,06-05-2019 07:33:32,97667,0.9
787,my favorite photo I've ever taken is of a kid tripping into $100k car,11-03-2020 22:39:18,97671,0.92
788,Happy birthday to you!,08-05-2017 14:21:25,97662,0.85
789,Enhance!,12-05-2018 19:22:20,97532,0.88
790,How to stop a kangaroo fight,01-07-2018 14:51:59,97481,0.9
791,Different societies prioritize different things. The tea aisle in a London supermarket.,03-19-2020 19:10:23,97472,0.9500000000000001
792,Can't place the building here,05-10-2017 10:39:41,97415,0.88
793,So .... I pull up in my cool BMW ...,03-20-2019 11:16:21,97368,0.92
794,"Moon footage, sped up",03-31-2019 15:21:30,97352,0.9500000000000001
795,Good Morning everyone!,04-06-2021 14:53:20,97321,0.85
796,My friend’s boyfriend was not happy about his kindergarten picture. His parents still have it framed in their house 20 years later.,12-14-2017 00:22:30,97301,0.92
797,This dog deserves an Oscar Award 😂,08-30-2019 13:28:38,97295,0.9400000000000001
798,My daughter asked me if I could Photoshop and old pic of her to make it look better,05-23-2019 12:43:19,97285,0.91
799,Surprise bops,12-18-2018 13:10:15,97273,0.93
800,"I’m a 911 Dispatcher, and it is public safety telecommunicator week. HR got us giant “911” shaped donuts. We were all a little concerned when we opened the first box.",04-15-2021 12:36:34,97277,0.93
801,Destroying the planet one step at a time,09-21-2019 10:18:07,97260,0.92
802,I got a call in my hotel room saying “your robot is here with your delivery” 😳😂,07-14-2020 16:25:17,97258,0.88
803,The Internet was made for this.,10-20-2017 17:03:26,97259,0.8200000000000001
804,Las Vegas...,06-28-2018 17:31:59,97184,0.9
805,I extrapolated the rest of 2020 with video game titles,03-28-2020 13:51:06,97189,0.92
806,Did not do the math,01-23-2020 15:10:54,97125,0.9500000000000001
807,"Oh, the sidewalk is shoveled?",11-29-2019 17:25:25,97108,0.93
808,“I only had one margarita”,08-07-2020 11:04:07,97082,0.93
809,On the bottom of my coffee bag,03-05-2021 09:22:36,97080,0.91
810,How to be a farmer,07-19-2020 13:42:32,97027,0.77
811,the strongest guy,07-30-2019 15:17:56,96995,0.91
812,This truck has a jellyfish launcher,01-31-2021 19:13:34,96994,0.85
813,Who's more zen?,01-30-2021 12:17:05,96992,0.93
814,Flat-Earther accidentally proves the earth is round in his own experiment,08-13-2019 16:15:46,96975,0.9400000000000001
815,You too,05-05-2021 20:04:55,96906,0.9
816,I am C-3PO,04-11-2020 10:09:11,96909,0.84
817,I wrapped my brother's present in cement...,12-22-2018 21:21:44,96894,0.88
818,Living in an apartment,01-27-2020 13:50:18,96861,0.89
819,Florida man,12-31-2018 17:55:22,96845,0.9
820,Ice-skating + HD cameras =,02-13-2018 15:33:38,96833,0.9
821,My coworker is a flat earther and it's his last day,12-03-2018 15:12:03,96733,0.87
822,This is actually a proven method,06-18-2017 09:45:15,96699,0.91
823,My local ice cream shop sharing TRUTH.,10-24-2020 14:33:53,96697,0.9
824,The robot uprising will be goofier than we expected,10-12-2017 17:08:14,96647,0.88
825,Power of makeup :),02-09-2020 09:30:20,96644,0.9
826,I design unnecessary things so I created the Password Keyboard for only typing out your passwords.,05-04-2021 15:39:00,96638,0.84
827,Recently had brain surgery. Sent this to my cousin and he said it belongs here.,09-23-2020 15:40:53,96609,0.87
828,The cruelest prank.,05-24-2020 20:53:43,96580,0.81
829,"My sister got married over the weekend, so we recreated this gem from our childhood.",09-22-2020 12:04:45,96470,0.86
830,"Himb goomba. (He is here to bring joy, please skip this post if you want to say anything negative about his appearance)",06-05-2020 17:55:27,96463,0.84
831,The end of my workdays in 2020,09-23-2020 22:05:15,96448,0.92
832,If Only We All Had This Power!,01-17-2019 15:34:26,96413,0.86
833,"All right Rowling, we get it.",03-21-2019 17:02:59,96385,0.91
834,A book review from Snoop,07-19-2017 09:34:43,96376,0.89
835,"Football players found out their coach used to dance for M.C. Hammer, made him do the dance at practice.",08-21-2017 08:39:41,96261,0.91
836,"A buddy was tired of seeing Americans with Chinese tattoos, so he showed her what it looks to a Chinese person.",03-05-2019 08:21:49,96259,0.85
837,Pigeon Standing On Water Fountain Waiting For Human to Help,01-28-2019 21:38:59,96252,0.91
838,Creating Supplement,12-16-2019 06:40:43,96224,0.91
839,"I design ridiculous product ideas, so I created a coffee table that is also a jigsaw puzzle.",05-15-2020 13:33:20,96206,0.86
840,Sarah Michelle Gellar just posted this on her Instagram. Thought it was pretty funny.,05-14-2020 12:45:48,96193,0.92
841,How to „Slacker Indie“ in 60 seconds,05-24-2021 08:57:44,96188,0.91
842,It says more than a thousand words,12-02-2018 11:34:26,96113,0.87
843,For anyone who missed josh fight,04-24-2021 14:00:55,96099,0.85
844,"In Spanish-speaking countries, the tooth fairy is a mouse (Ratoncito Pérez). This is my dentist office.",06-28-2018 08:06:52,96075,0.9400000000000001
845,College math courses in a nutshell.,03-04-2018 08:34:44,96074,0.85
846,My daughter’s one year old picture didn’t go quite as planned...,07-04-2019 22:20:08,96016,0.9500000000000001
847,Making a deposit,01-11-2018 11:26:06,96005,0.91
848,My lucky day.. some guy was selling PS5's outside the grocery store for $50,11-13-2020 17:27:40,95989,0.85
849,House Rules.,12-10-2017 15:42:02,95858,0.86
850,Told my nine year old I’d give her $100 if she copied exactly everything I did.,04-19-2020 18:03:44,95845,0.87
