,title,created_utc,score,upvote_ratio
265,Every year I try to disguise my sister's Christmas present. This year I think I went a little too far...,12-03-2018 09:54:08,123041,0.9400000000000001
266,Service with a smile from UPS,11-08-2018 13:19:37,123009,0.9400000000000001
267,General Kenobi,03-06-2020 04:46:09,122923,0.91
268,[OC] Jellyfish sting,10-28-2020 16:09:35,122874,0.87
269,My dad and I recreated a tender moment 34 years later,02-02-2019 21:28:43,122836,0.8300000000000001
270,"Took this picture of my dog the other day and someone said ""Looks like a Vogue cover"" and then this happened",12-20-2018 14:05:06,122718,0.92
271,This lady is out getting supplies.,03-21-2020 11:02:47,122551,0.89
272,"My daughter drew this in kindergarten. Title: ""Moms chatting after school""",07-14-2020 11:29:02,122432,0.92
273,This is my last resort,01-24-2018 21:06:43,122421,0.88
274,"My kid did this portrait of me over 10 years ago. I still look the same, IMO.",02-23-2020 19:23:35,122414,0.89
275,Lord of the Rings in 2017,05-26-2017 06:50:59,122409,0.89
276,My neighbor is 3 kids in a trench coat,11-13-2019 12:10:44,122339,0.9500000000000001
277,"""How do you like it?""",10-20-2017 10:43:50,122193,0.93
278,Bro support his Homies,11-06-2018 09:00:47,122168,0.91
279,A year ago I started sending my GF these photos whenever she asked if the baby was ok,11-16-2020 13:36:52,122010,0.89
280,What if we use 100% of our brain?,08-05-2020 22:23:00,121667,0.89
281,Hi 5,10-21-2020 19:40:56,121616,0.93
282,My states Police department made an April fools video.,03-31-2021 19:37:52,121435,0.8300000000000001
283,Kazakhstani language is the sound of a diesel engine trying to start up in -40 degrees,01-20-2019 17:14:36,121361,0.86
284,Ready for first pandemic Halloween,09-08-2020 11:15:11,121218,0.9400000000000001
285,Our Nest came through in a big way when we couldn’t be home for Halloween,11-01-2019 08:34:09,121176,0.91
286,Super gluing a pickle jar lid and asking buff guys to open it,10-14-2020 12:31:22,121145,0.86
287,My cat powers up his attacks.,10-16-2017 20:44:00,121054,0.91
288,That’s how anxiety works,01-19-2019 21:27:30,121047,0.87
289,Prankmaster Grandma,04-04-2017 05:03:18,120915,0.92
290,Brakes broke,02-11-2021 07:03:11,120870,0.9500000000000001
291,Damn right!,09-25-2018 20:59:14,120818,0.87
292,"Tom Brady looks like a single, divorced mother that just won full custody of her kids and is leaving the courtroom.",02-04-2018 17:45:23,120790,0.87
293,Reddit admins have entered the chat,09-01-2020 14:40:42,120725,0.91
294,Not all heroes wear capes.,11-24-2017 14:01:18,120418,0.88
295,My 4 year old niece can't read and bought me this birthday card because it featured 'a cute dog with a party hat',07-22-2019 17:10:20,120367,0.93
296,My dad sent me a picture this morning and said “it finally happened”,01-12-2021 14:02:40,120320,0.9400000000000001
297,Grower hides from SWAT in warehouse closet,11-13-2017 22:23:08,120234,0.86
298,"Just bought a standing desk. I'm 6'4"". GF is....not",04-18-2020 16:47:20,120193,0.88
299,It's the little things in life,02-10-2019 09:18:09,119980,0.8300000000000001
300,This is my favorite mug. I got it at a thrift store and have no idea who these people are,10-10-2018 14:57:21,119956,0.91
301,"Oh China, never change",03-14-2019 05:46:36,119877,0.91
302,This could be a good movie,11-19-2018 06:03:34,119874,0.9400000000000001
303,New Printer,10-20-2020 14:04:39,119855,0.91
304,The One.,01-08-2018 09:53:35,119743,0.9
305,I've never seen such a quick transition from Intrigue to Disgust,01-19-2020 11:28:20,119576,0.9400000000000001
306,Dick move Alladdin,11-23-2020 11:13:29,119485,0.91
307,Sean Connery,09-18-2020 11:41:31,119460,0.9400000000000001
308,This one picture has so much raw emotion,08-12-2020 18:14:00,119412,0.91
309,I put googly eyes on my VR glasses and let my grandparents try them out,09-30-2020 15:40:55,119382,0.93
310,Finished.,12-28-2019 02:55:27,119345,0.93
311,"The fourth largest city of Sweden, Uppsala, is currently flooded. The Swedes aren’t that concerned",07-29-2018 13:10:42,119277,0.93
312,"They pay me to build pipes, not to move rocks.",05-21-2020 13:03:37,119229,0.9400000000000001
313,Feel the burn,05-15-2020 07:23:05,119205,0.91
314,My astrophysicists daughter gave me a birthday card,02-27-2020 09:44:35,119130,0.92
315,At my local grocery store...,03-14-2020 06:57:13,119084,0.92
316,Retail Weekend,01-25-2021 14:44:57,119052,0.8200000000000001
317,Ben notices how tight his pants are tonight on Family Feud,09-24-2020 20:39:41,119026,0.9400000000000001
318,All of my coworkers agreed to dress up as smurfs for Halloween. Im the only one to go through with it.,10-29-2020 18:31:08,119024,0.92
319,Sick days,03-01-2021 07:28:13,119007,0.9
320,He sent it back to the chef,09-20-2019 17:33:52,118957,0.96
321,1 1/2 years later... “Our product doesn’t last that long!” O_O,04-02-2018 09:04:29,118876,0.93
322,A beard makes a big difference.,02-14-2019 07:37:07,118813,0.81
323,"Fiance and I just got the vaccine, haven't noticed any side effects yet",03-02-2021 15:30:10,118678,0.74
324,My parents haven't noticed.,12-21-2017 13:37:42,118623,0.89
325,Welcome to Cameron’s car,04-29-2021 19:19:29,118531,0.91
326,A brewery near me decided to name their newest beer after a recent email they received,03-14-2021 11:24:09,118444,0.91
327,Perfect fit [OC],08-30-2020 11:57:17,118367,0.89
328,My wife and I announced today!,10-23-2020 12:49:03,118271,0.8
329,Spent 10 minutes snapping pics of my wife so she could have 'the perfect sexy Instagram photo.' When she was finally happy I asked her to return the favour. We got this beauty in one take.,09-15-2019 08:29:14,118249,0.89
330,I cancelled a call mid-presentation bc my 9yo told me water was running all over her bathroom floor…,05-25-2021 11:07:47,118230,0.76
331,Where did all my money go??,07-29-2019 10:02:55,118209,0.89
332,"4 days without a cigarette and a co-worker told me to ""come back in a year"" before I'm proud about it. Mark your calendars, Ladies and Gents.",09-14-2017 13:24:30,118110,0.87
333,The calm before the storm.......,12-31-2017 10:22:57,118077,0.84
334,My friend has been practicing restoring and colorizing old photos.,03-22-2019 10:08:46,117970,0.93
335,Saw this today lol,01-28-2021 21:03:29,117731,0.86
336,If there's a single line of footprints in the snow I like to walk on the opposite step to make it look like one person was hopping,01-24-2020 08:22:27,117707,0.92
337,Tom Hanks crashing couples wedding photo shoot.,01-14-2018 09:47:28,117657,0.87
338,"Went to Colorado to visit some family, discovered a happy ass tree among the Garden of the Gods.",01-04-2019 21:11:42,117606,0.91
339,Kid gives Megatron Optimus Prime's Head on a Stick,07-06-2017 13:18:55,117611,0.88
340,jogging,10-18-2017 11:09:16,117589,0.93
341,Gym guy teaching blind woman how to deadlift,03-15-2018 11:53:31,117546,0.92
342,Throwback to when my mom forgot to submit my senior baby ad for the yearbook and asked my dad to do it,07-31-2020 22:18:09,117288,0.9500000000000001
343,Not exactly how I envisioned my Shrek themed birthday cake...,08-28-2020 16:55:20,117223,0.93
344,My friend’s birthday gift to her husband: a fantastic painting of their Derperman Pinscher,07-19-2019 10:08:16,117093,0.9400000000000001
345,PSA to all memers out there.,05-09-2018 08:31:58,117098,0.9
346,First thought that popped into my head when I saw this,06-20-2018 16:04:07,117026,0.89
347,I've waited my entire life to see someone actually try this,01-20-2018 05:42:39,116971,0.86
348,I build unnecessary items so I made The Modular Water Bottle System for customizable thirst levels.,03-18-2021 14:48:31,116977,0.84
349,Our friend got fired today,03-28-2019 18:54:10,116954,0.92
350,Now that’s how you open a beer!,01-17-2019 12:20:08,116923,0.86
351,Fever [OC],01-30-2021 09:56:14,116844,0.93
352,"When mankind unites, great things can be achieved",05-30-2017 08:17:17,116720,0.93
353,I lost it when he tried to lie down,03-12-2021 09:20:38,116691,0.9
354,"I saw the apron while shopping, and decided to do a remake of my mother’s favorite picture for Christmas. 23 years apart.",12-27-2020 22:35:34,116668,0.91
355,We were really excited to use a lime from our lime tree for the first time,08-23-2020 23:16:40,116546,0.9500000000000001
356,Our family has a 35+ year tradition of disguising Christmas gifts. This took over 80 hours to build.,12-24-2018 17:00:59,116472,0.91
357,My gf left this warning for me on my pillow,12-27-2020 04:52:40,116403,0.8300000000000001
358,The trash can.,09-21-2019 15:02:05,116386,0.91
359,Breaking News,01-30-2017 21:58:44,116355,0.88
360,My girlfriend and I (finally) got a PlayStation 5 so naturally we did a fake maternity and newborn shoot with it.,03-11-2021 10:38:31,116353,0.75
361,Imposter Syndrome,02-26-2021 02:47:46,116299,0.91
362,"all that time it took to setup, almost gets ruined by the cat",01-21-2020 11:54:35,116282,0.92
363,"When my wife's school said they had BBQ for Teacher Appreciation week, she was excited to hear to there was a vegetarian option! It was a potato with BBQ sauce",05-06-2020 18:27:45,116121,0.91
364,Cows absolutely adore accordion music.,03-07-2018 18:17:26,116086,0.92
365,"Meanwhile, in Springfield, Ohio...",06-07-2019 15:02:28,116005,0.9500000000000001
366,Had a kid the other day. First thing I packed was correct 'dad-ttire' for the trip home.,06-16-2020 10:51:45,115994,0.84
367,Channel 4 news,09-08-2020 14:46:07,115995,0.91
368,This is how Japan attacked Pearl Harbor according to flat earthers.,10-15-2020 07:21:52,115930,0.84
369,Kindness,06-30-2020 09:44:13,115907,0.92
370,This is why woman live longer than men,09-17-2019 03:37:56,115805,0.91
371,My fiancé is working on becoming a cartoonist. Thoughts?,12-21-2020 08:25:34,115742,0.8200000000000001
372,I have my 4 year old baffled. This could go on for hours.,05-25-2020 21:30:33,115720,0.9400000000000001
373,Told my wife I was sending her an erotic video.,07-23-2019 23:52:51,115596,0.89
374,Who paid the bill !!??🤔,07-13-2017 12:31:48,115532,0.87
375,Not a cat.,02-10-2021 23:15:28,115502,0.87
376,This building is like someone was making it up on the fly,10-03-2017 10:27:54,115259,0.92
377,Muscle memory,04-17-2018 20:33:17,115250,0.9
378,Change My Mind,02-23-2018 11:17:59,115229,0.87
379,Who will finish first?,02-08-2019 07:30:05,115220,0.89
380,Today on United Airline,04-12-2017 20:51:04,115201,0.86
381,"Trying to impress my wife with new overpriced smart bulbs, forgot our security cam was recording.",12-09-2017 12:13:49,115153,0.8300000000000001
382,"An international student hospitalised in China and the nurse who couldn’t speak English, informed him about his surgery with this note.",01-28-2019 01:49:05,115074,0.9
383,Who got into the catnip? Was it you?,08-08-2020 16:53:42,115061,0.9500000000000001
384,"I'm deathly afraid of heights... I went to the Skydeck at the Willis Tower (Sears Tower) and slowly inched my back to the edge, mustered up all composure I could and took a pic. I thought I nailed it until I saw the photo...",07-11-2018 12:39:24,114985,0.87
385,self-worth,02-21-2021 21:29:30,114958,0.91
386,I wish I was as happy as this guy in traffic,01-17-2017 11:27:19,114719,0.9400000000000001
387,Catch me if you can.,09-16-2020 07:01:47,114690,0.91
388,Overcrowding in British prisons,01-05-2018 09:43:34,114632,0.85
389,Justin explains the name behind his Nut Butter,08-02-2018 13:03:01,114556,0.91
390,I build fake product ideas and today I made a cup holder that attaches to your shoes.,08-10-2020 13:30:59,114531,0.87
391,Dedicating a book...,01-15-2019 20:11:22,114449,0.96
392,10 years since Bill Gates told me that lunch was a once a day thing.,05-06-2020 06:30:27,114362,0.93
393,The tides have turned.,07-13-2018 22:07:46,114320,0.88
394,Currently Africa by Toto is winning for our graduation song and someone doesn't approve,05-08-2018 13:18:47,114322,0.91
395,First date locations pros and cons,10-19-2017 12:37:15,114315,0.9
396,Confiscated this note from one of my students.,04-16-2021 21:14:16,114297,0.9
397,"Priest in Italy live streams mass, activates filters by mistake",03-23-2020 18:33:39,114297,0.9500000000000001
398,My mom said this was one of my favorite things to do as a child.,11-12-2017 14:14:35,114132,0.91
399,These guys know how to have fun.,06-28-2019 21:35:46,113941,0.93
400,Fun for the whole family.,03-02-2018 04:14:42,113888,0.89
401,Well now I don't want to (oc),04-28-2021 09:00:42,113871,0.87
402,"“""Shirtception"" - my favorite gift every year from my brother. We're now at level 7.",12-28-2020 19:12:50,113827,0.85
403,Max must NOT be allowed in the library. Cross posted from r/cats,11-29-2017 11:24:47,113629,0.91
404,"My 11 year old has started drawing fat, middle aged Batman at the beach and it's everything you never knew you needed in life",09-25-2017 12:17:52,113627,0.8300000000000001
405,Some cop in my hometown winning Halloween.,10-31-2018 13:28:30,113605,0.91
406,Not all heroes wear capes,02-12-2018 23:08:07,113473,0.89
407,10 days it is,06-24-2020 15:11:47,113365,0.89
408,Dammit Luke,01-04-2018 14:09:49,113290,0.81
409,This Thinker,12-03-2017 11:28:31,113041,0.92
410,The State Department nailed my girlfriend's passport,08-03-2017 18:40:52,113045,0.91
411,"Godspeed, August",07-31-2020 15:36:49,113020,0.9400000000000001
412,It’s been a stealthy three months,09-22-2017 00:55:35,113011,0.91
413,All dads were the same,11-03-2020 07:10:54,112971,0.88
414,Our house has 10 rooms...,11-06-2020 19:22:34,112908,0.85
415,"We've all basically been on Zoom lately, and I've noticed there's all kinds of ""Zoom""ers out there. Which one are you?",04-23-2020 10:55:56,112865,0.87
416,The sign at the pizza place I go to,04-02-2020 16:58:03,112403,0.93
417,My Dad makes my step mom take pictures of him doing weird things when we have record breaking low temperatures,01-07-2018 13:17:34,112307,0.87
418,This baby looks like he’s ready to pour you a pint at his pub.,11-23-2018 13:48:33,112282,0.89
419,Girl Likes Me,06-21-2020 17:37:37,112257,0.9
420,New Google Assistant,04-05-2019 16:13:43,112250,0.9400000000000001
421,What has he seen,03-30-2021 18:15:01,112217,0.9400000000000001
422,Yummy,01-24-2019 17:17:41,112169,0.88
423,My sister thought my leg could use more holiday spirit,12-28-2020 14:47:59,112052,0.89
424,My wife said when I pass she would go the extra mile to give me the burial I deserve...,12-06-2017 22:34:22,111966,0.88
425,"Wife sent this after picking up our dog after surgery today. Says he's ""still under the influence.""",10-13-2017 17:45:22,111841,0.91
426,The boss is really riding me today,12-11-2020 11:49:11,111812,0.9
427,Cranky Uber drivers,01-01-2019 11:56:27,111726,0.86
428,Backpack seller answers a question,11-20-2017 12:15:52,111593,0.92
429,hold my beer while I'm teleconferencing,04-28-2020 10:39:19,111573,0.87
430,My wife and I forgot to close the garage last night. I think it became the meeting place for a secret cat gang.,08-07-2019 15:23:08,111466,0.9500000000000001
431,Fake United signs posted at the airport (@TGLNYC on IG),12-04-2019 16:17:43,111407,0.9400000000000001
432,"My dog was extremely tired, but just HAD to follow me into the bathroom in the middle of the night.",01-04-2018 19:42:40,111262,0.91
433,Goal: Become so rich that your hairline comes back,11-27-2017 15:47:34,111194,0.88
434,"Hang on kids, you need to hear about all the times your “uncles” slapped each other.",07-01-2020 16:39:33,111167,0.92
435,My father is the Black Bob Ross,12-10-2017 21:22:58,111102,0.86
436,This really cracked me up for some reason.,11-09-2018 16:56:09,111055,0.92
437,Haters will say it's fake,05-05-2017 09:47:22,111031,0.87
438,Every year my friends and I do a themed No Shave November picture.,12-01-2020 08:05:08,111021,0.8
439,I bought my grandad a HUGE tub of his favourite chocolates and he emailed me this photo to tell me that he had finally finished them.,03-20-2019 05:53:52,110917,0.9400000000000001
440,My GF's obsession with cheesy cursive signs inspired me to make my own uninspirational signs,01-15-2018 13:29:24,110833,0.79
441,Just finished decorating our annual scary pumpkin,10-17-2020 20:48:23,110809,0.91
442,A Keeper At Tallinn Zoo Forgot a Broom In The Chimpanzee Enclosure - This Followed...,12-04-2020 06:07:13,110789,0.92
443,Segway announces new stroller for adults. Where have I seen this before?,01-03-2020 09:37:52,110771,0.93
444,Updated my wall art to be more relevant,03-27-2021 13:13:36,110663,0.91
445,That title is not available in your region,03-02-2019 15:05:52,110592,0.9
446,Doesn't even flinch,02-07-2020 08:41:11,110577,0.9500000000000001
447,Remodeling the kitchen and pulled the microwave off the wall. He never gave up hope.,02-10-2017 17:13:57,110553,0.92
448,Incognito Mode,11-20-2019 12:02:03,110522,0.93
449,Yesterday was my birthday so i threw myself a party,04-16-2018 20:47:59,110508,0.86
450,That's how you scape from being robbed!,01-03-2019 09:04:09,110494,0.92
451,Let's take a moment and thank all those looking for a cure,03-23-2020 04:29:09,110367,0.89
452,The collar my mom has for her dog,11-23-2020 15:34:51,110297,0.87
453,My little sister and her friend with their homemade movie theaters,01-16-2021 20:34:31,110249,0.9
454,"I design unnecessary products, and today I made the Not Hot Blanket for that one hot leg while sleeping.",05-26-2020 14:19:56,110244,0.88
455,My Worst Nightmare,05-24-2018 16:23:13,110236,0.89
456,Asked my sister if my nephew was enjoying the wedding; this is the picture she sent back,09-29-2020 01:10:46,110168,0.9500000000000001
457,Special needs teachers put this up today.,03-26-2018 12:30:15,110169,0.91
458,When religious solicitors see my no solicitation sign. The sense of defeat is palpable.,03-12-2019 20:43:03,110127,0.91
459,I made this unauthorized Burger King commercial with a dark twist. Hope you like it!,10-21-2020 14:35:53,110058,0.68
460,"Gotta Wear that facemask ""Bank Teller asked me to take it off. She Just laughed. """,04-11-2020 03:42:48,110033,0.91
461,"UTAH has its issues, but it’s traffic signs are top notch",01-14-2020 13:48:19,109950,0.9400000000000001
462,he looks traumatized,10-17-2020 13:57:11,109935,0.87
463,Get it together ABBY,06-22-2020 17:22:11,109893,0.93
464,An elder passing on his wisdom,05-27-2019 11:47:32,109888,0.92
465,Found out my kid had this on his school classroom wall all year.,05-25-2020 10:51:41,109877,0.9400000000000001
466,"Moon footage, sped up.",10-23-2018 04:49:27,109845,0.9500000000000001
467,Happy Vital Organ Day,02-14-2019 15:52:26,109777,0.92
468,I believe I have created the perfect mask.,07-13-2020 17:42:13,109775,0.91
469,We have officially come full circle,12-01-2019 20:51:08,109587,0.9
470,I like to imagine this was Alex's first view in the afterlife.,11-08-2020 16:01:09,109409,0.9
471,2017 eclipse. So majestic.,08-21-2017 21:55:33,109350,0.8
472,My friends told me to buy red but I think white is better,01-15-2021 11:02:37,109321,0.77
473,"In October I wrapped my brothers birthday present in concrete. For Christmas, he got revenge",12-25-2020 08:08:55,109299,0.87
474,Baby's first taste of ice cream 🍦,01-20-2020 10:41:55,109267,0.9
475,"As I snapped the selfie, I told Samuel L. Jackson to pose how he really felt about doing these kinds of things.",04-28-2017 16:44:44,109244,0.89
476,"Just found out that my friend was on the front page yesterday, here's another angle of it",10-02-2018 18:31:25,109203,0.85
477,Are you tired of being human as well?,01-24-2021 16:37:41,109143,0.9
478,“Holy” Shit.,01-26-2019 10:22:38,109052,0.88
479,"Using a prank idea from Askreddit, I put vanilla pudding in a mayonnaise jar. My kids were horrified as I ate it while watching them open their Easter presents.",04-01-2018 21:12:50,109015,0.88
480,"Forgot to reposition the camera to take a jump pic, looks like we hung ourselves",05-14-2017 12:19:21,108984,0.88
481,Take the damn picture. I don't got all day.,11-16-2018 17:28:54,108952,0.91
482,sue me,06-18-2020 10:31:14,108944,0.86
483,My kid created what I thought was an angry-rage-boner-poop-fly guy...,06-01-2017 12:05:01,108893,0.9
484,Bookstore’s Closed Sign in Seattle,09-12-2020 17:37:59,108794,0.9400000000000001
485,I photoshopped a magpie and a killer whale together,12-10-2019 11:00:47,108742,0.93
486,Trains were down...,01-05-2019 17:40:42,108715,0.92
487,My 13 year old sister thinks she’s hilarious,10-05-2017 03:07:27,108651,0.91
488,Earth preloading next month's world disaster,04-29-2020 13:46:26,108590,0.9400000000000001
489,No good work goes unpunished,12-28-2020 08:54:51,108567,0.91
490,My 15yo daughter bought this frog thingy at a thrift store and then painted him majestically.,02-01-2020 23:09:20,108529,0.92
491,What a save!,01-15-2019 03:41:11,108489,0.9400000000000001
492,My boyfriend told me he didn’t care what shoes I wore shopping,09-24-2019 10:24:56,108452,0.91
493,How to mess with coworkers!,12-16-2018 00:56:19,108234,0.87
494,A two for one special,01-18-2017 11:12:45,108169,0.9400000000000001
495,"Airport workers need fun, too.",08-11-2018 10:51:25,108132,0.92
496,Covid has forced people into bartering.,11-17-2020 16:36:14,108128,0.93
497,The real issues:,09-12-2019 19:32:47,108102,0.92
498,Gotta get them all confused from an early age,01-29-2020 16:45:34,108089,0.92
499,Card not accepted,08-27-2018 14:05:12,108069,0.87
500,Terrifying.,10-26-2020 20:53:17,108012,0.93
501,Lil dude had to get shaved for surgery,09-15-2020 12:21:20,107997,0.92
502,This map is all over Twitter. Apparently some German guy got bored and tried to name all 50 states. This is the end result...,02-07-2020 13:28:24,107968,0.84
503,TSA,04-29-2018 19:31:06,107964,0.88
504,The Meatyor,05-20-2019 10:07:03,107959,0.92
505,What my husband sends me while I'm at work,12-18-2020 07:11:29,107784,0.92
506,Ever wonder who makes those big ass fans at IKEA?,08-10-2020 21:24:48,107611,0.91
507,"My cousin wanted cake and ordered one. Told the bakers to write whatever they wanted because it was for just for her anyways, so...",03-21-2020 19:59:59,107612,0.9400000000000001
508,Retail work in a global pandemic is on another level [oc],04-08-2021 04:46:01,107561,0.7000000000000001
509,A domestic breed,10-19-2019 06:36:24,107552,0.93
510,Hmmmmmmm...,09-11-2020 10:47:57,107490,0.86
511,The good ol’ days of looney tunes,04-18-2019 02:43:06,107426,0.9500000000000001
512,t h a n k y o u,02-19-2019 18:33:37,107421,0.93
513,A train ticket is cheaper than a dentist,02-26-2020 15:34:23,107326,0.92
514,House Painters,09-01-2020 09:00:47,107322,0.9400000000000001
515,"Here's how 12 year old Gusto copes with fireworks and thunderstorms. He shuts himself in the bathroom and turns on the overhead fan for white noise. Here it is, finally captured on video.",07-03-2020 10:36:56,107302,0.96
516,peppery,04-05-2021 10:48:03,107269,0.8300000000000001
517,"My mate wasn't going to his graduation due to his parent being away. So we took a budget graduation photo and stepped in as ""mum"" and ""dad""",07-25-2018 04:14:21,107245,0.87
518,"Flight ""666"" on Friday 13th is now going straight to 'HEL'",10-13-2017 08:43:51,107247,0.89
519,Couldn't stop laughing at the anime sc filter on my dog.,09-23-2020 03:20:58,107213,0.93
520,You had one job!,12-16-2018 15:10:47,107107,0.92
521,"Well, it certainly is chilly today !!",01-02-2021 15:26:56,107012,0.87
522,Had my leg amputated and my brother shows up to the hospital dressed as a pirate,08-01-2017 19:32:23,106999,0.88
523,Fitness goals,03-15-2021 07:47:00,106923,0.92
524,A Good Day to Dog Hard,04-26-2017 10:01:23,106819,0.88
525,My brother wanted to measure the trees in his yard. This is how did he did it.,04-20-2020 18:59:59,106815,0.9400000000000001
526,Making brews and making moves 6 feet apart,03-26-2020 16:24:56,106778,0.88
527,That about sums up the Half Time show,02-02-2020 20:24:14,106760,0.9
528,This is why I hate escalators,01-24-2019 13:37:34,106676,0.92
529,We asked the 3 of them to take a pic of their awesome costumes and this guy jumped in...,09-17-2018 17:11:39,106652,0.91
530,Cone of Shame,03-09-2020 18:49:47,106620,0.9400000000000001
531,Got suspended from school for 4 days after this picture was mailed to dozens of parents. It was worth it.,05-27-2020 16:10:29,106574,0.85
532,Go big or go home,02-06-2021 09:17:08,106519,0.93
533,Raise your daughter right,01-01-2020 14:03:55,106479,0.9
534,It’s called quarantine coffee. It’s just like normal coffee but it has a margarita in it and also no coffee.,04-01-2020 12:20:18,106474,0.86
535,Mystery Solved,08-26-2020 11:52:40,106455,0.91
536,"21 years ago, this man sacrificed his life to save the world. Happy Independence Day.",07-04-2017 08:53:24,106416,0.8300000000000001
537,The Elephant in the Room,02-23-2021 11:16:54,106382,0.92
538,My kid sleeps like he fell down in Family Guy.,07-31-2018 12:45:41,106377,0.9
539,Jennifer Aniston’s first Instagram post has the photo quality of 1999.,10-15-2019 11:00:49,106357,0.87
540,Strange Planet Series 2,03-12-2019 10:20:25,106087,0.87
541,Shut up and let me love you!,02-07-2020 14:38:19,105975,0.9400000000000001
542,The legendary snow gun,01-09-2019 11:51:59,105975,0.89
543,"This little jumping spider tried to attack my mouse pointer, so I upped the game.",02-22-2019 12:27:42,105931,0.88
544,This is how we announced our pregnancy to our friends and family.,06-13-2020 11:36:32,105818,0.77
545,"My sister: ""You can do the half-marathon with me! Trust me, it's not that bad."" ...",04-27-2021 11:21:47,105727,0.86
546,Free Anti-Virus Software,11-02-2019 14:34:01,105674,0.9500000000000001
547,Canadian drug dealers trying to get their first real job,10-18-2018 10:34:14,105618,0.9
548,One cardboard sign to rule them all.,04-05-2021 19:13:44,105619,0.9
549,neighbor,05-13-2019 14:21:37,105607,0.9400000000000001
550,The effect of Tinder on roommate relations...,11-05-2018 13:52:54,105598,0.86
551,How my son shovels,01-18-2018 16:38:35,105593,0.84
