,title,created_utc,score,upvote_ratio
851,The oldest trick in the book.,08-22-2017 19:27:00,95827,0.8200000000000001
852,RED FLAGS,07-20-2019 12:17:24,95799,0.89
853,"So, some guy decided to cosplay as Johnny Depp's character in a movie - ALL of them.",12-08-2019 08:25:05,95767,0.91
854,"I don't want to brag, but my son might be a math genius...",04-13-2021 13:24:39,95760,0.89
855,Quite possibly stole the show @ NYCC 2019 Today!,10-06-2019 21:55:01,95750,0.92
856,Sister-in-law orders a Japanese whiskey for me every Christmas. I don’t think she read the description this time when she shipped me a $50 bottle of soy sauce.,12-26-2019 13:10:52,95743,0.9500000000000001
857,Stages of a beard,11-11-2019 11:50:43,95632,0.87
858,Our cat is positioned just right on the oven light button,01-07-2020 21:28:04,95607,0.9400000000000001
859,I used to work at a restaurant that purchased Land O'Lakes Buttered Milk in bulk...,08-26-2018 18:32:41,95527,0.92
860,This meteor,05-05-2018 11:29:22,95462,0.93
861,angry,03-07-2021 22:25:27,95422,0.91
862,Recovery level: 360°,12-20-2017 08:46:56,95417,0.9
863,"A local farm where I live had trouble with their flock all wanting to sleep in the same house, each night they have to go break them up. The other night they found their dog had joined in",06-16-2019 11:21:42,95402,0.96
864,My son figured out this trick today!,05-13-2020 10:55:14,95359,0.9
865,It hits the right spot,03-18-2021 17:39:50,95319,0.9
866,Tried to take a selfie at JFK. Caught this gem before I could figure out how to reverse the cam.,09-30-2017 16:04:43,95319,0.84
867,True sacrifice.,03-31-2020 00:38:44,95294,0.92
868,The last thing a craft beer sees before it dies ...,10-03-2019 20:49:30,95299,0.85
869,Scarlet v. 40 inches of snow.,12-17-2020 10:40:29,95232,0.93
870,Free at last!,03-01-2017 14:38:51,95239,0.92
871,The car I drew in 1st grade finally made it across the assembly line,11-20-2018 20:42:44,95193,0.91
872,My local burger joint became Bob's Burgers for April Fools,04-01-2017 15:12:10,95160,0.88
873,Life finds a way,04-06-2018 10:50:46,95116,0.89
874,In The Air Tonight drum solo: Quarantine edition,04-01-2020 17:44:09,95087,0.93
875,My security camera caught this shady character,06-01-2018 16:38:33,94977,0.86
876,Straightest Guy In The World Right Here.,04-03-2021 03:20:50,94953,0.8300000000000001
877,I went to the Airport,10-27-2020 15:29:56,94853,0.8300000000000001
878,The force isn’t so strong with this one,05-04-2020 12:17:46,94851,0.89
879,Perfect,08-22-2020 11:18:08,94846,0.88
880,This mans reaction to his age is priceless,01-14-2020 16:49:27,94785,0.93
881,My wife is smokin' hot so I picked the shower curtain.,11-28-2017 20:39:18,94777,0.8
882,Ouch..just kidding,08-05-2020 08:01:59,94772,0.9400000000000001
883,This pilot was flying his retirement flight and wanted to look special- and he did!,12-10-2018 10:19:56,94739,0.9
884,My brother pulled out his iPhone at thanksgiving with our Amish family.,11-22-2018 13:42:11,94707,0.92
885,Growing old,10-23-2020 03:16:11,94658,0.92
886,"I use cannabis oil for medicinal purposes, I accidentally dropped some to the floor and my dog licked it",09-03-2020 10:15:47,94642,0.8300000000000001
887,"""Near Misses Throughout History""",09-13-2017 20:25:08,94626,0.86
888,This is one of my favorite scenes from How It's Made,03-10-2018 18:21:56,94616,0.84
889,Nice Job,11-15-2018 14:18:58,94582,0.9400000000000001
890,We all know how this ends.,01-19-2018 20:46:53,94584,0.84
891,The time Stephen met Jim Carrey RIP Stephen Hawking,03-14-2018 02:43:38,94557,0.88
892,SNL Weekend Update: They write jokes for each other to read but don't see them until live on air,12-13-2020 05:38:28,94541,0.89
893,"And that, kids, is how I met your mother",08-17-2019 13:10:09,94512,0.9400000000000001
894,Opened up my gaming headset to replace the cord and was greeted by this...,03-27-2018 00:17:17,94510,0.92
895,The most creative creative Green Lantern cosplay ever,10-02-2019 08:52:00,94504,0.93
896,Blue screen of death,10-26-2018 05:46:19,94485,0.92
897,This manager just doesn't care anymore,11-29-2019 10:15:37,94460,0.93
898,It's over.,06-20-2019 05:53:06,94439,0.9
899,Best question at Comic-Con 2017,07-24-2017 11:08:20,94402,0.87
900,I got a vasectomy today,10-19-2020 11:37:19,94346,0.84
901,Not all sports are cancelled,03-14-2020 18:44:47,94310,0.92
902,"I heard this kid yelling for his dad at Lowe’s, I went looking for him and.....",04-27-2018 22:13:43,94309,0.92
903,This is what boys do in their free time,06-02-2019 17:50:36,94279,0.93
904,Funny Shirt,10-01-2019 21:45:04,94212,0.87
905,Happy National Coffee Day,09-29-2019 13:44:27,94215,0.93
906,A really honest company...,10-11-2019 07:27:04,94201,0.9500000000000001
907,Canadian Russian roulette,01-05-2018 14:31:57,94188,0.89
908,"DC condos really pretend that this is ok (5'7"" man for scale)",07-19-2020 21:15:14,94160,0.9500000000000001
909,Can't get this shampoo outta my hair,09-24-2018 15:17:50,94158,0.87
910,"Due to the pandemic, I decided to send my mom a cutout so I could still be home for the holidays!",12-07-2020 20:13:18,94121,0.88
911,🔥 When it's 119° in Phoenix 🔥,06-20-2017 19:01:58,94116,0.91
912,It's been one year since I trolled Hugh Jackman! I didn't realise until today that the date I met Hugh was the same date I joined Reddit many years ago 😂 thank you Reddit for the monster you created.,08-16-2020 05:56:32,94080,0.8300000000000001
913,got my gram a new apron for her 90th birthday. this is the moment she realized what was on it,03-04-2018 11:08:56,94075,0.87
914,Difference between sexes.,11-30-2018 13:33:12,94010,0.76
915,Driving over a pothole after the city authorities have measured it and confirmed it's within the limits.,05-28-2019 08:06:19,94004,0.9500000000000001
916,Slutty Ghost,10-30-2019 05:41:39,93997,0.91
917,Remodeling a Bathroom,07-03-2018 23:15:39,93995,0.9
918,"""OMG its my orange ball !""",04-12-2019 14:44:36,93977,0.92
919,Working hard vs working smart,08-10-2020 17:39:39,93948,0.91
920,SpaceX zero G indicator is the most Scientific equipment i have ever seen.,05-30-2020 15:37:25,93910,0.93
921,"Parents, how's that home schoolin' going?",05-01-2020 18:45:26,93881,0.92
922,My niece drew this at school yesterday.,04-27-2021 14:27:34,93871,0.84
923,My friend sent me this while at the DMV. This guy got fed up with waiting so he ordered a pizza.,06-02-2017 14:13:54,93873,0.92
924,"For fun I design fake products, behold The Infinity Saucelet, wield all of your favorite fast food sauces at once. Cover everything in sauce...whatever it takes.",05-31-2019 14:43:10,93837,0.86
925,Brain Activity,12-01-2019 06:05:52,93810,0.9400000000000001
926,This corn maze sign,10-05-2019 16:36:12,93786,0.9500000000000001
927,Adorable Dad Reflexes,05-19-2017 06:45:49,93732,0.87
928,The news anchor’s neck/chest is peeing,01-05-2019 08:03:23,93731,0.8300000000000001
929,Prevention is better than Cure. Or is it?,10-09-2020 02:29:06,93686,0.93
930,It was only a matter of time,11-11-2017 01:29:29,93651,0.8300000000000001
931,Shit.,04-07-2020 03:06:15,93646,0.92
932,Crazy sore muscles but no bath tub? Improvise. Adapt. Overcome.,02-20-2020 16:36:50,93628,0.88
933,All or Nothing! A sign from a local business,06-28-2020 03:31:38,93625,0.89
934,The older I get the younger this guy looks.,02-28-2020 19:48:44,93610,0.92
935,He thought she wanted to shake :(,12-08-2017 15:33:25,93595,0.81
936,This restaurant is only allowed to sell beer if someone buys food.,07-20-2020 10:44:13,93591,0.91
937,Kansas City really lets tourists have a good time,05-07-2018 15:07:13,93575,0.91
938,"terrible two, don’t judge",11-12-2018 10:32:37,93551,0.93
939,made a movie trailer starring my dog,04-25-2020 20:17:22,93543,0.92
940,"My friend's office has been in a post-it war with the neighbors...and yesterday, the neighbors won.",05-25-2016 11:57:32,93540,0.91
941,The most pronounced woof I've ever heard,09-05-2020 14:57:06,93525,0.9500000000000001
942,how is your life going?,09-29-2020 10:24:06,93512,0.89
943,Croc at weekend barbecue [OC],05-24-2020 04:49:17,93505,0.9400000000000001
944,My friend had to check her cat's collar cam footage because of what he brought home...,03-19-2021 07:16:33,93510,0.8
945,California Explained [OC],12-21-2019 11:34:06,93505,0.86
946,Watched Peter Pan recently and saw someone that looked a little too familiar,04-12-2020 09:15:16,93471,0.9
947,"Finally, a mannequin that shows how the shirt will really fit.",06-05-2020 00:22:27,93435,0.9400000000000001
948,Suspicious toddler being suspicious.,10-05-2020 22:56:38,93417,0.9
949,French and Spanish class decorated their doors,12-07-2019 23:33:45,93392,0.88
950,"The more ads, the less motivated to see it",07-15-2019 12:05:42,93307,0.88
951,Well Played. (x-post from r/gifs),02-03-2017 07:16:12,93304,0.91
952,Hide and seek skill level: 1000,02-23-2017 18:50:41,93289,0.87
953,You can never out-prank a dad,07-30-2018 16:33:02,93288,0.8300000000000001
954,The war is over.,10-17-2018 02:27:06,93270,0.86
955,fat tony,12-23-2019 14:40:32,93263,0.93
956,Told my dad there was a leak under the sink,03-25-2021 10:17:11,93206,0.81
957,Left beer in cooler outside. Wife found it. Figured the reddit would like this.,01-18-2019 18:11:02,93203,0.84
958,a French ghost,02-17-2021 18:24:56,93197,0.86
959,Mark Ruffalo visits children's hospital in his Hulk costume.,07-14-2018 16:19:03,93174,0.88
960,Dog in lockdown still needs exercise,02-27-2020 05:43:06,93153,0.9500000000000001
961,A wild luggage in its natural habitat,04-14-2018 08:47:25,93151,0.93
962,This guy is living in 2050,04-01-2018 10:48:04,93142,0.8200000000000001
963,my kid during his birthday safari,09-14-2020 11:21:41,93138,0.93
964,Too honkin' cold...,12-19-2019 12:39:45,93137,0.9500000000000001
965,A clean sweep,02-11-2018 12:47:36,93081,0.84
966,this dog followed the google earth guy.,06-16-2017 19:17:58,93054,0.91
967,The turn has tabled,12-14-2019 12:15:17,93044,0.9
968,"My now wife, now mother of my children, when we first met she was over me playing MW3 so much so I bought her a T shirt for X-mas, Now every year for 10 years I have bought her my favorite game Tee every year much to her delight!",01-03-2021 21:09:11,93029,0.79
969,Book for Kids,11-13-2018 06:50:16,92976,0.9400000000000001
970,Why I Can't Be a Math Teacher,11-13-2016 11:40:42,92982,0.91
971,The benefits of growing older,11-12-2020 14:26:51,92978,0.91
972,"Saw this pilot at the airport, yesterday.",11-01-2017 08:17:52,92942,0.93
973,Getting fitted for a uniform,04-20-2018 12:34:14,92914,0.89
974,Daily life as a repair tech.,07-01-2019 05:10:56,92918,0.9500000000000001
975,"Thanks, Google Translate",05-27-2018 05:30:13,92908,0.88
976,Strict dad,04-10-2020 11:02:48,92898,0.8
977,Some pranks are universal,10-28-2017 21:21:37,92883,0.91
978,frog ride irl,09-16-2019 06:27:19,92870,0.92
979,One cup of sand from each of the beaches I’ve visited in the past three years,01-03-2019 15:45:00,92817,0.77
980,can you make it,05-09-2021 15:32:52,92789,0.88
981,These dudes at my wife’s work Halloween game is respectable.,10-25-2018 12:52:55,92773,0.86
982,The exceptionally useless box,05-30-2019 04:48:52,92751,0.9400000000000001
